,author,id,url,score,text,date
0,thedyl,eipihqr,/r/pennystocks/comments/b20hne/penny_stock_trading_diary_week_3/eipihqr/,1,"Just stumbled upon this, thanks for the info and updates!",2019-03-17
1,TheBreadMakerr,eipirx8,/r/pennystocks/comments/b20hne/penny_stock_trading_diary_week_3/eipirx8/,1,"No problem, I have been posting these updates weekly and will continue to do so.",2019-03-17
2,RamzFanz,eipm2q1,/r/pennystocks/comments/b20hne/penny_stock_trading_diary_week_3/eipm2q1/,1,"I never set my sell prices at a round number, always a tick or two below. Round numbers are natural resistant points.",2019-03-17
3,TheBreadMakerr,eipnp5w,/r/pennystocks/comments/b20hne/penny_stock_trading_diary_week_3/eipnp5w/,1,Yeah I had plenty of opportunity to exit NGD for profit in the last two weeks. And yeah I saw the moves BIOC made.,2019-03-17
4,Santoritime2003,eipx56d,/r/pennystocks/comments/b20hne/penny_stock_trading_diary_week_3/eipx56d/,1,Sitting on a stash of 500 ngd because I thought of a cup and handle . Strange they only let you limit order or sell. Unfortunately though my buy in was at .89 . Wish I would've bought bioc because I have had the opportunity to buy either ngd or bioc . Had a bit of schadenfreude when bioc crashed the other day. Could of made 60% on that in just a week. ,2019-03-17
5,cyberarc83,eiq2url,/r/pennystocks/comments/b20hne/penny_stock_trading_diary_week_3/eiq2url/,1,Thanks for sharing. Can you let us know what you’re entering in prior to getting it in here so we can do the same ? ,2019-03-17
6,leadrain86,eiqa3px,/r/pennystocks/comments/b20hne/penny_stock_trading_diary_week_3/eiqa3px/,1,"Not bad, what are you looking for in your set ups? And do you only trade stuff under $1?",2019-03-17
7,TheBreadMakerr,eiqb35b,/r/pennystocks/comments/b20hne/penny_stock_trading_diary_week_3/eiqb35b/,1,"Yikes .89 is pretty high buy on NGD but it had a nice run up late in the day on Friday, momentum may continue into Monday. Always take profits especially on penny stocks, when these stocks have a pop they ALWAYS come back down quickly. You gotta capture the profit the stock gives you and move on to the next trade.",2019-03-17
8,TheBreadMakerr,eiqb4yj,/r/pennystocks/comments/b20hne/penny_stock_trading_diary_week_3/eiqb4yj/,1,"For sure, I actually posted my watchlist on here last Sunday. I will do the same at some point today.",2019-03-17
9,TheBreadMakerr,eiqbcsd,/r/pennystocks/comments/b20hne/penny_stock_trading_diary_week_3/eiqbcsd/,1,I am big on trading support/resistance levels. I really like these types of trades in penny land because if the stock breaks below the support level I have on the chart that is my clear stop loss point and most of my trades I buy right near that support level so my loss is minimal if it breaks down.,2019-03-17
10,Stuxnet15,eiqfu6q,/r/pennystocks/comments/b25qhg/where_to_get_started/eiqfu6q/,1,"First, learn to trade, and I’m not talking about clicking buy and sell. You need a methodology to why you’re entering and exiting a stock. For me, this meant finding a mentoring program. I joined www.bullsonwallstreet.com. Kunal, the owner and teacher is a world class day trader. There’s other programs out there, and you certainly should do your own research. I tried it on my own and kept losing. After the training BOW gave me, I’m much more confident in my trading. I’m not trying to advertise for them, and encourage you to check out your options to see what will work for you. But I also encourage you to look up bulls on wall street on YouTube, and see what they have to offer. They have a lot of free videos that will teach you the basics. Good luck. ",2019-03-17
11,norpiano,eiqg37h,/r/pennystocks/comments/b25qhg/where_to_get_started/eiqg37h/,1,"First, memorize the suicide prevention hotline. Second, call it.",2019-03-17
12,5MonkeyPunches,eiqgqf3,/r/pennystocks/comments/b25qhg/where_to_get_started/eiqgqf3/,1,For most of the tickers discussed here you're best to open an etrade account. If you want to use robin hood check out r/RobinHoodPennyStocks,2019-03-17
13,calvin50,eiqo0b4,/r/pennystocks/comments/b25qhg/where_to_get_started/eiqo0b4/,1,I second learning to trade. And agree Kunel is good. Also there are a lot of videos on trading.,2019-03-17
14,starcraftlolz,eiqqw2i,/r/pennystocks/comments/b20hne/penny_stock_trading_diary_week_3/eiqqw2i/,1,Nice man. Most people in this subreddit hold out for mega gains which can be amazing but your method is great for consistent low risk profit. What do you do or use to find stocks you're interested in?,2019-03-17
15,jysun,eiqrabq,/r/pennystocks/comments/b271ht/is_it_even_possible_to_short_penny_stocks/eiqrabq/,1,I think Timothy Sykes does this as well. Check him out,2019-03-17
16,Hanky___Panky,eiqrdvq,/r/pennystocks/comments/b271ht/is_it_even_possible_to_short_penny_stocks/eiqrdvq/,1,"Well he is shorting the kind of stocks that are pretty much designed to fail.

Step 1: Find a shitty company (not hard at all).

Step 2: Short sell when people panic sell. 

Step 3: Find out it was a pump and dump. 

Step 4: Brag about your loss to r/wallstreetbets",2019-03-17
17,stewtou,eiqrxbo,/r/pennystocks/comments/b271ht/is_it_even_possible_to_short_penny_stocks/eiqrxbo/,1,This 24 y/o is one of Tim’s “students”,2019-03-17
18,DelonWright,eiqvkx9,/r/pennystocks/comments/b27zot/march_17_2019_tomorrows_daily_rpennystocks/eiqvkx9/,1,"Still looking for a new pick this week. Already made my LPTX money, TRVN post news doesn’t seem like best time to get in, already own enough TEUM.. ugh",2019-03-17
19,spacecadet501st,eiqwbrc,/r/pennystocks/comments/b271ht/is_it_even_possible_to_short_penny_stocks/eiqwbrc/,1,Many brokers don’t allow penny stocks to be shorted ,2019-03-17
20,blackrue,eiqxmht,/r/pennystocks/comments/b20hne/penny_stock_trading_diary_week_3/eiqxmht/,1,thx for posting this!! I am a newbie too so getting a log of someone else who's  investing and getting their reflections is very helpful!,2019-03-17
21,TheBreadMakerr,eiqxpji,/r/pennystocks/comments/b20hne/penny_stock_trading_diary_week_3/eiqxpji/,1,"Yeah I just take a consistent 5% and let that build up the account.. it actually adds up pretty quickly.

I use a screener for the stocks I find. The one I use is marketinout.com",2019-03-17
22,TheBreadMakerr,eiqxqfm,/r/pennystocks/comments/b20hne/penny_stock_trading_diary_week_3/eiqxqfm/,1,"No problem, anytime!",2019-03-17
23,drekkas6,eiqxxul,/r/pennystocks/comments/b27zot/march_17_2019_tomorrows_daily_rpennystocks/eiqxxul/,1,Should I hold my LPTX throughout Monday ,2019-03-17
24,1776Aesthetic,eiqxzx3,/r/pennystocks/comments/b27zot/march_17_2019_tomorrows_daily_rpennystocks/eiqxzx3/,1,"Thoughts on AVGR, AMRH, and VYST?",2019-03-17
25,SprayAllDay,eiqz9b8,/r/pennystocks/comments/b271ht/is_it_even_possible_to_short_penny_stocks/eiqz9b8/,1,IIRC interactive brokers has the best short locates. Otherwise E*TRADE is decent for one of the ‘big’ brokers ,2019-03-17
26,karben14,eiqzpqp,/r/pennystocks/comments/b271ht/is_it_even_possible_to_short_penny_stocks/eiqzpqp/,1,"I don't get your list. If he shorted the stock and then it crashed, why do you say he lost in step 4?",2019-03-17
27,rough93,eir2o1j,/r/pennystocks/comments/b284d7/penny_stock_discord/eir2o1j/,1,"We have one pinned at the top of the sub, why not make that one more active rather than adding to the lot?",2019-03-17
28,ceyeyayo,eir4s9h,/r/pennystocks/comments/b271ht/is_it_even_possible_to_short_penny_stocks/eir4s9h/,1,Seems like Sykes and his students are all one massive axe. They all trade together and end up pumping and dumping the stock at the same time so they are able to make a killing.,2019-03-17
29,HGTV-Addict,eir5dfk,/r/pennystocks/comments/b271ht/is_it_even_possible_to_short_penny_stocks/eir5dfk/,1,Failure to exit before the pump phase. ,2019-03-17
30,calvin50,eir5foo,/r/pennystocks/comments/b271ht/is_it_even_possible_to_short_penny_stocks/eir5foo/,1,Shorting penny stocks is done all the time. But don’t think you can’t lose ( and lose a lot) . I’m looking for the stock that has mass shorts and low floats . It’s the perfect shot squeeze.,2019-03-17
31,joco645,eir5l5m,/r/pennystocks/comments/b271ht/is_it_even_possible_to_short_penny_stocks/eir5l5m/,1,Post it here if you can find one! If you’re on TD Ameritrade that’s even better. I can’t seem to find any penny stocks that can be short sold on TD.,2019-03-17
32,DaMambaVino,eir60ig,/r/pennystocks/comments/b271ht/is_it_even_possible_to_short_penny_stocks/eir60ig/,1,I think you can. A lot of companies have a “hard to borrow” list that has penny stocks on it that you can short if your account has enough in it. I would think shorting penny stocks would be highly dangerous though since they can jump 500% based on nothing. I’m still kicking myself not shorting WTW. 🤢,2019-03-17
33,DaMambaVino,eir61ys,/r/pennystocks/comments/b271ht/is_it_even_possible_to_short_penny_stocks/eir61ys/,1,TD has a hard to borrow list but many can’t be through them. That’s who I use.,2019-03-17
34,1827338989,eir63a8,/r/pennystocks/comments/b271ht/is_it_even_possible_to_short_penny_stocks/eir63a8/,1,Interactive brokers &amp;or centerpoint ,2019-03-17
35,calvin50,eir6ce8,/r/pennystocks/comments/b271ht/is_it_even_possible_to_short_penny_stocks/eir6ce8/,1,"I don’t short stocks but Airplane Jane on Twitter puts her long and short trades up every day . Patrick Wieland is on utube and walks you through his shorting 
When I put a ticker up I’ll say it’s a possible short squeeze or what I think is the best play on it . 
If you catch a short squeeze there is a killing to be made.",2019-03-17
36,coralto,eir6ok0,/r/pennystocks/comments/b271ht/is_it_even_possible_to_short_penny_stocks/eir6ok0/,1,Just looked up how to short a stock. Why in the world would anyone let you “borrow” their stocks? What’s in it for them? ,2019-03-17
37,houseflip,eir79ox,/r/pennystocks/comments/b271ht/is_it_even_possible_to_short_penny_stocks/eir79ox/,1,"theyre all scams. tim ""students"" turned marketers. none of them will make you a penny. you can short penny stocks .25-$1 but the fees often make it not worth your time. they all affiliate route you to the same broker - PM me if you want it . . ",2019-03-17
38,houseflip,eir7esv,/r/pennystocks/comments/b271ht/is_it_even_possible_to_short_penny_stocks/eir7esv/,1,large holders with millions of shares/percent have to hold anyway . they can allocate 5-10% to be borrowed if they really want. probably an income stream,2019-03-17
39,CrossDamon,eir7tdb,/r/pennystocks/comments/b284d7/penny_stock_discord/eir7tdb/,1,Says room is currently locked ,2019-03-17
40,starcraftlolz,eir8f8k,/r/pennystocks/comments/b20hne/penny_stock_trading_diary_week_3/eir8f8k/,1,What filters,2019-03-17
41,Meltedbeam,eirapxc,/r/pennystocks/comments/b27zot/march_17_2019_tomorrows_daily_rpennystocks/eirapxc/,1,The Million Dollar question right here.,2019-03-17
42,psxpetey,eirbfw2,/r/pennystocks/comments/b271ht/is_it_even_possible_to_short_penny_stocks/eirbfw2/,1,You need to book the shares ahead of time. Check your broker some stocks can’t be shorted or are hard to short because there are little or no shares to borrow. That guy Steven dux apparently made about 5 million from shorting he goes long as well but he mostly shorts because penny stocks are mostly garbage,2019-03-17
43,5MonkeyPunches,eirboe2,/r/pennystocks/comments/b284d7/penny_stock_discord/eirboe2/,1,Why do people want to start a discord for everything? ,2019-03-17
44,TotesMessenger,eirceiz,/r/pennystocks/comments/b2ab49/my_penny_stock_watchlist_for_the_week_of_3182019/eirceiz/,1,"I'm a bot, *bleep*, *bloop*. Someone has linked to this thread from another place on reddit:

- [/r/robinhood] [My Penny Stock Watch-List for the Week of 3.18.2019 ---&gt; $VRRB $EDGE $YRIV $BOPO $ZMRK $KRFG $SHLDQ $SES $AVGR](https://www.reddit.com/r/RobinHood/comments/b2abco/my_penny_stock_watchlist_for_the_week_of_3182019/)

&amp;nbsp;*^(If you follow any of the above links, please respect the rules of reddit and don't vote in the other threads.) ^\([Info](/r/TotesMessenger) ^/ ^[Contact](/message/compose?to=/r/TotesMessenger))*",2019-03-17
45,imtheninja,eircino,/r/pennystocks/comments/b27zot/march_17_2019_tomorrows_daily_rpennystocks/eircino/,1,"12% after hours is just insane.

&amp;#x200B;",2019-03-17
46,Transparent_Traders,eircvd3,/r/pennystocks/comments/b2ab49/my_penny_stock_watchlist_for_the_week_of_3182019/eircvd3/,1,"Yes, I have posted in 2 rooms ",2019-03-17
47,1Dru,eireuvi,/r/pennystocks/comments/b2ab49/my_penny_stock_watchlist_for_the_week_of_3182019/eireuvi/,1,"Great list man. I’m even more convinced of my picks now, because I actually have $YRIV, AVGR, &amp; ZMRK (My most hopeful pick). In my personal opinion and after some DD, I believe that ZMRK is going to make me a very happy man come Monday. I will be watching this one the hardest. I bought 50k shares like two months ago for .004 but I sold them for .0125 about 1 week ago. It had been climbing steadily the entire time. Well, I knew I had to get more, so I bought another 50k shares for .008 this time. I’m going to attempt to buy more first thing tomorrow morning and wait for the huge jump. This stock will be like $SHMP imho. Don’t take my word for it, please do your own DD...... but I’m very excited for this stock. ",2019-03-17
48,Transparent_Traders,eirfjvk,/r/pennystocks/comments/b2ab49/my_penny_stock_watchlist_for_the_week_of_3182019/eirfjvk/,1,I pretty much did the same thing on $ZMRK.  Now i am holding 100k shares at .0082,2019-03-17
49,Pieerre,eirgbrh,/r/pennystocks/comments/b271ht/is_it_even_possible_to_short_penny_stocks/eirgbrh/,1,Get the list of the biggest shareholders. Call them one by one. Get them to loan you their shares for interest. Sell them and you are good.,2019-03-17
50,WaxuTutu,eirgkkd,/r/pennystocks/comments/b271ht/is_it_even_possible_to_short_penny_stocks/eirgkkd/,1,This guy is completely legit. I learnt most of my trading strategies from him and am now trading for a living.,2019-03-17
51,DrLeee,eirh2k6,/r/pennystocks/comments/b271ht/is_it_even_possible_to_short_penny_stocks/eirh2k6/,1,24 or 12,2019-03-17
52,SweatyInvestor,eiri3p6,/r/pennystocks/comments/b2ab49/my_penny_stock_watchlist_for_the_week_of_3182019/eiri3p6/,1,$KRFG to infinity and beyond,2019-03-17
53,Transparent_Traders,eiri5ki,/r/pennystocks/comments/b2ab49/my_penny_stock_watchlist_for_the_week_of_3182019/eiri5ki/,1,You got that right.  Nice to see that website up and running now.,2019-03-17
54,Transparent_Traders,eiri7nf,/r/pennystocks/comments/b2ab49/my_penny_stock_watchlist_for_the_week_of_3182019/eiri7nf/,1,"You got that right, nice to see that website up running now.",2019-03-17
55,calvin50,eiriokk,/r/pennystocks/comments/b284d7/penny_stock_discord/eiriokk/,1,"I have the same prob all chat rooms locked 
But I do get info from the post",2019-03-17
56,Santoritime2003,eirkib5,/r/pennystocks/comments/b20hne/penny_stock_trading_diary_week_3/eirkib5/,1,Now I know it. But I thought penny stocks could have sustained gains as well.,2019-03-17
57,Transparent_Traders,eirmapq,/r/pennystocks/comments/b27zot/march_17_2019_tomorrows_daily_rpennystocks/eirmapq/,1,"I believe AVGR has more in the tank, but could see a day or two of consolidation.",2019-03-17
58,CollectingGold,eirnpo1,/r/pennystocks/comments/b271ht/is_it_even_possible_to_short_penny_stocks/eirnpo1/,1,Dude did u even watch or listen??? He never said he shorts penny stocks. He shorts “micro stocks” 1-10 dollar stocks. Smh ,2019-03-17
59,TheBreadMakerr,eirolfj,/r/pennystocks/comments/b20hne/penny_stock_trading_diary_week_3/eirolfj/,1,I have like 15 different scanners on marketinout but one of the cool things with marketinout is it scans for support/resistance. That is one of the scan options. I use that one combined with scanning for a stocks under $10 price. Usually produces solid results.,2019-03-17
60,TheBreadMakerr,eiroqob,/r/pennystocks/comments/b20hne/penny_stock_trading_diary_week_3/eiroqob/,1,"I’m not on here super often, I will be home in a bit and be able to get on the computer and pull up charts. Hit me up on Twitter, I can answer your questions and chart the stocks you are holding over there. https://mobile.twitter.com/TheBreadMakher",2019-03-17
61,thatwomengoesround,eiros70,/r/pennystocks/comments/b271ht/is_it_even_possible_to_short_penny_stocks/eiros70/,1,There’s no easy risk free way to make lots of money. If there was we would all be rich ,2019-03-17
62,betterbydesign,eirpgjz,/r/pennystocks/comments/b271ht/is_it_even_possible_to_short_penny_stocks/eirpgjz/,1,"Absolutely. He is 100% telling the truth. I am in his chat room and he gives screen shots of his brokers website and his trades. He posts his trades in real times sometimes. He made 90k last week on one trade. He has something you probably don't though. Tons of time, tons of capital, tons of experience, and a fantastic risk management strategy. Don't be persuaded by people saying he's a fraud. Tim Grittani is also amazing and there video of his real time trades.",2019-03-17
63,Transparent_Traders,eirqt1m,/r/pennystocks/comments/b2ab49/my_penny_stock_watchlist_for_the_week_of_3182019/eirqt1m/,1,Adding LPTX to the list.,2019-03-17
64,aurelianchaos11,eirrcw1,/r/pennystocks/comments/b271ht/is_it_even_possible_to_short_penny_stocks/eirrcw1/,1,"Same here. A lot of the stuff I've learned and still use when trading stocks I learned from Timothy Sykes and Steven Dux, Roland Wolf, Tim Grittani, Mark(?) Goode, etc. 

They're all verified millionaires (except maybe Roland but I think he's close last time I checked) with at least 1 million in trading profits. Tim Grittani has 6 million in profits. Not fake, not a scam. Verified trades. Sorry to burst your bubbles.",2019-03-17
65,betterbydesign,eirrkub,/r/pennystocks/comments/b271ht/is_it_even_possible_to_short_penny_stocks/eirrkub/,1,Oh and try TradeZero for penny stock. You have to reserve the shares but they have almost anything.,2019-03-17
66,AgregiouslyTall,eirs4j0,/r/pennystocks/comments/b271ht/is_it_even_possible_to_short_penny_stocks/eirs4j0/,1,If you’re trying to trade TD has been losing ground on that front honestly. IB will basically let you do whatever you want. Not sure how TW is when it comes to shorting.,2019-03-17
67,AgregiouslyTall,eirsbc6,/r/pennystocks/comments/b271ht/is_it_even_possible_to_short_penny_stocks/eirsbc6/,1,"You want to sell my MSFT share? Okay, I’m going to charge you interest on its value in the meantime. That’s what is in it for them.",2019-03-17
68,AgregiouslyTall,eirsine,/r/pennystocks/comments/b271ht/is_it_even_possible_to_short_penny_stocks/eirsine/,1,"Tim Sykes makes all his money marketing and selling his course. He’s been talking about how he made $4,000,000 trading stocks for like a fucking decade. You’d think that number would go up each year, but nope. Granted Tim is honest about it and says he only wants to ‘teach’ (read: charge people money for his tips).",2019-03-17
69,WaxuTutu,eirsiz0,/r/pennystocks/comments/b271ht/is_it_even_possible_to_short_penny_stocks/eirsiz0/,1,"Yea they really are real people just don't research enough, sure enough my comment has negative upvotes. Kind of expected it to be honest.",2019-03-17
70,AgregiouslyTall,eirsk2z,/r/pennystocks/comments/b271ht/is_it_even_possible_to_short_penny_stocks/eirsk2z/,1,Penny stocks are often considered below $5,2019-03-17
71,aurelianchaos11,eirtufu,/r/pennystocks/comments/b271ht/is_it_even_possible_to_short_penny_stocks/eirtufu/,1,"Lol yeah it's okay though, they can stay poor.",2019-03-17
72,BullishBearsTrading,eirtxer,/r/pennystocks/comments/b271ht/is_it_even_possible_to_short_penny_stocks/eirtxer/,1,CMEG is pretty good. Good short availability and access to DAS Trader,2019-03-17
73,WaxuTutu,eiru3cw,/r/pennystocks/comments/b271ht/is_it_even_possible_to_short_penny_stocks/eiru3cw/,1,Haha yea,2019-03-17
74,1Dru,eirvqt2,/r/pennystocks/comments/b2ab49/my_penny_stock_watchlist_for_the_week_of_3182019/eirvqt2/,1,That’s my other really nice one. Bought that last Monday and can’t wait to see it climb more. Hopefully drop a little so I can buy more. ,2019-03-17
75,CollectingGold,eiry21e,/r/pennystocks/comments/b271ht/is_it_even_possible_to_short_penny_stocks/eiry21e/,1,"U still ignore the fact that he said majority of his shorts are in the $10 bracket. Often considered for u, penny to me is under $1.",2019-03-17
76,AgregiouslyTall,eiryygd,/r/pennystocks/comments/b271ht/is_it_even_possible_to_short_penny_stocks/eiryygd/,1,The SECs definition of a penny stock is any stock under $5.,2019-03-17
77,filthycasual4,eis1whp,/r/pennystocks/comments/b20hne/penny_stock_trading_diary_week_3/eis1whp/,1,Following,2019-03-17
78,betterbydesign,eis24p4,/r/pennystocks/comments/b271ht/is_it_even_possible_to_short_penny_stocks/eis24p4/,1,I don't think so. He primarily does dip buys and is in and out in minutes. Not great to follow,2019-03-17
79,1Dru,eis4axj,/r/pennystocks/comments/b2ab49/my_penny_stock_watchlist_for_the_week_of_3182019/eis4axj/,1,HA!! THhats crazy. I almost went with 100k the first t8me but wanted to see how it would do. But I just put in another order for 50k to have an even 100k,2019-03-17
80,ceyeyayo,eis4bi8,/r/pennystocks/comments/b271ht/is_it_even_possible_to_short_penny_stocks/eis4bi8/,1,He has alerts that he sends out to all his students.,2019-03-17
81,CollectingGold,eis4fsb,/r/pennystocks/comments/b271ht/is_it_even_possible_to_short_penny_stocks/eis4fsb/,1,Yet u sill ignore he fact that he shorts stocks up to $10.,2019-03-17
82,betterbydesign,eis4vce,/r/pennystocks/comments/b271ht/is_it_even_possible_to_short_penny_stocks/eis4vce/,1,I know. I get them. But they do not lead to pumps from what I've seen. He's in and out the stock so quick they aren't really useful.,2019-03-17
83,AgregiouslyTall,eis5rs3,/r/pennystocks/comments/b271ht/is_it_even_possible_to_short_penny_stocks/eis5rs3/,1,I never ignored that. I merely stated penny stocks are any US stock priced under $5/share as far as the SEC is concerned.,2019-03-17
84,CollectingGold,eis6f7g,/r/pennystocks/comments/b271ht/is_it_even_possible_to_short_penny_stocks/eis6f7g/,1,Actually the dude doesn’t even say he shorts penny stocks. So it’s irrelevant what a penny stock is.,2019-03-17
85,tommycat11,eis98v3,/r/pennystocks/comments/b271ht/is_it_even_possible_to_short_penny_stocks/eis98v3/,1,He’s totally legit. I personally just think he’s a dick so I’ve moved onto other channels which have helped tremendously. ,2019-03-17
86,somegarbagedoesfloat,eisdbrp,/r/pennystocks/comments/b271ht/is_it_even_possible_to_short_penny_stocks/eisdbrp/,1,If you plan on executing step 4 you better have gone full autist and YOLO'd more than a minimum wage worker makes in a year,2019-03-17
87,kennnygo4,eislxlu,/r/pennystocks/comments/b271ht/is_it_even_possible_to_short_penny_stocks/eislxlu/,1,Check out techbudsolutions,2019-03-17
88,Introsium,eisnjpj,/r/pennystocks/comments/b271ht/is_it_even_possible_to_short_penny_stocks/eisnjpj/,1,You can still buy puts on some.,2019-03-17
89,rumplezoso,eisoy8b,/r/pennystocks/comments/b284d7/penny_stock_discord/eisoy8b/,1,"What you mean inactive... these dudes nvr stop talking, they're like professionals with the amounts of money they drop lol I'm like gotdamn",2019-03-17
90,xcobraxcomandrx,eisxlls,/r/pennystocks/comments/b27zot/march_17_2019_tomorrows_daily_rpennystocks/eisxlls/,1,"Accumulating more $ABCE around .015 with QB uplist, retired debt , and financials coming this is a great long hold IMO",2019-03-17
91,psxpetey,eisyql1,/r/pennystocks/comments/b271ht/is_it_even_possible_to_short_penny_stocks/eisyql1/,1,"well why would he trade big positions when he makes like 4,500,000 a year or more from his school plus there's like no stress. ",2019-03-17
92,AgregiouslyTall,eiszvi4,/r/pennystocks/comments/b271ht/is_it_even_possible_to_short_penny_stocks/eiszvi4/,1,"Where are you getting the info that he makes $4,500,000 a year from teaching? And I specifically said Tim is honest about the fact he doesn’t trade anymore.

But there’s a saying, ‘those who can’t do, teach.’ Tim made the bulk of his money around the dot com bubble when markets were extremely volatile. Tim’s skills didn’t hold up though. He started a couple hedge funds, all of which ultimately lost money. After his insane winning streak it was clear his strategy didn’t hold up. So he started teaching. If you haven’t you should watch Wall Street Warriors, it features Tim Sykes and he was not a very successful trader.

I say this to say, if you get 10,000 people and tell them each to play 7 turns of roulette and double down with each win you are guaranteed to have someone double their money 7 times. Tim was that person.

Now the reason he has to teach is because his strategy almost strictly revolves around targeting low volume stocks which is advantageous for smaller accounts and disadvantageous for larger accounts - hence you see Steve venturing into more and more expensive equities.",2019-03-17
93,buenotc,eitkupm,/r/pennystocks/comments/b25qhg/where_to_get_started/eitkupm/,1,It's probably safer to peruse r/wallstreetbets to satisfy your autism. But if you want to follow us down the rabbit hole be my guest https://www.thinkorswim.com/t/index.html#!/innovation and sign up. Go forth and do great things. ,2019-03-17
94,HodlMyMoon,eitmjyy,/r/pennystocks/comments/b271ht/is_it_even_possible_to_short_penny_stocks/eitmjyy/,1,Fuck Timothy Sykes his courses are highway robbery..,2019-03-17
95,HodlMyMoon,eitmlqq,/r/pennystocks/comments/b271ht/is_it_even_possible_to_short_penny_stocks/eitmlqq/,1,"Finally someone who understands, fuck Timothy Sykes. ",2019-03-17
