,author,id,url,score,text,date
0,tomjones12737,eht5hvi,/r/pennystocks/comments/axekmo/leas/eht5hvi/,1,Yeah it’s doing well right now. ,2019-03-05
1,POOP_BLASTER,eht5l7q,/r/pennystocks/comments/axekmo/leas/eht5l7q/,1,SCAM,2019-03-05
2,caffeinefreedom,eht5lhf,/r/pennystocks/comments/axekmo/leas/eht5lhf/,1,Tried to get in today and missed it. Still worth getting on?,2019-03-05
3,tomjones12737,eht638z,/r/pennystocks/comments/axekmo/leas/eht638z/,1,There’s like two other posts about $leas.  And who cares if it’s a scam or not. I made bank and riding freebies ,2019-03-05
4,bralyo,eht6afu,/r/pennystocks/comments/axekmo/leas/eht6afu/,1,who cares? people are making quite a bit off of it,2019-03-05
5,jovenhope,eht6nqh,/r/pennystocks/comments/axekmo/leas/eht6nqh/,1,This guy..,2019-03-05
6,jovenhope,eht6rs2,/r/pennystocks/comments/axekmo/leas/eht6rs2/,1,Come on in the water is fine...,2019-03-05
7,POOP_BLASTER,eht7fvt,/r/pennystocks/comments/axekmo/leas/eht7fvt/,1,Some people won't. Pump and dumper scam,2019-03-05
8,dawsonj20,eht85ms,/r/pennystocks/comments/axesa2/investing_in_canadian_markets/eht85ms/,1,"THC is a weed stock that is near a recent low.

GDNP makes biodegradable plastics. 

Both are in businesses with huge future upsides.",2019-03-05
9,tomjones12737,eht8guq,/r/pennystocks/comments/axekmo/leas/eht8guq/,1,Ya all the new people asking if they should buy after it’s ran up 400-500% lol,2019-03-05
10,POOP_BLASTER,eht8kpo,/r/pennystocks/comments/axekmo/leas/eht8kpo/,1,The usual suspects,2019-03-05
11,Karpit,eht97pg,/r/pennystocks/comments/axekmo/leas/eht97pg/,1,"Yeah I think so I saw a valuation somewhere that put it at $0.10, don’t know if it’ll get there though",2019-03-05
12,calvin50,ehtafzz,/r/pennystocks/comments/axfh5c/brkk/ehtafzz/,1,"Looks like it’s going to continue down to around.004
Needs to have volume around 60 million ",2019-03-05
13,canieatthis1,ehtaikv,/r/pennystocks/comments/axfh5c/brkk/ehtaikv/,1,You believe that it will drop pats the support of the SMA200 at .0053? ,2019-03-05
14,JamesBourne008,ehtajhc,/r/pennystocks/comments/axesa2/investing_in_canadian_markets/ehtajhc/,1,"Wait until we throw Trudeau out
",2019-03-05
15,PlutoPatata,ehtauow,/r/pennystocks/comments/axekmo/leas/ehtauow/,1,Definitely! Its still under a penny. Book valued at .9-.10,2019-03-05
16,calvin50,ehtbebi,/r/pennystocks/comments/axfh5c/brkk/ehtbebi/,1,Yes but it might bounce off it first . I see your.0054 support but the strong support is at .0045-004 where people think it’s a bargain. This isn’t going to happen overnight and could change. I did see a pattern in the spikes . It looks like end of March .watch for a volume spike,2019-03-05
17,canieatthis1,ehtcvvv,/r/pennystocks/comments/axfh5c/brkk/ehtcvvv/,1,"Oh yes I apologize, I’m not sure what I was looking at when posted but the 50 is 54. Thank you ",2019-03-05
18,raw_testosterone,ehtdn5j,/r/pennystocks/comments/axfthj/anyone_following_bmix/ehtdn5j/,1,Yes,2019-03-05
19,homerhere,ehtdzyr,/r/pennystocks/comments/axekmo/leas/ehtdzyr/,1,Yup,2019-03-05
20,gnardaddy,ehth9qt,/r/pennystocks/comments/axfthj/anyone_following_bmix/ehth9qt/,1,Worthless scam stock,2019-03-05
21,P0wer0verwhelming,ehthb7m,/r/pennystocks/comments/axfthj/anyone_following_bmix/ehthb7m/,1,that news dropped on feb 5th and the stock dropped since then,2019-03-05
22,therealml,ehthktl,/r/pennystocks/comments/axekmo/leas/ehthktl/,1,Take your poop blasting somewhere else bud. I made 150% profit today. ,2019-03-05
23,QxWho,ehthzz3,/r/pennystocks/comments/axesa2/investing_in_canadian_markets/ehthzz3/,1,Lol,2019-03-05
24,MentalTadpole,ehti1c4,/r/pennystocks/comments/axgoec/upcoming_plays/ehti1c4/,1,"$SSFT is the only stock I'm looking at right now. AI company making major moves.

$CRSM announced via Twitter today they are getting into CBD. It could make a nice move. It's still around .01",2019-03-05
25,filthycasual4,ehtiswt,/r/pennystocks/comments/axgoec/upcoming_plays/ehtiswt/,1,You think ssft is still a good buy,2019-03-05
26,MentalTadpole,ehtjq89,/r/pennystocks/comments/axgoec/upcoming_plays/ehtjq89/,1,"I do, yes. But it depends what you are looking for.

I'm in for the long haul. SSFT is a REAL company, with a long history of services major names in the tech industry. 

30+ employees, 2 offices, and a huge revenue increase is expected on their upcoming financial statements (up to $13M expected compared to &gt;$1M for 2017) this is due to the acquisition on Cornerstone Technologies last year.

Further to that, they recently signed an LOI to acquire another company. An AI company which apparently has some hot technology and existing customers and revenue.

They are fully audited as well and fully up to date with reporting obligations on OTC.

But look into it yourself, their newsreel from the past 14 months is likely the hottest in the OTC. But until last week not many people were aware of them. I think it is worth the time to do the DD even if you ultimately decide it's not for you.

Good luck!!",2019-03-05
27,CollinPS,ehtsq2y,/r/pennystocks/comments/axekmo/leas/ehtsq2y/,1,Might be a stupid question but why am I not able to find it on Robinhood? ,2019-03-05
28,Karpit,ehtt8je,/r/pennystocks/comments/axekmo/leas/ehtt8je/,1,"I’m not really sure, I’m using TD and it’s on there.",2019-03-05
29,Boopsnsnoots,ehttprr,/r/pennystocks/comments/axekmo/leas/ehttprr/,1,Robinghood and webull don’t trade otc,2019-03-05
30,dbsimeonov,ehtv434,/r/pennystocks/comments/axivx8/new_trader/ehtv434/,1,"Hi,  
I'm a beginner as well and saw a post recently about [Zacks.com](https://Zacks.com) which you can have for a month free(after that just register with new account). I'm not sure how good it is, but has a solid information.  
Also as a newbie I am checking often Bloomberg and Cnet for news.",2019-03-05
31,Kevenm7,ehtxhm3,/r/pennystocks/comments/axjjjg/thoughts_on_sgyp/ehtxhm3/,1,Same.,2019-03-05
32,Gecko8908,ehu05rs,/r/pennystocks/comments/axivx8/new_trader/ehu05rs/,1,"MyFXbook has a great calendar and stats for your trading account, plus it’s free. I use MetaTrader 4 as my platform",2019-03-05
33,halohayden582,ehu14hm,/r/pennystocks/comments/axk5uw/first_trade_in_years_this_past_week_yriv/ehu14hm/,1,First ones free,2019-03-05
34,KetoPhilCollins,ehu160i,/r/pennystocks/comments/axk5uw/first_trade_in_years_this_past_week_yriv/ehu160i/,1,"Lol...well, my next trade isn't going too well and i will post that later.  $ACET !!!

Rock on today!!!!!",2019-03-05
35,cyberarc83,ehu1cna,/r/pennystocks/comments/axk5uw/first_trade_in_years_this_past_week_yriv/ehu1cna/,1,Nice post. What are you’re thoughts on Leas ? Do you think 20-30% gains is good before you set an exit/stop ? I’m starting out too but want tread with caution. Leas has been  hyped over here for the last few weeks.,2019-03-05
36,KetoPhilCollins,ehu1htu,/r/pennystocks/comments/axk5uw/first_trade_in_years_this_past_week_yriv/ehu1htu/,1,"So...in MY opinion 20%-30% gain in excellent!! The reason i didn't exit YRIV after an intial decent gain was my limited amount of shares. Selling at .59 wouldn't cover my buy and sell fees! Lol

I have read the Twitter hype on $LEAS , but haven't personally looked at it for any info!!

Good luck to you and don't get discouraged! I wish i had 4 years of knowledge under my belt instead of walking away!!!",2019-03-05
37,idontdoalot,ehu27on,/r/pennystocks/comments/axjjjg/thoughts_on_sgyp/ehu27on/,1,If you read the news about them this just seems like too much of a risk,2019-03-05
38,calvin50,ehu3ycu,/r/pennystocks/comments/axkilu/jmu_gained_170_yesterday_will_it_run_for_another/ehu3ycu/,1,JMU is a China stock and is running on trade deal news. Check out CIFS also ,2019-03-05
39,vytasmike,ehu4jjt,/r/pennystocks/comments/axkilu/jmu_gained_170_yesterday_will_it_run_for_another/ehu4jjt/,1,YES! Sometimes when trading these small caps I forget about macro picture:) These current USA-China deal news can have big impact on China stocks for sure and it can be the case for $JMU!,2019-03-05
40,calvin50,ehu4r4v,/r/pennystocks/comments/axkilu/jmu_gained_170_yesterday_will_it_run_for_another/ehu4r4v/,1,"I’m probably going to buy in one of these 
Go into CIFS with caution it could have a small rise in the morning then fall the rest of the day ",2019-03-05
41,calvin50,ehu4ve5,/r/pennystocks/comments/axkilu/jmu_gained_170_yesterday_will_it_run_for_another/ehu4ve5/,1,I’m watching for them . Ticks me off I sold out of NIO to soon ,2019-03-05
42,dbsimeonov,ehu5pbz,/r/pennystocks/comments/axjjjg/thoughts_on_sgyp/ehu5pbz/,1,Risky... Still I keep an eye on them but right now would not advise you to buy.,2019-03-05
43,Direwolf0110,ehu6yn0,/r/pennystocks/comments/axjjjg/thoughts_on_sgyp/ehu6yn0/,1,"It’s literally bankrupt and they just sold their assets at auction.

Do basic DD before you go bankrupt too.",2019-03-05
44,calvin50,ehu7hwo,/r/pennystocks/comments/axk230/trading_from_taiwan/ehu7hwo/,1,"The free platforms are limited on penny stocks. E*TRADE , Amera trade, Trade Ideas are the ones I know. Robin Hood and Webull  are the two i here about most trading in the penny stocks. 
I would strongly suggest you paper trade(the Amera trade platform allows this) before using real money. Penny stocks move up and DOWN fast .",2019-03-05
45,thatyawningfeeling,ehu7w0b,/r/pennystocks/comments/axjjjg/thoughts_on_sgyp/ehu7w0b/,1,I’ve followed SGYP pretty closet for a while; I can’t really recommend them unless you’re a straight-up gambler.,2019-03-05
46,Camel-Kid,ehuapiw,/r/pennystocks/comments/axkilu/jmu_gained_170_yesterday_will_it_run_for_another/ehuapiw/,1,40k shares only??? Da fuq. You cant make money off that ,2019-03-05
47,deedaveid,ehubgzx,/r/pennystocks/comments/axekmo/leas/ehubgzx/,1,This. Are they even trading today? Just checked on Google an Yahoo and it seems to be stuck on both.,2019-03-05
48,marcushelbling,ehuf6r8,/r/pennystocks/comments/axm972/win/ehuf6r8/,1,"Cool, just bought 2 shares for 70 cents.",2019-03-05
49,canieatthis1,ehuf93o,/r/pennystocks/comments/axm972/win/ehuf93o/,1,Save some for the rest of us Jordan Belfort ,2019-03-05
50,5MonkeyPunches,ehufbft,/r/pennystocks/comments/axm972/win/ehufbft/,1,I'm in till the end of the week. ,2019-03-05
51,tomjones12737,ehufvjz,/r/pennystocks/comments/axekmo/leas/ehufvjz/,1,Don’t make anything til you sell.  Did u sell?,2019-03-05
52,therealml,ehufwfa,/r/pennystocks/comments/axekmo/leas/ehufwfa/,1,Yes sold it all yesterday,2019-03-05
53,therealml,ehufxu0,/r/pennystocks/comments/axekmo/leas/ehufxu0/,1,Yes sold it all yesterday ,2019-03-05
54,wenniehutjunior,ehug03a,/r/pennystocks/comments/axm972/win/ehug03a/,1,In at .36 fir 115,2019-03-05
55,Se3k3r,ehugd8f,/r/pennystocks/comments/axivx8/new_trader/ehugd8f/,1,Thanks so much! I’ll check it out today,2019-03-05
56,Se3k3r,ehugedh,/r/pennystocks/comments/axivx8/new_trader/ehugedh/,1,"Can’t beat free! Thank you, I’ll check it out tonight ",2019-03-05
57,bangbangooooo,ehugrsq,/r/pennystocks/comments/axmgsg/leas/ehugrsq/,1,"How low is this gunna go, I think I’m gunna wait to see how far it’ll drop, it’ll be nice to buy back in around 0.003 ",2019-03-05
58,Nottheface1337,ehugy9n,/r/pennystocks/comments/axmgsg/leas/ehugy9n/,1,Would be incredibly surprised if it got anywhere near that. ,2019-03-05
59,canieatthis1,ehugz3u,/r/pennystocks/comments/axm972/win/ehugz3u/,1,"Good buy, what’s your target price to sell? ",2019-03-05
60,bangbangooooo,ehuh729,/r/pennystocks/comments/axmgsg/leas/ehuh729/,1,"You’re probably right, it would be nice though but i see it going down to at least 0.005 so I would wait ",2019-03-05
61,NagelDonk,ehuhhle,/r/pennystocks/comments/axmgsg/leas/ehuhhle/,1,Not sure about this one any longer.,2019-03-05
62,dogbreath67,ehuhjm8,/r/pennystocks/comments/axmgsg/leas/ehuhjm8/,1,looks like it will need more fake tweets from the company or actual filings to get it above a penny. ,2019-03-05
63,tomjones12737,ehuhlyi,/r/pennystocks/comments/axmgsg/leas/ehuhlyi/,1,I’d like to see some official documents but yeah it’s questionable. I’m not buying just gonna let my free shares ride. All 45000 and they were bought low 2’s,2019-03-05
64,raw_testosterone,ehuhnt3,/r/pennystocks/comments/axivx8/new_trader/ehuhnt3/,1,Trade stock options if you want to retire early 😎,2019-03-05
65,Scoobydiesel87,ehuhylf,/r/pennystocks/comments/axm972/win/ehuhylf/,1,Picked up 100 here’s hoping for a nice turn around.,2019-03-05
66,Extra-Extra,ehui65z,/r/pennystocks/comments/axm972/win/ehui65z/,1,$8,2019-03-05
67,[deleted],ehui8fa,/r/pennystocks/comments/axm972/win/ehui8fa/,1,[removed],2019-03-05
68,amphetaminesfailure,ehuiq8u,/r/pennystocks/comments/axmgsg/leas/ehuiq8u/,1,"There were mm's holding substantial shorts looking to manipulate this morning, people who panicked over the manipulation, and a lot of other people looking to take their profits and run.

Shouldn't have been unexpected.  

Got out in the first hour and back in with an extra 500k shares.  

",2019-03-05
69,NagelDonk,ehuiy12,/r/pennystocks/comments/axmgsg/leas/ehuiy12/,1,TRDX is looking good.,2019-03-05
70,ForeverInjured,ehuji75,/r/pennystocks/comments/axm972/win/ehuji75/,1,Do you have a link for be article? Don’t see it on globenewswire myself ,2019-03-05
71,NG06,ehujltv,/r/pennystocks/comments/axm972/win/ehujltv/,1,I read that it was going to get delisted this week. Anyone else know anything about this?,2019-03-05
72,NagelDonk,ehujoh3,/r/pennystocks/comments/axmgsg/leas/ehujoh3/,1,"Agreed, not sure about the tweets.",2019-03-05
73,Se3k3r,ehuju0r,/r/pennystocks/comments/axivx8/new_trader/ehuju0r/,1,What’s a good path/resource to get started on that?,2019-03-05
74,canieatthis1,ehujubp,/r/pennystocks/comments/axm972/win/ehujubp/,1,Yes it is to be delisted tmrw from nasdaq onto otcqb. However this is a strong play in my opinion after the panic settles. ,2019-03-05
75,Gallarock,ehuk35k,/r/pennystocks/comments/axm972/win/ehuk35k/,1,Im pretty new to investing and have been using robin hood. When this gets delisted what exactly happens? ,2019-03-05
76,yakuzademon893,ehuk4v7,/r/pennystocks/comments/axmq0g/ryu/ehuk4v7/,1,By far the best character in street fighter..... ,2019-03-05
77,randomcluster,ehuks90,/r/pennystocks/comments/axm972/win/ehuks90/,1,"""Andddddd its gone""",2019-03-05
78,raw_testosterone,ehukz27,/r/pennystocks/comments/axivx8/new_trader/ehukz27/,1,Everyone always says YouTube so that I guess. I just listen to whatever wsb says or this sub because I’m lazy,2019-03-05
79,5MonkeyPunches,ehulbkw,/r/pennystocks/comments/axm972/win/ehulbkw/,1,this cracked me up,2019-03-05
80,TradinToRetire,ehulkhh,/r/pennystocks/comments/axmgsg/leas/ehulkhh/,1,Could be climbing now,2019-03-05
81,SenTedStevens,ehun0es,/r/pennystocks/comments/axmgsg/leas/ehun0es/,1,"Sold a chunk yesterday to pay for my shares and a little profit. My remaining holdings are free. It can go up, it can go down, doesn't matter.",2019-03-05
82,Youngfajita,ehun875,/r/pennystocks/comments/axlqas/cifs_atis_ncty_petz/ehun875/,1,I got a few shares of CIFS thinking about selling tomorrow if it keeps going up today.,2019-03-05
83,ItsBstone,ehunpfe,/r/pennystocks/comments/axm972/win/ehunpfe/,1,"I believe the company you invested in buys your shares back from you, if they go private. If they’re removed for some other reason idk. ",2019-03-05
84,INoPayneNoGain,ehuogk1,/r/pennystocks/comments/axm972/win/ehuogk1/,1,^^ same. Can someone answer this??,2019-03-05
85,SenTedStevens,ehuolvf,/r/pennystocks/comments/axmgsg/leas/ehuolvf/,1,"There's a bunch of little punters playing right now. I see lots of 10k, 30k, 50k bids.",2019-03-05
86,canieatthis1,ehupco0,/r/pennystocks/comments/axm972/win/ehupco0/,1,"Otcmarkets.com to check news, filings, etc. ",2019-03-05
87,canieatthis1,ehupkm8,/r/pennystocks/comments/axm972/win/ehupkm8/,1,"Correct. They are delisting from Nasdaq and ticker name change will become WINQ where their shares will then be listed on OTCQB. They will still be SEC reporting and continuing business, just under a new market with less expectations. ",2019-03-05
88,bangbangooooo,ehuq82x,/r/pennystocks/comments/axn35a/trq/ehuq82x/,1,Just curious what did you see that made you buy? ,2019-03-05
89,canieatthis1,ehuqhza,/r/pennystocks/comments/axm972/win/ehuqhza/,1,Also Robinhood doesn’t trade over-the-counter stocks so in that case I do not have an answer. Maybe some MU calls would help. ,2019-03-05
90,arp2195,ehuqtv0,/r/pennystocks/comments/axm972/win/ehuqtv0/,1,"I bought in at $10 multiple years ago, want some for free?",2019-03-05
91,SimChanga,ehuqvmb,/r/pennystocks/comments/axmgsg/leas/ehuqvmb/,1,That’s right. Ride and slide. ,2019-03-05
92,caffeinefreedom,ehurzok,/r/pennystocks/comments/axmgsg/leas/ehurzok/,1,about the STUPIDEST move I made all day.  Bought at the beginning and am down 25%.,2019-03-05
93,caffeinefreedom,ehusgk1,/r/pennystocks/comments/axekmo/leas/ehusgk1/,1,instant regret this morning.  probably another pump and dump.,2019-03-05
94,EngineerInDespair,ehushyf,/r/pennystocks/comments/axm972/win/ehushyf/,1,Bought 3 for $1.2 dollars ,2019-03-05
95,Gynotaw,ehusw0a,/r/pennystocks/comments/axlqas/cifs_atis_ncty_petz/ehusw0a/,1,killed pets,2019-03-05
96,marcushelbling,ehusypx,/r/pennystocks/comments/axm972/win/ehusypx/,1,"I have no idea how to do that. I use robinhood, kind of new to this whole thing.",2019-03-05
97,Kasmarcs,ehut6fy,/r/pennystocks/comments/axekmo/leas/ehut6fy/,1,Does this mean it's not too late for LEAS????,2019-03-05
98,pm_me_tumblr_nudes,ehut6se,/r/pennystocks/comments/axm972/win/ehut6se/,1,https://support.robinhood.com/hc/en-us/articles/360001227786-What-happens-if-I-own-a-stock-that-s-delisted-,2019-03-05
99,vikingsarega-y,ehuva1m,/r/pennystocks/comments/axn35a/trq/ehuva1m/,1,Oyu tolgi. Second largest copper mine in the world. Mongolian govt owns a third of it the rest is owned by rio tinto and turquoise hill. ,2019-03-05
100,bangbangooooo,ehuw59c,/r/pennystocks/comments/axn35a/trq/ehuw59c/,1,"Okay I was looking at it and I think there is money to be made over the next could weeks, looks like it will trend up some. But I was reading that their sustainable first production got delayed from q1 2021 to q3 2021, with no guarantee of not being delayed even further. But that doesn’t really mean to much for you right now cuz the stock already took a hit from that. It should recover some and hopefully you’ll make a little. I would buy more though. ",2019-03-05
101,crustycrew,ehuzthf,/r/pennystocks/comments/axow8a/srmx_winning/ehuzthf/,1,Think we will see a dump tomorrow or by EOD? Or do you think this will keep riding ,2019-03-05
102,SimChanga,ehuzzmi,/r/pennystocks/comments/axow8a/srmx_winning/ehuzzmi/,1,Tripled in one day huh ,2019-03-05
103,Kokid3g1,ehv1en5,/r/pennystocks/comments/axow8a/srmx_winning/ehv1en5/,1,"I've read that they have another deal also in the works with Duke Energy. And also a 8K drop tomorrow morning.... *supposedly*.

Does that mean we won't get some softening tomorrow?

Hard to say for sure.

 I honestly bought this on a whim due to the 2019 CES coverage..., I never thought they would actually get any contracts with a big name company.

But my sceptical side tells me something will happen and the contract will fall through... Penny stocks have me jaded as f*ck, so I might not be the best person to ask. 😏",2019-03-05
104,pm_me_tumblr_nudes,ehv2u9x,/r/pennystocks/comments/axm972/win/ehv2u9x/,1,So far I’m down 7% on it. Got in at $.3556,2019-03-05
105,redbeerded,ehv47oe,/r/pennystocks/comments/axp7lz/ubqu_reports_a_net_profit_in_2018/ehv47oe/,1,I’ll throw some money in this! Thanks ,2019-03-05
106,dogbreath67,ehv5bct,/r/pennystocks/comments/axp0vc/krfg_thoughts/ehv5bct/,1,"I bought some, lost money, sold it. Y’all can keep it lol",2019-03-05
107,[deleted],ehv650v,/r/pennystocks/comments/axm972/win/ehv650v/,1,[removed],2019-03-05
108,dawsonj20,ehv6em6,/r/pennystocks/comments/axp7lz/ubqu_reports_a_net_profit_in_2018/ehv6em6/,1,"New? It's been on the market since 2013.

It looks dead to me.",2019-03-05
109,TwoPornsPlease,ehv6jkl,/r/pennystocks/comments/axp7lz/ubqu_reports_a_net_profit_in_2018/ehv6jkl/,1,"The parent company has been, the CBD oil division is new. ",2019-03-05
110,dawsonj20,ehv6r5o,/r/pennystocks/comments/axp7lz/ubqu_reports_a_net_profit_in_2018/ehv6r5o/,1,A penny stock that changes focus like that is a huge red flag for pump and dumps.,2019-03-05
111,calvin50,ehv7k7s,/r/pennystocks/comments/axploe/guides_for_using_thinkorswim_to_buy_pennystocks/ehv7k7s/,1,There are UTUBE videos on TOS set ups for penny stocks. I have seen some people with a TD and RH account. You’re only problem is sometimes they might not be available on RH ,2019-03-05
112,vikingsarega-y,ehv81ub,/r/pennystocks/comments/axn35a/trq/ehv81ub/,1,It did take a hit after the news was announced that production in I think shaft 2 is going to be delayed. Also new tech showed them parts of the mine are not as stable as they originally thought.,2019-03-05
113,jovenhope,ehv8r10,/r/pennystocks/comments/axp0vc/krfg_thoughts/ehv8r10/,1,Bought low and am holding just to see. Not too much invested though so if I lose I lose. ,2019-03-05
114,bralyo,ehv8t5z,/r/pennystocks/comments/axob49/sdvi_signature_devices_inc_announces_launch_of/ehv8t5z/,1,hope this moves the needle... been holding this for a bit,2019-03-05
115,financenoob4,ehva1qw,/r/pennystocks/comments/axp0vc/krfg_thoughts/ehva1qw/,1,Sold my position for a huge loss. Live and learn I guess. I'm out EOD,2019-03-05
116,canieatthis1,ehvb0u5,/r/pennystocks/comments/axm972/win/ehvb0u5/,1,"I did play this position very quickly today but I suggest after the delisting and panicking tapers, that this will be a big play. 

Windstream did not arrive in Chapter 11 due to operational failures and currently does not anticipate the need to restructure material operations,” Thomas said. “While it is unfortunate that Aurelius engaged in these tactics to advance its returns at the expense of Windstream, we look forward to working through the financial restructuring process to secure a sustainable capital structure so we can maintain our strong operational performance and continue serving our customers for many years to come.”",2019-03-05
117,Elcapitan777,ehvb2n9,/r/pennystocks/comments/axp0vc/krfg_thoughts/ehvb2n9/,1,I’ll at least try to break even with a longer hold 😕,2019-03-05
118,Kryptografik,ehvb83a,/r/pennystocks/comments/axm972/win/ehvb83a/,1,about tree fiddy,2019-03-05
119,canieatthis1,ehvb9p3,/r/pennystocks/comments/axm972/win/ehvb9p3/,1,Lmao I was waiting for it. ,2019-03-05
120,Xerethor,ehvbe5z,/r/pennystocks/comments/axq2dz/onehour_delivery_service_holds_potential_to/ehvbe5z/,1,"For those wondering, it’s ParcelPal.",2019-03-05
121,Kryptografik,ehvbtoh,/r/pennystocks/comments/axm972/win/ehvbtoh/,1,was only a matter of time,2019-03-05
122,AdvancedTrader,ehvc3o4,/r/pennystocks/comments/axq2dz/onehour_delivery_service_holds_potential_to/ehvc3o4/,1,"+1 good info, thank you ",2019-03-05
123,xechodrewx,ehvdj1v,/r/pennystocks/comments/axp1n4/2_simple_day_trading_strategies/ehvdj1v/,1,"So after watching this I realized I don’t really know the basic terminology for trading, any ideas for Where I can learn the differences between selling short and buying long, limits, and such. I’m very new to trading ",2019-03-05
124,Tricombed,ehve588,/r/pennystocks/comments/axp0vc/krfg_thoughts/ehve588/,1,"The info that has come out hasn’t changed and nothing negative has been reported. 

It is most likely people taking their profits. Any good news will send it sailing back up. ",2019-03-05
125,iggrigs,ehveqib,/r/pennystocks/comments/axm972/win/ehveqib/,1,I'm gonna buy a 1000 shares 🤷🏼‍♂️,2019-03-05
126,HesperianDragon,ehvf4wc,/r/pennystocks/comments/axploe/guides_for_using_thinkorswim_to_buy_pennystocks/ehvf4wc/,1,"&gt; You’re only problem is sometimes they might not be available on RH 

Second that. It can be really frustrating having to use TOS because RH does not have the penny stock you want.",2019-03-05
127,calvin50,ehvfvz7,/r/pennystocks/comments/axploe/guides_for_using_thinkorswim_to_buy_pennystocks/ehvfvz7/,1,"I don’t use a free sight for two reasons. 
One they might not have the stock 
Two there slow to fill my order so I might not get the price point I want 
Solution: only look for stocks on the Dow NASDAQ
Don’t day trade first hour 
The way I look at it’s just a cost of trading ",2019-03-05
128,UltraconservativeLeu,ehvg62m,/r/pennystocks/comments/axq2dz/onehour_delivery_service_holds_potential_to/ehvg62m/,1,"I have been invested in this company for a while, and I am very excited about its future.  ",2019-03-05
129,skipsthecat,ehvhfvu,/r/pennystocks/comments/axq2dz/onehour_delivery_service_holds_potential_to/ehvhfvu/,1,Me too!,2019-03-05
130,Pollymath,ehvirhh,/r/pennystocks/comments/axploe/guides_for_using_thinkorswim_to_buy_pennystocks/ehvirhh/,1,"Sorry, to clarify your solutions for those who want to use Robinhood are:

1) Only search stocks on NASDAQ

2) Don't day trade first hour

Within those limitations, using Robinhood is ok?",2019-03-05
131,ranghmltn,ehvj3e2,/r/pennystocks/comments/axm82l/arsn_on_the_move/ehvj3e2/,1,Yes I do. Picked it up a little higher than that and missed my low buy in. Still think this could be a solid stop!,2019-03-05
132,calvin50,ehvkwxt,/r/pennystocks/comments/axp0vc/krfg_thoughts/ehvkwxt/,1,"Holding got in at .0034 today’s low 
It went down to .0032 fo a sec so I’m hoping that stays support. If it goes below it in the morning it may not recover for a few days. So I’m hoping for a rise up to .0045 at least . Otherwise it may go into a downward trend until they release news.",2019-03-05
133,calvin50,ehvlh3d,/r/pennystocks/comments/axrdmt/gdet_whos_in_for_the_001_rally/ehvlh3d/,1,I’ve heard a lot of noise on this one so I’m setting an alert. What was the volume when you bought in,2019-03-05
