,author,id,url,score,text,date
0,tyler_Suite,e5er3r3,/r/pennystocks/comments/9d1gnc/xnnhq_xenonics_holdings_bankrupt_and_out_of/e5er3r3/,1,"this seems real odd, curious to see the responses you get

&amp;#x200B;",2018-09-05
1,nervouswiggles,e5erlbr,/r/pennystocks/comments/9d1gnc/xnnhq_xenonics_holdings_bankrupt_and_out_of/e5erlbr/,1,I'm clueless also. Just lookedthis stock up. It's bringing revenue but the balance sheets is hideous to look at,2018-09-05
2,gorbonz4988,e5es699,/r/pennystocks/comments/9d1gnc/xnnhq_xenonics_holdings_bankrupt_and_out_of/e5es699/,1,That's weird ,2018-09-05
3,TTVRaptor,e5esijx,/r/pennystocks/comments/9d1gnc/xnnhq_xenonics_holdings_bankrupt_and_out_of/e5esijx/,1,"Ghost stocks get picked up by pump and dumpsters all the time, see Blockbusters moves (BLIAQ)",2018-09-05
4,houseflip,e5euce6,/r/pennystocks/comments/9d1gnc/xnnhq_xenonics_holdings_bankrupt_and_out_of/e5euce6/,1,"the % move is nice but only about $1,000 worth is traded daily ($1,400 today) [**http://prntscr.com/kqpbk5**](http://prntscr.com/kqpbk5)",2018-09-05
5,Ornstein_0,e5fah0z,/r/pennystocks/comments/9d1gnc/xnnhq_xenonics_holdings_bankrupt_and_out_of/e5fah0z/,1,Shes got a itty bitty teenie weenie yellow pumpa stock bikini ,2018-09-05
6,araldor1,e5fd5hx,/r/pennystocks/comments/9d1gnc/xnnhq_xenonics_holdings_bankrupt_and_out_of/e5fd5hx/,1,"Yeah, if no one is trading it for a significant amount of time and suddenly a few people buy they can set the new price. ",2018-09-05
7,idonthavehobbies,e5fgswq,/r/pennystocks/comments/9d5q39/atev_gains_strategic_licensing_partnership_with/e5fgswq/,1,"The deal includes $13M paid over milestone achievements and double digit royalties on sales of ATB-346.

This is just the beginning for this drug.  The science checks out, and this partnership demonstrates it.",2018-09-05
8,younotsmart1243,e5fhz7a,/r/pennystocks/comments/9d5q39/atev_gains_strategic_licensing_partnership_with/e5fhz7a/,1,The deal is a scam,2018-09-05
9,idonthavehobbies,e5fi6qq,/r/pennystocks/comments/9d5q39/atev_gains_strategic_licensing_partnership_with/e5fi6qq/,1,Why is that?,2018-09-05
10,pwd9398,e5ficov,/r/pennystocks/comments/9d5q39/atev_gains_strategic_licensing_partnership_with/e5ficov/,1,Cause he got impatient and sold over the summer XD,2018-09-05
11,pwd9398,e5fidsp,/r/pennystocks/comments/9d5q39/atev_gains_strategic_licensing_partnership_with/e5fidsp/,1,"Great news. Cash when they could really use it, and validation of their recent results. Can't wait for Q2 2019!",2018-09-05
12,Joeyschmo102,e5fj19a,/r/pennystocks/comments/9d65fe/any_thoughts_on_huge/e5fj19a/,1,It's pretty huge,2018-09-05
13,juanvelezt,e5fj3ny,/r/pennystocks/comments/9d65fe/any_thoughts_on_huge/e5fj3ny/,1,In know what you did there buddy ;),2018-09-05
14,nonameattachedforme,e5fj4n8,/r/pennystocks/comments/9d65fe/any_thoughts_on_huge/e5fj4n8/,1,"They are going to produce 400m grams of weed so that’s pretty substantial. That said, I don’t like that they don’t have a clear strategy beyond being a producer because that’s not where the money is. ",2018-09-05
15,juanvelezt,e5fjg4k,/r/pennystocks/comments/9d65fe/any_thoughts_on_huge/e5fjg4k/,1,Actually they seem to be very aware of the advantages from hydroponic techniques vs soil growing...that’s one of my arguments why it should be a good catch... where is the money then according to you?,2018-09-05
16,Moed69,e5fjuue,/r/pennystocks/comments/9d65fe/any_thoughts_on_huge/e5fjuue/,1,"No debt, financing available for expansion. 
Going to have patented product in the future. And more and more. Easy read and what the last video that was out. You will be impressed. ",2018-09-05
17,silverwhere81,e5fn4yi,/r/pennystocks/comments/9d5q39/atev_gains_strategic_licensing_partnership_with/e5fn4yi/,1,"I remember when I was excited to own 4,000 shares of this company.  Then I hit 40,000.  I am higher then this.  But out of all the pennystocks I watch, this to me seems to have a strong chance at performing very well.  8-10 months and we'll know.  Load up!",2018-09-05
18,younotsmart1243,e5fo5d3,/r/pennystocks/comments/9d5q39/atev_gains_strategic_licensing_partnership_with/e5fo5d3/,1,"Lol I play real pennies daddy, not this trash ",2018-09-05
19,idonthavehobbies,e5fpabn,/r/pennystocks/comments/9d5q39/atev_gains_strategic_licensing_partnership_with/e5fpabn/,1,Can you elaborate as to why you feel the deal is a scam though?,2018-09-05
20,RustySpunes,e5fpo1w,/r/pennystocks/comments/9d70q4/what_is_happening_to_pentanova_energy_pno/e5fpo1w/,1,Split,2018-09-05
21,pwd9398,e5fq4nf,/r/pennystocks/comments/9d5q39/atev_gains_strategic_licensing_partnership_with/e5fq4nf/,1,"He has nothing to back that up with lol, just baselessly trashing. Regional deals are part of the game with smallcap biotech and provide non-dilutive funding, exactly what we needed right now",2018-09-05
22,younotsmart1243,e5fqzbb,/r/pennystocks/comments/9d5q39/atev_gains_strategic_licensing_partnership_with/e5fqzbb/,1,Lol let's come back here one year to this day and see how your stock is then.    Lol trash stock with even trashier stockholders. Lol who would fall for this scam !!! It's a POS,2018-09-05
23,youvebeengreggd,e5fqzz4,/r/pennystocks/comments/9d5q39/atev_gains_strategic_licensing_partnership_with/e5fqzz4/,1,"&gt;  I play real pennies daddy

Is this....are you fucking serious?

This is WSB stuff right? You can't be real here.",2018-09-05
24,maplesyrup604,e5fz1jk,/r/pennystocks/comments/9d5q39/atev_gains_strategic_licensing_partnership_with/e5fz1jk/,1,"Not to rain on the parade here but Wallace’s prior concept drug failed at stage 3,... this is not a sure thing.... yet.  Manage accordingly.",2018-09-05
25,nonameattachedforme,e5fzk8p,/r/pennystocks/comments/9d65fe/any_thoughts_on_huge/e5fzk8p/,1,"Retail and branding, creating customer loyalty.. not in only producing ",2018-09-05
26,RustySpunes,e5g06xl,/r/pennystocks/comments/9d8ik1/little_watch_list/e5g06xl/,1,HCLP 👍🏽,2018-09-05
27,broken_capitalism,e5g15tn,/r/pennystocks/comments/9d8ik1/little_watch_list/e5g15tn/,1,Also CTRV,2018-09-05
28,cannabistodamoon,e5g1djt,/r/pennystocks/comments/9d8l54/cannabis_stock/e5g1djt/,1,Aphria. Second most capacity behind Canopy and only valued at 4.4 B. Aphria is also the only profitable cannabis company with a .21 cent EPS on the year.,2018-09-05
29,RustySpunes,e5g1mek,/r/pennystocks/comments/9d8pg8/what_are_you_guys_investing_in_and_looks_promsing/e5g1mek/,1,Aphria,2018-09-05
30,nonameattachedforme,e5g1r04,/r/pennystocks/comments/9d8l54/cannabis_stock/e5g1r04/,1,TEST,2018-09-05
31,VoodooMerchant,e5g2029,/r/pennystocks/comments/9d8pg8/what_are_you_guys_investing_in_and_looks_promsing/e5g2029/,1,$NEPT,2018-09-05
32,younotsmart1243,e5g276i,/r/pennystocks/comments/9d5q39/atev_gains_strategic_licensing_partnership_with/e5g276i/,1,You can stay in the small times or you go big u peasant. ,2018-09-05
33,imryaan96,e5g2eo6,/r/pennystocks/comments/9d8l54/cannabis_stock/e5g2eo6/,1,opinion on ACB?,2018-09-05
34,youvebeengreggd,e5g2ri2,/r/pennystocks/comments/9d5q39/atev_gains_strategic_licensing_partnership_with/e5g2ri2/,1,LOL,2018-09-05
35,HotWeedMusic,e5g3v36,/r/pennystocks/comments/9d8l54/cannabis_stock/e5g3v36/,1,KSHB,2018-09-05
36,tomford5213,e5g5q2x,/r/pennystocks/comments/9d8l54/cannabis_stock/e5g5q2x/,1,Dilution dilution dilution ,2018-09-05
37,Bull_Market_Bully,e5g620j,/r/pennystocks/comments/9d8l54/cannabis_stock/e5g620j/,1,CGC or CRON,2018-09-05
38,jantzid,e5g6qlg,/r/pennystocks/comments/9d8pg8/what_are_you_guys_investing_in_and_looks_promsing/e5g6qlg/,1,ASGX,2018-09-05
39,Cameltotem,e5g78gr,/r/pennystocks/comments/9d7iu7/atev_atbpf_antibe_therapeutics_announces/e5g78gr/,1,"Now that's a shit pennystock I haven't seen in a long time.

I made some bucks on it months ago but yeah",2018-09-05
40,gotcree,e5g7xuk,/r/pennystocks/comments/9d7iu7/atev_atbpf_antibe_therapeutics_announces/e5g7xuk/,1,What makes it so shit?,2018-09-05
41,bagels666,e5g8dka,/r/pennystocks/comments/9d8l54/cannabis_stock/e5g8dka/,1,"Bought in at $9, just sold at $14. I think all these marijuana stocks will tank with increased US legalization.",2018-09-05
42,BokChoiBoy22,e5g9k5e,/r/pennystocks/comments/9d5q39/atev_gains_strategic_licensing_partnership_with/e5g9k5e/,1,Your dad raised you as trash. What a loser he is. ,2018-09-05
43,idonthavehobbies,e5g9k8z,/r/pennystocks/comments/9d5q39/atev_gains_strategic_licensing_partnership_with/e5g9k8z/,1,"What was the name of the last drug?  Also did it receive licensing agreements?

To me this agreement builds confidence.  A company is risking $13M, a decision they would not take lightly.",2018-09-05
44,TRichard3814,e5g9vv1,/r/pennystocks/comments/9d7iu7/atev_atbpf_antibe_therapeutics_announces/e5g9vv1/,1,"Nothing they have an amazing drug through clinical trials and many patents on a promising technology

This is one of the few small cap companies I am invested in because of the potential to become a billion dollar company ",2018-09-05
45,TRichard3814,e5gc7sz,/r/pennystocks/comments/9d5q39/atev_gains_strategic_licensing_partnership_with/e5gc7sz/,1,"I don’t know why the stock isn’t up more lol

13M is like 1/5th of the stocks market cap and they only gave up 2% of the global market",2018-09-05
46,younotsmart1243,e5gcqa0,/r/pennystocks/comments/9d7iu7/atev_atbpf_antibe_therapeutics_announces/e5gcqa0/,1,The company is a scam and everybody knows it. Lol dilution scam. ,2018-09-05
47,imryaan96,e5gcviu,/r/pennystocks/comments/9d8l54/cannabis_stock/e5gcviu/,1,"I don't know about that, maybe at 16-17 but at this price seems profitable",2018-09-05
48,younotsmart1243,e5gg00o,/r/pennystocks/comments/9d5q39/atev_gains_strategic_licensing_partnership_with/e5gg00o/,1,They will hate you when you big time like me ,2018-09-05
49,Morsyn,e5ghxou,/r/pennystocks/comments/9d7iu7/atev_atbpf_antibe_therapeutics_announces/e5ghxou/,1,"Constant fluff 'news' with no real change, besides a moderate decrease, in price for months. Now, great news with hardly any change. Pretty shit, glad I sold when it first took off.",2018-09-05
50,silverwhere81,e5gi8uw,/r/pennystocks/comments/9d5q39/atev_gains_strategic_licensing_partnership_with/e5gi8uw/,1,"Correct, he was not the lead on that drug. Further, the drug failed to demonstrate effectiveness better than Naopraxen, while his company and ATB 346 do via a double blinded study. NiCox also failed FDA approval because of a lack of metobolic study. ATE's ATB 346 is undergoing a metobolic study this month. I think Mr. Wallace learned a lot from NiCox and what the FDA want to see. So far, the company is doing exactly that and hitting primary end points on each trial. NiCox often only met secondary. 

I had the same thought about his previous company. But Antibe is a solid outfit, with a top board of directors. Not a pump and dump working out of a storage locker. ",2018-09-05
51,nouserleft,e5gj4fc,/r/pennystocks/comments/9d8pg8/what_are_you_guys_investing_in_and_looks_promsing/e5gj4fc/,1,$TRVN,2018-09-05
52,TRichard3814,e5gl1s0,/r/pennystocks/comments/9d7iu7/atev_atbpf_antibe_therapeutics_announces/e5gl1s0/,1,Yes getting 1.3million dollars from a refutable company is a dilution scheme ,2018-09-05
53,karben14,e5gn397,/r/pennystocks/comments/9d7iu7/atev_atbpf_antibe_therapeutics_announces/e5gn397/,1,Looks like it went up almost 11%,2018-09-05
54,VerySuperGenius,e5gon7s,/r/pennystocks/comments/9d8l54/cannabis_stock/e5gon7s/,1,Their market cap is almost 300 times their revenue last year. Seems a bit overvalued. ,2018-09-05
55,ProfessionalCatWolf,e5gphzh,/r/pennystocks/comments/9d7iu7/atev_atbpf_antibe_therapeutics_announces/e5gphzh/,1,Did anyone else think it said ATBGE like the subreddit?,2018-09-05
56,younotsmart1243,e5gpnbz,/r/pennystocks/comments/9d7iu7/atev_atbpf_antibe_therapeutics_announces/e5gpnbz/,1,Lol ok bud. You bought a scam company lol just watch ,2018-09-05
57,pwd9398,e5gpyix,/r/pennystocks/comments/9d7iu7/atev_atbpf_antibe_therapeutics_announces/e5gpyix/,1,"Lol dont feed the troll, he popped up in the other ATE theead too. He is basically a caricature of a retard who has absolutely nothing to back up his bashing.",2018-09-05
58,galactictaco42,e5gq6n7,/r/pennystocks/comments/9d8ik1/little_watch_list/e5gq6n7/,1,"what gives you good vibes on them? i cant find any positive stories other than their plan to hit $3 a share, which is great plans and all but....

why should i drop dough on that?",2018-09-05
59,hamerhed42,e5gtg6f,/r/pennystocks/comments/9d65fe/any_thoughts_on_huge/e5gtg6f/,1,It’s going to be yuuugeee,2018-09-05
60,LeKingishere,e5gtjqb,/r/pennystocks/comments/9dcbas/thoughts_on_saex/e5gtjqb/,1,Just put it on red if you’re looking to turn $100 into $200. ,2018-09-05
61,younotsmart1243,e5gu3rc,/r/pennystocks/comments/9dcbas/thoughts_on_saex/e5gu3rc/,1,Pure scam. Don't buy. If you already did your sol ,2018-09-05
62,alienalec,e5gu6mt,/r/pennystocks/comments/9d8ik1/little_watch_list/e5gu6mt/,1,A strong candidate for a shingles vaccine might be what he’s looking at ,2018-09-05
63,newsmana,e5guj6s,/r/pennystocks/comments/9d8ik1/little_watch_list/e5guj6s/,1,Here you go: https://www.biopharmcatalyst.com/calendars/fda-calendar,2018-09-05
64,getoffmylawn13,e5gvbwa,/r/pennystocks/comments/9d8l54/cannabis_stock/e5gvbwa/,1,I'm in SPRWF (FIRE) and SIGO is my US lotto ticket play. ,2018-09-05
65,GlobalVagabond,e5gvdjm,/r/pennystocks/comments/9d8l54/cannabis_stock/e5gvdjm/,1,"$BDCI 

https://twitter.com/cannabisconsort/status/1037410438819053568?s=19",2018-09-05
66,getoffmylawn13,e5gvmzp,/r/pennystocks/comments/9d8pg8/what_are_you_guys_investing_in_and_looks_promsing/e5gvmzp/,1,SPRWF (FIRE) and BYSD are the only two pennystocks stocks I plan on holding long positions in for the foreseeable future.,2018-09-05
67,galactictaco42,e5gwk98,/r/pennystocks/comments/9dcbas/thoughts_on_saex/e5gwk98/,1,Oh yeah haven't bought,2018-09-05
68,cannabistodamoon,e5gww1y,/r/pennystocks/comments/9d8l54/cannabis_stock/e5gww1y/,1,"well that is bc it was based on medical sales in their first small facility. They will now be starting recreational sales in Canada in 2.3 million square feet of cannabis cultivation capacity. 

&amp;#x200B;

Their revenue is going to go to about 60-100 million per quarter starting next Q.",2018-09-05
69,bigmikey69er,e5gxjve,/r/pennystocks/comments/9d8pg8/what_are_you_guys_investing_in_and_looks_promsing/e5gxjve/,1,ATE.V,2018-09-05
70,[deleted],e5gxt9w,/r/pennystocks/comments/9dcbas/thoughts_on_saex/e5gxt9w/,1,[removed],2018-09-05
71,[deleted],e5gxvv5,/r/pennystocks/comments/9dcbas/thoughts_on_saex/e5gxvv5/,1,[removed],2018-09-05
72,[deleted],e5gxxdq,/r/pennystocks/comments/9d8pg8/what_are_you_guys_investing_in_and_looks_promsing/e5gxxdq/,1,[removed],2018-09-05
73,SantaOMG,e5gybqf,/r/pennystocks/comments/9d8pg8/what_are_you_guys_investing_in_and_looks_promsing/e5gybqf/,1,I wish aphria was on robinhood,2018-09-05
74,SirSilksalot,e5h05yr,/r/pennystocks/comments/9dcbas/thoughts_on_saex/e5h05yr/,1,"Love Saex, lots of Saex. But, Saex is good if you thing there is a tight squeeze. Or if your prefer, you can Put Saex, anywhere you like it (my face says Saex is good.) Saex will
go up and down and up and down. Classic Saex.",2018-09-05
75,broken_capitalism,e5h3avp,/r/pennystocks/comments/9d8ik1/little_watch_list/e5h3avp/,1,Does anyone else use BIB or CURE as a biotech etf sector reference to help decide on positions? BIB just double topped...,2018-09-05
76,beauregrd,e5h3ga0,/r/pennystocks/comments/9d8l54/cannabis_stock/e5h3ga0/,1,Cron made me some $$,2018-09-05
77,broken_capitalism,e5h3xx9,/r/pennystocks/comments/9d8ik1/little_watch_list/e5h3xx9/,1,"I usually only take a position on a stock with  low p/b, low inst ownership and prefer they have sales - but in bio(not all the time). I also like when the RSI goes way low 3 times, along with other indicators. If your using the bio calendar id get in like 3 or 4 mnths ahead of time, never know when an article will make it pop",2018-09-05
78,alienalec,e5h45av,/r/pennystocks/comments/9d8ik1/little_watch_list/e5h45av/,1,"Thank you for the advice, I’ll keep this in mind 👌",2018-09-05
79,versatileguy,e5h4rif,/r/pennystocks/comments/9d8pg8/what_are_you_guys_investing_in_and_looks_promsing/e5h4rif/,1,SSC,2018-09-05
80,cityrubbish,e5h7lp9,/r/pennystocks/comments/9d7iu7/atev_atbpf_antibe_therapeutics_announces/e5h7lp9/,1,"It’s a drug company. The process to get a drug approved takes years. 

I wouldn’t expect any meaningful gains for at least 2-3 years. 

HODL long, maybe real long. ",2018-09-05
81,saltypeanuts7,e5h7qry,/r/pennystocks/comments/9d8pg8/what_are_you_guys_investing_in_and_looks_promsing/e5h7qry/,1,Nvcn🤤,2018-09-05
82,lovelytrout,e5h81kf,/r/pennystocks/comments/9dcbas/thoughts_on_saex/e5h81kf/,1,I've been buying TRCH at 1.11 or below and setting limit sells for 1.30. usually takes 6 weeks but all year it's been bouncing between predictable values,2018-09-05
83,MentalTadpole,e5h8my1,/r/pennystocks/comments/9d8pg8/what_are_you_guys_investing_in_and_looks_promsing/e5h8my1/,1,$SSFT  $AMFE  $BWVI  $WEYL,2018-09-05
84,eduardojvc,e5hbg6x,/r/pennystocks/comments/9d8l54/cannabis_stock/e5hbg6x/,1,"All of them are super overrated; causing a giant volatility. I bought CRON at 8.5 and sold at 12.5 in 3 days. But now this is happening intraday: that’s insane. So, if you have the guts and believe there are pot fans investing heavily on this. Buy and sell with stoppers in the same day. Cheers ",2018-09-05
85,atman888,e5hcd9n,/r/pennystocks/comments/9dcbas/thoughts_on_saex/e5hcd9n/,1,"Check out TRVN, rumor has that they will have FDA approval in Nov. Also support at 1.50 level.  Could be a winner. Trading at $1.80 now.",2018-09-05
86,DoorKickerCommunity,e5hh69n,/r/pennystocks/comments/9dcbas/thoughts_on_saex/e5hh69n/,1,Weed Stocks ,2018-09-05
87,juanvelezt,e5hkijc,/r/pennystocks/comments/9d8pg8/what_are_you_guys_investing_in_and_looks_promsing/e5hkijc/,1,$HUGE,2018-09-05
88,cityrubbish,e5hmvxe,/r/pennystocks/comments/9d8l54/cannabis_stock/e5hmvxe/,1,Can value really be determined at the present time when the product they make is currently illegal to sell? ,2018-09-05
89,galactictaco42,e5hpbx6,/r/pennystocks/comments/9dcbas/thoughts_on_saex/e5hpbx6/,1,Maybe when it settles down I'll put investment money on that but nah it seems too hectic. Fuck being rich when I'm 40 I'm trying to make it now,2018-09-05
90,Lovetoyouknowhat,e5ih5aw,/r/pennystocks/comments/9d8pg8/what_are_you_guys_investing_in_and_looks_promsing/e5ih5aw/,1,I've got some aphria. Also some canopy but mostly aurora. I'm brand spanking new at stocks. Any advice would be greatly appreciated. ,2018-09-05
91,thedroid124,e5io1ts,/r/pennystocks/comments/9dcbas/thoughts_on_saex/e5io1ts/,1,I took a look. This guy looks to be correct.,2018-09-05
92,blueballz32,e5l7fim,/r/pennystocks/comments/9d8pg8/what_are_you_guys_investing_in_and_looks_promsing/e5l7fim/,1,Bysd ,2018-09-05
93,NG06,e5ldhhb,/r/pennystocks/comments/9d8pg8/what_are_you_guys_investing_in_and_looks_promsing/e5ldhhb/,1,$nlst ,2018-09-05
94,helpimstuckinmychair,e5mii55,/r/pennystocks/comments/9d8pg8/what_are_you_guys_investing_in_and_looks_promsing/e5mii55/,1,SFOR,2018-09-05
95,Zoogtar,e5mo5kd,/r/pennystocks/comments/9d8pg8/what_are_you_guys_investing_in_and_looks_promsing/e5mo5kd/,1,May I get an insight? :),2018-09-05
96,saltypeanuts7,e5mo6vd,/r/pennystocks/comments/9d8pg8/what_are_you_guys_investing_in_and_looks_promsing/e5mo6vd/,1,It was a joke fam lol,2018-09-05
97,Zoogtar,e5mq9ks,/r/pennystocks/comments/9d8pg8/what_are_you_guys_investing_in_and_looks_promsing/e5mq9ks/,1,Oh lol I was a little worried for you. ,2018-09-05
98,broken_capitalism,e5nfzq9,/r/pennystocks/comments/9d8ik1/little_watch_list/e5nfzq9/,1,"https://finviz.com/screener.ashx?v=211&amp;t=NBRV,NVAX",2018-09-05
99,broken_capitalism,e5nh9a1,/r/pennystocks/comments/9d8ik1/little_watch_list/e5nh9a1/,1,"https://finviz.com/screener.ashx?v=211&amp;t=NBRV,NVAX,TYME",2018-09-05
100,broken_capitalism,e5nhdc4,/r/pennystocks/comments/9d8ik1/little_watch_list/e5nhdc4/,1,"https://finviz.com/screener.ashx?v=211&amp;t=NBRV,NVAX,TYME,CTRV",2018-09-05
101,broken_capitalism,e5nhxo3,/r/pennystocks/comments/9d8ik1/little_watch_list/e5nhxo3/,1,BIB going to $55??? Sept7,2018-09-05
102,broken_capitalism,e5nie88,/r/pennystocks/comments/9d8ik1/little_watch_list/e5nie88/,1,Sell n short INO early next week,2018-09-05
103,broken_capitalism,e5o3d78,/r/pennystocks/comments/9d8ik1/little_watch_list/e5o3d78/,1,"SHORTS:
https://finviz.com/screener.ashx?v=211&amp;o=instown&amp;t=EVFM,APTX,ARWR,RETA,KALV,BCRX",2018-09-05
104,[deleted],e5ot7k4,/r/pennystocks/comments/9d8pg8/what_are_you_guys_investing_in_and_looks_promsing/e5ot7k4/,1,[removed],2018-09-05
105,Rodrat,e5pfln9,/r/pennystocks/comments/9d8l54/cannabis_stock/e5pfln9/,1,For long term. Yes. I think it's going to be one of the biggest brands in the end. ,2018-09-05
106,broken_capitalism,e5utv45,/r/pennystocks/comments/9d8ik1/little_watch_list/e5utv45/,1,https://www.marketwatch.com/investing/stock/nio 9-12-18,2018-09-05
107,broken_capitalism,e5wf6xc,/r/pennystocks/comments/9d8ik1/little_watch_list/e5wf6xc/,1,China plays GSH YUMC,2018-09-05
108,broken_capitalism,e5yrx1y,/r/pennystocks/comments/9d8ik1/little_watch_list/e5yrx1y/,1,Sold 1000 ALT @ 8.00 🤑,2018-09-05
109,broken_capitalism,e5yssa4,/r/pennystocks/comments/9d8ik1/little_watch_list/e5yssa4/,1,Keep eye on tvix,2018-09-05
110,Rec1umWrecker,e65xzfb,/r/pennystocks/comments/9d7iu7/atev_atbpf_antibe_therapeutics_announces/e65xzfb/,1,"Why don't you either support your claims or put your helmet back on and go back to your mother's basement, you're quite clearly a fucking retard ",2018-09-05
111,Rec1umWrecker,e65y2j7,/r/pennystocks/comments/9d7iu7/atev_atbpf_antibe_therapeutics_announces/e65y2j7/,1,"I'm glad you sold too, been amassing shares at these ridiculously low prices from dumb money like you",2018-09-05
112,Zoogtar,e6hk0kr,/r/pennystocks/comments/9d8pg8/what_are_you_guys_investing_in_and_looks_promsing/e6hk0kr/,1,Dude see it now? LOL!,2018-09-05
113,saltypeanuts7,e6hmfkl,/r/pennystocks/comments/9d8pg8/what_are_you_guys_investing_in_and_looks_promsing/e6hmfkl/,1,Yea man that reverse split made alot of people sad lol,2018-09-05
114,broken_capitalism,e74c3zx,/r/pennystocks/comments/9d8ik1/little_watch_list/e74c3zx/,1,"Ears, aytu 10-3-2018",2018-09-05
115,broken_capitalism,e7j8zyb,/r/pennystocks/comments/9d8ik1/little_watch_list/e7j8zyb/,1,Hard correction? Spy to 230?,2018-09-05
116,broken_capitalism,e7r2uql,/r/pennystocks/comments/9d8ik1/little_watch_list/e7r2uql/,1,OHRP 0.23 10-15-2018,2018-09-05
117,broken_capitalism,e7r2xyq,/r/pennystocks/comments/9d8ik1/little_watch_list/e7r2xyq/,1,Sell atwr @14,2018-09-05
118,broken_capitalism,e7r33ck,/r/pennystocks/comments/9d8ik1/little_watch_list/e7r33ck/,1,Sell evfm,2018-09-05
119,broken_capitalism,e7s17aq,/r/pennystocks/comments/9d8ik1/little_watch_list/e7s17aq/,1,"Add hclp,ctrv to watchlist 10/14/18",2018-09-05
120,broken_capitalism,e7tpc0f,/r/pennystocks/comments/9d8ik1/little_watch_list/e7tpc0f/,1,"FLKS 0.65

LONG

10/15/18
",2018-09-05
121,broken_capitalism,e7tpf51,/r/pennystocks/comments/9d8ik1/little_watch_list/e7tpf51/,1,Watch TTNP 0.23 10/15/18,2018-09-05
122,Entrepreneur-first,e89kkpd,/r/pennystocks/comments/9d65fe/any_thoughts_on_huge/e89kkpd/,1, https://www.businesswire.com/news/home/20181022005966/en/FSD-Pharma-Signs-Binding-LOI-Acquire-Therapix,2018-09-05
