,author,id,url,score,text,date
116,user_dan,dsclhu4,/r/pennystocks/comments/7ny9xz/is_360_blockchain_worth_it/dsclhu4/,1,"I think crypto stock rally is not over. We will see higher prices, but..

The crypto stocks on coming to terms with the highs that were made in Dec. The folks that bought up will sell at every opportunity they get. The resolution is to shake those people out over time with price drifting lower (really a pullback). See $MGTI after it hit it's highs in Aug.. textbook example. Note, this is not a prediction, but guidance on where I initiated and place stops.

I am bullish on $MGTI, but at this price, I would hold (I am from 1.70-ish). If it drifts to the 3s or high 2s, I would recommend initiating a position or adding. If it does not reach the 3s, go on to the next ticker in this raging bull market!

$BTCS is a little tough. It has a lot of support at .12, but it is hanging on to a consolidating range above it. A similar thing happened a couple of months ago when .0785 was a big support level. It ended up dipping to .0785 and bouncing hard. It technically IS at a good spot to open a position, but you have to be ok with a .11 stop.

$DIGAF and $GLNNF are worth a look too.",2018-01-03
117,TheAllMightyKeith,dskwcyo,/r/pennystocks/comments/7nx7nc/mict_thoughts_of_hitting_17/dskwcyo/,1,have you gotten out?,2018-01-03
118,Ebailey0360,dsl2anc,/r/pennystocks/comments/7nx7nc/mict_thoughts_of_hitting_17/dsl2anc/,1,"No sir I’m still in haven’t increased my stake just held initial 264 shares, also purchased FCEL at 1.72 and told my brother to buy in again past few days when it hit it but he was reluctant, it has similar gains of about 16 percent since. I can post proof if ya want haha.

Also if you want one to buy by end of day get SELB. They just got FDA approval for drug blah blah shares went down dip is lower than when I bought in at 9.07 but can foresee similar gains. 

Thanks for responding my karma is low so I’ve been banned from posting to other Reddit’s so sorry for the long post

Happy hunting",2018-01-03
119,TheAllMightyKeith,dsl2s21,/r/pennystocks/comments/7nx7nc/mict_thoughts_of_hitting_17/dsl2s21/,1,yeah sounds good ill look them up good luck ,2018-01-03
120,Ebailey0360,dsle9r3,/r/pennystocks/comments/7nx7nc/mict_thoughts_of_hitting_17/dsle9r3/,1,True that thanks sir ,2018-01-03
121,tkhendall,dstsyla,/r/pennystocks/comments/7nwayt/if_anyone_want_a_bit_of_reading_take_a_look_new/dstsyla/,1,Have you looked into CMCLF? I find it a little more appealing since it’s a Chinese company.,2018-01-03
122,Moed69,dsttqkl,/r/pennystocks/comments/7nwayt/if_anyone_want_a_bit_of_reading_take_a_look_new/dsttqkl/,1,"No I haven't. I'll look into it. I'm in Canada, so need to see if it's available to us. Thanks. ",2018-01-03
123,OmenQtx,dsvdr7x,/r/pennystocks/comments/7nxjna/args/dsvdr7x/,1,"Argos is doing a 1:20 reverse stock split at market close today. I'm pretty new at this, but that doesn't sound good for my 500 shares. Doing the math, nothing comes out favorably for me.",2018-01-03
124,Mario_Mendoza,du5qs6y,/r/pennystocks/comments/7nvykb/any_updates_on_cryo_im_thinking_of_punting_it/du5qs6y/,1,https://www.fda.gov/NewsEvents/Newsroom/PressAnnouncements/ucm591371.htm,2018-01-03
