,author,id,url,score,text,date
105,ClarenceWerly,e7j9dmf,/r/pennystocks/comments/9mra1r/new_to_penny_stocks/e7j9dmf/,1,Narrow your research to companies in industries that you personally know something about,2018-10-09
106,bigbopperz,e7ja8th,/r/pennystocks/comments/9mtvw3/snapchat_about_to_be_a_penny_stock/e7ja8th/,1,what positions you thinking?,2018-10-09
107,StevenMcphearson,e7jak0l,/r/pennystocks/comments/9mtvw3/snapchat_about_to_be_a_penny_stock/e7jak0l/,1,"12/21 $6 

They called me mad for taking that position about 2 weeks ago. 

IMHO the company really shouldn’t have gone public. They’re not making anything innovative. Little puppy trying to play with the big dogs. ",2018-10-09
108,Entrepreneur-first,e7jbzqe,/r/pennystocks/comments/9mq6b0/3_marijuana_stocks_that_gained_over_150_in/e7jbzqe/,1,How much you investment in very stock? What is the strategy take 5 big ones with more money or 20 penny stocks with small investment each?,2018-10-09
109,personable_finance,e7ji51m,/r/pennystocks/comments/9msspz/xxii_is_the_new_igc/e7ji51m/,1,Wen?,2018-10-09
110,gazgunz,e7jpv9h,/r/pennystocks/comments/9mqd23/rshn_bdci/e7jpv9h/,1,So it’s a scam ?,2018-10-09
111,[deleted],e7jyzs0,/r/pennystocks/comments/9mqd23/rshn_bdci/e7jyzs0/,1,[removed],2018-10-09
112,MrVolatility,e7k01sv,/r/pennystocks/comments/9mtkwj/subpenny_to_watch_cfgx/e7k01sv/,1,"I with you on this one bud. 

I bought 7 million shares almost 3 weeks ago @ 0003 and 0004 and sold half today @ 0008.   News has not even hit yet and they are Pink Current.   PR could maybe happen this week still and the news will make it fly. ",2018-10-09
113,MrVolatility,e7k02vf,/r/pennystocks/comments/9mtkwj/subpenny_to_watch_cfgx/e7k02vf/,1,"I remember man, these fools on this sub do not want to make money. ",2018-10-09
114,MrVolatility,e7k05qd,/r/pennystocks/comments/9mqd23/rshn_bdci/e7k05qd/,1,"Lol yes, but theres tons of money to be made on these ""scams"" .  Ride the pump, sell before the dump ",2018-10-09
115,MrVolatility,e7k0cct,/r/pennystocks/comments/9mpyp0/rcgp/e7k0cct/,1,Down 20 percent today ouch,2018-10-09
116,gazgunz,e7k1ug8,/r/pennystocks/comments/9mqd23/rshn_bdci/e7k1ug8/,1,"I’m new, they took a big shat on me. Is BDCI Scammy too? HIPH!",2018-10-09
117,MrVolatility,e7k1z61,/r/pennystocks/comments/9mqd23/rshn_bdci/e7k1z61/,1,"It took me a year and half of getting shit on to learn man but it had to happen so I could learn.     

Learn about share structures, dilution, convertible debt.    Subscribe to OTc trading accounts on Twitter,  stay up and do DD.  Technical analysis, chart reading. 

But HIPH is actually not looking to bad. ",2018-10-09
118,hangenouthere,e7k68mo,/r/pennystocks/comments/9mpgq8/rnx_gold_discovery/e7k68mo/,1,"Boulders of gold man 

once in a life time discovery 

just putting it out there ",2018-10-09
119,kandroid96,e7k9fum,/r/pennystocks/comments/9mra1r/new_to_penny_stocks/e7k9fum/,1,Definitely gotta be smart and do research. Personally my strategy starting out with Penny stocks was awful. I didn't lose too much money there but some of my other ventures definitely are not happy. On realized gains I have good retuens so far in my short time as an investor but the unrealized ideas I had are what's really killing me. ,2018-10-09
120,silverlakes123,e7kcwl4,/r/pennystocks/comments/9mpyp0/rcgp/e7kcwl4/,1,"Lmao I didn’t know a stock had to close green everyday, still holding gains from yesterday. Building higher highs and higher lows. AAPL closed down in the red yesterday, ouch",2018-10-09
121,SmartWarning,e7kjhcv,/r/pennystocks/comments/9msnon/brokerage_firm/e7kjhcv/,1,No worries. Thank you.,2018-10-09
122,SmartWarning,e7kjjwj,/r/pennystocks/comments/9msnon/brokerage_firm/e7kjjwj/,1,Thank you.,2018-10-09
123,NikoSleeps,e7kqpm9,/r/pennystocks/comments/9mpgq8/rnx_gold_discovery/e7kqpm9/,1,Why tf does the stock keep going down? Nothing but amazing news the past week. Down 20% and people having a bad case of FOMO are pulling out 2nd mortgages to go into this opportunity and it keeps going down. Anybody have any explanation?,2018-10-09
124,ApeScape55,e7l8mgf,/r/pennystocks/comments/9mpgq8/rnx_gold_discovery/e7l8mgf/,1,"The whole market is pretty much down, but gold is up.

&amp;#x200B;

People still need reassurance that there is more gold to dig up, and honestly the media hasn't really published much about RNC in north america. Very little volume in the US or Germany, mainly Canada. HLOD.",2018-10-09
125,Kenethica,e7li2cl,/r/pennystocks/comments/9mpgq8/rnx_gold_discovery/e7li2cl/,1,robinhood = us market. you need the RNKLF ticker,2018-10-09
126,Joncas94,e7lrgme,/r/pennystocks/comments/9mpgq8/rnx_gold_discovery/e7lrgme/,1,At 1.04 average now,2018-10-09
127,dgfdfdfdf,e7mfvw8,/r/pennystocks/comments/9mpgq8/rnx_gold_discovery/e7mfvw8/,1,People taking profit I suppose. ,2018-10-09
128,ApeScape55,e7mttl7,/r/pennystocks/comments/9mpgq8/rnx_gold_discovery/e7mttl7/,1,"Latest Interview - Mark is way too excited

&amp;#x200B;

[https://www.youtube.com/watch?v=bdN3bK0WyvI](https://www.youtube.com/watch?v=bdN3bK0WyvI)",2018-10-09
129,ApeScape55,e7mtw5y,/r/pennystocks/comments/9mpgq8/rnx_gold_discovery/e7mtw5y/,1,"### ""A really good post from a CEO.ca member on RNX

With Mikeymike426's permission, here it is...  
 

The initial discovery at Beta Hunt mine is truly amazing. To the point that many have doubts about the extent of the discovery. As the story began to develop we saw the strike length jump from 5m-10m-200m and eventually 540m and from 9000 oz to 27 000 ounces with the refined gold from the blast still not accounted for as they are waiting on The Perth Mint to mill and refine the tons of ore that came out with the blast. To date we only have a tally of the hand picked visible gold. It’s easy to have doubt since it has been a month since the initial discovery. However, they did not extend the strike zone without supporting evidence. They hit high grade gold below the Nickel lenses on level 14 and In fact, there are almost 700 kms worth of diamond drill holes from the previous 4 companies that have owned the property in the last 40 years. Some of which show 2300 g/t, 1200 g/t and many in the hundreds of g/t. In 2016, they released a report that is 187 pages and they clearly state that the A Zone strike length is actually 800 m. Maybe RNC is playing it safe and maybe we will see the strike length extended to reflect the 2016 assay report. We have heard people refer to this as a jewellery box find. Unfortunately, RNC has a model they have provided to the world that even expert John Kaiser says “it’s not about proving the discovery as much as it is about disproving it”. Eric Sprott obviously shares this sentiment as he announced that he is now a 10 percent owner of Royal Nickel and even went as far as to mention the Due Diligence being provided on ceo.ca, This speaks volumes to the work we have put in.... When multiple millionaires take notice maybe retail should be as-well. Nothing happens quickly in the mining world as there are many hurdles to overcome. Once a discovery is made geology needs time to analyze the data, plan how to attack the ore body, implement security measures and set up for a full scale drilling program. Each task takes time and attention as they don’t want to paint themselves into a corner. It’s not about driving the ore body and chasing the vein. Mining is science, architecture and geology all intertwined into a complex system. Mining is filled with red tape and procedures, all of which test the patience of the company and share holders alike. The geological model being presented is solid and only those who lack experience will brush this off as a one time find. Shorters will try to create doubt and institutions will push the price down in order to maximize their position. In the end it’s up to Royal Nickel to take the steps to prove out the theory and they have shown every intention to do so. Meanwhile they are extracting specimens in a fashion never seen before and continue to add value to the discovery. They have presented the technical data at two major conferences in the last few weeks and have rarely been challenged until some genius at Haywood decides to attempt to downplay the discovery. Look no further than the surrounding properties and the sheer magnitude of gold in Kalgoorlie and the Kambalda flats. Beta hunt sits on a dome with multiple shear zones. They have known for some time now they had a very unique geological formation with extreme high grade potential. Hitting the Father’s Day was no accident however the timing is all so bittersweet. Kevin Small tried to tell the purchasing company that there is 280 million in gold in the A Zone alone and it’s not even the main ore body... let that sink in... There are cross over features, shear zones, extensional veins and many many kms of vein to chase. Not every round will be 30 000 oz, but the potential is definitely there to find many bonanza zones throughout the mine. The best part is that it’s a fully operational mine with all the infrastructure in place to tackle the the ore bodies in very short order, all the while run a full scale drilling program. With 5 kms of ramp running parallel to the western flank and the A Zone, the sky is the limit :) either you believe or you don’t but the fact is that there is no other""",2018-10-09
130,Joncas94,e7mxn55,/r/pennystocks/comments/9mpgq8/rnx_gold_discovery/e7mxn55/,1,1.02 average now 10000 share,2018-10-09
131,Yeezymalak,e7mz16c,/r/pennystocks/comments/9mpgq8/rnx_gold_discovery/e7mz16c/,1,"Bought in at $0.98 last week as a yolo play expecting to hit $1.25 by EOD. Didn’t pan out and dropped to $0.70. See potential in the company, minimal debt and opportunity to uncover more gold from their dig. Will hold for a while and see how things pan out. ",2018-10-09
132,idontgive2fucks,e7nv5dk,/r/pennystocks/comments/9msspz/xxii_is_the_new_igc/e7nv5dk/,1,Yeah no thanks I already sold at 3.29,2018-10-09
133,niftydriftyprod,e7o68lv,/r/pennystocks/comments/9msspz/xxii_is_the_new_igc/e7o68lv/,1,I sold at 3.20. Going back for more hahaha.,2018-10-09
134,EnvyV07,e7pp3ea,/r/pennystocks/comments/9msspz/xxii_is_the_new_igc/e7pp3ea/,1,Good time to buy is now. Or Monday...,2018-10-09
135,doofhus,e7ps70e,/r/pennystocks/comments/9msspz/xxii_is_the_new_igc/e7ps70e/,1,"Been holding  XXII since $1.12, got a Christmas card last year as well. 
Huge potential if nicotine gets regulated ",2018-10-09
136,The_Stock_Guy,e7vmkr6,/r/pennystocks/comments/9msspz/xxii_is_the_new_igc/e7vmkr6/,1,This didn’t age well ,2018-10-09
137,[deleted],e8cd2do,/r/pennystocks/comments/9mpgq8/rnx_gold_discovery/e8cd2do/,1,[removed],2018-10-09
