,title,id,author,url,score,num_comments,text,date,link
0,$TRNX,g4n4vm,_OO9,https://www.reddit.com/r/pennystocks/comments/g4n4vm/trnx/,1,13,"Huge volume.  
They have until the 30JUNE20 to get back into $1 mark. 
💸",2020-04-20,https://www.reddit.com/r/pennystocks/comments/g4n4vm/trnx/
1,Aytu continues to be a bad company,g4mzs8,ConfidentMorning9,https://www.reddit.com/r/pennystocks/comments/g4mzs8/aytu_continues_to_be_a_bad_company/,1,0,[removed],2020-04-20,https://www.reddit.com/r/pennystocks/comments/g4mzs8/aytu_continues_to_be_a_bad_company/
2,VIXY a good play tomorrow?,g4murj,issa_mimzy,https://www.reddit.com/r/pennystocks/comments/g4murj/vixy_a_good_play_tomorrow/,1,2,do you think a bad bad oil day brings down the market these first 2 days maybe a 3rd bleed day but i think the market ends up Green on Friday +500 at least. What do you guys think?,2020-04-20,https://www.reddit.com/r/pennystocks/comments/g4murj/vixy_a_good_play_tomorrow/
3,PICK FOR TOMMM,g4mqgb,ravcc,https://www.reddit.com/r/pennystocks/comments/g4mqgb/pick_for_tommm/,1,9,Going for AKRX looks good so far,2020-04-20,https://www.reddit.com/r/pennystocks/comments/g4mqgb/pick_for_tommm/
4,Tops ships has sold,g4mcza,ggnigg4z,https://www.reddit.com/r/pennystocks/comments/g4mcza/tops_ships_has_sold/,1,27,Little tidbit for you guys hop in for pump and dump when they announce it hopefully tomorrow. Remember me when you get some news,2020-04-20,https://www.reddit.com/r/pennystocks/comments/g4mcza/tops_ships_has_sold/
5,That's an L,g4lnwj,cdm34,https://www.reddit.com/r/pennystocks/comments/g4lnwj/thats_an_l/,1,11,,2020-04-20,https://i.redd.it/0tkw4jh7krk41.jpg
6,What keywords in a stock's news article title usually mean the stock could potentially gain soon?,g4l7ec,Bsizzle1024,https://www.reddit.com/r/pennystocks/comments/g4l7ec/what_keywords_in_a_stocks_news_article_title/,1,11,"In short I am working on a script to show when a stock is potentially going to increase based on a news article. 

&amp;#x200B;

For Example, I have noticed stocks that usually contain recent news involving something positive with the Corona Virus tend to go up.",2020-04-20,https://www.reddit.com/r/pennystocks/comments/g4l7ec/what_keywords_in_a_stocks_news_article_title/
7,What say you VBIV MBRX SBPH!!?,g4kyap,Purchaseman1,https://www.reddit.com/r/pennystocks/comments/g4kyap/what_say_you_vbiv_mbrx_sbph/,1,0,[removed],2020-04-20,https://www.reddit.com/r/pennystocks/comments/g4kyap/what_say_you_vbiv_mbrx_sbph/
8,$MBRX Announces Agreement with ImQuest Biosciences to Expand Coronavirus Testing,g4r7b4,sekyuritei,https://www.reddit.com/r/pennystocks/comments/g4r7b4/mbrx_announces_agreement_with_imquest_biosciences/,1,4,,2020-04-20,https://www.prnewswire.com/news-releases/moleculin-announces-agreement-with-imquest-biosciences-to-expand-coronavirus-testing-301043291.html
9,DECN - Can we expect movement today?,g4r6sq,kynys,https://www.reddit.com/r/pennystocks/comments/g4r6sq/decn_can_we_expect_movement_today/,1,17,This slid down Friday assuming most didn’t want to hold over the weekend. But has there been any news bringing this back up today or should I just take my loses?,2020-04-20,https://www.reddit.com/r/pennystocks/comments/g4r6sq/decn_can_we_expect_movement_today/
10,$NBY Pharmaceuticals Signs Agreement to Distribute COVID-19 Antibody Rapid Point-of-Care Test to U.S. Healthcare Professionals,g4qwg9,sekyuritei,https://www.reddit.com/r/pennystocks/comments/g4qwg9/nby_pharmaceuticals_signs_agreement_to_distribute/,1,5,,2020-04-20,https://www.businesswire.com/news/home/20200420005232/en/
11,NovaBay Pharmaceuticals Signs Agreement to Distribute COVID-19 Antibody Rapid Point-of-Care Test to U.S. Healthcare Professionals,g4qw8k,sekyuritei,https://www.reddit.com/r/pennystocks/comments/g4qw8k/novabay_pharmaceuticals_signs_agreement_to/,1,0,,2020-04-20,https://www.businesswire.com/news/home/20200420005232/en/
12,Looking for a good flow app !!!!,g4qlsv,andrei_dia10,https://www.reddit.com/r/pennystocks/comments/g4qlsv/looking_for_a_good_flow_app/,1,0,"Looking for a flow app, currently debating in between cheddar flow, black box stocks, and flowalgo.

Do you guys happen to be using any of these platforms? If so i would really appreciate any feedback.",2020-04-20,https://www.reddit.com/r/pennystocks/comments/g4qlsv/looking_for_a_good_flow_app/
13,HONEY WHERES MY ASTRONAUT SUIT?!?🚀🌑 will XSPA SHOOT UP THIS WEEK?!,g4qa9r,BatangPasawaylol,https://www.reddit.com/r/pennystocks/comments/g4qa9r/honey_wheres_my_astronaut_suit_will_xspa_shoot_up/,1,5,,2020-04-20,https://i.redd.it/iklv6fva8yt41.jpg
14,Thoughts on SHIP?,g4q5ig,chiefredrum,https://www.reddit.com/r/pennystocks/comments/g4q5ig/thoughts_on_ship/,1,0,Let’s start the week off great everyone! Just looking for everyone’s input on this one in particular because i’ve been watching it for a few weeks and seems it has potential to go up. Anyone else? thanks for any info.,2020-04-20,https://www.reddit.com/r/pennystocks/comments/g4q5ig/thoughts_on_ship/
15,$DFCO close Friday at a new 11 year high. Find me another OTC doing anything close to that.,g4jnuc,NormanMitis,https://www.reddit.com/r/pennystocks/comments/g4jnuc/dfco_close_friday_at_a_new_11_year_high_find_me/,1,15,"I've been a full time OTC trader since 2006 and my style of trading/investing is to find the few quality setups and trade them for longer term swing trades. A few months tend to be the longest I'll hold but if the play warrants it, I will adapt. Enter $DFCO.

I first stumbled upon $DFCO in January 2018 when it when from defunct to filing financials again with OTC Markets. That sparked the stock to run 1500% in a day (breaking out of a 9 year base) and then it began to consolidate it's gains. That consolidation was what first caught my eye. Most OTCs that run that hard get dumped hard soon after, so when I see a stock run like crazy AND hold it's gains, that means it's accumulation. And my style of trading is to follow the big boys and when they accumulate that heavily, so do I.

Fast forward to now and the once defunct company is making steady progress but it wasn't until this past week that the price action finally picked up again. Then on Thursday and Friday it made back to back new 11 year high closes, setting the stage for a continuation of that 2018 rally. This is mega long term play in action so I fully expect this to have legs. There will be volatility for sure, ups down and consolidation along the way, but I expect the uptrend to sustain itself for a long period of time. I always encourage traders to take some profits into strength to lock in some gains and limit overall risk at that stage, but then when a play has this sort of potential you need to let some run.

Best chart in the OTC by far right here: [https://www.tradingview.com/x/K39erN3g/](https://www.tradingview.com/x/K39erN3g/)

I've been singing it's praises for 2 years now and though the price has held up well, the lack of volume has kept the market uninterested. I kept telling people buy up the .03s and .04s while the volume was low because once volume picks up you're paying much higher. Oh well, I tried. Retail traders love to chase volume.. so here comes the volume. 

$DFCO business overview: [https://8e74fc3f-11d9-4492-8055-30216a341b62.filesusr.com/ugd/59eb9d\_1fdb8e668c9f4a7393e4675362c1d6eb.pdf](https://8e74fc3f-11d9-4492-8055-30216a341b62.filesusr.com/ugd/59eb9d_1fdb8e668c9f4a7393e4675362c1d6eb.pdf)",2020-04-20,https://www.reddit.com/r/pennystocks/comments/g4jnuc/dfco_close_friday_at_a_new_11_year_high_find_me/
16,"RRD, what do you guys think about this?",g4jldn,VatoMoto420,https://www.reddit.com/r/pennystocks/comments/g4jldn/rrd_what_do_you_guys_think_about_this/,1,0,[removed],2020-04-20,https://www.reddit.com/r/pennystocks/comments/g4jldn/rrd_what_do_you_guys_think_about_this/
17,"RRD, thoughts? Its currently at 1.12 precovid19 was at 3.. what r ur guyses opinion? Buy?hold?",g4jknw,VatoMoto420,https://www.reddit.com/r/pennystocks/comments/g4jknw/rrd_thoughts_its_currently_at_112_precovid19_was/,1,0,[removed],2020-04-20,https://www.reddit.com/r/pennystocks/comments/g4jknw/rrd_thoughts_its_currently_at_112_precovid19_was/
18,"Lottery picks: Biggest upside, pre-pump picks using technical analysis",g4j47q,ShivaBowl19,https://www.reddit.com/r/pennystocks/comments/g4j47q/lottery_picks_biggest_upside_prepump_picks_using/,1,6,"I'm relatively new so in an effort to not let this shit be like stock twits, I ask that you only comment with charts. Leave the ""I feel like""s out of this string. We can do without the ""check out xyz"" comments.  

Ill continue to add to this list.

NTEC  0.25 target 0.34 lvl1 0.40 lvl2
https://www.tradingview.com/x/PHSa3jlo/
https://www.tradingview.com/x/PHSa3jlo/",2020-04-20,https://www.reddit.com/r/pennystocks/comments/g4j47q/lottery_picks_biggest_upside_prepump_picks_using/
19,New to stocks and looking for some opinions from people more familiar with all of this!,g4j422,Nate870,https://www.reddit.com/r/pennystocks/comments/g4j422/new_to_stocks_and_looking_for_some_opinions_from/,1,3,"So I bought a couple hundred shares of CNTY with hopes that it would make a turn around in the coming weeks.

I also bought a bit of shares of MWK by reading into some news regarding the company and the overall moves this particular stock has been making lately.

With that being said, should I continue to hold what I’ve got and play a slightly longer game or pull out soon?

Also, any other smaller stock options in the same vein that you may recommend checking out send my way please!",2020-04-20,https://www.reddit.com/r/pennystocks/comments/g4j422/new_to_stocks_and_looking_for_some_opinions_from/
20,What do you guys think of TH?,g4isx7,DragonElder,https://www.reddit.com/r/pennystocks/comments/g4isx7/what_do_you_guys_think_of_th/,1,2,SGBX is another conglomerate that popped up on my radar. Conglomerates seem to be on the rise which kind of makes sense because smaller businesses aren’t doing well and teaming up could help them. There’s only 8 that are pennystocks and these two seem to be the best.,2020-04-20,https://www.reddit.com/r/pennystocks/comments/g4isx7/what_do_you_guys_think_of_th/
21,APRU,g4to2f,FoodChemistMan,https://www.reddit.com/r/pennystocks/comments/g4to2f/apru/,1,0,[removed],2020-04-20,https://www.reddit.com/r/pennystocks/comments/g4to2f/apru/
22,CHEK,g4tllf,ravcc,https://www.reddit.com/r/pennystocks/comments/g4tllf/chek/,1,6,"Has a nice dip, time to buy in",2020-04-20,https://www.reddit.com/r/pennystocks/comments/g4tllf/chek/
23,OPK,g4tkgs,Patburns81,https://www.reddit.com/r/pennystocks/comments/g4tkgs/opk/,1,0,[removed],2020-04-20,https://www.reddit.com/r/pennystocks/comments/g4tkgs/opk/
24,$CYCC Up 168% COVID19 NEWS,g4tj2i,JDWhit_,https://www.reddit.com/r/pennystocks/comments/g4tj2i/cycc_up_168_covid19_news/,1,9,Reverse split. COVID19 news. Super low float.,2020-04-20,https://www.reddit.com/r/pennystocks/comments/g4tj2i/cycc_up_168_covid19_news/
25,WANT TO HEAR A JOKE? UAV,g4tijx,Shadoweats09,https://www.reddit.com/r/pennystocks/comments/g4tijx/want_to_hear_a_joke_uav/,1,13,"I bought UAV at $1.56 
How many shares?! Ahahaha you don’t want to know.",2020-04-20,https://www.reddit.com/r/pennystocks/comments/g4tijx/want_to_hear_a_joke_uav/
26,DECN,g4tgf0,LostCucumber69,https://www.reddit.com/r/pennystocks/comments/g4tgf0/decn/,1,0,[removed],2020-04-20,https://www.reddit.com/r/pennystocks/comments/g4tgf0/decn/
27,What’s with EWLL?!,g4tg1e,User42655,https://www.reddit.com/r/pennystocks/comments/g4tg1e/whats_with_ewll/,1,2,"Confused why news said its usage would increase, then my medical appointments (just finished one) with the VA now require its use and its just kinda stagnant. What’s up with that??",2020-04-20,https://www.reddit.com/r/pennystocks/comments/g4tg1e/whats_with_ewll/
28,OPK up +11% since opening,g4tfkt,Patburns81,https://www.reddit.com/r/pennystocks/comments/g4tfkt/opk_up_11_since_opening/,1,0,[removed],2020-04-20,https://www.reddit.com/r/pennystocks/comments/g4tfkt/opk_up_11_since_opening/
29,OPK up +11% since opening. Don't know why...,g4tf1q,Patburns81,https://www.reddit.com/r/pennystocks/comments/g4tf1q/opk_up_11_since_opening_dont_know_why/,1,0,[removed],2020-04-20,https://www.reddit.com/r/pennystocks/comments/g4tf1q/opk_up_11_since_opening_dont_know_why/
30,$AVCT Missle,g4te2j,JDWhit_,https://www.reddit.com/r/pennystocks/comments/g4te2j/avct_missle/,1,0,Low float. Nice gains today!,2020-04-20,https://www.reddit.com/r/pennystocks/comments/g4te2j/avct_missle/
31,SFOR moving this morning,g4tdd3,n0j0ke,https://www.reddit.com/r/pennystocks/comments/g4tdd3/sfor_moving_this_morning/,1,3,"Up 22%

Recent news that Zoom users are using the companies security programs to protect their conferences and information.   [https://www.globenewswire.com/news-release/2020/04/13/2015043/0/en/Zoom-Users-Turn-to-StrikeForce-s-Privacy-Protection-Software-to-Protect-Video-Conferencing-Confidential-Information.html](https://www.globenewswire.com/news-release/2020/04/13/2015043/0/en/Zoom-Users-Turn-to-StrikeForce-s-Privacy-Protection-Software-to-Protect-Video-Conferencing-Confidential-Information.html) 

The company is looking to restructure in order to uplist by 2021. [https://www.globenewswire.com/news-release/2020/04/17/2017885/0/en/StrikeForce-Technologies-Takes-Initial-Steps-Towards-Up-Listing-to-Major-Exchange.html](https://www.globenewswire.com/news-release/2020/04/17/2017885/0/en/StrikeForce-Technologies-Takes-Initial-Steps-Towards-Up-Listing-to-Major-Exchange.html) 

Do your own DD. I like this company for a short gain.",2020-04-20,https://www.reddit.com/r/pennystocks/comments/g4tdd3/sfor_moving_this_morning/
32,SHIP,g4tbaw,Taco177,https://www.reddit.com/r/pennystocks/comments/g4tbaw/ship/,1,19,at its lowest for the past month and it’s slowly going up,2020-04-20,https://www.reddit.com/r/pennystocks/comments/g4tbaw/ship/
33,TRNX,g4t5f9,mmrrbbxxoo,https://www.reddit.com/r/pennystocks/comments/g4t5f9/trnx/,1,10,What do you guys feel about this ?,2020-04-20,https://www.reddit.com/r/pennystocks/comments/g4t5f9/trnx/
34,Eros,g4t1db,pitystonks,https://www.reddit.com/r/pennystocks/comments/g4t1db/eros/,1,4,What's happened?,2020-04-20,https://www.reddit.com/r/pennystocks/comments/g4t1db/eros/
35,$bhs going to be the next one to run,g4t1b5,2gurleys1kupp33,https://www.reddit.com/r/pennystocks/comments/g4t1b5/bhs_going_to_be_the_next_one_to_run/,1,1,$bhs a small cap silver producer with cash in the bank. Greatly oversold. Will start producing here soon again. Volume has been great lately. This one will run back to normal price in the coming week or two I see .10 cents plus. Look at the chart. It’s coming back up. Also if you don’t go on ceo.ca you should. Lots of helpful info and stock boards for each stock.,2020-04-20,https://www.reddit.com/r/pennystocks/comments/g4t1b5/bhs_going_to_be_the_next_one_to_run/
36,"Screening of 11,552 Compounds Identifies Innovation Pharmaceuticals’ Brilacidin as One of the Most Promising Potential Inhibitors of the Novel Coronavirus COVID-19",g4sxic,1KrazyKarlVB,https://www.reddit.com/r/pennystocks/comments/g4sxic/screening_of_11552_compounds_identifies/,1,0,Might make some moves today.,2020-04-20,https://www.reddit.com/r/pennystocks/comments/g4sxic/screening_of_11552_compounds_identifies/
37,IPIX up 28% and going up,g4sx4y,donw5,https://www.reddit.com/r/pennystocks/comments/g4sx4y/ipix_up_28_and_going_up/,1,1,,2020-04-20,http://www.ipharminc.com/press-release/2020/4/20/screening-of-11552-compounds-identifies-innovation-pharmaceuticals-brilacidin-as-one-of-the-most-promising-potential-inhibitors-of-the-novel-coronavirus
38,CPE,g4sly5,Waccamaw407,https://www.reddit.com/r/pennystocks/comments/g4sly5/cpe/,1,6,"Dipping really low...thinking about buying up, do y’all think it will bump up to pre corona prices in the next few months?",2020-04-20,https://www.reddit.com/r/pennystocks/comments/g4sly5/cpe/
39,NBY,g4sg50,hess_michael,https://www.reddit.com/r/pennystocks/comments/g4sg50/nby/,1,12,I’m so glad I’ve been holding your bags all this time!,2020-04-20,https://www.reddit.com/r/pennystocks/comments/g4sg50/nby/
40,Ensv ?,g4sepe,Phathose024,https://www.reddit.com/r/pennystocks/comments/g4sepe/ensv/,1,0,[removed],2020-04-20,https://www.reddit.com/r/pennystocks/comments/g4sepe/ensv/
41,PCTL,g4s7ms,yesyesyesyesyesokyes,https://www.reddit.com/r/pennystocks/comments/g4s7ms/pctl/,1,8,Who's in on PCTL?? Let's make it rain dinos,2020-04-20,https://www.reddit.com/r/pennystocks/comments/g4s7ms/pctl/
42,ENSV dip buy?,g4s5sm,Vitamin-B6,https://www.reddit.com/r/pennystocks/comments/g4s5sm/ensv_dip_buy/,1,3,"What do y’all think, it rose total 82% Friday with a peak of 110% and seems to be taking a big dip before open. Is it time to buy?",2020-04-20,https://www.reddit.com/r/pennystocks/comments/g4s5sm/ensv_dip_buy/
43,Less than 1 hour,g4rys4,vastlywealthy,https://www.reddit.com/r/pennystocks/comments/g4rys4/less_than_1_hour/,1,7,"If you had to pick 1 stock that will let you retire by tomorrow, which one do you choose?",2020-04-20,https://www.reddit.com/r/pennystocks/comments/g4rys4/less_than_1_hour/
44,AYTU,g4rwu8,TN_Mike13,https://www.reddit.com/r/pennystocks/comments/g4rwu8/aytu/,1,6,Finally got some news. I’m baaacckk!,2020-04-20,https://www.reddit.com/r/pennystocks/comments/g4rwu8/aytu/
45,TOPS,g4rkra,wflores170,https://www.reddit.com/r/pennystocks/comments/g4rkra/tops/,1,29,Well.... hope y’all held TOPS....,2020-04-20,https://www.reddit.com/r/pennystocks/comments/g4rkra/tops/
46,‎Tendies Podcast: EPPY 4 What Goes Up Must Come Down on Apple Podcasts,g4wc6s,Jruzzin,https://www.reddit.com/r/pennystocks/comments/g4wc6s/tendies_podcast_eppy_4_what_goes_up_must_come/,1,0,"Hey guys,

Here is a fun pod with a breakdown of the week and some decent DD if anyone wants to listen!

 [https://podcasts.apple.com/us/podcast/eppy-4-what-goes-up-must-come-down/id1504992350?i=1000472021100](https://podcasts.apple.com/us/podcast/eppy-4-what-goes-up-must-come-down/id1504992350?i=1000472021100)",2020-04-20,https://www.reddit.com/r/pennystocks/comments/g4wc6s/tendies_podcast_eppy_4_what_goes_up_must_come/
47,MTNOY,g4w9f3,mexicant80,https://www.reddit.com/r/pennystocks/comments/g4w9f3/mtnoy/,1,0,"Opened down big this morning but has leveled off around 2.42. Seems like a good floor to buy in, thoughts? I couldn’t find an indication for why they were down below the rest of the market.",2020-04-20,https://www.reddit.com/r/pennystocks/comments/g4w9f3/mtnoy/
48,XSPA?,g4vzfy,jcktffy98,https://www.reddit.com/r/pennystocks/comments/g4vzfy/xspa/,1,14,Do we anticipate XSPA going up more?,2020-04-20,https://www.reddit.com/r/pennystocks/comments/g4vzfy/xspa/
49,Thoughts on XSPA,g4vxax,justl1ve,https://www.reddit.com/r/pennystocks/comments/g4vxax/thoughts_on_xspa/,1,4,It's going up quite a bit. From .42 to .50 rn,2020-04-20,https://www.reddit.com/r/pennystocks/comments/g4vxax/thoughts_on_xspa/
50,XSPA bullish!!!,g4vwb8,as12578,https://www.reddit.com/r/pennystocks/comments/g4vwb8/xspa_bullish/,1,11,I got in at .30 getting 60% return now! Anyone else in it? What do you think should be good selling price?,2020-04-20,https://www.reddit.com/r/pennystocks/comments/g4vwb8/xspa_bullish/
51,Ino,g4vt6v,rustysrealaf,https://www.reddit.com/r/pennystocks/comments/g4vt6v/ino/,1,7,Who thinks she’s gonna keep going up? I have 15 and I’m already at 100% gain should I take the money and run or is there bigger things coming,2020-04-20,https://www.reddit.com/r/pennystocks/comments/g4vt6v/ino/
52,Anyone day trading with a vanguard account?,g4vs5r,CG_Ops,https://www.reddit.com/r/pennystocks/comments/g4vs5r/anyone_day_trading_with_a_vanguard_account/,1,1,"I am new to investing/trading and setup a Vanguard account about a month ago.  Been buying some investment stocks/indexes as I go.  I have now put $25k into the account to allow me to day trade but I'm getting a warning about freeriding funds, even though I have plenty of cash to cover the couple of penny stocks I'm trying to day trade.
  
I'd prefer not to deal with multiple brokers (RH, TD, etc), I'm more just curious if anyone else is doing it and what their experience has been like.",2020-04-20,https://www.reddit.com/r/pennystocks/comments/g4vs5r/anyone_day_trading_with_a_vanguard_account/
53,American Manganese CEO Discusses Voltabox MOU,g4vh79,NASDQTRDER,https://www.reddit.com/r/pennystocks/comments/g4vh79/american_manganese_ceo_discusses_voltabox_mou/,1,0,"$AMYZF / $AMY.V Video Update April 17, 2020

https://www.howestreet.com/2020/04/american-manganese-voltabox-mou-recycling-lithium-ion-batteries/

See the Corporate profile: http://www.thestreetnow.com/spotlight/amyzf-amy/",2020-04-20,https://www.reddit.com/r/pennystocks/comments/g4vh79/american_manganese_ceo_discusses_voltabox_mou/
54,ETTX - am I the only one?,g4vfof,Coturier_is_a_Righty,https://www.reddit.com/r/pennystocks/comments/g4vfof/ettx_am_i_the_only_one/,1,2,"Am I the only one on $ETTX? 

This company is significantly above it's daily resistance, relative volume has been up over the past few trading days and has a large institutional ownership - all things that I view as positive. Plus, it is still 50% below it's 52 Week support level. 

&amp;#x200B;

I can't be the only one in on this guy, who's HODL with me?",2020-04-20,https://www.reddit.com/r/pennystocks/comments/g4vfof/ettx_am_i_the_only_one/
55,"GlobeX Data and Bahamas Partner To Launch GlobeX’s WFH Cloud Security, Data Management and Secure Communications Business Solutions Services",g4vee4,NASDQTRDER,https://www.reddit.com/r/pennystocks/comments/g4vee4/globex_data_and_bahamas_partner_to_launch_globexs/,1,0,"$SWIS News April 20, 2020

https://finance.yahoo.com/news/globex-data-bahamas-partner-launch-151500321.html

See the Corporate profile:
http://www.thestreetnow.com/spotlight/swisf-swis/",2020-04-20,https://www.reddit.com/r/pennystocks/comments/g4vee4/globex_data_and_bahamas_partner_to_launch_globexs/
56,Crude vs Toilet Paper,g4vdzk,rajatajmera10,https://www.reddit.com/r/pennystocks/comments/g4vdzk/crude_vs_toilet_paper/,1,14,,2020-04-20,https://i.redd.it/2fj83l3lwzt41.jpg
57,"$STSN something going on. Massive volume the last couple trading day, and they just went PINK current.",g4vbik,virus_stocks100,https://www.reddit.com/r/pennystocks/comments/g4vbik/stsn_something_going_on_massive_volume_the_last/,1,1,"Been watching for a while. They just went PINK current, and updated their float. its only 1 million lol. 

Last week, they had a 900% increase in volume over the entire week, and I noticed some big names starting to mention it in Discord room and Aurora chat room. 

Thoughts?

 [https://www.otcmarkets.com/stock/STSN/security](https://www.otcmarkets.com/stock/STSN/security)",2020-04-20,https://www.reddit.com/r/pennystocks/comments/g4vbik/stsn_something_going_on_massive_volume_the_last/
58,Heading to the Lambo dealership,g4vba1,bennybouch,https://www.reddit.com/r/pennystocks/comments/g4vba1/heading_to_the_lambo_dealership/,1,5,hey guys... commenting on a post from a while back here but gonna head down to the dealership and look at some colors in a few for when DECN goes to Mars.. any suggestions?,2020-04-20,https://www.reddit.com/r/pennystocks/comments/g4vba1/heading_to_the_lambo_dealership/
59,RTTR,g4uwlq,Bluetrees44,https://www.reddit.com/r/pennystocks/comments/g4uwlq/rttr/,1,3,"showing some good signs today. news of a possible merger which will be decided on may 7th. I should have purchased at .27 this morning but I dident because volume was stagnant. how do you guys feel? 

[https://finance.yahoo.com/news/ritter-pharmaceuticals-reports-financial-results-212742130.html](https://finance.yahoo.com/news/ritter-pharmaceuticals-reports-financial-results-212742130.html)",2020-04-20,https://www.reddit.com/r/pennystocks/comments/g4uwlq/rttr/
60,I don’t mean to brag... but I finally broke even today!!!,g4uuul,tritoad,https://www.reddit.com/r/pennystocks/comments/g4uuul/i_dont_mean_to_brag_but_i_finally_broke_even_today/,1,90,,2020-04-20,https://i.redd.it/r67j5u9erzt41.jpg
61,UBER awarded government contract,g4uo30,jmwnf,https://www.reddit.com/r/pennystocks/comments/g4uo30/uber_awarded_government_contract/,1,1,,2020-04-20,https://twitter.com/tradehawk/status/1252253125756350464?s=21
62,BBRW,g4un2t,Semper_Rejecto,https://www.reddit.com/r/pennystocks/comments/g4un2t/bbrw/,1,22,"Well....did you guys get in or not?

You still have a chance. The share price should sit around $0.07. But some estimates are at $0.70 because of the low float. 

Heavy volume day and sitting at $0.02 a share. Time to buy.

I don't work for the company.

I have a small amount of shares &gt;30,000. 

They are an All American Business in California making All American Brewery supplies. 

I might end up eating my words here but I will say it anyways, ""I told you.""",2020-04-20,https://www.reddit.com/r/pennystocks/comments/g4un2t/bbrw/
63,Any thoughts on AKRX,g4uggs,naik4o,https://www.reddit.com/r/pennystocks/comments/g4uggs/any_thoughts_on_akrx/,1,0,[removed],2020-04-20,https://www.reddit.com/r/pennystocks/comments/g4uggs/any_thoughts_on_akrx/
64,NBY ITSSSAAABUY,g4uc8c,ravcc,https://www.reddit.com/r/pennystocks/comments/g4uc8c/nby_itsssaaabuy/,1,8,Buy don’t miss out,2020-04-20,https://www.reddit.com/r/pennystocks/comments/g4uc8c/nby_itsssaaabuy/
65,Why is no one talking about $OPK?,g4uc1i,-dtstocks,https://www.reddit.com/r/pennystocks/comments/g4uc1i/why_is_no_one_talking_about_opk/,1,7,"Lots of volume today, lots of preexisting short positions about to get squeezed out, lots of deals being brokered across the country with BRLI, and 2 upcoming earnings report that should be expected to have generally positive expectations of the future for the company.",2020-04-20,https://www.reddit.com/r/pennystocks/comments/g4uc1i/why_is_no_one_talking_about_opk/
