,author,id,url,score,text,date
118,dcstockjvm,emv0x3e,/r/pennystocks/comments/bm5nfo/kgkg_hope_you_all_listened/emv0x3e/,1,"To be honest, just a gut. I started following them since November and they have grown like wild fire across the country. Small foundation but a strong foundation. That are almost nationwide and the first in this new sector.",2019-05-08
119,chrish_850,emv0xd9,/r/pennystocks/comments/bm6nq3/kgkg/emv0xd9/,1,Im I’m at .01 and riding this for the long haul,2019-05-08
120,chrish_850,emv10i3,/r/pennystocks/comments/bm5nfo/kgkg_hope_you_all_listened/emv10i3/,1,I’m in at .01 and riding this all year long,2019-05-08
121,dcstockjvm,emv133w,/r/pennystocks/comments/bm5nfo/kgkg_hope_you_all_listened/emv133w/,1,"To be honest, I found it in November during its initial run and got back in on Feb after they started showing signs they are a legit OTC company. I think I saw it as a recommendation on a yahoo board when I invested in that junk called PURA.",2019-05-08
122,chrish_850,emv1eca,/r/pennystocks/comments/bm9py8/kgkg_psiq_atev_abce/emv1eca/,1,Been with KGKG since .01 and riding it all the way up,2019-05-08
123,dcstockjvm,emv1eew,/r/pennystocks/comments/bm5nfo/kgkg_hope_you_all_listened/emv1eew/,1,"Damn, I’m jealous. Wish I had gotten in at .01.  That’s awesome. Make that money man!",2019-05-08
124,danimal82,emv1q38,/r/pennystocks/comments/bm6nq3/kgkg/emv1q38/,1,"I made like a thousand dollars today on this. Small potatoes for some of you, i know,  but for me it's a rare win.",2019-05-08
125,chrish_850,emv1qnk,/r/pennystocks/comments/bm5nfo/kgkg_hope_you_all_listened/emv1qnk/,1,Yeah I’m not selling shit. Can’t wait for that earnings report. I see .3 very soon and dollars by end of year,2019-05-08
126,dcstockjvm,emv1xh9,/r/pennystocks/comments/bm5nfo/kgkg_hope_you_all_listened/emv1xh9/,1,Agreed! Same here. I’m laughing at all the people thinking this a junk company. We will get the last laugh at the end of year. Patience is key.,2019-05-08
127,chrish_850,emv2gj4,/r/pennystocks/comments/bm5nfo/kgkg_hope_you_all_listened/emv2gj4/,1,"Yup. Only thing I’m keeping my eye on is other major brands dropping their own versions of CBD drinks. When that happens, we will definitely see a dip ONCE they hit the stores and products are side by side. For now and the foreseeable future, KGKG is going up up up.",2019-05-08
128,dcstockjvm,emv34wx,/r/pennystocks/comments/bm5nfo/kgkg_hope_you_all_listened/emv34wx/,1,I agree. Fingers crossed a major player that’s not in the energy drink sector puts money into Kona like coke did with monster.  I hope a big liquor/beer company does it. We shall see. I just now they are making the right moves.,2019-05-08
129,Dallas2143,emv3kuj,/r/pennystocks/comments/bm5nfo/kgkg_hope_you_all_listened/emv3kuj/,1,Ok fair enough. Where else can I look for DD information besides their financials,2019-05-08
130,chrish_850,emv3v5q,/r/pennystocks/comments/bm5nfo/kgkg_hope_you_all_listened/emv3v5q/,1,"Very smart moves.

Just curious, you have any holdings in PSIQ? I’ve been with them since .12",2019-05-08
131,dcstockjvm,emv4lv3,/r/pennystocks/comments/bm5nfo/kgkg_hope_you_all_listened/emv4lv3/,1,"If you need visuals, join the fb group and you can see distributors sharing there growth. That was what made me feel comfortable putting 35k into this.",2019-05-08
132,dcstockjvm,emv4pwy,/r/pennystocks/comments/bm5nfo/kgkg_hope_you_all_listened/emv4pwy/,1,I don’t. First I’m hearing. Worth looking into?,2019-05-08
133,Thundersnow69,emv65tl,/r/pennystocks/comments/bm85fm/bemg_at_04/emv65tl/,1,"Through a news article... 

“GCH (https://getcredithealthy.com/) is a fintech company that has developed a proprietary platform that provides consumers with access to tools and resources to rehabilitate and build their credit profiles and improve credit scores. DriveItAway (https://www.driveitaway.com/) has implemented a turn-key, solutions driven program. It has developed revolutionary mobile technology, including dealer-based “Car Sharing for Ride Sharing,” to offer temporary vehicles to Ride Share (Lyft, Uber) drivers, and has forged a “path to ownership” for those who ultimately wish to own their own Ride Share vehicles.”",2019-05-08
134,NG06,emv6cjz,/r/pennystocks/comments/bm606i/mrs_mission_ready_solutions_the_real_10x_bagger/emv6cjz/,1,Nice!! Will look into it. Thanks!,2019-05-08
135,chrish_850,emv6tuk,/r/pennystocks/comments/bm5nfo/kgkg_hope_you_all_listened/emv6tuk/,1,Had a massive acquisition today. Yes,2019-05-08
136,dcstockjvm,emv73yq,/r/pennystocks/comments/bm5nfo/kgkg_hope_you_all_listened/emv73yq/,1,Thanks for the tip,2019-05-08
137,phogeddaboudit,emv7sui,/r/pennystocks/comments/bm94vj/wkhs/emv7sui/,1,"Made a few hundos earlier... contemplating an overnight play on it, too.",2019-05-08
138,spitfire4,emv7zeq,/r/pennystocks/comments/bm5nfo/kgkg_hope_you_all_listened/emv7zeq/,1,"Nice, thanks",2019-05-08
139,jordanjbarta,emv919c,/r/pennystocks/comments/bm85fm/bemg_at_04/emv919c/,1,"Yep same. I’m hold $3g in crap stocks right now lol. 
This one will move again, this week for sure.",2019-05-08
140,jordanjbarta,emv9a0r,/r/pennystocks/comments/bm8hpi/positions_on_bemg/emv9a0r/,1,"Agreed. We good here. - I’m holding roughly 100k shares at an average of .042
Wish I could got those .03’s a few weeks back.",2019-05-08
141,lt050286,emvafv8,/r/pennystocks/comments/bm85fm/bemg_at_04/emvafv8/,1,Where can I buy?,2019-05-08
142,LuminousLynx,emvb17s,/r/pennystocks/comments/bm606i/mrs_mission_ready_solutions_the_real_10x_bagger/emvb17s/,1,!Remindme! 1 month,2019-05-08
143,LuminousLynx,emvb7mv,/r/pennystocks/comments/bm606i/mrs_mission_ready_solutions_the_real_10x_bagger/emvb7mv/,1,RemindMe! 1 month,2019-05-08
144,RemindMeBot,emvbd16,/r/pennystocks/comments/bm606i/mrs_mission_ready_solutions_the_real_10x_bagger/emvbd16/,1,"I will be messaging you on [**2019-06-08 21:59:51 UTC**](http://www.wolframalpha.com/input/?i=2019-06-08 21:59:51 UTC To Local Time) to remind you of [**this link.**](https://www.reddit.com/r/pennystocks/comments/bm606i/mrs_mission_ready_solutions_the_real_10x_bagger/emvb7mv/)

[**CLICK THIS LINK**](http://np.reddit.com/message/compose/?to=RemindMeBot&amp;subject=Reminder&amp;message=[https://www.reddit.com/r/pennystocks/comments/bm606i/mrs_mission_ready_solutions_the_real_10x_bagger/emvb7mv/]%0A%0ARemindMe!  1 month) to send a PM to also be reminded and to reduce spam.

^(Parent commenter can ) [^(delete this message to hide from others.)](http://np.reddit.com/message/compose/?to=RemindMeBot&amp;subject=Delete Comment&amp;message=Delete! ____id____)

_____

|[^(FAQs)](http://np.reddit.com/r/RemindMeBot/comments/24duzp/remindmebot_info/)|[^(Custom)](http://np.reddit.com/message/compose/?to=RemindMeBot&amp;subject=Reminder&amp;message=[LINK INSIDE SQUARE BRACKETS else default to FAQs]%0A%0ANOTE: Don't forget to add the time options after the command.%0A%0ARemindMe!)|[^(Your Reminders)](http://np.reddit.com/message/compose/?to=RemindMeBot&amp;subject=List Of Reminders&amp;message=MyReminders!)|[^(Feedback)](http://np.reddit.com/message/compose/?to=RemindMeBotWrangler&amp;subject=Feedback)|[^(Code)](https://github.com/SIlver--/remindmebot-reddit)|[^(Browser Extensions)](https://np.reddit.com/r/RemindMeBot/comments/4kldad/remindmebot_extensions/)
|-|-|-|-|-|-|",2019-05-08
145,IrRoscoeMr,emvbwrv,/r/pennystocks/comments/bm606i/mrs_mission_ready_solutions_the_real_10x_bagger/emvbwrv/,1,Already in :),2019-05-08
146,thenewmqueen,emvcedh,/r/pennystocks/comments/bm6nq3/kgkg/emvcedh/,1,"&gt;KGKG

Gains are gains",2019-05-08
147,MrRipShitUp,emvev1e,/r/pennystocks/comments/bm8hpi/positions_on_bemg/emvev1e/,1,"Well, sir, we have the opposite wish. I got in at .03 flat but only bought 3500 shares. With j had bought more. Bought it with some left over money I had after spending big on one that hasn’t moved since I bought it.",2019-05-08
148,dogbreath67,emvfc4g,/r/pennystocks/comments/bm85fm/bemg_at_04/emvfc4g/,1,I sold at .5 bought back at .45 so I increased my position but still down lol.. it’s definitely worth holding through the week though I think.,2019-05-08
149,i_luv_tiny,emvg0a0,/r/pennystocks/comments/bm9rqx/kgkg_sings_sponsor_ship/emvg0a0/,1,"are they signing them, too?",2019-05-08
150,__ICoraxI__,emvggej,/r/pennystocks/comments/bm9rqx/kgkg_sings_sponsor_ship/emvggej/,1,"first, they must sing the athletes into existence, under the light of the two trees of valinor, then they can sign them to the One Contract to Rule Them All",2019-05-08
151,keithmtl,emvgt2h,/r/pennystocks/comments/bm606i/mrs_mission_ready_solutions_the_real_10x_bagger/emvgt2h/,1,Remindme! 28 days,2019-05-08
152,Stuxnet15,emvh2av,/r/pennystocks/comments/bm6nq3/kgkg/emvh2av/,1,"Make sure to take profit. Small, consistent gains is key to growing your portfolio. Never aim for a grand slam to the moons of Jupiter every time. This thing may run up 10,000% more, but you don’t know that. Always, always make sure to take profit.",2019-05-08
153,Butwinsky,emvhg29,/r/pennystocks/comments/bm75sa/adom/emvhg29/,1,I'm holding with firm belief it will go back down to .30 cents tomorrow because this stock hates being over .40 for more than an hour.,2019-05-08
154,RingOfFyre,emvhphp,/r/pennystocks/comments/bm9wwt/59_watch_list/emvhphp/,1,I really hope BEMG doesn't explode at open when I missed out on buying the dip,2019-05-08
155,ProfessionalCatWolf,emvi9nr,/r/pennystocks/comments/bm606i/mrs_mission_ready_solutions_the_real_10x_bagger/emvi9nr/,1,"What platform can I buy it on? Not on RH or Schwab. Sorry, new to pennystocks",2019-05-08
156,PayFromDickroll,emvj2qk,/r/pennystocks/comments/bm94vj/wkhs/emvj2qk/,1,How did you happen upon this stock/others like it?,2019-05-08
157,Ewallye,emvj6h7,/r/pennystocks/comments/bm94vj/wkhs/emvj6h7/,1,"Bought at 1.25. boyah. Nope. Actually sold it before the ascending triangle broke due to playing it safe. Sat back and watched the bugger fly afterwards. Oh well,that's trading. This was a unicorn stock. congrats to those who held.",2019-05-08
158,nitrouz,emvonw4,/r/pennystocks/comments/bm606i/mrs_mission_ready_solutions_the_real_10x_bagger/emvonw4/,1,"I know it trades on over the counter. They're working on making this stock DTC eligible. Right now it's hard for Americans to buy it. Canadians dont seem to understand the value here. I hope this company lists in America in a professional manner, DTC eligible
https://www.bloomberg.com/quote/MSNVF:US",2019-05-08
159,houseflip,emvp57r,/r/pennystocks/comments/bm94vj/wkhs/emvp57r/,1,donald trump leaked/tweeted that gm may be selling a plant to near-broke WKHS . . . stock has gone from .90 to 3.76 already,2019-05-08
160,nitrouz,emvp7m1,/r/pennystocks/comments/bm606i/mrs_mission_ready_solutions_the_real_10x_bagger/emvp7m1/,1,"Sweet - the price has artificially being kept low by some ""Anonymous"" broker and we're guessing, it could be for a bought deal. We may see some private equity money go in here. Keep an eye",2019-05-08
161,nitrouz,emvp8sx,/r/pennystocks/comments/bm606i/mrs_mission_ready_solutions_the_real_10x_bagger/emvp8sx/,1,Smart money Jim Cramer lol,2019-05-08
162,Creevildead,emvq6tg,/r/pennystocks/comments/bm606i/mrs_mission_ready_solutions_the_real_10x_bagger/emvq6tg/,1,RemindMe! 25 days,2019-05-08
163,invcht2,emvqe6w,/r/pennystocks/comments/bm7qee/top_3_trading_books_for_beginner_traders/emvqe6w/,1,Mark Douglas is the GOAT,2019-05-08
164,market_notify,emvqfrm,/r/pennystocks/comments/bm7qee/top_3_trading_books_for_beginner_traders/emvqfrm/,1,He has some great stuff!,2019-05-08
165,jettrooper357,emvqnst,/r/pennystocks/comments/blziez/watchlist_58/emvqnst/,1,This list was 4 for 4 today!!!,2019-05-08
166,darknessfalls2010,emvr4g1,/r/pennystocks/comments/bm94vj/wkhs/emvr4g1/,1,Bought 134 shares at .62 back in April and sold for 1.15 fml,2019-05-08
167,gnardaddy,emvrcqp,/r/pennystocks/comments/bmccis/htrc/emvrcqp/,1,No but after a quick look it looks like a lame stock with low trading volume. Curious what got you interested in it though?,2019-05-08
168,Wetcat9,emvsrkx,/r/pennystocks/comments/bm606i/mrs_mission_ready_solutions_the_real_10x_bagger/emvsrkx/,1,that ah spread lol...definitely a stock to not do market orders on,2019-05-08
169,a-Bird-on-a-Wing,emvvv0h,/r/pennystocks/comments/bm5nfo/kgkg_hope_you_all_listened/emvvv0h/,1,What an original product hemp energy drinks. Nobody can compete with that.,2019-05-08
170,banannasale,emvw3g8,/r/pennystocks/comments/bm606i/mrs_mission_ready_solutions_the_real_10x_bagger/emvw3g8/,1,Does anyone know how to buy it from the US? Trying to navigate that process,2019-05-08
171,banannasale,emvwe3s,/r/pennystocks/comments/bm606i/mrs_mission_ready_solutions_the_real_10x_bagger/emvwe3s/,1,Does anyone know how to buy it from the US? Trying to navigate that process,2019-05-08
172,banannasale,emvwu5q,/r/pennystocks/comments/bm606i/mrs_mission_ready_solutions_the_real_10x_bagger/emvwu5q/,1,Does anyone know how to buy it from the US? Trying to navigate that process,2019-05-08
173,A-Fat-Texan,emvx03m,/r/pennystocks/comments/bm94vj/wkhs/emvx03m/,1,"I’ve been in this stock for about 18 months at an average cost just under a dollar. This isn’t just a psychology play, here’s the basics:

Workhorse produces chassis for EV and next-gen hybrid trucks and vans, and also has a drone venture that is in the process of being sold.

NGEN-1000: Workhorse’s last mile delivery van that was designed to compete on the USPS fleet next generation delivery vehicle contract. Workhorse was named one of the 5 finalists last year. The contract is estimated to be worth $6B, and they have 1100 other orders for the van already. First deliveries are expected for Q4 this year.

W-15: Well before Rivian announced its pickup, the W-15 had already logged 4000 pre-orders. The project is currently on hold while the company focuses on the NGEN van, but will likely resume shortly after van production catches stride

Financing: Workhorse entered an agreement with Marathon Asset Management in February that gives them access to a $35MM line of credit, essentially enough to run the company for another year until they begin filling van orders.

Trump tweet: Workhorse is planning to buy a GM manufacturing plant in Ohio. In and of itself shopping for a plant isn’t unusual because other USPS contract bidders are doing the same, but Trumps involvement leaves some to speculate that Workhorse is the current front runner.

This is my little pet company in my portfolio and it’s fun to finally see people talking about it, even if r/pennystocks is just passing through.",2019-05-08
174,nitrouz,emvxz0p,/r/pennystocks/comments/bm606i/mrs_mission_ready_solutions_the_real_10x_bagger/emvxz0p/,1,Here is the site where you can see awards. Everything here is 3 months before. That's the rule with the DOD https://www.fpds.gov/ezsearch/search.do?indexName=awardfull&amp;templateName=1.5.1&amp;s=FPDS.GOV&amp;q=Unifire,2019-05-08
175,nitrouz,emvy0ek,/r/pennystocks/comments/bm606i/mrs_mission_ready_solutions_the_real_10x_bagger/emvy0ek/,1,"Here is the link where you can see their awards

https://www.fpds.gov/ezsearch/search.do?indexName=awardfull&amp;templateName=1.5.1&amp;s=FPDS.GOV&amp;q=Unifire",2019-05-08
176,jordanjbarta,emvy60i,/r/pennystocks/comments/bm8hpi/positions_on_bemg/emvy60i/,1,"I feel your pain!
You on Twitter?",2019-05-08
177,NG06,emvz241,/r/pennystocks/comments/bm606i/mrs_mission_ready_solutions_the_real_10x_bagger/emvz241/,1,Thank you,2019-05-08
178,RingOfFyre,emw0xgd,/r/pennystocks/comments/bm606i/mrs_mission_ready_solutions_the_real_10x_bagger/emw0xgd/,1,Don't do market orders on anything unless you're just trying to load up on a long term ETF hold or something,2019-05-08
179,idonthavehobbies,emw1c0e,/r/pennystocks/comments/bm9py8/kgkg_psiq_atev_abce/emw1c0e/,1,"Yes  $ATE.V!! Final Phase 2 trial underway, should be completed in the next couple of months.  Then the FDA meeting.  The Phase 3 design and partnership.  

Get ready for this one to take off!",2019-05-08
180,Creevildead,emw1dix,/r/pennystocks/comments/bm606i/mrs_mission_ready_solutions_the_real_10x_bagger/emw1dix/,1,Unfortunately the only way I'm trading is via wealthsimple and unfortunately this isn't on there since its without a 52day high over 50 cents. So I don't exactly know how to buy in yet.,2019-05-08
181,RingOfFyre,emw1gnu,/r/pennystocks/comments/bm606i/mrs_mission_ready_solutions_the_real_10x_bagger/emw1gnu/,1,What says they get 10% of the contract?,2019-05-08
182,nitrouz,emw1txu,/r/pennystocks/comments/bm606i/mrs_mission_ready_solutions_the_real_10x_bagger/emw1txu/,1,"I am just saying as what if. Historically, they've gotten 2%-5%. Majority used to go to ADS Tactical 90%. These 2019 DLS contracts are worth $4 billion and each of the 6 companies have an equal chance to solicit for these contracts. There are new solicitations each day. Like for example, check out how much contracts ADS gets: https://www.fpds.gov/ezsearch/search.do?q=atlantic+diving+supply&amp;s=FPDS.GOV&amp;templateName=1.5.1&amp;indexName=awardfull&amp;sortBy=SIGNED_DATE&amp;desc=Y

However, they just recently lost their small business license and these DLA contracts are only eligible for small businesses

https://www.washingtonpost.com/business/2019/04/12/military-equipment-supplier-atlantic-diving-supply-loses-small-business-status/?utm_term=.4b3cb7709141

10% is not too farfetched but realistically, I am expecting 5%.",2019-05-08
183,DeadReligion,emw1uvb,/r/pennystocks/comments/bm606i/mrs_mission_ready_solutions_the_real_10x_bagger/emw1uvb/,1,I purchased some shares through Schwab. Look up 'Mission Ready Solutions' or MSNVF,2019-05-08
184,nitrouz,emw1zp6,/r/pennystocks/comments/bm606i/mrs_mission_ready_solutions_the_real_10x_bagger/emw1zp6/,1,"You're right - never do a market order, no matter the circumstances. They say the best time to do a trade is 15 minutes after market has opened.",2019-05-08
185,DeadReligion,emw22bg,/r/pennystocks/comments/bm606i/mrs_mission_ready_solutions_the_real_10x_bagger/emw22bg/,1,So how would $33 billion be split 6 ways? Between which companies?,2019-05-08
186,iandbz,emw26wt,/r/pennystocks/comments/bmbs6b/hell_yea_wkhs_baby_thanks_trump/emw26wt/,1,i’m jealous,2019-05-08
187,nitrouz,emw2hd8,/r/pennystocks/comments/bm606i/mrs_mission_ready_solutions_the_real_10x_bagger/emw2hd8/,1,"The same companies that were awarded the $4 billion. So what happened is that the original ceiling was supposed to be $33 billion over a 10 year period (see link: https://govtribe.com/opportunity/federal-contract-opportunity/special-operations-equipment-soe-tailored-logistics-support-tls-spe8ej18r0001)

This did not happen because of the ADS Tactical debacle. They were getting kicked out and losing their small business status so which is why they awarded a BRIDGE contract for the next 365 days expiring on March 3rd 2020 or around there. Around that time, the dust should settle with ADS and then they'll be only 5 approved DLS/SOE certified companies. I am sure Unifire will be one of them.

Atlantic Diving Supply used to take 90% of the contracts so kicking them out was a big move. 2019 is the last time they'll be able to bid on these small business contracts. How can a company who made 2.5 billion last year be considered a small business? Good thing tthey kicked them out!

Look, the bottom line is that these people defrauded the military - https://www.washingtonpost.com/news/capital-business/wp/2017/08/11/scuba-supply-company-pays-16-million-to-settle-allegations-it-defrauded-the-military/?utm_term=.7f7d3744a451",2019-05-08
188,nitrouz,emw2oic,/r/pennystocks/comments/bm606i/mrs_mission_ready_solutions_the_real_10x_bagger/emw2oic/,1,"The original 6 companies currently are
1) Unifire
2) Atlantic Diving Supply
3) Quantico Tactical
4) W.S Darley &amp; Co
5) Federal Resources
6) Tactical and Survival Specialties

https://dod.defense.gov/News/Contracts/Contract-View/Article/1779133/",2019-05-08
189,Vivid82,emw3sz1,/r/pennystocks/comments/bm606i/mrs_mission_ready_solutions_the_real_10x_bagger/emw3sz1/,1,Also the reason they expect to get more of those contracts now is because due to the merger with MRS they can now excess a credit facility which allows them to bid on the larger contracts.,2019-05-08
190,MrRipShitUp,emw5mv9,/r/pennystocks/comments/bm8hpi/positions_on_bemg/emw5mv9/,1,I am,2019-05-08
191,NG06,emw5z3u,/r/pennystocks/comments/bm606i/mrs_mission_ready_solutions_the_real_10x_bagger/emw5z3u/,1,On Schwab ticker msnvf,2019-05-08
192,Azuwho,emwb67u,/r/pennystocks/comments/bm9wwt/59_watch_list/emwb67u/,1,You’re good. See that 2 hour MACD cross over? Watch to see if the 4 hour is ending near term but on the 2 hourly chart since it entered the red zone you want to watch the 1 hourly to make sure and confirm a reversal. That dip was a bloodbath,2019-05-08
193,IrRoscoeMr,emwfaf1,/r/pennystocks/comments/bm606i/mrs_mission_ready_solutions_the_real_10x_bagger/emwfaf1/,1,Ive been trying to find the value of their newest patent but ive been coming up short.,2019-05-08
194,IrRoscoeMr,emwi5vf,/r/pennystocks/comments/bm606i/mrs_mission_ready_solutions_the_real_10x_bagger/emwi5vf/,1,"https://patents.justia.com/inventor/yolita-nugent

From no contact. I didnt see it included in the financials. I believe this is what was showcased on twitter by Martinez awhile ago.",2019-05-08
195,Peechz,emwiwvd,/r/pennystocks/comments/bm94vj/wkhs/emwiwvd/,1,"Yeah, all based on a tweet... Shit just blows my mind. Do you expect it to just fall off in the morning? There's no way it's gonna hold for long.",2019-05-08
196,kquillen07,emwoab0,/r/pennystocks/comments/bm94vj/wkhs/emwoab0/,1,Ill hold till it drops under 2.40,2019-05-08
197,levinorthdesign,emwonr4,/r/pennystocks/comments/bm94vj/wkhs/emwonr4/,1,"[https://www.bizjournals.com/cincinnati/news/2019/05/09/workhorse-spokesman-postal-service-vehicles-may.html](https://www.bizjournals.com/cincinnati/news/2019/05/09/workhorse-spokesman-postal-service-vehicles-may.html)

&amp;#x200B;

do you think this will drop price?",2019-05-08
198,kquillen07,emwsbze,/r/pennystocks/comments/bm94vj/wkhs/emwsbze/,1,So what your saying is hold on to it lol,2019-05-08
199,amg,emwtfm2,/r/pennystocks/comments/bm94vj/wkhs/emwtfm2/,1,"&gt; grab and go

Well said, good advice for a lot of stocks on this sub. But we all have our *darlings*, I suppose.",2019-05-08
200,carnthesaints,emwz2yf,/r/pennystocks/comments/bm85fm/bemg_at_04/emwz2yf/,1,So selling loans to people with shitty credit who can't get a loan by conventional means? That's really not such a great sector.,2019-05-08
201,HoDgePoDgeGames,emx42jx,/r/pennystocks/comments/bm94vj/wkhs/emx42jx/,1,"Still holding? (serious question not trolling) 

[Down 10%](https://finance.yahoo.com/quote/WKHS?p=WKHS)",2019-05-08
202,kquillen07,emx74oa,/r/pennystocks/comments/bm94vj/wkhs/emx74oa/,1,Sold 30 kept 10,2019-05-08
203,market_notify,emx9p0a,/r/pennystocks/comments/blziez/watchlist_58/emx9p0a/,1,Sweeeeet!,2019-05-08
204,MagicFeet,emxbkpi,/r/pennystocks/comments/bm8hpi/positions_on_bemg/emxbkpi/,1,Having 5k shares at 0.05. Probably will pyramid in within the week.,2019-05-08
205,datboi3637,emxpqbv,/r/pennystocks/comments/bm606i/mrs_mission_ready_solutions_the_real_10x_bagger/emxpqbv/,1,Why is the post nsfw,2019-05-08
206,sephresx,emxr4vh,/r/pennystocks/comments/bm8hpi/positions_on_bemg/emxr4vh/,1,"got in with 2000 shares this morning at .05, here's to hoping!!!",2019-05-08
207,SNPowers86,emxy7fh,/r/pennystocks/comments/bm6nq3/kgkg/emxy7fh/,1,You need discipline. You might win this time but ur fucked over the long run. Take ur % and go,2019-05-08
208,Wonderbread003,emz0lir,/r/pennystocks/comments/bm8hpi/positions_on_bemg/emz0lir/,1,I only bought 2k as well,2019-05-08
209,DonKevinho,emz9usx,/r/pennystocks/comments/bm75sa/adom/emz9usx/,1,Sold last night and bought on the dip early,2019-05-08
210,shorgarr,emzft1t,/r/pennystocks/comments/bm9py8/kgkg_psiq_atev_abce/emzft1t/,1,Been holding for over a year on this one,2019-05-08
211,spoiler_dave,emzpvw3,/r/pennystocks/comments/bm85fm/bemg_at_04/emzpvw3/,1,Actually what they're doing is pretty brilliant. I'm not buying into the Uber/Lyft IPO nonsense because there's no direct correlation one way or another. What they're doing is more or less credit counseling and fast-pathing people that want to earn with Uber/Lyft to be able to afford newer vehicles (required by both companies in order to drive for them). They're doing this by working with dealers who have overstock and basically setting up short-term leases where the dealer gets paid and the customer gets to drive for Uber/Lyft and make money. It's a very interesting ecosystem. The same is true for the mortgage. When buyers are turned down (or will have to pay higher rates) because of credit rating issues Get Credit Healthy acts as an intermediary to the broker/lender and helps fix the consumers credit. In the meantime the consumer is paying GCH a certain amount per month for their services. They're making revenue already which can't be said for many of the bio-pharms out there with big promises and living on grants.,2019-05-08
212,idonthavehobbies,en0bjqc,/r/pennystocks/comments/bm9py8/kgkg_psiq_atev_abce/en0bjqc/,1,"Ya, I think with the release of results last year a lot of people bought in and have been holding.  

This trial really is the make it or break it for Antibes.",2019-05-08
213,freshbalk2,en0o5q9,/r/pennystocks/comments/bm5nfo/kgkg_hope_you_all_listened/en0o5q9/,1,got any other stocks youre interested in?,2019-05-08
214,hyrotter,en0st9j,/r/pennystocks/comments/bm606i/mrs_mission_ready_solutions_the_real_10x_bagger/en0st9j/,1,I'm in...just waiting for the rest of the market to catch on,2019-05-08
215,upsideDownAlex,en22u9s,/r/pennystocks/comments/bmccis/htrc/en22u9s/,1,"The float is ridiculously low, and I wanted to see if anyone could verify it",2019-05-08
