,author,id,url,score,text,date
134,akalocke,ehvliro,/r/pennystocks/comments/axpwwq/dss_up_70_today/ehvliro/,1,I made like 3% off them from a sale I did two days ago..... FML,2019-03-05
135,Smilezp12,ehvmd8g,/r/pennystocks/comments/axmq0g/ryu/ehvmd8g/,1,Lolll true,2019-03-05
136,chrish_850,ehvmepp,/r/pennystocks/comments/axm82l/arsn_on_the_move/ehvmepp/,1,Yeah I have no plans of selling anytime soon at the rate they are gaining locations for sales. Will pick up more on a good dip,2019-03-05
137,Kappa996,ehvnb6q,/r/pennystocks/comments/axpkzv/i_posted_about_rxmd_a_few_days_ago_but/ehvnb6q/,1,Any news that should be coming up to make this happen?,2019-03-05
138,LonghornzR4Real,ehvng6w,/r/pennystocks/comments/axp1n4/2_simple_day_trading_strategies/ehvng6w/,1,Investopedia.com would be a good start.  ,2019-03-05
139,canieatthis1,ehvnv3f,/r/pennystocks/comments/axpkzv/i_posted_about_rxmd_a_few_days_ago_but/ehvnv3f/,1,"-Closing of $18M revenue generating pharmacy acquisition which will double existing revenue.

-CBD partnership 

- 3rd year of audited financials 

- SEC Registration

",2019-03-05
140,Kappa996,ehvnxsf,/r/pennystocks/comments/axpkzv/i_posted_about_rxmd_a_few_days_ago_but/ehvnxsf/,1,"Cool, I’ll look into it.",2019-03-05
141,Extra-Extra,ehvo33w,/r/pennystocks/comments/axrdmt/gdet_whos_in_for_the_001_rally/ehvo33w/,1,"Why do I notice a lot of stocks like these at one point had a high price? This one (according to google) had an apparent $600,000 price, even though that makes no sense. ",2019-03-05
142,Crypto556,ehvot6h,/r/pennystocks/comments/axrdmt/gdet_whos_in_for_the_001_rally/ehvot6h/,1,"Reverse splits. Nobody actually paid $600,000 for a share. They paid $600,000 for an equivalent stake in the company. ",2019-03-05
143,scottwagoner,ehvrd2z,/r/pennystocks/comments/axp1n4/2_simple_day_trading_strategies/ehvrd2z/,1,I feel OP doesn’t have enough Karma. Take my upvote and follow new friend. ,2019-03-05
144,Extra-Extra,ehvrg87,/r/pennystocks/comments/axrdmt/gdet_whos_in_for_the_001_rally/ehvrg87/,1,Ahhh much more understandable. It made zero sense to me and I overlooked that possibility. Thanks for the quick reply!,2019-03-05
145,FunnyOrPie,ehvs4dy,/r/pennystocks/comments/axrdmt/gdet_whos_in_for_the_001_rally/ehvs4dy/,1,Kate pierogi on YouTube yakks about the next 100x,2019-03-05
146,miamidd12,ehvsb44,/r/pennystocks/comments/axrdmt/gdet_whos_in_for_the_001_rally/ehvsb44/,1,Bought at $0.0045 I think its a really good entry ,2019-03-05
147,[deleted],ehvscdx,/r/pennystocks/comments/axrdmt/gdet_whos_in_for_the_001_rally/ehvscdx/,1,[removed],2019-03-05
148,999stone,ehvugh1,/r/pennystocks/comments/axrdmt/gdet_whos_in_for_the_001_rally/ehvugh1/,1,What is the ask price when you try to buy this stock? Mine is showing an ask of 0.2553 and a bid of 0.001 on TD Ameritrade. Am I missing something? ,2019-03-05
149,miamidd12,ehvuvln,/r/pennystocks/comments/axrdmt/gdet_whos_in_for_the_001_rally/ehvuvln/,1,Maybe because it is after market hours it will update tomorrow morning ,2019-03-05
150,Semper_Rejecto,ehvvn9t,/r/pennystocks/comments/axrdmt/gdet_whos_in_for_the_001_rally/ehvvn9t/,1,I'd like to see a rally. ,2019-03-05
151,[deleted],ehvvxd9,/r/pennystocks/comments/axrdmt/gdet_whos_in_for_the_001_rally/ehvvxd9/,1,[removed],2019-03-05
152,WolfofLawlStreet,ehvw2uk,/r/pennystocks/comments/axrdmt/gdet_whos_in_for_the_001_rally/ehvw2uk/,1,$DRYS is like 46 million. ,2019-03-05
153,miamidd12,ehvw4d4,/r/pennystocks/comments/axrdmt/gdet_whos_in_for_the_001_rally/ehvw4d4/,1,Yessir!,2019-03-05
154,Strackles,ehvwurq,/r/pennystocks/comments/axrdmt/gdet_whos_in_for_the_001_rally/ehvwurq/,1,"What makes you think it's gonna go on another run? And could you include a source if you have one?
",2019-03-05
155,miamidd12,ehvwxqc,/r/pennystocks/comments/axrdmt/gdet_whos_in_for_the_001_rally/ehvwxqc/,1,what do yo mean not getting it ,2019-03-05
156,financenoob4,ehvwzcj,/r/pennystocks/comments/axp0vc/krfg_thoughts/ehvwzcj/,1,How do you know when to go in? I averaged down this morning only to have it drop a shit ton more until I said fuck it and sold,2019-03-05
157,NG06,ehvy8v5,/r/pennystocks/comments/axm972/win/ehvy8v5/,1,"Why do you say it's a strong play. In your opinion, what makes it that?",2019-03-05
158,TwentiiJimmii,ehvybi6,/r/pennystocks/comments/axm972/win/ehvybi6/,1,"A little off topic.. but there should be a sticky at the top of the sub that says ""Don't see the ticker on Robinhood? Here's why."" 😂

I'm fairly new to trading myself but damn that Robinhood question pops up a lot on here. Just saying.",2019-03-05
159,inv998,ehvypw3,/r/pennystocks/comments/axq2dz/onehour_delivery_service_holds_potential_to/ehvypw3/,1,Paid promotion stock.,2019-03-05
160,therealmaclaren,ehvze4q,/r/pennystocks/comments/axp7lz/ubqu_reports_a_net_profit_in_2018/ehvze4q/,1,I first got into UBQU at 0.0009......I am a new trader and didn’t know about stop loss. As of right now I have 2.3 million shares with a average of 0.0004. Waiting for a breakout to take it back to .001 ,2019-03-05
161,canieatthis1,ehw0dsc,/r/pennystocks/comments/axm972/win/ehw0dsc/,1,"Because the word bankruptcy spreads fear &amp; with that people panic and overreact. Business will continue, and the filing for chapter 11 protection is the best step forward. They’ll have access to capital and resources they need to continue building. ",2019-03-05
162,NG06,ehw0fe2,/r/pennystocks/comments/axm972/win/ehw0fe2/,1,Thank you. ,2019-03-05
163,canieatthis1,ehw0jlb,/r/pennystocks/comments/axm972/win/ehw0jlb/,1,"No problem but this is also my opinion.  Don’t make any decisions based on what I say, it’s in you. ",2019-03-05
164,NG06,ehw0m79,/r/pennystocks/comments/axm972/win/ehw0m79/,1,"Agreed, thank for the input. ",2019-03-05
165,Jimbo_eh,ehw18fa,/r/pennystocks/comments/axp0vc/krfg_thoughts/ehw18fa/,1,"Don’t panic it’s normal just wait for everything to be finalized and news to get released, nervous people gonna run and it’ll probably drop more but it should make another run ",2019-03-05
166,[deleted],ehw1f0c,/r/pennystocks/comments/axrdmt/gdet_whos_in_for_the_001_rally/ehw1f0c/,1,[removed],2019-03-05
167,canieatthis1,ehw1j5h,/r/pennystocks/comments/axm972/win/ehw1j5h/,1,"Penny stocks are actually considered to most as stocks under $5.00. 

OTC could be considered the bottom of the barrel with stocks well over $5.00 but also low as .0000001 or whatever. 

Robinhood just gay tbh lol ",2019-03-05
168,miamidd12,ehw245r,/r/pennystocks/comments/axrdmt/gdet_whos_in_for_the_001_rally/ehw245r/,1,"I was doing some research and the % volume shorted when it was trading between 002 - 003  its huge, now its about 40% up from there and buying keeps coming in which leads me to believe (90% sure) that there is a short squeeze coming to over $0.01 - $0.015 ",2019-03-05
169,calvin50,ehw26tb,/r/pennystocks/comments/axp0vc/krfg_thoughts/ehw26tb/,1,"There’s a good chance it’s going to lose even more tomorrow morning. If you look at the last 3 days it’s dropped every morning. About 1 yesterday it started a steady fall and I believe it would have started climbing again but the market was in a downward trend this morning. Even if it drops tomorrow it should snap  Back to .004 . The way you can tell this is the RSI 
Every time it gets to around 30 it bounces . If you go back three days the stock bounces at the 30 . Today if you bring the RSI line up to 50 you find that it only crosses once  and touches a few times . If you go back the last couple of days it touches the 30 ( that’s where people want to buy . The price is irrelevant)but draw a line at the 50 . Big trends and some almost oversolds.
So we know this stock bounces at30( no stock is the same) and if it has volume will climb after 50 .we also know people want it because it doesn’t get to 20 . There wasn’t a panic sell today because it never got oversold.
So if I wanted to buy in this stock today I would watch the RSI as it went down while looking all the way back to the beginning of the spike . The first resistance is .0045 the second.0055 and so on . Those resistances are now support line but which one is strong. The support that people want to buy at is strong support. I believe that’s going to be the .0045 . It could fall through that tomorrow but it should come back to and float around it until it continues down or starts it’s uptrend back . It takes some practice with different stocks but all your looking for is what number is the buying going on",2019-03-05
170,miamidd12,ehw28lc,/r/pennystocks/comments/axrdmt/gdet_whos_in_for_the_001_rally/ehw28lc/,1,plus the company is really active with news and current otc markets everything looking in the right direction ,2019-03-05
171,financenoob4,ehw2mwk,/r/pennystocks/comments/axp0vc/krfg_thoughts/ehw2mwk/,1,"Thanks for the advice, appreciate it. Still learning charts and indicators. Also where do you find your stocks from? ",2019-03-05
172,calvin50,ehw2pex,/r/pennystocks/comments/axp0vc/krfg_thoughts/ehw2pex/,1,I watch videos every night ,2019-03-05
173,999stone,ehw5kcd,/r/pennystocks/comments/axrdmt/gdet_whos_in_for_the_001_rally/ehw5kcd/,1,That's what I'm hoping. Thanks.,2019-03-05
174,miamidd12,ehw7otf,/r/pennystocks/comments/axrdmt/gdet_whos_in_for_the_001_rally/ehw7otf/,1,Excited for tomorrow ,2019-03-05
175,RobbieBee,ehw8uj7,/r/pennystocks/comments/axpkzv/i_posted_about_rxmd_a_few_days_ago_but/ehw8uj7/,1,Been following this. Hopefully their acquisition goes through. They seem to be in a steady growth phase. Mayenter longand add on dips.  Main concern is how they differe iatefeom other smaller pharmacies.,2019-03-05
176,drowpro,ehwazm8,/r/pennystocks/comments/axow8a/srmx_winning/ehwazm8/,1,"Probably will drop down a little bit, but one of those that won’t surprise me if it reaches a penny or two...sell  what you put and make a little profit and let the rest ride",2019-03-05
177,TwentiiJimmii,ehwb3o8,/r/pennystocks/comments/axm972/win/ehwb3o8/,1,Got you! I just know I see that a lot on here haha,2019-03-05
178,drowpro,ehwbdlj,/r/pennystocks/comments/axow8a/srmx_winning/ehwbdlj/,1,"If you held on, it may drop some more, but it could also be one of those rare triple 000’s that reaches a penny or two within a couple weeks. I would sell some to get your buy in back and let the rest ride until you feel the steam running out.",2019-03-05
179,Veljeezy,ehwht5c,/r/pennystocks/comments/axm972/win/ehwht5c/,1,Just ordered 310. We going all in?,2019-03-05
180,calvin50,ehwtjdw,/r/pennystocks/comments/axrdmt/gdet_whos_in_for_the_001_rally/ehwtjdw/,1,Another run will depend on a few things. The volume needs to stay above 50 million or 30 percent for a continuation . In this run . What I’m hoping is it holds the .0045-.0035 range with lower volume 10-20 million. That would indicate some confidence.Then all that you’re waiting on is some good news. I’m going to hold to see if this happens but there is a strong chance I’ll be wrong and it will just continue down till some big news comes.,2019-03-05
181,Unknownlizard1,ehwuo4v,/r/pennystocks/comments/axp1n4/2_simple_day_trading_strategies/ehwuo4v/,1,Yep,2019-03-05
182,samjones1231,ehwxmhj,/r/pennystocks/comments/axp1n4/2_simple_day_trading_strategies/ehwxmhj/,1,"Y'all should read this before clicking: 
https://www.fscomeau.com/why-technical-analysis-is-bullshit/",2019-03-05
183,[deleted],ehx13te,/r/pennystocks/comments/axmgsg/leas/ehx13te/,1,[removed],2019-03-05
184,Thatspritelife,ehxm4pf,/r/pennystocks/comments/axq2dz/onehour_delivery_service_holds_potential_to/ehxm4pf/,1,is $PTNYF their ticker symbol?,2019-03-05
185,capitalgrowth,ehxmt7z,/r/pennystocks/comments/axq2dz/onehour_delivery_service_holds_potential_to/ehxmt7z/,1,Yes Parcel Pal,2019-03-05
186,fallendissent,ehym2zh,/r/pennystocks/comments/axp1n4/2_simple_day_trading_strategies/ehym2zh/,1,"No one said it was a
Guarantee, it's only a piece of the puzzle and saying it has no value is verifiably false",2019-03-05
187,JonMQuiles,ehyoruj,/r/pennystocks/comments/axmgsg/leas/ehyoruj/,1,News the that CEO a scam artist and this company is scam so not a good look u pumping ,2019-03-05
188,johnyt3,ehyq70g,/r/pennystocks/comments/axp1n4/2_simple_day_trading_strategies/ehyq70g/,1,The fuck did I tell you about clickbait? HUH?,2019-03-05
189,Nottheface1337,ehyx00k,/r/pennystocks/comments/axmgsg/leas/ehyx00k/,1,"Says the guy taking pics of his dog while pooping lol. That being said. I would do the same...respect. You also seem as new to trading as I am. I was in at .0012 and made great money off the swings. Was very fortunate to get in so early and continued to increase my position thank to early sellers. This is less a pump and dump and more a tentative RM announcement, gap, consolidation, and longish hold for hopefully more profits...that’s the plan...no pumping and dumping here by me. Happy hunting. ",2019-03-05
190,samjones1231,ehyz6m8,/r/pennystocks/comments/axp1n4/2_simple_day_trading_strategies/ehyz6m8/,1,"""should read"" as in buyer beware not as in believe like the Bible. ",2019-03-05
191,sgtwtf22,ei0c666,/r/pennystocks/comments/axrdmt/gdet_whos_in_for_the_001_rally/ei0c666/,1,Do any of you want to mail your current debit card to get a metal copy made?,2019-03-05
192,SoQrates,ei15dez,/r/pennystocks/comments/axp1n4/2_simple_day_trading_strategies/ei15dez/,1,Haha ok ok no click bait thumbnails.,2019-03-05
193,Gnaquoia,ei21di8,/r/pennystocks/comments/axp1n4/2_simple_day_trading_strategies/ei21di8/,1,I’m with you man using historical info to predict future trading outcomes violates even weak form market efficiency. Just economics. I enjoyed reading the article!,2019-03-05
194,swistydreams,ei37jf5,/r/pennystocks/comments/axp1n4/2_simple_day_trading_strategies/ei37jf5/,1,Lol the guy who wrote the article is from wsb))))),2019-03-05
195,Semper_Rejecto,eiaalmj,/r/pennystocks/comments/axrdmt/gdet_whos_in_for_the_001_rally/eiaalmj/,1,Are we starting the next run today?,2019-03-05
196,StratTeleBender,eibc45x,/r/pennystocks/comments/axp1n4/2_simple_day_trading_strategies/eibc45x/,1,"TA showed me that SPY was going to breakout today. TA showed me the support levels that BA failed to break below today which hinted that it was going to break higher. A cup and handle on JNJ showed me 100% profits on my calls. 

TA is about support, resistance, and patterns of psychological behavior in the market. Each pattern must be adhered to and breakouts must confirm the expected move. Your boy who wrote the article sited multiple incorrect patterns in the article with failed breakouts and then used improper English to bitch about them. ",2019-03-05
197,foonojil,eiga16z,/r/pennystocks/comments/axrdmt/gdet_whos_in_for_the_001_rally/eiga16z/,1,I bought in. 0054 and just sold today for. 0176.  I'm good,2019-03-05
198,daytradeguru,eiixhhe,/r/pennystocks/comments/axrdmt/gdet_whos_in_for_the_001_rally/eiixhhe/,1,Nice run! Go $GDET,2019-03-05
199,exirn,emeajxy,/r/pennystocks/comments/axp1n4/2_simple_day_trading_strategies/emeajxy/,1,One month later he posted that: [https://www.fscomeau.com/i-was-wrong-technical-analysis-is-gods-gift-to-humanity/](https://www.fscomeau.com/i-was-wrong-technical-analysis-is-gods-gift-to-humanity/),2019-03-05
