,author,id,url,score,text,date
0,igormsts,efwz15q,/r/pennystocks/comments/anyia1/shmp_last_chance_to_get_in/efwz15q/,1,Yes... I bought in at .02 also but got only 75k shares. I’m in it for the long haul. ,2019-02-07
1,dcstockjvm,efwz92r,/r/pennystocks/comments/anyia1/shmp_last_chance_to_get_in/efwz92r/,1,75k is still a good amount! Congrats man! ,2019-02-07
2,igormsts,efx07zs,/r/pennystocks/comments/anyia1/shmp_last_chance_to_get_in/efx07zs/,1,"Yeah thanks to u.
 For the advice. First year in stocks so kind of following along some people until I get the hang of it. ",2019-02-07
3,dcstockjvm,efx0c7v,/r/pennystocks/comments/anyia1/shmp_last_chance_to_get_in/efx0c7v/,1,"No prob man, good luck out there.",2019-02-07
4,Yeezy4twenty24,efx11rh,/r/pennystocks/comments/anyqnq/pura_to_go/efx11rh/,1,How many employees? Where are the headquartered?,2019-02-07
5,Yeezy4twenty24,efx16d6,/r/pennystocks/comments/anyqnq/pura_to_go/efx16d6/,1,Is this the same company that made you donate money for your their Christmas party that was hosted over your lunch break?,2019-02-07
6,macG224,efx349d,/r/pennystocks/comments/anym96/argw_disappearance/efx349d/,1,"Happened to one of my random penny stocks a few months ago , it came back with a slightly different name and I have no clue what the reason was.  GL
",2019-02-07
7,scottwagoner,efx46qr,/r/pennystocks/comments/anyia1/shmp_last_chance_to_get_in/efx46qr/,1,"I agree! My avg is .023. I’m very pissed Interactive Brokers sold 97 shares without informing beforehand they were doing so to cover my monthly fee! 

Regardless, I’m long and strong! But wish I had a TON more",2019-02-07
8,SoYouLikeShitposts,efx8f1z,/r/pennystocks/comments/anyia1/shmp_last_chance_to_get_in/efx8f1z/,1,"&gt;I’m very pissed Interactive Brokers sold 97 shares without informing beforehand they were doing so to cover my monthly fee!

Ouch, that sucks. I use IBKR as my main broker too. I read in their ToS that if you dont make a certain amount in commission from trades a month then you will get hit with a maintaince fee. If you dont have enough in your cash balance then they will liquidate a position in order to cover it. I setup a monthly 20$ recurring deposit just to avoid having that happen.",2019-02-07
9,bralyo,efx9kj3,/r/pennystocks/comments/anyia1/shmp_last_chance_to_get_in/efx9kj3/,1,I got out today... Good run,2019-02-07
10,dcstockjvm,efx9lql,/r/pennystocks/comments/anyia1/shmp_last_chance_to_get_in/efx9lql/,1,Too soon man. She still has a lot left. ,2019-02-07
11,redbeerded,efx9ykr,/r/pennystocks/comments/anyqnq/pura_to_go/efx9ykr/,1,"Sigh* 

But no! I would not do that to you (or anyone). ",2019-02-07
12,Yeezy4twenty24,efxbonk,/r/pennystocks/comments/anyqnq/pura_to_go/efxbonk/,1,I’m in! 🤑,2019-02-07
13,monclerman,efxead6,/r/pennystocks/comments/anyia1/shmp_last_chance_to_get_in/efxead6/,1,My friends think I’m crazy when I talk about this stock. ,2019-02-07
14,lembo916,efxje5g,/r/pennystocks/comments/anyia1/shmp_last_chance_to_get_in/efxje5g/,1,"I'm still here with you brother! Looking forward to the harvest and will decide what to do from there as well. All I know is if this lotto works out the way it's shaping up to, I'm going to seriously crush a ton of shrimp on the day I sell. ",2019-02-07
15,calvin50,efxslmz,/r/pennystocks/comments/anym96/argw_disappearance/efxslmz/,1,"Trading at .58 this morning with an average of 58 k volume 
Last news was January 31 
There was no movement yesterday ",2019-02-07
16,calvin50,efxt8pd,/r/pennystocks/comments/anyia1/shmp_last_chance_to_get_in/efxt8pd/,1,"As porky would say abide abide that’s all folks 
May retest.29 c but then expect a fall today and tomorrow I could be wrong anything is possible but I try to go by charts 
As for news unless it’s phenomenal I don’t see it changing much 
GREAT RUN ",2019-02-07
17,thetoycannon,efxtcua,/r/pennystocks/comments/ao2rk8/banco_sabadell/efxtcua/,1,Welcome to penny stock paranoia,2019-02-07
18,calvin50,efxtrgy,/r/pennystocks/comments/ao2rk8/banco_sabadell/efxtrgy/,1,"Get on UTUBE and study everything you can find on trading stocks before you invest another dime
David Moadel
Tim Sykes
Ross Cameron
Are just a few
",2019-02-07
19,kdyz,efxu5sx,/r/pennystocks/comments/ao2rk8/banco_sabadell/efxu5sx/,1,"I actually did the Jason Bonds one, thanks for the other suggestions though- going to watch them later",2019-02-07
20,bralyo,efxu66u,/r/pennystocks/comments/anyia1/shmp_last_chance_to_get_in/efxu66u/,1,She does... Right back to .02,2019-02-07
21,calvin50,efxu6n7,/r/pennystocks/comments/anyqnq/pura_to_go/efxu6n7/,1,"All I can say is the RSI shows it’s at fair value 
I’m going to wait for volume to come in 
Good hunting ",2019-02-07
22,dcstockjvm,efxu9ek,/r/pennystocks/comments/anyia1/shmp_last_chance_to_get_in/efxu9ek/,1,Lol same. I called my tax guy and now he wants to know more about OTC stocks lol,2019-02-07
23,dcstockjvm,efxubk6,/r/pennystocks/comments/anyia1/shmp_last_chance_to_get_in/efxubk6/,1,Right! I was thinking about bouncing after the harvest but I have a feeling this may actually go up if they can prove what they say they can do. ,2019-02-07
24,heliogt2,efxvhh5,/r/pennystocks/comments/anyqnq/pura_to_go/efxvhh5/,1,"this has been in play for years. I suggest getting up with the backstory. Related tickers is USMJ, common ownership

&amp;#x200B;

[https://www.aciconglomerated.com/aci](https://www.aciconglomerated.com/aci)",2019-02-07
25,podkirby,efxxitv,/r/pennystocks/comments/anyia1/shmp_last_chance_to_get_in/efxxitv/,1,So I use Robinhood for stocks. The Robinhood doesn't list many penny stocks. What sites are you guys using for buying/trading?,2019-02-07
26,dcstockjvm,efxxnjo,/r/pennystocks/comments/anyia1/shmp_last_chance_to_get_in/efxxnjo/,1,I have Fidelity Investments. $4.95 a trade. They have a nice platform too. Plus it links to my retirement accounts.,2019-02-07
27,monclerman,efxxrms,/r/pennystocks/comments/anyia1/shmp_last_chance_to_get_in/efxxrms/,1,"Right ? Short some, but definitely hold some kind of position for the long. This patent is exclusively theirs.. there is no way this company will be a penny stock forever.",2019-02-07
28,devin1420,efxxxw7,/r/pennystocks/comments/anyia1/shmp_last_chance_to_get_in/efxxxw7/,1,What's a good amount of money to invest I don't have 60 grand to invest ,2019-02-07
29,inv998,efxy8o3,/r/pennystocks/comments/anyia1/shmp_last_chance_to_get_in/efxy8o3/,1,"Congrats. I am neutral on the stock. In your previous post you link the Yahoo news Harbinger report on SHMP.  If you read the full report you will see.

"" Disclaimer This report was prepared for informational purposes only.  Harbinger Research, LLC (“Harbinger”) was paid $5,000 in cash by Casson Communications,  LLCfor the  preparation and distribution of this updated research reportin the  context of a  broader shareholder  communications  program. All  information  contained  in  this  report  was  provided  by  the  Company.""

This is highlighted.

 ""Harbinger did not make an independent investigation or inquiry as to the accuracy of any information provided by the Company and is relying solely upon information provided by the Company for the accuracy and completeness of all such information. """,2019-02-07
30,Krisforfun,efxyjic,/r/pennystocks/comments/ao3u8u/premier_health_announces_partnership_strategy_for/efxyjic/,1,"In my opinion they're valuable if what the article suggests is true. Opening the monopoly  in government to up for private companies to bid on.

Universal healthcare is not going anywhere in Canada, so if PHGI can score some kind of contract, that's guaranteed winning. 

https://www.cbc.ca/news/canada/toronto/ndp-healthcare-leak-1.5004685",2019-02-07
31,dcstockjvm,efxylji,/r/pennystocks/comments/anyia1/shmp_last_chance_to_get_in/efxylji/,1,They are having a Third Party verify their upcoming harvest. So we shall soon...if they are the real deal or all talk.  ,2019-02-07
32,amphetaminesfailure,efxym1y,/r/pennystocks/comments/anyia1/shmp_last_chance_to_get_in/efxym1y/,1,"Too many people refuse to accept that there are success stories with otc traded companies.  They see them as just stocks to flip and make a few bucks.  Now obviously it can't be denied that they're rare.  Of course they are.  But it success still happens multiple times a year.  

Every year I usually have around five companies that I will end up putting my faith in as long term holds because I think they will be successful.  Am I only right on one or *maybe* two of them?  Absolutely.  And I end up losing on the rest.  But I more than make up for it on the ones I'm right.  And I only make these type of investments with money I can burn in the first place.  

A lot of people are really neglecting the technology this company has created and patented.  This investment isn't about ""shrimp"".  It's about technology that has the *potential* to revolutionize an entire industry.  

I do regret only getting in for 5k shares on this one, but I was in at .035 but I'm still looking at a good profit if things continue to go well with the company.  ",2019-02-07
33,amphetaminesfailure,efxyn1g,/r/pennystocks/comments/anyia1/shmp_last_chance_to_get_in/efxyn1g/,1,I got called Buba.  ,2019-02-07
34,dcstockjvm,efxypzq,/r/pennystocks/comments/anyia1/shmp_last_chance_to_get_in/efxypzq/,1,"100% 

To be honest, I have ZERO cares about if they sell shrimp to market. It’s all about the technology. ",2019-02-07
35,amphetaminesfailure,efxz8j9,/r/pennystocks/comments/anyia1/shmp_last_chance_to_get_in/efxz8j9/,1,"The attitude a lot of people have, especially on this sub, is why they all say there's no money to be made in penny stocks.  I might only make a few hundred dollars a week making short term trades, but that's money that gets invested into the handful of stocks I see having potential to break through a dollar or more.  And I've made good money that way.  ",2019-02-07
36,miamidd12,efxzfqk,/r/pennystocks/comments/ao41zv/aabb_news_asia_metals_expands_gold_mining/efxzfqk/,1,Looks ready to bounce from these levels,2019-02-07
37,unix233,efxzxlw,/r/pennystocks/comments/ao442q/premier_health_group_phgi_phgrf_announces/efxzxlw/,1,"Massive news, company is on its way to multi millions more. cheap shares time to absorb it while we can. ",2019-02-07
38,calvin50,efy0j1e,/r/pennystocks/comments/anyia1/shmp_last_chance_to_get_in/efy0j1e/,1,"I don’t paper trade so I started with 100$ (that’s what I could afford to lose) how much can you lose 
I’ve had people tell me they started with 6000$ and lost it
Here’s your goal with what ever you decide to start with try and gain 10 percent a trade 
But don’t lose more than 5 percent a trade 
I know that doesn’t sound like much but that’s a win win
Only other thing is study study study",2019-02-07
39,jameson62,efy1i0o,/r/pennystocks/comments/ao442q/premier_health_group_phgi_phgrf_announces/efy1i0o/,1,"You see this part of the PR: 

&amp;#x200B;

&gt;Additionally, the Company has been in discussions with a short list of Canadian Licensed Producers (LP) under the Access to Cannabis for Medical Purposes Regulations (ACMPR) in order to partner with a, or multiple, LP(s) to provide doctor and patient education at the clinic level.

&amp;#x200B;",2019-02-07
40,Greeph16,efy1j1h,/r/pennystocks/comments/ao2rk8/banco_sabadell/efy1j1h/,1," Spanish banks are not trustworthy, Bankia was in the shithole for thought 2011 and 2012 and the bank and the government lied about the situation of the bank to investors and consumers .I personally lost a lot of money with this bank . 

Sorry if the grammar is bad ",2019-02-07
41,FollowTheMoney23,efy1t0r,/r/pennystocks/comments/ao442q/premier_health_group_phgi_phgrf_announces/efy1t0r/,1,Agreed diamond in the Mj sector not many know about. ,2019-02-07
42,driv818,efy2iw1,/r/pennystocks/comments/ao442q/premier_health_group_phgi_phgrf_announces/efy2iw1/,1,"Yes and also they expect to provide additional updates in Q1 2019, exciting.",2019-02-07
43,DreamGirL11,efy2khy,/r/pennystocks/comments/ao442q/premier_health_group_phgi_phgrf_announces/efy2khy/,1,wonder who the companies are,2019-02-07
44,dcstockjvm,efy2ork,/r/pennystocks/comments/anyia1/shmp_last_chance_to_get_in/efy2ork/,1,You are a smart man. ,2019-02-07
45,ckbikes1,efy2p65,/r/pennystocks/comments/anyqnq/pura_to_go/efy2p65/,1,I bought 15k @ .13,2019-02-07
46,amphetaminesfailure,efy37kn,/r/pennystocks/comments/anyia1/shmp_last_chance_to_get_in/efy37kn/,1,"If I really was I wouldn't have kept faith in HIPH.  They had a big dip last year after the Super Bowl, but I kept with them because of their recent finance arrangement and acquisition LOI for two other brands.  

Not to say I think they're going to end up a total loss, but I should have dropped half of my 10k shares near EOD Friday and put them into SHMP, which I did consider, but held back.  

Oh well.  Nothing ventured nothing gained.  ",2019-02-07
47,kdyz,efy3z2p,/r/pennystocks/comments/ao2rk8/banco_sabadell/efy3z2p/,1,"Looked into Bankia and heck did they certainly have scandals, they’re still around though",2019-02-07
48,Greeph16,efy4h1n,/r/pennystocks/comments/ao2rk8/banco_sabadell/efy4h1n/,1,"Because they were ""rescued "" and merged with other banks in order to survive ",2019-02-07
49,mannyceballos,efy4yrt,/r/pennystocks/comments/anyia1/shmp_last_chance_to_get_in/efy4yrt/,1,still going up every day it gains pull back was minimal ,2019-02-07
50,dcstockjvm,efy51w2,/r/pennystocks/comments/anyia1/shmp_last_chance_to_get_in/efy51w2/,1,This is a beast. No stopping SHMP. ,2019-02-07
51,mchgrms,efy5itn,/r/pennystocks/comments/anyia1/shmp_last_chance_to_get_in/efy5itn/,1,"Congrats.

I'm 29 also and about to dive back into trading. Pretty excited about it. I'll most likely miss the rest of their big run, but I'll catch their train later this month.",2019-02-07
52,cannainform2,efy5rhd,/r/pennystocks/comments/ao442q/premier_health_group_phgi_phgrf_announces/efy5rhd/,1,Why do you think that? I've been invested in the cannabis sector for many years and have never heard of this company.,2019-02-07
53,ranghmltn,efy80vo,/r/pennystocks/comments/ao4rib/arsn_its_confirmed_now_everyone_huge_merger_with/efy80vo/,1, I have been trading this one all morning for some quick gains. Going to save some for the long haul. ,2019-02-07
54,StockBreakoutPlays,efy93n6,/r/pennystocks/comments/anyia1/shmp_last_chance_to_get_in/efy93n6/,1,"SHMP nice setup for breakout higher here. 

[5-day chart setup on .34 breakout.](https://imgur.com/gallery/Vkqe2p8)",2019-02-07
55,dcstockjvm,efyaypi,/r/pennystocks/comments/anyia1/shmp_last_chance_to_get_in/efyaypi/,1,Agreed! She’s looking great!,2019-02-07
56,arch1inc,efyb83w,/r/pennystocks/comments/anyia1/shmp_last_chance_to_get_in/efyb83w/,1,Still time to buy in? 52wk highs...might have missed this lol ,2019-02-07
57,dcstockjvm,efybc71,/r/pennystocks/comments/anyia1/shmp_last_chance_to_get_in/efybc71/,1,I don’t think so. Still a few days before news. May not make a ton but you will make some.,2019-02-07
58,dcstockjvm,efybez9,/r/pennystocks/comments/anyia1/shmp_last_chance_to_get_in/efybez9/,1,Still time to buy in. Still a little while before the news drops. May not make a ton but you can make some.,2019-02-07
59,arch1inc,efybhu4,/r/pennystocks/comments/anyia1/shmp_last_chance_to_get_in/efybhu4/,1,Aight. Bought in,2019-02-07
60,driv818,efybw8j,/r/pennystocks/comments/ao442q/premier_health_group_phgi_phgrf_announces/efybw8j/,1,"Its not a pure play cannabis stock, its a Canadian healthcare company expanding into cannabis clinics ",2019-02-07
61,StockBreakoutPlays,efygeyb,/r/pennystocks/comments/anyia1/shmp_last_chance_to_get_in/efygeyb/,1,.40's up,2019-02-07
62,samuraishit,efyheoc,/r/pennystocks/comments/ao442q/premier_health_group_phgi_phgrf_announces/efyheoc/,1,Whats the symbol?,2019-02-07
63,manning18goat,efyi6t0,/r/pennystocks/comments/anyia1/shmp_last_chance_to_get_in/efyi6t0/,1,"This is what I dont get, how do people not realize this? Their patent also covers all aquatic life and can be scaled to size. I even think it covers more then just the food industry, think about fish and wildlife conservation. ",2019-02-07
64,A2CKilla,efyikg4,/r/pennystocks/comments/anyia1/shmp_last_chance_to_get_in/efyikg4/,1,"Man, thank you for sharing this last year. I was one of the ones that saw the info you posted and looked into the company. Definitely was a long term hold. I even remember someone talking smack because it was a random stock. Man look at them now. In hindsight, wish I would have bought more back then, but you know what, profit is profit. People get stuck on get rich quick money. I have a few things I do for that and a few long term holds. Glad I stuck with shmp!!!! Let's go!!!!! ",2019-02-07
65,dcstockjvm,efyipz3,/r/pennystocks/comments/anyia1/shmp_last_chance_to_get_in/efyipz3/,1,You’re welcome man! This is so exciting! We have a real winner! It’s awesome! ,2019-02-07
66,dcstockjvm,efyirme,/r/pennystocks/comments/anyia1/shmp_last_chance_to_get_in/efyirme/,1,She’s flying! ,2019-02-07
67,dcstockjvm,efyisx9,/r/pennystocks/comments/anyia1/shmp_last_chance_to_get_in/efyisx9/,1,It does. It’s about the technology! I,2019-02-07
68,dcstockjvm,efyitrc,/r/pennystocks/comments/anyia1/shmp_last_chance_to_get_in/efyitrc/,1,Happy you did? ,2019-02-07
69,arch1inc,efyiztd,/r/pennystocks/comments/anyia1/shmp_last_chance_to_get_in/efyiztd/,1,Yes! Hope the news pushes it even more :) ,2019-02-07
70,dcstockjvm,efyjzkh,/r/pennystocks/comments/anyia1/shmp_last_chance_to_get_in/efyjzkh/,1,Oh it will. $$$ in bags coming.,2019-02-07
71,driv818,efympds,/r/pennystocks/comments/ao442q/premier_health_group_phgi_phgrf_announces/efympds/,1,PHGRF is the US and candadian is PHGI,2019-02-07
72,monclerman,efynh4w,/r/pennystocks/comments/ao442q/premier_health_group_phgi_phgrf_announces/efynh4w/,1,What would be better to invest in? Or doe it not matter. I trade in CAD so obviously losing 34% of my principal is already not good to me ,2019-02-07
73,bucky1515,efyrbg5,/r/pennystocks/comments/anyia1/shmp_last_chance_to_get_in/efyrbg5/,1,Still worth getting in?,2019-02-07
74,dcstockjvm,efyrf10,/r/pennystocks/comments/anyia1/shmp_last_chance_to_get_in/efyrf10/,1,"Yes, there is a dip now. ",2019-02-07
75,bucky1515,efys4es,/r/pennystocks/comments/anyia1/shmp_last_chance_to_get_in/efys4es/,1,Any thoughts/insights on holding period? Price predictions?,2019-02-07
76,dcstockjvm,efysbnr,/r/pennystocks/comments/anyia1/shmp_last_chance_to_get_in/efysbnr/,1,"I say .50 by end of day tomorrow. If news breaks on Monday .80+.

It all depends on what type of PR results they release about holding or selling after that. I consider this an investment stock.. not a trade stock. ",2019-02-07
77,itsyaboi117,efyxuyo,/r/pennystocks/comments/ao85qd/mnga_how_do_i_sue_you_bastards/efyxuyo/,1,"Yeah I’m at a pretty damn huge loss right now, don’t know whether to buy more. Really hoping the next earnings report will save us all. ",2019-02-07
78,xannyfamily1017,efyye8l,/r/pennystocks/comments/anyia1/shmp_last_chance_to_get_in/efyye8l/,1,Just wanna say thanks for the heads up on this beast!! Loving the ride,2019-02-07
79,BigGreenCandles,efyzrd4,/r/pennystocks/comments/ao85qd/mnga_how_do_i_sue_you_bastards/efyzrd4/,1,I would never buy more. It’s gonna go right back down to where it was. 25 cents. I just wish I could short it. ,2019-02-07
80,dcstockjvm,efyztvb,/r/pennystocks/comments/anyia1/shmp_last_chance_to_get_in/efyztvb/,1,Very welcome! We still have a fun ride ahead of us! ,2019-02-07
81,kdyz,efz0qfv,/r/pennystocks/comments/ao2rk8/banco_sabadell/efz0qfv/,1,"Just curious but did this apply to you and other people who bought it through the internet during those times? “On 17 February 2016, the bank announced it would fully compensate minority shareholders who participated in the IPO in exchange for returning their shares to the bank. They will receive 100% of their investment plus 1% compensatory interest per annum.”",2019-02-07
82,TotesMessenger,efz5sfw,/r/pennystocks/comments/ao7kdr/ryu_apparel_inc_ryuv_timing_the_turning_point/efz5sfw/,1,"I'm a bot, *bleep*, *bloop*. Someone has linked to this thread from another place on reddit:

- [/r/canadianinvestor] [RYU Apparel Inc RYU.V Timing the turning point.](https://www.reddit.com/r/CanadianInvestor/comments/ao9b5p/ryu_apparel_inc_ryuv_timing_the_turning_point/)

&amp;nbsp;*^(If you follow any of the above links, please respect the rules of reddit and don't vote in the other threads.) ^\([Info](/r/TotesMessenger) ^/ ^[Contact](/message/compose?to=/r/TotesMessenger))*",2019-02-07
83,TJ_Faullk,efz6xr4,/r/pennystocks/comments/ao85qd/mnga_how_do_i_sue_you_bastards/efz6xr4/,1,I was in the same spot. I didn’t know they were doing a reverse split.  For a couple hours I thought I was up 1700%. Luckily I sold around $3.50 even though it was a pretty big loss.,2019-02-07
84,OptimusMaximusCrypto,efz7wby,/r/pennystocks/comments/ao76cs/a_ranking_of_the_biggest_cannabis_stocks_by/efz7wby/,1,Kusko 500m Mcap but ranked 2nd... that’s a lot of upward potential. What’s up with it’s Mcap then?,2019-02-07
85,Bainsy,efz82yj,/r/pennystocks/comments/ao442q/premier_health_group_phgi_phgrf_announces/efz82yj/,1,"Hey guys hope you dont mind me asking, im looking at getting into the stock market in the near future and just doing some research and learning the ropes What platform do you guys use? ive been looking at 212 and plus500 cant seem to find any of these companys on there tho was thinking about starting out with cheap shares like penny stocks etc any help would be amazing thanks ",2019-02-07
86,Nottheface1337,efz9hcz,/r/pennystocks/comments/ao76cs/a_ranking_of_the_biggest_cannabis_stocks_by/efz9hcz/,1,Woot woot cmon PSIQ. Been making good money just off the .31 to .4 swings lol. ,2019-02-07
87,calvin50,efz9nm0,/r/pennystocks/comments/ao85qd/mnga_how_do_i_sue_you_bastards/efz9nm0/,1,"My first reverse split I cursed for a week
Lost half my stack",2019-02-07
88,Jpaperz,efzbcy4,/r/pennystocks/comments/ao85qd/mnga_how_do_i_sue_you_bastards/efzbcy4/,1,"Trust me, something big is coming if youve been reading the press releases and SEC fililings",2019-02-07
89,Jpaperz,efzbfgk,/r/pennystocks/comments/ao85qd/mnga_how_do_i_sue_you_bastards/efzbfgk/,1,Im a loser and get emails whenever they do something lol,2019-02-07
90,krys_star,efzbxwh,/r/pennystocks/comments/ao85qd/mnga_how_do_i_sue_you_bastards/efzbxwh/,1,I sold everything at a huge loss. Fuck this company.,2019-02-07
91,Jpaperz,efzcjcd,/r/pennystocks/comments/ao85qd/mnga_how_do_i_sue_you_bastards/efzcjcd/,1,"Whyy? They have a very strategic plan. recently they acquired one of the last gas distributers in texas, informed us about the meeting in dubai, in the taronis presentation they gave a nice breakdown of how much clientele they recieved, also signed a deal with san diego, acquired a los angelos distributor location all within the last 2 weeks, on top of a public offering today an hour  ago",2019-02-07
92,Jpaperz,efzcn92,/r/pennystocks/comments/ao85qd/mnga_how_do_i_sue_you_bastards/efzcn92/,1,Theyre also expanding into europe into 3/5 of the largest ports..,2019-02-07
93,thebronxtaco,efzcnwv,/r/pennystocks/comments/ao85qd/mnga_how_do_i_sue_you_bastards/efzcnwv/,1,"I’m no expert but secondary public offerings are typically seen as a bad thing, no?",2019-02-07
94,Jpaperz,efzd612,/r/pennystocks/comments/ao85qd/mnga_how_do_i_sue_you_bastards/efzd612/,1,"Normally yes, but compared from 3k clientele to 30k theres going to be strong buys and holds. The company rebranded itself and came with a big shadow behind it creeping. Theyre up 200% since last year in revenue/sales and most likely using that profic towards expansion. Not to mention san diego has to now retrain most of their workers to use the new fuel. Thats all money, i give it a month to be back at 2.25+ steadily, but me personally i said back in august after the board changed head that shit was gling to change and since then theyve been making roughly 1m a month, and that was without the recently great additions. so im not as worried about it especially cause the plan was to hold it 5 years. Crazy right? 5 years lmaoo",2019-02-07
95,Jpaperz,efzehns,/r/pennystocks/comments/ao6k4v/february_07_2019_tomorrows_daily_rpennystocks/efzehns/,1,Probably $ADXS $LODE $DPW $MOSY or $WFT,2019-02-07
96,Jpaperz,efzej5h,/r/pennystocks/comments/ao6k4v/february_07_2019_tomorrows_daily_rpennystocks/efzej5h/,1,*Robinhood* :(,2019-02-07
97,nswa1992,efzguk6,/r/pennystocks/comments/ao7kdr/ryu_apparel_inc_ryuv_timing_the_turning_point/efzguk6/,1,"Even if ryu get to one tenth of what lulu Is worth, I would be happy as fuck haha. I think if you hold your shares for 10 years you could see some huge returns. ",2019-02-07
98,WolfofLawlStreet,efzhti5,/r/pennystocks/comments/ao85qd/mnga_how_do_i_sue_you_bastards/efzhti5/,1,"Typical meme stock. Gets pumped and then dumped and kids be crying on here. Honestly, anytime you hear a RS, run. ",2019-02-07
99,thatguybuddy,efzi1iz,/r/pennystocks/comments/ao7kdr/ryu_apparel_inc_ryuv_timing_the_turning_point/efzi1iz/,1,I’m hoping for just a strong 0.30 for a base for this thing to hang on to in 2019 would be excellent. It’s going to be about the excitement of the new money and who that new money is that will get this to the next level. Having stores in New York and LA certainly will help that. ,2019-02-07
100,nswa1992,efzixjb,/r/pennystocks/comments/ao7kdr/ryu_apparel_inc_ryuv_timing_the_turning_point/efzixjb/,1,Well I have heard justin beibers dad has a few million invested. So maybe they will get some ads with justin lol. ,2019-02-07
101,danimal82,efzj586,/r/pennystocks/comments/anyqnq/pura_to_go/efzj586/,1,i suggest looking into $KGKG. seems like a safer bet IMO.,2019-02-07
