,author,id,url,score,text,date
0,NotClothed,eetuk41,/r/pennystocks/comments/aj9usv/clarocity/eetuk41/,1,Invest in what you believe in and let it fall into place. We aren't Warren Buffet ,2019-01-24
1,Jake10873,eety34k,/r/pennystocks/comments/aja8sx/investing_question/eety34k/,1,I use TDAmeritrade. Watch out for the trading fees though as they can add up quickly depending on how many trades you make!,2019-01-24
2,rr00069,eeu3bjf,/r/pennystocks/comments/ajb6lt/hello_im_new/eeu3bjf/,1,Robinhood ,2019-01-24
3,mtuttle49,eeu4rlw,/r/pennystocks/comments/aja8sx/investing_question/eeu4rlw/,1,Yep. I bought a foreign stock and there is an additional $15 fee on top of the $6.95 fee through TD. Although the $15 fee doesnt go to TD.,2019-01-24
4,welivewelearn,eeu5vgd,/r/pennystocks/comments/ajb6lt/hello_im_new/eeu5vgd/,1,Robinhood does not trade OTC ,2019-01-24
5,Derp2638,eeu66xl,/r/pennystocks/comments/ajb6lt/hello_im_new/eeu66xl/,1,A real broker. Don’t listen to these people saying robin hood. You want a broker from a bank. I have Merrill edge which is ok. I’ve head really good things about ameritade though,2019-01-24
6,Hanky___Panky,eeuab5s,/r/pennystocks/comments/ajb6lt/hello_im_new/eeuab5s/,1,"Got a TD Ameritrade account, to start an electronic account I think it’s like 50 bucks.  

Lastly, don’t listen to Robinhood pushers.",2019-01-24
7,global-e1337,eeuas5g,/r/pennystocks/comments/aja8sx/investing_question/eeuas5g/,1,Find the right broker. Banks will fuck you on fees,2019-01-24
8,norpiano,eeuaxhe,/r/pennystocks/comments/ajb6lt/hello_im_new/eeuaxhe/,1,"Hi new, I’m dad",2019-01-24
9,heliogt2,eeub846,/r/pennystocks/comments/ajb6lt/hello_im_new/eeub846/,1,"So what happened you didn't have enough fun trading CFD and forex? 

This penny stock game is even more likely to end up with you losing 100 % of your money.

it can be a lot of fun if you can afford it though. Kind of think of it like s Vegas gambling budget and see how much fun you can have with it till it all runs out",2019-01-24
10,stranicola,eeucvur,/r/pennystocks/comments/ajb6lt/hello_im_new/eeucvur/,1,"Yeah I’ve heard of Ameritrade, thank you all for the infos, I’ll check later",2019-01-24
11,sadblackman32,eeukg2i,/r/pennystocks/comments/aj9usv/clarocity/eeukg2i/,1,Wish we were..,2019-01-24
12,unix233,eeum0du,/r/pennystocks/comments/ajdmmv/phgrf_news_premier_health_announces_binding_loi/eeum0du/,1,"that is very impressive news, this company just keeps on giving to the investors. One of my fav and top mj / biotech company. ",2019-01-24
13,driv818,eeum3p2,/r/pennystocks/comments/ajdmmv/phgrf_news_premier_health_announces_binding_loi/eeum3p2/,1,"Strategically I think this is a good move for the company's expanisions plan- pharmacy, telemedicine, cannabis clinics etc. Looking for a break and hold of .70, then I think this could potentially really open up.",2019-01-24
14,weed_trader,eeuon90,/r/pennystocks/comments/ajco2w/bemg_partners_with_lyft_and_uber_huge_news_for_a/eeuon90/,1,"Big names on it now

[https://twitter.com/Grolden87/status/1088456385308704769](https://twitter.com/Grolden87/status/1088456385308704769)

&amp;#x200B;

[https://twitter.com/greatstockpicks/status/1088457814106791938](https://twitter.com/greatstockpicks/status/1088457814106791938)

&amp;#x200B;

Company tweeted they will be filing S-1 to get it on OTCQB",2019-01-24
15,jesuswasabottom,eevf3hl,/r/pennystocks/comments/ajgc60/any_student_challenge_of_tim_sykes_whats_your/eevf3hl/,1,They are definitely overrated and outdated.,2019-01-24
16,Del_Phoenix,eevfzwz,/r/pennystocks/comments/ajgwwl/vyst_still_going_lol_got_a_small_batch_of_free/eevfzwz/,1,"Pump and dump, crash and burn coming up guaranteed",2019-01-24
17,CaptainWeee,eevg2iv,/r/pennystocks/comments/ajgwwl/vyst_still_going_lol_got_a_small_batch_of_free/eevg2iv/,1,Lol that won’t matter to those who got in under .0010 when I alerted it.,2019-01-24
18,Del_Phoenix,eevg3x2,/r/pennystocks/comments/ajgwwl/vyst_still_going_lol_got_a_small_batch_of_free/eevg3x2/,1,"As long as they sell while they're up, I'm just saying it's probably too late to get in at this point",2019-01-24
19,CaptainWeee,eevgpjp,/r/pennystocks/comments/ajgwwl/vyst_still_going_lol_got_a_small_batch_of_free/eevgpjp/,1,Yup,2019-01-24
20,LordZeekos,eeviyqp,/r/pennystocks/comments/ajgc60/any_student_challenge_of_tim_sykes_whats_your/eeviyqp/,1,Thanks for your input. Who should I watch and study these days?,2019-01-24
21,TRichard3814,eevndtr,/r/pennystocks/comments/ajgwwl/vyst_still_going_lol_got_a_small_batch_of_free/eevndtr/,1,"I just went to their website and clicked the menus tab

It redirected to an ad lol",2019-01-24
22,said-abubgioa,eevngin,/r/pennystocks/comments/ajcfg5/hiph_writes_letter_of_intent_this_morning_for_the/eevngin/,1,"WILMINGTON, Del. ,  Jan. 24, 2019  /PRNewswire/ --&amp;#xA0;The Chemours Company (Chemours) (NYSE: CC), a global chemistry company with leading market positions in titanium technologies, fluoroproducts and chemical solutions, announced it will release fourth quarter and full-year 2018 financial...
Find out more https://marketwirenews.com/news-releases/chemours-announces-dates-for-fourth-quarter-and-full-year-2018-earnings-release-and-webcast-conference-call-7549410.html 
",2019-01-24
23,CaptainWeee,eevnk88,/r/pennystocks/comments/ajgwwl/vyst_still_going_lol_got_a_small_batch_of_free/eevnk88/,1,😂🤣🍆💦,2019-01-24
24,TRichard3814,eevnmnp,/r/pennystocks/comments/ajgwwl/vyst_still_going_lol_got_a_small_batch_of_free/eevnmnp/,1,Could you explain to me what the fuck this company is how you found it and why it’s up so much,2019-01-24
25,CaptainWeee,eevnubl,/r/pennystocks/comments/ajgwwl/vyst_still_going_lol_got_a_small_batch_of_free/eevnubl/,1,No explanation needed ride the waves 🤑,2019-01-24
26,TRichard3814,eevnvn6,/r/pennystocks/comments/ajgwwl/vyst_still_going_lol_got_a_small_batch_of_free/eevnvn6/,1,Yeah and not like an for there products like a clickbait gambling ad with 5 redirects before it,2019-01-24
27,Chayis,eevoptv,/r/pennystocks/comments/aji3dz/penny_stocks_with_real_earnings/eevoptv/,1,Helios Matheson is under a cent!,2019-01-24
28,Bricktop52,eevpgmu,/r/pennystocks/comments/ajgwwl/vyst_still_going_lol_got_a_small_batch_of_free/eevpgmu/,1,"u/CaptainWeee is my new favourite person on reddit. Just gone through his post history. 

I want what he’s having...all aboard the Weee train. Penny stocks tomorrow. ",2019-01-24
29,CaptainWeee,eevqf0e,/r/pennystocks/comments/ajgwwl/vyst_still_going_lol_got_a_small_batch_of_free/eevqf0e/,1,👏😂🤣 Weeeee baby weeeeee!!! 🚬🐔🍆💦,2019-01-24
30,CaptainWeee,eevqfdr,/r/pennystocks/comments/ajgwwl/vyst_still_going_lol_got_a_small_batch_of_free/eevqfdr/,1,Lol all good,2019-01-24
31,rieboldt,eevr1em,/r/pennystocks/comments/ajfy6q/gcgx_making_moves/eevr1em/,1,Stop pumping this.,2019-01-24
32,Smotpoking,eevr9ht,/r/pennystocks/comments/ajgwwl/vyst_still_going_lol_got_a_small_batch_of_free/eevr9ht/,1,Thoughts on $TPNI? Thinking about picking up a good amount,2019-01-24
33,not-remind-bot,eevra9x,/r/pennystocks/comments/ajfy6q/gcgx_making_moves/eevra9x/,1,"I bought in and there’s news, am I not allowed to be excited? I’m also open to and looking for opinions. Two posts in two days wasn’t my intention. ",2019-01-24
34,brrr69,eevtw27,/r/pennystocks/comments/aji3dz/penny_stocks_with_real_earnings/eevtw27/,1,Theres a reason penny stocks are penny stocks,2019-01-24
35,TRichard3814,eevuj0h,/r/pennystocks/comments/ajgwwl/vyst_still_going_lol_got_a_small_batch_of_free/eevuj0h/,1,Christ I wish I could short this,2019-01-24
36,TRichard3814,eevukvo,/r/pennystocks/comments/aji3dz/penny_stocks_with_real_earnings/eevukvo/,1,That reason is the stock costs a penny,2019-01-24
37,brrr69,eevun11,/r/pennystocks/comments/aji3dz/penny_stocks_with_real_earnings/eevun11/,1,Yes and most penny stocks are trash. For investing long term. ,2019-01-24
38,fox_91,eevurs2,/r/pennystocks/comments/aji3dz/penny_stocks_with_real_earnings/eevurs2/,1,SPSO is a solar company which just finished a name change and recent good filings. ,2019-01-24
39,CaptainWeee,eevusvc,/r/pennystocks/comments/ajgwwl/vyst_still_going_lol_got_a_small_batch_of_free/eevusvc/,1,I dig it for a swing play it had good volume last couple days 👏,2019-01-24
40,CaptainWeee,eevutrw,/r/pennystocks/comments/ajgwwl/vyst_still_going_lol_got_a_small_batch_of_free/eevutrw/,1,😂😂😂,2019-01-24
41,TheGunFairy,eevvive,/r/pennystocks/comments/aji3dz/penny_stocks_with_real_earnings/eevvive/,1,"trash for investing long term, or because they take long term investment to pay off?",2019-01-24
42,brrr69,eevwaba,/r/pennystocks/comments/aji3dz/penny_stocks_with_real_earnings/eevwaba/,1,I mean most penny stocks do not preform well long term. ,2019-01-24
43,Derp2638,eevwnvn,/r/pennystocks/comments/aji3dz/penny_stocks_with_real_earnings/eevwnvn/,1,"Welp I have SNES for you.  Admit I’m down 50% it’s 80 cents now. Their revenue growth from last quarter to this quarter will be from 100k to possibly 350-500k.  It’s a rat pest control company. They have a product that just started selling called contrapest. It’s basically rat birth control. They have secured a giant contract in DC and a few other places we’ve already seen the paper work. Also, just got general use approval waiting for paperwork to be done in all states as well and to top things off is the most environmentally friendly product on the market. ",2019-01-24
44,TRichard3814,eevx2ng,/r/pennystocks/comments/aji3dz/penny_stocks_with_real_earnings/eevx2ng/,1,"Looks good other then the insane run rate

$2 million a quarter in losses Jesus Christ 

7.4 million in cash and 300k in debt with a market cap of 18 million would be amazing if they had an EPS of even 0.01.

Where’s it going?",2019-01-24
45,Derp2638,eevyixe,/r/pennystocks/comments/aji3dz/penny_stocks_with_real_earnings/eevyixe/,1,What do you mean by where’s it going ? ,2019-01-24
46,TRichard3814,eevymx1,/r/pennystocks/comments/aji3dz/penny_stocks_with_real_earnings/eevymx1/,1,What are they spending 8 million dollars a year on. Product development or what?,2019-01-24
47,Derp2638,eevz6kg,/r/pennystocks/comments/aji3dz/penny_stocks_with_real_earnings/eevz6kg/,1,Research and development. Currently they are working for the same formula on wild hogs and other animals viewed as pests that destroy farmland and other such things. I believe in a conference call they mentioned the product for wild hogs going through the epa in 2019.  The big money in this is in Hawaii. Housing managers and environmental concerns for rats eating through the environment is where they can make bank. And considering the environmental restrictions and the fact that this product can be used is a very very good sign. ,2019-01-24
48,TRichard3814,eew0bhv,/r/pennystocks/comments/aji3dz/penny_stocks_with_real_earnings/eew0bhv/,1,Ok that’s reasonable spend I will check the company out,2019-01-24
49,Derp2638,eew0zhr,/r/pennystocks/comments/aji3dz/penny_stocks_with_real_earnings/eew0zhr/,1,Alright good luck man. Have a good one chief ,2019-01-24
50,Karmais_a_bitch,eew5pmt,/r/pennystocks/comments/aji3dz/penny_stocks_with_real_earnings/eew5pmt/,1,"Most but not all, take $CVSI, I bought 1 year ago for .56, yes they had real earnings all the way through, today it closed at $5.09 and soon to list on the NASDAQ. No reverse split, just all real money. There are many more stories like this.",2019-01-24
51,Superfudge400,eewbo9x,/r/pennystocks/comments/ajiewj/tokers_jokers_cannabis_stocks_on_the_rise/eewbo9x/,1,Ok,2019-01-24
52,LAVISHSAV4GE,eewcz08,/r/pennystocks/comments/ajfy6q/gcgx_making_moves/eewcz08/,1,Do yo thang man nothing wrong with posting info bout a stock or what you found people do it all the time on here. Some people just get a lil salty when they’ve lost some monies ^^^,2019-01-24
53,Bacon_Hero,eewfroo,/r/pennystocks/comments/ajeu35/bcci_rltr_reeltime_media_signs_package_deal_to/eewfroo/,1,Nice. I knew this one would pay off,2019-01-24
54,Luffykyle,eewimpa,/r/pennystocks/comments/ajiewj/tokers_jokers_cannabis_stocks_on_the_rise/eewimpa/,1,ACB is a steal. Ain’t a penny stock anymore but it’s only a fraction of the price it will one day be. ,2019-01-24
55,ryancoon82,eex875f,/r/pennystocks/comments/aji3dz/penny_stocks_with_real_earnings/eex875f/,1,$AXXA Is actually releasing $100million in earnings today. Look at @ExxeGroup twitter and OTC accounts. ,2019-01-24
56,KShim79,eex9a7q,/r/pennystocks/comments/ajgc60/any_student_challenge_of_tim_sykes_whats_your/eex9a7q/,1,"Zeekos, I would point you towards other DVDs on Profitly.

Mathew Owens on Profitly isn't a pennystock guy, but both of the DVDs I watched from him changed how I trade.

 [https://profit.ly/store/info/298?aff=11737](https://profit.ly/store/info/298?aff=11737) 

 [https://profit.ly/store/info/306?aff=11737](https://profit.ly/store/info/306?aff=11737) 

&amp;#x200B;

I've re watched both of those three times. Great stuff in em. I'm not sure, but I'm pretty sure they're much cheaper than Tim's stuff as well. Mathew focuses on futures and not penny stocks, but some of the lessons carry over. I switched to trading futures after watching them.

Hope that helps!",2019-01-24
57,alikanst5fem,eexishr,/r/pennystocks/comments/ajf600/january_24_2019_tomorrows_daily_rpennystocks/eexishr/,1,"With the recent advent of new products with cannabidiol (CBD)-infused formulas hitting the market, the potential for the next big entry into the cannabis sector could come from a personal care products giant. A potential partnership with a personal care products major could come through one o...
Got this from https://marketwirenews.com/news-releases/the-benefits-of-cbd-in-personal-care-products-presents-the-cannabis-sector-s-next-frontier-7551288.html 
",2019-01-24
58,SquizzOC,eexv6rx,/r/pennystocks/comments/ajcfg5/hiph_writes_letter_of_intent_this_morning_for_the/eexv6rx/,1,We getting a small run on HIPH today?,2019-01-24
59,hydragyrum2,eeyzfnf,/r/pennystocks/comments/aji3dz/penny_stocks_with_real_earnings/eeyzfnf/,1,"$VYST 

Price has skyrocketed in the last few days.

Lots of great news coming in the last few days and weeks. Real product, has many patents, their latex will be an industry standard IMO, and more recently, they announced that they will be buying back 250M shares beginning next week. As well as news of uplisting to the Nasdaq...

Check out this DD for more info: 
https://investorshub.advfn.com/boards/read_msg.aspx?message_id=146166501",2019-01-24
60,[deleted],eeyzp1y,/r/pennystocks/comments/ajgc60/any_student_challenge_of_tim_sykes_whats_your/eeyzp1y/,1,[removed],2019-01-24
61,TRichard3814,eez2eog,/r/pennystocks/comments/aji3dz/penny_stocks_with_real_earnings/eez2eog/,1,"Yeah I have some criteria for a company

If I go to their official website and the menu button redirects me to an ad for an online gambling scam, i don’t invest. It’s a simple rule but it has done me well.",2019-01-24
62,hydragyrum2,eez2vbb,/r/pennystocks/comments/aji3dz/penny_stocks_with_real_earnings/eez2vbb/,1,"https://www.vystarcorp.com

This website redirected you to an ad? I think you may have accessed some other website. I’m not getting any ads through the above website.",2019-01-24
63,hydragyrum2,eez2wh2,/r/pennystocks/comments/aji3dz/penny_stocks_with_real_earnings/eez2wh2/,1,"https://www.vystarcorp.com

This website redirected you to an ad? I think you may have accessed some other website. I’m not getting any ads through the above website.",2019-01-24
64,Investinsauerkraut,eezgsgb,/r/pennystocks/comments/aji3dz/penny_stocks_with_real_earnings/eezgsgb/,1,What gov contracts do you expect? I'm obvi unfamiliar with the business but are there serious competitors to fight for these contracts? ,2019-01-24
65,TRichard3814,eezjzm9,/r/pennystocks/comments/aji3dz/penny_stocks_with_real_earnings/eezjzm9/,1,Yes it did,2019-01-24
66,StockBreakoutPlays,eezp7oc,/r/pennystocks/comments/aji3dz/penny_stocks_with_real_earnings/eezp7oc/,1,"Those photo-shopped images on the home page really sold me. 

Most companies make it easy to buy products. This website doesn't have any for sale? 

It seems as though the CEO is trying to buy his own companies? That is a red flag and pretty typical of penny stock scams. If his furniture business was really that strong he wouldn't be looking to sell it for shares. 

They want to uplist to Nasdaq but can't keep their OTC page up to date? Meaning website address is not correct, shareholder info not updated and old officers listed. 

Okay, so I went to Rotman's online to buy one of their new mattress-in-a-box.  I will have to go pick it up in store since they don't deliver to my area. Sorry, I'm not driving to Boston for a mattress. The whole point of mattress-in-a-box is so customers don't have to go pick it up.

Trade the pump (convertible notes are coming due in February) and move on. ",2019-01-24
67,Derp2638,ef052a4,/r/pennystocks/comments/aji3dz/penny_stocks_with_real_earnings/ef052a4/,1,"No other real competitors. No one else has rat birth control essentially so they have the market cornered . Poisons don’t do the job well enough.  As well as their product contrapest being super environmentally friendly more so than poisons or any other product. They just got a 5000 unit contract with Washington D.C. This basically is at least 250,000$  of revenue could be up to 500,000. I think it’s more around 300k area. Next, to refill the Contrapest it’s 35$ a unit. Then you have feedlot contracts that will add lots of revenue. In addition you have wildlife reserves in Hawaii which is big money. And finally you have home and managers of neighborhoods that have many different houses. These will have giant money as well. A bunch of city’s are already using it. So basically they make good money the individual sale then monthly to every other depending on how active the rats are they need to refill the bait containers with more contrapest fluid. ",2019-01-24
68,hydragyrum2,ef0hb6c,/r/pennystocks/comments/aji3dz/penny_stocks_with_real_earnings/ef0hb6c/,1,"1. In essence, aren’t all photos photoshopped to an extent? Granted, some better than others. But who cares? Even big name magazines come out with poor photoshopped images on their covers. Sure, I get it’s one way to determine the legitimacy of a company, but I wouldn’t write off a company just based off of that. Also, their website is not meant for Ecommerce so that’s why you can’t purchase product off of their website. I recommend giving them a call, the CEO is extremely nice and takes the time to answer all your questions.

2. The CEO did NOT buy his own company. I’m not sure where you got that from? The CEO of Rotmans merged with Vystar to manufacture the latex in house since much of the product offerings used Vytex latex and since Rotmans also distributed through NHS. The CEO of Rotman was then appointed CEO of Vystar.

3. I can’t speak to the update of information on the OTC website. I don’t know why it’s not updated. They probably should to ease shareholder confidence.

4. The purpose of mattress-in-a-box is for the convenience of transporting and not necessarily shipping to anyone and anywhere. I’m sure in the near future, they will offer their product all across the US but they just started. Give it time. But consider the patent they have on their latex and how it has potential to be an industry standard within medicine, manufacturing, recreational etc.

The OP requested some potential stocks with serious revenue and I named one. I’m currently up 333% on it so I’m happy. It’s up to you and OP how you conduct your DD and what conclusion you come to. I’m not telling anyone how they should trade, just trying to answer or clarify questions and misunderstandings. ",2019-01-24
69,jimmy1460,ef6xyfh,/r/pennystocks/comments/ajfy6q/gcgx_making_moves/ef6xyfh/,1,This is slept on,2019-01-24
70,Moonsniff,ef7028m,/r/pennystocks/comments/aji3dz/penny_stocks_with_real_earnings/ef7028m/,1,"I’m actually in this industry but not a competitor.  I visited their booth at NPMA Pest World and their product is interesting. Are you in the industry as well, or have you just done your DD?

I think their product is a harder sell in residential and some commercial settings. I think their integration into a wild hog product, sounds more interesting. 

I personally don’t see this being a huge player in the Pest Control market until the USA bans more rodenticides. Just my two cents. 

",2019-01-24
71,Moonsniff,ef714rt,/r/pennystocks/comments/aji3dz/penny_stocks_with_real_earnings/ef714rt/,1,"Just a few negatives that I see... 

Containment of the liquid. Stations need to be secured and locked. There are some players already out there that own this market. They will need to integrate their product to fit into more rodent “stations.” 

This product doesn’t kill rodents. They still feed, defecate, and cause damage. The rodenticides that mentioned in other comments are cheaper and VERY effective. There are plenty of different rodenticide options out there.  If this product is used I’d imagine they would have to also actively use snap traps along with it. 

The industry isn’t quick with “change”. People that have been trapping and poisoning rodents for years, aren’t just going to switch. The first thing they will ask, is if it the product kills the rodent. 

With that said, this is an awesome product for highly sensitive areas. And does have a place in the market. 

",2019-01-24
72,not-remind-bot,ef7199t,/r/pennystocks/comments/ajfy6q/gcgx_making_moves/ef7199t/,1,Slept on? What does that mean?,2019-01-24
73,Derp2638,ef73guf,/r/pennystocks/comments/aji3dz/penny_stocks_with_real_earnings/ef73guf/,1,"To reply to both comments I will say I’m an investor and don’t work in the industry. Have talked to those who do and they like the product. Basically they said when poison doesn’t work this seems like a good alternative. As well as using Contrapest in conjunction with traps. Which I think is it’s value at its best. They have secured a big govt contract recently. As well as developing it for other animals like wild hogs and such. The reason why I bought into it is because it’s environmentally friendly and as more states have environmental concerns this is the way to go. Also, I think poison does the job well don’t get me wrong I’m not delusional but I believe Contrapest will more or less eliminate and make sure the problems eliminated. Thoughts ?  ",2019-01-24
74,Derp2638,ef73qiq,/r/pennystocks/comments/aji3dz/penny_stocks_with_real_earnings/ef73qiq/,1,"Also, I believe the big money here is when they go to Europe with this product.  Now I might be in and out of this stock by then as well but I’m just saying I think they will make a lot of money in cities,feedlots, and  across the pond a lot more money. To my knowledge there are a lot of restrictions over there and this would pass all of em ",2019-01-24
75,jimmy1460,ef76a8l,/r/pennystocks/comments/ajfy6q/gcgx_making_moves/ef76a8l/,1,No one is really paying it attention but has a ton of potential.,2019-01-24
76,not-remind-bot,ef77k1s,/r/pennystocks/comments/ajfy6q/gcgx_making_moves/ef77k1s/,1,"Ah, thanks, still learning some of the terms",2019-01-24
77,jimmy1460,ef7gnd8,/r/pennystocks/comments/ajfy6q/gcgx_making_moves/ef7gnd8/,1,No big deal not really a trading or investing term just a phrase ,2019-01-24
78,CrossDamon,egbowtm,/r/pennystocks/comments/ajgwwl/vyst_still_going_lol_got_a_small_batch_of_free/egbowtm/,1,Did the same thing and I’m definitely sold lmao,2019-01-24
79,ForexMTindicators,enet0if,/r/pennystocks/comments/ajgc60/any_student_challenge_of_tim_sykes_whats_your/enet0if/,1,You can find some Tim Sykes DVDs on forum mtindicators.com,2019-01-24
