,author,id,url,score,text,date
0,CanSomeSlam,dumpd0g,/r/pennystocks/comments/7zaxfu/ldsr_looking_real_nice/dumpd0g/,1,"if it doesnt pull back tomorrow i'd honestly be shocked, usually takes a couple tries to break that penny mark and stay there. jmo glta ",2018-02-22
1,Morsyn,dumpthq,/r/pennystocks/comments/7zaxfu/ldsr_looking_real_nice/dumpthq/,1,"what are their products exactly? is there any type of revenue growth expected, or is it simply just a trade stock (not investment)",2018-02-22
2,LucefieD,dumy1q2,/r/pennystocks/comments/7zaxfu/ldsr_looking_real_nice/dumy1q2/,1,"Software to assist companies with GDPR compliance, a program called Classidocs - https://www.data443.com/classidocs-home/ 

Should grow exponentially when GDPR is implemented on the 25th of May, however Classidocs already currently has clients. A website has them listed as generating about 2 mil in revenue but that doesn't necessarily mean anything. CEO said there will be Classidocs revenue on the next Q. They also recently anounced relations with Silicon Valley Bank, who has backed companies like fitbit. Honestly it's good for both a short term trade and a long term investment. I intend to leave about 500k shares for the long term while selling the rest between .01 and .05",2018-02-22
3,impulsiveinvestor,dumypya,/r/pennystocks/comments/7zaxfu/ldsr_looking_real_nice/dumypya/,1,"That doesnt make sense. 134m shares traded today, thats around a $1m in value.... Shits gonna crash hard when it does... Sad I missed it though!",2018-02-22
4,Morsyn,dun07fm,/r/pennystocks/comments/7zaxfu/ldsr_looking_real_nice/dun07fm/,1,"thank you, bud",2018-02-22
5,vegan-weirdo,dun0wge,/r/pennystocks/comments/7zaxfu/ldsr_looking_real_nice/dun0wge/,1,"I love it when I see people applying fundamental analysis to stocks of this elk ... 
It's like analyzing a 5 year-olds' baseball team on national TV with all the individual kids &amp; collective stats. ",2018-02-22
6,Saints420Fan,dun8xfc,/r/pennystocks/comments/7zaxfu/ldsr_looking_real_nice/dun8xfc/,1,"Def going to crash within a few weeks JMHO.  Their CEO has not listed 1 client yet; stock has been climbing wayyyyyy fast without news just in the hype train; google searches with GDPR mention nothing about Data433 (the worst marketing team ever for someone that “won awards”) . I’ve said it on another LDSR thread - their CEO had his ClassiDocs product on another ticket APHD - and it was another pump and dump. People have already 10 bagged this stock - nobody wants to leave the party early, but you also don’t want to be there when the cops come either. I’d have a plan to bail by the end of this or next week (just my 0.02$)",2018-02-22
7,jigre1,dunm9hb,/r/pennystocks/comments/7zft6g/aker_short_term_or_long_term/dunm9hb/,1,"Ummmmm, kinda both. I've been keeping 200 shares while flipping a few hundred more, looking at it as working down my avg price of the first 200.

I have a similar saying for penny stocks as women.

All penny stocks are risks, you just have to find the risks that you can stomach.

Now replace penny stocks with women and risks with crazy.

Personally I can stomach AKER's risk to go for the reward.",2018-02-22
8,IGOSODAMNHAM,dunoc1p,/r/pennystocks/comments/7zft6g/aker_short_term_or_long_term/dunoc1p/,1,Short term. This is a play on a chart. None of these penny stocks should be longterm.,2018-02-22
9,Luffykyle,dunol6l,/r/pennystocks/comments/7zft6g/aker_short_term_or_long_term/dunol6l/,1,I’m long term.  Got 4000 shares waiting to sell once it hits $4,2018-02-22
10,Senecany,dunpo94,/r/pennystocks/comments/7zg1nz/pura_plan_to_purchase_turning_point/dunpo94/,1,Sold at .026,2018-02-22
11,personable_finance,dunqrwa,/r/pennystocks/comments/7zft6g/aker_short_term_or_long_term/dunqrwa/,1,"depends what you consider ""long term"". market standards of 5+ years? no way. 
a few months? sure. But I think there's more value to be said over holding some of them longer than the typical 3-7 days that most people are going off.",2018-02-22
12,FuriouS76,dunsc8e,/r/pennystocks/comments/7zft6g/aker_short_term_or_long_term/dunsc8e/,1,Yes,2018-02-22
13,FuriouS76,dunsjfv,/r/pennystocks/comments/7zft6g/aker_short_term_or_long_term/dunsjfv/,1,"For me, I am exiting AKER today at .60 if it hits it. I do not see news indicating there will not be a correction down to the slow / steady up trend seen for the past 2 months. I will watch for the proper re-entry point next week most likely.    
   ",2018-02-22
14,LucefieD,dunszum,/r/pennystocks/comments/7zaxfu/ldsr_looking_real_nice/dunszum/,1,I already sold some at .01 I have another sell at .03 but I'm not sure if it will get that far. Either way got my finger on the trigger I messed up pretty bad in 2017 with BVTK. Made money but not as much as I should have. ,2018-02-22
15,omega12345A,dunty5t,/r/pennystocks/comments/7zaxfu/ldsr_looking_real_nice/dunty5t/,1,"Getting antsy here too, the thing is shooting up too fast on no news.",2018-02-22
16,Senecany,dunv60d,/r/pennystocks/comments/7zgk2r/anyone_hit_pas_yesterday_up_275/dunv60d/,1,Ticker does not compute ,2018-02-22
17,Saints420Fan,dunvlwd,/r/pennystocks/comments/7zaxfu/ldsr_looking_real_nice/dunvlwd/,1,If your gut is telling you it’s too good to be true - then it probably is. I told a friend who just jumped out at 0.09 - I’m content watching some people get rich from the sidelines. There’s always the next pump and dump to ride out there.  Think about how much revenue they have to generate though to keep their price up this high. Without listing a single contract I don’t think it’s a safe bet. The market makers are having a field day with it on the way up though. I assume they will let this ride as long as it will before they dump. Or maybe they release some filings? Who knows! Just too risky for me to justify it ,2018-02-22
18,Senecany,dunxikc,/r/pennystocks/comments/7zh6xx/etrade_or_td_ameritrade/dunxikc/,1,Not that I see.,2018-02-22
19,upsideDownAlex,dunxq4t,/r/pennystocks/comments/7zh6xx/etrade_or_td_ameritrade/dunxq4t/,1,You use TD or E*Trade?,2018-02-22
20,Senecany,dunxuky,/r/pennystocks/comments/7zh6xx/etrade_or_td_ameritrade/dunxuky/,1,TD. 0 problems in 1year.,2018-02-22
21,jigre1,duny4zl,/r/pennystocks/comments/7zh8xc/mysz/duny4zl/,1,"Sunday @ 1:30pm. This is likely helping the show with ratings more than helping mysz, as all the investors and traders will tune in and get hyped. ",2018-02-22
22,impulsiveinvestor,dunyblh,/r/pennystocks/comments/7zh6xx/etrade_or_td_ameritrade/dunyblh/,1,"TDA++++, they pickup before the first ring even registers when you call for assistance. Never had issues with stock prices. Done with robinhood, takes 1.5 weeks to get response to help ticket and is basic automated non help, never got referral stock either.",2018-02-22
23,personable_finance,dunybun,/r/pennystocks/comments/7zeps6/goph_is_the_gift_that_keeps_on_giving/dunybun/,1,flatlining at 1.70 is its job,2018-02-22
24,CanSomeSlam,dunzhvh,/r/pennystocks/comments/7zaxfu/ldsr_looking_real_nice/dunzhvh/,1,I WAS WRONG,2018-02-22
25,HU4R0LLz,dunziyu,/r/pennystocks/comments/7zgjep/cstu_breakout_strong_catalysts_1_target_price/dunziyu/,1,cool,2018-02-22
26,IGOSODAMNHAM,dunzzqq,/r/pennystocks/comments/7zft6g/aker_short_term_or_long_term/dunzzqq/,1,"Nah, just sell after the move you can always rebuy. This is a play based on the chart that's it.",2018-02-22
27,ryoon21,duo00k0,/r/pennystocks/comments/7zh6xx/etrade_or_td_ameritrade/duo00k0/,1,"I use E*Trade. The trick is to use the “stream” functionality.  There are a few steps to set it up but once you’ve got it, you’ve got it. ",2018-02-22
28,ryoon21,duo02ih,/r/pennystocks/comments/7zh6xx/etrade_or_td_ameritrade/duo02ih/,1,"Otherwise, your prices come in at a 15 minute lag",2018-02-22
29,IGOSODAMNHAM,duo068p,/r/pennystocks/comments/7zft6g/aker_short_term_or_long_term/duo068p/,1,"Highly suggest selling after this move. It's a BIO turd and they have 0 cash. It's a play based on the chart. Holding to $4, you will just lose money. Have you read any of the studies? Fins? Doubt it. Even if they get FDA approval they will have to dilute for money.",2018-02-22
30,leadrain86,duo0nzr,/r/pennystocks/comments/7zft6g/aker_short_term_or_long_term/duo0nzr/,1,"This times a million. Good advice for trading biotechs, and any penny stocks really. ",2018-02-22
31,leadrain86,duo0rfe,/r/pennystocks/comments/7zft6g/aker_short_term_or_long_term/duo0rfe/,1,"Playing 8 - 10% swings just like you said. Day trade only, no swings. There’s been zero news, just good volume on a low float. ",2018-02-22
32,getoffmylawn13,duo1mq5,/r/pennystocks/comments/7zh6xx/etrade_or_td_ameritrade/duo1mq5/,1,TDA plus thinkorswim no brainer,2018-02-22
33,upsideDownAlex,duo1o2q,/r/pennystocks/comments/7zh6xx/etrade_or_td_ameritrade/duo1o2q/,1,Is it using the marketcaster?,2018-02-22
34,supnul,duo1sx6,/r/pennystocks/comments/7zh6xx/etrade_or_td_ameritrade/duo1sx6/,1,I have heard that E-Trade has more borrows but i cannot confirm. This is however unrelated to price latency.,2018-02-22
35,LandmanCA,duo1x4b,/r/pennystocks/comments/7zh8xc/mysz/duo1x4b/,1,"I bought at 1.80, before they issued new shares and tanked the price. Just waiting for it to get back to that level so I can unload this bag. ",2018-02-22
36,getoffmylawn13,duo2lgr,/r/pennystocks/comments/7zhrcn/i_have_more_unrealized_gains_than_ever_before_and/duo2lgr/,1,"It doesn't matter if you sell half, one fifth or all of it, but definitely sell some after being up this much. The regret if it pulls back or bleeds back down is far worse than what you are feeling now trust me.",2018-02-22
37,ryoon21,duo2qrr,/r/pennystocks/comments/7zh6xx/etrade_or_td_ameritrade/duo2qrr/,1,"Uhhhhh not sure. Maybe? In looking at the app on my iphone, you can go to settings and there is a toggle switch next to “Real Time Streaming” under the subheading “Application Settings”. Mine is on, but I remember first setting it up you basically have to verify that you aren’t a professional trader using e*trade for a company. Might have to do it on an actual computer first, I can’t remember as it has been several months. ",2018-02-22
38,mikeschinas,duo2qyt,/r/pennystocks/comments/7zhrcn/i_have_more_unrealized_gains_than_ever_before_and/duo2qyt/,1,"I’m a fairly new trader so I haven’t had massive gains like yourself. I’ve read a couple books and have also realized that if you play with the “what if it goes up more.” Side of yourself, you can get burned fast. Then again if you have a large enough account you can afford small losses here and there. Best bet is take profits and be happy with your successes. ",2018-02-22
39,LucefieD,duo2r6w,/r/pennystocks/comments/7zhrcn/i_have_more_unrealized_gains_than_ever_before_and/duo2r6w/,1,"I've definitely felt that regret before, not on this level but it's all I could think about for a long time... I'd better sell more of this. I've only been trading for 3 years now but I've definitely learned stuff the hard way. ",2018-02-22
40,capzoots,duo3esx,/r/pennystocks/comments/7zg46d/aprn/duo3esx/,1,Meh,2018-02-22
41,Luffykyle,duo3ew3,/r/pennystocks/comments/7zft6g/aker_short_term_or_long_term/duo3ew3/,1,I’ll take my chances.  Fda hype alone will bring it close to a dollar. I’m in at .25 cents so waiting will only risk me losing a couple hundred dollars ,2018-02-22
42,IGOSODAMNHAM,duo3sp9,/r/pennystocks/comments/7zft6g/aker_short_term_or_long_term/duo3sp9/,1,"Just FYI I was one of the first people posting about this on social media for the set up. It's completely a play on the chart.

https://twitter.com/IGOSODAMNHAM/status/958059765300715521

It's not going to $1.00.",2018-02-22
43,getoffmylawn13,duo3x7b,/r/pennystocks/comments/7zhrcn/i_have_more_unrealized_gains_than_ever_before_and/duo3x7b/,1,"Congrats, best advice is to take a chill pill and watch the market for a week or two if you pull out all or a huge majority. That dopamine and adrenaline lasts a bit and you'll be chasing huge gains again if you try to pick another winner right away. ",2018-02-22
44,Luffykyle,duo41ao,/r/pennystocks/comments/7zft6g/aker_short_term_or_long_term/duo41ao/,1,We’ll see what happens.  I’ll hold you to your word if it ever does reach $1,2018-02-22
45,Arrublac814,duo43cl,/r/pennystocks/comments/7zg46d/aprn/duo43cl/,1,"Not a fan? 
",2018-02-22
46,upsideDownAlex,duo4pch,/r/pennystocks/comments/7zh6xx/etrade_or_td_ameritrade/duo4pch/,1,"I have real time streaming on but there's still a delay, This is why I was asking but you should check out marketcaster it's from etrade and it gives you a better view of what's going on",2018-02-22
47,IGOSODAMNHAM,duo4ugm,/r/pennystocks/comments/7zft6g/aker_short_term_or_long_term/duo4ugm/,1,"Haha, good luck. If it can get more volume I could see it reaching .8ish though! Hope it blasts through 1$ :).",2018-02-22
48,ryoon21,duo520d,/r/pennystocks/comments/7zh6xx/etrade_or_td_ameritrade/duo520d/,1,"Wasn’t aware of such a thing. I’ll look into it, thanks. How much of a delay do you see? I thought it was on point once I turned on streaming but I haven’t compared it to anything",2018-02-22
49,HGTV-Addict,duo5lq3,/r/pennystocks/comments/7zhrcn/i_have_more_unrealized_gains_than_ever_before_and/duo5lq3/,1,"The market cap is only $10m? Is that right? 

Insane to be holding $50k+ in that small a company. Your sale will probably move the market so I would exit all now while there are buyers to sell to. ",2018-02-22
50,capzoots,duo5ola,/r/pennystocks/comments/7zg46d/aprn/duo5ola/,1,"I've been holding onto it for a while, it's only lost money for me. Hope this news turns the tide.",2018-02-22
51,Dillweed7,duo5pfy,/r/pennystocks/comments/7zh8xc/mysz/duo5pfy/,1,"Fuck it, man. Buy that gold they advertise on their commercials.",2018-02-22
52,getoffmylawn13,duo5uh3,/r/pennystocks/comments/7zhrcn/i_have_more_unrealized_gains_than_ever_before_and/duo5uh3/,1,They have close to 4 billion outstanding. Close to $60 million market cap. Not sure where you got your number from.,2018-02-22
53,HGTV-Addict,duo5vl5,/r/pennystocks/comments/7zhrcn/i_have_more_unrealized_gains_than_ever_before_and/duo5vl5/,1,Google finance. ,2018-02-22
54,Dillweed7,duo5whx,/r/pennystocks/comments/7zhrcn/i_have_more_unrealized_gains_than_ever_before_and/duo5whx/,1,"Good advice. Stick closely to your method, if you do. Remember, your not Midas. Congrats, man. Congrats.",2018-02-22
55,JWoods6969,duo669r,/r/pennystocks/comments/7zaxfu/ldsr_looking_real_nice/duo669r/,1,INZZ Looking good as well.,2018-02-22
56,Derp2638,duo6hay,/r/pennystocks/comments/7zeps6/goph_is_the_gift_that_keeps_on_giving/duo6hay/,1,I dunno. I think it might uptick higher. Not super long ago it was at 3$. I think 1.70 is obviously a big point of resistance though,2018-02-22
57,Saints420Fan,duo6p59,/r/pennystocks/comments/7zhrcn/i_have_more_unrealized_gains_than_ever_before_and/duo6p59/,1,"Minimum to take out is to cover you’re initial investment - but you may have read my thoughts in the other thread you posted. I’d take a big chunk out. Even if this is a fraudulent stock, you will have left before it was realized. If it’s not, there will be 10000 more just like it done the road. Strike while the iron is hot, and with hose gains you can take a nice vacation and plot your next move bud (or realistically just pay off debt but vacation sounds nicer right?) ",2018-02-22
58,JWoods6969,duo6uxz,/r/pennystocks/comments/7zhrcn/i_have_more_unrealized_gains_than_ever_before_and/duo6uxz/,1,POTN is the one! I've got few and Looking good,2018-02-22
59,Thanagarian22,duo6ygq,/r/pennystocks/comments/7zft6g/aker_short_term_or_long_term/duo6ygq/,1,Some think it will go from 1 to 4 dolllars per at some point in the next 12 months easily just because of possible buyouts from 3rd party businesses. ,2018-02-22
60,HU4R0LLz,duo7moy,/r/pennystocks/comments/7zh8xc/mysz/duo7moy/,1,"This is would be a lot wiser, ever with the jacked up premiums. ",2018-02-22
61,Makeshift5,duo7mzp,/r/pennystocks/comments/7zhrcn/i_have_more_unrealized_gains_than_ever_before_and/duo7mzp/,1,“You won’t go broke taking gains”. Warren buffet,2018-02-22
62,leadrain86,duo7z5e,/r/pennystocks/comments/7zh8xc/mysz/duo7z5e/,1,Take profits! ,2018-02-22
63,IGOSODAMNHAM,duo7zgw,/r/pennystocks/comments/7zhrcn/i_have_more_unrealized_gains_than_ever_before_and/duo7zgw/,1,"You should sell at leas half IMO. If you don't know what to do, and you wouldn't buy here, why hold your full position.",2018-02-22
64,Arrublac814,duo94m2,/r/pennystocks/comments/7zg46d/aprn/duo94m2/,1,I would hold at least until feb 28th and see what the news brings us!  ,2018-02-22
65,CanSomeSlam,duo98lf,/r/pennystocks/comments/7zhrcn/i_have_more_unrealized_gains_than_ever_before_and/duo98lf/,1,sell then buy more shares at a lower price ;),2018-02-22
66,uoYredruM,duoa18h,/r/pennystocks/comments/7zh8xc/mysz/duoa18h/,1,I bought in to all the hype and got in at $2.30. I should have got out when it hit $2.99. Been riding it hoping for the best.,2018-02-22
67,upsideDownAlex,duoab6d,/r/pennystocks/comments/7zh6xx/etrade_or_td_ameritrade/duoab6d/,1,Probably like half an hour if it ever changes. I'm hoping the marketcaster is more up to date but it seems like it is so I'm going to try it for a while and see what happens,2018-02-22
68,jtmathis42477,duob631,/r/pennystocks/comments/7zhrcn/i_have_more_unrealized_gains_than_ever_before_and/duob631/,1,"How long have you held? When dealing with large gains it's smart to consider holding the block for at least year and you could potentially save thousands in taxes by changing the gain to ""long term"".",2018-02-22
69,omega12345A,duobdvd,/r/pennystocks/comments/7zhrcn/i_have_more_unrealized_gains_than_ever_before_and/duobdvd/,1,"Come now, who would hold a penny for a year.
Its gonna be half its worth next week.",2018-02-22
70,jtmathis42477,duobo9l,/r/pennystocks/comments/7zhrcn/i_have_more_unrealized_gains_than_ever_before_and/duobo9l/,1,I don't know a thing about lsdr man just making a statement ,2018-02-22
71,awanderingfire,duoduzs,/r/pennystocks/comments/7zg46d/aprn/duoduzs/,1,"In my opinion APRN has a great idea but a terrible business. While they've done a great job with supply chain &amp; general awareness they're spending way too much on marketing &amp; free meals at this point in their maturity...Yet to get the lifetime customer their business needs. 
I'd stay away but could work for a short term play -given their fall since IPO",2018-02-22
72,Saints420Fan,duoe1es,/r/pennystocks/comments/7zhrcn/i_have_more_unrealized_gains_than_ever_before_and/duoe1es/,1,"Yeah this stock is poised to possibly topple within the next few weeks/months. Def stuck with dealing with capital gains. When taking that into consideration - what would you rather cash out:

40% tax on 50k OR 40% tax on like 2k by the time you pull out after a dump ",2018-02-22
73,mikeschinas,duoe9j0,/r/pennystocks/comments/7zidlc/best_recommendations_for_robinhood/duoe9j0/,1,Looking to swing or day trade? ,2018-02-22
74,Saints420Fan,duoedy9,/r/pennystocks/comments/7zhrcn/i_have_more_unrealized_gains_than_ever_before_and/duoedy9/,1,"@ Lucifide 

I saw your post in iHub. If you read the boards it’s clear as day there’s a few distinct talking heads that shoot down anything negative on the boards. These are guys that got in while it was trip 0 and would probably kick their dog before they let any nay sayers try to diminish the wave they’re riding. They don’t do much to PROVE this is going to be long term rather then say “no their CEO is good he wasn’t apart of the APHD scam” etc or “please just go ahead and sell and I’ll take”.   There is legit DD on the board but it’s very much a lot of hype and as you posted on the forums - if their CEL Jay posts some weak stuff from earnings (that couldn’t keep up with stock price inflation rate) then as you said - there could be a sell off.  Timing is everything my friend. Good luck with whatever you decide ",2018-02-22
75,Chickachic-aaaaahhh,duoegl0,/r/pennystocks/comments/7zidlc/best_recommendations_for_robinhood/duoegl0/,1,Both. Mostly day trade unless if i find something worth holding on to. ,2018-02-22
76,WarrenPuff_It,duoeqr2,/r/pennystocks/comments/7zhrcn/i_have_more_unrealized_gains_than_ever_before_and/duoeqr2/,1,Buffett*,2018-02-22
77,mikeschinas,duoev6i,/r/pennystocks/comments/7zh6xx/etrade_or_td_ameritrade/duoev6i/,1,TDA thinkorswim has been working flawless for me. It’s amazing for charting and the scanner is excellent. I currently trade with questrade but use TOS for charting and i’m honestly thinking about making the switch over. ,2018-02-22
78,ksars,duof91q,/r/pennystocks/comments/7zidlc/best_recommendations_for_robinhood/duof91q/,1,r/RobinHoodPennyStocks,2018-02-22
79,Chickachic-aaaaahhh,duofdi7,/r/pennystocks/comments/7zidlc/best_recommendations_for_robinhood/duofdi7/,1,Dude thanks!!,2018-02-22
80,mikeschinas,duofg0n,/r/pennystocks/comments/7zidlc/best_recommendations_for_robinhood/duofg0n/,1, Currently watching $CRK to make another break and $FIT for the bounce tomorrow morning. ,2018-02-22
81,queenslandbananas,duogrrs,/r/pennystocks/comments/7zhrcn/i_have_more_unrealized_gains_than_ever_before_and/duogrrs/,1,"&gt; I have a set plan on when to take profits

That's the important part. Stick to it.",2018-02-22
82,disease_free_pigeon,duogzxt,/r/pennystocks/comments/7zidlc/best_recommendations_for_robinhood/duogzxt/,1,"Bpmx? Its a gamble, you wont need all 300, maybe just enough for 1000 shares ",2018-02-22
83,Seattlestocker,duoiaan,/r/pennystocks/comments/7zhrcn/i_have_more_unrealized_gains_than_ever_before_and/duoiaan/,1,Don't get greedy ,2018-02-22
84,vitodivita,duoin6x,/r/pennystocks/comments/7zhrcn/i_have_more_unrealized_gains_than_ever_before_and/duoin6x/,1,Good for you man I walked away just a couple weeks before the boomage with the intent to get back in...lost a huge opportunity! (3 mill shares) definetely watch carefully this stock could easily dump any day now..,2018-02-22
85,Morsyn,duoinq9,/r/pennystocks/comments/7zhrcn/i_have_more_unrealized_gains_than_ever_before_and/duoinq9/,1,"Simple, set mental stop losses/limits every single day.",2018-02-22
86,[deleted],duoisdy,/r/pennystocks/comments/7zft6g/aker_short_term_or_long_term/duoisdy/,1,[removed],2018-02-22
87,salem833,duojbnp,/r/pennystocks/comments/7zhrcn/i_have_more_unrealized_gains_than_ever_before_and/duojbnp/,1,Pull out then short. ,2018-02-22
88,vegan-weirdo,duok79q,/r/pennystocks/comments/7zhrcn/i_have_more_unrealized_gains_than_ever_before_and/duok79q/,1,"""Shocked ""
",2018-02-22
89,pudj,duop5m1,/r/pennystocks/comments/7zg46d/aprn/duop5m1/,1,I just don't think the business offers enough value to consumers. The number of people that like to cook but not shop their own ingredients seems really limited. People tend to either want to be thoroughly involved in their consumption process or don't care enough to pay the premium..,2018-02-22
90,Arrublac814,duopml3,/r/pennystocks/comments/7zg46d/aprn/duopml3/,1,You don’t believe there’s potential in a bigger player buying them out?,2018-02-22
91,Arrublac814,duopxbw,/r/pennystocks/comments/7zg46d/aprn/duopxbw/,1,Blue Apron is targeting the busy adult with a career who still values quality product and a healthy meals which are already portioned out so there’s no feeling bad when your food goes bad in you fridge.  It’s a TIME saving idea and people value those.  They might just need help from a bigger player ,2018-02-22
92,deadfermata,duoqyhc,/r/pennystocks/comments/7zh8xc/mysz/duoqyhc/,1,"23600 shares here. Been holding since early Jan. Never sold. Kept buying and buying. 

Company has so much promise if weak hands stop selling and shorting stopped.",2018-02-22
93,deadfermata,duoqzx6,/r/pennystocks/comments/7zh8xc/mysz/duoqzx6/,1,AH now at 1.87. Touched 1.90 before slight pullback.,2018-02-22
94,awanderingfire,duor1v8,/r/pennystocks/comments/7zg46d/aprn/duor1v8/,1,Maybe but it's not worth the risk in my opinion. Who would be a good fit to buy them out do you think?,2018-02-22
95,deadfermata,duor500,/r/pennystocks/comments/7zft6g/aker_short_term_or_long_term/duor500/,1,"Both AKER and ATOS are in the same boat. AKER waiting on FDA and ATOS had conference but no real updates. ATOS still in trial mode. Unlikely to have substantial movements for a while until studies are finalize with results and movement towards FDA approval.
",2018-02-22
96,Arrublac814,duorm8i,/r/pennystocks/comments/7zg46d/aprn/duorm8i/,1,Walmart ,2018-02-22
97,Tricombed,duorrpz,/r/pennystocks/comments/7zhrcn/i_have_more_unrealized_gains_than_ever_before_and/duorrpz/,1,Sell all of it now or will regret it guaranteed. It is going to drop very soon just like every other penny stock that gains like this. ,2018-02-22
98,LucefieD,duowvdf,/r/pennystocks/comments/7zhrcn/i_have_more_unrealized_gains_than_ever_before_and/duowvdf/,1,Problem is it might not reach my next target to sell at... But then again it looks pretty strong so it might. That's my conflict.,2018-02-22
99,leadrain86,duozd7x,/r/pennystocks/comments/7zhrcn/i_have_more_unrealized_gains_than_ever_before_and/duozd7x/,1,"Scale out. Take some profit now, trust your instinct. Then keep scaling out, maybe 25% of your position at a time? ",2018-02-22
