,author,id,url,score,text,date
0,WillPoleDance4Carbs,dwe7bvv,/r/pennystocks/comments/87njp8/is_tim_sykes_pennystocking_framework_part_deux/dwe7bvv/,1,"PSF2 *supposedly* has 6 chapters available now, the rest are in process.
He mentioned it a couple times today in his webinar. 

No idea on TC2. 

If you email admin@timothysykes.com, he, or one of the support folks, will get back to you pretty quick. ",2018-03-28
1,GAC44,dwe7rgs,/r/pennystocks/comments/87njp8/is_tim_sykes_pennystocking_framework_part_deux/dwe7rgs/,1,"Thanks, would you happen to have a download of that webinar?",2018-03-28
2,WillPoleDance4Carbs,dwe82o3,/r/pennystocks/comments/87njp8/is_tim_sykes_pennystocking_framework_part_deux/dwe82o3/,1,Nope. It probably won't be up for a couple days at least.,2018-03-28
3,avaldez321,dwe99fs,/r/pennystocks/comments/87nxc2/how_do_you_deal_with_your_loses/dwe99fs/,1,Cry,2018-03-28
4,GAC44,dwe9phq,/r/pennystocks/comments/87njp8/is_tim_sykes_pennystocking_framework_part_deux/dwe9phq/,1,"Alright, thanks for your help.",2018-03-28
5,Luffykyle,dwe9q2l,/r/pennystocks/comments/87nxc2/how_do_you_deal_with_your_loses/dwe9q2l/,1,"I don’t lose... lol jk.  I panic sale when a stock is giving me losses, and then I buy back in at an all time high.  ",2018-03-28
6,Pf70_Coin,dwe9sjx,/r/pennystocks/comments/87nxc2/how_do_you_deal_with_your_loses/dwe9sjx/,1,Easy. I buy more low and watch it go lower ,2018-03-28
7,elyuma,dwe9wea,/r/pennystocks/comments/87nxc2/how_do_you_deal_with_your_loses/dwe9wea/,1,"Cry, add more funds,I lose, repeat.. ",2018-03-28
8,Helliarc,dwebxip,/r/pennystocks/comments/87nxc2/how_do_you_deal_with_your_loses/dwebxip/,1,I curse and brag to all my friends about how much money I lost. ,2018-03-28
9,olivertwist225,dwedzjw,/r/pennystocks/comments/87nxc2/how_do_you_deal_with_your_loses/dwedzjw/,1,"I think the real question you should be asking yourself is if you're worrying about losing your money, do you even have the money to lose.",2018-03-28
10,demedus,dweeajt,/r/pennystocks/comments/87nxc2/how_do_you_deal_with_your_loses/dweeajt/,1,That is MY strategy too!,2018-03-28
11,avaldez321,dweegmw,/r/pennystocks/comments/87nxc2/how_do_you_deal_with_your_loses/dweegmw/,1,Me when I bought and kept buying NVCN,2018-03-28
12,Luffykyle,dweejs7,/r/pennystocks/comments/87nxc2/how_do_you_deal_with_your_loses/dweejs7/,1,lol I was just thinking the same thing. I bought it at .20 then I bought it at .17 then I bought it at .13 and now I’m stuck with an average of .17,2018-03-28
13,le_saint94,dweenus,/r/pennystocks/comments/87o31b/vate/dweenus/,1,Pump n dump ,2018-03-28
14,WonkyWombat321,dwefrbu,/r/pennystocks/comments/87nxc2/how_do_you_deal_with_your_loses/dwefrbu/,1,"This is a hard question to answer because it depends on your trade habits. As a patient bottom feeder if I get a fill in the first place I'm lucky, if it falls a decent bit below my original buy in that's a blessing. That being said, before I ever average down I always reassess my original thinking to see if it still stands firm. I have very few losses in the penny space, but I also don't fill the majority of the buy orders I place. 

When a play I'm in is up 3x I will typically play both sides given how volatile penny stocks are. HCEI for example I entered at .0005, sold a few mill above .002 and have filled bids in the low teens since the most recent run. I've filled multiple 11 bids and also filled several sell orders at 22 and 19. This personally keeps me focused and constantly reanalyzing my plays without the risk of missing out on a big move since I hold onto my core position until what I'm waiting for comes to fruition (or doesn't).",2018-03-28
15,for_whatever_reason_,dwefsw7,/r/pennystocks/comments/87nxc2/how_do_you_deal_with_your_loses/dwefsw7/,1,You can do anything if you're not afraid,2018-03-28
16,Mikeyt1250,dwefvqm,/r/pennystocks/comments/87o31b/vate/dwefvqm/,1,"Warrants. They have 8 million expiring on the first of April and a bunch more on the 8th. People claim the warrants and then dump for profit. On top of that, shorters. It's a penny stock that is volatile, almost all stocks decline after big news spikes, and with warrants being claimed , its a shorters dream. Don't worry, the long game will pay off big time on this one.",2018-03-28
17,mistertyz,dwegqzk,/r/pennystocks/comments/87o31b/vate/dwegqzk/,1,Thank you Mikey! Am I right then to assume the middle of next week would be a good time to accumulate? ,2018-03-28
18,1827338989,dweigqt,/r/pennystocks/comments/87nxc2/how_do_you_deal_with_your_loses/dweigqt/,1,I cut the loss before losing 20%. Way before.,2018-03-28
19,Fotivator,dwel0we,/r/pennystocks/comments/87nxc2/how_do_you_deal_with_your_loses/dwel0we/,1,"A rule of thumb for me is to look at the 52w performance. If the thing looks like a rollercoaster ride you can clearly see the stock is used for whats called short plays. Lets say a stock's 52w performance is 0.09-1.75 and the stock is currently at 1.45, unless you have insider information or see some massive piece of news before anyone else does, your best bet is to stay away from the stock until it goes back down to the 0.30-0.50 range. 

Now if the stocks 52w history looks like a steady (yet bumpy) uphill climb continuously, then those are the stocks you can usually invest in and go for a ""long play"" until you make your own investment back and then some. 

The only thing I can recommend is watch the ranges, get as close to the low as you can, and then sell as close to the high as possible. It sounds dumb and trivial, but you'd be surprised how many people don't even research the stocks performance for the year before just placing an order off of the day's price. Just remember, always have a buy number in your head and always have a sell number in your head. Don't be impatient and don't be greedy. These two mental notes have earned me quite a bit of money in my time day trading, Good luck.",2018-03-28
20,jigre1,dwel5jb,/r/pennystocks/comments/87nxc2/how_do_you_deal_with_your_loses/dwel5jb/,1,Whiskey and tears...,2018-03-28
21,good4steve,dwemrxf,/r/pennystocks/comments/87piae/thoughts_on_abio/dwemrxf/,1,What are your thoughts? ,2018-03-28
22,Fotivator,dwenm8g,/r/pennystocks/comments/87piae/thoughts_on_abio/dwenm8g/,1,"Asking Reddit if you should buy a stock or not isn't really the best investing practice. Do your research and make an educated decision. 


I will say however that if you look at their 52w high and low, they're very close to their current maximum low. If you were looking for a short play, this would be the time to get in. ",2018-03-28
23,Huffy1506,dweoy3i,/r/pennystocks/comments/87o31b/vate/dweoy3i/,1,You have absolutely no idea what you are talking about... ,2018-03-28
24,Dem827,dwepuhf,/r/pennystocks/comments/87o31b/vate/dwepuhf/,1,/s,2018-03-28
25,berto0311,dweunpm,/r/pennystocks/comments/87o31b/vate/dweunpm/,1,So it would be best to wait till after the 8th to go all in?,2018-03-28
26,Mikeyt1250,dweuo0z,/r/pennystocks/comments/87o31b/vate/dweuo0z/,1,"Yeah even late next week, as people will be dumping right up to the bell on Friday. Won't be surprised to see high 30's which would be a steal for this stock",2018-03-28
27,Mikeyt1250,dweuuw3,/r/pennystocks/comments/87o31b/vate/dweuuw3/,1,"Well, I would think middle of next week before the 8th, only because once this block of warrants is done, you should see a steady up swing, and with any news release a pretty big spike. 

Institutions haven't bought in yet, as they are aware of these warrants and they like to wait until the volatility is at its lowest. and really this drug and their pipeline drugs are game changers, so currently undervalued. After the eighth you should see a steady climb. 

Unfortunately my crystal ball is broken, but this is my best speculation based on what I know.",2018-03-28
28,Anderjesse,dwewl1b,/r/pennystocks/comments/87o31b/vate/dwewl1b/,1,What is a warrant Miley?,2018-03-28
29,Mikeyt1250,dwews0x,/r/pennystocks/comments/87o31b/vate/dwews0x/,1,"A warrant is an option to buy shares at a set price at anytime up to expiration of the warrant. They are used to attract people to buy shares of a stock that is looking to get a cash injection. 

So for example, if you 'x' amount of shares at this price, we will give you 'x' amount of warrants at this price. You don't have to use the warrants, but if the stocks go up beyond the warrant price, it's easy money.

Currently this ATE warrants are at .15, so an easy 3X return ",2018-03-28
30,Anderjesse,dwexeeh,/r/pennystocks/comments/87o31b/vate/dwexeeh/,1,Basically ATE won’t sky rocket until phase 4 is done so 2+ some years?,2018-03-28
31,Dillweed7,dweyjcu,/r/pennystocks/comments/87nxc2/how_do_you_deal_with_your_loses/dweyjcu/,1,"Rinse, repeat. Ready to go back to my job... extra motivated and subordinate.",2018-03-28
32,Mikeyt1250,dweys97,/r/pennystocks/comments/87o31b/vate/dweys97/,1,"No. They won't be doing phase 3 or 4. They are a perfect candidate for a buy out. Amazing product, no capital. I don't know what your definition of sky rocket is, but with the right partnership $2-$5 is definitely within the realm ",2018-03-28
33,Anderjesse,dwezled,/r/pennystocks/comments/87o31b/vate/dwezled/,1,"Yea, I apologize for using the moonboi terms. Why aren’t they doing the he next phases? I don’t assume they are just going to stay stagnant until they are gobbled up",2018-03-28
34,Mikeyt1250,dwf09dn,/r/pennystocks/comments/87o31b/vate/dwf09dn/,1,"They just don't have the capital. They will do them if they are able to partner, and that's what their investment presentation says, but without that, they just don't have enough to even get through phase 3. My guess is the big pharmas would rather take this on themselves and buy out this company before its value is in the 3+ billion range ",2018-03-28
35,Anderjesse,dwf0r1m,/r/pennystocks/comments/87o31b/vate/dwf0r1m/,1,"I gotcha, I greatly appreciate you explaining things. Do you believe there is a chance that no one will be interested in taking on their NSAID? Or is it a pretty much given that all they are looking for is a good offer?",2018-03-28
36,Mikeyt1250,dwf1jjd,/r/pennystocks/comments/87o31b/vate/dwf1jjd/,1,"Their NSAID literally could change the world. I know that sounds extreme but there are implications across the health sectors that people don't even realize with this drug. It is almost twice as effective as the current leading NSAID and the trial revealed it is literally 16x safer. There are things NSAIDs do that have been ignored because of what they do to GI tracts; for example shrink cancer rumours. 

A lot of pharmas are interested in this one. It's just a matter of what's on the table in the bargaining process. Obviously I can't know for sure, but I would imagine Antibe has had some offers already, but I'm also sure they aren't going to just take the first offer on the table because of how revolutionary their drug is. Only time will tell",2018-03-28
37,drgreenthumbatx420,dwf1myc,/r/pennystocks/comments/87o31b/vate/dwf1myc/,1,From what I can understand this drug is supposed to be an NSAID that does not have the same gastrointestinal side effects that drugs like ibuprofen does. ,2018-03-28
38,Anderjesse,dwf1scx,/r/pennystocks/comments/87o31b/vate/dwf1scx/,1,Yes you are correct in this and like stated above it is way safer (over 16x),2018-03-28
39,Anderjesse,dwf1tlt,/r/pennystocks/comments/87o31b/vate/dwf1tlt/,1,CraZy stuff. Seriously amazing. ,2018-03-28
40,nhnick,dwf29i6,/r/pennystocks/comments/87nxc2/how_do_you_deal_with_your_loses/dwf29i6/,1,Only by knowing the money I lost was what I could afford to lose. And beer.,2018-03-28
41,driv818,dwf2dh6,/r/pennystocks/comments/87s1a1/plays_for_the_day/dwf2dh6/,1,Today I'm following BKPPF INPX BIOC GTBP TNDM  TVIX,2018-03-28
42,80s_kid_1974,dwf2tnd,/r/pennystocks/comments/87s34s/what_exactly_am_i_doing_wrong/dwf2tnd/,1,Just find a mutual fund or etf and set it forget it.  What your doing now is gambling.,2018-03-28
43,israel1947,dwf315w,/r/pennystocks/comments/87s34s/what_exactly_am_i_doing_wrong/dwf315w/,1,"I’m following the stocks mentioned here and people say it looks promising but it’s like a fucking curse or something. The stocks are growing and as SOON as I buy it, it starts to drop like crazy. ",2018-03-28
44,silverwhere81,dwf34mh,/r/pennystocks/comments/87o31b/vate/dwf34mh/,1,We should know by tomorrow at 4pm as TSX will be closed Friday and Monday for Good Friday and Easter Monday.  Its by understanding that warrants cannot be exercised when market is closed.,2018-03-28
45,Morsyn,dwf3629,/r/pennystocks/comments/87s34s/what_exactly_am_i_doing_wrong/dwf3629/,1,"I mean the whole market was down yesterday and today, looking to be rebounding a bit though.",2018-03-28
46,austxtencentbaba,dwf3kt9,/r/pennystocks/comments/87s34s/what_exactly_am_i_doing_wrong/dwf3kt9/,1,"When you decide on a stock to buy don’t buy in all at once. Leave a little room just in case it dips. Keep buying in the dips to make your average cost go down. When the market settles down it’ll bounce back. Just hold for now. The scary part is finding the bottom. 
",2018-03-28
47,gsuato17,dwf3m1e,/r/pennystocks/comments/87s1a1/plays_for_the_day/dwf3m1e/,1,NVCN ,2018-03-28
48,[deleted],dwf3olp,/r/pennystocks/comments/87s34s/what_exactly_am_i_doing_wrong/dwf3olp/,1,[removed],2018-03-28
49,xxbearillaxx,dwf4m8h,/r/pennystocks/comments/87o31b/vate/dwf4m8h/,1,This may be a stupid question (noobie) would this be ATBPF on OTC?,2018-03-28
50,berto0311,dwf4r1i,/r/pennystocks/comments/87o31b/vate/dwf4r1i/,1,Yes,2018-03-28
51,ryandeanrocks,dwf528q,/r/pennystocks/comments/87s34s/what_exactly_am_i_doing_wrong/dwf528q/,1,"The incentive of someone on reddit telling everyone else that a stock is going to take off, is to make profit. They found a stock on sale, bought a lot and then flood to reddit to try to generate hype for it so the price will go up for them.

Don’t blindly follow reddit investing advice, especially for a gamble like penny stocks.",2018-03-28
52,xxbearillaxx,dwf52je,/r/pennystocks/comments/87o31b/vate/dwf52je/,1,Thanks.,2018-03-28
53,SexyLibertarian,dwf56pe,/r/pennystocks/comments/87s34s/what_exactly_am_i_doing_wrong/dwf56pe/,1,"Ever heard the saying “if you’re not paying for the product, you are the product”? It goes for financial advice also. Google pump and dump then think logically why anyone would go online and tell a bunch of strangers about a hot stock tip, for free. Not saying every person here is pumping intentionally, but by echoing info you get without any firsthand knowledge you’re likely just perpetuating a pump ",2018-03-28
54,Starskins,dwf5af4,/r/pennystocks/comments/87s34s/what_exactly_am_i_doing_wrong/dwf5af4/,1,You are chasing. Plain and simple. ,2018-03-28
55,salem833,dwf6hlu,/r/pennystocks/comments/87s34s/what_exactly_am_i_doing_wrong/dwf6hlu/,1,"One of my top rules for stock trading is ""Never chase"" if its up &gt;4-5% on the day, ill skip it entirely and mark it as a miss. 
Youre supposed to catch it before it lifts off",2018-03-28
56,TRANFRAN,dwf6mud,/r/pennystocks/comments/87s34s/what_exactly_am_i_doing_wrong/dwf6mud/,1,Rule number one: do the opposite of thus subreddit.,2018-03-28
57,avaldez321,dwf76t8,/r/pennystocks/comments/87si41/best_time_to_buy_in/dwf76t8/,1,"Now, markets down",2018-03-28
58,krazytekn0,dwf7gt5,/r/pennystocks/comments/87s34s/what_exactly_am_i_doing_wrong/dwf7gt5/,1,"This is literally gambling. You are buying high and selling low that's the only thing you can be doing wrong. That and you're doing literally 0 research it sounds like. This sub is full of people trying to hype stuff they own so they can make a buck. If you view penny stocks as anything other than high risk / disposable money, you're doing it wrong. ",2018-03-28
59,ryoon21,dwf7kix,/r/pennystocks/comments/87s34s/what_exactly_am_i_doing_wrong/dwf7kix/,1,"My general rule of thumb is, when things are looking good for a stock, it’s too late. When a stock plummets for no reason, then it’s time to buy. ",2018-03-28
60,krazytekn0,dwf7n3m,/r/pennystocks/comments/87s34s/what_exactly_am_i_doing_wrong/dwf7n3m/,1,"It's just basic psychology, also you should totally buy NVCN, it's just about to rebound from it's 52 week low..... *cough*",2018-03-28
61,itzjamesftw,dwf7o1o,/r/pennystocks/comments/87s34s/what_exactly_am_i_doing_wrong/dwf7o1o/,1,"&gt; I’m following the stocks mentioned here and people say it looks promising but it’s like a fucking curse or something. 

Everything here is based incredibly on opinion and opinion fails when coming to the stock market at a higher clip than us being right.",2018-03-28
62,tacopwnsyou,dwf8zsq,/r/pennystocks/comments/87nxc2/how_do_you_deal_with_your_loses/dwf8zsq/,1,Nice name.  I'm over in silverbugs a lot.,2018-03-28
63,phogeddaboudit,dwfcmbd,/r/pennystocks/comments/87s34s/what_exactly_am_i_doing_wrong/dwfcmbd/,1,Double down!,2018-03-28
64,IGOSODAMNHAM,dwfcny3,/r/pennystocks/comments/87s34s/what_exactly_am_i_doing_wrong/dwfcny3/,1,You don't know how to read charts or MOMO. Also following picks you see here is stupid because I can tell you for a fact that they are always late. By the time a stock gets posted here it's almost always late and going to sell off soon.,2018-03-28
65,rplusj1,dwfcpwi,/r/pennystocks/comments/87s34s/what_exactly_am_i_doing_wrong/dwfcpwi/,1,"&gt; I’m following the stocks mentioned here and people say it looks promising 

That's the right way to lose money. Just because someone flooded this sub saying stock is good doesn't mean you have to buy it. Take a note of that stock. Read more about it. Check how it is performed in last 1 month, 3 months and an year. Now if you like the stock keep it on your watchlist. ",2018-03-28
66,rplusj1,dwfcs3m,/r/pennystocks/comments/87s34s/what_exactly_am_i_doing_wrong/dwfcs3m/,1,Ehm.. Buy BPMX and GERN.. ,2018-03-28
67,rplusj1,dwfcxwg,/r/pennystocks/comments/87s34s/what_exactly_am_i_doing_wrong/dwfcxwg/,1,And sell it if you get good gains in one day. High chances it will fall next day.  Once I got 16% a day and waited another day to sell @ more profit. Boom. Down to 28%. Now I just sell after one day's profit.,2018-03-28
68,Dr_Emmet_Brown,dwfg0o5,/r/pennystocks/comments/87s34s/what_exactly_am_i_doing_wrong/dwfg0o5/,1,Bad market last few weeks. Stop selling and hold out to make some gains back. The only person who gets injured on a roller coaster is the one who jumps out. ,2018-03-28
69,lovelessowl,dwfgwau,/r/pennystocks/comments/87s34s/what_exactly_am_i_doing_wrong/dwfgwau/,1,"I know where he's/she's coming from. I'm just getting my feet wet investing as well. I try to do research to find companies in industries I'm familiar with that I can afford, but when it comes to pennies, I don't know where to start to find stocks worth buying. This sub is about as accessible as it gets, and it would really be too bad if everyone was just trying to screw each other over so they could dump their mistakes for less of a loss.",2018-03-28
70,israel1947,dwfiwrr,/r/pennystocks/comments/87s34s/what_exactly_am_i_doing_wrong/dwfiwrr/,1,I guess my question then is how do you know it won’t plummet even more and potentially have the company go bankrupt?,2018-03-28
71,jigre1,dwfk0sy,/r/pennystocks/comments/87tb8z/uavs/dwfk0sy/,1,"If my math is right, that's higher than ENRJ if you multiply the RS by their last price (which I was expecting). Not by much but I'll be happy to get my 45 shares or whatever if they are ready to climb. I've done some research since the merger announcement but can't give any input on it worthwhile.",2018-03-28
72,ryoon21,dwfkg5a,/r/pennystocks/comments/87s34s/what_exactly_am_i_doing_wrong/dwfkg5a/,1,"Like everyone says, it’s always a gamble. But typically, when there isn’t any new news, stocks have their usual peaks and valleys. It’s a safe bet to set a buy limit at a previous valley (low point). Follow the trends though. In the world of pennies, what goes up, will eventually come down.  ",2018-03-28
73,queenslandbananas,dwfl1he,/r/pennystocks/comments/87s34s/what_exactly_am_i_doing_wrong/dwfl1he/,1,"&gt; I’m following the stocks mentioned here

That is your mistake.",2018-03-28
74,xxbearillaxx,dwfm17t,/r/pennystocks/comments/87s34s/what_exactly_am_i_doing_wrong/dwfm17t/,1,I plan on blindly following your advice because my infant needs more formula and I have 50 bucks to my name.  Trying to turn that into a billion real quick.  Thanks for the heads up. ,2018-03-28
75,xxbearillaxx,dwfm6cn,/r/pennystocks/comments/87s34s/what_exactly_am_i_doing_wrong/dwfm6cn/,1,"Ever heard of Pac Sun?  I bought in when I was a lot younger, think 16.  Did great for a long time, and then the company went bankrupt and all I had in there was gone.  It can happen to bigger companies.  10x more likely to happen to these companies.  You shouldn't be buying penny stocks unless you'd also be willing to put that money on a game of blackjack at a casino.  Although Blackjack might give you better odds. ",2018-03-28
76,le_saint94,dwfmn7b,/r/pennystocks/comments/87tb8z/uavs/dwfmn7b/,1,"Yeah I’m a bit nervous about when RH selling opens up, so we’ll see how that goes...",2018-03-28
77,Zmac122,dwfplmm,/r/pennystocks/comments/87s34s/what_exactly_am_i_doing_wrong/dwfplmm/,1,"Dont buy meme stocks, my dude",2018-03-28
78,Dillweed7,dwfqczj,/r/pennystocks/comments/87s34s/what_exactly_am_i_doing_wrong/dwfqczj/,1,NVCN rising.,2018-03-28
79,rayaman,dwfsvym,/r/pennystocks/comments/87s34s/what_exactly_am_i_doing_wrong/dwfsvym/,1,To be honest with Penny stocks you have a better chance of making money if you buy them randomly then following what others say...,2018-03-28
80,krazytekn0,dwft11g,/r/pennystocks/comments/87s34s/what_exactly_am_i_doing_wrong/dwft11g/,1,"sweet, now I can dump that shit",2018-03-28
81,SEIGOF_KONN,dwft2rm,/r/pennystocks/comments/87nxc2/how_do_you_deal_with_your_loses/dwft2rm/,1,"It's not a loss until you sell. I'm down over 20% in past month overall, but that's still about $1k for me (full-time student, part-time $15/hr). I figure if we're unknowingly in the start of a recession I may as well take the 60-80% hit and try to bounce back with the market.",2018-03-28
82,RTShark,dwftuya,/r/pennystocks/comments/87s34s/what_exactly_am_i_doing_wrong/dwftuya/,1,I always sell some on the way up.  Say I have 5000 shares of a 50 cent stock I will sell a third to half at first five to ten cent pop depending on how strong the action is to lock in profit.  Let the rest ride with stop on entry.  Will move stop up as price action dictates.,2018-03-28
83,Dillweed7,dwfui1t,/r/pennystocks/comments/87s34s/what_exactly_am_i_doing_wrong/dwfui1t/,1,... and falling.,2018-03-28
84,theoni21,dwfuitw,/r/pennystocks/comments/87nxc2/how_do_you_deal_with_your_loses/dwfuitw/,1,"Just wait it out , if you don’t believe in the company, sell it when it reaches break even or small loss. If not just wait till it goes back up. Was -20% for like 4 months , then up 30% sold. ",2018-03-28
85,CanSomeSlam,dwfuntp,/r/pennystocks/comments/87s34s/what_exactly_am_i_doing_wrong/dwfuntp/,1,"by the time a stock is green, a lot of times its too late to buy. I do all of my buying on red days on big pullbacks ",2018-03-28
86,CanSomeSlam,dwfv0uj,/r/pennystocks/comments/87si41/best_time_to_buy_in/dwfv0uj/,1,"wait until there is a selloff day, like today. then watch level 2 closely, and you will see bidders step in to stop a downtrend. that's usually when I add. ",2018-03-28
87,ExtensionWerewolf,dwfwazo,/r/pennystocks/comments/87vnxh/wrfx/dwfwazo/,1,Anything for us that don't use the book of faces and too lazy to google?,2018-03-28
88,qbcl_kdr,dwfwdd7,/r/pennystocks/comments/87s34s/what_exactly_am_i_doing_wrong/dwfwdd7/,1,"You can go wrong twice in a trade. (Personal Experience).

* You buy at the wrong time. (i bought a lot of BABA stock for 90 in 2014)
* You Sell at the wrong time. (i Sold It for 80)

I could have made a killing If i still owned it or held it for sometime.

- penny stocks are unreliable, I invested in one company stock and held the stock for too long. the company was delisted from the exchange eventually.(You should not take any advice off the internet make sure you do your own DD)",2018-03-28
89,silverlakes123,dwfwgkk,/r/pennystocks/comments/87vnxh/wrfx/dwfwgkk/,1,"Haha that video should be public, it’s a great video to watch...I just caught wind of it and it has answered every question that I have had so far. If that link doesn’t work google worldflix inc Facebook and you should see it ",2018-03-28
90,[deleted],dwfx3go,/r/pennystocks/comments/87o31b/vate/dwfx3go/,1,[removed],2018-03-28
91,BolenArrow,dwfxfyy,/r/pennystocks/comments/87vjrr/andi/dwfxfyy/,1,I bought this at .019 and didn't sell when it hit .03 like an idiot... now I am sad.,2018-03-28
92,SketchyCharmander,dwfxiry,/r/pennystocks/comments/87o31b/vate/dwfxiry/,1,I bought a decent chunk of shares a couple weeks ago.  How did you know about the warrants?,2018-03-28
93,goofie_newfie6969,dwfxp1c,/r/pennystocks/comments/87si41/best_time_to_buy_in/dwfxp1c/,1,MMEX,2018-03-28
94,WarrenPuff_It,dwfy3x2,/r/pennystocks/comments/87si41/best_time_to_buy_in/dwfy3x2/,1,"Buy on red days, sell on green days. Duh.",2018-03-28
95,ContrarianHero,dwfy8gl,/r/pennystocks/comments/87si41/best_time_to_buy_in/dwfy8gl/,1,The bottom.,2018-03-28
96,RES_KnowsYourSins,dwfzcoy,/r/pennystocks/comments/87s34s/what_exactly_am_i_doing_wrong/dwfzcoy/,1,"But if this sub follows rule number one.... do I.... not follow rule number and do what this subreddit does... which is to follow rule number one... and... 

Oh God my brain hurts",2018-03-28
97,Shull-z,dwfzuaq,/r/pennystocks/comments/87vnxh/wrfx/dwfzuaq/,1,Can't find the symbol 🤔,2018-03-28
