,title,id,author,url,score,num_comments,text,date,link
0,CLNY testing the 30 day high,fzo2li,BlackAnvilEgo42,https://www.reddit.com/r/pennystocks/comments/fzo2li/clny_testing_the_30_day_high/,2,1,"CLNY fell below 2.46 on 3/13, tested on 3/26 but averaged down again. Strong bullish movement over the past week pushed to 2.45 Thursday. It's a juicy looking dip, but volatility has me scared to pull the trigger Monday. Anyone have better clarity on this than I? Are we looking at the ceiling, or the launchpad at 2.50?",2020-04-12,https://www.reddit.com/r/pennystocks/comments/fzo2li/clny_testing_the_30_day_high/
1,Aytu,fzmylw,AcrobaticWord2,https://www.reddit.com/r/pennystocks/comments/fzmylw/aytu/,0,10,New analyst price target $75 - 1 out of 1 or 100% of analysts recommends it as a buy (me),2020-04-12,https://www.reddit.com/r/pennystocks/comments/fzmylw/aytu/
2,CYDY in Monday. Incredible solid non pump company. Do you DDs on how will will be a strong anti viral.. I’m buying more on Monday !,fzryxt,tboydoboe,https://www.reddit.com/r/pennystocks/comments/fzryxt/cydy_in_monday_incredible_solid_non_pump_company/,1,0,[removed],2020-04-12,https://www.reddit.com/r/pennystocks/comments/fzryxt/cydy_in_monday_incredible_solid_non_pump_company/
3,Howtotrade,fzt8lp,JasonA121,https://www.reddit.com/r/pennystocks/comments/fzt8lp/howtotrade/,7,2,"Ive created a new community! Just search for Howtotrade. for anyone that wants to learn something new about trading! hope we can all help each other out to become better traders!
🤝 it’s brand new so post and comment to get the ball rolling 😀",2020-04-12,https://www.reddit.com/r/pennystocks/comments/fzt8lp/howtotrade/
4,BCRX...thoughts?,fzsh3k,BrianBash,https://www.reddit.com/r/pennystocks/comments/fzsh3k/bcrxthoughts/,1,1,"Trump pump, talked about it at his press conference Thursday. Thoughts?",2020-04-12,https://www.reddit.com/r/pennystocks/comments/fzsh3k/bcrxthoughts/
5,"Mexico signed late Friday, who's buyin oil?",fzvftu,chrysler82000,https://www.reddit.com/r/pennystocks/comments/fzvftu/mexico_signed_late_friday_whos_buyin_oil/,1,0,[removed],2020-04-12,https://www.reddit.com/r/pennystocks/comments/fzvftu/mexico_signed_late_friday_whos_buyin_oil/
6,LPI worth it?,fzut8a,_Scrypto_,https://www.reddit.com/r/pennystocks/comments/fzut8a/lpi_worth_it/,1,2,"For a long hold and some nice gains? Would that be something? It was a bit volatile in the past. I'm wondering if they ever get back to at least 3 bucks withhin the next year+ Could be a nice gain for the long game after the wuflu

Edit: Spelling",2020-04-12,https://www.reddit.com/r/pennystocks/comments/fzut8a/lpi_worth_it/
7,"Noob Question/DD - Why doesn't there seem to be more discussion/investment in high dividend stocks such as TRTX, MFA, RWT, NYMT?",fzxkqd,XanTheGreycloak,https://www.reddit.com/r/pennystocks/comments/fzxkqd/noob_questiondd_why_doesnt_there_seem_to_be_more/,5,12,"I'm very new to the investing world having just recently downloaded the Robinhood app and tossed some throwaway money from online surveys into the account. I've been looking at this sub and the Robinhood sub for a couple weeks now and was wondering why I don't see more discussion on Reddit about stocks like the ones listed above that have dividends such as 70.18 and 41.88, and were consistent prices looking at the 5-year before the crash with plenty of potential to rise back up.

Aren't these the type of stocks that could give you the most bang for your buck if you invest while they're low and then just hang on once they're at pre-crash levels? Or is there something I'm overlooking as a complete beginner?

Thanks in advance for any thoughts or commentary on the subject.",2020-04-12,https://www.reddit.com/r/pennystocks/comments/fzxkqd/noob_questiondd_why_doesnt_there_seem_to_be_more/
8,"Noob Question - Why doesn't there seem to be more discussion/investment is high dividend stocks such as TRTX, MFA, RWT, NYMT?",fzxj7n,[deleted],https://www.reddit.com/r/pennystocks/comments/fzxj7n/noob_question_why_doesnt_there_seem_to_be_more/,1,0,[deleted],2020-04-12,https://www.reddit.com/r/pennystocks/comments/fzxj7n/noob_question_why_doesnt_there_seem_to_be_more/
9,$RWT,fzwceh,joe51299,https://www.reddit.com/r/pennystocks/comments/fzwceh/rwt/,3,4,"Anyone holding this in hopes that it returns to even half of what it was before the recession. In the teens for a while, dipped dramatically, lagging behind other REITS? anyone?",2020-04-12,https://www.reddit.com/r/pennystocks/comments/fzwceh/rwt/
10,$DECN,fzvyn6,DaBrainfuckler,https://www.reddit.com/r/pennystocks/comments/fzvyn6/decn/,0,19,Anyone planning on holding on to this? There's chatter that FDA approval is imminent but that's been the talk for a week. Starting to think that it's bullshit.,2020-04-12,https://www.reddit.com/r/pennystocks/comments/fzvyn6/decn/
11,Dumb?? How can a company that is permanently revoked be hitting new highs??,fzzu2v,harsh-truth,https://www.reddit.com/r/pennystocks/comments/fzzu2v/dumb_how_can_a_company_that_is_permanently/,2,2,Near total NOOB here. I had a typo that brought up USWF. Saw it was reaching new highs 19900% and looked into it. Found the website is now a Chinese Restaurant and it was permanently revoked in 2004. Si what's the deal here?,2020-04-12,https://www.reddit.com/r/pennystocks/comments/fzzu2v/dumb_how_can_a_company_that_is_permanently/
12,Your favorite stock news/scanner apps,fzzkz3,mattbdubya,https://www.reddit.com/r/pennystocks/comments/fzzkz3/your_favorite_stock_newsscanner_apps/,37,11,"Just wondering what your favorite apps are to scan for new stocks or get updates on 'strong buys' etc. Paid or free, just looking to increase my research capabilities",2020-04-12,https://www.reddit.com/r/pennystocks/comments/fzzkz3/your_favorite_stock_newsscanner_apps/
13,volume forcast indicator,fzzdf6,BOUARARA05,https://www.reddit.com/r/pennystocks/comments/fzzdf6/volume_forcast_indicator/,1,0,[removed],2020-04-12,https://www.reddit.com/r/pennystocks/comments/fzzdf6/volume_forcast_indicator/
14,USWS thought???,fzz62a,g553194,https://www.reddit.com/r/pennystocks/comments/fzz62a/usws_thought/,4,12,I bought in on the drop Thursday@ .65 after reading about the big contract the signed with EQT. Anyone else watching this and feel like it will shoot up this week?,2020-04-12,https://www.reddit.com/r/pennystocks/comments/fzz62a/usws_thought/
15,VOLUME FORCAST INDICATOR,fzz2x1,BOUARARA05,https://www.reddit.com/r/pennystocks/comments/fzz2x1/volume_forcast_indicator/,1,0,[removed],2020-04-12,https://www.reddit.com/r/pennystocks/comments/fzz2x1/volume_forcast_indicator/
16,On demand Pharmacy stocks could become the next big thing.,fzyt86,cacorangel,https://www.reddit.com/r/pennystocks/comments/fzyt86/on_demand_pharmacy_stocks_could_become_the_next/,13,7,"My thought process: 

Coronavirus is more likely to attack older people. 

These people need medication (blood pressure, cholesterol, etc). 

Going to a pharmacy now is more dangerous than ever. 

Medication cannot be openly sold through e-commerce BUT it can be sold online with the right tools.

I found this a couple days ago and asked around. Still doing research. Thoughts? 

Pharmcorx.com &gt; about &gt; investors

https://backend.otcmarkets.com/otcapi/company/financial-report/242806/content

Looks good! Over 40k prescriptions/month.",2020-04-12,https://www.reddit.com/r/pennystocks/comments/fzyt86/on_demand_pharmacy_stocks_could_become_the_next/
17,How do you feel about TOPS and SHIP tomorrow?,fzxvyp,mwd1981,https://www.reddit.com/r/pennystocks/comments/fzxvyp/how_do_you_feel_about_tops_and_ship_tomorrow/,1,0,[removed],2020-04-12,https://www.reddit.com/r/pennystocks/comments/fzxvyp/how_do_you_feel_about_tops_and_ship_tomorrow/
18,My custom break out potential scanner! Hope you get some use out of it!,fzpni1,ericwcharmon,https://www.reddit.com/r/pennystocks/comments/fzpni1/my_custom_break_out_potential_scanner_hope_you/,57,8,,2020-04-12,/r/RobinhoodYachtClub/comments/fzofpl/my_custom_scanner_built_to_detect_stocks_with/
19,Best Trading Account for Penny Stocks,fzpm4c,choice_name,https://www.reddit.com/r/pennystocks/comments/fzpm4c/best_trading_account_for_penny_stocks/,1,0,[removed],2020-04-12,https://www.reddit.com/r/pennystocks/comments/fzpm4c/best_trading_account_for_penny_stocks/
20,Pre market tells,fzp913,jacobbodd,https://www.reddit.com/r/pennystocks/comments/fzp913/pre_market_tells/,3,18,I'm a pretty beginner trader following the markets. When looking at my watch-list in the morning i'm not sure what to look for pre-market that is indicative of a incoming spike or drop. Anyone have good tips?,2020-04-12,https://www.reddit.com/r/pennystocks/comments/fzp913/pre_market_tells/
21,PACD.... should I sell and break even or sell?,fzohxf,GetMeBluntz,https://www.reddit.com/r/pennystocks/comments/fzohxf/pacd_should_i_sell_and_break_even_or_sell/,1,3,"
I’m kinda new I really want to see if anyone else has any ideas about PACD. Up, down... sell, hold... I am not sure how opec might affect it since most people think the oil reduction wasn’t enough",2020-04-12,https://www.reddit.com/r/pennystocks/comments/fzohxf/pacd_should_i_sell_and_break_even_or_sell/
22,IPIX,g056yu,broavrock,https://www.reddit.com/r/pennystocks/comments/g056yu/ipix/,3,0,Thoughts on IPIX?  Debate between its legitimacy as a potential therapeutic and it just being a recycled pharmaceutical.,2020-04-12,https://www.reddit.com/r/pennystocks/comments/g056yu/ipix/
23,TBLT prospect?,g04u1r,brooksjd0518,https://www.reddit.com/r/pennystocks/comments/g04u1r/tblt_prospect/,144,30,,2020-04-12,https://i.redd.it/9e16cvhhcgs41.jpg
24,DECN,g04f33,brooksjd0518,https://www.reddit.com/r/pennystocks/comments/g04f33/decn/,9,21,"This looks like it'll have resistance around $.50 if it can break the recent resistance. 

At some point, I see this hitting a dollar. I also see it going back and forth a lot.",2020-04-12,https://www.reddit.com/r/pennystocks/comments/g04f33/decn/
25,$OGEN,g049qc,msatsyt,https://www.reddit.com/r/pennystocks/comments/g049qc/ogen/,12,45,Do you guys think it is worth it?,2020-04-12,https://www.reddit.com/r/pennystocks/comments/g049qc/ogen/
26,GPOR,g049gz,Sweettear74,https://www.reddit.com/r/pennystocks/comments/g049gz/gpor/,2,0,Will GPOR react to the oil production cut news ?,2020-04-12,https://www.reddit.com/r/pennystocks/comments/g049gz/gpor/
27,Who's in on BIOC?,g03dl4,DaneDesigns,https://www.reddit.com/r/pennystocks/comments/g03dl4/whos_in_on_bioc/,3,13,How is everyone feeling for tmrw? Selling tmrw morning?,2020-04-12,https://www.reddit.com/r/pennystocks/comments/g03dl4/whos_in_on_bioc/
28,Is there any penalty for owning stocks? A Tax?,g032vg,[deleted],https://www.reddit.com/r/pennystocks/comments/g032vg/is_there_any_penalty_for_owning_stocks_a_tax/,1,1,[deleted],2020-04-12,https://www.reddit.com/r/pennystocks/comments/g032vg/is_there_any_penalty_for_owning_stocks_a_tax/
29,Is Oil (PCE) worth investing in on Monday?,g06prf,Kaidaros,https://www.reddit.com/r/pennystocks/comments/g06prf/is_oil_pce_worth_investing_in_on_monday/,8,5,"I just began investing, so would it be worth it to buy pce stocks when the market opens tomorrow?",2020-04-12,https://www.reddit.com/r/pennystocks/comments/g06prf/is_oil_pce_worth_investing_in_on_monday/
30,Apr 13 PICKS,g06ocr,_SaulGood,https://www.reddit.com/r/pennystocks/comments/g06ocr/apr_13_picks/,3,7,"**Jounce Therapeutics, Inc. (JNCE)**

Profit Margin =38.43% (Yahoo Finance)

**Cenovus Energy Inc. (CVE)**

Profit Margin =10.87% (Yahoo Finance)

&amp;#x200B;

* Individuals invest @ their own risk.",2020-04-12,https://www.reddit.com/r/pennystocks/comments/g06ocr/apr_13_picks/
31,"Tomorrow is the big day! We get to see what oil is going to to, what are your predictions? What stocks are you holding?",g05ugp,TheHidestHighed,https://www.reddit.com/r/pennystocks/comments/g05ugp/tomorrow_is_the_big_day_we_get_to_see_what_oil_is/,11,17,"Basically the title. I've got KOS and CPE, ready for a surge!",2020-04-12,https://www.reddit.com/r/pennystocks/comments/g05ugp/tomorrow_is_the_big_day_we_get_to_see_what_oil_is/
32,Td ameritrade question,g05ify,jacobbodd,https://www.reddit.com/r/pennystocks/comments/g05ify/td_ameritrade_question/,5,4,"Noob question * I use td ameritrade as my broker not sure if that matters. I need to take out a bit of money from my account but i dont want halt trading for 3 days. If i trade my positions but leave 200 or 300 dollars in ""available trading funds"" throughout a few days, will my cash settle?",2020-04-12,https://www.reddit.com/r/pennystocks/comments/g05ify/td_ameritrade_question/
33,ALPP - DD Through Q1 2020,g01l2o,Disturbingfavorites,https://www.reddit.com/r/pennystocks/comments/g01l2o/alpp_dd_through_q1_2020/,1,0,[removed],2020-04-12,https://www.reddit.com/r/pennystocks/comments/g01l2o/alpp_dd_through_q1_2020/
34,"April 12, 2020 Tomorrow's Daily /r/Pennystocks Discussion! Monday Discussion thread!",g01ki1,AutoModerator,https://www.reddit.com/r/pennystocks/comments/g01ki1/april_12_2020_tomorrows_daily_rpennystocks/,0,3,"Please use this thread to discuss your plays of the day!

Since this thread is likely to fill up quickly, consider sorting the comments by ""new"" (instead of ""best"" or ""top"") to see the newest posts.",2020-04-12,https://www.reddit.com/r/pennystocks/comments/g01ki1/april_12_2020_tomorrows_daily_rpennystocks/
35,Potential movement in Oil &amp; Gas tomorrow...,g00r81,George_McFly_1955,https://www.reddit.com/r/pennystocks/comments/g00r81/potential_movement_in_oil_gas_tomorrow/,15,44,"UPDATED --&gt; [https://www.bloomberg.com/news/articles/2020-04-12/oil-price-war-ends-with-historic-opec-deal-to-cut-production](https://www.bloomberg.com/news/articles/2020-04-12/oil-price-war-ends-with-historic-opec-deal-to-cut-production) 

I'm watching HAL, OVV, RDS, CPE. Any other recommendations?",2020-04-12,https://www.reddit.com/r/pennystocks/comments/g00r81/potential_movement_in_oil_gas_tomorrow/
