,author,id,url,score,text,date
361,OkQuail2,fmm1l08,/r/pennystocks/comments/fw3sx2/aker/fmm1l08/,1,What should I set it at?,2020-04-06
362,moose3298,fmm1nws,/r/pennystocks/comments/fw3qne/scyx/fmm1nws/,1,ok thanks doing some dd now,2020-04-06
363,OkQuail2,fmm1s5z,/r/pennystocks/comments/fw3sx2/aker/fmm1s5z/,1,Reason I wouldn’t sell right now is to see if it goes higher?,2020-04-06
364,School_IT_Hero,fmm1wjg,/r/pennystocks/comments/fw3i0u/decn_or_antibe/fmm1wjg/,1,"Decn for sure. just off a quick google search it looks like antibe has't put out any PR since Feb. Also it seems that the news they got is for ATB-346 drug that went to stage 2, which is a drug for the prevention of ulcers.. i think? No CV press from what i could find. Kinda reminds me of HTBX they had a nice spike a month or two ago from their t-cell therapy drug went to phase 2 as well. the only difference is htbx drug was for immune therapy. so it was easy for them to pivot to CV vaccine which is what all of HTBX's PR is about now.

sorry for the long answer but to answer your question Decn because they already have fda paper work turned in and is just waiting for approval. probably missed more info but im pooping and my legs fell asleep so i need to get up now...  


Edit Antibe company news :[https://antibethera.com/news/](https://antibethera.com/news/) .",2020-04-06
365,TysonCochran,fmm224v,/r/pennystocks/comments/fvvp99/xspa_bring_it_out_boys_here_we_go/fmm224v/,1,Ya I'm still in. Been been going back and forth all morning on whether to stay in or not.,2020-04-06
366,FractalAsshole,fmm26rf,/r/pennystocks/comments/fw3sx2/aker/fmm26rf/,2,"Set a price target and make a plan. $90 / a day can make your portfolio grow nicely.

Shooting for 1 or 2 big wins will make your portfolio die",2020-04-06
367,Awkward-Comma,fmm27oc,/r/pennystocks/comments/fvyqk6/opk_new_partnership/fmm27oc/,1,"There is some heavy shorting going on, also short and distort tactics. 
Hopefully it picks up again, and the shorters gets squeezed. 
I believe this stock should be much higher, and with earnings soon I think it will.",2020-04-06
368,co2_druid,fmm2914,/r/pennystocks/comments/fw3zhh/decn_printing_that_dough/fmm2914/,3,"Hit in the AM with XSPA,
Hit in the PM with DECN.


Today was money Monday.",2020-04-06
369,OkQuail2,fmm29io,/r/pennystocks/comments/fw3sx2/aker/fmm29io/,1,Thanks for the insight! I’m new to all this. It’s shooting up now. I set my stop limit to $150 profit it’s at $178 now,2020-04-06
370,thatguydan1995,fmm29uw,/r/pennystocks/comments/fw0h0n/rwt_is_cheap_right_now/fmm29uw/,1,How many shares you guys grab? Grabbed 100 at $2.78. Tempted to go for more before closing,2020-04-06
371,Kyism,fmm2x83,/r/pennystocks/comments/fvznuf/decn_good_news/fmm2x83/,1,It's up 106% today,2020-04-06
372,BKNY75,fmm38z8,/r/pennystocks/comments/fw3zhh/decn_printing_that_dough/fmm38z8/,2,My entire portfolio is green today. Except AYTU. Which is pretty ironic. But I’m in at $1.42 so I’m still up overall.,2020-04-06
373,jlmo9,fmm3edo,/r/pennystocks/comments/fw3sx2/aker/fmm3edo/,1,"Yeah, that's what I would do. It would be a shame for you to do your research and take a risk on stock and not make anything when you had the opportunity to sell-off.",2020-04-06
374,BKNY75,fmm3hit,/r/pennystocks/comments/fw3sx2/aker/fmm3hit/,1,"Back in the day, like this time in 2018, AKER was the AYTU of today in this subreddit. I’m not fucking this horse again. But I hope you make tons of money and I bet you smell amazing.",2020-04-06
375,FractalAsshole,fmm3i4w,/r/pennystocks/comments/fw3sx2/aker/fmm3i4w/,1,"That's awesome and I'm glad it worked out this time.

Stop limits wont execute in After Hours in case you didnt know. Watch carefully at the point",2020-04-06
376,pesti13nce,fmm3i9s,/r/pennystocks/comments/fw3zlw/tops/fmm3i9s/,1,"I sold my 400 shares at .25, I'm a happy camper. Bought in at .18",2020-04-06
377,rexbanner204,fmm3lsq,/r/pennystocks/comments/fvvp99/xspa_bring_it_out_boys_here_we_go/fmm3lsq/,1,Same here. Bought at .2 and I’ve seen some speculation that it could go up to $1 this week which is why I’m hesitant to sell,2020-04-06
378,Neng1987,fmm3si9,/r/pennystocks/comments/fw40e1/decn_this_is_not_a_drill/fmm3si9/,2,Should I sell for 60% gain or hold lol,2020-04-06
379,bendangs,fmm3tni,/r/pennystocks/comments/fw40e1/decn_this_is_not_a_drill/fmm3tni/,1,Opinions of it continue to go up throughout the week?,2020-04-06
380,itst0ny,fmm3yt2,/r/pennystocks/comments/fw28m8/callsputs_for_the_week/fmm3yt2/,1,Why oil calls?,2020-04-06
381,Kyism,fmm3zfh,/r/pennystocks/comments/fw40e1/decn_this_is_not_a_drill/fmm3zfh/,3,up 106% today I beleive. I bought in at the last peak which was like 0.149 so I'm very close to breaking even. Going to hold for awhile,2020-04-06
382,co2_druid,fmm3zvr,/r/pennystocks/comments/fw3zhh/decn_printing_that_dough/fmm3zvr/,2,It would be AYTU lol,2020-04-06
383,sneakcarrot,fmm4ief,/r/pennystocks/comments/fvz2xt/aytu/fmm4ief/,1,I feel like this gave me cancer,2020-04-06
384,HeroTheyCallMe1,fmm4q2u,/r/pennystocks/comments/fw40e1/decn_this_is_not_a_drill/fmm4q2u/,1,I'm new to this and use HL to buy shares. They don't show up on HL. What's the reason? Sorry if stupid question :/,2020-04-06
385,XtremelyNooby,fmm50gu,/r/pennystocks/comments/fw40e1/decn_this_is_not_a_drill/fmm50gu/,2,Maybe they don't support OTC stocks,2020-04-06
386,4thand5UT,fmm54za,/r/pennystocks/comments/fvz2xt/aytu/fmm54za/,1,"When is ""eventually""?",2020-04-06
387,Crackitup302,fmm5ach,/r/pennystocks/comments/fvz2xt/aytu/fmm5ach/,1,I have been asking myself that as well. I wish I knew.,2020-04-06
388,Intermittent_Fisting,fmm5do7,/r/pennystocks/comments/fw40e1/decn_this_is_not_a_drill/fmm5do7/,1,"Damn it, I'm pissed. Tried to transfer some funds to my TDA account. But, It won't let me buy this specific stock for some reason while the transfer is pending. Even though, I'm able to buy other stuff? Ugggh... feel like I missed the boat on this one.",2020-04-06
389,NotSoSus,fmm5fii,/r/pennystocks/comments/fvz2xt/aytu/fmm5fii/,1,I sold as soon as I broke even. Never again,2020-04-06
390,Aspiring--Doctor,fmm5tv7,/r/pennystocks/comments/fw4k4w/lk/fmm5tv7/,2,"relax, it won’t go up all at once. If you see it creep from 4-&gt;5 then 5-&gt;6 and then 6-&gt;7 yeah I’d go for it. But it’s gonna be volatile for a little bit, esp because with corona companies don’t have as much income",2020-04-06
391,School_IT_Hero,fmm5veq,/r/pennystocks/comments/fw40e1/decn_this_is_not_a_drill/fmm5veq/,1,yeah that happened to me last thursday its because they OTC which is weird. You can trade with unsettled funds if the stock is on the NYSE though which does't help lol,2020-04-06
392,musicismyforte123,fmm682g,/r/pennystocks/comments/fvznuf/decn_good_news/fmm682g/,1,Is this supported on Robinhood?,2020-04-06
393,youngbullking,fmm6cwe,/r/pennystocks/comments/fw4k4w/lk/fmm6cwe/,2,"I bought some like an idiot at 5.60 the other day, but i think yeah it will move slowly. I'm selling at anything up 6-6.5",2020-04-06
394,Aspiring--Doctor,fmm6ily,/r/pennystocks/comments/fw4k4w/lk/fmm6ily/,1,Good idea idk if it will bounce back till at least corona is over,2020-04-06
395,thatsAChopbro,fmm6mg9,/r/pennystocks/comments/fw4k4w/lk/fmm6mg9/,1,It’s a long term hold,2020-04-06
396,thatsAChopbro,fmm6qm8,/r/pennystocks/comments/fw3b5z/ino/fmm6qm8/,1,Man INO will drive you nuts. I’d play it tho get out in the highs like today and buy in the low,2020-04-06
397,Kyism,fmm6rfq,/r/pennystocks/comments/fvz2xt/aytu/fmm6rfq/,1,I lost $250 on it.  Was up $400 didn't sell because why would I when it was literally hitting $2.20 that day and only seemed to just taken off. Learned my lesson about pennystocks and how volatile they are.,2020-04-06
398,mshyeri,fmm6yw8,/r/pennystocks/comments/fw4hp8/where_are_we_standing_on_ewll/fmm6yw8/,1,0.006. 10k shares....,2020-04-06
399,ignore_shitpost,fmm6zne,/r/pennystocks/comments/fw0h0n/rwt_is_cheap_right_now/fmm6zne/,2,Why do you think it's gonna go up?,2020-04-06
400,Pavelthebest97,fmm72jo,/r/pennystocks/comments/fvvp99/xspa_bring_it_out_boys_here_we_go/fmm72jo/,1,Sold at .35 bought at .20 I waited it went to .39 should’ve sold then lol. It’s ok tho still made 200$ and rebought at .31 What y’all think still gonna go up .50 this week?,2020-04-06
401,mshyeri,fmm73a0,/r/pennystocks/comments/fw3sx2/aker/fmm73a0/,1,Sell half. Get the profit and if the other half flys higher then you get another profit. Win win.,2020-04-06
402,RGV_Bulldog,fmm7b5i,/r/pennystocks/comments/fw0h0n/rwt_is_cheap_right_now/fmm7b5i/,1,Yea why?,2020-04-06
403,TransSpeciesDog,fmm7m0c,/r/pennystocks/comments/fw3zhh/decn_printing_that_dough/fmm7m0c/,1,What's your TP to sell?,2020-04-06
404,JohnLouis24,fmm7x87,/r/pennystocks/comments/fvqgzg/imimf_your_opinion/fmm7x87/,1,"Whelp, I'm pathetic, ended up buying at .44 per share. I'm not really looking at this as a short term stock so I figure better to miss out on a few cents as opposed to waiting for a return back to .38 or so and never seeing it.",2020-04-06
405,co2_druid,fmm81lv,/r/pennystocks/comments/fw3zhh/decn_printing_that_dough/fmm81lv/,1,I wasn't greedy so I sold at 0.12 - made my gains and that's all I care about lol.,2020-04-06
406,SgtTasty,fmm87e7,/r/pennystocks/comments/fw40e1/decn_this_is_not_a_drill/fmm87e7/,1,OTC and your deposit isn't in time. Anything else shoukd be fine but not OTC,2020-04-06
407,dopa07,fmm8fs7,/r/pennystocks/comments/fw40e1/decn_this_is_not_a_drill/fmm8fs7/,1,is otc stock,2020-04-06
408,Knight_Aero,fmm8hza,/r/pennystocks/comments/fvvp99/xspa_bring_it_out_boys_here_we_go/fmm8hza/,1,Anybody still think it'll recover?,2020-04-06
409,Reddit_and_forgeddit,fmm8ijg,/r/pennystocks/comments/fw40e1/decn_this_is_not_a_drill/fmm8ijg/,1,You have to wire the money to be able to use it same day,2020-04-06
410,[deleted],fmm8j5n,/r/pennystocks/comments/fw40e1/decn_this_is_not_a_drill/fmm8j5n/,1,[deleted],2020-04-06
411,XtremelyNooby,fmm8pc3,/r/pennystocks/comments/fw40e1/decn_this_is_not_a_drill/fmm8pc3/,1,It was 25c with no news. I believe it'll go up,2020-04-06
412,GinButJ,fmm8pu5,/r/pennystocks/comments/fvvp99/xspa_bring_it_out_boys_here_we_go/fmm8pu5/,2,Diamond hands turned to broke hands lol,2020-04-06
413,Knight_Aero,fmm8v3j,/r/pennystocks/comments/fvqgzg/imimf_your_opinion/fmm8v3j/,1,"Just my opinion, I think you're still ok as it seems to be staying above .44 throughout the day so far. Hopefully tomorrows meeting is great news.",2020-04-06
414,dopa07,fmm8xrc,/r/pennystocks/comments/fw0cjr/decn_buy_while_its_cheap/fmm8xrc/,1,"is cheaper than the other ones and it gives results in just a few seconds, if this gets approved it will be the best test kit in the market right now",2020-04-06
415,Knight_Aero,fmm91mw,/r/pennystocks/comments/fvvp99/xspa_bring_it_out_boys_here_we_go/fmm91mw/,1,"It seems to be trying. If it gets close to .3 again, I will hold out and see how the rest of the week goes.",2020-04-06
416,trentslade111,fmm93bg,/r/pennystocks/comments/fw5285/xspa/fmm93bg/,1,Look at decn lol,2020-04-06
417,FSUag,fmm97o4,/r/pennystocks/comments/fw52ja/xspagood_time_to_buy/fmm97o4/,2,You dont say,2020-04-06
418,Syvash,fmm9dls,/r/pennystocks/comments/fw55rv/xspa/fmm9dls/,1,Is this a good time to buy in again?,2020-04-06
419,twenty98,fmm9n9m,/r/pennystocks/comments/fw55rv/xspa/fmm9n9m/,1,"From my experience, after a direct offering like this, the stock price declines until the hype has kind of faded. Obviously no one knows what the stock price will do but I wouldn't say it's a good time to buy, but do your own DD :)",2020-04-06
420,happybeandip,fmm9rv2,/r/pennystocks/comments/fvznuf/decn_good_news/fmm9rv2/,1,What app you all use for decn?,2020-04-06
421,Not_Flygon,fmm9uqu,/r/pennystocks/comments/fw0h0n/rwt_is_cheap_right_now/fmm9uqu/,1,Just picked some up,2020-04-06
422,JohnLouis24,fmma5db,/r/pennystocks/comments/fvqgzg/imimf_your_opinion/fmma5db/,2,"Let's hope your right! While you may already know I found the link with information regarding tuning into the conference call tomorrow, figured you'd be interested:

 [IMC Conference Call](https://www.louisvillenews.net/news/264482876/imc-international-mining-corp-announces-change-to-corporate-update-conference-call-with-director-of-thane-minerals-inc-greg-hawkins)",2020-04-06
423,Kyism,fmma7w8,/r/pennystocks/comments/fvxtar/how_to_use_volume_and_candlestick_pattern_to_spot/fmma7w8/,1,Can someone explain the definition of bullish and bearish to me that is throwing me off,2020-04-06
424,[deleted],fmmadqw,/r/pennystocks/comments/fvz2xt/aytu/fmmadqw/,1,[removed],2020-04-06
425,Imadeutscher,fmmalg5,/r/pennystocks/comments/fw3b5z/ino/fmmalg5/,1,"Try Novax, made 5k",2020-04-06
426,flipflock,fmmaoo4,/r/pennystocks/comments/fw4hp8/where_are_we_standing_on_ewll/fmmaoo4/,1,0.0002  20k shares...lets dance,2020-04-06
427,Neng1987,fmmar8n,/r/pennystocks/comments/fw55rv/xspa/fmmar8n/,1,It shot back up to .27. Still has potential,2020-04-06
428,flipflock,fmmavde,/r/pennystocks/comments/fw4fpp/oncs/fmmavde/,1,I got in at $2.55 this morning when it was streaking then it immediately dropped and cut my losses at $2.05...only thing coming out on this are our tears,2020-04-06
429,twenty98,fmmb0v1,/r/pennystocks/comments/fw55rv/xspa/fmmb0v1/,1,Yup!,2020-04-06
430,Imaginary_Subject,fmmbblh,/r/pennystocks/comments/fw4hp8/where_are_we_standing_on_ewll/fmmbblh/,1,0.0004  500K shares. Not expecting anything in the near future but wiling to hold just in case it pops some day.,2020-04-06
431,Alistor3717,fmmbdyi,/r/pennystocks/comments/fvz2xt/aytu/fmmbdyi/,1,"Hey I'm up $.15 cents, don't know what you are complaining about.",2020-04-06
432,Stuxnet15,fmmbqpm,/r/pennystocks/comments/fw3sx2/aker/fmmbqpm/,1,Akerites are gluttons for punishment.,2020-04-06
433,mattl1028,fmmc1kv,/r/pennystocks/comments/fvz2xt/aytu/fmmc1kv/,1,I’m down 10,2020-04-06
434,FractalAsshole,fmmc4kf,/r/pennystocks/comments/fw55rv/xspa/fmmc4kf/,1,"This offering isnt nearly as bad though,  definite overreaction. Means I get to ride the wave to .40 again",2020-04-06
435,Imaginary_Subject,fmmc8pk,/r/pennystocks/comments/fvz2xt/aytu/fmmc8pk/,1,"&gt; this video

What video?",2020-04-06
436,goldentr33,fmmceey,/r/pennystocks/comments/fvz2xt/aytu/fmmceey/,1,I honestly hope to God this comment is a troll. You do realise stock prices get diluted when you make the float larger? What an ignorant sentiment.,2020-04-06
437,baggins88,fmmcf4m,/r/pennystocks/comments/fvp3g3/srne_do_your_research_and_ride_the_train_gentlemen/fmmcf4m/,1,Get in while you can,2020-04-06
438,[deleted],fmmch7h,/r/pennystocks/comments/fw52ja/xspagood_time_to_buy/fmmch7h/,1,[removed],2020-04-06
439,SweatyLatina,fmmck1q,/r/pennystocks/comments/fw4hp8/where_are_we_standing_on_ewll/fmmck1q/,1,200k shares at .0005 😬,2020-04-06
440,Arniescc,fmmck9s,/r/pennystocks/comments/fw52ja/xspagood_time_to_buy/fmmck9s/,1,"Don't buy ,stock offering,sell before end of day",2020-04-06
441,Arniescc,fmmcocl,/r/pennystocks/comments/fw52ja/xspagood_time_to_buy/fmmcocl/,1,Lucklily I bought for .23 and sold for .26 before end of day,2020-04-06
442,Xander_Hamilton,fmmcxrv,/r/pennystocks/comments/fw4hp8/where_are_we_standing_on_ewll/fmmcxrv/,1,"120,000 at .0001",2020-04-06
443,1010Gang,fmmcxv5,/r/pennystocks/comments/fw5dyc/what_other_platforms_is_good_beside_robinhood/fmmcxv5/,3,"Webull personally because free stocks, I can dm you an invite code if you’d want 

make sure to do research tho just to make sure to understand it first",2020-04-06
444,oneallinticketplease,fmmd50n,/r/pennystocks/comments/fw0h0n/rwt_is_cheap_right_now/fmmd50n/,1,Got 8000 shares bby,2020-04-06
445,ignore_shitpost,fmmdkuz,/r/pennystocks/comments/fvvwe4/macys_m_calls/fmmdkuz/,1,I bough a put option. I don't see any reason why they would sustain these gains. I don't even get why they gapped up in the first place but I suspect they'll drop down to 5 or below within the next week or so.,2020-04-06
446,Intermittent_Fisting,fmmdldd,/r/pennystocks/comments/fw40e1/decn_this_is_not_a_drill/fmmdldd/,1,"Yep, lesson learned.. May have missed the boat on this one. I only used up half of my deposit. Will have to keep an eye on this stock tomorrow.",2020-04-06
447,ignore_shitpost,fmmdmea,/r/pennystocks/comments/fvvwe4/macys_m_calls/fmmdmea/,1,You got puts too?,2020-04-06
448,Virzaah,fmmdmt6,/r/pennystocks/comments/fvvwe4/macys_m_calls/fmmdmt6/,2,I too am not sure why it's gapping up? No news as well,2020-04-06
449,jlomohocob,fmmdnt3,/r/pennystocks/comments/fw4k4w/lk/fmmdnt3/,1,"It will do alright, sit tight.",2020-04-06
450,ignore_shitpost,fmmdqdc,/r/pennystocks/comments/fvvwe4/macys_m_calls/fmmdqdc/,2,When do your contracts expire? I think this is going down within the next week or two. I am baffled that it's hit the price it's at now to be honest.,2020-04-06
451,twenty98,fmmdrfn,/r/pennystocks/comments/fw55rv/xspa/fmmdrfn/,2,"I agree, people just get nervous because some of them don't understand what it means fully; they only see the price of each share that was sold and panic sell. Good luck to you!",2020-04-06
452,Virzaah,fmme0pn,/r/pennystocks/comments/fvvwe4/macys_m_calls/fmme0pn/,2,I honestly might get another put for this.. Since it's bound to go down... And this is most likely the highest itll be? I don't know why it gapped up,2020-04-06
453,Arniescc,fmme1e2,/r/pennystocks/comments/fw5285/xspa/fmme1e2/,1,"Look at my post about getting in on decn,wow",2020-04-06
454,conorscottvanek,fmme1rs,/r/pennystocks/comments/fw4hp8/where_are_we_standing_on_ewll/fmme1rs/,1,They've seen a surge in PHIZIO digital physical therapy use recently. It jumped to $2.00 on February 12th. Not sure how easy it would be to sell all that if it happens again though.,2020-04-06
455,Arniescc,fmme44y,/r/pennystocks/comments/fw5285/xspa/fmme44y/,1,Direct stock offering by company,2020-04-06
456,youngbullking,fmme5ad,/r/pennystocks/comments/fw0cjr/decn_buy_while_its_cheap/fmme5ad/,1,Should I put 10k on it,2020-04-06
457,Arniescc,fmme981,/r/pennystocks/comments/fw0cjr/decn_buy_while_its_cheap/fmme981/,1,You should of when this post went in but it will go up eventually  a lot more with FDA approval.,2020-04-06
458,JohnnyLakefront,fmmebvk,/r/pennystocks/comments/fvznuf/decn_good_news/fmmebvk/,1,No. It's an OTC stock. You'll need a different broker for it,2020-04-06
459,Arniescc,fmmeejq,/r/pennystocks/comments/fw0cjr/decn_buy_while_its_cheap/fmmeejq/,1,"90.85% today,wow. Hope you all got in. I have been buying cheap shares for a while. Still holding,waiting for FDA approval.",2020-04-06
460,GoldenJoe24,fmmegxp,/r/pennystocks/comments/fvxtar/how_to_use_volume_and_candlestick_pattern_to_spot/fmmegxp/,2,bull up bear down,2020-04-06
461,youngbullking,fmmek30,/r/pennystocks/comments/fw0cjr/decn_buy_while_its_cheap/fmmek30/,1,"Damn they don't have it on Robinhood. I need to get off this BS app, what would you recommend?",2020-04-06
462,ignore_shitpost,fmmekfg,/r/pennystocks/comments/fvvwe4/macys_m_calls/fmmekfg/,2,Me neither. Take a look at them a week ago and what good news has come out that should change that? Nothing. I think a lot of traders think that it's at a discount or something. My bet is it's going right back down where it started this month.,2020-04-06
463,[deleted],fmmenyj,/r/pennystocks/comments/fw5dyc/what_other_platforms_is_good_beside_robinhood/fmmenyj/,1,[removed],2020-04-06
464,JohnnyLakefront,fmmeo9k,/r/pennystocks/comments/fvznuf/decn_good_news/fmmeo9k/,1,400k shares?,2020-04-06
465,Virzaah,fmmep2s,/r/pennystocks/comments/fvvwe4/macys_m_calls/fmmep2s/,1,I see! Hmm this stock is parabolic at times .. I really don’t know what could’ve made it gap this much .. but I too see it going down .. this gap was weird,2020-04-06
466,Arniescc,fmmepqy,/r/pennystocks/comments/fw0cjr/decn_buy_while_its_cheap/fmmepqy/,1,I will be getting a Webull account soon due to you can trade at 4 am.,2020-04-06
467,HappoHero,fmmeser,/r/pennystocks/comments/fw1pzq/who_else_is_holding_ecor/fmmeser/,1,I've got 200 @$1.00,2020-04-06
468,Neng1987,fmmet4a,/r/pennystocks/comments/fw55rv/xspa/fmmet4a/,1,"Sold my share earlier at the top, will probly get back in this week if it dips to low 20 cents",2020-04-06
469,youngbullking,fmmetct,/r/pennystocks/comments/fw0cjr/decn_buy_while_its_cheap/fmmetct/,1,"Nice, is it 4am to 8pm, also do you know if it's commission free?",2020-04-06
470,TysonCochran,fmmeukf,/r/pennystocks/comments/fw5dyc/what_other_platforms_is_good_beside_robinhood/fmmeukf/,1,"What makes Webull better than E-Trade? Also, would I have to sell all my stocks in E-Trade and then buy back in or can they transfer?",2020-04-06
471,JohnnyLakefront,fmmeur5,/r/pennystocks/comments/fw07qf/decn_files_finalized_fda_eua_application_for_its/fmmeur5/,1,"There's really no telling, yet.

It could be a pump and dump, or it could be a company trying to expand on the wake of a new market.

Gotta do your DD and make that decision on your own",2020-04-06
472,ignore_shitpost,fmmeve4,/r/pennystocks/comments/fvvwe4/macys_m_calls/fmmeve4/,1,I'm no expert but I don't see any good news for them since last week and if you look at end of March it was starting to drop from the price it's currently at. I don't see why it would keep going up. My guess is there's a lot of traders thinking they're getting a discount or maybe we have some longer term plays. I don't know. I think it goes down below 5 in a week or two.,2020-04-06
473,CaptainWeee,fmmewjj,/r/pennystocks/comments/fvrlqe/market_should_be_bottoming_out_next_week_or_week/fmmewjj/,1,"Nice bounce today, couple of the plays went 30%+ congrats to those who flipped them. Let’s gauge what the market does tomorrow.",2020-04-06
474,ignore_shitpost,fmmf0gk,/r/pennystocks/comments/fvq0m0/how_do_you_guys_feel_about_gamestop/fmmf0gk/,1,Bought some puts today for 5/1 at $3 strike price. I don't see it going up much more before dropping.,2020-04-06
475,s-kumar,fmmf1tz,/r/pennystocks/comments/fvz2xt/aytu/fmmf1tz/,2,"Sell it and see next day, it will be on Moon !!",2020-04-06
476,1010Gang,fmmfg9c,/r/pennystocks/comments/fw5dyc/what_other_platforms_is_good_beside_robinhood/fmmfg9c/,1,"I don’t have experience with e-trade personally so I can’t really tell you, but I’m pretty sure that you can’t transfer stocks directly you’d have to sell",2020-04-06
477,Pavelthebest97,fmmfkd6,/r/pennystocks/comments/fvvp99/xspa_bring_it_out_boys_here_we_go/fmmfkd6/,1,Bruh whoever got a dip at .23 just now is a lucky man,2020-04-06
478,youngbullking,fmmflo3,/r/pennystocks/comments/fw4hp8/where_are_we_standing_on_ewll/fmmflo3/,1,"Damn that is insane, imagine having a million share at less than a cent and it hits $2 😅",2020-04-06
479,Boson347,fmmfos5,/r/pennystocks/comments/fvyqk6/opk_new_partnership/fmmfos5/,1,Top 10 questions science still cannot answer.,2020-04-06
480,pennysmash403,fmmgfxm,/r/pennystocks/comments/fvznuf/decn_good_news/fmmgfxm/,1,Durrrr. If CTyx explodes next few days I’ll make it 500k. Life’s good,2020-04-06
481,bigpapi836,fmmgitg,/r/pennystocks/comments/fw5dyc/what_other_platforms_is_good_beside_robinhood/fmmgitg/,1,"Webull has better interface,tools and research/news in their app. If you're not gunning for the free stocks, I would recommend TDA, interface is a lot different and so, take some time to get used to it. ToS is great, all in place; watchlist, account info, charts and etc., I personally used paper trading to get familiar with TDA's interface. Customer service is great and open 24/7.

Just my .2 hope this helps!",2020-04-06
482,SendCheeze,fmmgsrf,/r/pennystocks/comments/fvyqk6/opk_new_partnership/fmmgsrf/,1,It's not doing so good because it's a no name stock. If it gains traction it will go to the moon,2020-04-06
483,_Brxce,fmmh608,/r/pennystocks/comments/fvz2xt/aytu/fmmh608/,1,Just buy aytuw instead,2020-04-06
484,34thStreetMiracle,fmmh6an,/r/pennystocks/comments/fvz2xt/aytu/fmmh6an/,1,Yup fuck this stock was hoping it’d pop today along with xspa but it never did.  I’m at a 17% loss right now.  Might not get any better from here :/,2020-04-06
485,[deleted],fmmhdmy,/r/pennystocks/comments/fw0ua5/tops_on_the_rise_again/fmmhdmy/,1,[removed],2020-04-06
486,kids_eat_drugs,fmmhh59,/r/pennystocks/comments/fw6gpv/what_are_you_guys_buying_right_now_and_holding/fmmhh59/,1,"Was thinking jdst or uco, but I haven't read up enough on them yet.",2020-04-06
487,peterjoseph7,fmmhje8,/r/pennystocks/comments/fw0h0n/rwt_is_cheap_right_now/fmmhje8/,2,been looking at news and charts why is $RWT so low right now?,2020-04-06
488,Purplepunch36,fmmho53,/r/pennystocks/comments/fw6gpv/what_are_you_guys_buying_right_now_and_holding/fmmho53/,1,"Sold XSPA in hopes it will drop tomorrow then buy more, bought more JNUG and holding on to that till who knows when.",2020-04-06
489,DidYouReadThatThing,fmmhsqo,/r/pennystocks/comments/fw55rv/xspa/fmmhsqo/,1,"That dip got me back in the green for the day, so at least I'm only wasting my time and not my money.",2020-04-06
490,Imaginary_Subject,fmmhye5,/r/pennystocks/comments/fw6gpv/what_are_you_guys_buying_right_now_and_holding/fmmhye5/,1,Trnx and Atbpf,2020-04-06
491,cmmckechnie,fmmi9ia,/r/pennystocks/comments/fw55rv/xspa/fmmi9ia/,1,Wait for news they haven’t even confirmed airport testing sites.,2020-04-06
492,cmmckechnie,fmmicdt,/r/pennystocks/comments/fw52ja/xspagood_time_to_buy/fmmicdt/,1,They haven’t even confirmed the plans yet lol,2020-04-06
493,cmmckechnie,fmmidza,/r/pennystocks/comments/fw52ja/xspagood_time_to_buy/fmmidza/,1,siiiiiiiiiiiiiiiiick,2020-04-06
494,JohnnyLakefront,fmmihmr,/r/pennystocks/comments/fvznuf/decn_good_news/fmmihmr/,1,TD Ameritrade/think or swim,2020-04-06
495,thinkpad83,fmmii8m,/r/pennystocks/comments/fw6gpv/what_are_you_guys_buying_right_now_and_holding/fmmii8m/,1,I bought JDST and will see what happens tomorrow.,2020-04-06
