,author,id,url,score,text,date
0,CapKirb,e1f16hw,/r/pennystocks/comments/8uffdv/made_60k_40_today_these_stocks_will_pump_tomorrow/e1f16hw/,1,"Curious to see how accurate now, best of luck to you. You seem fairly confident how much research have you done other than the few links you have?",2018-06-28
1,hoopsfan217,e1f1gf5,/r/pennystocks/comments/8uffdv/made_60k_40_today_these_stocks_will_pump_tomorrow/e1f1gf5/,1,How do you find these stocks? ,2018-06-28
2,mirawiel,e1f1sa0,/r/pennystocks/comments/8uffdv/made_60k_40_today_these_stocks_will_pump_tomorrow/e1f1sa0/,1,"theres no research. only gains

i guess if you wanna know how i find these. at market open i use a scanner to find all stocks between 5cents and 99cents that have gained 15% value with over 300,000 volume

each pennystock that hits 15% gains i throw down 100dollars into. its only a few each day that gain 15%. then the ones that start making money i throw 300 more dollars into then another 300 then another 300 then i keep throwing in more 300's if they keep going up 

then that night i set a -5% stoploss on all my money positions. this will trigger the next day if the stock drops. and if it drops, it auto cashes me out. if it goes higher, i keep shares and set a -5% stoploss for the next day. keep riding the gains until the stoploss cashes me out",2018-06-28
3,edgelordkys,e1f3bk9,/r/pennystocks/comments/8uffdv/made_60k_40_today_these_stocks_will_pump_tomorrow/e1f3bk9/,1,pics or this is all bs,2018-06-28
4,ShadyPatel,e1f3fe9,/r/pennystocks/comments/8uffdv/made_60k_40_today_these_stocks_will_pump_tomorrow/e1f3fe9/,1,Let’s see how it goes. I bought CEI cause I think your right. ,2018-06-28
5,RayTheMaster,e1f3iq1,/r/pennystocks/comments/8uffdv/made_60k_40_today_these_stocks_will_pump_tomorrow/e1f3iq1/,1,A scanner?,2018-06-28
6,mirawiel,e1f3o9c,/r/pennystocks/comments/8uffdv/made_60k_40_today_these_stocks_will_pump_tomorrow/e1f3o9c/,1,"how? market is closed

the markets closed. i assume you mean you put in a buy order?

hold on that brah.  i should clarify they way you should be trading pennystonks

only drop 10% of your cash into CEI at open. if it dips, buy 10% more when you think the dip is over. then when it goes up. put in 14%.  then if it goes up more put another 7%

put in 6-10% portions of your cash to lower risk and buy dips.  

then the next day you can sell it all in 1 trade and its not a daytrade",2018-06-28
7,goose_10,e1f3r04,/r/pennystocks/comments/8uffdv/made_60k_40_today_these_stocks_will_pump_tomorrow/e1f3r04/,1,So a scanner is your insider info?,2018-06-28
8,ShadyPatel,e1f3ube,/r/pennystocks/comments/8uffdv/made_60k_40_today_these_stocks_will_pump_tomorrow/e1f3ube/,1,True. I only bought two shares for now. Also is there a specific reason for the specific percentages? Just wondering,2018-06-28
9,mirawiel,e1f3zxc,/r/pennystocks/comments/8uffdv/made_60k_40_today_these_stocks_will_pump_tomorrow/e1f3zxc/,1,"nah no reason. that percentage is onyl for CEI because its a 99% sure thing

my normal strategy is this

at market open i use a scanner to find all stocks between 5cents and 99cents that have gained 15% value with over 300,000 volume

each pennystock that hits 15% gains i throw down 100dollars into. its only a few each day that gain 15%. then the ones that start making money i throw 300 more dollars into then another 300 then another 300 then i keep throwing in more 300's if they keep going up

then that night i set a -5% stoploss on all my big money positions. this will trigger the next day if the stock drops. and if it drops, it auto cashes me out. if it goes higher, i keep shares and set a -5% stoploss for the next day. keep riding the gains until the stoploss cashes me out",2018-06-28
10,ShadyPatel,e1f43dz,/r/pennystocks/comments/8uffdv/made_60k_40_today_these_stocks_will_pump_tomorrow/e1f43dz/,1,That sounds like a nice strategy. How do you find inside information? Sorry if it is a noob questions because I am just starting to learn how to invest and day trade. ,2018-06-28
11,mirawiel,e1f43nj,/r/pennystocks/comments/8uffdv/made_60k_40_today_these_stocks_will_pump_tomorrow/e1f43nj/,1,nope. thats how i find shit if i got no info to run on,2018-06-28
12,kutie-pie,e1f492a,/r/pennystocks/comments/8uffdv/made_60k_40_today_these_stocks_will_pump_tomorrow/e1f492a/,1,"thought CPE would explode today, thoughts? ",2018-06-28
13,mirawiel,e1f4gk4,/r/pennystocks/comments/8uffdv/made_60k_40_today_these_stocks_will_pump_tomorrow/e1f4gk4/,1,"2% is nice gains for anything over 2 dollars

massive 30+% gains for things that arent pennystocks are rare and hard to time. but do happen",2018-06-28
14,hiegear,e1f4h9j,/r/pennystocks/comments/8uffdv/made_60k_40_today_these_stocks_will_pump_tomorrow/e1f4h9j/,1,Good heads up! 👍,2018-06-28
15,kutie-pie,e1f4i9r,/r/pennystocks/comments/8uffdv/made_60k_40_today_these_stocks_will_pump_tomorrow/e1f4i9r/,1,thanks for posting brotha. do you use any TA/ indicators for breakouts? or just scanner and news? ,2018-06-28
16,mirawiel,e1f4jpx,/r/pennystocks/comments/8uffdv/made_60k_40_today_these_stocks_will_pump_tomorrow/e1f4jpx/,1,"usually i dont have any super info and go to where the action and volume is.

 just i heard from the grapevine that these 2 stocks were gunna good winners. but possible pump and dumps so cash out gains if it starts dropping",2018-06-28
17,ShadyPatel,e1f4lnj,/r/pennystocks/comments/8uffdv/made_60k_40_today_these_stocks_will_pump_tomorrow/e1f4lnj/,1,Ohh ok. Which scanner do you use?,2018-06-28
18,PortapottyJonny,e1f4ood,/r/pennystocks/comments/8uffdv/made_60k_40_today_these_stocks_will_pump_tomorrow/e1f4ood/,1,"If I want to buy, would I put a limit on it at .469 for the open or actually buy in the morning? ",2018-06-28
19,PortapottyJonny,e1f5yqj,/r/pennystocks/comments/8uffdv/made_60k_40_today_these_stocks_will_pump_tomorrow/e1f5yqj/,1,CEI is a bullsh*t. Company?? ,2018-06-28
20,52_week_low,e1f7nce,/r/pennystocks/comments/8uffdv/made_60k_40_today_these_stocks_will_pump_tomorrow/e1f7nce/,1,[securities fraud](https://www.sec.gov/fast-answers/answerspumpdumphtm.html),2018-06-28
21,rethinkdaily,e1fa71x,/r/pennystocks/comments/8uffdv/made_60k_40_today_these_stocks_will_pump_tomorrow/e1fa71x/,1,"Certain brokers allow trading after hours. For example I use E-Trade and can buy and sell shares before and after hours. However it’s an additional $0.005 fee per share or $5 per 1000 shares. I might have messed up my decimal points, but that’s how stock prices change after normal hours ",2018-06-28
22,Ironspatula87,e1facuy,/r/pennystocks/comments/8uffdv/made_60k_40_today_these_stocks_will_pump_tomorrow/e1facuy/,1,How you get this software?,2018-06-28
23,Artamisgordan,e1faxyk,/r/pennystocks/comments/8uffdv/made_60k_40_today_these_stocks_will_pump_tomorrow/e1faxyk/,1, B,2018-06-28
24,kennethn0210,e1fet1k,/r/pennystocks/comments/8uffdv/made_60k_40_today_these_stocks_will_pump_tomorrow/e1fet1k/,1,"Piss off, ur the pumper ",2018-06-28
25,BowB4Me,e1fez9v,/r/pennystocks/comments/8uffdv/made_60k_40_today_these_stocks_will_pump_tomorrow/e1fez9v/,1,Really a shit post ,2018-06-28
26,Duck33i,e1ff5ji,/r/pennystocks/comments/8uffdv/made_60k_40_today_these_stocks_will_pump_tomorrow/e1ff5ji/,1,Don't trust this retard,2018-06-28
27,Delusional_01,e1fgon3,/r/pennystocks/comments/8uffdv/made_60k_40_today_these_stocks_will_pump_tomorrow/e1fgon3/,1,I also wanna know what scanner do you use?,2018-06-28
28,raghud1,e1fknmj,/r/pennystocks/comments/8uffdv/made_60k_40_today_these_stocks_will_pump_tomorrow/e1fknmj/,1,Good post ,2018-06-28
29,MuzdogMillionaire,e1fpk6h,/r/pennystocks/comments/8ugcli/life_atyr_pharma/e1fpk6h/,1,"Might need to hold for 1 to 3 years pending on speed of approval for Phase II. Price will drop a little before then if they didn't make some unexpected positive discovery, and tell the markets about it.

Phase I basically means no one died when they were exposed to the drug across the ranges they tested. Its the same as a chip sample in mining. There will usually be a peak in volume, but a fall back usually follows.

I'd hold out until after Phase II trials, and the lead in to Phase III if you want to churn, but you're looking at a year or two.

I don't hold this ticker yet, but I will add it to my watch list. May even set a position at 85c

I've watched a few in this sort of space over the last couple of years, and they generally follow the same pattern.",2018-06-28
30,Hufflepuff77,e1fpoq1,/r/pennystocks/comments/8uj5fn/lexagene_otcqb_lxxgf_tsxvlxg_bear_run_persists/e1fpoq1/,1,"To invest or not to invest, that is the question!",2018-06-28
31,tommyleeboners,e1froqt,/r/pennystocks/comments/8uffdv/made_60k_40_today_these_stocks_will_pump_tomorrow/e1froqt/,1,He wasn’t wrong on CEI.. ,2018-06-28
32,chris886,e1frqh1,/r/pennystocks/comments/8uffdv/made_60k_40_today_these_stocks_will_pump_tomorrow/e1frqh1/,1,"Whelp, making a shit ton on CEI right now. ",2018-06-28
33,OhMahStocks,e1fryf3,/r/pennystocks/comments/8uffdv/made_60k_40_today_these_stocks_will_pump_tomorrow/e1fryf3/,1,"Thanks for the heads up on CEI! Bought as much as I could at opening at $0.79, it's now at $1.20 only 15 minutes after open! Wish I had heard of this stock sooner, or could have bought last night at $0.50",2018-06-28
34,circlysquare25,e1fsio0,/r/pennystocks/comments/8ujlst/anyone_in_on_cei/e1fsio0/,1,"Just made like 80% today and took the profit, pullback will occur soon and that’s when I’ll get back in for the long",2018-06-28
35,DeltaRobTV,e1fslu0,/r/pennystocks/comments/8ujlst/anyone_in_on_cei/e1fslu0/,1,Thinking it’ll continue to grow today? ,2018-06-28
36,MalesaurusRex,e1fst6n,/r/pennystocks/comments/8ujlst/anyone_in_on_cei/e1fst6n/,1,No cum eating instructions for me thx,2018-06-28
37,circlysquare25,e1fsy8x,/r/pennystocks/comments/8ujlst/anyone_in_on_cei/e1fsy8x/,1,"Not really IMO, 170% is a lot for intraday, however I could be wrong, and maybe it won’t be today, but there will be a pullback",2018-06-28
38,mirawiel,e1fsysj,/r/pennystocks/comments/8ujl74/opinions_on_cei/e1fsysj/,1,"i went all in at .40 yesterday

massive gains. loving it. easy to 2 dollays within 2-3 days",2018-06-28
39,Rashfordinho,e1ft09c,/r/pennystocks/comments/8ujl74/opinions_on_cei/e1ft09c/,1,Yeah I’m in at like .36 trying to decide whether or not to sell ,2018-06-28
40,Dubby7,e1ftigk,/r/pennystocks/comments/8ujl74/opinions_on_cei/e1ftigk/,1,I don’t own any but the target price was $1 ,2018-06-28
41,HinduVagitarian,e1ftz1z,/r/pennystocks/comments/8uffdv/made_60k_40_today_these_stocks_will_pump_tomorrow/e1ftz1z/,1,"great call on CEI. we need more people like you in this - not to blindly buy, but to put them on the radar.",2018-06-28
42,drgreenthumbatx420,e1fuejb,/r/pennystocks/comments/8ujlst/anyone_in_on_cei/e1fuejb/,1,I feel the same way. Almost let fomo get me but I've been watching cei long enough to know they'll go back down and that's when I'm going to jump in. ,2018-06-28
43,circlysquare25,e1fum1j,/r/pennystocks/comments/8ujlst/anyone_in_on_cei/e1fum1j/,1,"Yup, I didn’t except it to hit 200% intraday otherwise I would’ve sold a little later but yeah I can’t wait to hop in on the pull back",2018-06-28
44,air_zac,e1fuytg,/r/pennystocks/comments/8uffdv/made_60k_40_today_these_stocks_will_pump_tomorrow/e1fuytg/,1,Haha ya came back to say this. I followed his advice just for shits and it’s working out ,2018-06-28
45,kwebb1021,e1fv96s,/r/pennystocks/comments/8uffdv/made_60k_40_today_these_stocks_will_pump_tomorrow/e1fv96s/,1,Holy smokes. Guess I'm too late for that CEI blast off ,2018-06-28
46,Charwizzard,e1fvpib,/r/pennystocks/comments/8uffdv/made_60k_40_today_these_stocks_will_pump_tomorrow/e1fvpib/,1,Thanks for the info in CEI! You were spot on with that prediction.,2018-06-28
47,circlysquare25,e1fwq3u,/r/pennystocks/comments/8ujlst/anyone_in_on_cei/e1fwq3u/,1,Let the pull back begin,2018-06-28
48,Dortego22,e1fxpur,/r/pennystocks/comments/8ujlst/anyone_in_on_cei/e1fxpur/,1,Got in @.83 sold at 1.40  if only I could do this everyday lol,2018-06-28
49,unkownsourcecode,e1fy12l,/r/pennystocks/comments/8uffdv/made_60k_40_today_these_stocks_will_pump_tomorrow/e1fy12l/,1,Wow,2018-06-28
50,comaomega15,e1fyg55,/r/pennystocks/comments/8ujl74/opinions_on_cei/e1fyg55/,1,Bought in at 1.14 sold at 1.5. waiting to see whether or not it will correct or if it wants to skyrocket.,2018-06-28
51,bm1llz18,e1fypop,/r/pennystocks/comments/8ujlst/anyone_in_on_cei/e1fypop/,1,"Yes I am in on it. I heard some things and have suspicion it could get up to 2-3 dollars. I wouldn't quit on it yet, but do as you think or want obviously.",2018-06-28
52,kwebb1021,e1fyt0a,/r/pennystocks/comments/8ujl74/opinions_on_cei/e1fyt0a/,1,Wish I saw your post yesterday :( ,2018-06-28
53,bm1llz18,e1fywvh,/r/pennystocks/comments/8ujlst/anyone_in_on_cei/e1fywvh/,1,Also depends when you got in. If you got in below 1 then you can easily still make 20&amp;#37; if it ends up not making it up there.,2018-06-28
54,unkownsourcecode,e1g02j0,/r/pennystocks/comments/8ujl74/opinions_on_cei/e1g02j0/,1,"still worth it, or train has passed?",2018-06-28
55,EatShartYouSwine,e1g0xw8,/r/pennystocks/comments/8ujl74/opinions_on_cei/e1g0xw8/,1,Wondering same thing,2018-06-28
56,gbvgbvgbvgbvgbvgbv,e1g1ejd,/r/pennystocks/comments/8ujl74/opinions_on_cei/e1g1ejd/,1,"First stock i've bought, been doing some research for 3 weeks.  I don't have money to spend really so I'm just going for it with a little cash to get some learning experience.  Went in with 25 bucks at .79 then added 100 at 120.   Will make a decision tonight on if I should continue to ride it through Thursday. ",2018-06-28
57,BusyNess101,e1g26nw,/r/pennystocks/comments/8ugcli/life_atyr_pharma/e1g26nw/,1,Thanks for the reply; though it’s not what I want to read— it’s what I should read and understand ,2018-06-28
58,mbr902000,e1g3hba,/r/pennystocks/comments/8uk88a/idgc_claims_to_have_new_management/e1g3hba/,1,"Better hope for a pump
",2018-06-28
59,houseflip,e1g4oxk,/r/pennystocks/comments/8ul4at/cpow_reinstatement_play/e1g4oxk/,1,this is how many large plays begin . thanks.,2018-06-28
60,CryptoNoob77,e1g5kt5,/r/pennystocks/comments/8uk88a/idgc_claims_to_have_new_management/e1g5kt5/,1,What broker do you use to trade stocks? The chart on my app shows nothing....,2018-06-28
61,dreamcar88,e1g5m4v,/r/pennystocks/comments/8ul4at/cpow_reinstatement_play/e1g5m4v/,1,got some 2s . hit 5 not long ago,2018-06-28
62,DrChangsteen,e1g6jhj,/r/pennystocks/comments/8ul4at/cpow_reinstatement_play/e1g6jhj/,1,"""a cease trade order has been issued on this security""",2018-06-28
63,drgreenthumbatx420,e1g88sm,/r/pennystocks/comments/8ujlst/anyone_in_on_cei/e1g88sm/,1,I wonder where the floor is gonna be now. ,2018-06-28
64,circlysquare25,e1g8spk,/r/pennystocks/comments/8ujlst/anyone_in_on_cei/e1g8spk/,1,Don’t know but watch out for entry points ,2018-06-28
65,red_simplex,e1g94sp,/r/pennystocks/comments/8uldlf/check_the_most_talked_about_pennystocks_on/e1g94sp/,1,I would like to have ability to filter stocks/crypto. JFYI ,2018-06-28
66,st4yd0wn,e1gc69y,/r/pennystocks/comments/8uldlf/check_the_most_talked_about_pennystocks_on/e1gc69y/,1,Noted! Will update this week,2018-06-28
67,plussframes,e1gd9op,/r/pennystocks/comments/8um7qt/slight_cron_recovery_today/e1gd9op/,1,Lurking for answers as well. Any reason for the big drop? Market correction ? There's some real obstacles in implementation before Cron can move their product to market ,2018-06-28
68,Zaxper951,e1geppn,/r/pennystocks/comments/8uffdv/made_60k_40_today_these_stocks_will_pump_tomorrow/e1geppn/,1,Yea made $106 on it. Sold off at the peak @ $1.50.,2018-06-28
69,eskjcSFW,e1gevx1,/r/pennystocks/comments/8umbcd/xiaomi_ipo/e1gevx1/,1,Funny forget the yi action camera line either,2018-06-28
70,Juve94,e1gfo8p,/r/pennystocks/comments/8umbcd/xiaomi_ipo/e1gfo8p/,1,I am definitely going to take the gamble. When is the IPO date?,2018-06-28
71,ozcar_g,e1gfydr,/r/pennystocks/comments/8uffdv/made_60k_40_today_these_stocks_will_pump_tomorrow/e1gfydr/,1,"Well, I observe from the sidelines (didnt invest, still learning) amd Im a believer now. Saw it go up 125%!",2018-06-28
72,ozcar_g,e1gg3zc,/r/pennystocks/comments/8uffdv/made_60k_40_today_these_stocks_will_pump_tomorrow/e1gg3zc/,1,"Well, I observed CEI from the sidelines (didnt invest, still learning) and Im a believer now. Saw it go up 125%!",2018-06-28
73,OdinMcHammerclaw,e1giqw3,/r/pennystocks/comments/8um7qt/slight_cron_recovery_today/e1giqw3/,1,CRON for the last 3 months swings in a range from low $6 to $8. Just normal behavior for it. I've kept a pretty good eye on it since March.,2018-06-28
74,Scottydeux,e1gj84z,/r/pennystocks/comments/8um7qt/slight_cron_recovery_today/e1gj84z/,1,Losing out on $CGC by faking around with $CRON,2018-06-28
75,biscuiteater69,e1gjjkd,/r/pennystocks/comments/8uffdv/made_60k_40_today_these_stocks_will_pump_tomorrow/e1gjjkd/,1,This guy is a legend. All you folks are jealous.,2018-06-28
76,litigator02,e1gjkc5,/r/pennystocks/comments/8uffdv/made_60k_40_today_these_stocks_will_pump_tomorrow/e1gjkc5/,1,CEI did well,2018-06-28
77,Boots-n-Bell,e1gohwj,/r/pennystocks/comments/8un846/just_started_with_penny_stocks_what_the_hell_to_do/e1gohwj/,1,Go blue!,2018-06-28
78,unkownsourcecode,e1gp9c0,/r/pennystocks/comments/8uffdv/made_60k_40_today_these_stocks_will_pump_tomorrow/e1gp9c0/,1,Sow whats the next play then? We’re listening ,2018-06-28
79,KushNuggies,e1gpk5i,/r/pennystocks/comments/8unma5/a_tip_u_will_be_grateful_for_it_will_make_u/e1gpk5i/,1,"Step 1: look at his post history
Step 2: Don’t buy",2018-06-28
80,jakelasersnake,e1gpzkt,/r/pennystocks/comments/8un8ut/how_do_penny_stocks_work/e1gpzkt/,1,Buy low sell high,2018-06-28
81,zhome888,e1gr4a5,/r/pennystocks/comments/8uffdv/made_60k_40_today_these_stocks_will_pump_tomorrow/e1gr4a5/,1,"Wait, what, ""3) PLG Insider info""? ",2018-06-28
82,Ricky_Ravioli,e1grhiw,/r/pennystocks/comments/8unma5/a_tip_u_will_be_grateful_for_it_will_make_u/e1grhiw/,1,Lol so we’re pump and dumping on Reddit now?,2018-06-28
83,VDNasty,e1grla8,/r/pennystocks/comments/8un846/just_started_with_penny_stocks_what_the_hell_to_do/e1grla8/,1, I as well would like to know. Fairly new too. ,2018-06-28
84,GreenForThanksgiving,e1gt1zx,/r/pennystocks/comments/8un8ut/how_do_penny_stocks_work/e1gt1zx/,1,!redditsilver,2018-06-28
85,BoogieWoogie16,e1gt82v,/r/pennystocks/comments/8un846/just_started_with_penny_stocks_what_the_hell_to_do/e1gt82v/,1,Quit while you're ahead!,2018-06-28
86,BoogieWoogie16,e1gwktu,/r/pennystocks/comments/8unma5/a_tip_u_will_be_grateful_for_it_will_make_u/e1gwktu/,1,I upvoted both of you since he has -2 karma all time..,2018-06-28
87,nprmass,e1gwqdy,/r/pennystocks/comments/8un846/just_started_with_penny_stocks_what_the_hell_to_do/e1gwqdy/,1,What is the current valuation process you go through when looking at a stock?,2018-06-28
88,iamnatetorious,e1gxkma,/r/pennystocks/comments/8un846/just_started_with_penny_stocks_what_the_hell_to_do/e1gxkma/,1,"What's this *valuation* you speak of? =)

They're ""all worthless"" your just following volume and momentum here.

Sure some become Netflix (nflx) but most become MoviePass (hmny)",2018-06-28
89,UsedUrinalCakes,e1gxq9y,/r/pennystocks/comments/8un846/just_started_with_penny_stocks_what_the_hell_to_do/e1gxq9y/,1,R/robinhoodpennystocks,2018-06-28
90,Murder_Castle,e1gy9eg,/r/pennystocks/comments/8un846/just_started_with_penny_stocks_what_the_hell_to_do/e1gy9eg/,1,Snes is at about 1.80 and are expecting an announcement any day now from California to allow them to sell their new rat prevention product that will make rats sterile.  They already have distribution contracts in New York and in California.  California is the last state to approve.                                                             ,2018-06-28
91,lego3072,e1gyg82,/r/pennystocks/comments/8un846/just_started_with_penny_stocks_what_the_hell_to_do/e1gyg82/,1,Go Irish,2018-06-28
92,YourNameIsTobethius,e1gyrkz,/r/pennystocks/comments/8un846/just_started_with_penny_stocks_what_the_hell_to_do/e1gyrkz/,1,This is fucking hilarious ,2018-06-28
93,queenslandbananas,e1gyssv,/r/pennystocks/comments/8unma5/a_tip_u_will_be_grateful_for_it_will_make_u/e1gyssv/,1,Looks like a scam to me. Stay away.,2018-06-28
94,MuzdogMillionaire,e1h0zah,/r/pennystocks/comments/8unma5/a_tip_u_will_be_grateful_for_it_will_make_u/e1h0zah/,1,"Not happening, without going deeper into the research, the market responded negatively to the top line result they released at the end of Feb.

There would want to be one hell of a misinterpretation of data in their report to drop from $1.55 to $.45 just over a day. Usually indicates that, if the drug is effective then there may be a hurdle in approval - dragging your buy and hold timeline out. Or! The result did not meet expectation. 

Either way, if its a pump and dump, most you can hope for is a double or triple on approval if you get caught holding the bag.",2018-06-28
95,houseflip,e1h15rw,/r/pennystocks/comments/8un846/just_started_with_penny_stocks_what_the_hell_to_do/e1h15rw/,1,"hello new trader welcome...i have been trading for 10 years. hopefully you realize and can admit that this play (on your end) was pure luck and hopefully you know why MNGA went up (hint = ticker PED) . you have to develop a strategy . a reason to buy, and a reason to sell. know when you want to sell before you buy. these words are for trading not investing. many also play charts, this is called technical analysis. your target time frame per trade (1 hour, 1 day, 1 week , 1 quarter) changes pretty much everything so it's hard to answer your questions.",2018-06-28
96,mirawiel,e1h3mfg,/r/pennystocks/comments/8uffdv/made_60k_40_today_these_stocks_will_pump_tomorrow/e1h3mfg/,1,"no new picks so far. im busy with other things

if i get some nice picks i will post them. nice picks are found maybe once a week. besides that i just go off instincts in the moment

tmrw i will most likely just be looking for dips that look juicy to buy. i put a little money in a dip, then move on and look for another dip.  my bread and butter plan that usually works best for me is buying dips then selling a bit later if it goes in my favor


as for my usual pennystock strategy. my normal plan is to find a pennystock that has made 15% + gains and seems to have high volume and strong movement in either direction. which likely means theres some kind of hype giving the stock life .  then i try to identify where i think the lowest floor of the stock is. the price shouldnt drip beloe the ""floor"" usually

once i identify what i think the lowest ""floor"" is. i throw 100 dollars in when it seems to be trending up. then i wait for it to dip down. when it dips a bit down. i throw in 300 more when it seems the dip is over

then if it dips more. i wait and throw in another 300 when i think that dip is over

if i have correctly judged the ""floor"" of the stock, then the price shouldnt drop below the floor. if it dips to the floor, i put in another 300 dollars and it should climb back to my original buy point. once it gains back, i make money from all lower dips i put money into

thats my usual plan i do if i have no nice picks to work with. biggest part of the method is being able to correctly judge where the real floor of the stock is",2018-06-28
97,ahmedosman89,e1h3y4z,/r/pennystocks/comments/8un846/just_started_with_penny_stocks_what_the_hell_to_do/e1h3y4z/,1,How did you hear about this? Just curious,2018-06-28
98,ChessyLogic,e1h4iof,/r/pennystocks/comments/8uffdv/made_60k_40_today_these_stocks_will_pump_tomorrow/e1h4iof/,1,Do you think cei will pump again tomorrow? ,2018-06-28
99,mirawiel,e1h4r92,/r/pennystocks/comments/8uffdv/made_60k_40_today_these_stocks_will_pump_tomorrow/e1h4r92/,1,"nah i think CEI will gain 5-10 cents a day until its around 2 dollars

still decent 5-10% gains per day for a while

might pump 20% tmrw tho",2018-06-28
100,AllahTheKoala,e1h4w9k,/r/pennystocks/comments/8un846/just_started_with_penny_stocks_what_the_hell_to_do/e1h4w9k/,1,Stop,2018-06-28
101,hoopsfan217,e1h5ghe,/r/pennystocks/comments/8umbcd/xiaomi_ipo/e1h5ghe/,1,July 9th ,2018-06-28
102,Juve94,e1h5i7s,/r/pennystocks/comments/8umbcd/xiaomi_ipo/e1h5i7s/,1,Thank you. ,2018-06-28
103,mirawiel,e1h6u9s,/r/pennystocks/comments/8uffdv/made_60k_40_today_these_stocks_will_pump_tomorrow/e1h6u9s/,1,"NEW STOCK PICK. gonna pop off soon probably

https://www.google.com/search?q=sagd+stock
 
SAGD",2018-06-28
104,howmynutstaste,e1h7anw,/r/pennystocks/comments/8un846/just_started_with_penny_stocks_what_the_hell_to_do/e1h7anw/,1,Upgrade your Robinhood account to level 3 and start trading options on margin.,2018-06-28
105,holeeray,e1h7nmu,/r/pennystocks/comments/8un846/just_started_with_penny_stocks_what_the_hell_to_do/e1h7nmu/,1,"OP, do not do this.",2018-06-28
106,vbman213,e1h9iot,/r/pennystocks/comments/8un846/just_started_with_penny_stocks_what_the_hell_to_do/e1h9iot/,1,"If you are asking this question, you have certainly NOT started with penny stocks. ",2018-06-28
107,FellowHoustonian96,e1h9wtu,/r/pennystocks/comments/8un846/just_started_with_penny_stocks_what_the_hell_to_do/e1h9wtu/,1,Same,2018-06-28
108,Murder_Castle,e1hae74,/r/pennystocks/comments/8un846/just_started_with_penny_stocks_what_the_hell_to_do/e1hae74/,1,"Here's their website.  

https://senestech.com/

I gave the tip.  Do some research.  ",2018-06-28
