,title,id,author,url,score,num_comments,text,date,link
0,Week #41 Stock Picking Contest is now Open!,9m3zms,Fatherthinger,https://www.reddit.com/r/pennystocks/comments/9m3zms/week_41_stock_picking_contest_is_now_open/,1,27,[Week #41 Stock Picking Contest is now Open](https://www.reddit.com/user/Fatherthinger/comments/9m3ij5/week_41_stock_picking_contest_is_now_open/),2018-10-07,https://www.reddit.com/r/pennystocks/comments/9m3zms/week_41_stock_picking_contest_is_now_open/
1,$INPX,9m1zhk,slugger97,https://www.reddit.com/r/pennystocks/comments/9m1zhk/inpx/,1,7,No love for the recent spike?,2018-10-07,https://www.reddit.com/r/pennystocks/comments/9m1zhk/inpx/
2,Free trading sites like Robindhood outside the US?,9m31gw,LazyHighGoals,https://www.reddit.com/r/pennystocks/comments/9m31gw/free_trading_sites_like_robindhood_outside_the_us/,1,3,"Hello, I'd love to start out on Robinhood in a super tiny way, but since it's only avaible in USA right now, I got stopped.

Anyone have some compareable sites for EU? (Germany)

I'm really far away from starting trading over a bank with all the fees.  Just want to invest a couple dollars and most importantly get a look into practice.",2018-10-07,https://www.reddit.com/r/pennystocks/comments/9m31gw/free_trading_sites_like_robindhood_outside_the_us/
3,MagneGas (MNGA) - To the moon? Further insight into MNGA,9m8mru,deez970nuts,https://www.reddit.com/r/pennystocks/comments/9m8mru/magnegas_mnga_to_the_moon_further_insight_into/,1,0,[removed],2018-10-07,https://www.reddit.com/r/pennystocks/comments/9m8mru/magnegas_mnga_to_the_moon_further_insight_into/
4,Weekly Stock Market Review,9m8bsi,Fatherthinger,https://www.reddit.com/r/pennystocks/comments/9m8bsi/weekly_stock_market_review/,1,1,[Weekly Stock Market Review](https://www.reddit.com/user/Fatherthinger/comments/9m8723/weekly_stock_market_review_octobers_top_stocks/),2018-10-07,https://www.reddit.com/r/pennystocks/comments/9m8bsi/weekly_stock_market_review/
5,"Weekly Market Recap Sunday October 7 2018, Green week!!",9m7mps,tradinglearning101,https://www.reddit.com/r/pennystocks/comments/9m7mps/weekly_market_recap_sunday_october_7_2018_green/,1,0,[removed],2018-10-07,https://www.reddit.com/r/pennystocks/comments/9m7mps/weekly_market_recap_sunday_october_7_2018_green/
6,"October 07, 2018 Tomorrow's Daily /r/Pennystocks Discussion! Monday Discussion thread!",9m76wj,AutoModerator,https://www.reddit.com/r/pennystocks/comments/9m76wj/october_07_2018_tomorrows_daily_rpennystocks/,1,10,"Please use this thread to discuss your plays of the day!

Since this thread is likely to fill up quickly, consider sorting the comments by ""new"" (instead of ""best"" or ""top"") to see the newest posts.
",2018-10-07,https://www.reddit.com/r/pennystocks/comments/9m76wj/october_07_2018_tomorrows_daily_rpennystocks/
