,author,id,url,score,text,date
85,whatthef_rick,f9b5xci,/r/pennystocks/comments/e45qas/searching_for_profitable_penny_stock_traders/f9b5xci/,1,I’m from ny. Wanna set up a discord and discuss what our plays will be for the day? I want to have a group of op’s that I can share my opinions with so I can get some feedback from other well experienced traders,2019-11-30
86,dogbreath67,f9bg1kc,/r/pennystocks/comments/e45qas/searching_for_profitable_penny_stock_traders/f9bg1kc/,1,So would you say that Timothy Sykes is full of shit?,2019-11-30
87,ADubya87,f9bv6yv,/r/pennystocks/comments/e45qas/searching_for_profitable_penny_stock_traders/f9bv6yv/,1,With that logic I need to be a rich to tell that Herbalife is a scam.,2019-11-30
88,StockBreakoutPlays,f9c2itw,/r/pennystocks/comments/e45qas/searching_for_profitable_penny_stock_traders/f9c2itw/,1,"Just because you think MLM schemes are scams and they very well may be, doesnt mean HLF is an outright scam. The products are very real. I know friends/family that use and sell. Ask Bill Ackman how his $1 billion short bet worked out a few years ago... 

Nothing is as easy as it seems. Except HMNY. That dilution scheme was snifed miles away.",2019-11-30
89,UpperFeynman,f9c2vlt,/r/pennystocks/comments/e45qas/searching_for_profitable_penny_stock_traders/f9c2vlt/,1,"Yeah, but how do you get good data on penny stocks for that?",2019-11-30
90,dliu1,f9c67d7,/r/pennystocks/comments/e44tqd/best_penny_stocks_over_3/f9c67d7/,1,"Go join /rwallstreetbets and do the OPPOSITE of whatever they're doing.

literally cant go tits up",2019-11-30
91,SensibleCreeper,f9c67ip,/r/pennystocks/comments/e44tqd/best_penny_stocks_over_3/f9c67ip/,1,Dumbest post I've ever read.,2019-11-30
92,SensibleCreeper,f9c8nnt,/r/pennystocks/comments/e44tqd/best_penny_stocks_over_3/f9c8nnt/,1,"I believe I've seen your posts with your current or relative stock list before, prob what that guy is referring to. I've generally sloughed you off, but after doing some DD, I really like your picks. Thanks for your efforts.

Edit: I usually beak people with your level of posts due to their ignorance.",2019-11-30
93,MADWOKE,f9ceqm0,/r/pennystocks/comments/e44tqd/best_penny_stocks_over_3/f9ceqm0/,1,Rule #1 of penny stocks. DO NOT BUY PENNY STOCKS.,2019-11-30
94,certifiedtyb,f9cioz3,/r/pennystocks/comments/e45qas/searching_for_profitable_penny_stock_traders/f9cioz3/,2,That’s exactly my point they don’t teach you you need to teach yourself in order to be successful this world is just greedy,2019-11-30
95,certifiedtyb,f9cji6r,/r/pennystocks/comments/e45qas/searching_for_profitable_penny_stock_traders/f9cji6r/,1,Even though the book say some of them aren’t even as important or more important their % of working is low (like you said which I agree) it was the start of figuring out what I should be looking for and where I should mostly focus. I watch charts on my free time everyday,2019-11-30
96,impurfection,f9cjo6f,/r/pennystocks/comments/e45qas/searching_for_profitable_penny_stock_traders/f9cjo6f/,1,"Absolutely, his teachings and methods are outdated by at least 10 years. His buy the dip strategy will probably fail you 9/10 times.",2019-11-30
97,impurfection,f9cjpix,/r/pennystocks/comments/e45qas/searching_for_profitable_penny_stock_traders/f9cjpix/,2,Couldn’t agree more,2019-11-30
98,dogbreath67,f9ck30m,/r/pennystocks/comments/e45qas/searching_for_profitable_penny_stock_traders/f9ck30m/,1,Yeah I looked at some of his stuff but I figured if you’re really that successful at trading why would you spend so much effort trying to get people to give you money.,2019-11-30
99,certifiedtyb,f9ckdli,/r/pennystocks/comments/e45qas/searching_for_profitable_penny_stock_traders/f9ckdli/,1,"Yeah I don’t want to be spoon feed either. 

Yeah even though successful penny stock traders nail their trades I do believe that they post the ticker symbols after they have blown up so that everyone following them gets FOMO creating momentum and therefore having the successful trader lock in profits while the others usually loss due to FOMO.

L2 is definitely a life changer couldn’t agree more",2019-11-30
100,certifiedtyb,f9ckk1t,/r/pennystocks/comments/e45qas/searching_for_profitable_penny_stock_traders/f9ckk1t/,1,Yeah we can most definitely do that I’m not sure how to set up a discord group just not sure how to make one but I’ll be looking into that!,2019-11-30
101,carnthesaints,f9ckkx4,/r/pennystocks/comments/e45qas/searching_for_profitable_penny_stock_traders/f9ckkx4/,1,Trading patterns are the only data that *is* any good.,2019-11-30
102,carnthesaints,f9ckvg0,/r/pennystocks/comments/e45qas/searching_for_profitable_penny_stock_traders/f9ckvg0/,1,"That's the problem with these books - they just give a bunch of different, often contradictory tips, and you are supposed to magically know when to ignore them and when not to.

It's all nonsense.",2019-11-30
103,crustycrew,f9clxq3,/r/pennystocks/comments/e45qas/searching_for_profitable_penny_stock_traders/f9clxq3/,1,"Shoot me a PM, I’ve had a very good track record over the past few months. Got a very knowledgeable group I am trading with.",2019-11-30
104,certifiedtyb,f9cool1,/r/pennystocks/comments/e45qas/searching_for_profitable_penny_stock_traders/f9cool1/,1,I believe is nonsense for the investor who is successful but for those that don’t know would be a starting point. Imo taking action is the only way you will ever get to see the bigger picture,2019-11-30
105,whatthef_rick,f9d8kgf,/r/pennystocks/comments/e45qas/searching_for_profitable_penny_stock_traders/f9d8kgf/,1,gonna download it or whatever and make an account. don't have one either,2019-11-30
106,UpperFeynman,f9d8ptr,/r/pennystocks/comments/e45qas/searching_for_profitable_penny_stock_traders/f9d8ptr/,1,I’m talking about good data for running NN on. Most have survivorship bias problems or the data sets just don’t exist.,2019-11-30
107,certifiedtyb,f9dhjsq,/r/pennystocks/comments/e45qas/searching_for_profitable_penny_stock_traders/f9dhjsq/,1,"https://discord.gg/sXR35gr 

It’s in the making I’m going to be inviting people you could share the link with your buddies it’s free access and if you want to follow me on Twitter @/sblvd_ I post decent content",2019-11-30
108,carnthesaints,f9dscp5,/r/pennystocks/comments/e45qas/searching_for_profitable_penny_stock_traders/f9dscp5/,1,"Yes, there is definitely a problem of survivorship bias. But if you can automate chart collection for a few thousand stocks for the last several years, my experience is that the problem of survivorship bias is not significant. All the data in question is publicly available.",2019-11-30
109,ADubya87,f9f3yey,/r/pennystocks/comments/e45qas/searching_for_profitable_penny_stock_traders/f9f3yey/,1,"What webinar do you run? Or blog, site etc.",2019-11-30
110,RamzFanz,f9f4fiv,/r/pennystocks/comments/e45qas/searching_for_profitable_penny_stock_traders/f9f4fiv/,1," 

I'm about to provide you with constructive criticism...

...stop trying to rip people off.",2019-11-30
111,StockBreakoutPlays,f9fds3y,/r/pennystocks/comments/e45qas/searching_for_profitable_penny_stock_traders/f9fds3y/,1,I don't. I post on my personal blog for fun sometimes to help others learn. I don't have a program to sell or clickbait for page views. Happy trading!,2019-11-30
112,StockBreakoutPlays,f9fdubc,/r/pennystocks/comments/e45qas/searching_for_profitable_penny_stock_traders/f9fdubc/,1,Enlighten me. I'm all ears.,2019-11-30
113,jeffg365,f9fsufs,/r/pennystocks/comments/e45qas/searching_for_profitable_penny_stock_traders/f9fsufs/,1,I HAVE LOST ONE 1 SINGLE out of pocket RED CENT since I started out trading.!!! Been trading since February and I am up.!! I'm now trying to learn options and that can be a true Gamble!!! Keep your eye on TRNX &amp; CPRX I believe in them !,2019-11-30
114,binboutit,f9iro8h,/r/pennystocks/comments/e45qas/searching_for_profitable_penny_stock_traders/f9iro8h/,1,"Word. I just look at the basic line graph. Once in a while I might check out the 50 and 200 day sma. If I look at other information, I’ll think I know things I don’t.",2019-11-30
115,jamescgames,f9j29yn,/r/pennystocks/comments/e45qas/searching_for_profitable_penny_stock_traders/f9j29yn/,1,Can you point me towards this data/methods you use for chart collection?,2019-11-30
116,whatthef_rick,f9jntxm,/r/pennystocks/comments/e45qas/searching_for_profitable_penny_stock_traders/f9jntxm/,1,gonna join the chat now,2019-11-30
117,moron_scientist,fctego0,/r/pennystocks/comments/e3x7vl/watch_for_nvax_to_moon_this_week/fctego0/,1," proposes to offer 250M shares while its market value is only 110M, how much will this stock fall?",2019-11-30
118,due2getit,ff7em12,/r/pennystocks/comments/e3x7vl/watch_for_nvax_to_moon_this_week/ff7em12/,1,"Just doubled my investment on this, thanks for this post forever ago 👌",2019-11-30
119,Stockbaron,ff7r2dh,/r/pennystocks/comments/e3x7vl/watch_for_nvax_to_moon_this_week/ff7r2dh/,1,"Nice, I just played it again for a two day 400% gain, it will come back down soon, just for us to play it again.",2019-11-30
