,author,id,url,score,text,date
0,N3RD_01,ekrhd4v,/r/pennystocks/comments/bckufe/who_here_has_bought_timothy_sykes_vip_program_and/ekrhd4v/,1,"Save your money, or send me the money instead.",2019-04-13
1,nuttingtogachifanfic,ekriegk,/r/pennystocks/comments/bckufe/who_here_has_bought_timothy_sykes_vip_program_and/ekriegk/,1,"4 People bought it and weren't happy with it? Or haven't bought it and just presume it's a scam?

I couldn't tell",2019-04-13
2,sosodeaf,ekrmfk8,/r/pennystocks/comments/bcl5ae/evfm/ekrmfk8/,1,"I’m in and hopeful they pop later this year. However, Seems like there’s a decent amount of competition in the non hormonal birth control market, so I’m more hopeful that they can find some success treating stds too.",2019-04-13
3,rootchakra111,ekrodm4,/r/pennystocks/comments/bckufe/who_here_has_bought_timothy_sykes_vip_program_and/ekrodm4/,1,"I saw someone bought it for 6,000 and was trying to sell it for 2,000. He said it was horrible",2019-04-13
4,bigboyish,ekrotvk,/r/pennystocks/comments/bckufe/who_here_has_bought_timothy_sykes_vip_program_and/ekrotvk/,1,"Nope, but I'm pretty sure that guy's a scam. On Twitter, all the stuff he retweets from his ""students"" thanking him are accounts with like 5 followers and no other posts lol.",2019-04-13
5,linaustin5,ekrpgac,/r/pennystocks/comments/bclebx/has_anyone_heard_about_gern/ekrpgac/,1,I have my bags ready,2019-04-13
6,tr14l,ekrrp56,/r/pennystocks/comments/bckufe/who_here_has_bought_timothy_sykes_vip_program_and/ekrrp56/,1,"LPT: If it being a scam is even a question, it's a scam.",2019-04-13
7,levi_lolo,ekrsq28,/r/pennystocks/comments/bclebx/has_anyone_heard_about_gern/ekrsq28/,1,"It ran a lot last year, had a huge gap down and is now in a steady uptrend. It’s got a gap to fill around $2.30 up towards $6. 

I went long at $2 looking for that gap to start filling, and earnings are early May.",2019-04-13
8,CoolRunner,ekrstj2,/r/pennystocks/comments/bckufe/who_here_has_bought_timothy_sykes_vip_program_and/ekrstj2/,1,If he was legit he wouldn’t have to sell VIP programs to pay the bills.,2019-04-13
9,nuttingtogachifanfic,ekrt4np,/r/pennystocks/comments/bckufe/who_here_has_bought_timothy_sykes_vip_program_and/ekrt4np/,1,"He makes a lot of free Videos on youtube,

why wouldn't he demand money in exchange for his time and (valuable) knowledge?

What a stupid opinion to have",2019-04-13
10,nuttingtogachifanfic,ekrtngv,/r/pennystocks/comments/bckufe/who_here_has_bought_timothy_sykes_vip_program_and/ekrtngv/,1,it costs 200,2019-04-13
11,nuttingtogachifanfic,ekru6of,/r/pennystocks/comments/bckufe/who_here_has_bought_timothy_sykes_vip_program_and/ekru6of/,1,"went through his last week of retweets, average is more like 50-200 followers

Idk why you'd assume that the average joe would have 10k followers on twitter

if he wanted to fake that he could just bot the followers, its very cheap to get an account to 10k+

assuming that someones dumb enough to create new accounts with 2 followers

 to advertise himself is beyond me

&amp;#x200B;

terrible argument",2019-04-13
12,nuttingtogachifanfic,ekru884,/r/pennystocks/comments/bckufe/who_here_has_bought_timothy_sykes_vip_program_and/ekru884/,1,what,2019-04-13
13,BruntheRed,ekrufjv,/r/pennystocks/comments/bclebx/has_anyone_heard_about_gern/ekrufjv/,1,"I’m in at 1.74, hoping for it to steadily climb until earnings, charts look good",2019-04-13
14,nuttingtogachifanfic,ekrugzb,/r/pennystocks/comments/bckufe/who_here_has_bought_timothy_sykes_vip_program_and/ekrugzb/,1,"The average person would just give it away for free?

Is that the World you live in? You put time and knowledge into something and don't ask for anything in return,

you just give it away for free? because kindness pays the bills nowadays?

\+ It's very unlikely that these 200$ courses are his main source of income but what do I know",2019-04-13
15,hikenerd,ekruqtg,/r/pennystocks/comments/bckufe/who_here_has_bought_timothy_sykes_vip_program_and/ekruqtg/,1,That’s not the argument he’s making lol. He wouldn’t be teaching if he was that good.,2019-04-13
16,kennnygo4,ekruzl3,/r/pennystocks/comments/bckufe/who_here_has_bought_timothy_sykes_vip_program_and/ekruzl3/,1,Check out Ricky Gutierrez!,2019-04-13
17,nuttingtogachifanfic,ekrv2x8,/r/pennystocks/comments/bckufe/who_here_has_bought_timothy_sykes_vip_program_and/ekrv2x8/,1,"&gt; He wouldn’t be teaching if he was that good. 

these 200 IQ takes are too much for me",2019-04-13
18,nuttingtogachifanfic,ekrv48t,/r/pennystocks/comments/bckufe/who_here_has_bought_timothy_sykes_vip_program_and/ekrv48t/,1,:),2019-04-13
19,hikenerd,ekrv8ei,/r/pennystocks/comments/bckufe/who_here_has_bought_timothy_sykes_vip_program_and/ekrv8ei/,1,Why would you post something asking for opinions and then combat everyone’s response? You came in here with an opinion and you’re u willing to listen to others.,2019-04-13
20,nuttingtogachifanfic,ekrvxxi,/r/pennystocks/comments/bckufe/who_here_has_bought_timothy_sykes_vip_program_and/ekrvxxi/,1," holy shit how do you function in society

&amp;#x200B;

If you read just the first half of the title you'll see that the question goes to those who have bought the course

instead I'm getting responses from dumbfucks saying ""bro if hes rich he wouldnt charge money lmfao"" 

I hate giving attention to idiots like you but holy shit ur stupidity is killin me 

&amp;#x200B;

&gt; You came in here with an opinion and you’re u willing to listen to others. 

you really analyzed me well there  

""and you’re u willing to listen to others. ""  good grammar btw",2019-04-13
21,scottwagoner,ekrw8df,/r/pennystocks/comments/bckufe/who_here_has_bought_timothy_sykes_vip_program_and/ekrw8df/,1,Ricky’s stuff is ehh at best. He only trades ETFs now and pretty much the same ones every day. His discord is just a bunch of people trading just what he does. If you even mention penny stocks he blasts you saying he doesn’t trade pennies...yet his videos that you pay for to get access to his discord are him trading pennies. But he won’t acknowledge this.,2019-04-13
22,hikenerd,ekrybg7,/r/pennystocks/comments/bckufe/who_here_has_bought_timothy_sykes_vip_program_and/ekrybg7/,1,"You are the idiot and it's clear to everyone here. You didn't want anyone's opinion if it didn't align with yours. Confirmation bias much? 

It's also not poor grammar it's clearly auto-correct from a phone. Unwilling.",2019-04-13
23,born2rock4life,ekrylkx,/r/pennystocks/comments/bckufe/who_here_has_bought_timothy_sykes_vip_program_and/ekrylkx/,1,"I can attest that what he teaches is extremely profitable. Also look up Steven Dux and William Karajan. Both share his strategies, and Steven was a student of Timothy Sykes who turned his $20k into $970k within 13 months. He has a lot of great content/DVD’s that teach everything from shorting, penny stocks, reading SEC filings, basics and fundamentals, and more. If you follow what he teaches and not just copy cat what he trades live, you will find success. 

Anyone saying he is a scam either doesn’t agree with his style, doesn’t like his character (he can be abrasive, but is bluntly honest,) and/or most likely has never been involved in his programs and teaching.

He gives the basic secrets to his style away in this interview I linked below, and I would say judge for yourself based on whether or not his style appeals to you. Everyone has a method that works best for them, and the more you hone in on a style and perfect it, the more consistent you will become and more profitable as well.

He teaches both long and short methodologies, so even if shorting isn’t your ideal style, you can still find other programs and lessons of his that teach long strategies, scalping, etc.

I haven’t had the extra income to invest in his challenge myself, but I’ve watched most all of the content while at a friends house and can speak to this as a review. I’ve since become more consistent in attaining profits, quicker and less emotional about cutting losses quickly, and many other key elements that makes the difference in becoming part of the 10% of traders who don’t fail.

Feel free to message me if you have any questions further, or reply in-line and I’d be glad to answer them.

-Ryan

Steven Dux interview:  https://youtu.be/Li3-NwAj6t4",2019-04-13
24,WenMun,ekrz78p,/r/pennystocks/comments/bclebx/has_anyone_heard_about_gern/ekrz78p/,1,This is one of those bio stock that burn massive amount of money without any result.,2019-04-13
25,initialglass,eks0mve,/r/pennystocks/comments/bcmwx2/to_the_person_who_wanted_a_timothy_sykes_review/eks0mve/,1,"So you posted a video review of Tim Sykes... that’s posted by Tim Sykes. 

Yea, that’s clearly gonna be biased.",2019-04-13
26,born2rock4life,eks105f,/r/pennystocks/comments/bcmwx2/to_the_person_who_wanted_a_timothy_sykes_review/eks105f/,1,"Obviously. I shared it so they could see his style, as it demonstrates some of the key methods he uses. Not to convince them to buy the program. That’s all personal choice, but as most people trading penny’s aren’t abundant with cash, it’s an easy way to take away something from the video for free.

As far as his credibility; Tim, Steven, and others share their profits for all to see on www.profit.ly so anyone can verify his success independently. 

He is transparent about what he does and emphasizes that anyone who teaches should be, as everybody can have a Green Day, but that doesn’t mean they are consistently profitable / not losing more money than they’re profiting overall.

Regardless of whether you like him or not, he has made millions trading and has the proof for all to see. That’s why I can confidently say it’s not a scam.",2019-04-13
27,TheBazaarTrades,eks2gkv,/r/pennystocks/comments/bcmwx2/to_the_person_who_wanted_a_timothy_sykes_review/eks2gkv/,1,"I applied to this long time ago. They wanted me to pay to take their ""class"" by a huge payment.  I turned it down based on their ""interviewed""  even though I was approved. I made my first 1k from $100 in two months day trade / shortening it. Yeah, I'm good.",2019-04-13
28,born2rock4life,eks2ry4,/r/pennystocks/comments/bcmwx2/to_the_person_who_wanted_a_timothy_sykes_review/eks2ry4/,1,"That’s why I hadn’t joined the challenge/class myself. I started with smaller capital and once I am above the $25k for PDT, preferably $30k, I will join at that point. Even still, their monthly subscription is affordable starting at $80/mo; but again I have seen the content already, so I am waiting until I’m further up before paying homage, so to say.

My review was intended to inform people, not convince them to buy the course. Someone who has $100k to start would benefit greatly from the material and the investment to them is far less than risking it all and taking a small 2-3% loss.

Granted most of us penny stockers start with much smaller capital investments, which is why I emphasized watching the interview to learn a few things from his style, as it’s freely accessible on YouTube.

Glad you’re making money, but never stop learning. You can find plenty of free material online, be it from Sykes, Dux, Karaman, Ricky Gutierrez, or whoever you prefer. The more we learn, the better we will become.",2019-04-13
29,HodlGang_HodlGang,eks9sby,/r/pennystocks/comments/bcmwx2/to_the_person_who_wanted_a_timothy_sykes_review/eks9sby/,1,"Ah yes, advertising gurus under the guise of education - which is exactly what Tim does with stocks - he’s such a good guy he wants you to make money with his strategies so he’ll tell you what they are for $100 bucks a month.  - when banks and hedge funds are super secretive about their strategies - Tim is giving you a sweet deal - become a successful millionaire penny stock trader by investing a few grand in his “education courses” 


 And don’t forget to study! Only those who study make money - so if you don’t make money - you didn’t buy and study enough of his material - so buy more, and keep studying. 

Can you see the pattern now? 

He’s selling a dream guys. That’s his job. All day everyday - he sells you a fantasy -",2019-04-13
30,born2rock4life,eksa763,/r/pennystocks/comments/bcmwx2/to_the_person_who_wanted_a_timothy_sykes_review/eksa763/,1,"Someone else earlier  reared a post asking if anyone who has been in his program could provide an honest review, but their post was deleted or taken down. 

I can understand why he relinquished after people flamed the post, much like you’re doing without giving feedback on his strategies. You want to lump him into the category you’re painting with broad strokes, which is fine if you have credibility and can back that up. 

But you aren’t even critiquing what he teaches, which tells me you likely don’t know anything about the course, haven’t partaken in it, and are here despite that to voice your opinion. Go right ahead, but that’s pretty ignorant to spread misinformation assuming you haven’t.

As I replied to someone else’s post earlier, you can see all of his trades on www.profit.ly along with Steven Dux, and many others. The strategies work for him, and I can attest I’ve had more consistent success and bigger wins after practicing them.

I have actually reviewed the videos after watching a vast majority of them, and am trying to help give honest feedback. Thanks for chiming in with your opinion and no actual feedback on the course. It’s extremely valued. /sarcasm",2019-04-13
31,HodlGang_HodlGang,eksedmw,/r/pennystocks/comments/bcmwx2/to_the_person_who_wanted_a_timothy_sykes_review/eksedmw/,1,"I’m opposed to advising that in order to learn to trade successfully, one must follow a gurus teaching or ‘strategies’ - not necessarily Tim specifically - but in this case, Tim and any of the other YouTube trading gurus you’ve mentioned. 

I’d recommend people experiment and find what they like to trade, and then go from there. For example, learning to trade options is something Tim doesn’t teach, and yet options are often more volatile than penny stocks - and they’re tradeable in highly liquid stocks like amzn. 

Which mean your strategies can scale further than they could in penny stocks. Where liquidity is often less than $50 million per day - why would you want to pigeonhole yourself by staking all your initial time and money learning penny stocks from Tim. 

He’ll admit that it’s not something you can trade millions of dollars in. Let’s assume it’s all true for a moment - making $10k/ week sounds great -  but you really need a 6 figure account for that to be even remotely possible. 

And don’t forget 90% of traders lose money consistently. Which includes every one of Tim’s subscribers. Just because you’re watching some YouTube gurus videos, or paying them money, means you’re automatically inducted into the special 10% of winners.

&gt;why he relinquished after people flamed the post, much like you’re doing without giving feedback on his strategies. 

You mean the strategy which surmounts to buy the pump, and short the dump? All the support resistance, patterns, breakouts, break downs, washouts, cut losses quickly, higher highs, lower lows, 10% gap scanner... I could go on? - I still would not recommend paying or subscribing to Tim or any other Profit.ly gurus. Nor even trying to copy what they’re doing, because you’re “trading education” shouldn’t be learning to follow what some guru tells you to do. 

That’s not learning, that’s following. 

&gt;But you aren’t even critiquing what he teaches, which tells me you likely don’t know anything about the course, haven’t partaken in it, and are here despite that to voice your opinion. 

Tim and his gurus all sell several courses. Exactly how much money and time must one spend to satisfy you?

I’m objective to his claim that if you pay him money, in return he’ll teach you “How to make Millions” which is a claim he makes as the title of one of his most popular courses. So yeah, I know a bit about the guy....

&gt;Go right ahead, but that’s pretty ignorant to spread misinformation assuming you haven’t.

Because, in order for you to assume you’re right, you must first assume I’m misinformed. Which is an awfully convenient argument....

&gt;As I replied to someone else’s comment earlier, you can see all of his trades on www.profit.ly along with Steven Dux, and many others. The strategies work for him, and I can attest I’ve had more consistent success and bigger wins after practicing them.

&gt; You attest to consistent success. Yeah I’ll definitely just take your word on that. /s",2019-04-13
32,psxpetey,eksiiq7,/r/pennystocks/comments/bcmwx2/to_the_person_who_wanted_a_timothy_sykes_review/eksiiq7/,1,"His trader challenge is 9 grand his base program is 1.7 it comes with a lot  software like profitly and his trading platform. It’s cool that it has sec filings right there but he’s charging retarded money for information you get with almost any broker software you can find the sec filings for free on nasdaq.com as well as many many many other sites.

Profitly is interesting but I mean really you can find trade ideas by using a gap scanner and looking at the top% gainers on literally any site including nasdaq for free.

He always brags about his free content on YouTube. I’ve watched all of Stevens videos and all of grittanis and sykes are by far the biggest pile of shit. Why ? Maybe because I don’t want to hear : hi my name is time Sykes I trade from crazy places my millionaire students my millionaire students my millionaire students for 9 minutes on 200 videos with no actual content on the video except that. You don’t even get what’s in the title. The only free content he has that is worth a damn is trader checklist.

Why would I pay 9 grand to listen to someone that is supposed to be a millionaire use the goddamn mic in his laptop( millionaire can’t even buy a fucking mic) while he taps away on his keyboard with the worst audio on earth.

Same problem with dux and grtanni but they actually give out information on their trades.

I was going to try out his trader challenge or penny stocking silver but once I heard the attached price tag I said (nah this isn’t for me) and buddies like well you could float the cost on your credit card! I was like ok this is so scammy it is not even funny. The constant spam emails you get with links to seminars that are actually just his YouTube videos with bots in a chat. 

Then I watched all the podcasts his first student made and while some people make money a lot of them lose as well on his program so it’s not exactly fool proof. 

He now makes almost all his money from teaching and man oh man it’s a fuckload. 

The reason I find him scammy above and beyond that is because he could easily fake his trades these days as he owns the software he posts to and he owns the software he posts from. He uploaded his tax returns but that would be really easy to fake.


All in all if you do pay for his content there’s a lot of good stuff in his DVD’s but you can get it pretty much anywhere for free. Like how to read sec filings there’s billions of free videos and websites. Like Steven dux says 90% of the content he and other traders put out is completely useless. But combining all of the 10%’s make a useful way to trade.

I don’t expect him to do everything for free but at least put in a little bit of effort into your content. I’m not paying 300 dollars for a DVD with some laptop ass audio or super scammy infomercial aesthetics.",2019-04-13
33,psxpetey,eksilh9,/r/pennystocks/comments/bcmwx2/to_the_person_who_wanted_a_timothy_sykes_review/eksilh9/,1,I think that’s more who it’s designed for people with 100k to blow.  All his millionaire students started with 15-30k .,2019-04-13
34,jettrooper357,eksjv0h,/r/pennystocks/comments/bclebx/has_anyone_heard_about_gern/eksjv0h/,1,"GERN had a good run this week. Not sure if that will continue, but it made me some profit this week.",2019-04-13
35,Crawlzzz,eksk6ch,/r/pennystocks/comments/bcmwx2/to_the_person_who_wanted_a_timothy_sykes_review/eksk6ch/,1,Truth is just that you don't need him. You can learn everything you need to know for free and through experience.,2019-04-13
36,Odell_Strangehams,eksl5tt,/r/pennystocks/comments/bclebx/has_anyone_heard_about_gern/eksl5tt/,1,Stay away.,2019-04-13
37,Crawlzzz,eksp2hd,/r/pennystocks/comments/bcqrir/vtl/eksp2hd/,1,There's been a lot of activity over the last week. I shorted it the beginning of this week and made decent profit.,2019-04-13
38,houseflip,eksp48g,/r/pennystocks/comments/bcmwx2/to_the_person_who_wanted_a_timothy_sykes_review/eksp48g/,1,fakenews,2019-04-13
39,flylikegaruda,eksp75j,/r/pennystocks/comments/bcqrir/vtl/eksp75j/,1,"Yes, I tried it too but my trading platform, First Trade, did not let me short it. What platform do you use?",2019-04-13
40,Crawlzzz,ekspv2g,/r/pennystocks/comments/bcqrir/vtl/ekspv2g/,1,It was just on a paper account. I just read that they're merging into $IMUX soon so I'd be careful,2019-04-13
41,[deleted],eksqfk7,/r/pennystocks/comments/bcqrir/vtl/eksqfk7/,1,[removed],2019-04-13
42,flylikegaruda,eksqmam,/r/pennystocks/comments/bcqrir/vtl/eksqmam/,1,"Thanks. That is correct. There was not much of trade happening for last 4 months but after the news of $IMUX few days ago, there was much of activity and price of the stock peaked at  around $1.1. Looks like the merger is anticipated to be good.",2019-04-13
43,wrioter,eksqt38,/r/pennystocks/comments/bclebx/has_anyone_heard_about_gern/eksqt38/,1,That Johnson and Johnson deal was a bitch,2019-04-13
44,houseflip,eksr1hv,/r/pennystocks/comments/bcqrir/vtl/eksr1hv/,1,already went .25 to $1.25 didn't it? move on buddy,2019-04-13
45,flylikegaruda,eksrgzx,/r/pennystocks/comments/bcqrir/vtl/eksrgzx/,1,Actually it was wavering around 0.7 to 0.8 during the last trading hour yesterday,2019-04-13
46,anonymousstockmoron,eksrxtu,/r/pennystocks/comments/bcqrir/vtl/eksrxtu/,1,"Everyone played the merger hype.

Once got was an announced they were doing a 1 to 40 reverse split it dipped cause fuck that shit. 
If it gains heat again next week I’ll be surprised.",2019-04-13
47,anonymousstockmoron,ekss0n5,/r/pennystocks/comments/bcr5fr/what_are_some_stocks_that_you_like_for_long_term/ekss0n5/,1,$ARCI,2019-04-13
48,bdudes1,ekssh3f,/r/pennystocks/comments/bcr5fr/what_are_some_stocks_that_you_like_for_long_term/ekssh3f/,1,As far as esports goes Activision owns Major League Gaming.,2019-04-13
49,Xstream3,eksshs6,/r/pennystocks/comments/bcr5fr/what_are_some_stocks_that_you_like_for_long_term/eksshs6/,1,PRPO is expected to skyrocket possibly upto $20 per share (according to some analysts) do your own research in it first but it seems like a decent bet.,2019-04-13
50,Crawlzzz,ekssktr,/r/pennystocks/comments/bcqrir/vtl/ekssktr/,1,I use howthemwrkerworks for paper trading. Robinhood for actual trades but I do most with paper for now.,2019-04-13
51,Crawlzzz,eksspwo,/r/pennystocks/comments/bcqrir/vtl/eksspwo/,1,Good to know. I haven't been able to screen it properly yet I just was aware of a merger.,2019-04-13
52,GlobalVagabond,ekst31z,/r/pennystocks/comments/bcr5fr/what_are_some_stocks_that_you_like_for_long_term/ekst31z/,1,$GCGX $PSIQ $IGPK,2019-04-13
53,ReflectAA,ekst4wh,/r/pennystocks/comments/bclebx/has_anyone_heard_about_gern/ekst4wh/,1,"The drug is legit. J&amp;J did walk away, but by their own admission that was for financial reasons. Also actual J&amp;J employees believed in GERN's drug program so much that a few of them left J&amp;J to go work for Geron.

I've had a position since last year. I sold about half last summer during the large run-up, so now I'm just riding that out. 

It's definitely not all roses though. They have insufficient cash to actually exist for more than a year or two, and their management is kind of... slow? Unmotivated? I don't know what the word is but they seem to lack urgency compared to other drugs that have been developed in the last 5 years.

The two positive outcomes at this point are a) that they get an external investment from somewhere (ie: another J&amp;J type deal, or a minority stake from someor b) a merger. I don't really see how Geron is successful if they continue operating solo.

That being said, development-partnership deals are pretty common in the industry, and my money, literally, is on Geron finding another one.",2019-04-13
54,flylikegaruda,ekst5xe,/r/pennystocks/comments/bcqrir/vtl/ekst5xe/,1,That is a good point,2019-04-13
55,patster2355,ekst728,/r/pennystocks/comments/bcr5fr/what_are_some_stocks_that_you_like_for_long_term/ekst728/,1,"Enwave Corp $NWVCF. They have awesome technology for drying food, pharmaceuticals, and weed.",2019-04-13
56,ElusiveTurtle,ekstolk,/r/pennystocks/comments/bcr5fr/what_are_some_stocks_that_you_like_for_long_term/ekstolk/,1,FOLGF. They are sitting on a 30% stake in an oil field that could supply power to all of Australia for over 500 years. Currently trading at around 20 cents.,2019-04-13
57,GoGoButters,ekstpfh,/r/pennystocks/comments/bcr5fr/what_are_some_stocks_that_you_like_for_long_term/ekstpfh/,1,"Long, long term is WM for me",2019-04-13
58,GotFroberg,ekstult,/r/pennystocks/comments/bcr5fr/what_are_some_stocks_that_you_like_for_long_term/ekstult/,1,$ACB,2019-04-13
59,DonKevinho,eksvg56,/r/pennystocks/comments/bcr5fr/what_are_some_stocks_that_you_like_for_long_term/eksvg56/,1,WPRT,2019-04-13
