,author,id,url,score,text,date
60,mtooth,eksvlv0,/r/pennystocks/comments/bcr5fr/what_are_some_stocks_that_you_like_for_long_term/eksvlv0/,1,"Here are a few that I own as long-term holds; definitely do your own research though since as the old adage goes: *if you don't know why you bought a stock then how will you know when to sell it?*

$ATBPF / ATE.V - This is a /r/pennystocks favorite and for good reason since they have a very easy to understand drug pipeline with the potential to completely replace existing NSAIDs (first), certain opiods, and even aspirin with a safer alternative.  Phase 2 results on the NSAID replacement were phenomenal.  Their [investor presentation](http://www.antibethera.com/wordpress/pdf/presentations/Antibe%20Investor%20Presentation%20-%20February%202019.pdf) explains everything quite clearly and since it's just pain killers you do not need to be a medical expert to understand the implications.  Only downside is that they've issued tons of warrants over the years so there's lots of dilution but it shouldn't matter too much if their drug makes it to market.

$EYEN - Interesting IPO from 2018 with 3 Phase 3 drugs in the pipeline along with an OTC product they plan to start selling in 2019.  Again, it's a super-easy to understand drug company; they're trying to replace eye-droppers with a sophisticated spray device that allows them to deliver smaller dosages.  One side-effect of the smaller dose size is that it unlocks some already-known drugs which are not widely used because they cause side-effects at higher doses via eye-drops.  It was a super compelling buy at $2.50 in December because they had about $2/share in cash at the time... but even at ~$5 I think it's worth looking at when you consider the size of market they could address (their myopia product could be massive in China but that'll be more like 2021 timeframe).

$SCON - If you're patient enough and have the nerves to survive the dilutions this one could some day be a 1000 bagger.  They are one of only a couple companies with the specialized manufactoring capability to produce some new barium copper oxide rare-earth superconducting wire (the wire which composes most of a new generation of high-energy superconducting electromagnet that can operate with liquid nitrogen instead of liquid helium).  There's a lot of interest from the military, utilities, and cutting-edge electric power startups.  I view $SCON as a way to get indirect investment access to MIT's new Commonwealth Fusion Systems startup (Bill Gates is an investor) since they will need massive quantities of this wire if they are successful in their new fusion design.  The high-temperature superconducting magents are *the fundamental physics advancement* that enables the possibility of a small-radius (i.e. inexpensive) tokamak fusion reactor.  The time scales for this investment are decades though; and specifically for next year or two $SCON will have to keep diluting the stock so just keep it on your watchlist; it looks like they could see serious revenue by 2021 though.  I have a very small position just so that I have some exposure and never forget about it.  The price is definitely compelling at a $5MM market cap considering this could easily become a &gt;100 million revenue company some day.",2019-04-13
61,Creativity_Rater,ekswvrx,/r/pennystocks/comments/bcr5fr/what_are_some_stocks_that_you_like_for_long_term/ekswvrx/,1,"I would avoid long term penny stocks right now if I were you. That being said, I am already long on $AQB and if I were to recommend one pennystock it would be that.",2019-04-13
62,jcarr575,eksxhht,/r/pennystocks/comments/bcr5fr/what_are_some_stocks_that_you_like_for_long_term/eksxhht/,1,This,2019-04-13
63,cowpiefatty,eksxw2q,/r/pennystocks/comments/bcr5fr/what_are_some_stocks_that_you_like_for_long_term/eksxw2q/,1,Be careful with this one in my newness i made and burnt so much on this boy right here,2019-04-13
64,andrewgaratz,eksy3he,/r/pennystocks/comments/bcr5fr/what_are_some_stocks_that_you_like_for_long_term/eksy3he/,1,Where do you see it in 5 years?,2019-04-13
65,blind_mowing,eksy3oh,/r/pennystocks/comments/bcr5fr/what_are_some_stocks_that_you_like_for_long_term/eksy3oh/,1,With a reverse split?,2019-04-13
66,teamrd,eksy5xe,/r/pennystocks/comments/bcr5fr/what_are_some_stocks_that_you_like_for_long_term/eksy5xe/,1,100% People always gonna be trashing this planet up.,2019-04-13
67,abaddon2025,eksyf9a,/r/pennystocks/comments/bclebx/has_anyone_heard_about_gern/eksyf9a/,1,"I agree with you, they’re burning a lot of cash each year. Hopefully once they announce partnership it will fill the gap",2019-04-13
68,abaddon2025,eksyfm5,/r/pennystocks/comments/bclebx/has_anyone_heard_about_gern/eksyfm5/,1,Why,2019-04-13
69,thundrcnt-,eksylg9,/r/pennystocks/comments/bcr5fr/what_are_some_stocks_that_you_like_for_long_term/eksylg9/,1,"Hanging on to a handful of SIML for the moment, their recent acquisition has been making waves with these distribution agreements and I expect that to continue, at least in earnest",2019-04-13
70,Odell_Strangehams,eksyp9c,/r/pennystocks/comments/bclebx/has_anyone_heard_about_gern/eksyp9c/,1,"It had a decent run but at this point you’d be chasing it.  This stock is one of those bio stocks that could make a few decent gains or the bottom could drop out (like it has several times).  Most of the time it trades flat though.  

Also as someone else said this company spends a lot of money and makes nothing.  

All of the above but mostly because this entry point will get you burned unless you are wanting to short it or hold it forever.",2019-04-13
71,abaddon2025,eksz1j9,/r/pennystocks/comments/bclebx/has_anyone_heard_about_gern/eksz1j9/,1,"I got a friend who’s actually studied natural sciences, said the company, the team and the research is solid, but yeah from money point of view it’s a cash burn.",2019-04-13
72,Odell_Strangehams,eksz6vv,/r/pennystocks/comments/bclebx/has_anyone_heard_about_gern/eksz6vv/,1,"Yeah. I think they are a decent company but as a money maker I’m not really seeing anything that makes me think I would sink money in here.  

Nothing wrong with buying 100 shares though and forgetting about them just in case.",2019-04-13
73,alilfishy,ekszfvv,/r/pennystocks/comments/bcr5fr/what_are_some_stocks_that_you_like_for_long_term/ekszfvv/,1,CRMD,2019-04-13
74,Creativity_Rater,ekt02kq,/r/pennystocks/comments/bcr5fr/what_are_some_stocks_that_you_like_for_long_term/ekt02kq/,1,"Bought out, making a profit selling fish/fish eggs, or its assets back to its parent company. They can pretend they are eco friendly because their fish produce less waste (they may be and its not pretend, idk, but either way the fish are eco friendly). Because the fish will take less time to grow they are cheaper, they've done a cost comparison and they will profit off the fish, and due to overfishing, fish prices should go up naturally. They have a serious advantage once they start running. 

&amp;#x200B;

But institutions are buying in at 2.25 so anyone buying it might want to wait and try for that, or wait until a recession hits and ""gamble"" stocks take a serious fall.",2019-04-13
75,wldrnryn,ekt04pu,/r/pennystocks/comments/bcr5fr/what_are_some_stocks_that_you_like_for_long_term/ekt04pu/,1,What dont you understand about penny stock?,2019-04-13
76,PlutoPatata,ekt1t2s,/r/pennystocks/comments/bcr5fr/what_are_some_stocks_that_you_like_for_long_term/ekt1t2s/,1,$LRSV UK based cbd products. They are expanding to north america.,2019-04-13
77,PlutoPatata,ekt216a,/r/pennystocks/comments/bcr5fr/what_are_some_stocks_that_you_like_for_long_term/ekt216a/,1,Waiting for this to go 6-7 and will put 50% of my portfolio.,2019-04-13
78,Limit_1,ekt2kn7,/r/pennystocks/comments/bcr5fr/what_are_some_stocks_that_you_like_for_long_term/ekt2kn7/,1,Nah. If you do DD on it you’ll see that’s not the case,2019-04-13
79,j0shyuaa,ekt2qz4,/r/pennystocks/comments/bcr5fr/what_are_some_stocks_that_you_like_for_long_term/ekt2qz4/,1,VYST. They a merging with Rotmans furniture a $35 mil a year company. VYST makes air purifiers for hospitals and also makes an organic latex for their mattresses and latex gloves. They're currently at .07 a share with an institution investing 200000 shares at .15 a share  They're goal is to trade in the NASDAQ. Long term this could be at least $4 a share.,2019-04-13
80,xacksox,ekt2tgz,/r/pennystocks/comments/bcr5fr/what_are_some_stocks_that_you_like_for_long_term/ekt2tgz/,1,$TEUM,2019-04-13
81,belds,ekt2vc6,/r/pennystocks/comments/bcr5fr/what_are_some_stocks_that_you_like_for_long_term/ekt2vc6/,1,"Why would you avoid them, the possible incoming recession?",2019-04-13
82,belds,ekt3121,/r/pennystocks/comments/bcr5fr/what_are_some_stocks_that_you_like_for_long_term/ekt3121/,1,I just meant I’m really only knowledgeable about stocks in those two sectors. These answers are great and I really appreciate the descriptions that you wrote out. It can be tough to see the reasons people are holding certain stocks and think they’ll make big gains in the future so that really helps. Thanks so much,2019-04-13
83,xacksox,ekt69bq,/r/pennystocks/comments/bcr5fr/what_are_some_stocks_that_you_like_for_long_term/ekt69bq/,1,food for thought,2019-04-13
84,born2rock4life,ekt6eg7,/r/pennystocks/comments/bcmwx2/to_the_person_who_wanted_a_timothy_sykes_review/ekt6eg7/,1,"Of course, but many people “pay for their education,” that way. I was one of them, which is also why I speak up and try to emphasize taking away knowledge for free where possible, since most penny stock traders aren’t starting with enough capital to make paying for an education otherwise appealing.

Paper trading / demo accounts are a great means to learn and practice, but nothing teaches you how to deal with the psychology when it’s real money except experience like you said.

The emphasis of educational programs (books, courses, whatever you prefer,) saying “cut losses quickly,” becomes a huge part of helping with success and preserving capital.",2019-04-13
85,IrRoscoeMr,ekt6nzo,/r/pennystocks/comments/bcr5fr/what_are_some_stocks_that_you_like_for_long_term/ekt6nzo/,1,"MSNVF is my long term. PPE for Government contracts. Mission ready solutions merging with unifire. Waiting for tsx to finalize the merger. Financing already complete so you wouldn't have to worry about that.

https://mobile.twitter.com/Fmartinezx9/status/1116457922849058816?s=17

Apparently they are honey badgers and dgaf and are already working together.",2019-04-13
86,holeeray,ekt71wc,/r/pennystocks/comments/bcr5fr/what_are_some_stocks_that_you_like_for_long_term/ekt71wc/,1,"ALRT is my only long penny hold. The hype has really died down on them, but they're not a sensational brand that likes to pump with random PRs. They're finally starting to roll out their app and it feels like they're coming to a head with marketing to certain healthcare sectors so I'm hoping for a pop within the next year or so.

I've got a couple no bid bags, too, but I just imagine that money's already gone. :P",2019-04-13
87,Jaminshaman,ekt7bzx,/r/pennystocks/comments/bcr5fr/what_are_some_stocks_that_you_like_for_long_term/ekt7bzx/,1,$SNES and $AMRH are both pretty safe and profitable longs,2019-04-13
88,born2rock4life,ekt7jfq,/r/pennystocks/comments/bcmwx2/to_the_person_who_wanted_a_timothy_sykes_review/ekt7jfq/,1,"That’s why I emphasize watching all the content you can for free, as most people with penny stock focus aren’t trading blue chips because they don’t have much capital.

Gripes aside with the audio recordings (I am a professional musician, so I loathe the audio clipping heard in the short stocking DVD series,) his material is useful when it comes to learning.

I agree the cost of the challenge is more than I would pay without h I get the income to dispose, which is why I haven’t joined yet myself. Once I have the means, I will, but more so to give credit where it’s due since I’ve seen most of his stuff free as I mentioned. The subscription based approach is good and I think a better bet for most. While his watchlist is one thing you said is useful, you are correct that you can do it all yourself for free. I use ThinkOrSwim scanners and never rely on anyone else for watchlists, which he encourages also in his videos, As does Steven, which he mentions he does in the interview.

I’m a huge advocate of free education myself, and anyone with a little tech savvyness can find torrents on the pirates of the bay with most of the content. I don’t advise such, but just saying. Knowledge is power, and learning everything you can is the best way to help ensure success. Trading is highly psychological, and knowing how others who are successful think can be a huge boost to one’s own psychology.",2019-04-13
89,born2rock4life,ekt8fl9,/r/pennystocks/comments/bcmwx2/to_the_person_who_wanted_a_timothy_sykes_review/ekt8fl9/,1,"That’s great, but providing a review is meant to inform. Glad you shared how you feel about the guy, but it would be more beneficial to give examples of all the videos/channels you mention where a valuable education can be had rather than his own.

You are right that you can find most of what he teaches for free, but helping others have an idea where to start is the purpose of my review, particularly the person who made a post yesterday which was deleted/removed.

But to that same extent, what he teaches in his content is useful. If it wasn’t, then the same thing would be said for all of the content on YouTube. Knowledge is useful. Experience is useful. And learning from anyone who has both, even more so.",2019-04-13
90,psxpetey,ekt9x8m,/r/pennystocks/comments/bcmwx2/to_the_person_who_wanted_a_timothy_sykes_review/ekt9x8m/,1,"Well his YouTube videos aren’t educational at all they’re absolute trash and basically just Uber scammy advertisements. I wouldn’t mind seeing what his other dvds have in store but I’m not paying what he’s asking for something that badly made. 

Steven dux is putting out a new DVD and it sounds like it’s going to be the same thing garbage audio just telling how and when he got in and out. But even him he never talks about what he was thinking before getting into the trade or exactly why he got in like volume, something in the sec or news, he just shows the ticker and when he got in and out. Not really educational. These guys always say they love teaching but it’s very very badly done. 

I also read his book thingy that he always advertises is free, more like a magazine that just has some common sense stuff in there nothing really useful.

Free education is awesome but for people to pay you have to put out quality stuff. Also knowing people who are successful isn’t worth that money. 

Some of the psychology ideas they hammer on about are decent. I use think or swim too. But also finvis those news alerts are absolutely worth their weight in gold. They allow you to get in before it’s already popped and take almost the whole move. Trouble is it only shows 30 mins of pre market and no after hours which is bullshit.",2019-04-13
91,JoshRozin,ektbizw,/r/pennystocks/comments/bcs57b/stocks_available_on_wealthsimple_trade/ektbizw/,1,"Looks like they offer “over 8000 different stocks” as of August last year while there’s over 15,000 stocks on the OTC alone. Have been looking at WealthSimple trade... maybe when they’re more developed!",2019-04-13
92,anonymousstockmoron,ektbocd,/r/pennystocks/comments/bcr5fr/what_are_some_stocks_that_you_like_for_long_term/ektbocd/,1,I still don’t understand how it’s been flying under the radar so long.,2019-04-13
93,Xstream3,ektboru,/r/pennystocks/comments/bcs57b/stocks_available_on_wealthsimple_trade/ektboru/,1,In Canada we don't have Robinhood yet so need to use WealthSimple until then. Right now it's very limited in functionality so I need to use other apps alongside it to find more info which is annoying,2019-04-13
94,born2rock4life,ektcvx1,/r/pennystocks/comments/bcmwx2/to_the_person_who_wanted_a_timothy_sykes_review/ektcvx1/,1,"Now this reply provides constructive input. My staying the prior one wasn’t valuable was because it criticized without providing any valuable arguments. That said;

I agree with a lot of what you say. I’ve learned from many people, books, strategies in all the content, etc. and doing that and finding what worked best for me is why I speak up and provided the review I did. I don’t care if you believe me, that I’m profitable, or otherwise. I’ve achieved success (and not just in trading,) but am simply trying to help inform the person’s whose original post was deleted, and for others who wanted to see a review otherwise.

That said, I’ve had many $1-2k days, and that was when I was at $5-10k capital. Six figures is far from necessary to see these kinds of gains. Maybe for blue chips that move 3-5% on a daily basis at most, but surely not volatile penny stocks.

Options are a great thing, and as you mentioned can be highly liquid while dealing with larger sums of capital. The purpose of the post being in the penny stock subreddit forum is because most of the times people trading them don’t have lots of capital, and given that, slippage isn’t something they’re likely to experience when buying and selling since they’re not making orders for hundreds of thousands or millions of share at once.

As far as learning what to do, rather than learning the principles of why they do what they do, you are correct. If you copy cat their trades and not understand the underlying reasons they make the trades, then you’re setting yourself up to get stuck bag holding/taking losses in volatile penny stocks. If you know the skills and think for yourself, you will find yourself ahead of the game, so to speak.

As far as paying for him to teach you how to make millions, isn’t that pretty much what college does? Except most people spend tens of thousands, if not hundreds of thousands, which they pay interest on top of. They’re scams too, just because most people don’t make millions? Tim openly states that so far only 6 students of his have become millionaires, so he’s not misleading, just stating the possibility. He isn’t guaranteeing that is the case for everyone.

Never mind that’s why Aaron Schwartz shared so much knowledge for free that he downloaded from MIT. So people could obtain knowledge and make use of it. What Tim proposes is no different, and he advises learning everything you can, particularly for the same reasons with the internet having all of the material for free if you look hard enough.",2019-04-13
95,born2rock4life,ekte7e8,/r/pennystocks/comments/bcmwx2/to_the_person_who_wanted_a_timothy_sykes_review/ekte7e8/,1,"Some of them aren't, but many of them do have useful information.  To the unexperienced trader, they may not recognize what's beneficial as they aren't experienced and aren't aware of what they're looking for, and you can't blame them

As far as the programs he, Steven, or any guru puts together and sells, they all do so to help people, but of course are putting a price on the work they put into it. Their time is valuable.  I personally recommend the book ""The Market Whisperer,"" for those who want a cheap/free approach to learn the basics and fundamentals, as it's free with a 30-day trial on Amazon Kindle Unlimited. However, Steven does disclose why he's entered trades, though his English isn't the best it does explain why he entered the trade. William Karaman as well. I only speak to people I've watched and learned from, then applied which has given me better success. I can't say much for many other content creators because I don't know them or their programs, and you won't see me doing so, as I believe providing an opinion on something I'm not educated upon is doing a disservice.

If people are looking for free resource otherwise, I'd recommend ""EatSleepProfit"" YouTube channel. He shows the basics of what penny stocking is, how to setup scanners/find news, etc. But that wasn't the point of my post, which I restate is to provide a review to someone who asked for one yesterday when their post was deleted/removed particular to Tim Sykes.

As far as news; FinViz is great, and they have good charts/scanners built-in. I also use SeekingAlpha for news and TheFly.  I use https://volumebot.com to identify short volume which is free.  Outside of that, my scanner setup was built off the framework from the guy I mentioned earlier's youtube channel, EatSleepProfit. It does the job well for finding low float, low cap stocks with volume in order to find potential runner candidates, gap-ups, etc.",2019-04-13
96,i_am_trippin_balls,ektf8u5,/r/pennystocks/comments/bcr5fr/what_are_some_stocks_that_you_like_for_long_term/ektf8u5/,1,I 2nd Activision,2019-04-13
97,abcde123edcba,ektfb4i,/r/pennystocks/comments/bcr5fr/what_are_some_stocks_that_you_like_for_long_term/ektfb4i/,1,Why CRMD,2019-04-13
98,abcde123edcba,ektfbo0,/r/pennystocks/comments/bcr5fr/what_are_some_stocks_that_you_like_for_long_term/ektfbo0/,1,Why TEUM?,2019-04-13
99,abcde123edcba,ektfd5o,/r/pennystocks/comments/bcr5fr/what_are_some_stocks_that_you_like_for_long_term/ektfd5o/,1,Why ARCI?,2019-04-13
100,abcde123edcba,ektfgan,/r/pennystocks/comments/bcr5fr/what_are_some_stocks_that_you_like_for_long_term/ektfgan/,1,Why do you like PRPO?,2019-04-13
101,abcde123edcba,ektfgoo,/r/pennystocks/comments/bcr5fr/what_are_some_stocks_that_you_like_for_long_term/ektfgoo/,1,Why them?,2019-04-13
102,abcde123edcba,ektfhk3,/r/pennystocks/comments/bcr5fr/what_are_some_stocks_that_you_like_for_long_term/ektfhk3/,1,Why WPRT?,2019-04-13
103,abcde123edcba,ektfik0,/r/pennystocks/comments/bcr5fr/what_are_some_stocks_that_you_like_for_long_term/ektfik0/,1,Why do you like SIML?,2019-04-13
104,abcde123edcba,ektfkdy,/r/pennystocks/comments/bcr5fr/what_are_some_stocks_that_you_like_for_long_term/ektfkdy/,1,Why SNES and AMRH?,2019-04-13
105,xacksox,ektg44e,/r/pennystocks/comments/bcr5fr/what_are_some_stocks_that_you_like_for_long_term/ektg44e/,1,"Lots of multi-million dollar contracts, yet their price doesn’t always reflect their true current value, as their projects take months to complete. They have grown steadily over the last three years. I want to retire on these guys.",2019-04-13
106,[deleted],ektg9sj,/r/pennystocks/comments/bcs57b/stocks_available_on_wealthsimple_trade/ektg9sj/,1,[removed],2019-04-13
107,thundrcnt-,ektgbob,/r/pennystocks/comments/bcr5fr/what_are_some_stocks_that_you_like_for_long_term/ektgbob/,1,"Steady build in price following their last two announcements for their Proscere Bioscience subsidiary. I was expecting a massive dump but it hasn’t happened so far, so I’m getting a bit more confident. Any further announcements are going to put it past a dime imho, maybe even higher",2019-04-13
108,anonymousstockmoron,ektgmnv,/r/pennystocks/comments/bcr5fr/what_are_some_stocks_that_you_like_for_long_term/ektgmnv/,1,"Read their 10-K filing.
-Multiple letters of intent for an asset sale (their recycling business) totaling $30MM - $35MM
 
-The stock is trading at ~ $0.55 with a current market cap of  $5MM that would put the stock at about $3 - $3.50 a share. Analyst are predicting $4 a share by the end of the year.

-Their CEO has multiple asset sales under his belt so he knows what he’s dealing with.

- they have no debt as it was paid off with the previous asset sale.

-they’re speeding up a tax settlement that they were going to drag out for multiple years so that shows they’re serious about said asset sale.

-they also own GeoTraq (not recycling) which is soon to go to commercial.",2019-04-13
109,abcde123edcba,ektgxlz,/r/pennystocks/comments/bcr5fr/what_are_some_stocks_that_you_like_for_long_term/ektgxlz/,1,Could. You possible explain what they do? How long do these contracts last for?,2019-04-13
110,xacksox,ekthb77,/r/pennystocks/comments/bcr5fr/what_are_some_stocks_that_you_like_for_long_term/ekthb77/,1,"They’re a IoT/cloud company that want to build the first “smart cities” via cloud-computing software. You can learn just as much , if not more than me , at their website pareteum.com",2019-04-13
111,GoldFynch,ekthj5j,/r/pennystocks/comments/bcr5fr/what_are_some_stocks_that_you_like_for_long_term/ekthj5j/,1,Any Canadian penny stocks worth putting money into right now? I’ve been doing the same just putting money into weed stocks but the only one performing really well for me as been OGI,2019-04-13
112,KORJesus,ektiig9,/r/pennystocks/comments/bcs57b/stocks_available_on_wealthsimple_trade/ektiig9/,1,I feel you. Some stocks are on there some aren't. I'm looking at ARCI right now and a few others.,2019-04-13
113,Melissa6381,ektjji1,/r/pennystocks/comments/bcqrir/vtl/ektjji1/,1,I’ve never been through a merger before and am holding VTL/imux- have you seen successful situations like this one before?,2019-04-13
114,belds,ektjk0l,/r/pennystocks/comments/bcr5fr/what_are_some_stocks_that_you_like_for_long_term/ektjk0l/,1,"I’m more focused on the American side of things but I also have the otc version of organigram which has been doing well for me also. 


The only Canadian weed pennystock I have is indiva. They’re a newer company focusing on extraction. They’re creating facilities that have the growing, processing and extraction all under the same roof. Too early to tell but I’m a fan of extraction as I think that’s gonna be big in the future. I have a couple American ones as well I can go into if you’re interested but your post makes it sound like you only want companies being traded on the Canadian exchanges.",2019-04-13
