,author,id,url,score,text,date
0,Brandon_23_,fmjkrvd,/r/pennystocks/comments/fvobwo/worried_by_the_xspa_aytu_colab/fmjkrvd/,1,"Yeah, I bought at about 0.2450c a share and bought 1000 shares and it all just went down hill. Ended up day trading and selling in after hours and lost $4 luckily",2020-04-06
1,rovaYa,fmjl9zf,/r/pennystocks/comments/fvobwo/worried_by_the_xspa_aytu_colab/fmjl9zf/,1,"You guys are backing out of XSPA? i’m holding for this week, i got in at .19 i think it’ll hit around .30-.35 then i’m getting hoping off the 🚂",2020-04-06
2,LoPriore,fmjlk9l,/r/pennystocks/comments/fvobwo/worried_by_the_xspa_aytu_colab/fmjlk9l/,1,No I don’t want to back out. I think it’s good hold actually. Just woke up to AYTU talk the other day and had nitemare flashes of Sabby and rocket emojis,2020-04-06
3,peanutbutterpretzel4,fmjtxuk,/r/pennystocks/comments/fvobwo/worried_by_the_xspa_aytu_colab/fmjtxuk/,1,"I have 1700 shares of XSPA and 100 shares AYTU 

Will be watching closely tomorrow.",2020-04-06
4,Vast_Cricket,fmjw7gs,/r/pennystocks/comments/fvq0m0/how_do_you_guys_feel_about_gamestop/fmjw7gs/,1,doomed,2020-04-06
5,TriFade,fmjw8ji,/r/pennystocks/comments/fvq0m0/how_do_you_guys_feel_about_gamestop/fmjw8ji/,1,Thanks for for the reassurance!,2020-04-06
6,stocksorcerer,fmjwhk0,/r/pennystocks/comments/fvq0m0/how_do_you_guys_feel_about_gamestop/fmjwhk0/,1,"I would definitely not buy in. They are already failing because of amazon and steam or other online game stores, but their business practices of late have doomed them further.",2020-04-06
7,thesunny51,fmjwhxz,/r/pennystocks/comments/fvq0m0/how_do_you_guys_feel_about_gamestop/fmjwhxz/,1,$2 put GME 10/16,2020-04-06
8,Vast_Cricket,fmjwyci,/r/pennystocks/comments/fvq0m0/how_do_you_guys_feel_about_gamestop/fmjwyci/,1,The only person into Gamestop was Michael Burry. I took part of his announced portfolio which was a men suit company and it is about ready to be delisted.  I think he sold Gamestop awhile back....,2020-04-06
9,thesaltyXO,fmjx00p,/r/pennystocks/comments/fvq0m0/how_do_you_guys_feel_about_gamestop/fmjx00p/,1,Currently hoping to break even this week,2020-04-06
10,TriFade,fmjx31m,/r/pennystocks/comments/fvq0m0/how_do_you_guys_feel_about_gamestop/fmjx31m/,1,Yea my thoughts exactly. They can't compete with companies online as games are easily distributed ONLINE. What's the point of going to Gamestop to buy games and return items and have to deal with their terrible return policy when games are accessible with an online purchase. I do see them going down but to $2.5 by this friday? All the backlash they've received and them being on the ventilator so long just reassures me even more.,2020-04-06
11,TriFade,fmjx6uo,/r/pennystocks/comments/fvq0m0/how_do_you_guys_feel_about_gamestop/fmjx6uo/,1,Nah we need to profit.,2020-04-06
12,TriFade,fmjxb41,/r/pennystocks/comments/fvq0m0/how_do_you_guys_feel_about_gamestop/fmjxb41/,1,Profitz,2020-04-06
13,[deleted],fmjxc0f,/r/pennystocks/comments/fvobwo/worried_by_the_xspa_aytu_colab/fmjxc0f/,1,[removed],2020-04-06
14,stocksorcerer,fmjxga1,/r/pennystocks/comments/fvq0m0/how_do_you_guys_feel_about_gamestop/fmjxga1/,1,"I don’t trade options because I don’t yet understand them completely, so I’m not the guy to ask about it. I don’t see the stock going up anytime soon though. I hope this works out well for you.",2020-04-06
15,TriFade,fmjxorm,/r/pennystocks/comments/fvq0m0/how_do_you_guys_feel_about_gamestop/fmjxorm/,1,Trade options are pretty fun (for me at least). I've made more money with this than anything else that I've tried. Give it a try when you're comfortable its definitely profitable.,2020-04-06
16,stocksorcerer,fmjxzfb,/r/pennystocks/comments/fvq0m0/how_do_you_guys_feel_about_gamestop/fmjxzfb/,1,"I’ll do more research into it definitely, and this is probably the time to be doing it anyways when the market is more hectic but also more predictable for some stocks. I just know I’d have a bad time gambling with options, wouldn’t be able to make the right calls when necessary. Stocks are slower, but usually less risky when you know what to look for, not that I’m an expert or anything. I do have a fair amount of stocks bought into TTOO that I’m betting on right now, but who knows how the hell that will go",2020-04-06
17,exocetblue,fmjyzmc,/r/pennystocks/comments/fvqh90/how_to_play_the_bear_in_airlines/fmjyzmc/,1,Remindme! 29 hours,2020-04-06
18,cocoaflavorbutthole,fmjzaei,/r/pennystocks/comments/fvpgra/antibe_therapeutics_tsxvate_otcatbpf_looks_good/fmjzaei/,1,have been trying to tell people about ATBPF since forever,2020-04-06
19,RemindMeBot,fmjzaua,/r/pennystocks/comments/fvqh90/how_to_play_the_bear_in_airlines/fmjzaua/,1,"I will be messaging you in 1 day on [**2020-04-07 07:37:26 UTC**](http://www.wolframalpha.com/input/?i=2020-04-07%2007:37:26%20UTC%20To%20Local%20Time) to remind you of [**this link**](https://np.reddit.com/r/pennystocks/comments/fvqh90/how_to_play_the_bear_in_airlines/fmjyzmc/?context=3)

[**CLICK THIS LINK**](https://np.reddit.com/message/compose/?to=RemindMeBot&amp;subject=Reminder&amp;message=%5Bhttps%3A%2F%2Fwww.reddit.com%2Fr%2Fpennystocks%2Fcomments%2Ffvqh90%2Fhow_to_play_the_bear_in_airlines%2Ffmjyzmc%2F%5D%0A%0ARemindMe%21%202020-04-07%2007%3A37%3A26%20UTC) to send a PM to also be reminded and to reduce spam.

^(Parent commenter can ) [^(delete this message to hide from others.)](https://np.reddit.com/message/compose/?to=RemindMeBot&amp;subject=Delete%20Comment&amp;message=Delete%21%20fvqh90)

*****

|[^(Info)](https://np.reddit.com/r/RemindMeBot/comments/e1bko7/remindmebot_info_v21/)|[^(Custom)](https://np.reddit.com/message/compose/?to=RemindMeBot&amp;subject=Reminder&amp;message=%5BLink%20or%20message%20inside%20square%20brackets%5D%0A%0ARemindMe%21%20Time%20period%20here)|[^(Your Reminders)](https://np.reddit.com/message/compose/?to=RemindMeBot&amp;subject=List%20Of%20Reminders&amp;message=MyReminders%21)|[^(Feedback)](https://np.reddit.com/message/compose/?to=Watchful1&amp;subject=RemindMeBot%20Feedback)|
|-|-|-|-|",2020-04-06
20,icleancatsonmydayoff,fmjzlzy,/r/pennystocks/comments/fvq0m0/how_do_you_guys_feel_about_gamestop/fmjzlzy/,1,I’ve got 4/17 p strike of 2.74 and I can only imagine it’ll keep falling. Hold until expiration you think?,2020-04-06
21,Knight_Aero,fmjzo30,/r/pennystocks/comments/fvqgzg/imimf_your_opinion/fmjzo30/,1,I bought it around .33 weeks ago since I knew they were acquiring some new land for mining potential. Looks very promising and we could see good news this Tuesday at a meeting they are having. The big news will come at the end of the month or early next when they reveal the results of the land survey. If its promising the bump should be decent. When they begin mining officially though I think is when things may really roll. I'll be happy if they crest over a dollar at some point in the next few months. I thing some gold mining stocks have seen this easily if the market calls for it. This is definitely a long watch though if you don't mind the higher fee per trade and the waiting. I think it's like 6 something through TD.,2020-04-06
22,StocksForADummy,fmk108t,/r/pennystocks/comments/fvquff/tos_or_webull/fmk108t/,1,"I personally use webull but enjoy the way TOS works and looks. 

I’ve heard recently that TOS has been having lagging issues lately but I can’t say that with absolute certainty. If you want the free stock, open a webull account just to collect and transfer to TOS after a while if it’s not what you’re looking for.",2020-04-06
23,beniman8,fmk17hz,/r/pennystocks/comments/fvqxsk/daytrading_cont/fmk17hz/,1,You get all the money back plus profit . The broker takes a comission. Everything happens on that moment,2020-04-06
24,thatsmyburrito,fmk1pzg,/r/pennystocks/comments/fvqxsk/daytrading_cont/fmk1pzg/,1,My understanding is that you are waiting for the sale of the stock to settle so you will be waiting on the whole $610 for three days.,2020-04-06
25,FractalAsshole,fmk1r5x,/r/pennystocks/comments/fvqyvy/best_place_to_trade_your_wallet_thanks_you/fmk1r5x/,1,"Saved you all a click. They're selling memberships.

Breaks sub rules

""""
Role pricing differences: 

Both of these memberships give you access to the room and all alerts.
Weekly survivor:   $11.99 a week 
Money Team: $44

These 3 include the below.
Includes:  access to all room and alerts, as well as once a month 30minutes – 1 hour conversation to review previous trades, and find room for improvement. 
You also get a high referral bonus for every member you invite, and they subscribe. 
Affiliate:  $77 
Market survivor: this for Yearly 
Head Honcho: this is for lifetime membership.

Type "" upgrade""  without quotes to sign up 

""""""",2020-04-06
26,Osman120,fmk1yiu,/r/pennystocks/comments/fvqxsk/daytrading_cont/fmk1yiu/,1,TDA is 0 commission and not for cash account,2020-04-06
27,Vast_Cricket,fmk221p,/r/pennystocks/comments/fvquff/tos_or_webull/fmk221p/,1,"That lagging glitching was rpt earlier. I fixed mine with a timing delay pointed out by someone.  I believe it is behind. TOS will be part of Schwab-TD merged company once approved.  People flown in from Omaha coaching one on one and they answered different questions.  

Webull is a Chinese company with software developed in Hunan. I do not feel comfortable with a relatively new company with office in NYC having my fica numbers.  I prefer a more established US company doing banking and trades.",2020-04-06
28,discobiskitz,fmk2xl8,/r/pennystocks/comments/fvobwo/worried_by_the_xspa_aytu_colab/fmk2xl8/,1,Me too,2020-04-06
29,[deleted],fmk37wv,/r/pennystocks/comments/fvquff/tos_or_webull/fmk37wv/,1,[removed],2020-04-06
30,co2_druid,fmk39l6,/r/pennystocks/comments/fvquff/tos_or_webull/fmk39l6/,1,"Just jumping on here as a fan of ToS, it has been lagging / having issues with the updates, at least for me.

I'm also using a pretty beafy computer with a solid Ethernet connection speed that has no issues with the other platforms I've tried (RH / Webull), so I believe at least in my particular case the issue does lie with ToS.",2020-04-06
31,Agnia_Barto,fmk3hgq,/r/pennystocks/comments/fvr9k1/beginner/fmk3hgq/,1,Invest in lentils mate,2020-04-06
32,Agnia_Barto,fmk3mln,/r/pennystocks/comments/fvqh90/how_to_play_the_bear_in_airlines/fmk3mln/,1,Short it? Bear VIX? Buy puts? Google how to get rich when markets go down?,2020-04-06
33,ThinbluelineandK9s,fmk42va,/r/pennystocks/comments/fvr9k1/beginner/fmk42va/,1,"Open a high yield savings. You should probably have a few grand saved somewhere safe before you try investing. 

Coming from someone that lost several thousand last year being young and thinking I could figure it out. It's not as easy as some make it look online.",2020-04-06
34,BuyingMoreCallsToo,fmk48cf,/r/pennystocks/comments/fvqh90/how_to_play_the_bear_in_airlines/fmk48cf/,1,"I'd recommend a call credit spread (still bearish).

This will tie up your capital, providing up front credit, and you make money so long as the stocks don't go up, if you do it right. I'll give an example. 

Just checked and there's 4/17 22/24 for delta, max risk $102, max profit starting below $22/share is $98. So they're currently below $20 a share, so basically +50% on your money if they don't go up 10% in two weeks, for max profit, 15% to break even, or 20% to lose $102.

This ties up $200 for collateral, but you get $98 back immediately, which is free to use. Just remember you can lose all $200, as well as the $98 if you lose the $98 somewhere else, and the stock shoots up over $24.",2020-04-06
35,JohnLouis24,fmk4b93,/r/pennystocks/comments/fvqgzg/imimf_your_opinion/fmk4b93/,1,"Sounds good, probably gonna be placing an order for tomorrow morning and see if i can’t get in at .38 a share... I usually stay far away from these sort of stocks but as you said, the promise is there. We shall see what happens Tuesday",2020-04-06
36,Knight_Aero,fmk5gv6,/r/pennystocks/comments/fvqgzg/imimf_your_opinion/fmk5gv6/,1,I have a limit buy for more at the same price. Might take profits if it cracks .5 tomorrow and basically swap it with the .38 buy if it dips down enough. If it still tends up come Tuesday but stays under .5 tomorrow I'll hold and see where things go.,2020-04-06
37,Imaginary_Subject,fmk5s6z,/r/pennystocks/comments/fvpgra/antibe_therapeutics_tsxvate_otcatbpf_looks_good/fmk5s6z/,1,This company has some of the best looking long-term growth compared to the other penny stocks that get brought up in this sub. Not to mention the extremely thorough DD to back it up.,2020-04-06
38,XIST-R-2-S,fmk5s7a,/r/pennystocks/comments/fvrlqe/market_should_be_bottoming_out_next_week_or_week/fmk5s7a/,1,Penny stock subreddit...,2020-04-06
39,Not_Flygon,fmk5sqy,/r/pennystocks/comments/fvrlqe/market_should_be_bottoming_out_next_week_or_week/fmk5sqy/,1,Be careful with LK,2020-04-06
40,CaptainWeee,fmk5wd3,/r/pennystocks/comments/fvrlqe/market_should_be_bottoming_out_next_week_or_week/fmk5wd3/,1,The gains on these will be bigger than most penny-stocks in the same period of time. Check out the charts most are ready for 500% moves or more within a month.,2020-04-06
41,CaptainWeee,fmk5xbo,/r/pennystocks/comments/fvrlqe/market_should_be_bottoming_out_next_week_or_week/fmk5xbo/,1,What’s going on with that one?,2020-04-06
42,XIST-R-2-S,fmk6006,/r/pennystocks/comments/fvrlqe/market_should_be_bottoming_out_next_week_or_week/fmk6006/,1,"I’m aware but on a penny stock subreddit, you’re supposed to only post about penny stocks lol.",2020-04-06
43,CaptainWeee,fmk66o0,/r/pennystocks/comments/fvrlqe/market_should_be_bottoming_out_next_week_or_week/fmk66o0/,1,Well only 7 of those are technically classified as not penny-stocks at this point so for the most part the list is legit.,2020-04-06
44,btoned,fmk68kg,/r/pennystocks/comments/fvrlqe/market_should_be_bottoming_out_next_week_or_week/fmk68kg/,1,ChiNeSe ScAM,2020-04-06
45,CaptainWeee,fmk6a6m,/r/pennystocks/comments/fvrlqe/market_should_be_bottoming_out_next_week_or_week/fmk6a6m/,1,"Ahhhh, you don’t think it could bounce Monday? Down over -80%",2020-04-06
46,FractalAsshole,fmk6aj5,/r/pennystocks/comments/fvrlqe/market_should_be_bottoming_out_next_week_or_week/fmk6aj5/,1,"""Should be bottoming out next week""

Bruh you have no idea theres no DD here",2020-04-06
47,CaptainWeee,fmk6d1u,/r/pennystocks/comments/fvrlqe/market_should_be_bottoming_out_next_week_or_week/fmk6d1u/,1,"Doesn’t matter SPY keeping the support, doesn’t want to drop below support even if it does which I still anticipate these are good for bounces up and down till bottom.",2020-04-06
48,Jetahiri,fmk6efj,/r/pennystocks/comments/fvrlqe/market_should_be_bottoming_out_next_week_or_week/fmk6efj/,1,It’s like people still don’t know the golden rule. The bloody market can never be timed.,2020-04-06
49,Not_Flygon,fmk6fvs,/r/pennystocks/comments/fvrlqe/market_should_be_bottoming_out_next_week_or_week/fmk6fvs/,1,"Research why it crashed, don’t make the same mistake I did",2020-04-06
50,BiznessBob,fmk6gjm,/r/pennystocks/comments/fvrlqe/market_should_be_bottoming_out_next_week_or_week/fmk6gjm/,1,How do I bet that you are incredibly wrong SPY will fly through support,2020-04-06
51,CaptainWeee,fmk6hwh,/r/pennystocks/comments/fvrlqe/market_should_be_bottoming_out_next_week_or_week/fmk6hwh/,1,It’s already up.,2020-04-06
52,CaptainWeee,fmk6j78,/r/pennystocks/comments/fvrlqe/market_should_be_bottoming_out_next_week_or_week/fmk6j78/,1,Gotcha thanks man,2020-04-06
53,BiznessBob,fmk6jq8,/r/pennystocks/comments/fvrlqe/market_should_be_bottoming_out_next_week_or_week/fmk6jq8/,1,Lmao I’m talking about by Monday of next week,2020-04-06
54,CaptainWeee,fmk6nbg,/r/pennystocks/comments/fvrlqe/market_should_be_bottoming_out_next_week_or_week/fmk6nbg/,1,Well we all know it’s going to crash further down. It either bottoms this or next week.,2020-04-06
55,BiznessBob,fmk6oe9,/r/pennystocks/comments/fvrlqe/market_should_be_bottoming_out_next_week_or_week/fmk6oe9/,1,"You, we have not seen the bottom yet",2020-04-06
56,Grenynvald,fmk7181,/r/pennystocks/comments/fvrlqe/market_should_be_bottoming_out_next_week_or_week/fmk7181/,1,This is useless.,2020-04-06
57,bbdragon10,fmk77un,/r/pennystocks/comments/fvr9k1/beginner/fmk77un/,1,Thank for this. I will open a high yield savings first before I do anything else.,2020-04-06
58,MidwestMN,fmk78w7,/r/pennystocks/comments/fvq0m0/how_do_you_guys_feel_about_gamestop/fmk78w7/,1,"Ive got a $3p 4/9 and although im ITM, near the end of business Friday it starting wrecking the profits. I am merely speculating, but it has been in a downward spiral for a while now so im holding out for it to drop back down. I thought about doing the 2.5 but I wasn't sure it'd go that far but it was definitely trending that way, 3 hours aside.",2020-04-06
59,CaptainWeee,fmk7adh,/r/pennystocks/comments/fvrlqe/market_should_be_bottoming_out_next_week_or_week/fmk7adh/,1,"There’s huge support bottoms and huge resistance tops on the chart $180 will be almost impossible to break through, that is the bottom I’m referring to. If it does break through that then another cycle begins.",2020-04-06
60,BiznessBob,fmk7brt,/r/pennystocks/comments/fvrlqe/market_should_be_bottoming_out_next_week_or_week/fmk7brt/,1,See you below 180...,2020-04-06
61,CaptainWeee,fmk7dp7,/r/pennystocks/comments/fvrlqe/market_should_be_bottoming_out_next_week_or_week/fmk7dp7/,1,Lol sounds good more money for me 🤷‍♂️,2020-04-06
62,chefseank,fmk8edf,/r/pennystocks/comments/fvr9k1/beginner/fmk8edf/,1,"All you need is a gram of weed and 500 bux

Buy low

Sell high",2020-04-06
63,DjangoNinja,fmk8f7e,/r/pennystocks/comments/fvrlqe/market_should_be_bottoming_out_next_week_or_week/fmk8f7e/,1,"Dude.... No every Quant firm on the planet has marked 180 as the absolute bottom.

You have no clue what spy below 180 would even mean

Literally the entire country would be hoover era poverty.",2020-04-06
64,cynicaloptimist92,fmk8r00,/r/pennystocks/comments/fvrlqe/market_should_be_bottoming_out_next_week_or_week/fmk8r00/,1,What makes you think the market is bottoming in a week or two? What could possibly be your basis for this?,2020-04-06
65,bigmikey69er,fmk8usi,/r/pennystocks/comments/fvpgra/antibe_therapeutics_tsxvate_otcatbpf_looks_good/fmk8usi/,1,"I own 40,000 shares.",2020-04-06
66,BiznessBob,fmk8w02,/r/pennystocks/comments/fvrlqe/market_should_be_bottoming_out_next_week_or_week/fmk8w02/,1,Hoover era poverty... here we come,2020-04-06
67,CaptainWeee,fmk9nos,/r/pennystocks/comments/fvrlqe/market_should_be_bottoming_out_next_week_or_week/fmk9nos/,1,"If you look at the charts we have at least one more leg down to $180 below that very unlikely but still possible. 

With each leg lower it becomes more difficult to continue. If you look at various charts you'll see the quality companies have rebounded significantly while the ones that sold off initially due to high exposure to physical experiences are still near their lows.

If you are betting on further downside you are betting against the high quality companies now.  Thats totally fine to make as a bet, its just a different story. 

Either way there will be multiple ups and downs to profit off of.",2020-04-06
68,ItsDokk,fmka6m9,/r/pennystocks/comments/fvqh90/how_to_play_the_bear_in_airlines/fmka6m9/,1,This is what I’ve been doing. Call verticals on airlines ftw!,2020-04-06
69,Vast_Cricket,fmkaj7a,/r/pennystocks/comments/fvqgzg/imimf_your_opinion/fmkaj7a/,1,Buying land is not the same as expecting great harvest. It is expanding however.,2020-04-06
70,JohnLouis24,fmkav7z,/r/pennystocks/comments/fvqgzg/imimf_your_opinion/fmkav7z/,1,"Well supposedly, the land they acquired in a region British Columbia is historically known for being rich in Gold. I believe there's reason to expect positive findings.",2020-04-06
71,Vast_Cricket,fmkb3zs,/r/pennystocks/comments/fvqxsk/daytrading_cont/fmkb3zs/,1,most likely the end of the business. Some etf can take 2 day always after closing. Week end is like Sunday pm.,2020-04-06
72,fulltonzero,fmkce0s,/r/pennystocks/comments/fvqh90/how_to_play_the_bear_in_airlines/fmkce0s/,1,You can’t do this on an app like robinhood can you?,2020-04-06
73,cliffs_used_tires,fmkcm5w,/r/pennystocks/comments/fvqxsk/daytrading_cont/fmkcm5w/,1,you need to re-evaluate your strategy.,2020-04-06
74,[deleted],fmkd0v5,/r/pennystocks/comments/fvpcoh/antibe_therapeutics_tsxvate_otcatbpf_results_soon/fmkd0v5/,1,[removed],2020-04-06
75,BuyingMoreCallsToo,fmkdm3v,/r/pennystocks/comments/fvqh90/how_to_play_the_bear_in_airlines/fmkdm3v/,1,"That's actually what I use.

You have to enable spreads in your account settings. If it doesn't let you, you may need to change your settings for experience or risk tolerance.

When you have it enabled, and you are looking at options you'll see a select option in the top right. That allows you to select multiple options. The discover options on some stocks will also show examples you can pick from. Just select if the stock should go up or down, and scroll past the put option to credit options. 

Just be sure you understand what you're selecting. Google examples, try to understand the concepts and look at videos with examples. It was overwhelming for me until it clicked. 

A credit, gives you money right away for locking up collateral. A debit charges you, but the initial charge is your max loss. I normally do credits, not debits.",2020-04-06
76,CaptainWeee,fmkf0fy,/r/pennystocks/comments/fvrlqe/market_should_be_bottoming_out_next_week_or_week/fmkf0fy/,1,Yes that’s why I don’t think it will go below $180 almost impossible for it to.,2020-04-06
77,CaptainWeee,fmkf1mx,/r/pennystocks/comments/fvrlqe/market_should_be_bottoming_out_next_week_or_week/fmkf1mx/,1,Lol,2020-04-06
78,markusvirma12,fmki4j6,/r/pennystocks/comments/fvpgra/antibe_therapeutics_tsxvate_otcatbpf_looks_good/fmki4j6/,1,"Why are the prices different? I'm new here

 ATBPF is 0.42$

 ATE  is 0.59$",2020-04-06
79,ivandrago21,fmkixd8,/r/pennystocks/comments/fvquff/tos_or_webull/fmkixd8/,1,I have a checking account with TD-Ameritrade so it makes moving money around easy but the analytics of Webull are pretty good and I think it's faster with updates.,2020-04-06
80,School_IT_Hero,fmkj57r,/r/pennystocks/comments/fvtb59/what_app_do_you_guys_recommend_for_otcpink_sheets/fmkj57r/,1,I use Thinkorswim which is offered though TD ameritrade,2020-04-06
81,ivandrago21,fmkjj95,/r/pennystocks/comments/fvr9k1/beginner/fmkjj95/,1,"I was excited for the market at your age too my man.  If you have bills then you need 3 months of savings for those bills first then you can risk extra money.  You are young and making money in the market takes time ( unless you are VERY lucky). Start with a fake trading account to get used to the way things work. Read as many book as you can. There is so much knowledge out there don't let it pass you by. Also don't look at those crazy 200% + type stocks those always unpredictable and you can lose your shirt chasing the ""what if "" situation. Last thing, stay away from r/wallstreetbets you are not ready for options trading. Period. Best of luck you my friend just take it slow.",2020-04-06
82,chickengreaseofpeace,fmkonix,/r/pennystocks/comments/fvq0m0/how_do_you_guys_feel_about_gamestop/fmkonix/,1,They're done,2020-04-06
83,gravballe,fmkp0dr,/r/pennystocks/comments/fvpgra/antibe_therapeutics_tsxvate_otcatbpf_looks_good/fmkp0dr/,1,do i buy the Antibe Therapeutics Inc from torronto exchange or the otc one? it would be easier for me to get the cannadian one but are there any drawbacks to that?,2020-04-06
84,shlomitsur,fmkqk89,/r/pennystocks/comments/fvqh90/how_to_play_the_bear_in_airlines/fmkqk89/,1,"Airlines will start holding lots of $ on their balance sheets from now on which will lower their ROE, that's why Buffett lost interest .",2020-04-06
85,INKOSI-Yaw,fmkqpcy,/r/pennystocks/comments/fvvkp7/xspa_possible_breakout_today/fmkqpcy/,1,"Up 53.26% so far 
I sold at $0.33 
Wish I’d have hung on a bit longer 
May buy in again if it drops, but that’s pretty unlikely at this point",2020-04-06
86,viietlol,fmkqt6h,/r/pennystocks/comments/fvvkp7/xspa_possible_breakout_today/fmkqt6h/,1,19.5k shares at .20 for me. Tbh buy when you can . I can easily see this going to $1-2,2020-04-06
87,INKOSI-Yaw,fmkqvxq,/r/pennystocks/comments/fvvkp7/xspa_possible_breakout_today/fmkqvxq/,1,"You reckon it’ll go to $1-$2 by today? 
Contemplating buying into $ATE with the money what do you reckon?",2020-04-06
88,co2_druid,fmkr5uj,/r/pennystocks/comments/fvvkp7/xspa_possible_breakout_today/fmkr5uj/,1,Hey fellow trader in at 0.20! Good luck to you too!,2020-04-06
89,viietlol,fmkrcs9,/r/pennystocks/comments/fvvkp7/xspa_possible_breakout_today/fmkrcs9/,1,Not today but by this week I feel like it will. A PR would push it to $1+,2020-04-06
90,viietlol,fmkretu,/r/pennystocks/comments/fvvkp7/xspa_possible_breakout_today/fmkretu/,1,.4-.5 opening I feel like,2020-04-06
91,INKOSI-Yaw,fmkryky,/r/pennystocks/comments/fvvkp7/xspa_possible_breakout_today/fmkryky/,1,"Cheers legend ! 
And congrats on your investment doubling so far! Hope it’ll go much higher for you",2020-04-06
92,viietlol,fmks02x,/r/pennystocks/comments/fvvkp7/xspa_possible_breakout_today/fmks02x/,1,😬,2020-04-06
93,masterroshejb2017,fmks15o,/r/pennystocks/comments/fvvp99/xspa_bring_it_out_boys_here_we_go/fmks15o/,1,Pases i didn’t load more i got 210 @25 cents,2020-04-06
94,Breit-tag1986,fmkt18i,/r/pennystocks/comments/fvw35r/amazing_stocks/fmkt18i/,1,Holy crap I woke up and thought ameritrade was messed up again. Whats everyones thoughts on XSPA? Do I sell at open or let it ride? I have 651 shares at approx .20,2020-04-06
95,viietlol,fmktd9h,/r/pennystocks/comments/fvw35r/amazing_stocks/fmktd9h/,1,Let it ride. 19.5k shares at .20,2020-04-06
