,author,id,url,score,text,date
0,lkwtzxt,e700hc8,/r/pennystocks/comments/9klrz7/ogen/e700hc8/,1,Ogen is prob shot in my mind tmrw unless something huge happens at conference. Buy the hype sell the news man. $Prtk is my play right now isn't a penny but  two fda filings happening Thursday hopefully it runs beforehand. Best of luck,2018-10-02
1,6717N,e700y6u,/r/pennystocks/comments/9klrz7/ogen/e700y6u/,1,"Looking at $PRTK right now, might give it a shot tomorrow and hold till Thurs to see where it goes. Also been playing around $MNGA ",2018-10-02
2,lkwtzxt,e703kq5,/r/pennystocks/comments/9klrz7/ogen/e703kq5/,1,Wow $MGNA is down from 202 5 years I will do some research on this for sure thanks,2018-10-02
3,lkwtzxt,e703nr6,/r/pennystocks/comments/9klrz7/ogen/e703nr6/,1,*$MNGA,2018-10-02
4,rynlds21,e705q1v,/r/pennystocks/comments/9klrz7/ogen/e705q1v/,1,ADVT,2018-10-02
5,rugby_shirt,e706pac,/r/pennystocks/comments/9kmjxn/commission_free_otc_brokers/e706pac/,1,RH,2018-10-02
6,Arrow3766,e707bc5,/r/pennystocks/comments/9klrz7/ogen/e707bc5/,1,Why ADVT?,2018-10-02
7,rhinosaur101,e708j8a,/r/pennystocks/comments/9kmjxn/commission_free_otc_brokers/e708j8a/,1,Looking for all,2018-10-02
8,promethapreme,e708rwq,/r/pennystocks/comments/9kmjxn/commission_free_otc_brokers/e708rwq/,1,No,2018-10-02
9,mistertyz,e70btdk,/r/pennystocks/comments/9kmzmh/rnx/e70btdk/,1,"I don't follow a lot of stocks but have been watching this one. Based on facts alone:

-They have found the world's largest and third largest gold nuggets. 
-They reported 2300g/t of gold from their initial blast. The highest grade mine is approximately 45g/t. The odds they can continue mining over two kilograms of gold per ton is unlikely. The odds that they found the only significant gold deposit in the area is equally unlikely. 
-The initial blast was reported to be from 10 meters, and they estimate the shear zones to total 8 kilometers. There are four roughly even length zones. 
-They are the first to drill into lunnon basalt. They are proving this theory and the theory which states significant gold deposits will lie along the shear zones as they go.

They also have a nickel mining operation. 

Do your own due diligence, though. Hoping for a news release this week. ",2018-10-02
10,Bran219,e70cgty,/r/pennystocks/comments/9kmzmh/rnx/e70cgty/,1,"I have a mining friend who works close to the Beta Hunt Mine. Apparently everything is super secretive and hush hush right now. From what he has told me they are the talk of the town and from my own DD talk of the mining world. Lots of upside with RNX right now, possibility of news this week this thing wont stay under $1 for many more days tomorrow may be the last day we see. All in all do your own DD, crazy potential here and one of the most exciting/anticipated stocks i've seen in my 12 years of investing. 

Cheers",2018-10-02
11,gtrg7,e70cnok,/r/pennystocks/comments/9kmzmh/rnx/e70cnok/,1,wow this is really exciting thank you for the info ,2018-10-02
12,crunchone,e70cysk,/r/pennystocks/comments/9kmzmh/rnx/e70cysk/,1,ceo.ca/rnx,2018-10-02
13,chimp1992,e70dpux,/r/pennystocks/comments/9kmzmh/rnx/e70dpux/,1,"Agreed, come here for info. Best discussion board there is for RNX.

I'm (almost) all in on RNX. Let's goooo.",2018-10-02
14,godseagle7,e70g3e6,/r/pennystocks/comments/9kmjxn/commission_free_otc_brokers/e70g3e6/,1,"If you’re military, law enforcement, or first responder. TradeStation has free commissions.",2018-10-02
15,vardhanpatel,e70girq,/r/pennystocks/comments/9kn9s9/cvsi/e70girq/,1,Just curious what platform do you use for trading?,2018-10-02
16,freshlimesoda22,e70glrv,/r/pennystocks/comments/9kmzmh/rnx/e70glrv/,1,"Will RNKLF be also impacted by this? Should I consider investing in RNKLF? 

I'm located in U.S.",2018-10-02
17,OIC_U812,e70gp6a,/r/pennystocks/comments/9kn9s9/cvsi/e70gp6a/,1,eTrade,2018-10-02
18,krsaxor,e70m0m5,/r/pennystocks/comments/9kmzmh/rnx/e70m0m5/,1,"This is the ticker for the company in the US.

&amp;#x200B;",2018-10-02
19,TopDeckPatches,e70qech,/r/pennystocks/comments/9kmjxn/commission_free_otc_brokers/e70qech/,1,How abt autistic fag,2018-10-02
20,Arrow3766,e70vgwa,/r/pennystocks/comments/9kmzmh/rnx/e70vgwa/,1,Where can I buy?,2018-10-02
21,drewdbaby,e70wreu,/r/pennystocks/comments/9kq8n0/pkg_ptnyf_parcelpal_receives_over_1_million_from/e70wreu/,1,I'm pretty sure this 100$ stock isn't a damn penny stocks... Is it?,2018-10-02
22,6717N,e70yam4,/r/pennystocks/comments/9klrz7/ogen/e70yam4/,1,Up almost a dollar pre-market from yesterday ,2018-10-02
23,capitalgrowth,e70ydcw,/r/pennystocks/comments/9kq8n0/pkg_ptnyf_parcelpal_receives_over_1_million_from/e70ydcw/,1,"$PKG Canadian symbol $PTNYF is ParcelPal 
NOT Packaging Corporation of America",2018-10-02
24,rynlds21,e70yqv1,/r/pennystocks/comments/9klrz7/ogen/e70yqv1/,1,"It’s a company with a patented packaging system for marijuana that increases shelf life as well as complies with all regulations for labels and child-proofing. Just read back through their press releases over the last 6-9 months. They are constantly expanding operations, and doubling/tripling their revenue. 

It’s a long-term play because as it’s legalized in more and more states, they’ll continue to grow into new markets and they’re preparing themselves now for that increased demand by constantly increasing capacity. ",2018-10-02
25,dcstockjvm,e70z1rc,/r/pennystocks/comments/9kmzmh/rnx/e70z1rc/,1,I use Fidelity ,2018-10-02
26,dcstockjvm,e70z2gt,/r/pennystocks/comments/9kmzmh/rnx/e70z2gt/,1,I use fidelity. ,2018-10-02
27,Pavillon,e7104an,/r/pennystocks/comments/9kmzmh/rnx/e7104an/,1,Why is Robinhood not showing this?,2018-10-02
28,dcstockjvm,e710fep,/r/pennystocks/comments/9kmzmh/rnx/e710fep/,1,It’s an OTC stock. Robinhood doesn’t support. ,2018-10-02
29,CHUBBYninja32,e710jpr,/r/pennystocks/comments/9kmjxn/commission_free_otc_brokers/e710jpr/,1,Probably not.,2018-10-02
30,6717N,e71249w,/r/pennystocks/comments/9klrz7/ogen/e71249w/,1,"Up another dollar, this is wild. Predicted to hit $5+ today ",2018-10-02
31,TheLonelyWind,e712o3c,/r/pennystocks/comments/9klrz7/ogen/e712o3c/,1,Just bought in at 3.10. If it hits 5 im out.,2018-10-02
32,6717N,e712sgd,/r/pennystocks/comments/9klrz7/ogen/e712sgd/,1,They have announcements coming out at 1pm- hopefully this will also drive up the price. Good luck! ,2018-10-02
33,6717N,e712vo2,/r/pennystocks/comments/9klrz7/ogen/e712vo2/,1,"Announcements coming out at 1pm at a conference, hopefully this will also drive up the price. Good luck! ",2018-10-02
34,NikoSleeps,e715juw,/r/pennystocks/comments/9kmzmh/rnx/e715juw/,1,Bought in heavy and filled right away. Lots of volume on a stock under $1. I leik dis,2018-10-02
35,BeligerentBlacksmith,e716mba,/r/pennystocks/comments/9krj3p/hiph_announces_major_distribution_deal_with_sing/e716mba/,1,Loving it. Was starting to lose faith but looking good for now.,2018-10-02
36,CaptainWeee,e716nkr,/r/pennystocks/comments/9krj3p/hiph_announces_major_distribution_deal_with_sing/e716nkr/,1,No faith to be lost with this bad boy 😎👌🔥🔥🔥,2018-10-02
37,jimmy2940,e716oxl,/r/pennystocks/comments/9kragz/week_39_stock_picking_contest_results_the_winner/e716oxl/,1,"I sold at 3.60....
",2018-10-02
38,MrVolatility,e7172xi,/r/pennystocks/comments/9kqsn2/whats_going_on_with_bvtk/e7172xi/,1,"Dead cat bounce. Bvtk is one of biggest scams in the pennystock world. 

Along with IHSI and Darkpulse.",2018-10-02
39,LongJohnCopper,e717583,/r/pennystocks/comments/9kn9s9/cvsi/e717583/,1,"I just made a few thousand from $3.76 to $5.01 and got out yesterday when the Farm Bill expired. Hoping for a lull during Oct before negotiations pick back up after the November mid-term elections. I'll probably slowly start accumulating again here shortly if it gets to the low to mid $4 range and keep averaging down if I can. 

&amp;#x200B;

This should be a good pop on Farm Bill passage if they manage to keep the Hemp provisions.",2018-10-02
40,jaspytri,e7175k6,/r/pennystocks/comments/9kmzmh/rnx/e7175k6/,1,Where  can I buy? Its not on robinhood ,2018-10-02
41,screw_the__pooch,e7176tg,/r/pennystocks/comments/9krj3p/hiph_announces_major_distribution_deal_with_sing/e7176tg/,1,"Too late to buy in? Been trying to get my account set up for the past week now, started looking into buying at .035 😓",2018-10-02
42,CaptainWeee,e717nqx,/r/pennystocks/comments/9krj3p/hiph_announces_major_distribution_deal_with_sing/e717nqx/,1,"Lol still early imo, just buy the dips whenever you can 😉",2018-10-02
43,AdviceManimal,e717vb2,/r/pennystocks/comments/9kragz/week_39_stock_picking_contest_results_the_winner/e717vb2/,1,"Yeah, I sold around $3.00 as well. Bought a couple hundred at $0.40 last year so I'm kicking myself for not being a little more patient. I've had enough experience with penny stocks to sell when times get a little good. At least we took a profit??",2018-10-02
44,jimmy2940,e717yno,/r/pennystocks/comments/9kragz/week_39_stock_picking_contest_results_the_winner/e717yno/,1,"Yeah haha, profitting less than you could have is still better than not proffiting at all ",2018-10-02
45,newsmana,e718rvx,/r/pennystocks/comments/9kn9s9/cvsi/e718rvx/,1,They are garbage.,2018-10-02
46,doodski420,e7195wj,/r/pennystocks/comments/9krj3p/hiph_announces_major_distribution_deal_with_sing/e7195wj/,1,Also started dippin into over sold so now is probably a great time to save acouple pennies,2018-10-02
47,mchgrms,e719jps,/r/pennystocks/comments/9krj3p/hiph_announces_major_distribution_deal_with_sing/e719jps/,1,That big spike first thing this morning was fun to watch :D,2018-10-02
48,CaptainWeee,e71avsk,/r/pennystocks/comments/9krj3p/hiph_announces_major_distribution_deal_with_sing/e71avsk/,1,Lol for sure 😂😅,2018-10-02
49,CaptainWeee,e71ax5g,/r/pennystocks/comments/9krj3p/hiph_announces_major_distribution_deal_with_sing/e71ax5g/,1,Yes indeed. Wanted them to fill the gap up from this morning but too much support down here at .09 😏,2018-10-02
50,louiehass,e71b0fx,/r/pennystocks/comments/9krj3p/hiph_announces_major_distribution_deal_with_sing/e71b0fx/,1,Is this done climbing? .09 the end? ,2018-10-02
51,CaptainWeee,e71b1xi,/r/pennystocks/comments/9krj3p/hiph_announces_major_distribution_deal_with_sing/e71b1xi/,1,Lmao nah not by a long shot. After lunch will have some nice fireworks imo 🤑,2018-10-02
52,louiehass,e71b9bo,/r/pennystocks/comments/9krj3p/hiph_announces_major_distribution_deal_with_sing/e71b9bo/,1,Can’t wait !,2018-10-02
53,LekkerSpaceJuice,e71cjwq,/r/pennystocks/comments/9kragz/week_39_stock_picking_contest_results_the_winner/e71cjwq/,1,You think IGC will stay at it's current price or drop back down to what it was a few weeks ago? ,2018-10-02
54,freshlimesoda22,e71cmtz,/r/pennystocks/comments/9kmzmh/rnx/e71cmtz/,1,Thanks!,2018-10-02
55,KG2303,e71cul8,/r/pennystocks/comments/9klrz7/ogen/e71cul8/,1,Why MNGA? I’m looking for insight as to what makes it appealing.,2018-10-02
56,CaptainWeee,e71dt1x,/r/pennystocks/comments/9krj3p/hiph_announces_major_distribution_deal_with_sing/e71dt1x/,1,Up Signal just formed on the 15 Min here we go boys!!!,2018-10-02
57,temsik1587,e71e6bl,/r/pennystocks/comments/9kragz/week_39_stock_picking_contest_results_the_winner/e71e6bl/,1,"It’ll drop below $13 for sure, look at TLRY for example. Went from $30 to $200 and within the next day down to $99",2018-10-02
58,CaptainWeee,e71e8b2,/r/pennystocks/comments/9krj3p/hiph_announces_major_distribution_deal_with_sing/e71e8b2/,1,Breaking through .11 again game time boys 😍😍😍,2018-10-02
59,ShinuKara,e71f0em,/r/pennystocks/comments/9kragz/week_39_stock_picking_contest_results_the_winner/e71f0em/,1,Yeah that’s a good attitude. Better to learn from partial wins than from failures. ,2018-10-02
60,doodski420,e71f19u,/r/pennystocks/comments/9krj3p/hiph_announces_major_distribution_deal_with_sing/e71f19u/,1,Agreed on 15 min chart is just beautiful day,2018-10-02
61,[deleted],e71f215,/r/pennystocks/comments/9kshtq/sing_hiph_american_premium_water_corp_announces/e71f215/,1,[removed],2018-10-02
62,CaptainWeee,e71fb07,/r/pennystocks/comments/9krj3p/hiph_announces_major_distribution_deal_with_sing/e71fb07/,1,Up Signal again Send It 🤑🤑🤑,2018-10-02
63,CaptainWeee,e71fm6x,/r/pennystocks/comments/9krj3p/hiph_announces_major_distribution_deal_with_sing/e71fm6x/,1,"CDEL still wants more shares I see, on the bid and ask, should see him or her take off that block soon $HIPH",2018-10-02
64,jeremyRockit,e71g3o4,/r/pennystocks/comments/9kragz/week_39_stock_picking_contest_results_the_winner/e71g3o4/,1,Then back up to $170,2018-10-02
65,queenslandbananas,e71h3u4,/r/pennystocks/comments/9kqsn2/whats_going_on_with_bvtk/e71h3u4/,1,"&gt; Is there another pump coming?

That was the pump.",2018-10-02
66,louiehass,e71h8ms,/r/pennystocks/comments/9krj3p/hiph_announces_major_distribution_deal_with_sing/e71h8ms/,1,How do I find the signals? Still kind of new to trading? ,2018-10-02
67,ducky_zero,e71hz67,/r/pennystocks/comments/9krj3p/hiph_announces_major_distribution_deal_with_sing/e71hz67/,1,Got 1000 at .04 thinking about adding some more,2018-10-02
68,eliterate,e71kdnf,/r/pennystocks/comments/9ksrrb/screw_ogen/e71kdnf/,1,Freefall...,2018-10-02
69,ozigiri,e71koo9,/r/pennystocks/comments/9ksrrb/screw_ogen/e71koo9/,1,I bought at 2.97 in the morning and now  it is at 2.19...,2018-10-02
70,eliterate,e71li6t,/r/pennystocks/comments/9ksrrb/screw_ogen/e71li6t/,1,We can hold hands and pray for the typical after hours activity.,2018-10-02
71,nick3797,e71lxo7,/r/pennystocks/comments/9kt14a/october_02_2018_tomorrows_daily_rpennystocks/e71lxo7/,1,"NSPR for sure, holding about 4,000 shares right now and waiting for a nice pop up to .5",2018-10-02
72,CaptainWeee,e71m2lq,/r/pennystocks/comments/9krj3p/hiph_announces_major_distribution_deal_with_sing/e71m2lq/,1,"BOOM!!! Gap closed FINALLY, back up baby!!! Just in time for power hour 🤑🤑🤑 $HIPH",2018-10-02
73,CaptainWeee,e71m351,/r/pennystocks/comments/9krj3p/hiph_announces_major_distribution_deal_with_sing/e71m351/,1,Nice catch!!!,2018-10-02
74,temsik1587,e71m56t,/r/pennystocks/comments/9kragz/week_39_stock_picking_contest_results_the_winner/e71m56t/,1,Yes but from a high of $280,2018-10-02
75,pyette91,e71m8qv,/r/pennystocks/comments/9kt14a/october_02_2018_tomorrows_daily_rpennystocks/e71m8qv/,1,Hive crypto’s are about to skyrocket,2018-10-02
76,louiehass,e71n2d9,/r/pennystocks/comments/9krj3p/hiph_announces_major_distribution_deal_with_sing/e71n2d9/,1,What is even happening right now. This thing is all over the place ,2018-10-02
77,DeepWebSurfer,e71obgu,/r/pennystocks/comments/9kt14a/october_02_2018_tomorrows_daily_rpennystocks/e71obgu/,1,Aerohive?,2018-10-02
78,pyette91,e71ocws,/r/pennystocks/comments/9kt14a/october_02_2018_tomorrows_daily_rpennystocks/e71ocws/,1,Hive technology on the tsx,2018-10-02
79,CaptainWeee,e71oeed,/r/pennystocks/comments/9krj3p/hiph_announces_major_distribution_deal_with_sing/e71oeed/,1,"Big fat gap from this morning filled panic sellers sold into the fill because they thought it would close red and wanted to lock in profits, however now that the gap is closed should move up nicely from here 👏🙌🔥",2018-10-02
80,davezilla79,e71ofy6,/r/pennystocks/comments/9kt14a/october_02_2018_tomorrows_daily_rpennystocks/e71ofy6/,1,RNX is going to be massive. ,2018-10-02
81,DeepWebSurfer,e71ogi6,/r/pennystocks/comments/9kt14a/october_02_2018_tomorrows_daily_rpennystocks/e71ogi6/,1,thanks 👍,2018-10-02
82,DangerDDanger,e71onix,/r/pennystocks/comments/9krafx/whn/e71onix/,1,Should I just yolo 4K into it? ,2018-10-02
83,BeligerentBlacksmith,e71ov26,/r/pennystocks/comments/9kt14a/october_02_2018_tomorrows_daily_rpennystocks/e71ov26/,1,"I’m up 70% on ACOL today, sold half my shares and keeping the rest to see what happens tomorrow. It’s starting to drop back down now but I’m curious about what it will look like in the morning. 

Aside from that I’m keeping an eye on LODE and CRMD but I’m not expecting too much from them tomorrow. 

I don’t really have many plays in mind right now, just taking it easy. ",2018-10-02
84,DangerDDanger,e71p4nd,/r/pennystocks/comments/9kt14a/october_02_2018_tomorrows_daily_rpennystocks/e71p4nd/,1,Promise? ,2018-10-02
85,CaptainWeee,e71povk,/r/pennystocks/comments/9krj3p/hiph_announces_major_distribution_deal_with_sing/e71povk/,1,"$HIPH Gap filled, Flip groups out and Panic Sellers also out. All we need is an .08 close to catch momentum into tomorrow to send it up again either way, long term here so not worried 😉👌🔥",2018-10-02
86,xlogit3k,e71pw60,/r/pennystocks/comments/9ks7oa/intk_current_as_of_today_stop_sign_coming_down/e71pw60/,1,NICE! $INTK is doing big things and will be over .01 soon IMO!,2018-10-02
87,WenMun,e71qeqe,/r/pennystocks/comments/9kt2rz/new_to_penny_stocks/e71qeqe/,1,Pump and dump market I would rather do options much better.  Head over to r/Wallstreetbet pretty fun on that side. ,2018-10-02
88,NikoSleeps,e71qjtm,/r/pennystocks/comments/9ktyea/500/e71qjtm/,1,$TRUL (Trulieve Cannabis) or $OGEN. OGEN might have peaked but do your DD. $TRUL IPOd on Wednesday and its close to tripling since its IPO. Analysts are saying $33.50 is where it should end up but you never know,2018-10-02
89,NikoSleeps,e71qkzh,/r/pennystocks/comments/9ksrrb/screw_ogen/e71qkzh/,1,Looks like your prayer worked....Holy shit did it ever work,2018-10-02
90,ManWithManyTalents,e71qo3k,/r/pennystocks/comments/9kragz/week_39_stock_picking_contest_results_the_winner/e71qo3k/,1,I don’t want to talk about it...,2018-10-02
91,keatoncollins100,e71qqtt,/r/pennystocks/comments/9ktyea/500/e71qqtt/,1,I can’t find $TRUL on robinhood,2018-10-02
92,jimmy2940,e71r7xd,/r/pennystocks/comments/9kragz/week_39_stock_picking_contest_results_the_winner/e71r7xd/,1,"I know man, it hurts my soul",2018-10-02
93,ManWithManyTalents,e71ra54,/r/pennystocks/comments/9kragz/week_39_stock_picking_contest_results_the_winner/e71ra54/,1,"I’m pretty new to investing and made a stupid mistake

I bought IGC at .69 and sold at 1.95...",2018-10-02
94,eliterate,e71rbb5,/r/pennystocks/comments/9ksrrb/screw_ogen/e71rbb5/,1,It's gonna work again tomorrow. I'm holding until double digits!,2018-10-02
95,CaptainWeee,e71rnis,/r/pennystocks/comments/9krj3p/hiph_announces_major_distribution_deal_with_sing/e71rnis/,1,"$11,000,000 in trading volume and a green close can’t ask for more!!! Had that stupid gap closed earlier in the day like the first hour we would have closed HOD. Not worried should be nice and green tomorrow based on today’s candle. $HIPH",2018-10-02
96,xXFoxyGrandpaXx,e71rvny,/r/pennystocks/comments/9ktyea/500/e71rvny/,1,Do u have a source for what analysts said??,2018-10-02
97,BeligerentBlacksmith,e71s2w7,/r/pennystocks/comments/9kragz/week_39_stock_picking_contest_results_the_winner/e71s2w7/,1,Yeah well this stock is very upsetting for some of us so let’s not talk about it ever again. ,2018-10-02
98,dillonrpayt,e71s7si,/r/pennystocks/comments/9ktyea/500/e71s7si/,1,That’s because it’s Canadian. Canadian stocks aren’t on Robinhood unless it was added as part of the worldwide update,2018-10-02
99,[deleted],e71sirh,/r/pennystocks/comments/9ktyea/500/e71sirh/,1,[removed],2018-10-02
100,IntrepidBlock,e71sk56,/r/pennystocks/comments/9kqsn2/whats_going_on_with_bvtk/e71sk56/,1,"Well aware that it’s a scam, but there is opportunity to make $ on a scam if you’re willing to play with fire. Just got to know when to get out. You’re right though, probably just a dead cat bounce.",2018-10-02
101,IntrepidBlock,e71smqh,/r/pennystocks/comments/9kqsn2/whats_going_on_with_bvtk/e71smqh/,1,A pump generally includes PR’s with a lot of general forward looking statements. I had not seen any; hence why I asked.,2018-10-02
102,chickenmeal,e71src7,/r/pennystocks/comments/9ktyea/500/e71src7/,1,DTEA,2018-10-02
103,JodnHoe,e71t3dk,/r/pennystocks/comments/9ksrrb/screw_ogen/e71t3dk/,1,Any data to back this up? I want to hold as well but need someone to give me some confidence in this,2018-10-02
104,keatoncollins100,e71t71r,/r/pennystocks/comments/9ktyea/500/e71t71r/,1,why is it rising so quickly ,2018-10-02
105,rootchakra111,e71uvdm,/r/pennystocks/comments/9kt14a/october_02_2018_tomorrows_daily_rpennystocks/e71uvdm/,1,Rhe ,2018-10-02
106,victorystroke,e71v5dh,/r/pennystocks/comments/9kragz/week_39_stock_picking_contest_results_the_winner/e71v5dh/,1,Friend is up ~800% with 1 share after buying it at the end of last year or something,2018-10-02
107,jgoldston_0,e71w0lq,/r/pennystocks/comments/9kujlq/bemg_share_reduction_complete_updated_ss_74/e71w0lq/,1,😂,2018-10-02
108,Juanjuandavid,e71w1vg,/r/pennystocks/comments/9ktyea/500/e71w1vg/,1,Vtvt,2018-10-02
109,jgoldston_0,e71w5uk,/r/pennystocks/comments/9kt2rz/new_to_penny_stocks/e71w5uk/,1,"I think you mean r/WallStreetBets 

And FWIW, 90% of content on both of the subs is pretty much garbage.",2018-10-02
110,walk15,e71wacg,/r/pennystocks/comments/9ktyea/500/e71wacg/,1,Following,2018-10-02
111,WenMun,e71wahl,/r/pennystocks/comments/9kt2rz/new_to_penny_stocks/e71wahl/,1,Depending which info and data you can filtered it out.  I used it for sell signal sort of when Jim Kramer suggesting a stock to invest in.  ,2018-10-02
112,keatoncollins100,e71waqj,/r/pennystocks/comments/9ktyea/500/e71waqj/,1,will it continue to grow?,2018-10-02
113,eliterate,e71wqa3,/r/pennystocks/comments/9ksrrb/screw_ogen/e71wqa3/,1,"Not offhand, but check out the posts in r/robinhoodpennystocks",2018-10-02
114,gfbrd,e71xinv,/r/pennystocks/comments/9ktyea/500/e71xinv/,1,RSi is quite high for that stock. Looks like it could pop soon.,2018-10-02
115,acegreen1989,e71y20e,/r/pennystocks/comments/9ktyea/500/e71y20e/,1,$DIS calls or $AMD puts,2018-10-02
116,getoffmylawn13,e71ysbh,/r/pennystocks/comments/9kt14a/october_02_2018_tomorrows_daily_rpennystocks/e71ysbh/,1,I believe HVBTF is the US otc ticker if the same company.,2018-10-02
117,Kenethica,e71z1bs,/r/pennystocks/comments/9kmzmh/rnx/e71z1bs/,1,It's not or it's tsx. Robinhood does not support tsx,2018-10-02
118,Daa813,e71zg7a,/r/pennystocks/comments/9kt14a/october_02_2018_tomorrows_daily_rpennystocks/e71zg7a/,1,What are you using? Don’t see it on fidelity or robinhood ,2018-10-02
119,Kevenm7,e71zjbf,/r/pennystocks/comments/9kusy9/lode/e71zjbf/,1,already $Lodeded,2018-10-02
120,MrVolatility,e71zrge,/r/pennystocks/comments/9kqsn2/whats_going_on_with_bvtk/e71zrge/,1,I've been watching bvtk for 2 months and bought the bottem @ 0005 and sold at 0007.  It's already had its pump last year. Look for reverse split soon ,2018-10-02
121,DangerDDanger,e71zruu,/r/pennystocks/comments/9kusy9/lode/e71zruu/,1,What makes this attractive other then it’s just a penny stock? Seems like they have been sliding for a while now. ,2018-10-02
122,marcjessie,e720kf6,/r/pennystocks/comments/9ktyea/500/e720kf6/,1,"ldsr
",2018-10-02
123,bsos32,e720qhv,/r/pennystocks/comments/9kt14a/october_02_2018_tomorrows_daily_rpennystocks/e720qhv/,1,I'll take a bite.. Because why?,2018-10-02
124,ekorrenn,e720uee,/r/pennystocks/comments/9kt14a/october_02_2018_tomorrows_daily_rpennystocks/e720uee/,1,Why?,2018-10-02
125,sh4dy15,e72140d,/r/pennystocks/comments/9ks7oa/intk_current_as_of_today_stop_sign_coming_down/e72140d/,1,"Hell yeah! Easily over .01....might even reach .02-.03 with stop sign coming off.

Company is profitable with 3rd Q filings, audited annuals, and uplist to senior exchange coming. 

No brainer. Tried to post this here months ago. Surprisingly people still have a chance to get in. ",2018-10-02
126,sh4dy15,e7214tl,/r/pennystocks/comments/9ks7oa/intk_current_as_of_today_stop_sign_coming_down/e7214tl/,1,Ready for the ride!!!!,2018-10-02
127,xlogit3k,e7217kh,/r/pennystocks/comments/9ks7oa/intk_current_as_of_today_stop_sign_coming_down/e7217kh/,1,Yeah surprising there is not a lot of eyes on this yet. Don’t see that many profitable companies in the OTC like this that have so many catalysts in the works. $INTK is doing big things ,2018-10-02
128,davinator401,e721n05,/r/pennystocks/comments/9kragz/week_39_stock_picking_contest_results_the_winner/e721n05/,1,I have 12 stocks I bought at $3-5. Gonna hold for a bit more but might just sell because igc does not seem to be that legit,2018-10-02
129,73inve,e721rxp,/r/pennystocks/comments/9kt14a/october_02_2018_tomorrows_daily_rpennystocks/e721rxp/,1,"Just bought 600 of $AGRX at .34, already made back the 6.75 trade fee. Looking to make a small profit, probably sell if it goes above .45 or so. Any thoughts?",2018-10-02
130,73inve,e7226y4,/r/pennystocks/comments/9kmzmh/rnx/e7226y4/,1,should I buy the US ticker? $RNKLF?,2018-10-02
131,BootySex,e722q4x,/r/pennystocks/comments/9ktyea/500/e722q4x/,1,"MNGA are you kidding me lol, I've made so much money off of it today",2018-10-02
132,ZackJenks,e723eaf,/r/pennystocks/comments/9kusy9/lode/e723eaf/,1,1k+ already secured,2018-10-02
133,Dyslexic342,e72461j,/r/pennystocks/comments/9kusy9/lode/e72461j/,1,"Late yesterday, the company announced that it has received an award. Of course, the news excited investors, sending the stock on a run for the top.",2018-10-02
134,Dyslexic342,e724bnt,/r/pennystocks/comments/9ksrrb/screw_ogen/e724bnt/,1,Now we are at 3.57,2018-10-02
