,author,id,url,score,text,date
126,arch1inc,emuepfb,/r/pennystocks/comments/blrqxw/anyone_have_a_ultra_low_float_watchlist_like_5/emuepfb/,1,"They have revenue, they just went public in 2018 dec. so all records previous were private. 

Customers all around the world —&gt; based in New York, large customer base there due to discounts they offer and promotions in the area. They offer discounts in Europe (partnered) with unionpay which is big in EU so it is quite popular card to have. ECARD is accepted in 174 countries around the world, they have a huge marketing base with their CEO and top investor group. 

With the price past couple days, more short volume than usual, as people keep taking away those shares though the price will stabalize. Personally expect 30-40$ PPS by end of summer, been holding since 40 cents.",2019-05-07
127,freshbalk2,emurf4k,/r/pennystocks/comments/bluq5k/bemg_company_just_confirmed_big_news_coming_this/emurf4k/,1,I like the way this man thinks. I assume she’s leaving him if it flops?,2019-05-07
128,DerkBerk-,emv70vx,/r/pennystocks/comments/blqddu/two_us_companies_stand_to_benefit_significantly/emv70vx/,1,how do you trade BEMG stock?,2019-05-07
129,PM_Me_Shitty_Jokes,emwkv9w,/r/pennystocks/comments/bluq5k/bemg_company_just_confirmed_big_news_coming_this/emwkv9w/,1,Both are accurate. But which way it goes determines who ends up with the kids.,2019-05-07
130,fecal_destruction,emybxo1,/r/pennystocks/comments/blqddu/two_us_companies_stand_to_benefit_significantly/emybxo1/,1,How the fuck do you short penny stocks,2019-05-07
131,Explosiveshitter44,en372qx,/r/pennystocks/comments/blk70z/watchlist_for_tomorrow/en372qx/,1,"Check it out now, you think it's another bs tweet?",2019-05-07
132,CaptainWeee,en3ez0t,/r/pennystocks/comments/blk70z/watchlist_for_tomorrow/en3ez0t/,1,"Yeah saw the tweet today, no idea tbh just play the pops and profit off them.",2019-05-07
133,Mister2JZ-GTE,enbyszj,/r/pennystocks/comments/bluq5k/bemg_company_just_confirmed_big_news_coming_this/enbyszj/,1,Lol.  What happen to this stock?  Was it not supposed to moon after Uber IPO?,2019-05-07
134,njl0341,encb7lf,/r/pennystocks/comments/bluq5k/bemg_company_just_confirmed_big_news_coming_this/encb7lf/,1,"You should ask OP. Nowhere did i make that statement. In fact, i sold at .06.",2019-05-07
135,rouchiis,end1gtv,/r/pennystocks/comments/blqddu/two_us_companies_stand_to_benefit_significantly/end1gtv/,1,Yea fr I always wondered how people research to find stocks like that,2019-05-07
136,welldamn669,ene9xqz,/r/pennystocks/comments/blqddu/two_us_companies_stand_to_benefit_significantly/ene9xqz/,1,LOL,2019-05-07
137,Vallarta21,enz3zi7,/r/pennystocks/comments/bllz07/sunw_big_money_today/enz3zi7/,1,...aaaand pump is over. back to .79,2019-05-07
