,author,id,url,score,text,date
0,ArabyFromDublin,ds2bp5r,/r/pennystocks/comments/7niwdu/insy_short_squeeze_opportunity/ds2bp5r/,1,"Nice pick, I'd probably agree about the squeeze opportunity. Haven't looked much into this company but if any products or revenue are upcoming as good news, it might even be a company to go long for. ",2018-01-02
1,wake886,ds2i7pf,/r/pennystocks/comments/7niwdu/insy_short_squeeze_opportunity/ds2i7pf/,1,Can you PM me your script? Curious :),2018-01-02
2,RElliott10,ds2jit8,/r/pennystocks/comments/7niwdu/insy_short_squeeze_opportunity/ds2jit8/,1,Yeah. My laptop is downstairs rn though so it’ll be the first thing I do tomorrow morning ,2018-01-02
3,[deleted],ds2kxt8,/r/pennystocks/comments/7niwdu/insy_short_squeeze_opportunity/ds2kxt8/,1,[removed],2018-01-02
4,1HappyPanda,ds2v6pq,/r/pennystocks/comments/7niwdu/insy_short_squeeze_opportunity/ds2v6pq/,1,Could I also take a look at this script?,2018-01-02
5,dylan9596,ds2wibu,/r/pennystocks/comments/7nmseo/sanp_has_some_low_volume_price_action_this_morning/ds2wibu/,1,People just trying to get in low before the news about their crypto mining rigs come out. Expected this week or next week. ,2018-01-02
6,Nigel_Hans,ds2wpi4,/r/pennystocks/comments/7nmseo/sanp_has_some_low_volume_price_action_this_morning/ds2wpi4/,1,"Gotcha, yea I took a small position last week out of curiosity, figure if I lose it, its no big deal. But if it hits even even 1 penny, I'll be more than thrilled.",2018-01-02
7,SquizzOC,ds2wpij,/r/pennystocks/comments/7nmseo/sanp_has_some_low_volume_price_action_this_morning/ds2wpij/,1,Definitely getting in cheap for the news. Get in now while you can! Let’s go $1 a share! Woooooooo!,2018-01-02
8,Gabenism,ds2wqsd,/r/pennystocks/comments/7nmseo/sanp_has_some_low_volume_price_action_this_morning/ds2wqsd/,1,They announced on their twitter @santo_io that they're officially into Crypto. I got in at 0.0013. I'm pretty happy this morning.,2018-01-02
9,dylan9596,ds2wr2f,/r/pennystocks/comments/7nmseo/sanp_has_some_low_volume_price_action_this_morning/ds2wr2f/,1,1 penny good luck ;),2018-01-02
10,dylan9596,ds2wsge,/r/pennystocks/comments/7nmseo/sanp_has_some_low_volume_price_action_this_morning/ds2wsge/,1,One penny good luck I think I’m going to try to get in at .0016 today hoping for .0050 ,2018-01-02
11,Nigel_Hans,ds2wxxn,/r/pennystocks/comments/7nmseo/sanp_has_some_low_volume_price_action_this_morning/ds2wxxn/,1,"I don't see this hitting a dollar anytime soon, I think potentially 10 cents is possible by the end of the year, depending very much on how well crypto holds up the recent boom consolidation.",2018-01-02
12,Nigel_Hans,ds2x1bg,/r/pennystocks/comments/7nmseo/sanp_has_some_low_volume_price_action_this_morning/ds2x1bg/,1,"Yea, def not holding my breath, but I said that when I had 6k shares of ORIG back in Aug at 10 cent per, sold it at .08, then a month later it jumped to $25, so ill at least hold oyt for this and see what happens",2018-01-02
13,Gabenism,ds2x1fw,/r/pennystocks/comments/7nmseo/sanp_has_some_low_volume_price_action_this_morning/ds2x1fw/,1,"I think it's a real test of one's liver to hold onto a penny this cheap for that long, too. I expect to get out by February.",2018-01-02
14,Nigel_Hans,ds2x2o8,/r/pennystocks/comments/7nmseo/sanp_has_some_low_volume_price_action_this_morning/ds2x2o8/,1,"Yea there does seem to be alot of holding, which boads well.",2018-01-02
15,Gabenism,ds2x6pc,/r/pennystocks/comments/7nmseo/sanp_has_some_low_volume_price_action_this_morning/ds2x6pc/,1,"Jesus, I remember buying ORIG at .08 and I sold cause it dropped a little. I was only just into investing, with little capital too, so I had trigger finger.",2018-01-02
16,Nigel_Hans,ds2xag6,/r/pennystocks/comments/7nmseo/sanp_has_some_low_volume_price_action_this_morning/ds2xag6/,1,"Yea, I kicked myself in the ass.for that one lol",2018-01-02
17,pwnddit,ds2xpqs,/r/pennystocks/comments/7niwdu/insy_short_squeeze_opportunity/ds2xpqs/,1,"I'm impressed by the knowledge to create your own python script to screen stocks! If you don't mind, can you send me the script that you're using? I've been tinkering around a bit on my own with scripting, but to no avail.",2018-01-02
18,Iwasthechosenone,ds2xzxl,/r/pennystocks/comments/7njxkb/a_case_for_myhi/ds2xzxl/,1,Good call!,2018-01-02
19,Del_Phoenix,ds2y0s3,/r/pennystocks/comments/7nmseo/sanp_has_some_low_volume_price_action_this_morning/ds2y0s3/,1,What brokerage can you use to get into OTC stocks like this?,2018-01-02
20,SquizzOC,ds2y1ju,/r/pennystocks/comments/7nmseo/sanp_has_some_low_volume_price_action_this_morning/ds2y1ju/,1,Ameritrade ,2018-01-02
21,prayformojo1,ds2yd0p,/r/pennystocks/comments/7nmseo/sanp_has_some_low_volume_price_action_this_morning/ds2yd0p/,1,"Website is up and running...

https://santo.io/",2018-01-02
22,Gabenism,ds2yem7,/r/pennystocks/comments/7nmseo/sanp_has_some_low_volume_price_action_this_morning/ds2yem7/,1,"Their [website](https://santo.io) is promising, by the way. Very promising.",2018-01-02
23,gotmynamefromcaptcha,ds2ytwb,/r/pennystocks/comments/7nmseo/sanp_has_some_low_volume_price_action_this_morning/ds2ytwb/,1,"They got their website up and running so things are looking good for what they said they want to achieve in Q1 2018. 

News is somewhere in this sub from a week or two ago. Not holding my breath though, I held BVTK for months and months and then it fell down to half of what I bought it at despite their constant Twitter activity boasting contracts and what not. ",2018-01-02
24,cmarkcity,ds3073e,/r/pennystocks/comments/7njxkb/a_case_for_myhi/ds3073e/,1,"I've noticed similar trends with other marijuana stocks. Having missed the prime time to buy in October, do you think it'd be best to wait for another cycle where the price drops again, or buy now to get some profits before it peaks?",2018-01-02
25,Gabenism,ds30sx8,/r/pennystocks/comments/7nmseo/sanp_has_some_low_volume_price_action_this_morning/ds30sx8/,1,"I use E*Trade, myself.",2018-01-02
26,Gabenism,ds360za,/r/pennystocks/comments/7nn3yl/sanp_news_should_be_coming_late_this_week/ds360za/,1,"I got in at 0.0013, and I'm expecting to see a penny by February, honestly. Consistent growth, too; not just volatility. This is one of the most secure pennies I can imagine getting into.",2018-01-02
27,WeekendTacticalSuppl,ds392js,/r/pennystocks/comments/7njxkb/a_case_for_myhi/ds392js/,1,"Congrats to those in this last week when it was in the $.07-.09 range. 
Got in for a small stake this morning at $.17 and already sitting at a 28+% gain.  hoping it continues up a little more.",2018-01-02
28,englishinseconds,ds3aeek,/r/pennystocks/comments/7nn3yl/sanp_news_should_be_coming_late_this_week/ds3aeek/,1,"Ok.... so they're buying 100 of the AntMan S9 machines, and should get them up and running this quarter.

At the current price of bitcoins, and complexity to mine, they can make at most, $200,000/year from all these devices if they get free electricity. 

It's a company with 5.5 billion outstanding shares.

By my calculations this stock should be trading around .000036

You know, if they're getting free electricity.",2018-01-02
29,zimzambIe,ds3az6j,/r/pennystocks/comments/7nn3yl/sanp_news_should_be_coming_late_this_week/ds3az6j/,1,"Full operation size should be 2,000 miners. Their revenue is going to be a lot higher than what you’re doing your math with",2018-01-02
30,Xray_Mind,ds3az8w,/r/pennystocks/comments/7nn3yl/sanp_news_should_be_coming_late_this_week/ds3az8w/,1,"They are in a joint venture with Canoe Pool whom is planning on housing up to 50,000 Miners. They have exclusive licensing of Canoe Pools software in America. Canoe Pool has nearly 2% of all hash power in the world. That is where their income stream will happen. 

Their facility will eventually have 2-3000 S9s in it. Even at modest estimate of $500/month income per unit they are looking st more like a projected trade price of  .0021

Considering the average US stock has a P/E ratio of 21.8, it is not out of the question that they can reach a target price of 0.2-0.4 cents. 

",2018-01-02
31,Gabenism,ds3bfdq,/r/pennystocks/comments/7no46r/january_02_2018_tomorrows_daily_rpennystocks/ds3bfdq/,1,"291,666 $SANP @ 0.0013; expecting to see 0.0090/share by Feb",2018-01-02
32,Talonx4,ds3bt93,/r/pennystocks/comments/7njxkb/a_case_for_myhi/ds3bt93/,1,It should still gain.  No reason for it to stop yet.  That was a large amount of volume earlier.  ,2018-01-02
33,englishinseconds,ds3cavj,/r/pennystocks/comments/7nn3yl/sanp_news_should_be_coming_late_this_week/ds3cavj/,1,"And how much % will they get from those 50,000 miners?  Why would Canoe Pool give up anything for a small company who doesn't even have 100 miners up and running yet?

SANP is spending what, $200k for those units?  [That's such small potatoes in the bitcoin mining world that it's laughable.](https://www.buybitcoinworldwide.com/mining/hardware/antminer-s9/)


China has already forced out so many small town miners this company has no chance to stay above water.  They've invested hundreds of millions of dollars into their mining infrastructure, how is this company going to compete?

If $200k could make you competitive in the bitcoin mining world everyone would be doing it, and if everyone is doing it, the complexity gets so high the  units are rendered useless.

Invest in this company, flip it before it crashes for sure.  But lets not hyping this like they've got some huge edge on everyone is ridiculous.

Suggesting a $200k investment will give you $50,000 a month return as a ""modest estimate"" is even more ridiculous.  If the company making these things could make that much mining, they wouldn't be selling them in the first place, they'd be using them to mine.",2018-01-02
34,englishinseconds,ds3coh1,/r/pennystocks/comments/7nn3yl/sanp_news_should_be_coming_late_this_week/ds3coh1/,1,"So the company is [hopeful the 100 units will be delivered by end of Q1](https://santo.io/2017/10/23/purchase_mining_sysytems/)

Yet somehow they plan on getting 20x that up and running soon?

This is a company that in the last three years was a gold mining company, then an online cigar company, then they were going to make grow pods out of shipping containers, and now exclusively crypto currencies.

They have no clue what they're doing, other than fleecing investors. ",2018-01-02
35,Gabenism,ds3d65k,/r/pennystocks/comments/7norfs/what_applicationswebsites_etc_are_you_using/ds3d65k/,1,"I got an OptionsHouse account back in March (I think) and then they were bought by ETrade, so I use ""OptionsHouse by Etrade."" I like it because it's a flat $4.95 commission per order. Only issue is you have to make sure your profits are going to net above $9.92, so when playing around, that's something to look out for.",2018-01-02
36,ROIDxRAGE,ds3ddbd,/r/pennystocks/comments/7noqv9/whats_up_with_mjna/ds3ddbd/,1,"A lot of the MJ stocks are on the rise. CBIS, MJNA, and HEMP are all doing really well for me. 
",2018-01-02
37,Talonx4,ds3dp98,/r/pennystocks/comments/7njxkb/a_case_for_myhi/ds3dp98/,1,Thank you sir!  I learned from the best!,2018-01-02
38,WeekendTacticalSuppl,ds3dssd,/r/pennystocks/comments/7njxkb/a_case_for_myhi/ds3dssd/,2,"Up 41% now, however some of the $ I used to buy this morning was unsettled funds. So I can't sell until tomorrow at the earliest.
Wish I would of bought a week ago..",2018-01-02
39,Xray_Mind,ds3e4bh,/r/pennystocks/comments/7nn3yl/sanp_news_should_be_coming_late_this_week/ds3e4bh/,1,"If you spent 3 seconds reading you would see my post is in relation to the projected 2000 units they plan on having running in the future. 

It is much more like a 3-4 million dollar investment for that return. 

A) The largest bitcoin company on Earth is located in Georgia not China. 

B) Every industry has companies that focus on creating profit from the end user, and end users that focus on generating profit for themselves. To make a state such as your last is ignorant to say the least. Should Car manufactures enter into the Uber/Lyft/Taxi business since they could just use the cars instead of selling them to make others money? Should farms enter the restaurant business? 
",2018-01-02
40,Talonx4,ds3ejbl,/r/pennystocks/comments/7njxkb/a_case_for_myhi/ds3ejbl/,2,"I know that feeling.  I bought about a week ago.  I almost posted it then, but got distracted with the holidays.  

I'll post more picks soon.  Really want to get back into making good calls on here.  ",2018-01-02
41,englishinseconds,ds3epr0,/r/pennystocks/comments/7nn3yl/sanp_news_should_be_coming_late_this_week/ds3epr0/,1,"&gt; Should Car manufactures enter into the Uber/Lyft/Taxi business since they could just use the cars instead of selling them to make others money?

just to be clear, I'm ignorant, but that statement isn't?  Because there's way more uses for cars than being a taxi business.  

How many uses are there for cryptomining arrays?

And when do they project these 2000-3000 units will be up and running?  How come there's such a wide discrepancy in how many they're planning?  Where will the funding come from these 3000 units (I honestly can't see the press release where they're discussing it)

Last time I [dug into a company and saw so many red flags](https://www.reddit.com/r/pennystocks/comments/7i72gk/svte/dqwkbnu/?st=jby33e8e&amp;sh=598b15a3), it turned out to be nothing more than another pump and dump.  Given, this company seems to at least be more legit than that dumpster fire, but this seems like one more company jumping onto the crpyto game because it's popular right now.  Especially since last year they were going to be making sustainable grow pods out of shipping containers.",2018-01-02
42,Iwasthechosenone,ds3ewmo,/r/pennystocks/comments/7noqv9/whats_up_with_mjna/ds3ewmo/,1,California now legal as of yesterday.  Still filtering profits off that news. ,2018-01-02
43,Xray_Mind,ds3f4j8,/r/pennystocks/comments/7nn3yl/sanp_news_should_be_coming_late_this_week/ds3f4j8/,1,"I thought the only way to explain your lack of understanding of a manufacturer business model was with an equally ignorant comment.

The fact of the matter is that some companies and individuals are extremely good at logistics, or manufacturing, or technological skill, etc. so they go into business into that speciality. Apparently Bitmain feels their competitive advantage in the marketplace is in their manufacturing/logistics and they do extremely well. It is much easier to manufacture and sell thousands of units than to mine with them. No upkeep and no headache of keeping the rig running. 



",2018-01-02
44,OCDweller,ds3fpcc,/r/pennystocks/comments/7niwdu/insy_short_squeeze_opportunity/ds3fpcc/,1,"I, too, would love to see have a peek at the script and contribute improvements if I make any.",2018-01-02
45,AntonioEatsOreos,ds3fzp8,/r/pennystocks/comments/7norfs/what_applicationswebsites_etc_are_you_using/ds3fzp8/,1,"Just getting into it as well, I'm using thinkorswim and their embedded scanning tool. 

Don't call me a shill but I was thinking about trying stocks to trade when I have around 20k buying power. ",2018-01-02
46,RElliott10,ds3grz5,/r/pennystocks/comments/7niwdu/insy_short_squeeze_opportunity/ds3grz5/,1,"[The repo is a mess, but here it is] (https://github.com/RyanElliott10/Short-Squeeze-Predictor/tree/csv)",2018-01-02
47,RElliott10,ds3gs5o,/r/pennystocks/comments/7niwdu/insy_short_squeeze_opportunity/ds3gs5o/,1,"[The repo is a mess, but here it is] (https://github.com/RyanElliott10/Short-Squeeze-Predictor/tree/csv)",2018-01-02
48,RElliott10,ds3gshi,/r/pennystocks/comments/7niwdu/insy_short_squeeze_opportunity/ds3gshi/,1,"[The repo is a mess, but here it is] (https://github.com/RyanElliott10/Short-Squeeze-Predictor/tree/csv)",2018-01-02
49,OCDweller,ds3heqm,/r/pennystocks/comments/7niwdu/insy_short_squeeze_opportunity/ds3heqm/,1,"Awesome, thank you !",2018-01-02
50,Senecany,ds3i8tb,/r/pennystocks/comments/7npfyx/whats_the_deal_with_baa/ds3i8tb/,1,Temporaily halted.,2018-01-02
51,jensu16,ds3jcmd,/r/pennystocks/comments/7norfs/what_applicationswebsites_etc_are_you_using/ds3jcmd/,1,"I use robinhood. It’s a pretty good starter stocks application. It doesn’t charge commission it’s a good option for a newbie. 
However it’s currently only available on mobile devices so that is also something to consider. But I’ve been using it for a while and I don’t find anything wrong with that!! ",2018-01-02
52,Hold_onto_yer_butts,ds3jy8v,/r/pennystocks/comments/7nmseo/sanp_has_some_low_volume_price_action_this_morning/ds3jy8v/,1,"There are 2.2 billion shares outstanding.

Is this a $2B company?

Don't get me wrong, I'm hodling this for a bit, but be reasonable with expectations.",2018-01-02
53,SquizzOC,ds3kqab,/r/pennystocks/comments/7nmseo/sanp_has_some_low_volume_price_action_this_morning/ds3kqab/,1,"I am being reasonable, I don't actually expect this to make it to $1 a share. :)",2018-01-02
54,Morsyn,ds3l6qi,/r/pennystocks/comments/7npbmz/yten_possible_continuation_swing/ds3l6qi/,1,"this is one of the more underwhelming buys in this sector, imo. Plenty of companies that are valued way lower with way more potential to release profits or have upward movement early on. Just my take on it.",2018-01-02
55,thispostislava,ds3laog,/r/pennystocks/comments/7norfs/what_applicationswebsites_etc_are_you_using/ds3laog/,2,I was looking into it but apparently it's only for Americans! ,2018-01-02
56,[deleted],ds3lx38,/r/pennystocks/comments/7nmseo/sanp_has_some_low_volume_price_action_this_morning/ds3lx38/,1,[removed],2018-01-02
57,eskjcSFW,ds3lzy7,/r/pennystocks/comments/7npvwy/the_true_bubble_marjuana_or_bitcoin/ds3lzy7/,1,It can be both,2018-01-02
58,itzjamesftw,ds3n39h,/r/pennystocks/comments/7no46r/january_02_2018_tomorrows_daily_rpennystocks/ds3n39h/,1,"EARS, TEUM, MYSZ.

TEUM and MYSZ saw some run today, but loading up on EARS. 

EARS:  Auris Medical News Release - Auris Medical to Provide Update on Its AM-111 Hearing Loss Program on Thursday, January 4, 2018 -- Large conference planned. At 0.62 a share I expect this to get a bump on Wednesday, already ramping up a bit today. Tomorrow will be very interesting.

TEUM: Been a fun one the past week with no slowing down now. Got back to 2.60 a share today. Landed a large deal in India and just partnered with AirToken

MYSZ: Took off earlier than I thought... They have an app that can digitally size your clothes. They are at CES in a week in Vegas and they are teasing ""ground breaking technology"" -- I thought this would take off closer to then, but saw a nice 25% gain today. Still affordable at 0.82 a share and I think this finds itself over one pretty soon. ",2018-01-02
59,slightofhand69,ds3n7f7,/r/pennystocks/comments/7no46r/january_02_2018_tomorrows_daily_rpennystocks/ds3n7f7/,1,"$SX.c  on the Canadian Market
$icm is also poised to moved",2018-01-02
60,nokarmawhore,ds3o82c,/r/pennystocks/comments/7no46r/january_02_2018_tomorrows_daily_rpennystocks/ds3o82c/,1,"[$ACCA ](https://imgur.com/a/5TwKY) Update, closed up 35%",2018-01-02
61,imguralbumbot,ds3o86q,/r/pennystocks/comments/7no46r/january_02_2018_tomorrows_daily_rpennystocks/ds3o86q/,1,"^(Hi, I'm a bot for linking direct images of albums with only 1 image)

**https://i.imgur.com/jt3oxTl.png**

^^[Source](https://github.com/AUTplayed/imguralbumbot) ^^| ^^[Why?](https://github.com/AUTplayed/imguralbumbot/blob/master/README.md) ^^| ^^[Creator](https://np.reddit.com/user/AUTplayed/) ^^| ^^[ignoreme](https://np.reddit.com/message/compose/?to=imguralbumbot&amp;subject=ignoreme&amp;message=ignoreme) ^^| ^^[deletthis](https://np.reddit.com/message/compose/?to=imguralbumbot&amp;subject=delet%20this&amp;message=delet%20this%20ds3o86q) ",2018-01-02
62,moneymenow,ds3pl4z,/r/pennystocks/comments/7npumw/azfl/ds3pl4z/,1,Too many shares out there.,2018-01-02
63,Grasmick,ds3ptij,/r/pennystocks/comments/7norfs/what_applicationswebsites_etc_are_you_using/ds3ptij/,1,Charles Schwab. 4.95 per trade. Access to everything so far. OTC and foreign. ,2018-01-02
64,5Loaves2Fish1Biscuit,ds3q05j,/r/pennystocks/comments/7npbmz/yten_possible_continuation_swing/ds3q05j/,1, One or two jumping out at you in particular?,2018-01-02
65,EvanJamesLee,ds3q1b1,/r/pennystocks/comments/7norfs/what_applicationswebsites_etc_are_you_using/ds3q1b1/,2,"Broker: [Robinhood](https://robinhood.com/)

Chart Screener: [Finviz](https://finviz.com/screener.ashx?v=111&amp;ft=4)

Chart Analysis: [Stockcharts.com](http://stockcharts.com/freecharts/)

Live Charting: [Level2StockQuotes.com](http://www.level2stockquotes.com/level-ii-quotes.html)

All are free to use
",2018-01-02
66,penisthightrap_,ds405ng,/r/pennystocks/comments/7nmseo/sanp_has_some_low_volume_price_action_this_morning/ds405ng/,2,What do you use to trade? I don't see SANP on Robin Hood and Ally says it doesn't allow trading on stocks below 1¢,2018-01-02
67,Morsyn,ds40bdo,/r/pennystocks/comments/7niwdu/insy_short_squeeze_opportunity/ds40bdo/,1,"Thanks for the heads up dude, I took your advice but unfortunately not with as much as I would have liked to have. How far do you see it being squeezed (I might add to my position) and any others on your radar?

Curious on how you operate the scripts, seems cool.",2018-01-02
68,Nigel_Hans,ds40fs7,/r/pennystocks/comments/7nmseo/sanp_has_some_low_volume_price_action_this_morning/ds40fs7/,1,Im on TDAmeritrade,2018-01-02
69,RElliott10,ds40ov6,/r/pennystocks/comments/7niwdu/insy_short_squeeze_opportunity/ds40ov6/,2,"To be honest, I’m not entirely sure. It had a good move today and it’s shorted quite a bit, plus it’s not a half bad company so I can see it lasting another day or so. I am watching a few more, most notably ANTH, good setup with heavy shorts - similar to INSY. 

My code is up on my [Github] (https://github.com/RyanElliott10/Short-Squeeze-Predictor) if you’re interested. Otherwise, I have a few posts going into how I screened them. ",2018-01-02
70,reester10,ds413c0,/r/pennystocks/comments/7nmseo/sanp_has_some_low_volume_price_action_this_morning/ds413c0/,3,ORIG had a reverse split of 9200 old shares to one new share.  You didn't miss out :),2018-01-02
71,Nigel_Hans,ds416sh,/r/pennystocks/comments/7nmseo/sanp_has_some_low_volume_price_action_this_morning/ds416sh/,1,"Oh really? Well that's a relief, I hadn't really watched the news after I got out lol",2018-01-02
72,Morsyn,ds41r8g,/r/pennystocks/comments/7niwdu/insy_short_squeeze_opportunity/ds41r8g/,1,"I'm almost positive it'll go up tomorrow, a few people had their eyes on the shares for shorts and you can kinda assess it from the float.

I wouldn't have a clue how to use it. I was just going to ask if you could run HMSY and ROKU for me if it wasn't too much trouble, I'm pretty sure these two are susceptible to or being squeezed currently.",2018-01-02
73,RElliott10,ds41u6v,/r/pennystocks/comments/7niwdu/insy_short_squeeze_opportunity/ds41u6v/,2,Yeah I can check for you once I get back later tonight ,2018-01-02
74,Morsyn,ds41y6w,/r/pennystocks/comments/7niwdu/insy_short_squeeze_opportunity/ds41y6w/,1,"Thank you, man, appreciate it.",2018-01-02
75,Hold_onto_yer_butts,ds42b63,/r/pennystocks/comments/7nmseo/sanp_has_some_low_volume_price_action_this_morning/ds42b63/,1,Schwab,2018-01-02
76,cmarkcity,ds42r3a,/r/pennystocks/comments/7nmseo/sanp_has_some_low_volume_price_action_this_morning/ds42r3a/,1,"I bought some with Fidelity, but it limited me to 10,000 shares without broker approval. Idk how it is on other sites.",2018-01-02
77,LIbertyNinja,ds45wo5,/r/pennystocks/comments/7npumw/azfl/ds45wo5/,1,"It's a scam. Make money off the hype if you can, then get out.",2018-01-02
78,cmarkcity,ds47r64,/r/pennystocks/comments/7npumw/azfl/ds47r64/,1,"How can you tell its a scam? It looks legit and promising to me, but I'm admittedly new to this. If its a pump and dump, what kind of indicators did you notice?",2018-01-02
79,Morsyn,ds49yuu,/r/pennystocks/comments/7npbmz/yten_possible_continuation_swing/ds49yuu/,1,"honestly thinking of all-inning ACB as a condensed focus would net more at this point for me. Also, INSY has quite a good pump that will continue for a while. Evio/Namaste will probably rise for a little while too.",2018-01-02
80,RElliott10,ds4be2o,/r/pennystocks/comments/7niwdu/insy_short_squeeze_opportunity/ds4be2o/,1,"ROKU never even came up on the screener, which can be attributed to it being priced above $10, but upon looking at it I would not advise buying just for a short squeeze.

The same thing goes for HMSY, but if you feel you know what you are doing, by all means, have at it!",2018-01-02
81,Gabenism,ds4m37v,/r/pennystocks/comments/7nmseo/sanp_has_some_low_volume_price_action_this_morning/ds4m37v/,1,My most optimistic trajectory says 0.18 in two years.,2018-01-02
82,Gabenism,ds4m4wl,/r/pennystocks/comments/7nmseo/sanp_has_some_low_volume_price_action_this_morning/ds4m4wl/,1,"You can buy any number of available shares with OptionsHouse by ETrade (I assume just Etrade now), as long as you use a limit order. Market orders aren't allowed for subpenny.",2018-01-02
83,[deleted],ds4nr3c,/r/pennystocks/comments/7nmseo/sanp_has_some_low_volume_price_action_this_morning/ds4nr3c/,1,[removed],2018-01-02
84,stuffguy1,ds4oe0p,/r/pennystocks/comments/7noqv9/whats_up_with_mjna/ds4oe0p/,1,Still continuing its climb. Anyone have a reasonable idea of what this stock is actually worth? What has prevented it from getting above where it's been hovering the past few years?,2018-01-02
85,Morsyn,ds4r9bw,/r/pennystocks/comments/7niwdu/insy_short_squeeze_opportunity/ds4r9bw/,1,"ROKU had news today and SKYROCKETED so lucky me. HMNY I stop trailed at like .15 cents below open so I'm chillin there too. Thanks again for INSY, shit is soaring today.",2018-01-02
