,title,id,author,url,score,num_comments,text,date,link
0,$YTEN,e9xf8r,hipotamer,https://www.reddit.com/r/pennystocks/comments/e9xf8r/yten/,1,2,What’s do you guys think about $YTEN?,2019-12-13,https://www.reddit.com/r/pennystocks/comments/e9xf8r/yten/
1,KNR Kontrol Energy discussion Q3 Results and future outlook,e9wp0i,WootubeEntertainment,https://www.reddit.com/r/pennystocks/comments/e9wp0i/knr_kontrol_energy_discussion_q3_results_and/,1,12,"This is my golden egg right now and am happy with the price increase that came with the Q3 results. However they're saying that with the Toyota Partnership that they will outperform even this in Q4 and next year is looking all upwards. Especially with more and more companies trying to improve their energy efficiency, Most companies stock value is more of a 3:1 to their revenue and there's is more of a 1:1 ratio currently. My target is 1.50 USD price",2019-12-13,https://www.reddit.com/r/pennystocks/comments/e9wp0i/knr_kontrol_energy_discussion_q3_results_and/
2,"Simple Questions - December 13, 2019",ea05jq,AutoModerator,https://www.reddit.com/r/pennystocks/comments/ea05jq/simple_questions_december_13_2019/,1,2,"This thread is for simple questions that don't warrant their own thread as well as general discussion. We strongly encourage you to check the sidebar before posting. Please feel free to engage and discuss topics with other members of the community.

**IMPORTANT: Downvotes are strongly discouraged. Sorting by ""New"" is strongly encouraged.**",2019-12-13,https://www.reddit.com/r/pennystocks/comments/ea05jq/simple_questions_december_13_2019/
3,Buy sell or hold?,e9zwiw,itzAspen,https://www.reddit.com/r/pennystocks/comments/e9zwiw/buy_sell_or_hold/,1,0,"I currently am invested in $BCRX and $AMRX. I have a lot of hope for $BCRX and plan on putting more in, so I plan on holding it for now. But what’s the move in your guy’s opinion on $AMRX seems a bit risky of a move so not sure if I should just hold on in hope or sell.",2019-12-13,https://www.reddit.com/r/pennystocks/comments/e9zwiw/buy_sell_or_hold/
4,check out amtx for 2 day trading,ea1ssq,xpercipio,https://www.reddit.com/r/pennystocks/comments/ea1ssq/check_out_amtx_for_2_day_trading/,1,6,"for the last few months, amtx has been going from about .95-.97 to 1.00 every other day. fairly consistently in my opinion. not a pro trader. but if your penny stock attention span is 2 days, it might be fun to look into.",2019-12-13,https://www.reddit.com/r/pennystocks/comments/ea1ssq/check_out_amtx_for_2_day_trading/
5,$trnx,ea0u02,KomandoMetz,https://www.reddit.com/r/pennystocks/comments/ea0u02/trnx/,1,6,"to the moon?!

turkey is almost done. spinoff is prolly tradeable next week!

what to do now? id love to hodl them for years actually",2019-12-13,https://www.reddit.com/r/pennystocks/comments/ea0u02/trnx/
6,Itronics Announces Launch of Redesigned Website,ea4axl,NASDQTRDER,https://www.reddit.com/r/pennystocks/comments/ea4axl/itronics_announces_launch_of_redesigned_website/,1,0,[removed],2019-12-13,https://www.reddit.com/r/pennystocks/comments/ea4axl/itronics_announces_launch_of_redesigned_website/
7,"AGRI-DYNAMICS, INC. CEO Joseph Amram plans to increase shareholder value by focusing on precious metals mining",ea47an,NASDQTRDER,https://www.reddit.com/r/pennystocks/comments/ea47an/agridynamics_inc_ceo_joseph_amram_plans_to/,1,1,"$AGDY News December 12, 2019

https://www.otcmarkets.com/stock/AGDY/news/AGRI-DYNAMICS-INC-CEO-Joseph-Amram-plans-to-increase-shareholder-value-by-focusing-on-precious-metals-mining?id=249123

See the Corporate profile:
http://www.thestreetnow.com/spotlight/agdy/",2019-12-13,https://www.reddit.com/r/pennystocks/comments/ea47an/agridynamics_inc_ceo_joseph_amram_plans_to/
8,MMNFF,ea46h7,spookiestmemefinance,https://www.reddit.com/r/pennystocks/comments/ea46h7/mmnff/,1,0,[removed],2019-12-13,https://www.reddit.com/r/pennystocks/comments/ea46h7/mmnff/
9,How to invest in the pharmaceutical sector?,ea3x6t,premiumpill,https://www.reddit.com/r/pennystocks/comments/ea3x6t/how_to_invest_in_the_pharmaceutical_sector/,1,12,[removed],2019-12-13,https://www.reddit.com/r/pennystocks/comments/ea3x6t/how_to_invest_in_the_pharmaceutical_sector/
10,How to screen for short term volatility?,ea355r,Manny-Hatz,https://www.reddit.com/r/pennystocks/comments/ea355r/how_to_screen_for_short_term_volatility/,1,2,"Hope it’s not a stupid question, I’m pretty new to this. I know to screen for high volume but so far I haven’t figured out how to screen for volatility. I use td ameritrade.",2019-12-13,https://www.reddit.com/r/pennystocks/comments/ea355r/how_to_screen_for_short_term_volatility/
11,$SBES $QALB,ea6eym,CaptainWeee,https://www.reddit.com/r/pennystocks/comments/ea6eym/sbes_qalb/,1,20,,2019-12-13,/r/PennyHaven/comments/ea6eu5/sbes_still_on_a_major_tear_people_who_pushed_dcgd/
12,$SBES $WSGF $ATDS,ea5y6e,blackstealth7,https://www.reddit.com/r/pennystocks/comments/ea5y6e/sbes_wsgf_atds/,1,0,$SBES $WSGF $ATDS,2019-12-13,https://www.reddit.com/r/pennystocks/comments/ea5y6e/sbes_wsgf_atds/
13,QUIK,ea5u2t,elon182,https://www.reddit.com/r/pennystocks/comments/ea5u2t/quik/,1,8,"QUIK appeared to be trending up. Got in at 0.40.
Can anybody provide any insight or recommendations on how long I should hold? Fairly new to this. 
Put $815 in at .40",2019-12-13,https://www.reddit.com/r/pennystocks/comments/ea5u2t/quik/
14,"December 13, 2019 Tomorrow's Daily /r/Pennystocks Discussion - What are your Friday / weekend plays?",ea7gvl,AutoModerator,https://www.reddit.com/r/pennystocks/comments/ea7gvl/december_13_2019_tomorrows_daily_rpennystocks/,1,1,"Please use this thread to discuss your plays of the day!

Since this thread is likely to fill up quickly, consider sorting the comments by ""new"" (instead of ""best"" or ""top"") to see the newest posts.",2019-12-13,https://www.reddit.com/r/pennystocks/comments/ea7gvl/december_13_2019_tomorrows_daily_rpennystocks/
15,$SBES,ea6ylk,blackstealth7,https://www.reddit.com/r/pennystocks/comments/ea6ylk/sbes/,1,0,$SBES,2019-12-13,https://www.reddit.com/r/pennystocks/comments/ea6ylk/sbes/
