,author,id,url,score,text,date
0,Jeermm,f9wj2lj,/r/pennystocks/comments/e79vor/i_have_learned_so_much_from_this_guy/f9wj2lj/,1,whats his stream?,2019-12-07
1,dickwop,f9wjpm0,/r/pennystocks/comments/e79vor/i_have_learned_so_much_from_this_guy/f9wjpm0/,1,He only does private videos for subscribers every weeknight on his site OTCMethod.com,2019-12-07
2,anonymous1020304,f9wjwj5,/r/pennystocks/comments/e79rqc/oragenics/f9wjwj5/,1,Holding 325 shares until they release the phase 2 results of their clinical study in early 2020. If goes well the stock should go up just based on that. Also suppose to talk to investors at an event December 10th so hoping to maybe flip if it goes up,2019-12-07
3,taiman8,f9wm13n,/r/pennystocks/comments/e79vor/i_have_learned_so_much_from_this_guy/f9wm13n/,1,Hmm you have 3 comments that all reference this same guy.,2019-12-07
4,dickwop,f9wmxhq,/r/pennystocks/comments/e79vor/i_have_learned_so_much_from_this_guy/f9wmxhq/,1,I am a big fan he helped me make so much money,2019-12-07
5,tawebber1,f9wo2t1,/r/pennystocks/comments/e79rqc/oragenics/f9wo2t1/,1,"Yes, holding 10k shares at .591",2019-12-07
6,taiman8,f9wpjfy,/r/pennystocks/comments/e79vor/i_have_learned_so_much_from_this_guy/f9wpjfy/,1,Hmm do you pay $50 monthly or $481?,2019-12-07
7,alucarddrol,f9wqhua,/r/pennystocks/comments/e79vor/i_have_learned_so_much_from_this_guy/f9wqhua/,1,Report,2019-12-07
8,ohiamaude,f9wv9f0,/r/pennystocks/comments/e79vor/i_have_learned_so_much_from_this_guy/f9wv9f0/,1,"No, he's the guy in the picture.",2019-12-07
9,taiman8,f9wvaj3,/r/pennystocks/comments/e79vor/i_have_learned_so_much_from_this_guy/f9wvaj3/,1,Lol I know 😂,2019-12-07
10,DecadentHam,f9wwx23,/r/pennystocks/comments/e79rqc/oragenics/f9wwx23/,1,Advice? Holding and hoping is not a strategy. The long term chart is awful and it most likely will retrace back to .450 levels if not lower.,2019-12-07
11,AutoHustler,f9wxomv,/r/pennystocks/comments/e79vor/i_have_learned_so_much_from_this_guy/f9wxomv/,1,Gay,2019-12-07
12,learningoptions,f9x5ft9,/r/pennystocks/comments/e79rqc/oragenics/f9x5ft9/,1,"In one night stands you never wake next to the skank, you don't take the skank to meet your parents, and you never marry the skank.",2019-12-07
13,NomadicTrader2019,f9xzclm,/r/pennystocks/comments/e79rqc/oragenics/f9xzclm/,1,"This gets pumped and dumped regularly. Eventually, it's gonna rocket. Run up to P2 PR will see a massive pump.",2019-12-07
14,NomadicTrader2019,f9xznzg,/r/pennystocks/comments/e79rqc/oragenics/f9xznzg/,1,"Wait wait.. 250 shares?? That's like $150. If u let $150 get to u, there is no way you're gonna survive. U will die of a stroke by the time u lose your virginity.",2019-12-07
15,Shiggle,f9ymxmq,/r/pennystocks/comments/e79vor/i_have_learned_so_much_from_this_guy/f9ymxmq/,1,"If you are going to shill your own bullshit, then be a little more eloquent and convincing.",2019-12-07
16,Uncle_Kent,f9ywzh6,/r/pennystocks/comments/e79rqc/oragenics/f9ywzh6/,1,It’s a pump and dump,2019-12-07
17,cukamakazi,f9z3prh,/r/pennystocks/comments/e7gdv4/need_advice_on_when_to_sell/f9z3prh/,1,"What commission are you paying on the trades? For example, paying a $7 commission to cash out a $15 gain probably doesn’t make sense. You’d basically have just broken even after the fees and taxes. Unless you need the $, I’d hold until you have a much more sizeable gain (hopefully).",2019-12-07
18,SensibleCreeper,f9z3q8n,/r/pennystocks/comments/e7gdv4/need_advice_on_when_to_sell/f9z3q8n/,1,"Just like all the other posts exactly like this one, dont execute your entry without an exit plan in place. Add your brokerage fees into your trades to find even.


all in all... you'll just end up winging it because you cant be bothered to do your own DD and you depend on people on reddit. GLTY.",2019-12-07
19,abaddon2025,f9z5bub,/r/pennystocks/comments/e7gdv4/need_advice_on_when_to_sell/f9z5bub/,1,Take out commission you’re not really any better off.,2019-12-07
20,itzAspen,f9z61fg,/r/pennystocks/comments/e7gdv4/need_advice_on_when_to_sell/f9z61fg/,1,"Not paying commission, using Robinhood.",2019-12-07
21,mcdanijt,f9z8gpm,/r/pennystocks/comments/e7gdv4/need_advice_on_when_to_sell/f9z8gpm/,1,Sometimes on penny stocks it is okay to take a break even sell because you never know when it will tank and you lose everything,2019-12-07
22,mcdanijt,f9z8wzv,/r/pennystocks/comments/e7gdv4/need_advice_on_when_to_sell/f9z8wzv/,1,If you set up a fidelity account there is no commission  fees or trading fees anymore,2019-12-07
23,cukamakazi,f9z915e,/r/pennystocks/comments/e7gdv4/need_advice_on_when_to_sell/f9z915e/,1,"Ahh, then the size of the gain isn’t as important. However, you’ll still want to consider the break even on the extra effort you’ll have to put into noting the transaction on your taxes.",2019-12-07
24,archwin,f9z9jmi,/r/pennystocks/comments/e7gdv4/need_advice_on_when_to_sell/f9z9jmi/,1,"Probably not a bad idea to exit. I'm new too but I keep missing exit points (on Robinhood too) due to work and life. $15 is $15

I missed the Boeing peak and lost a lot of potential equity",2019-12-07
25,johnfreny,f9za3hr,/r/pennystocks/comments/e7gdv4/need_advice_on_when_to_sell/f9za3hr/,1,Brokerage fees what is this 2015? But seriously it’s a good idea to figure out how much of loss or a gain is worth the risk. I usually set mine to he around 13% +-,2019-12-07
26,MidWestMind,f9zc3jm,/r/pennystocks/comments/e7gdv4/need_advice_on_when_to_sell/f9zc3jm/,2,"Okay man, listen.    I’m new too (September) and learned something very valuable about RH that made me switch to Webull for short term fast trading.  

About a month ago I had a stock jump up 13% AH (after hours).    I wanted to sell ASAP to keep lock in profit.   PreMarket starts at 4am and I set my shit to sell.    Price was dropping, so I lowered my ask.   Still pending.   Price dropped more.   I lowered again hoping the sell would go through.    RH doesn’t allow trades before 9am, by that time I lost $1K than if I could sell at 4am.   

So I keep my RH for longer term stocks (PCG, SPCE, etc).    Use Webull for buying and selling on a daily basis.  It allows full market time trading from 4am to 8pm.   (All times eastern).  

Don’t lose out on profit after hours like I did.",2019-12-07
27,JustBrolic,f9zefv5,/r/pennystocks/comments/e7gdv4/need_advice_on_when_to_sell/f9zefv5/,0,Sell when you have profits,2019-12-07
28,Frothy_Walrus,f9zejcq,/r/pennystocks/comments/e7gdv4/need_advice_on_when_to_sell/f9zejcq/,1,"Use a platform that offers commission free trades. I personally use TD Ameritrade. Very solid platform for mobile and desktop and offer great support services. As well as offering commission free trading. 

Personally, I sit for &gt;10% gains. However, if you do not have much capital, selling at smaller gains (~5%) can be a way to grow your capital. Especially if can’t diversify your capital across multiple stocks. Continue research into multiple industries, stocks. Develop buy and sell points. With commission free trading, once you feel you have reached your buy/sell point(s) on one stock, pull the trigger and move to your next stock. You get all the earnings and can use those to increase holdings on your next stock, allowing larger growth on your next move.",2019-12-07
29,AlAyrianMilk,f9zek4u,/r/pennystocks/comments/e7gdv4/need_advice_on_when_to_sell/f9zek4u/,0,Lmao that's as big of a return as youre going to get for 500 dollars xD,2019-12-07
30,JonDongers,f9zkcah,/r/pennystocks/comments/e7gdv4/need_advice_on_when_to_sell/f9zkcah/,1,They’re referral system is also a lot better,2019-12-07
31,TastyTryHard,f9znpbs,/r/pennystocks/comments/e7gdv4/need_advice_on_when_to_sell/f9znpbs/,1,"Try to look for either a price action resistance that could mean a trend reversal or set a trailing stop loss, I would highly suggest looking at the bigger picture (daily chart) and see what direction the stock is heading overall.",2019-12-07
32,moby_9ish,f9zocch,/r/pennystocks/comments/e7gdv4/need_advice_on_when_to_sell/f9zocch/,1,"You can also sell as much as you put in, and consider remaining shares as “free”.  I do this when it’s a stock I’m interested in, but don’t want to risk my hard earned money.",2019-12-07
33,B0KCH0Y,f9zpzpa,/r/pennystocks/comments/e7gdv4/need_advice_on_when_to_sell/f9zpzpa/,1,"No options yet, big oof. Also looks like there's a sale of stock fees. Once they bring options might be worth trying",2019-12-07
34,newleafkratom,fa05ykc,/r/pennystocks/comments/e7j305/anyone_here_haveheard_of_stories_of_people_being/fa05ykc/,1,"The only ten-baggers-plus I've made money in were RM's

Watch for current Pink Sheet companies with little to no growth, small market caps and no convertible debt. Those are prime for RM possibilities. $GBBT for instance.",2019-12-07
35,JavanHammer,fa093t4,/r/pennystocks/comments/e7gdv4/need_advice_on_when_to_sell/fa093t4/,1,Do you have to be a PDT and keep $25k or use any starting amount?,2019-12-07
36,MidWestMind,fa0aqmy,/r/pennystocks/comments/e7gdv4/need_advice_on_when_to_sell/fa0aqmy/,1,"It's federal SEC rules to have 25k before you can keep buying and selling the same stock on the same day.    You can 3 times per week if you don't have that much, which is why some people have multiple trading apps.   You can trad 3x per week per app.",2019-12-07
37,Martin_Birch,fa0b4dm,/r/pennystocks/comments/e7gdv4/need_advice_on_when_to_sell/fa0b4dm/,1,Save up some real money and in the interim just paper trade to learn. There is little point in trading for loose change,2019-12-07
38,watterbuffaloo,fa0crmg,/r/pennystocks/comments/e7j305/anyone_here_haveheard_of_stories_of_people_being/fa0crmg/,1,Help I'm disabled what is R/M,2019-12-07
39,Smit_W,fa0dh2s,/r/pennystocks/comments/e7j305/anyone_here_haveheard_of_stories_of_people_being/fa0dh2s/,0,"No doubt, there are stocks that fit this criteria: no growth, small MC, no convertible debt out there, but how do you decide which ones to pull the trigger on? Was there anything more to $GBBT that made it stand out to you from the rest? Or do you just pick one, build up a position and wait for something to happen? 

Definitely appreciate your feedback.",2019-12-07
40,Smit_W,fa0dx21,/r/pennystocks/comments/e7j305/anyone_here_haveheard_of_stories_of_people_being/fa0dx21/,0,Reverse merger,2019-12-07
41,g0dlyone,fa0j1m4,/r/pennystocks/comments/e7gdv4/need_advice_on_when_to_sell/fa0j1m4/,1,I set up a Webull account linked my bank account but it still won’t allow me to buy stocks any help?,2019-12-07
42,MidWestMind,fa0jow7,/r/pennystocks/comments/e7gdv4/need_advice_on_when_to_sell/fa0jow7/,1,"Oh yeah, lol I did crypto for a bit before traditional stocks and not having 24 hour ability to trade is odd at first.   You can only trade when the stock market is open on weekdays.",2019-12-07
43,Prometheus013,fa0n87p,/r/pennystocks/comments/e7gdv4/need_advice_on_when_to_sell/fa0n87p/,2,Fifteen bucks? My buy and sell fees in Canada wouldn't cover that lol. Hold.,2019-12-07
44,M33RHARIS,fa0o6lh,/r/pennystocks/comments/e7gdv4/need_advice_on_when_to_sell/fa0o6lh/,1,"18 year old here who has increased his portfolio by 300%+, could’ve been 600%+ if I didn’t sell the dumb ARWR at 20 bucks, now it’s at like 70.



Rule number 1, dont do what I just did, never look back, if you’re in for short term gains, never be greedy, set a stop loss above the price you asked for, and usually when stocks soar due to recent events, they also fall, so never hold them during closed market(did this with AMRN, had the opportunity to sell at $24, when bought at $16, but was too greedy and it fell, its back at $22 or so but still).",2019-12-07
45,Thatginger18,fa0o7bg,/r/pennystocks/comments/e7j305/anyone_here_haveheard_of_stories_of_people_being/fa0o7bg/,1,Watch the china hustle on netflix it covers how a lot lf R/Ms on the new york stock exchange are not what they seem/the big short is also a good movie you can pick somethings up thats on netflix too,2019-12-07
46,watterbuffaloo,fa0qdvp,/r/pennystocks/comments/e7j305/anyone_here_haveheard_of_stories_of_people_being/fa0qdvp/,1,&lt;3,2019-12-07
47,NinjaTiddies,fa0y79j,/r/pennystocks/comments/e7gdv4/need_advice_on_when_to_sell/fa0y79j/,1,&gt;300% is pretty crazy. How much $ did you start with?,2019-12-07
48,M33RHARIS,fa0zc9q,/r/pennystocks/comments/e7gdv4/need_advice_on_when_to_sell/fa0zc9q/,1,"Lol I’m pretty poor so $75. 





I’m looking at both AMRN and ARWR, expect both to go up next week.",2019-12-07
49,CandidAttitude51,fa0zvyr,/r/pennystocks/comments/e7gdv4/need_advice_on_when_to_sell/fa0zvyr/,1,when and why?,2019-12-07
50,c0d3d123,fa16jxf,/r/pennystocks/comments/e7gdv4/need_advice_on_when_to_sell/fa16jxf/,1,there are also exceptions to this such as using a cash-only account etc.,2019-12-07
51,M33RHARIS,fa16wun,/r/pennystocks/comments/e7gdv4/need_advice_on_when_to_sell/fa16wun/,1,"Probably next week, ARWR fell a lot since the company sold some $200 million worth of stocks to fund their research, it’s slowly climbing back up, and AMRN recently got their only product approved. Which is why it jumped from $16 to $24 in like 5 days.",2019-12-07
52,CandidAttitude51,fa17k4w,/r/pennystocks/comments/e7gdv4/need_advice_on_when_to_sell/fa17k4w/,1,which one do you think will go more up? I am holding both but want to sell on of them.,2019-12-07
53,M33RHARIS,fa18k6g,/r/pennystocks/comments/e7gdv4/need_advice_on_when_to_sell/fa18k6g/,1,"Tbh I won’t recommend selling any, I know Arwr will hit $100 for sure pretty soon. It’s not showing any signs of stopping unless the company really messes up bad. Won’t be surprised if AMRN hit’s $30-40 by Feb",2019-12-07
54,ChineseTacoT,fa1tgez,/r/pennystocks/comments/e7gdv4/need_advice_on_when_to_sell/fa1tgez/,1,Lock in your profit !!,2019-12-07
55,tboydoboe,fa1z4jz,/r/pennystocks/comments/e7gdv4/need_advice_on_when_to_sell/fa1z4jz/,1,"I’ve been doing this penny stock think via Ameritrade for 3 years. It’s stressful and the penny stocks are highly volatile. If you get in have a discipline . My discipline is I never chase a stock. Lots of pump and dumped and even with those as long as I get in and out within 3-7 mins and make 20-30% I’m good to go to the next stock. I never hold a stock over night under 1 to 2 bucks. If a company which could be a shell hits 1 buck most of the time it does down. After the big boys come back from lunch we might get a bounce but I’m in to the next stock looking at the float, VOLUME, and the spreads between the Ask and bid. 
I have been averaging over this year around 2-300 a day. I don’t trade everyday. Too hard on me. I do have day trading power with my 25k in there but my goals are clear. Make around $500 a week and I’m out. The more obviously I put in the bigger the profit or loss and there have been plenty of those for me. 
When you start out simulate the trading with play money and once you start feeling confident then start with baby steps. Yes we have commissions on both end so keep that always in mind and whatever tax bracket ur in the IRS will get a chunk. Take all this into consideration.  Trading as you are doing is certainly not for everyone. If you are trading to pay the bills on penny stocks stop ASAP. Penny stocks are anything from .0001 to 8 bucks. 
Patience and discipline is what it’s all about!! Yes I’ve seen 2500% jumps in 15 mins. If I don’t get in prior I loose looking at that stock. Onward. Volume and the float ( how many shares are out for public trading) are the major 2 issues to look at. I love learning about what companies do.. an example: VSTR or SHMP  have wonderful patents. Will I get into them?? Only long term. Always put stop losses or market losses on your sells cause these trades can go right past your ask on your execution and leave you dead in the water.  
Always welcome to email me for no money on this end. Here to help. Let me know and I’ll inbox you my email. 
Happy holidays!!
Tom Boyd",2019-12-07
56,kneelb4neil,fa1zlb7,/r/pennystocks/comments/e7gdv4/need_advice_on_when_to_sell/fa1zlb7/,1,Remember that he only invested $250. It may seem like nothing if you have a portfolio worth 10s of thousands but a 5% increase isn’t bad short term,2019-12-07
57,kneelb4neil,fa1zrcq,/r/pennystocks/comments/e7gdv4/need_advice_on_when_to_sell/fa1zrcq/,1,One thing I learnt when trading is don’t get greedy over profits. The moment u start holding on too long thinking it will go up you will start losing money. Also depends on your risk tolerance,2019-12-07
58,Kaidoleer,fa213go,/r/pennystocks/comments/e7gdv4/need_advice_on_when_to_sell/fa213go/,1,"""Brokerage fees what is this 2015?"" You got me to chuckle, thanks lol",2019-12-07
59,Prometheus013,fa2hdur,/r/pennystocks/comments/e7gdv4/need_advice_on_when_to_sell/fa2hdur/,1,I lose or gain a months wages on an eventful day. He can work an hour for what he is considering pulling out. Not worth the effort to.,2019-12-07
60,VOTE_TRUMP2020,fa2rf9v,/r/pennystocks/comments/e7gdv4/need_advice_on_when_to_sell/fa2rf9v/,1,"On TD Ameritrade’s ThinkorSwim platform, you can actually set up times and conditions for what time you want a stock to be bought or sold (however if you are holding overnight and want to sell it during premarket hours without selling the stock manually, you’re going to have to change the time of the trade from “DAY” to “EXT_GTC” which stands for Extended hours Good ‘Til cancelled). However, if you want to sell it the minute the market opens, or 10 minutes after the market opens, you can absolutely do that and set a specific time for your trades to execute.",2019-12-07
61,Shiznoz222,fa3dpib,/r/pennystocks/comments/e7gdv4/need_advice_on_when_to_sell/fa3dpib/,1,You severely underestimate the value of an hour of one's life.,2019-12-07
62,MidWestMind,fa4i6kb,/r/pennystocks/comments/e7gdv4/need_advice_on_when_to_sell/fa4i6kb/,1,Like I said in the first post that I’m new.   So how do you do these cash only accounts?,2019-12-07
63,gavotron5,fa5hxdx,/r/pennystocks/comments/e7j305/anyone_here_haveheard_of_stories_of_people_being/fa5hxdx/,1,$sbes has completely high jacked my twitter feed. And now bux is tweeting about it. I have been watching it since .0015 have not bought wish I did . I have no idea if it’s a legit company but I know there are a shit ton of ppl pumping this thing and from what I noticed the same ppl pumped dcgd to 2.22 . I would just play this on the 30 minute chart .,2019-12-07
64,walkerv5,fa5k3cs,/r/pennystocks/comments/e7j305/anyone_here_haveheard_of_stories_of_people_being/fa5k3cs/,1,"Thanks! I'm new, but I'm listening.",2019-12-07
65,ErikaSchoene,fa5t96h,/r/pennystocks/comments/e7gdv4/need_advice_on_when_to_sell/fa5t96h/,1,second,2019-12-07
66,Smit_W,fa60n2h,/r/pennystocks/comments/e7j305/anyone_here_haveheard_of_stories_of_people_being/fa60n2h/,1,"My initial thoughts exactly. I've been forked between *this is a real R/M with real people behind it and the move is justified* vs. *this is a P&amp;D orchestrated by Bux and his followers but idgaf because I'm in at .0045 so I don't have much to lose*. To decide which of these is the real answer, I've literally been doing DD since the time I made this post. The conclusion? It's both, lol.

My only skepticism about SBES is: 
1. There's a guy on Twitter claiming that $ADSV is the real R/M happening and not SBES as both have gone through the same company to register and both SBES and ADSV have the same address (I don't know how this could've happened and I'm not sure how to 100% confirm through a third party which is the real R/M. I could be misunderstanding the technicals here about how all of this works, but 1 side has to be lying). 

2. Robert Xu, aka the guy wanting to bring RockySaaS to the U.S., doesn't answer questions. He's active on social media, but not sure if this is because of a language barrier.

3. The guy disputing ADSV as the real R/M is getting rocked on Twitter because people believe he's behind a recent fake website telling SBES shareholders they have no intention to R/M. The website has been deleted, but somebody typed in the website's address to WhoIs and the domain and admin name fall under someone named IRENE BLACK. Robert Xu has since denied this by putting together a 5 minute effort, GoDaddy website telling shareholders there *is* a R/M happening. The same guy has linked the website ADSV and while *it seems legit*, the website has an email but no phone number suggesting to me someone doesn't want to answer their phone (idk if this is just bad IR or what).

4. SBES doesn't have an 8k and the last one was dropped last April.

5. People are throwing numbers around on Twitter, Yahoo Finance, ihub about the valuation of SBES, but if you ask them where they're getting this info, they will dodge the question.

For me, the things that need to be confirmed are: 
1. Who is Irene Black?
2. Confirm through a third party, not Robert Xu, not the guy running ADSV, but someone who could provide definitive proof which company is doing the R/M. I don't know how to confirm this honestly until something like an 8k drops.
3. On Monday, I'm calling the University of Illinois to confirm Xu's academic credentials.",2019-12-07
67,Prometheus013,fa63gtd,/r/pennystocks/comments/e7gdv4/need_advice_on_when_to_sell/fa63gtd/,1,"He's going to spend an hour thinking about it and debating over it. Could have just worked another hour, added to total investment and let it sit for years.",2019-12-07
68,GermyBones,fa6xcyh,/r/pennystocks/comments/e7j305/anyone_here_haveheard_of_stories_of_people_being/fa6xcyh/,1,Mood. Glad someone else asked.,2019-12-07
69,NinjaTiddies,fa71rxy,/r/pennystocks/comments/e7gdv4/need_advice_on_when_to_sell/fa71rxy/,1,Still a very impressive return,2019-12-07
70,c0d3d123,fa76lj8,/r/pennystocks/comments/e7gdv4/need_advice_on_when_to_sell/fa76lj8/,1,Im by no means an expert but essentially its an account type and instead of borrowing money via margin its your own cash. This will help: https://www.timothysykes.com/blog/pattern-day-trader-rule/,2019-12-07
71,MidWestMind,fa7886u,/r/pennystocks/comments/e7gdv4/need_advice_on_when_to_sell/fa7886u/,1,"Okay, so for example on RH.   I don't have any money ""pending"" incoming from my bank or borrowing any money.   So I can day trade with the margin turned off?",2019-12-07
72,gavotron5,fa886af,/r/pennystocks/comments/e7j305/anyone_here_haveheard_of_stories_of_people_being/fa886af/,1,Hey what’s your twitter handle . I would like to follow you . Dm me if you like,2019-12-07
73,myblkz,faa2vmu,/r/pennystocks/comments/e7gdv4/need_advice_on_when_to_sell/faa2vmu/,1,"If you don't mind me asking, how do you use the volume and float to determine a good stock to buy In",2019-12-07
74,_NintenDude_,faa2wk6,/r/pennystocks/comments/e79rqc/oragenics/faa2wk6/,1,What’s p2 pr?,2019-12-07
75,NomadicTrader2019,faa2zu2,/r/pennystocks/comments/e79rqc/oragenics/faa2zu2/,1,P2 results. They just announced completion of enrollment.,2019-12-07
76,tboydoboe,fcsrwzo,/r/pennystocks/comments/e7gdv4/need_advice_on_when_to_sell/fcsrwzo/,1,"A penny you really don’t need to get  involved with the float. I will say each company will release to the public. If the amount of people allowed to only trade the company / low float is low then once in awhile you’ll watch squeezes upwards. Get out at 15% after commissions and move in .. 
most importantly 1-2 times the normal volume brings it possibly to the bigger traders and it might shoot up BUT watch the increase or decrease of the volume like a hawk. 15-20% is all you should ever go for in profit. You might make 100% but remember these penny’s drop sometimes faster than  as they go up. 
I keep my eyes on my Ameritrade at the profit % and then get out. Once you have this kind of discipline you’ll make money. Waiting for the big pops is basically gambling and usually you’ll loose.
The greatest of luck.
Tom Boyd",2019-12-07
77,itzAspen,fcte6u2,/r/pennystocks/comments/e7gdv4/need_advice_on_when_to_sell/fcte6u2/,1,Thank you!!,2019-12-07
78,tboydoboe,fcytqrv,/r/pennystocks/comments/e7gdv4/need_advice_on_when_to_sell/fcytqrv/,2,"Sorry I didn’t spellcheck but you hopefully got what I was telling you. If not you’re always welcome to ask away. Happy New Year to all.
Tom Boyd : )",2019-12-07
79,tboydoboe,fd05g3c,/r/pennystocks/comments/e7gdv4/need_advice_on_when_to_sell/fd05g3c/,1,"Get out at  commissions in and out at 15% and with penny stocks get out on the same day while the volume is huge. I use Ameritrade. 7 in 7 out. Don’t go for big 50-100% gains. These small penny’s go down as fast as they go up. This kind of disciple will make you money. Swing trading doesn’t work for me with Pennys
The best $$
Tom Boyd",2019-12-07
