,title,id,author,url,score,num_comments,text,date,link
0,What happens if you buy all the share?,81aowf,Stunt187,https://www.reddit.com/r/pennystocks/comments/81aowf/what_happens_if_you_buy_all_the_share/,56,18,"Some penny stock only has 400,000 shares and you keep buying and turns out you now own 300k. What happens? Is the company yours? Can they issue more shares to dilute you?

I'm talking about an OTC penny stock with like $50,000 market cap?

Curious, thanks",2018-03-02,https://www.reddit.com/r/pennystocks/comments/81aowf/what_happens_if_you_buy_all_the_share/
1,"Simple Questions - March 02, 2018",81c8sn,AutoModerator,https://www.reddit.com/r/pennystocks/comments/81c8sn/simple_questions_march_02_2018/,2,4,"This thread is for simple questions that don't warrant their own thread as well as general discussion. We strongly encourage you to check the sidebar before posting. Please feel free to engage and discuss topics with other members of the community.

**IMPORTANT: Downvotes are strongly discouraged. Sorting by ""New"" is strongly encouraged.**
",2018-03-02,https://www.reddit.com/r/pennystocks/comments/81c8sn/simple_questions_march_02_2018/
2,Would you buy more BPMX?,81by6w,andipe220,https://www.reddit.com/r/pennystocks/comments/81by6w/would_you_buy_more_bpmx/,7,9,,2018-03-02,https://www.reddit.com/r/pennystocks/comments/81by6w/would_you_buy_more_bpmx/
3,ASCM,81bwjl,[deleted],https://www.reddit.com/r/pennystocks/comments/81bwjl/ascm/,0,0,[deleted],2018-03-02,https://www.reddit.com/r/pennystocks/comments/81bwjl/ascm/
4,MGCLF,81egmo,dbodeenisudm,https://www.reddit.com/r/pennystocks/comments/81egmo/mgclf/,5,12,"Base exchange is Australia.
Pharmaceutical Cannabis play; off the shelf cannabis beauty products and sells raw cannabis material.
Their facility in Slovenia where their material comes from has interim GMP.
Any thoughts?
Around 100 million market cap.  ",2018-03-02,https://www.reddit.com/r/pennystocks/comments/81egmo/mgclf/
5,Global markets down,81e2ix,ryoon21,https://www.reddit.com/r/pennystocks/comments/81e2ix/global_markets_down/,2,0,Get ready for another fun day of losses. Wait to see where stocks bottom out before buying in. ,2018-03-02,https://www.reddit.com/r/pennystocks/comments/81e2ix/global_markets_down/
6,DEAC,81dttm,[deleted],https://www.reddit.com/r/pennystocks/comments/81dttm/deac/,1,1,[deleted],2018-03-02,https://www.reddit.com/r/pennystocks/comments/81dttm/deac/
7,"TICKER ABIO BIOTECH will go up 16xtimes UR investment READ THIS ARTICLE, CAME OUT TODAY BUY AND HOLD ABIO https://www.analystrecommendation.com/2018/03/01/arca-biopharma-inc-abio-stock-price-expected-to-reach-at-16-5-in-next-52-week/",81fl2t,NEWYEARTIP,https://www.reddit.com/r/pennystocks/comments/81fl2t/ticker_abio_biotech_will_go_up_16xtimes_ur/,1,0,[removed],2018-03-02,https://www.reddit.com/r/pennystocks/comments/81fl2t/ticker_abio_biotech_will_go_up_16xtimes_ur/
8,Long Term Holds everyone?,81fhpl,pickpocketgnomes,https://www.reddit.com/r/pennystocks/comments/81fhpl/long_term_holds_everyone/,1,0,[removed],2018-03-02,https://www.reddit.com/r/pennystocks/comments/81fhpl/long_term_holds_everyone/
9,Google Alerts setup?,81f4y9,Wasabi786,https://www.reddit.com/r/pennystocks/comments/81f4y9/google_alerts_setup/,13,2,"I've seen people mention here and there, that they have google alerts setup. 

Would anyone be willing to share their setup (Search queries)?",2018-03-02,https://www.reddit.com/r/pennystocks/comments/81f4y9/google_alerts_setup/
10,RXMD,81f4gr,rektamo,https://www.reddit.com/r/pennystocks/comments/81f4gr/rxmd/,8,10,Thank you for the bump while everything continues to crash ,2018-03-02,https://www.reddit.com/r/pennystocks/comments/81f4gr/rxmd/
11,How do you guys feel about VTNL?,81f3ee,Giodan1026,https://www.reddit.com/r/pennystocks/comments/81f3ee/how_do_you_guys_feel_about_vtnl/,4,13,[VTNL] (https://www.google.com/search?q=vtnl&amp;rlz=1C1CHFX_enUS699US699&amp;oq=vtnl&amp;aqs=chrome..69i57j69i61j0l4.1151j0j1&amp;sourceid=chrome&amp;ie=UTF-8),2018-03-02,https://www.reddit.com/r/pennystocks/comments/81f3ee/how_do_you_guys_feel_about_vtnl/
12,RXMD Blockbuster M&amp;A news going parabolic,81enhx,jeahh,https://www.reddit.com/r/pennystocks/comments/81enhx/rxmd_blockbuster_ma_news_going_parabolic/,1,0,[removed],2018-03-02,https://www.reddit.com/r/pennystocks/comments/81enhx/rxmd_blockbuster_ma_news_going_parabolic/
13,SVSN P&amp;D,81emo4,Senecany,https://www.reddit.com/r/pennystocks/comments/81emo4/svsn_pd/,9,9,"On Market open the stock was just pumped 50,000 shares 80% over open price.   

That pump happened because good news was released this morning.

All pump and dumps start with a buy significantly over current stock price to make people think the stock is shooting up.

Let's see what happens

I own 0 shares


Edit: its 9:54 and at 309%..... Just saying I completely called this....
400%

536% holy.....

10:09 am. 709%......  &gt;.&lt;",2018-03-02,https://www.reddit.com/r/pennystocks/comments/81emo4/svsn_pd/
14,$AKER Grab some before Monday’s highly anticipated FDA announcement. .70 cents range is a gift.,81gfb3,Laker_Gev,https://www.reddit.com/r/pennystocks/comments/81gfb3/aker_grab_some_before_mondays_highly_anticipated/,38,70,,2018-03-02,https://www.reddit.com/r/pennystocks/comments/81gfb3/aker_grab_some_before_mondays_highly_anticipated/
15,CEI Dropping under .10,81g8kt,ritedamian,https://www.reddit.com/r/pennystocks/comments/81g8kt/cei_dropping_under_10/,1,16,"Hi, new to stocks so I was wondering if in the case, which is very likely, this stock goes under .10 if I should buy here. Mostly in hopes it gets back to .11 or more but I heard it may be nearing its downfall as well. Thoughts?",2018-03-02,https://www.reddit.com/r/pennystocks/comments/81g8kt/cei_dropping_under_10/
16,"March 02, 2018 Tomorrow's Daily /r/Pennystocks Discussion - What are your Friday / weekend plays?",81g8aw,AutoModerator,https://www.reddit.com/r/pennystocks/comments/81g8aw/march_02_2018_tomorrows_daily_rpennystocks/,2,5,"Please use this thread to discuss your plays of the day!

Since this thread is likely to fill up quickly, consider sorting the comments by ""new"" (instead of ""best"" or ""top"") to see the newest posts.
",2018-03-02,https://www.reddit.com/r/pennystocks/comments/81g8aw/march_02_2018_tomorrows_daily_rpennystocks/
17,Grab some $CRUOF - Rockshield Capital Corp. CSE: RKS.c,81hp7s,Laker_Gev,https://www.reddit.com/r/pennystocks/comments/81hp7s/grab_some_cruof_rockshield_capital_corp_cse_rksc/,13,9,Currently trading at 0.35 cents range.  This is going to be a nice pick up once $TGOD goes public.  You're welcome.,2018-03-02,https://www.reddit.com/r/pennystocks/comments/81hp7s/grab_some_cruof_rockshield_capital_corp_cse_rksc/
18,CPTO.V Crypto Global. Liking the look of this,81h0y8,nightmancommeth,https://www.reddit.com/r/pennystocks/comments/81h0y8/cptov_crypto_global_liking_the_look_of_this/,4,4,Brand new to the market and now seems to have found its place. has now secured a bunch of funding and is buying out other blockchain companies. I threw 1k at it to see what happens. ,2018-03-02,https://www.reddit.com/r/pennystocks/comments/81h0y8/cptov_crypto_global_liking_the_look_of_this/
19,Anyone have input on $DCTH? I bought 60K at .017. Can’t decide if I did the right thing or not. Input?,81jh8b,Jimbonola,https://www.reddit.com/r/pennystocks/comments/81jh8b/anyone_have_input_on_dcth_i_bought_60k_at_017/,1,0,[removed],2018-03-02,https://www.reddit.com/r/pennystocks/comments/81jh8b/anyone_have_input_on_dcth_i_bought_60k_at_017/
