,author,id,url,score,text,date
0,Eminem_8_mile,dwvzw0d,/r/pennystocks/comments/8a5ey9/betteru_btru_100m_financing_update/dwvzw0d/,1,Where did you pull the 3$usd number from,2018-04-06
1,DavidBingle,dww0uh6,/r/pennystocks/comments/8a5ey9/betteru_btru_100m_financing_update/dww0uh6/,1,I pulled it from here: https://globenewswire.com/news-release/2018/02/13/1340275/0/en/UPDATE-betterU-Education-Corporation-Signs-Definitive-Agreement-and-Provides-Update-on-100-Million-Investment.html,2018-04-06
2,humbletradesman,dww38gl,/r/pennystocks/comments/8a5ey9/betteru_btru_100m_financing_update/dww38gl/,1,Lol,2018-04-06
3,buzyninja,dww4zj9,/r/pennystocks/comments/8a5ey9/betteru_btru_100m_financing_update/dww4zj9/,1,Lol,2018-04-06
4,stopitseagulls,dww7fk7,/r/pennystocks/comments/8a6an7/hypersolar_inc/dww7fk7/,1,Hell yeah. Bitch is gonna run. ,2018-04-06
5,stopitseagulls,dww7goe,/r/pennystocks/comments/8a6an7/hypersolar_inc/dww7goe/,1,They've got some great tech. Not the best short term bet though.  ,2018-04-06
6,PaperPlait,dwwszn3,/r/pennystocks/comments/8a99ui/andi_phone_release_date_out/dwwszn3/,1,"I like these guys, but just like most other companies, they are in the very early stages of development, so much so that I can't even see any actual products, ideas, or plans in general.

Keep an eye on them, and an ear to their news. Otherwise, simply watching.",2018-04-06
7,dlipseir,dwwts9m,/r/pennystocks/comments/8a99ui/andi_phone_release_date_out/dwwts9m/,1,"bro did you see what i posted? product is coming out 4/10. it already hit a penny from 88 in the first 2 min of open....
",2018-04-06
8,PaperPlait,dwwtw84,/r/pennystocks/comments/8a99ui/andi_phone_release_date_out/dwwtw84/,1,I honestly don't know how I looked right over it. I guess I was too enthralled with the NASA-esque instagram,2018-04-06
9,BigNasty817,dwwuf6s,/r/pennystocks/comments/8a99ui/andi_phone_release_date_out/dwwuf6s/,1,This is awesome! I got lucky and bought a shit ton(actual measurement) of shares when it was about .003. ,2018-04-06
10,leorapture,dwww1t1,/r/pennystocks/comments/8a99ui/andi_phone_release_date_out/dwww1t1/,1,Pretty huge that they came through like they said they would. Seems legit. ,2018-04-06
11,dlipseir,dwwz32p,/r/pennystocks/comments/8a99ui/andi_phone_release_date_out/dwwz32p/,1, Def are hense why I've been averaging down all the way to. 005. I posted about andi on here a while ago and people basically called me crazy and screamed scam. That's okay I'll be laughing to the bank,2018-04-06
12,leorapture,dwwz8y5,/r/pennystocks/comments/8a99ui/andi_phone_release_date_out/dwwz8y5/,2,I posted about them yesterday and it attracted mixed critics. This recent activity should silence a few naysayers. ,2018-04-06
13,Schrodingers-Tendies,dwx1pke,/r/pennystocks/comments/8a9z2w/how_to_buy_penny_stocks/dwx1pke/,1,"Penny stocks and getting good money after a few decades.

Name a worse combo? 

I’ll start: Cobain and Shotguns",2018-04-06
14,Kokid3g1,dwx2sxa,/r/pennystocks/comments/8a99ui/andi_phone_release_date_out/dwx2sxa/,1,"I tripled my original amount of shares I owned of ANDI  just this last week while they were being hammered.

I don't get to *be one of those guys, (savant traders) * very often.

FEELS GOOD!!! ",2018-04-06
15,Kokid3g1,dwx3hkk,/r/pennystocks/comments/8a9zm6/just_sold_my_cryo_shares_for_a_healthy_profit/dwx3hkk/,2,"The buzz right now is ANDI.


http://www.utopya.co/",2018-04-06
16,HodlGang_HodlGang,dwx3wnq,/r/pennystocks/comments/8a9z2w/how_to_buy_penny_stocks/dwx3wnq/,1,"OP also mentioned,

Penny stocks and Investing 

Per your question. No RH is the only broker around that offers free trading. With only a few hundred they’re probably your best bet. 

I’m wondering if you only ask for an alternative because RH isn’t availability in the Himalayas?",2018-04-06
17,L0S027,dwx4bep,/r/pennystocks/comments/8aanoo/alert_to_make/dwx4bep/,1,"I bought 11 shares  at .517, I hope I goes up",2018-04-06
18,DanTheMan12-1994,dwx4hge,/r/pennystocks/comments/8aanoo/alert_to_make/dwx4hge/,1,Would be great if they had more patients in the trial and it showed a little more superior to metoprolol ,2018-04-06
19,dvrryck,dwx4ta3,/r/pennystocks/comments/8a99ui/andi_phone_release_date_out/dwx4ta3/,1,"If big market was green this would’ve blasted, but everything is red ",2018-04-06
20,DanTheMan12-1994,dwx5yh9,/r/pennystocks/comments/8aaxy9/lrdr_up_2000_since_i_bought_at_001_reinstatement/dwx5yh9/,1,"Question new on this penny stock, what app do you use for OTC stocks similar to robinhood",2018-04-06
21,queenslandbananas,dwx5zxw,/r/pennystocks/comments/8aaxy9/lrdr_up_2000_since_i_bought_at_001_reinstatement/dwx5zxw/,1,"Looks pretty overvalued now, I would stay away.",2018-04-06
22,1827338989,dwx7xg3,/r/pennystocks/comments/8a9z2w/how_to_buy_penny_stocks/dwx7xg3/,1,These aren’t investments lol ,2018-04-06
23,bulletbutton,dwx8b9x,/r/pennystocks/comments/8aanoo/alert_to_make/dwx8b9x/,1,"""as soon as FDA approval comes""

I've heard that before... AKER...BPMX...XXII.. LOL",2018-04-06
24,helloimflag,dwx8m28,/r/pennystocks/comments/8aanoo/alert_to_make/dwx8m28/,1,Yeah i sold out of XXII shit looks dead. This one looks alright though,2018-04-06
25,sensicle,dwxcici,/r/pennystocks/comments/8aaxy9/lrdr_up_2000_since_i_bought_at_001_reinstatement/dwxcici/,1,People said that at 005. I never listen. I guess I'm stubborn that way. ;),2018-04-06
26,sensicle,dwxcjo9,/r/pennystocks/comments/8aaxy9/lrdr_up_2000_since_i_bought_at_001_reinstatement/dwxcjo9/,1,E-Trade only. Best platform for OTC. ,2018-04-06
27,OriginalEmu7,dwxcmyw,/r/pennystocks/comments/8aaxy9/lrdr_up_2000_since_i_bought_at_001_reinstatement/dwxcmyw/,1,Yea I agree way too overvalued to buy in now,2018-04-06
28,Morsyn,dwxcn1s,/r/pennystocks/comments/8aaxy9/lrdr_up_2000_since_i_bought_at_001_reinstatement/dwxcn1s/,2,"Hello, where did you find that Joseph Arcaro was involved with WSML as well? Can I please have more information on this. Thanks in advance. Also, that float is not accurate.",2018-04-06
29,OriginalEmu7,dwxcspu,/r/pennystocks/comments/8aanoo/alert_to_make/dwxcspu/,1,"stop reposting about the same thing, NO ONE BUY THIS STOCK based on this guy. If u do ur own DD and find out whatever go for it please don't buy based off this post",2018-04-06
30,OriginalEmu7,dwxcwae,/r/pennystocks/comments/8a9z2w/how_to_buy_penny_stocks/dwxcwae/,1,"No there is nothing similar to Robinhood, and you won't get good money after a penny stock ""investment"". Penny stocks are meant to be traded for a week at max",2018-04-06
31,rcunknown47,dwxd3lv,/r/pennystocks/comments/8aanoo/alert_to_make/dwxd3lv/,1,Saw this post on StockTwits lol,2018-04-06
32,sensicle,dwxdl8n,/r/pennystocks/comments/8aaxy9/lrdr_up_2000_since_i_bought_at_001_reinstatement/dwxdl8n/,2,"Can you provide info that the float isn't accurate? Looking at L2, it trades sooo thin that it's gotta be close. Either way it's a ridiculously low floater because it moves on air. 

I got the Arcaro info on ihub on the LRDR board.",2018-04-06
33,DanTheMan12-1994,dwxdxgy,/r/pennystocks/comments/8aaxy9/lrdr_up_2000_since_i_bought_at_001_reinstatement/dwxdxgy/,1,Thanks,2018-04-06
34,Morsyn,dwxfn7j,/r/pennystocks/comments/8aaxy9/lrdr_up_2000_since_i_bought_at_001_reinstatement/dwxfn7j/,1,"Oh I absolutely agree it is a low float, it looks very clean and I am interested. I was just saying that number was reported on OTC in 2015 from its previous shell. Unfortunately, we won't know until they file. 


I was looking on the WSML boards and didn't see his name mentioned anywhere.",2018-04-06
35,Rich_Foamy_Flan,dwxftrn,/r/pennystocks/comments/8aanoo/alert_to_make/dwxftrn/,1,Pumperrrrrr,2018-04-06
36,Rich_Foamy_Flan,dwxfvhy,/r/pennystocks/comments/8aanoo/alert_to_make/dwxfvhy/,3,When commissions cost more than stock,2018-04-06
37,Morsyn,dwxgbqc,/r/pennystocks/comments/8aaxy9/lrdr_up_2000_since_i_bought_at_001_reinstatement/dwxgbqc/,1,"So.. throw CYPE and AXMP in there too as plays of us that are rapidly climbing, the latter of which seems to be mid pump. Weird as fuck, but this might be huge money opportunities. I'm looking into AXMP as well now.",2018-04-06
38,queenslandbananas,dwxhgh5,/r/pennystocks/comments/8aaxy9/lrdr_up_2000_since_i_bought_at_001_reinstatement/dwxhgh5/,1,"Even more people will say it when it's at its peak. As a general rule, people are wrong about such things.",2018-04-06
39,himalayan_pride,dwxhl0r,/r/pennystocks/comments/8a9z2w/how_to_buy_penny_stocks/dwxhl0r/,1,"Thanks for your answers. Looks like I misunderstood the penny stocks. 
",2018-04-06
40,himalayan_pride,dwxhqnu,/r/pennystocks/comments/8a9z2w/how_to_buy_penny_stocks/dwxhqnu/,1,"Thank you for the answer. Though I’m from himalayas, i am in the area where i can invest freely. The only thing i want is invest few thousand dollars in startup company or any company with future prospects. And check back my money after a decade or so",2018-04-06
41,TheCaIifornian,dwxj6mi,/r/pennystocks/comments/8aaxy9/lrdr_up_2000_since_i_bought_at_001_reinstatement/dwxj6mi/,0,I don’t trust you purely based off of your weird decimal placement. ,2018-04-06
42,sensicle,dwxk7ao,/r/pennystocks/comments/8aaxy9/lrdr_up_2000_since_i_bought_at_001_reinstatement/dwxk7ao/,1,"Since we're in the penny stock sub, it's generally accepted that we're referring to stocks under $1 and often under a penny. The period at the end (not decimal) was to finish the sentence ending with 001, ""double oh one"", or a tenth of a penny. 

I figured it was implied. I didn't want to put ""0.001."" because I didn't want the period *and* decimal although on second thought, perhaps I should have. ",2018-04-06
43,TheCaIifornian,dwxktrg,/r/pennystocks/comments/8aaxy9/lrdr_up_2000_since_i_bought_at_001_reinstatement/dwxktrg/,1,"According to [the SEC](https://www.sec.gov/fast-answers/answerspennyhtm.html):

&gt; The term ""penny stock"" generally refers to a security issued by a very small company that trades at less than $5 per share. Penny stocks generally are quoted over-the-co

But if the general consensus here is anything under $1 I can see how that makes sense. ",2018-04-06
44,italiangreenbeans,dwxomdp,/r/pennystocks/comments/8aanoo/alert_to_make/dwxomdp/,1,howtolosemoneyevenifthestockgoesup.jpg,2018-04-06
45,Kokid3g1,dwxp7f6,/r/pennystocks/comments/8a99ui/andi_phone_release_date_out/dwxp7f6/,1,So now this is being down voted? We're up 82%today. Friggin bashers never quit... ,2018-04-06
46,fidguru,dwxr94t,/r/pennystocks/comments/8a9z2w/how_to_buy_penny_stocks/dwxr94t/,1,Research. Research. Research. More research. Paper trade. Paper trade. Paper trade. More paper trading. Save a couple grand. Then trade real money.,2018-04-06
47,himalayan_pride,dwxsnb9,/r/pennystocks/comments/8a9z2w/how_to_buy_penny_stocks/dwxsnb9/,1,"Research: that I’m doing in natural sciences and not in stocks, which i will do when i have enough time. Could you please elaborate what specifically you are inferring saying paper trade( I understand it is traditional way of buying n selling)?",2018-04-06
48,himalayan_pride,dwxsoav,/r/pennystocks/comments/8a9z2w/how_to_buy_penny_stocks/dwxsoav/,1,What are these?,2018-04-06
49,rugby_shirt,dwxvlch,/r/pennystocks/comments/8adywy/how_much_does_it_cost_to_create_a_pink_slip_otc/dwxvlch/,1,500 to 1mil,2018-04-06
50,JsadkinsAtWork,dwxwk58,/r/pennystocks/comments/8aaxy9/lrdr_up_2000_since_i_bought_at_001_reinstatement/dwxwk58/,1,"Love eTrade, I put the Stand alone platform (the one called eTrade, not open house) on a little chromebook knock-off. I wake up in time to do my DD and start the day on a little thing small enough to work as my desk side alarm clock. It's the life. ",2018-04-06
51,SanDiegoDads,dwxwpid,/r/pennystocks/comments/8adywy/how_much_does_it_cost_to_create_a_pink_slip_otc/dwxwpid/,1,legalzoom.com should have the info you're looking for. What kinda scam are you trying to push? I know a place with a bunch of suckers who will buy your pink sheets...,2018-04-06
52,this__fuckin__guy,dwxxp07,/r/pennystocks/comments/8adywy/how_much_does_it_cost_to_create_a_pink_slip_otc/dwxxp07/,1,"I got pink sheets, pink socks, pink shirts you can too! Just add 1 new red shirt to your whites during washing.",2018-04-06
53,danparker276,dwxzm5r,/r/pennystocks/comments/8adywy/how_much_does_it_cost_to_create_a_pink_slip_otc/dwxzm5r/,1,"Some are legit, I'm just interested to see if it's a worth while option vs VC investors, or I just tell my VC investors to buy the OTC because they want more liquidity (assuming that there would be liquidity in this one if done right)",2018-04-06
54,RemedialStudent,dwxzvhy,/r/pennystocks/comments/8a6an7/hypersolar_inc/dwxzvhy/,1,"Tech looks promising, I'm holding on long term.  ",2018-04-06
55,kgcolbyiii,dwy323p,/r/pennystocks/comments/8aaxy9/lrdr_up_2000_since_i_bought_at_001_reinstatement/dwy323p/,1,Sounds like you're trying to bring a potential stock down because you didn't hop on early. Always sore losers naysaying ,2018-04-06
56,queenslandbananas,dwy48hl,/r/pennystocks/comments/8aaxy9/lrdr_up_2000_since_i_bought_at_001_reinstatement/dwy48hl/,1,I'm not trying to bring a stock down; I certainly don't have that power. I'm just pointing out that the valuation is extremely rich right now.,2018-04-06
57,-AC-,dwy6sc7,/r/pennystocks/comments/8aaxy9/lrdr_up_2000_since_i_bought_at_001_reinstatement/dwy6sc7/,1,Yes because his single post on this reddit is going to bring the value of this stock crashing down...,2018-04-06
58,CanSomeSlam,dwy74q9,/r/pennystocks/comments/8aaxy9/lrdr_up_2000_since_i_bought_at_001_reinstatement/dwy74q9/,1,"market cap 55 million, no thanks",2018-04-06
59,84fishforce,dwyabo4,/r/pennystocks/comments/8a9z2w/how_to_buy_penny_stocks/dwyabo4/,1,"Hey bud. You seem like a genuine person and I saw your post this morning but had to run to work before I could try to help you out a bit. I'm actually a complete and total beginner that just started looking into this stuff less than a week ago, but based on your questions I feel qualified enough to at least help steer your mindset in a more proper direction than it's at right now.

To answer this immediate question: Penny stocks aren't typically seen as ""investments"" because they're extremely volatile (prone to drastic movements up and down and generally risky). They aren't like your typical ""blue chip"" stocks (look this up if you don't know what that means, because it sounds like that might be closer to what you're looking for) which you can feel relatively safe investing money in over a longer period of time because they likely won't go under overnight. You can ""set and forget"" these kinds of stocks more than penny stocks. Penny stocks can go up 100% one week (or day) and then down 100% the next. This kind of thing won't happen with Disney or Apple. Of course, the volatility is part of the allure of penny stocks because you can double your money way more quickly than you ever could with a blue chip stock... or you could lose all of it if you make a bad decision out of greed/cockiness/stupidity.

You also asked someone else what they meant by ""paper trading"", and this basically means practicing with fake money until you develop a strategy for a long time before feeling confident enough to ""go live"" and use your real money. Some people don't do this and instead choose to use real money but on a small, SMALL scale to make themselves feel the psychological and emotional aspects that come with standing to gain or lose real money. Generally though you'll be advised to paper trade for at least a year of positive gains, and even then, nothing is ever guaranteed and you will likely still be on the losing side a lot of the time. It's just part of the game. From what I've read, the smartest way to play it is to only invest what you're comfortable with losing completely, and even then, get out once you've made 10-30% back (and ideally you'll be on the winning side 6/10 times, for starters).

You also mentioned that you don't have much time to invest into this, and unfortunately, that's a surefire way to lose all of your money and you might as well be gambling at a casino at that point. This does take a ton of time, a ton of reading, and a ton of practice before you can start making money without it being thanks to luck (and, again, you will likely still lose a lot or most of it at the beginning).

Finally, be extremely careful with listening to people that try to recommend or talk about penny stocks online. Most of them have a hidden agenda and are trying to manipulate you in one way or another (look up ""pump and dump"" for a further explanation). They tell you ""This company is the next Google and is guaranteed to explode 1000% overnight! Become a millionaire and buy today before it's too late!"" so the price gets driven up, and then they sell their shares once you've pumped it up for them (and lost your money in the process). I'm simplifying it, but look into it.

Anyway, this is one of the longest posts I've ever written but I feel as though you might get easily swindled if you're not careful so I felt obligated to try to help you out. I'm gonna go back to researching my ass off as much as possible. Best of luck, friend.",2018-04-06
60,vegan-weirdo,dwybqk0,/r/pennystocks/comments/8adywy/how_much_does_it_cost_to_create_a_pink_slip_otc/dwybqk0/,1,"He's asking about the cost set up, not the  projected market cap . ",2018-04-06
61,No_Travel_Blog_Here,dwydbk3,/r/pennystocks/comments/8aaxy9/lrdr_up_2000_since_i_bought_at_001_reinstatement/dwydbk3/,1,"You're trying to predict things. You should only be reacting. You never buy and hold BEFORE news or in anticipation of news.

And you're not going to like it when this garbage stock goes plummeting...as it will...as the overwhelming majority of all these always do.",2018-04-06
62,xonix_digital,dwydek3,/r/pennystocks/comments/8a99ui/andi_phone_release_date_out/dwydek3/,1,"I hated this stock and was tired of hearing about it from OP (lol). But I popped on it near the floor and have made a killing in the last couple days.

Beers on me OP! 🤑",2018-04-06
63,Ragefan66,dwyfsz2,/r/pennystocks/comments/8aaxy9/lrdr_up_2000_since_i_bought_at_001_reinstatement/dwyfsz2/,1,"Lmao if you think the people of RH can manipulate the stock price in any way lmao. Get outta here with that bullshit, just because he thinks its a risky investment doesn't mean he's a sore soi boy. ",2018-04-06
64,sensicle,dwyfwab,/r/pennystocks/comments/8aaxy9/lrdr_up_2000_since_i_bought_at_001_reinstatement/dwyfwab/,1,"You're not making predictions? Your prediction is it will fail. Don't make predictions BEFORE you know what company will be merged into the shell and most certainly without doing a single minute of research, for if you did, you'd know that Arcaro has a perfect track record in reverse mergers - all of which fucking fly after being reinstated. 

So without knowing jack shit about the company, you're predicting that it can't hit 5 cents? 10 cents? Even more? Go ahead. Predict what you will and I'll do the same. My money's staying put... for now. ",2018-04-06
65,kgcolbyiii,dwygb8u,/r/pennystocks/comments/8aaxy9/lrdr_up_2000_since_i_bought_at_001_reinstatement/dwygb8u/,1,More like people with that negative crybaby attitude will expose negative emotions on a stock. When some ones doing reading on opinions through google,2018-04-06
66,No_Travel_Blog_Here,dwygnjn,/r/pennystocks/comments/8aaxy9/lrdr_up_2000_since_i_bought_at_001_reinstatement/dwygnjn/,1,"&gt;Your prediction is it will fail.

The odds are overwhelmingly in the favor that the stock will FAIL. Period. Over 95% probability this stock will go to *zero*. 

What is astounding, is that you have fallen into the trap of yet another sucker who thinks the fundamentals of a garbage penny stock are good enough to SKY ROCKET you to riches with your tiny initial sub-penny investment. 

That's ludicrous and it's moronic and it's downright *stupid*. It really does make you a verifiable sucker. You're essentially the same type of person who falls for a boiler room scam. 

&gt;on't make predictions BEFORE you know what company will be merged into the shell and most certainly without doing a single minute of research, for if you did, you'd know that Arcaro has a perfect track record in reverse mergers - all of which fucking fly after being reinstated.

Here's how you make money on penny stocks - you REACT to news and volume and blatant pumps by the company. 

Earnings come out (good or bad doesn't matter) - what happens to the volume and stock price? Volume jumps up? Great - make a trade in and out the same day and walk away with a nice 50% gain. 

Rumors of deals and mergers and contracts come out? REACT to what happens to the stock - make a nice 30% to 50% gain - and get the fuck out. 

Company CEO releases yet another press release with ""GREAT NEWS!"" which is all baseless forward-thinking statements? Does that cause the stock to spike (as it is a blatant pump)? Great - take the meat of the move and get out. 

In other words - THE FUNDAMENTALS DON'T MATTER. 

But because you're a sucker you actually BELIEVE this horeshit. 

Worse yet - you're bagholding all the rumors and pumps. 

So when the rumors inven end up not panning out - you're fucked. You're just another starry-eyed bag-holder that got suckered into another trash penny stock - you're a statistic. 

When the FDA doesn't approve that thing...when the rumor doesn't pan out...when that deal turned out to be a pump...when that contract falls through. 

You're fucked, you're fucked, **YOU'RE FUCKED!**

You are not different. You are just like every other sucker who loses all their money on these garbage stocks. 

Because you're making all of the token wrong decisions. 

&gt;So without knowing jack shit about the company, you're predicting that it can't hit 5 cents? 10 cents? Even more? Go ahead. Predict what you will and I'll do the same. My money's staying put... for now.

WHO THE FUCK CARES!?

I don't give a flying fuck if it hits $100. I DON'T predict I **react**.

Which is what you should be doing. But you're not - you're bagholding and you think you're the .0001% of people who isn't going to be fucked by it.

&gt;I'm going with what the judge who signed off on it said: that it's a very real and attractive package. Judges don't generally sing praise. Something worthy appears to be forming here.

That doesn't actually **mean* *ANYTHING*. 

You're just falling into trap after trap after trap. 

I guess I'm just kind of astounded that you don't see it. That you jumped into this world without doing any research on the stupid mistakes everybody else makes. 

Either that or you read about all the stupid mistakes everybody else notoriously makes with penny stocks (believing fundamentals, buying on pumped news, bagholding ""to the moon!"" and more) and you decided to do it anyway. ",2018-04-06
67,timmerity,dwygtt5,/r/pennystocks/comments/8aaxy9/lrdr_up_2000_since_i_bought_at_001_reinstatement/dwygtt5/,1,This is great advice. I'm saving this to refer to later. ,2018-04-06
68,-AC-,dwyoas6,/r/pennystocks/comments/8aaxy9/lrdr_up_2000_since_i_bought_at_001_reinstatement/dwyoas6/,1,Again... one person's opinion on reddit is not changing anything,2018-04-06
69,kgcolbyiii,dwys2vb,/r/pennystocks/comments/8aaxy9/lrdr_up_2000_since_i_bought_at_001_reinstatement/dwys2vb/,1,It's a domino effect.  It's been proven people are sheeple. False info spreads rapidly because people don't DD and spend the time reading. People do a 5minute quick glance and call it done.,2018-04-06
70,[deleted],dwyt5qz,/r/pennystocks/comments/8a9z2w/how_to_buy_penny_stocks/dwyt5qz/,1,[removed],2018-04-06
71,sensicle,dwyuywt,/r/pennystocks/comments/8aaxy9/lrdr_up_2000_since_i_bought_at_001_reinstatement/dwyuywt/,1,"I understand you're pissed. You did have a chance to get in when I first mentioned it. See you at 3 cents. Then I'll check back in again at 5. If you want me to stop after that, I might. But if it goes to 10, I'll have to remind you of this conversation one more time. 

This isn't my first rodeo, homeboy. I've made a couple hundred thousand dollars trading just penny stocks over the years. ",2018-04-06
72,-AC-,dwyv57j,/r/pennystocks/comments/8aaxy9/lrdr_up_2000_since_i_bought_at_001_reinstatement/dwyv57j/,1,Smh... ok if you say so... so how much did his post cost you? ,2018-04-06
73,sensicle,dwyvh6x,/r/pennystocks/comments/8aaxy9/lrdr_up_2000_since_i_bought_at_001_reinstatement/dwyvh6x/,1,"&gt;WHO THE FUCK CARES!?

&gt;I don't give a flying fuck if it hits $100. I DON'T predict I **react**.

&gt;I  money from your silly decisions and short you on the way down.

First of all, you obviously CARE quite a bit about saving me from a ""mistake"". Look at at that wall of text, dude! I'm very flattered that your concern for my money runs so very deep and is personal to you. So personal, in fact, that you were willing to put *that* much effort into telling me I'm wrong. Impressive, but reeks of regret. 

You don't care if it hits $100? Fucking idiot. Yeah you do. If it hit $100, even just $1, you'd have been so very wrong in your criticism of my investment that you'd never show your face around me again (figure of speech, you're really just a bitter Internet stranger that missed out on 100% gains when I alerted this). Meanwhile, if it hit $1 I'd be balling so hard I'd have to wonder which luxury SUV to buy for my wife.

You short penny stocks? Sure, buddy. Sure. ",2018-04-06
