,author,id,url,score,text,date
0,queenslandbananas,dvpyrb9,/r/pennystocks/comments/84j5ab/what_are_some_penny_stocks_that_are_just_taking/dvpyrb9/,1,"If they are taking off now, it is already too late.",2018-03-15
1,OneLegAtaTimeTheory,dvpyrid,/r/pennystocks/comments/84j5ab/what_are_some_penny_stocks_that_are_just_taking/dvpyrid/,1,YTEN up 73% today.  Have no idea what it’s going to do tomorrow tho.  ,2018-03-15
2,78z1r,dvpyyl3,/r/pennystocks/comments/84j5ab/what_are_some_penny_stocks_that_are_just_taking/dvpyyl3/,1,DDB did well today ,2018-03-15
3,Luffykyle,dvpz3nw,/r/pennystocks/comments/84j5ab/what_are_some_penny_stocks_that_are_just_taking/dvpz3nw/,1,Aker,2018-03-15
4,Luffykyle,dvpz3xu,/r/pennystocks/comments/84j5ab/what_are_some_penny_stocks_that_are_just_taking/dvpz3xu/,1,Basically ,2018-03-15
5,avaldez321,dvpzi7w,/r/pennystocks/comments/84j5ab/what_are_some_penny_stocks_that_are_just_taking/dvpzi7w/,1,$Deez,2018-03-15
6,1827338989,dvq0u86,/r/pennystocks/comments/84j5ab/what_are_some_penny_stocks_that_are_just_taking/dvq0u86/,1,"$AYTU biotech heating up for sure, trend reversal today off bottom.",2018-03-15
7,SRT64,dvq35j5,/r/pennystocks/comments/84j5n4/what_apps_can_be_used_to_buy_pennystocks_in_europe/dvq35j5/,1,Etoro ,2018-03-15
8,Boots-n-Bell,dvq4hl7,/r/pennystocks/comments/84j5ab/what_are_some_penny_stocks_that_are_just_taking/dvq4hl7/,1,DFFN. Watching for a nice gap fill end of this week or early next. ,2018-03-15
9,stb_running,dvq7uoh,/r/pennystocks/comments/84j5ab/what_are_some_penny_stocks_that_are_just_taking/dvq7uoh/,1,RIBT. It's been taking off for a while but huge changes have been made in the last two quarters. Had a huge run up today and have earnings tomorrow. Been in since .91.,2018-03-15
10,[deleted],dvq8miu,/r/pennystocks/comments/84j5ab/what_are_some_penny_stocks_that_are_just_taking/dvq8miu/,1,[removed],2018-03-15
11,rentedred1,dvqeil9,/r/pennystocks/comments/84j5ab/what_are_some_penny_stocks_that_are_just_taking/dvqeil9/,1,"SNMX, good Q4 reports. As well road map is looking solid. No extreme gains like RAS, but mostly positive here till mid 2018 ",2018-03-15
12,SiebeSch,dvqf3ab,/r/pennystocks/comments/84j5n4/what_apps_can_be_used_to_buy_pennystocks_in_europe/dvqf3ab/,1,I use degiro (low fees) and lynx ,2018-03-15
13,Mzuppardo007,dvqfliq,/r/pennystocks/comments/84j5ab/what_are_some_penny_stocks_that_are_just_taking/dvqfliq/,1,JETMF and ONCS,2018-03-15
14,dlipseir,dvqfrvg,/r/pennystocks/comments/84j5ab/what_are_some_penny_stocks_that_are_just_taking/dvqfrvg/,1,$TNKE $UHLN $LIBE,2018-03-15
15,bdog66656,dvqigsa,/r/pennystocks/comments/84ltt5/alberta_partial_upgrading_bshv/dvqigsa/,1,How long are you planning to hold this trade for? ,2018-03-15
16,Ravikiranvaranasi,dvqj11r,/r/pennystocks/comments/84ltt5/alberta_partial_upgrading_bshv/dvqj11r/,1,They were last traded on 5th March...it seems it is halted atm,2018-03-15
17,AustralianNole,dvqk0xa,/r/pennystocks/comments/84lnpv/tnke_moon/dvqk0xa/,1,"Noob question. I apologize because this probably isn't the best place to ask, but I'll trade down votes for answers. -- Currently Robinhood, where do I go to trade pennystocks?",2018-03-15
18,dlipseir,dvqkimk,/r/pennystocks/comments/84lnpv/tnke_moon/dvqkimk/,1,E-Trade or TDAmeritrade are 2 options. Most OTC and pennies are not on RobinHood,2018-03-15
19,JulyOf98,dvqkkcr,/r/pennystocks/comments/84lnpv/tnke_moon/dvqkkcr/,1,"Do you really believe itll pop? What would your personal selling point be? It's back down around 
.002ish",2018-03-15
20,SRT64,dvqkmo9,/r/pennystocks/comments/84ltt5/alberta_partial_upgrading_bshv/dvqkmo9/,1,A month or so ,2018-03-15
21,dlipseir,dvqm1gx,/r/pennystocks/comments/84lnpv/tnke_moon/dvqm1gx/,1,Its at 25 at open. im not selling for anything less than 3 but prob holding for more. i was in at .0017. merger was pretty big news,2018-03-15
22,dlipseir,dvqn2a6,/r/pennystocks/comments/84lnpv/tnke_moon/dvqn2a6/,1,"just hit .0048 :)
",2018-03-15
23,Deli-Man-Dan,dvqohtx,/r/pennystocks/comments/84lnpv/tnke_moon/dvqohtx/,1,I got in at .0025. already up ,2018-03-15
24,SketchyCharmander,dvqot2g,/r/pennystocks/comments/84muc3/explain_this_to_me_like_im_an_idiot/dvqot2g/,1,"Stock go up, stock go down",2018-03-15
25,Giodan1026,dvqou05,/r/pennystocks/comments/84muc3/explain_this_to_me_like_im_an_idiot/dvqou05/,1,OHHHHHHHHHHHHH! buy why,2018-03-15
26,avaldez321,dvqoxvp,/r/pennystocks/comments/84muc3/explain_this_to_me_like_im_an_idiot/dvqoxvp/,1,"People buy, people sell",2018-03-15
27,AlligatorRaper,dvqpfcc,/r/pennystocks/comments/84muc3/explain_this_to_me_like_im_an_idiot/dvqpfcc/,1,"Hype wears off, smart money gets out, others are left holding bags when the music stops. ",2018-03-15
28,doggopuppersenpai,dvqpjux,/r/pennystocks/comments/84muc3/explain_this_to_me_like_im_an_idiot/dvqpjux/,1,The us dollar became more valuable ,2018-03-15
29,Giodan1026,dvqpktb,/r/pennystocks/comments/84muc3/explain_this_to_me_like_im_an_idiot/dvqpktb/,1,Hmmmm I think I got it... but what’s that word money mean? ,2018-03-15
30,Giodan1026,dvqplj3,/r/pennystocks/comments/84muc3/explain_this_to_me_like_im_an_idiot/dvqplj3/,1,Woah,2018-03-15
31,AlligatorRaper,dvqprvl,/r/pennystocks/comments/84muc3/explain_this_to_me_like_im_an_idiot/dvqprvl/,1,The thing you lose playing the lottery and penny stocks. Thanks for being a good sport. ,2018-03-15
32,SargentGoat,dvqqpl7,/r/pennystocks/comments/84muc3/explain_this_to_me_like_im_an_idiot/dvqqpl7/,1,Sorry for that guy being a dick. A lot of people on penny stock Reddit’s seem to get pissed off very easily. Basically people often buy on the hype and sell on the news whether the news is positive or not and so right after a big catalyst a sell off often causes a drop in price on low cost stocks ,2018-03-15
33,Giodan1026,dvqrer4,/r/pennystocks/comments/84muc3/explain_this_to_me_like_im_an_idiot/dvqrer4/,1,"Don’t downvote this, it was just answering my question the way I asked it. Just having a little fun here guys. ",2018-03-15
34,la_tete_finance,dvqsn1j,/r/pennystocks/comments/84ltt5/alberta_partial_upgrading_bshv/dvqsn1j/,1,Looks like it just might be sparsely traded.,2018-03-15
35,Tricombed,dvqso7x,/r/pennystocks/comments/84muc3/explain_this_to_me_like_im_an_idiot/dvqso7x/,1,"Buy the rumor, sell the news. ",2018-03-15
36,pollofrog77,dvqtgs1,/r/pennystocks/comments/84muc3/explain_this_to_me_like_im_an_idiot/dvqtgs1/,1,Karma balanced ,2018-03-15
37,[deleted],dvqthbg,/r/pennystocks/comments/84muc3/explain_this_to_me_like_im_an_idiot/dvqthbg/,1,[deleted],2018-03-15
38,Ox29A,dvqtrww,/r/pennystocks/comments/84muc3/explain_this_to_me_like_im_an_idiot/dvqtrww/,1,Game Theory.,2018-03-15
39,xrudeboy420x,dvqugsb,/r/pennystocks/comments/84muc3/explain_this_to_me_like_im_an_idiot/dvqugsb/,1,Sell all news and conferences.  I don’t care if the news is good.  Sell that shit and buy in a week.,2018-03-15
40,IGOSODAMNHAM,dvquoqx,/r/pennystocks/comments/84muc3/explain_this_to_me_like_im_an_idiot/dvquoqx/,1,News was expected. The stock had a huge run. There is a lull and people don't want to have their money sitting in a stock that won't do anything for a while. The chart topped out also.,2018-03-15
41,Stockmrktnewb,dvr0ief,/r/pennystocks/comments/84npsg/txtm_growprocess/dvr0ief/,1,"I don't think it will happen anytime soon, if I were being optimistic it maybe June or July, but really doubt it. They are waiting on licensing from South Africa, if I remember correctly, and with all the political turmoil I doubt licensing TXTM is a priority. 

I like the idea and what TXTM wanted to do with their ICO, but management has me worried it will go nowhere. 

While you can make some money off TXTM with the .0008 to .0011 fluctuations, I would avoid any major investment in the company. I am pretty sure I have lost the spare $40 I threw into it, but I can Iive with that.",2018-03-15
42,Clitoriserator,dvr14xr,/r/pennystocks/comments/84obrk/jbzyd_is_now_almost_400_a_share_after_postreverse/dvr14xr/,1,Now I watch as it goes down before jumping in,2018-03-15
43,fox_91,dvr16vc,/r/pennystocks/comments/84obrk/jbzyd_is_now_almost_400_a_share_after_postreverse/dvr16vc/,1,"I think we hit double 0’s not trips. But semantics aside, it’s in the right position for Wang to get us moving out of penny land",2018-03-15
44,Ascertion,dvr1ag2,/r/pennystocks/comments/84obrk/jbzyd_is_now_almost_400_a_share_after_postreverse/dvr1ag2/,1,"The 52-week low is $0.009.  

Sorry you're right, I meant double 0s, not trips. ",2018-03-15
45,pickpocketgnomes,dvr291x,/r/pennystocks/comments/84nuku/tnke_showing_out/dvr291x/,1,What in pump and dump ,2018-03-15
46,rektamo,dvr38we,/r/pennystocks/comments/84ol5y/whats_everyones_long_term_holds/dvr38we/,1,"West water resources: WWR bought only graphite production center in North America switching over to producing electric car batteries and trucks. Owns hundreds of thousands of acres of un-mined uranium land.

Hcti : high volume could spike up soon ",2018-03-15
47,alucarddrol,dvr3cfr,/r/pennystocks/comments/84o0yt/bioa_earnings_call_tonight_at_4pm_after_market/dvr3cfr/,1,Doubtful,2018-03-15
48,holeeray,dvr3lw4,/r/pennystocks/comments/84o0yt/bioa_earnings_call_tonight_at_4pm_after_market/dvr3lw4/,1,K,2018-03-15
49,getoffmylawn13,dvr3ppj,/r/pennystocks/comments/84ol5y/whats_everyones_long_term_holds/dvr3ppj/,1,"BYSD I usually hate trips, but the new CEO they added over a month ago has some decent investment fund and financial work history. They plan to deal with Bitcoin and blockchain and I think his work history is a good area for this to impact. All that they stated so far is a Bitcoin ATM partnership with chainbytes. I'll see what the future has in store with my long position because I don't plan on selling anytime soon.",2018-03-15
50,MAGAlikeaMOFO,dvr3uwa,/r/pennystocks/comments/84ol5y/whats_everyones_long_term_holds/dvr3uwa/,1,I'm long on BPMX because I fucked up...AMA,2018-03-15
51,personable_finance,dvr3yw8,/r/pennystocks/comments/84nop1/xxii_fdas_anprm_released_today_looking_to_mandate/dvr3yw8/,1,"based on your last thread and this thread, it sounds like you're pretty decided. ",2018-03-15
52,alucarddrol,dvr45kn,/r/pennystocks/comments/84o0yt/bioa_earnings_call_tonight_at_4pm_after_market/dvr45kn/,1,"You seriously think it'll go from $0.06 to $15.00?

Any reason why?",2018-03-15
53,holeeray,dvr4g5b,/r/pennystocks/comments/84o0yt/bioa_earnings_call_tonight_at_4pm_after_market/dvr4g5b/,1,You moved my decimal point over two spaces.,2018-03-15
54,DogFarts,dvr4lzp,/r/pennystocks/comments/84ol5y/whats_everyones_long_term_holds/dvr4lzp/,1,Hcti. ,2018-03-15
55,[deleted],dvr4peb,/r/pennystocks/comments/84okki/march_15_2018_tomorrows_daily_rpennystocks/dvr4peb/,1,[removed],2018-03-15
56,Morsyn,dvr4w9e,/r/pennystocks/comments/84ol5y/whats_everyones_long_term_holds/dvr4w9e/,1,ANDI's acquisition goes through next week,2018-03-15
57,AustralianNole,dvr4y18,/r/pennystocks/comments/84lnpv/tnke_moon/dvr4y18/,1,Thanks mate,2018-03-15
58,getoffmylawn13,dvr5058,/r/pennystocks/comments/84oq13/how_do_i_get_into_this/dvr5058/,1,Paper trade and study for a couple months. You'll lose all of your money if you trade right away.,2018-03-15
59,Boots-n-Bell,dvr52ok,/r/pennystocks/comments/84ol5y/whats_everyones_long_term_holds/dvr52ok/,1,DFFN. Gap up coming in next week. Possibly two ,2018-03-15
60,chillertayyab123,dvr52rs,/r/pennystocks/comments/84oq13/how_do_i_get_into_this/dvr52rs/,1,"know any free paper trade platforms i could use?
",2018-03-15
61,alucarddrol,dvr53gi,/r/pennystocks/comments/84o0yt/bioa_earnings_call_tonight_at_4pm_after_market/dvr53gi/,1,"Sorry, I didn't see it",2018-03-15
62,ThisIsMyStocksAlt,dvr66uo,/r/pennystocks/comments/84okki/march_15_2018_tomorrows_daily_rpennystocks/dvr66uo/,1,“Surely NVCN has bottomed our by now.” ,2018-03-15
63,cascadianhillbilly,dvr6ab5,/r/pennystocks/comments/84nop1/xxii_fdas_anprm_released_today_looking_to_mandate/dvr6ab5/,1,This is great news and a really clear indication of things moving in XXII's favor at the federal level. Thanks for sharing!,2018-03-15
64,getoffmylawn13,dvr6c5p,/r/pennystocks/comments/84oq13/how_do_i_get_into_this/dvr6c5p/,1,I use thinkorswim with TD Ameritrade. You might be able to use the paper trade feature for free but you might have to open an account.,2018-03-15
65,Hold_onto_yer_butts,dvr7wmy,/r/pennystocks/comments/84j5ab/what_are_some_penny_stocks_that_are_just_taking/dvr7wmy/,1,VTNL,2018-03-15
66,JohnnyChimpo13,dvr823h,/r/pennystocks/comments/84p26k/bvtk_ecrypt_one_patent_rejected_final_rejection/dvr823h/,1,http://ptslaw.com/2016/04/a-final-rejection-is-not-the-end/,2018-03-15
67,SuperScuba,dvr8jb6,/r/pennystocks/comments/84p26k/bvtk_ecrypt_one_patent_rejected_final_rejection/dvr8jb6/,1,CEO confirmed that this is just another piece of the back and forth with the patent attorneys to the patent office.  We might see even more of these.,2018-03-15
68,Paladin_PDX,dvr9mi1,/r/pennystocks/comments/84p26k/bvtk_ecrypt_one_patent_rejected_final_rejection/dvr9mi1/,1,I hope this triggers a massive sell off so I can scoop up more at 0.0010 and possibly trips. with fins not due till May(?) we may see trips! conspicious silence from twitter feed DPT and BVTK,2018-03-15
69,zimboombah,dvr9rmm,/r/pennystocks/comments/84nlvn/checkout_sgrp_flying_under_the_radar_at_159/dvr9rmm/,1,Big if true! Any source for the expected jump in revenue?,2018-03-15
70,Senecany,dvr9vjt,/r/pennystocks/comments/84obrk/jbzyd_is_now_almost_400_a_share_after_postreverse/dvr9vjt/,1,1000 volume at 4$.... 4000$ volume.... Garbage.,2018-03-15
71,_RichardNixon_,dvra2kh,/r/pennystocks/comments/84ol5y/whats_everyones_long_term_holds/dvra2kh/,1,"Digital Turbine(APPS). It is a company that helps monetize apps. I think it's going to be a good stock to hold on to for awhile. 

MNGA. Their earnings report comes out soon and there is news that they had record sales in February.",2018-03-15
72,BVTKmax,dvra7gh,/r/pennystocks/comments/84p26k/bvtk_ecrypt_one_patent_rejected_final_rejection/dvra7gh/,1,Tom should release another fluff PR to allay his investors fears.,2018-03-15
73,Ascertion,dvraaoc,/r/pennystocks/comments/84obrk/jbzyd_is_now_almost_400_a_share_after_postreverse/dvraaoc/,1,A lot of shares are still processing for many owners/potential buyers.  That is why volume is low. ,2018-03-15
74,BVTKmax,dvraihh,/r/pennystocks/comments/84p26k/bvtk_ecrypt_one_patent_rejected_final_rejection/dvraihh/,1,Whatever you scoop them up at won't matter when the RS. ,2018-03-15
75,JohnnyChimpo13,dvrayqr,/r/pennystocks/comments/84p26k/bvtk_ecrypt_one_patent_rejected_final_rejection/dvrayqr/,1,They're starting their vice filming tomorrow all they need is a picture of the set ,2018-03-15
76,JohnnyChimpo13,dvrb2u6,/r/pennystocks/comments/84p26k/bvtk_ecrypt_one_patent_rejected_final_rejection/dvrb2u6/,1,The jets will win a Super Bowl before Bravatek has another reverse split ,2018-03-15
77,AnomalyNexus,dvrbdyl,/r/pennystocks/comments/84nop1/xxii_fdas_anprm_released_today_looking_to_mandate/dvrbdyl/,1,Well I bought a mountain of calls so I hope this thing flies.,2018-03-15
78,Shizzo,dvrbdys,/r/pennystocks/comments/84nop1/xxii_fdas_anprm_released_today_looking_to_mandate/dvrbdys/,1,"I definitely hold a position, but I could be persuaded.",2018-03-15
79,Shizzo,dvrbxp4,/r/pennystocks/comments/84nop1/xxii_fdas_anprm_released_today_looking_to_mandate/dvrbxp4/,1,Me and you both.,2018-03-15
80,suitology,dvrbz90,/r/pennystocks/comments/84nlvn/checkout_sgrp_flying_under_the_radar_at_159/dvrbz90/,1,Sales=/= profit ,2018-03-15
81,baddadfad,dvrccv8,/r/pennystocks/comments/84obrk/jbzyd_is_now_almost_400_a_share_after_postreverse/dvrccv8/,1,Yes... I have fidelity and my JBZY account has basically been frozen all day. ,2018-03-15
82,AnomalyNexus,dvrci27,/r/pennystocks/comments/84nop1/xxii_fdas_anprm_released_today_looking_to_mandate/dvrci27/,1,"Most expiring tomorrow...

Good luck to us both.",2018-03-15
83,queenslandbananas,dvrdkp1,/r/pennystocks/comments/84p26k/bvtk_ecrypt_one_patent_rejected_final_rejection/dvrdkp1/,1,"I don't know anything about football, but basic math suggests an R/S or some form of share increase will happen in the next few months.",2018-03-15
84,bazooka_joe81,dvrdnf8,/r/pennystocks/comments/84ol5y/whats_everyones_long_term_holds/dvrdnf8/,1,Same,2018-03-15
85,JohnnyChimpo13,dvreczr,/r/pennystocks/comments/84p26k/bvtk_ecrypt_one_patent_rejected_final_rejection/dvreczr/,1,The dilution stage is basically over. They've take out minimal convertible debt since August and everything before that has already converted. If they were waiting for dilution to end to get the ball rolling then we should see what they have up their sleeves shortly ,2018-03-15
86,Hamsmelly,dvreuct,/r/pennystocks/comments/84oq13/how_do_i_get_into_this/dvreuct/,1,"You wanna take advantage of pump and dumps? Ok here's how. Garner a social media following, take a position in some low liquid-trash company like BPMX, ""alert"" your loyal followers into buying as well as recommend it as a buy here and on as many different mediums as possible, then sell your shares to the people dumb enough to make trades based on fucking subreddit/stocktwits/discord chat recommendations. 

Sounds like a shitty thing to do to people right? You're right but that's how money is made in the penny world. Welcome OP have fun losing money ",2018-03-15
87,BVTKmax,dvrf4fq,/r/pennystocks/comments/84p26k/bvtk_ecrypt_one_patent_rejected_final_rejection/dvrf4fq/,1,My bet is that Tom &amp; Dennis won't even finish the interview once they figure out what they're walking into. ,2018-03-15
88,[deleted],dvrf75s,/r/pennystocks/comments/84oq13/how_do_i_get_into_this/dvrf75s/,1,[deleted],2018-03-15
89,psinsyd,dvrftph,/r/pennystocks/comments/84obrk/jbzyd_is_now_almost_400_a_share_after_postreverse/dvrftph/,1,"Am I seeing this right that the bottom seemed to have dropped out of it?  

I'm showing it's now down 2.277 or 99%",2018-03-15
90,TheCaIifornian,dvrfy8f,/r/pennystocks/comments/84ol5y/whats_everyones_long_term_holds/dvrfy8f/,1,BRK-B,2018-03-15
91,wodentx,dvrg2lw,/r/pennystocks/comments/84o0yt/bioa_earnings_call_tonight_at_4pm_after_market/dvrg2lw/,1,"So did the call take place? 

https://finance.yahoo.com/news/bioamber-delays-filing-annual-report-211600027.html",2018-03-15
92,Max_TwoSteppen,dvrg8km,/r/pennystocks/comments/84ol5y/whats_everyones_long_term_holds/dvrg8km/,1,"I had a friend get me into this very recently and oops, I'm down 20% in about a week. I only started with $35 so whatever, but it's frustrating",2018-03-15
93,BaronCapdeville,dvrh44q,/r/pennystocks/comments/84muc3/explain_this_to_me_like_im_an_idiot/dvrh44q/,1,"OP,  this is your answer here. It’s not as easily noticeable in blue chips, but in penny stocks, the cycle is observable in many cases. 

Penny traders want to cash out as close to a peak as possible, then take gains before the stock cools off. This is such a popular idea, that most pennys cool rapidly after testing New highs. 

In penny’s, take your gains where you can. Do not hold shit thinking it will pay off in a year or two. 
Sure, it might, but you’ll miss all the swing trading all the way to the top. Only hold if you deeply, deeply believe in the product AND the executive team. even then, be prepared to lose it all. ",2018-03-15
94,JohnnyChimpo13,dvrh7mg,/r/pennystocks/comments/84p26k/bvtk_ecrypt_one_patent_rejected_final_rejection/dvrh7mg/,1,What made you create a Reddit account with bvtk in the name less than a month ago?,2018-03-15
95,BowB4Me,dvrhctd,/r/pennystocks/comments/84ol5y/whats_everyones_long_term_holds/dvrhctd/,1,"$GROW. Crypto mining stock play with exposure to the only real profitable mining company so far (Hive Blockchain). Currently $2.80. Not selling for anything less than $8.00. Very low float at 11 Million, easily go 300% in a mater of days. Will follow BTC prices. Could see this at $8.00 with avatar at $15,000. Expecting to see this by summer 2018. I could have just bought Hive Blockchain but then I’d be down 70% in the last 2 months. Instead I’m down just 20% in the last 2 months in $GROW. They are an ETF investment company with a great CEO, who happens to also be the Chairman of HIVE. Will come back to this post when I sell for $8 in a couple of months. ",2018-03-15
96,sheen1013,dvrhexn,/r/pennystocks/comments/84ol5y/whats_everyones_long_term_holds/dvrhexn/,1,you gotta hold for the long term. Wait for the rocket ship. you're chillin,2018-03-15
97,PaperPlait,dvrhu2i,/r/pennystocks/comments/84obrk/jbzyd_is_now_almost_400_a_share_after_postreverse/dvrhu2i/,1,I only have JBZY? Wtf is JBZYD?,2018-03-15
98,RandomT9,dvrilwx,/r/pennystocks/comments/84obrk/jbzyd_is_now_almost_400_a_share_after_postreverse/dvrilwx/,1,Ticker is changed to JBZYD temporarily until reverse split is done (~20 days or so.),2018-03-15
99,JustCallMeAtom,dvrjf9i,/r/pennystocks/comments/84oq13/how_do_i_get_into_this/dvrjf9i/,1,"Be a value investor and focus on penny stocks.
Read security analysis and intelligent investor. ",2018-03-15
100,skeemon,dvrjh91,/r/pennystocks/comments/84ol5y/whats_everyones_long_term_holds/dvrjh91/,1,"ATE, my near 60,000 shares still riding into Phase 2b results - next week - and beyond.  If the results are very promising, then that's more reason for me to hold, anticipating further near-future catalysts in the form of a major partnership/buyout.  Success forming a partnership could eventually mean ATE gets to take a chunk of the $11 billion+ NSAID market. I can't express how confident and excited I am!",2018-03-15
101,BVTKmax,dvrjlwg,/r/pennystocks/comments/84p26k/bvtk_ecrypt_one_patent_rejected_final_rejection/dvrjlwg/,1,What made you create a Reddit account a year ago with the name chimpo in it?,2018-03-15
102,JorgeEspino,dvrjm1q,/r/pennystocks/comments/84ol5y/whats_everyones_long_term_holds/dvrjm1q/,1,$TOPS 😂,2018-03-15
103,Thundersnow69,dvrk7ji,/r/pennystocks/comments/84oq13/how_do_i_get_into_this/dvrk7ji/,1,Think or swim!,2018-03-15
104,newstart3385,dvrkhq5,/r/pennystocks/comments/84oq13/how_do_i_get_into_this/dvrkhq5/,1,"I sometimes feel like this is the purpose of being part of huge penny stock mentor group/chats

I mean take a guy like Timothy Sykes or Warrior Trading......that is the whole point kind of everyone is following each other correct? Its like your paying a fee but it comes back",2018-03-15
105,turnip5000,dvrkkfa,/r/pennystocks/comments/84ol5y/whats_everyones_long_term_holds/dvrkkfa/,1,"$JET . Was up $9000 on Tuesday. News came out, now I’m up $230. 😩",2018-03-15
106,Hamsmelly,dvrkslm,/r/pennystocks/comments/84oq13/how_do_i_get_into_this/dvrkslm/,1,No it doesn't. You're paying them to be the one left with the bag,2018-03-15
107,BGOG83,dvrkzvo,/r/pennystocks/comments/84ol5y/whats_everyones_long_term_holds/dvrkzvo/,1,FND. Exciting rapid growth retailer in an antiquated industry. Has a 5-10 year run ahead of it that I feel we won’t see in retail sector for a very long time. Their track record over the past 9 years is insane and they have a ton of white space to expand. ,2018-03-15
108,BachelorUno,dvrlc1a,/r/pennystocks/comments/84ol5y/whats_everyones_long_term_holds/dvrlc1a/,1,What's so good about JET.V?,2018-03-15
109,higgs_boson_2017,dvrm4wc,/r/pennystocks/comments/84nuku/tnke_showing_out/dvrm4wc/,1,It be your own stocks,2018-03-15
110,newstart3385,dvrn6ho,/r/pennystocks/comments/84oq13/how_do_i_get_into_this/dvrn6ho/,1,"Yea I dunno opinions seem to ALWAYS different depending on who you ask. Like there are succcessful people with Tim, Warriors etc 

Then you have people who say just read your own, go on YouTube etc. I had a chat with a guy who said he lost it all with Warrior Trading and I talked to someone who highly recommended it. So I think it comes down to the person.",2018-03-15
111,JohnnyChimpo13,dvrn8g1,/r/pennystocks/comments/84p26k/bvtk_ecrypt_one_patent_rejected_final_rejection/dvrn8g1/,1,The movie super troopers ,2018-03-15
112,drgreenthumbatx420,dvrovxz,/r/pennystocks/comments/84ol5y/whats_everyones_long_term_holds/dvrovxz/,1,Out of curiosity what makes confident about the stock? Do you have any idea if the trial has been successful and results next week will be good? ,2018-03-15
113,Saints420Fan,dvrp2sw,/r/pennystocks/comments/84ol5y/whats_everyones_long_term_holds/dvrp2sw/,1,"GLFH

You’re welcome ",2018-03-15
114,MyCatDorito,dvrqu52,/r/pennystocks/comments/84ol5y/whats_everyones_long_term_holds/dvrqu52/,1,Big things are going to happen this summer,2018-03-15
115,turnip5000,dvrr3ms,/r/pennystocks/comments/84ol5y/whats_everyones_long_term_holds/dvrr3ms/,1,“Good” ? I’m not sure. ,2018-03-15
