,author,id,url,score,text,date
74,sensicle,dwyw9v6,/r/pennystocks/comments/8aaxy9/lrdr_up_2000_since_i_bought_at_001_reinstatement/dwyw9v6/,1,"lol I just thought of something else... 

So you said you take 50 percent gains and exit, right? Great. Normally that's what I do. I got POTN at 60, sold at 90, exited perfectly because it sank down to 30s after that. 

But had we both been in LRDR together at 001, and you exited at 0015, I guarantee you'd be the one barking about how it's a garbage play, it's a scam, all pennies are scams, we're all stupid for holding --- you'd be that idiot trying to bash everyone else's investment for one of either two reasons, possible both: (a) jealous ass haters gonna hate, and/or (b) you're looking for re-entry at a lower ask, hoping someone whacks the bid. 

I know your type. I see you fucks all the time and it's really clear what your angle is. ",2018-04-06
75,himalayan_pride,dwz0ady,/r/pennystocks/comments/8a9z2w/how_to_buy_penny_stocks/dwz0ady/,1,"Thank you very much for clarifying a lot of stuffs. Now, I got the idea where I want/need to invest. Sometimes people mock for no reason and not knowing is not a crime. There will always be first time for everything for everyone. I will at the moment will play around with little money which i can afford to lose. Thank you again for taking your time to write a lengthy post. ",2018-04-06
76,TripsByMonday,dx10ppw,/r/pennystocks/comments/8a99ui/andi_phone_release_date_out/dx10ppw/,1,Your crazy and its a scam ,2018-04-06
77,projectlifeventures,dx3dcxi,/r/pennystocks/comments/8a78dr/simple_questions_april_06_2018/dx3dcxi/,1,Im fairly new and trying to get anide of how you guys find certain stock. Im a little overwhelmed by yhe info. Any suggestions on where to start. Im mainly combing yere and twitter and spam mail.,2018-04-06
78,Shortstuff38,dx5rwk5,/r/pennystocks/comments/8a78dr/simple_questions_april_06_2018/dx5rwk5/,1,"Hello, i'm using this subreddit to help me follow and get used to trading and the stock market on the mobile app Robinhood. I have a problem because most of the stocks here are not listed on Robinhood. Is that normal? Is it not listed because they are not worth enough money? What should i do? Thank you for your time.",2018-04-06
79,MrWreckThatOhh,dx61i3c,/r/pennystocks/comments/8a99ui/andi_phone_release_date_out/dx61i3c/,1,https://youtu.be/lwtH5bv7QyQ,2018-04-06
80,[deleted],dx6ccf3,/r/pennystocks/comments/8a9z2w/how_to_buy_penny_stocks/dx6ccf3/,1,[removed],2018-04-06
81,gabeindahouse,dx7tz8h,/r/pennystocks/comments/8a78dr/simple_questions_april_06_2018/dx7tz8h/,1,"Im fairly new to stocks, trading , and the market. Im wondering if using certain sources for research such as Ryan Scribner and youtube videos in general is okay to do or if i should avoid it. Note- youtube is not my primary source of information, i use it more for when i don't understand a term or concept.",2018-04-06
82,CrucityGaming,dx8k964,/r/pennystocks/comments/8a78dr/simple_questions_april_06_2018/dx8k964/,1,That's probably because a lot of those stocks are OTC Which are not on Robinhood. ,2018-04-06
83,slippyslammyswanson,e6w3bhs,/r/pennystocks/comments/8aaekq/nvcn_up_30_in_2_days/e6w3bhs/,1,Good post,2018-04-06
