,author,id,url,score,text,date
0,SupGirluHungry,euom4ts,/r/pennystocks/comments/ch3jfx/how_is_the_volatility_of_penny_stocks_compared_to/euom4ts/,1,If you’re making 3-5 figures a day just keep doing what you’re doing,2019-07-24
1,TheWildJarvi,euomnsd,/r/pennystocks/comments/ch3jfx/how_is_the_volatility_of_penny_stocks_compared_to/euomnsd/,1,I think he may have broken an arm jerking himself off.,2019-07-24
2,blaked_baller,euomrri,/r/pennystocks/comments/ch3jfx/how_is_the_volatility_of_penny_stocks_compared_to/euomrri/,1,"You see, people always leave out that they lose 4-7 figures a day",2019-07-24
3,SupGirluHungry,euomuk8,/r/pennystocks/comments/ch3jfx/how_is_the_volatility_of_penny_stocks_compared_to/euomuk8/,1,I will break my arm jerking him off too for 10k,2019-07-24
4,IWantAllYourMoney,euonem3,/r/pennystocks/comments/ch3jfx/how_is_the_volatility_of_penny_stocks_compared_to/euonem3/,1,"Ah, this sub seems to be a toxic sub comprised of jealous losers or immature teenager trolls. I'm outta here.",2019-07-24
5,Bubbs77,euovovg,/r/pennystocks/comments/ch1cu4/siml_simlatus_275m_in_distribution_contracts/euovovg/,1,"I’ve Been holding a small Bag here for a couple
Months. Soon as I can I’m out  like a trout.",2019-07-24
6,GeebieWeebies,eup2oea,/r/pennystocks/comments/ch1cu4/siml_simlatus_275m_in_distribution_contracts/eup2oea/,1,"Fair enough, thanks",2019-07-24
7,Laker_Gev,eupdph6,/r/pennystocks/comments/ch1cu4/siml_simlatus_275m_in_distribution_contracts/eupdph6/,1,"No thoughts.  But checkout APHD at .016, thank me later.",2019-07-24
8,Laker_Gev,eupdsbc,/r/pennystocks/comments/ch4aqx/ttcm_slide/eupdsbc/,1,"Checkout APHD at .016, headed to .25+",2019-07-24
9,OpinionPoop,euped1v,/r/pennystocks/comments/ch4aqx/ttcm_slide/euped1v/,1,i lost a bit on the dip. thank god i got out at my stop at .025 or it would have gotten bad.,2019-07-24
10,thehappydoghouse,eupefk5,/r/pennystocks/comments/ch4aqx/ttcm_slide/eupefk5/,1,Dear young ones. Welcome to pump and dump,2019-07-24
11,calvin50,eupwk72,/r/pennystocks/comments/ch1cu4/siml_simlatus_275m_in_distribution_contracts/eupwk72/,1,If it gets above.014 or doesn’t go below .01 I’m in,2019-07-24
12,hakabotaco,eupwymu,/r/pennystocks/comments/ch4aqx/ttcm_slide/eupwymu/,1,I lost 1/2 my gains and bailed. Still left with just over 100% return. Keeping an eye out for re-entry,2019-07-24
13,weasil22,eupz8j5,/r/pennystocks/comments/ch4aqx/ttcm_slide/eupz8j5/,1,"This one's tricky for me. I decided to hold long, though. Once it gets going well, collecting and creating more and more data, I feel the technology will be bought (and maybe the company) and used in a completely different and more thought out way. Kind of like how the game Ingress was made into Pokemon Go, but on a larger technical scale. The targeted AD space on this sort of tech is gigantic.",2019-07-24
14,tampatrish,euq72ae,/r/pennystocks/comments/ch4aqx/ttcm_slide/euq72ae/,1,I guess we'll see also following PCMB  [https://stockprice.com/stock-price-featured-content/the-future-of-drug-delivery-has-biotech-investors-focusing-on-one-small-company-2019-07-08/](https://stockprice.com/stock-price-featured-content/the-future-of-drug-delivery-has-biotech-investors-focusing-on-one-small-company-2019-07-08/),2019-07-24
15,ldana2,euq87yf,/r/pennystocks/comments/ch4aqx/ttcm_slide/euq87yf/,1,Still in.... let’s see what happens,2019-07-24
16,couchtomatopotato,euqbyer,/r/pennystocks/comments/ch4aqx/ttcm_slide/euqbyer/,1,yep. doing this too.,2019-07-24
17,Bubbs77,euqeuv2,/r/pennystocks/comments/ch4aqx/ttcm_slide/euqeuv2/,1,"I agree with you that this tech once refined and realized for its potiential has a good possibility of being bought out. On the other hand it will not happen over night. I believe it will take a fairly long time for people and businesses to load enough data for this to be appealing for a buy out. So what to do in the mean time. There’s nothing wrong with holding long and forgetting about it. But another strategy is to play this thing by the OTC’s “unwritten” rules. Some of those rules are sell the news (just have to figure which news constitutes a selloff), always take profits, play  pump &amp; dumps to your advantage.   If you start learning some of these rules you can make a lot of profits, then buy back in and even swing trade to accumulate more shares, then hold those free shares for long run while you have a pocket full of money. I do plan on taking a small portion of my profits to start a long position (like you are) a little later down the road. It feels much nicer to do that with free shares and a pile of money. Why the rant?? I’m simply hoping that what I’ve learned playing this OTC can help some of you.  There are other strategy’s but this one (once I started sticking to it) has been working very well for me. Good luck.",2019-07-24
18,Bubbs77,euqf1n3,/r/pennystocks/comments/ch4aqx/ttcm_slide/euqf1n3/,1,Good job. Sounds like your safety catch ensured your profits. Good play ole chap,2019-07-24
19,Laker_Gev,euqfgoh,/r/pennystocks/comments/ch7uqz/kibush_capital_corp_otcdlcr_exclusive_reveals_otc/euqfgoh/,1,"Also checkout APHD at .017, 🎯.25",2019-07-24
20,NecessaryPosition,euqfji5,/r/pennystocks/comments/ch4aqx/ttcm_slide/euqfji5/,1,"Honestly, I just added to my position. I think the iOS release will bump it enough to pay off.",2019-07-24
21,Laker_Gev,euqgods,/r/pennystocks/comments/ch83fx/otc_watchlist_724/euqgods/,1,Add APHD on that list too bro,2019-07-24
22,ldana2,euqh8vu,/r/pennystocks/comments/ch4aqx/ttcm_slide/euqh8vu/,1,Let’s hope so. That and the Guinness world record (if set),2019-07-24
23,mtnblazed6oh3,euqjaqk,/r/pennystocks/comments/ch4aqx/ttcm_slide/euqjaqk/,1,"This is my plan, and unfortunately I didn’t stick to it with this recent release news. I didn’t think initial google play release would’ve been quite this big of a sell the news event, even though my instincts said I should sell a portion at least. Ugh - lesson learned. 

Bought some more today on this dip and will take profits when presented the opportunity again.",2019-07-24
24,mtnblazed6oh3,euqjet8,/r/pennystocks/comments/ch4aqx/ttcm_slide/euqjet8/,1,I’m curious to see the hype machine behind the worlds largest scavenger hunt. They’re going to need to market the shit out of this app if they want it to be a success. I at least plan to be holding for that hype.,2019-07-24
25,njjrb22,euqlw9b,/r/pennystocks/comments/ch4aqx/ttcm_slide/euqlw9b/,1,"&gt;APHD

why do you think they're going to increase so heavily?",2019-07-24
26,GourmetFilet,euqm9aw,/r/pennystocks/comments/ch4aqx/ttcm_slide/euqm9aw/,1,"I was a big supporter, still kind of am. But I sold 75% during the slide down @.027. Still profited large as my buy in was .004. But seriously I was really disappointed with the app roll out. The google play launch was a joke. I had friends and family with Android Devices Download it and they had no idea what to do and just about every feature was restricted. Not a good look or first impression for the app.  Looking for re-entry but I really need them to update this app quickly so it’s something people will want",2019-07-24
27,emily_strange,euqnavv,/r/pennystocks/comments/ch9g7s/thoughts_on_fpay/euqnavv/,1,Bullish earnings coming first week of august (estimated),2019-07-24
28,mrkoz89,euqnfn2,/r/pennystocks/comments/ch4aqx/ttcm_slide/euqnfn2/,1,"Super torn as well. Sold some to cover my original investment and now holding the rest as I believe in this tech. I too was disappointed with the app release, albeit it is a beta. Working out the kinks and bugs for the true release which I would hope has a marketing campaign to go along with it.",2019-07-24
29,tampatrish,euqo8fy,/r/pennystocks/comments/ch83fx/otc_watchlist_724/euqo8fy/,1,PMCB [https://stockprice.com/stock-price-featured-content/the-future-of-drug-delivery-has-biotech-investors-focusing-on-one-small-company-2019-07-08/](https://stockprice.com/stock-price-featured-content/the-future-of-drug-delivery-has-biotech-investors-focusing-on-one-small-company-2019-07-08/),2019-07-24
30,Laker_Gev,euqok21,/r/pennystocks/comments/ch4aqx/ttcm_slide/euqok21/,1,"New prefferrded B shares were filled recently, that's typically a merger, acuisition or funding.  O e of the 3 will come out . OS 107M, ZERO DEBT = No dilution.",2019-07-24
31,econoscar,euqrgyi,/r/pennystocks/comments/ch9rpl/cbbt_round_3_and_visl_round_2/euqrgyi/,1,Why $VISL?,2019-07-24
32,XpLiCiT_OnEs,euqrvaq,/r/pennystocks/comments/ch83fx/otc_watchlist_724/euqrvaq/,1,No CWNR? Sucker has been running the last week,2019-07-24
33,kismethavok,euqvjpp,/r/pennystocks/comments/chado0/trnx/euqvjpp/,1,".6 peak today, maybe.",2019-07-24
34,TinyTornado7,euqwor4,/r/pennystocks/comments/chado0/trnx/euqwor4/,1,Take profits and get out,2019-07-24
35,summertimebooze,euqxntb,/r/pennystocks/comments/ch4aqx/ttcm_slide/euqxntb/,1,"Ok so I had some extra cash in my Schwab account and the in at .0005 for 12000 shares and made a tiny profit despite the massive slide.

I didn’t invest much, but I was cautiously optimistic that we’d hit .04 at which point I was going to sell. Has anybody here used the app? I don’t have an android so I can’t test it. The videos I saw of it in action looked kind of sketchy. The concept is huge, I’ll give you that. I come from digital advertising and this has huge monetization potential.

Here’s my BUTS. The website for the company developing it, honeycomb digital, is not even mobile optimized. Red flag for me. That’s the least you can do. The UX on the app looks terrible. Let’s be honest. The rendering of the arks looks more like a wireframe than anything ready for public consumption. The engine they’re running it on is publicly available source code. Are they just riding on the patented concept giving them value? I wish I could test it personally on iOS, but my gut feeling is that it’s far from a finished product.

I can’t find it atm but some of the investors in tautachrome have a checkered past at best. Some have been involved in other fantastical tech innovations linked to OTC. I can’t really figure out their endgame. If they’re legit or if they created all this buzz, including the telegram support group, to pump and dump this. I mean, that is a massive amount of work to run all those sock puppets. 

What do you guys think? Is this legit and poorly executed, or a massive charade?

Anyway, this has been an eye opening experience for me in the world of penny stocks.",2019-07-24
36,dubsdube420,euqy9zb,/r/pennystocks/comments/chado0/trnx/euqy9zb/,1,This. IF it even hits .6 it’s just gonna bleed down to .40s tomorrow.,2019-07-24
37,XxCrashOverridexX,eur0zvg,/r/pennystocks/comments/chavst/trnx/eur0zvg/,1,Holding and watching how Turkey plays out.,2019-07-24
38,mkultrahigh,eur31rm,/r/pennystocks/comments/chavst/trnx/eur31rm/,1,Holding 10 years to see how this contract ends up. Gonna ride it out see if I can retire early.,2019-07-24
39,CaptainWeee,eur8lbi,/r/pennystocks/comments/ch9rpl/cbbt_round_3_and_visl_round_2/eur8lbi/,1,Beat down to a pulp and NASA contract the other day shot it up from $1.50-$8.00 who knows what other news they’re gearing up to drop soon. Either way technically it’s ready for a bounce.,2019-07-24
40,CaptainWeee,eur8uwe,/r/pennystocks/comments/ch9rpl/cbbt_round_3_and_visl_round_2/eur8uwe/,1,"$CBBT $VISL are my main plays and the ones I’m in mostly atm, but don’t forget or past ones this week also they’re still moving: $PCTL $TRNX 🤑🤑🤑",2019-07-24
41,TestNum47,eurbezl,/r/pennystocks/comments/chado0/trnx/eurbezl/,1,hahahaha,2019-07-24
42,banditorama,eurcxgd,/r/pennystocks/comments/chado0/trnx/eurcxgd/,1,"Quality technical analysis, although I'm semi-concerned by the lack of at least 6 rocket ships. I'll have to check in with the analysts at stock twits before I buy",2019-07-24
43,Anarkrist,eurd4h0,/r/pennystocks/comments/ch4aqx/ttcm_slide/eurd4h0/,1,Got in for a few hundred thousand shares at .014.,2019-07-24
44,Anarkrist,eurdcaf,/r/pennystocks/comments/ch4aqx/ttcm_slide/eurdcaf/,1,"All out. Unless they add features fast, it will be a while before this has any public utility.",2019-07-24
45,summertimebooze,eurehbx,/r/pennystocks/comments/ch4aqx/ttcm_slide/eurehbx/,1,Me too.,2019-07-24
46,CoffeeNTrees,euri7v5,/r/pennystocks/comments/chb1mz/yoga/euri7v5/,1,how does this work exactly?  (if you feel like explaining),2019-07-24
47,squatsforthethots69,euriyjw,/r/pennystocks/comments/chc0jy/atbpf/euriyjw/,1,What's your DD,2019-07-24
48,kismethavok,eurjrk2,/r/pennystocks/comments/chado0/trnx/eurjrk2/,1,Waiting for the .3's to buy back in.,2019-07-24
49,amg,eurlbl7,/r/pennystocks/comments/chavst/trnx/eurlbl7/,1,"Very small amount of shares, just so I can say I went through the whatever you call it when you get shares of another company from another company.",2019-07-24
50,Bubbs77,eurmrm5,/r/pennystocks/comments/ch4aqx/ttcm_slide/eurmrm5/,1,I’m not sure if it’s  bull crap company or not. I’m not aware of any of these people’s pasts as you are. I think a few here on Reddit seen this for what it was and claimed it the whole time. We saw this as a stock that would generate a lot of buzz and therefore make a run. That’s phase one. Phase two will begin playing out now and we will see what this company is actually made of. I’m 100% out and watching things play out to see when or if I’ll reenter.,2019-07-24
51,[deleted],eurms5u,/r/pennystocks/comments/chc0jy/atbpf/eurms5u/,1,[deleted],2019-07-24
52,Drewcifer236,euroafm,/r/pennystocks/comments/chcr78/steven_dux_trading_technique_for_sale/euroafm/,1,No one cares.,2019-07-24
53,TestNum47,eurobbj,/r/pennystocks/comments/chc0jy/atbpf/eurobbj/,2,"It seems almost too good. I tend to view the lacking interest actually as a positive sign. Weird for sure but maybe I'm just not seeing the problem here. I wonder what their drug costs in production since Nsaids are usually cheap to produce and if the price is so much higher I don't see a good adaption rate for short term treatment. 

Why does it still say ""Recruiting""?

[https://clinicaltrials.gov/ct2/show/NCT03978208?term=antibe&amp;rank=1](https://clinicaltrials.gov/ct2/show/NCT03978208?term=antibe&amp;rank=1)

Must watch:

[https://www.youtube.com/watch?v=w\_3heP7ol0A](https://www.youtube.com/watch?v=w_3heP7ol0A)",2019-07-24
54,summertimebooze,eurq24x,/r/pennystocks/comments/ch4aqx/ttcm_slide/eurq24x/,1,"The information on the web is sketchy, but when I was googling yesterday I found stuff under Roadship Holdings (previous Tautachrome name) and Polybia studios, leading me down a rabbit hole showing connections to investor Michael Nugent who was involved in a major penny stock scam touting a “revolutionary” engine technology. This is all stuff I found on in publications like the Sydney morning herald. I wanted to believe this was real, but my gut is telling me otherwise. Who knows how many layers of deception are going on here. I also looked into Leonard and he seemed legit, because I found patents under his name, but who knows if some of those credentials are embellished. He has one book no longer in publication from the seventies about nutrition.

On the surface the tech sounds compelling. They’re also using all the buzzwords, so take that for what you will. But when I saw the screenshots and videos of it in action it made me pause. There’s just no way that will be massively adopted with that UX or the AR renderings.",2019-07-24
55,THEREALISLAND631,eurrcmz,/r/pennystocks/comments/chb1mz/yoga/eurrcmz/,1,I just looked them up and know nothing about them but I find it weird an OTC stock like this is on RobinHood...,2019-07-24
56,jenlou289,eurv4pa,/r/pennystocks/comments/ch83fx/otc_watchlist_724/eurv4pa/,1,KALY? Really? shitstock if I ever smelled one... been drowning for years... Would like to know why you have it on your list,2019-07-24
57,RingOfFyre,eurzc64,/r/pennystocks/comments/chc0jy/atbpf/eurzc64/,1,Does recruiting mean they still haven't found test patients?,2019-07-24
58,IamGohn,eus1iwt,/r/pennystocks/comments/chc0jy/atbpf/eus1iwt/,1,Curious about the “requiring” aspect... commenting to see what others think,2019-07-24
59,Nand3s,eus32vu,/r/pennystocks/comments/chc0jy/atbpf/eus32vu/,1,"Quite important question here.

Do they have the money money? 

Or do they need to raise some more and then more and then just a little bit more?",2019-07-24
60,stockmaester,eus4na1,/r/pennystocks/comments/che6k8/looking_for_stocks_that_between_1_and_5/eus4na1/,1,Why are you searching for stocks that are mainly pump and dumps?,2019-07-24
61,chinesedeliveryguy,eus54f9,/r/pennystocks/comments/che6k8/looking_for_stocks_that_between_1_and_5/eus54f9/,1,I don't have a lot of money. Just trying to stretch my dollar for more shares to invest in.,2019-07-24
62,stockmaester,eus6hcc,/r/pennystocks/comments/che6k8/looking_for_stocks_that_between_1_and_5/eus6hcc/,1,"Not worth it.  Try this out. 

https://discord.gg/ztDWUfG",2019-07-24
63,mkultrahigh,eus802n,/r/pennystocks/comments/che6k8/looking_for_stocks_that_between_1_and_5/eus802n/,1,Trnx,2019-07-24
64,Nezbotz,eus877d,/r/pennystocks/comments/chc0jy/atbpf/eus877d/,1,"Last I knew they were funded through their projected trials. That was months ago, I haven’t been keeping track of them for a while. Disclaimer: I have shares",2019-07-24
65,TestNum47,eusa25e,/r/pennystocks/comments/chc0jy/atbpf/eusa25e/,1,"According to the site yes. It just doesn't fit into the timeline.

I might be wrong but the study was supposed to be finished in April/May already but they decided to expand it. If you look at the completion date it says August for primary and September for Study. Maybe that explains it, maybe not. I don't know",2019-07-24
66,John-Rambone,eusbeeu,/r/pennystocks/comments/ch9rpl/cbbt_round_3_and_visl_round_2/eusbeeu/,1,In on VISL at 1.08 Mr. Weee,2019-07-24
67,CaptainWeee,eusbzpo,/r/pennystocks/comments/ch9rpl/cbbt_round_3_and_visl_round_2/eusbzpo/,1,Nice sir good entry!,2019-07-24
68,healthmotosadhu,eusj23u,/r/pennystocks/comments/ch9rpl/cbbt_round_3_and_visl_round_2/eusj23u/,1,"I got in visl late last week and early this week at an average of 1.11. Then it tanked down to .99 and had a slight bounce on contract news. I sold on the bounce yesterday. The chart looks great but the company sucks in my opinion. The dilution from the offering is crazy. You can calculate the market cap before and after the offering. Market cap before offering was the same at 8$/share as it is 1$/share (comparable at least). That gives you an idea of the dilution at play here. I would have stayed in yesterday had the bounce yesterday not been attributed to news. The fact that it barely bounced on significant news is a bad sign to me.

Just my opinion. 

Wish you guys the best on this one!!!",2019-07-24
69,mtooth,eusjrje,/r/pennystocks/comments/chc0jy/atbpf/eusjrje/,1,"Here's an interesting interview with their CEO from earlier this year:

https://youtu.be/15936YI2qMI

It's a good intro to the company and review of near-term catalysts.  Most interesting is the hint that Wallace actually has a whole separate inflammation drug he wants to work on (Legault makes it seem like they're almost bored with the hydrogen-sulfide... so maybe a near-term sale of ATE or a quick partner exclusivity deal after final phase2 metabolic study?).  Whether they develop this new inflammation drug at ATE or via a new start-up it will definitely be worth keeping an eye on.  In my view this makes ATE an even more attractive speculative buy if they have a new project they're more excited about than the ATB pipeline.",2019-07-24
70,berto0311,eusl8vt,/r/pennystocks/comments/chc0jy/atbpf/eusl8vt/,1,They are funded through this trial for atb346. This money is for the other projects I suppose,2019-07-24
71,conspiracytruthist,eusmnqv,/r/pennystocks/comments/chccc0/fcel/eusmnqv/,1,Good luck.,2019-07-24
72,conspiracytruthist,eusmueo,/r/pennystocks/comments/chcr78/steven_dux_trading_technique_for_sale/eusmueo/,1,Why not making a shit load of copies and sell it for way cheaper then you would actually make your money back.,2019-07-24
73,kismethavok,eusn6pi,/r/pennystocks/comments/che6k8/looking_for_stocks_that_between_1_and_5/eusn6pi/,1,Long or short?,2019-07-24
74,Laker_Gev,eusnion,/r/pennystocks/comments/ch4aqx/ttcm_slide/eusnion/,1,Awesome buy bro.  Welcome aboard.  If you’re on Twitter let me know.,2019-07-24
75,Laker_Gev,eusnn57,/r/pennystocks/comments/ch4aqx/ttcm_slide/eusnn57/,1,Awesome buy bro.  Welcome aboard.  If you on Twitter let me know.,2019-07-24
76,chinesedeliveryguy,eusq8y5,/r/pennystocks/comments/che6k8/looking_for_stocks_that_between_1_and_5/eusq8y5/,1,Short.,2019-07-24
77,NormanMitis,eussb8w,/r/pennystocks/comments/che6k8/looking_for_stocks_that_between_1_and_5/eussb8w/,1,"Short means short sale, ie borrow shares and sell them, then buy them back at a lower price. You're betting on the price to go down.

I imagine you meant short as in duration and holding a short period of time. In that case you're still 'long' which simply means you're a buyer/ betting on the price to rise.",2019-07-24
78,NormanMitis,eust4m5,/r/pennystocks/comments/ch9qy2/otc_stock_screener/eust4m5/,1,"I use Equity Feed, have been since 2006. If you want to get serious with trading pennies, you need a real time scanner to follow the market live. It's pricey but once you get serious it's simply a tool you need to have.

[https://chartdiligence.com/wp-content/uploads/2019/07/7-24-2019-7-05-09-PM.png](https://chartdiligence.com/wp-content/uploads/2019/07/7-24-2019-7-05-09-PM.png)

&amp;#x200B;

If you're not looking for the heavy duty real time streaming scan results, there are free options like the screener at [OTC.com](https://OTC.com). Very different dynamic but in the end they're both just different ways to scan and monitor the OTC world.",2019-07-24
79,madankstanks,eustwdh,/r/pennystocks/comments/chc0jy/atbpf/eustwdh/,1,"Great watch, thank you for this!",2019-07-24
80,chinesedeliveryguy,eustyls,/r/pennystocks/comments/che6k8/looking_for_stocks_that_between_1_and_5/eustyls/,1,You're right. I'm so new to this I'm just learning as I go lol,2019-07-24
81,dmoney113,eusvive,/r/pennystocks/comments/chc0jy/atbpf/eusvive/,1,u/karben14 time to jump back in yet? Last patient enrolment soon and then results before end of summer,2019-07-24
82,getoffmylawn13,eut2hfu,/r/pennystocks/comments/che6k8/looking_for_stocks_that_between_1_and_5/eut2hfu/,1,"BYSD (Bayside Blockchain) I'm holding this bag until I die unfortunately. But keep an eye on it if it ever wakes up or releases news. There's no telling what it could do with a 307,000 share float.",2019-07-24
83,[deleted],eut6wuw,/r/pennystocks/comments/che6k8/looking_for_stocks_that_between_1_and_5/eut6wuw/,1,[removed],2019-07-24
84,GDP1195,eut86mt,/r/pennystocks/comments/chccc0/fcel/eut86mt/,1,"I sold my fuel cell shares  last week for a 70% loss. They could be going under soon unless they have a turnaround, which is why I sold. They have a lot of debt, not enough liquidity to cover their current liabilities and are losing money, iirc. So I’d say investing in them atm is very risky.",2019-07-24
85,bnguyxn,eutnh29,/r/pennystocks/comments/chcr78/steven_dux_trading_technique_for_sale/eutnh29/,1,are you interested? and no need for copies. everyone have access to the drive once i send the link and yall can download.,2019-07-24
86,HostageKilla-,euu2h1l,/r/pennystocks/comments/che6k8/looking_for_stocks_that_between_1_and_5/euu2h1l/,1,"SLS is at .12 which has dropped near its 52 week low recently.
NAKD is at .09 which is near its 52 week low as well.",2019-07-24
87,OpinionPoop,euuawo8,/r/pennystocks/comments/ch4aqx/ttcm_slide/euuawo8/,1,"After another day of dip, i'd have lost it all !",2019-07-24
88,GourmetFilet,euv49hd,/r/pennystocks/comments/ch4aqx/ttcm_slide/euv49hd/,1,The app roll out was botched. Treating the official launch in play store like a beta. I thought the whole reason to have a beta group of testers was for a legit launch?? Glad I profited but I keep thinking what could have been if this company did it the right way,2019-07-24
89,karben14,euv7ok2,/r/pennystocks/comments/chc0jy/atbpf/euv7ok2/,1,I am still waiting. I hold nothing yet. I have learned to be patient with this sort of thing. I will buy a week or so before the key date. The price usually drops just before the critical date.,2019-07-24
90,tampatrish,euv8yus,/r/pennystocks/comments/chc0jy/atbpf/euv8yus/,1,I took a peek at ATBPF yesterday still have to do some more DD on it. I like this other biotech as well [PMCB](https://stockprice.com/stock-price-featured-content/the-future-of-drug-delivery-has-biotech-investors-focusing-on-one-small-company-2019-07-08/),2019-07-24
91,juggyjt1,euvrppn,/r/pennystocks/comments/ch9rpl/cbbt_round_3_and_visl_round_2/euvrppn/,1,In CBBT at .0016.,2019-07-24
92,Anarkrist,euw6qm4,/r/pennystocks/comments/ch4aqx/ttcm_slide/euw6qm4/,1,"I'm not disagreeing with you but, as a trader, I look for value. There is value in this IDEA. Now that they have opened the app up to allow you to add ""friends"" and such, and you can see their ARks, I can see the value. As it stands, there is no value in the application, but the potential is there, and I'll be interested to see IF the social media aspect (which is confirmed by testers to be in the 2.0 private beta) really brings anything to the table.

I'm interested enough that I'm buying at .017 and below. I may trade it between that level and around .02, but at least there is action coming from inside Tautachrome, and that action is visible, somewhat, to those on the outside. 

My gut is that this has some legs, eventually. But they really need a partnership, IMO.",2019-07-24
93,[deleted],euwmrul,/r/pennystocks/comments/chc0jy/atbpf/euwmrul/,1,[removed],2019-07-24
