,author,id,url,score,text,date
0,IHateMaxRoyalGiants,f94xvol,/r/pennystocks/comments/e3syf3/help_me_out/f94xvol/,1,"Try $EROS, $ADXS, or $FCEL",2019-11-30
1,CandidAttitude51,f9519hm,/r/pennystocks/comments/e3syf3/help_me_out/f9519hm/,1,When do you think these will gain?,2019-11-30
2,2020vw69,f955mh2,/r/pennystocks/comments/e3syf3/help_me_out/f955mh2/,1,"Intelsat(I). I agree with the other post on ADXS, but it’s $.51 so doesn’t fit your criteria.",2019-11-30
3,Stockbaron,f956u49,/r/pennystocks/comments/e3syf3/help_me_out/f956u49/,1,"Look at biotechs they are moving big time like BCRX, AKBA, NVAX, SVRA, CANF, punch a couple of these stocks into stocktwits and you will find more.",2019-11-30
4,WhiteDannyBrown,f958pfl,/r/pennystocks/comments/e3syf3/help_me_out/f958pfl/,1,It’s important to understand that “a couple thousand of profit” is all relative. What’s your buying power? A couple thousand could be easy or impossible.,2019-11-30
5,2020vw69,f95e1fa,/r/pennystocks/comments/e3x7vl/watch_for_nvax_to_moon_this_week/f95e1fa/,1,Why?,2019-11-30
6,Quasarmoto,f95e9ir,/r/pennystocks/comments/e3x7vl/watch_for_nvax_to_moon_this_week/f95e9ir/,1,My guess is correlation. They seem to boom a lot before they crash.,2019-11-30
7,MidWestMind,f95f8iw,/r/pennystocks/comments/e3x7vl/watch_for_nvax_to_moon_this_week/f95f8iw/,1,"On my watchlist, but perfect week to manipulate the price.   I’ll watch it through this next week.",2019-11-30
8,Stockbaron,f95gen3,/r/pennystocks/comments/e3x7vl/watch_for_nvax_to_moon_this_week/f95gen3/,1,"Why is kinda of up in the air. An analyst just gave the shares a price upgrade to 12 based on a new vaccine in phase 3 called Nano. NVAX is a serious vehicle for Volatility and noterietay because of the Bill and Melinda Gates connection.  It gets a lot of attention and moves quickly. When they do make a huge announcement based on an achievement with merit, it will literally sky rocket. This is all assuming that some direct offering doesn’t pop up out of the blue. Not every biotech abuses their shareholders like that. With the worlds richest man behind it, I don’t think they need to raise cash. Knock on wood. With that said, MM’s probably have their price target in mind, you just saw people jump in and collaborate their tooling of the share price on Friday. The momentum could and likely will continue up. Of course it could pull back slightly first to fill the gap is just made jumping up. Overall I’m bullish on it because I was in the trade last time it darted up to $8. I’m already up 200% on calls I bought Friday at open. Just trying to give all a heads up. GLTA",2019-11-30
9,SensibleCreeper,f95gmcr,/r/pennystocks/comments/e3x7vl/watch_for_nvax_to_moon_this_week/f95gmcr/,1,"Lol, never seen a pump n dump?",2019-11-30
10,Bhawks489,f95jikq,/r/pennystocks/comments/e3syf3/help_me_out/f95jikq/,1,I cant tell if you are trolling or didnt read OPs question.,2019-11-30
11,Bhawks489,f95jogh,/r/pennystocks/comments/e3syf3/help_me_out/f95jogh/,1,Check out NURO. Get in quick though news supposedly dropping monday,2019-11-30
12,Bhawks489,f95jugd,/r/pennystocks/comments/e3syf3/help_me_out/f95jugd/,1,That was my question too. Thousands isnt that hard when you have tens of thousands to work with. 100s...not so much,2019-11-30
13,Bhawks489,f95jwml,/r/pennystocks/comments/e3syf3/help_me_out/f95jwml/,1,3 dollar minimum,2019-11-30
14,Radical_way,f95k3i3,/r/pennystocks/comments/e3x7vl/watch_for_nvax_to_moon_this_week/f95k3i3/,1,"Definitely looks like its set up for a vertical green, dont get greedy.",2019-11-30
15,SensibleCreeper,f95moqr,/r/pennystocks/comments/e3x7vl/watch_for_nvax_to_moon_this_week/f95moqr/,1,"Well... this is a shit post. OP get your shit together!

[NVAX](https://clinicaltrials.gov/ct2/show/NCT04120194?term=Novavax+Inc&amp;draw=2&amp;rank=5) doesnt have anything coming up except for their expected preliminary to wrap up sometime Dec. Expect a pump'n dump, but nothing will hold, completion is expected Nov 2020.",2019-11-30
16,SensibleCreeper,f95n6l1,/r/pennystocks/comments/e3x7vl/watch_for_nvax_to_moon_this_week/f95n6l1/,1,"Look how many times they've reversed split, Gates foundation is paying their bills, they're diluting like an SOB. Bio-stocks are a suck, watch your self!",2019-11-30
17,Vallerta21,f95nqn2,/r/pennystocks/comments/e3syf3/help_me_out/f95nqn2/,1,LGBS. Make 5x your money soon,2019-11-30
18,Stockbaron,f95qskw,/r/pennystocks/comments/e3x7vl/watch_for_nvax_to_moon_this_week/f95qskw/,1,"The only thing that made this a shit post was your shit dribbling comment without doing an once more of a search than a Becky standing in her morning latte line. They could in weeks have the most widely used flu vaccine across the US and entire world for that matter. This vaccine is in phase 3 which doesn’t really matter because it has already shown it works well in prior studies. So why I was just attributing the initial move to a little manipulation and was exhibiting my carefulness to everyone, the only shitty messy comment in here is yours so far. Here go sit on the toilet and read their little story... https://www.cnn.com/2019/11/29/health/universal-flu-vaccine/index.html",2019-11-30
19,SensibleCreeper,f95t9r1,/r/pennystocks/comments/e3x7vl/watch_for_nvax_to_moon_this_week/f95t9r1/,1,"Weeks... Lol, you are too new! Good luck in your learning curve.",2019-11-30
20,CSC100,f960lo6,/r/pennystocks/comments/e3x7vl/watch_for_nvax_to_moon_this_week/f960lo6/,1,"Personally I’d avoid NVAX because they’ve been around for 30 years and have never brought anything to market.

There was a ton of hype around the stage 3 trial for RSV vaccine which ultimately missed the primary end point and led to them reverse splitting.

Also, it’s an extremely poorly managed company, which typically doesn’t lead to good results.",2019-11-30
21,gamingftw453,f965zxx,/r/pennystocks/comments/e3syf3/help_me_out/f965zxx/,1,Oh shoot Im new to this stuff since its just a game. So basically we can only buy stocks that are a minimum of $3 and can spend a max of like 25k one stock. We start off with like a 100k which is basically how much I have.,2019-11-30
22,gamingftw453,f966ylw,/r/pennystocks/comments/e3syf3/help_me_out/f966ylw/,1,"So like Im new to this whole stock thing. So since the stocks you listed are like already increasing and like at a peak for the last week or so, do you expect them to keep increasing and as a result I should still buy em",2019-11-30
23,StockBreakoutPlays,f96vxev,/r/pennystocks/comments/e3x7vl/watch_for_nvax_to_moon_this_week/f96vxev/,1,"Needs to breakout over 5 Monday. Short-term trade only. If it can't hold above 5, it'll die. It gets a good run after reverse splits if volume sticks around. We'll see. Good Luck.",2019-11-30
24,UnhappyEll,f96wxge,/r/pennystocks/comments/e44tqd/best_penny_stocks_over_3/f96wxge/,1,You need a different hobby,2019-11-30
25,StockSis,f96wz6y,/r/pennystocks/comments/e3x7vl/watch_for_nvax_to_moon_this_week/f96wz6y/,1,ClayTrader people manipulating this pos stock??,2019-11-30
26,gamingftw453,f96x56j,/r/pennystocks/comments/e44tqd/best_penny_stocks_over_3/f96x56j/,1,wdym?,2019-11-30
27,Odell_Strangehams,f96xazp,/r/pennystocks/comments/e44tqd/best_penny_stocks_over_3/f96xazp/,1,If anyone actually knew this we would be rich.  The best you’ll get here are guesses and speculation.  Most of which will be really wrong.,2019-11-30
28,Bhawks489,f96yo7y,/r/pennystocks/comments/e44tqd/best_penny_stocks_over_3/f96yo7y/,1,Is this the same person asking for that class?,2019-11-30
29,certifiedtyb,f96yzqr,/r/pennystocks/comments/e44tqd/best_penny_stocks_over_3/f96yzqr/,1,Good luck,2019-11-30
30,MikaelRaiders1,f96zq2u,/r/pennystocks/comments/e44tqd/best_penny_stocks_over_3/f96zq2u/,1,$Deez they are about to explode,2019-11-30
31,Stockbaron,f96zwyz,/r/pennystocks/comments/e3x7vl/watch_for_nvax_to_moon_this_week/f96zwyz/,1,"You sound like an emotional trader, I could really care less, I go where the volume goes, but you got it all figured out,  so you do you",2019-11-30
32,Stockbaron,f97014a,/r/pennystocks/comments/e3x7vl/watch_for_nvax_to_moon_this_week/f97014a/,1,"Yes, I suspect a small pull back to fill the gap up from Friday, then the room is clear for take off.",2019-11-30
33,WhiteDannyBrown,f970a8f,/r/pennystocks/comments/e3syf3/help_me_out/f970a8f/,1,Good context. And how long is the context? With 100k fictional cash a couple thousand profit is very realistic! I imagine your teacher won’t allow anything under $3 as you’d be dipping into “penny stocks” which have high volatility. They are largely unpredictable and this class probably wants to teach safe/good habit investing!,2019-11-30
34,StockBreakoutPlays,f970z49,/r/pennystocks/comments/e44tqd/best_penny_stocks_over_3/f970z49/,1,"MNK - bottom reversal pattern has been forming over the past few months. Needs a breakout over 4. 

55% short float. Do your own research on the fundamentals. It's not popular in that regard. Make your own opinion. I trade based mostly on technicals. Buyers have been willing to buy it higher lately. A breakout over 4 may push the short float to start covering to lock in gains from the past two-year decline. Even if it is not this week, I have an alert set to let me know if/when the stock is testing the 4 level.

MNK Chart setup:  [https://imgur.com/zlnjEOd](https://imgur.com/zlnjEOd) 

NIO - I have an alert set for breakout over 2.50

SRNE - could squeeze again if can build over 3.

NVAX - needs to clear 5

SSI - also need to clear 5 for chance at another leg higher. It will also be a good short when they're done with it.

ASLN - on the list, but no bias. We'll see where it opens and how the order book flows. 

EROS - daily chart trying to breakout. Has been known to run .50/1 in the past. 

A few others on the list (do your own homework): CHS, ARLO, GORO, ATRS, AGEN, KDMN, VUZI

Happy Trading!",2019-11-30
35,WhiteDannyBrown,f9711it,/r/pennystocks/comments/e3syf3/help_me_out/f9711it/,1,"You want to focus on high beta stocks given that it’s a bear market, it’s fake money and you are going for broke! You could use this website to find some stocks:

https://www.suredividend.com/high-beta-stocks/

Good luck!",2019-11-30
36,SensibleCreeper,f971ajv,/r/pennystocks/comments/e3x7vl/watch_for_nvax_to_moon_this_week/f971ajv/,1,"After beaking me like that and you're calling me emotional? I was helping you, be more like Becky, not like a hypocrite. Let me know if you need a hug and a spin or any other advice that can help your learning curve, wouldn't want you to fall as hard as this post you made.",2019-11-30
37,Stockbaron,f972tyn,/r/pennystocks/comments/e3x7vl/watch_for_nvax_to_moon_this_week/f972tyn/,1,"Dude your a trip, I’m sure I have been trading a lot longer than you, I don’t need your help, I never asked you to rudely inject your warped post vengeance into my conversation, go troll little girls on Facebook so you can feel some real satisfaction tonight. Nobody needs you holding their hand trading here, we’re all adults, sell some of us are.",2019-11-30
38,[deleted],f97390t,/r/pennystocks/comments/e44tqd/best_penny_stocks_over_3/f97390t/,1,[removed],2019-11-30
39,peridotdragon33,f973o45,/r/pennystocks/comments/e3x7vl/watch_for_nvax_to_moon_this_week/f973o45/,1,"Bought 10K worth of shares, I just can’t realize how people keep posting free stock recommendations that make tons of money on Reddit",2019-11-30
40,gamingftw453,f974fuh,/r/pennystocks/comments/e3syf3/help_me_out/f974fuh/,1,We have until around February.,2019-11-30
41,ADubya87,f974zam,/r/pennystocks/comments/e45qas/searching_for_profitable_penny_stock_traders/f974zam/,1,Unfortunately most seminars and webinars are garbage. Maybe someone else can help. Be skeptical of all those forums and blogs.,2019-11-30
42,cantrollmyR,f9756ia,/r/pennystocks/comments/e44tqd/best_penny_stocks_over_3/f9756ia/,1,Increase a dollar hahaha,2019-11-30
43,Odell_Strangehams,f975ag8,/r/pennystocks/comments/e44tqd/best_penny_stocks_over_3/f975ag8/,1,For real. Cringe worthy bullshit.,2019-11-30
44,cantrollmyR,f975dqz,/r/pennystocks/comments/e44tqd/best_penny_stocks_over_3/f975dqz/,1,Based on his user I’d say he’s a teen getting into stocks for the first time so I’ll cut him some slack,2019-11-30
45,Odell_Strangehams,f975hvo,/r/pennystocks/comments/e44tqd/best_penny_stocks_over_3/f975hvo/,1,Yeah. But he should probably slow it down a bit and learn a bit before he spends his tuition.,2019-11-30
46,cantrollmyR,f975kua,/r/pennystocks/comments/e44tqd/best_penny_stocks_over_3/f975kua/,1,Yeah everyone’s gotta learn somewhere but he will learn stocks aren’t that easy to know it’ll go up a dollar hahaha,2019-11-30
47,Maverick5599,f976auv,/r/pennystocks/comments/e3syf3/help_me_out/f976auv/,1,"Use your money on RH to get infinite leverage and then buy puts on SPY and calls on AMD, can’t go tits up",2019-11-30
48,inthe801,f976w0i,/r/pennystocks/comments/e45qas/searching_for_profitable_penny_stock_traders/f976w0i/,1,"There is no magic formula for stocks. IF someone did figure out a method that was reliable it would soon change because the market changes, and they certainly wouldn't be out selling courses or training when they could be making way more money trading.   It's like surfing or other things... you have to do it alot until you have your own style and method that works for how you think.",2019-11-30
49,certifiedtyb,f977gv2,/r/pennystocks/comments/e45qas/searching_for_profitable_penny_stock_traders/f977gv2/,1,Thing is that I have found my style and method I’m just trying to see if it’s similar or compares to other successful trader. I guess you can say I want reassurance.,2019-11-30
50,StockBreakoutPlays,f977m6o,/r/pennystocks/comments/e45qas/searching_for_profitable_penny_stock_traders/f977m6o/,1,"*I present this comment to challenge your thought process, it is not meant as disrespect.*

So you believe in books but don't believe in a course? What if that course was developed by an author? Or if a book you've read was based on a course?

Why should we offer you connections? What value would you bring to that connection?

Surrounding yourself with profitable traders is a great way to go. But do you think the good ones just give away most of their ideas/concepts and live trades without wanting some compensation, even if its lunch/beer? Not to mention that strategies and market conditions change. The good ones know how to adapt. You need to have constant access to a mentor or group. 

If you put together your own groupthink, you'll have people with all different kinds of strategies. This can be good and bad. Good to learn new things, bad because you may lose money trying to learn their process. Everyone will think their strategy is better than the next guys.

Use Reddit, find other forums, use twitter, use facebook, use insta; but most importantly you need to develop your own playbook of strategies that works for you. It is extremely difficult to change your thought process after you think you've developed a strategy that works, but then over-time you realize it doesn't anymore. Having a group of profitable traders for real feedback is key, but be prepared to spend a little time/money to access those traders that have a similar strategy as you. 

Just don't expect someone to teach you the ropes if you don't bring value to the conversation or aren't willing to compensate them for their time after years of building their own strategies. 

Good Luck &amp; Happy Trading!",2019-11-30
51,certifiedtyb,f978q6p,/r/pennystocks/comments/e45qas/searching_for_profitable_penny_stock_traders/f978q6p/,1,"I totally agree! But unlike books, those who run courses won’t teach you certain patterns, how a candlestick is formed based on momentum, how to find a stock with volume, mention news/catalyst or even the different type of concepts for trading. I actually do have a Twitter (@/sblvd_) which I been following a couple of traders who post great content and I basically had them be a mentor under my radar. I’m not necessarily trying to get spoon feed but I just need someone for reassurance more than anything. I personally feel like I bring value might not be a lot but knowledge and passion I do have!",2019-11-30
52,D_Legare,f978umc,/r/pennystocks/comments/e44tqd/best_penny_stocks_over_3/f978umc/,1,Invest 100% into HMNY. Literally can’t go tits up.,2019-11-30
53,StockBreakoutPlays,f97a5mx,/r/pennystocks/comments/e45qas/searching_for_profitable_penny_stock_traders/f97a5mx/,1,"How do you know what a course will or won't teach you if you haven't/won't take one? 

That's great that you have people to follow on twitter. Have you written down your trade planning process to review with someone or do you have a journal to track your thought process behind your entry and exits? 

As for reassurance, honestly ask yourself if you're looking for someone who will agree with you or are you looking for someone who will provide constructive criticism?",2019-11-30
54,StockBreakoutPlays,f97btcs,/r/pennystocks/comments/e45qas/searching_for_profitable_penny_stock_traders/f97btcs/,1,"I agree with being skeptical. I also believe in the old 'Trust but verify' quote.  That said, there are quality seminars you can learn from even if you know 75% of what they are talking about already. I'm guessing you are a multi-millionaire and should be teaching the seminars, right? Let me know when you have your webinar ready and I'll check it out!",2019-11-30
55,certifiedtyb,f97co05,/r/pennystocks/comments/e45qas/searching_for_profitable_penny_stock_traders/f97co05/,1,"I had this one man that DM’d me a while back and gave me a one week free trial to his course but overall it was messy. What I did like was how people where always posting ticker symbols and their predictions.

My trade ideas other than the ones mentioned in my last comment; position size, support/resistance (supply/demand), patterns and LOTS of patience. My trading journal is basically my twitter account lol.

I’d rather choose constructive criticism over having someone agree with what I’m saying!",2019-11-30
56,StockBreakoutPlays,f97gyp4,/r/pennystocks/comments/e44tqd/best_penny_stocks_over_3/f97gyp4/,1,"The people who know this are rich. You do not know them. If they offered you real advice, you wouldn't believe them anyway.

*Live a few years of your life like most people won’t, so that you can spend the rest of your life like most people never will.*",2019-11-30
57,StockBreakoutPlays,f97hcfe,/r/pennystocks/comments/e44tqd/best_penny_stocks_over_3/f97hcfe/,1,So do you...,2019-11-30
58,Stockbaron,f97lzdu,/r/pennystocks/comments/e3x7vl/watch_for_nvax_to_moon_this_week/f97lzdu/,1,It hits some crazy fast upwards channels when it gets 3+ mil in daily volume. If you like watching your money just flip higher this is a fun one to have in your portfolio. It may drop a bit to film the gap Monday but prepare for take off afterwards. The shorts are going to get stomped out on this one.,2019-11-30
59,[deleted],f97o5rv,/r/pennystocks/comments/e45qas/searching_for_profitable_penny_stock_traders/f97o5rv/,1,[removed],2019-11-30
60,KingOfEMS,f97z3r9,/r/pennystocks/comments/e44tqd/best_penny_stocks_over_3/f97z3r9/,1,What is $Deez? I can’t find it when I search for it.,2019-11-30
61,DelaRosaX,f980em0,/r/pennystocks/comments/e44tqd/best_penny_stocks_over_3/f980em0/,2,Deez nuts,2019-11-30
62,KingOfEMS,f980myt,/r/pennystocks/comments/e44tqd/best_penny_stocks_over_3/f980myt/,1,"😉
 Needed to set you up for delivery.",2019-11-30
63,ErikaSchoene,f9879f2,/r/pennystocks/comments/e45qas/searching_for_profitable_penny_stock_traders/f9879f2/,1,investors business daily is offering 8 weeks for 8 dollars and some of there other programs for 2 weeks free.,2019-11-30
64,ErikaSchoene,f987hrn,/r/pennystocks/comments/e45qas/searching_for_profitable_penny_stock_traders/f987hrn/,1,The only way to do that is to back test your method against a paper account. See if it beats the market over time. There are no trading fees anymore for most trades so it makes calculation easier.,2019-11-30
65,RamzFanz,f98c4hn,/r/pennystocks/comments/e45qas/searching_for_profitable_penny_stock_traders/f98c4hn/,1,"What's funnier, the OP or the gullible replies?

I'm going with OP.

Although, the amount of wasted time the replies required, have me cracking up too!",2019-11-30
66,certifiedtyb,f98cf8b,/r/pennystocks/comments/e45qas/searching_for_profitable_penny_stock_traders/f98cf8b/,0,I think they’re funny too buddy 😂👍🏿,2019-11-30
67,RamzFanz,f98cs7x,/r/pennystocks/comments/e44tqd/best_penny_stocks_over_3/f98cs7x/,1,"What if I don't self-identify as a ""guy?""",2019-11-30
68,RamzFanz,f98curj,/r/pennystocks/comments/e44tqd/best_penny_stocks_over_3/f98curj/,2,GUH,2019-11-30
69,RamzFanz,f98d0j2,/r/pennystocks/comments/e44tqd/best_penny_stocks_over_3/f98d0j2/,1,"So, you're just basically regurgitating what you've heard here?

I like it!",2019-11-30
70,RamzFanz,f98ezvg,/r/pennystocks/comments/e45qas/searching_for_profitable_penny_stock_traders/f98ezvg/,1,"Oh, look, it's new accounts replying to each other promoting selling.

How novel.

Jesus fucking Christ, retards, go work stocktwits where you can dupe thousands, you idiots.",2019-11-30
71,certifiedtyb,f98f6o5,/r/pennystocks/comments/e45qas/searching_for_profitable_penny_stock_traders/f98f6o5/,1,Lmfao just by the way you’re bashing out on me I can tell you haven’t been profitable in 4 years. O GOD I’ll be praying for you. 😂🥺😭,2019-11-30
72,RamzFanz,f98f918,/r/pennystocks/comments/e45qas/searching_for_profitable_penny_stock_traders/f98f918/,1,"I had this one man on Reddit pretend to be two men to try to sell me some bullshit.

Imagine that?!?!?!",2019-11-30
73,certifiedtyb,f98fe9g,/r/pennystocks/comments/e45qas/searching_for_profitable_penny_stock_traders/f98fe9g/,1,I’m actually making my own online course and tech company as we speaking!,2019-11-30
74,RamzFanz,f98fg7l,/r/pennystocks/comments/e45qas/searching_for_profitable_penny_stock_traders/f98fg7l/,1,What you think is they're suckers.,2019-11-30
75,RamzFanz,f98fvqg,/r/pennystocks/comments/e45qas/searching_for_profitable_penny_stock_traders/f98fvqg/,1,"I'm about to provide you with constructive criticism...

...stop trying to rip people off.",2019-11-30
76,RamzFanz,f98siru,/r/pennystocks/comments/e45qas/searching_for_profitable_penny_stock_traders/f98siru/,1,I believe that.,2019-11-30
77,RamzFanz,f98svbx,/r/pennystocks/comments/e45qas/searching_for_profitable_penny_stock_traders/f98svbx/,1,"You're the tard we're supposed to be tricked into funding?!

Dude, you don't have to try hard so much, but you have to try harder than that, for fuck's sake.",2019-11-30
78,certifiedtyb,f98szv8,/r/pennystocks/comments/e45qas/searching_for_profitable_penny_stock_traders/f98szv8/,1,You should find a new hobby this isn’t meant for you 🤷🏿‍♂️,2019-11-30
79,gamingftw453,f9926ky,/r/pennystocks/comments/e3x7vl/watch_for_nvax_to_moon_this_week/f9926ky/,1,So would you recommend buying it on Tuesday instead of Monday?,2019-11-30
80,StockBreakoutPlays,f9958ic,/r/pennystocks/comments/e45qas/searching_for_profitable_penny_stock_traders/f9958ic/,1,"I don't believe I've offered anything for sale? Nor was I the 'man' he was referring too. Even if I had a program, very few people who post here would be able to afford it. 

I do like your passive aggressive communication style though. Your future seminars, since you're obviously a multimillionaire trader, will be amazing to watch! Let me know when they are ready!",2019-11-30
81,StockBreakoutPlays,f995qvm,/r/pennystocks/comments/e44tqd/best_penny_stocks_over_3/f995qvm/,1,"Heard where? If you are implying that I read 50 posts to generate this list, your assumptions would be wrong sir. 

I would love to see your penny watchlist for the week ahead? Do you have a link in which to click so I could read your trade plan? Thanks in advance.",2019-11-30
82,impurfection,f99mmgl,/r/pennystocks/comments/e45qas/searching_for_profitable_penny_stock_traders/f99mmgl/,1,"I'm not a profitable trader yet, I started almost a year ago back in January 2019. I actually got into Timothy sykes TimChallenge because one of his students Steven Dux got interviewed by youtuber Timothy Delaghetto, whom I have been following for a while and that was basically what led me to trust Tim sykes. Fast forward to June, after going through a lot of his material, I learned that his course is not worth the price you pay. From what I have learned all these people offering courses, they're just marketers not real stock traders in my opinion. I'm always down to make connections with someone learning to trade stocks since there aren't many of us to begin with.",2019-11-30
83,carnthesaints,f9aei50,/r/pennystocks/comments/e45qas/searching_for_profitable_penny_stock_traders/f9aei50/,1,"I have averaged a 60% return over the last 12 years, beginning with 50k of capital. You can do the math to figure out how much I have now. Most of the popular patterns you've filled your book with are not helpful; and most of the seminars you see advertised are pure garbage. You need to approach things scientifically, and run thousands of recent charts through neural nets to find patterns that will persist in the short term.",2019-11-30
84,nomadtrader22,f9aso97,/r/pennystocks/comments/e45qas/searching_for_profitable_penny_stock_traders/f9aso97/,1,"I'm a profitable penny stock trader - short only. I got this way by doing everything myself for myself only. 

Any kind of outside input is distracting. 

No hand holding or encouragement offered or accepted. 

Occam's razor!   Example: Why would anyone use L2 when all the orders are from people who have chosen to display them? I want to buy 5000 $AWX let me tell the world first. 

I did receive encouragement along the way from my  P&amp;L",2019-11-30
