,author,id,url,score,text,date
115,HodlGang_HodlGang,ektjnqt,/r/pennystocks/comments/bcmwx2/to_the_person_who_wanted_a_timothy_sykes_review/ektjnqt/,1,"As far as paying for him to teach you how to make millions, isn’t that pretty much what college does? 

Colleges generally make the claim that you can get a job in specific areas of study given you earn a degree form their school. But when it comes to making millions, the odds of finding a job which will get you there are very small. In reality, you probably need to start a business. And from personal experience, studying business, and conducting successful business are two very different things which no school can prepare you for. Some things you just can’t learn in classrooms. That said, I do think schools are primarily scamming students if they don’t actually lead to related careers, which is all too common. 

&gt;Never mind that’s why Aaron Schwartz shared so much knowledge for free that he downloaded from MIT. So people could obtain knowledge and make use of it. 

Following your logic, Aaron would more likely be the one to pirate and distribute Tim’s videos rather than advise people to pay money. 

I’ll just restate my objections aren’t with Tim’s teaching. I object to the validity of certain claims he makes, and I object to paying to learn a subject where the teacher knows 90% of students will fail. 

He doesn’t qualify or filter his students at all to weed out the 90% which are destined to fail. Of course not - he’d be cutting his revenue by 90% if he did that - so of course he takes their money anyways, and tells you anyone can be a millionaire if you follow his teachings   - which at best is only 10% true - and it’s no wonder he makes no guarantees - 

So yeah, I think Tim runs a shady business.",2019-04-13
116,born2rock4life,ektkcqy,/r/pennystocks/comments/bcmwx2/to_the_person_who_wanted_a_timothy_sykes_review/ektkcqy/,1,"We agree on schools being mostly scams. I for one was a Sys Admin and then engineer all through self-learning, Ceres, and compounding experience. Unfortunately many careers require a degree, not to mention pay far less than the tech industry, like teaching for example.

RE the Aaron Schwartz reply; you can find Tim Sykes content for free online. He knows that and advises people to access as much as they can since the internet provides the content for free. He likely wasn’t intending that to mean pirating his material, but regardless, it’s available if sought out.

He runs a business, and at least is honest about it being there to make money. He has the costs stated upfront, and recites the fact numerous times that 90% fail.

I guess comparing it to what many penny stock companies do when they lie to their shareholders and say things are great right before filing bankruptcy, R/S and then selling warrants and grays, etc. I wouldn’t call it shady, just not well-liked. Plenty of companies we have on the boards and try to profit from, whether long or short, are only looking to ensure their financial gain and not share holders. Tim at least wants you to be successful and is telling you the truth about them.",2019-04-13
117,bestsparkyalive,ektkh1i,/r/pennystocks/comments/bcs57b/stocks_available_on_wealthsimple_trade/ektkh1i/,1,TD?,2019-04-13
118,belds,ektlt6g,/r/pennystocks/comments/bcr5fr/what_are_some_stocks_that_you_like_for_long_term/ektlt6g/,1,"Actually I didn’t know this but halo labs is apparently on the NEO Canadian exchange. They’re AGEEF in the US, not sure what their ticker is in Canada. That’s another extraction/concentrates company out of Oregon and currently expanding to the southwest US. They are just now starting to pick up some steam although it could still be a while before they really start moving.",2019-04-13
119,stuntzx2023,ektmmx3,/r/pennystocks/comments/bcr5fr/what_are_some_stocks_that_you_like_for_long_term/ektmmx3/,1,PRPO just signed a deal with a manufacturer for their new technology. ER is next week I believe.,2019-04-13
120,EngineerInDespair,ektofkk,/r/pennystocks/comments/bcv0pt/fcel/ektofkk/,1,"Same, sold it on Friday",2019-04-13
121,psxpetey,ektqt4j,/r/pennystocks/comments/bcmwx2/to_the_person_who_wanted_a_timothy_sykes_review/ektqt4j/,1,I’ll have to check those out,2019-04-13
122,WindyCityMe,ektrma0,/r/pennystocks/comments/bcv0pt/fcel/ektrma0/,1,Long on FCEL. Hope the stock will grow nicely in the new economy. Fingers crossed.,2019-04-13
123,LetsMakeMoney2gether,ektsav5,/r/pennystocks/comments/bcv0pt/fcel/ektsav5/,1,Thanks for the response. Ya at this point all I can do is hope for the same. Id be happy to sell at .90,2019-04-13
124,growtreesplantseeds,ektuilg,/r/pennystocks/comments/bcr5fr/what_are_some_stocks_that_you_like_for_long_term/ektuilg/,1,What do you think of $PUFXF?,2019-04-13
125,BokChoiBoy22,ektvq72,/r/pennystocks/comments/bcr5fr/what_are_some_stocks_that_you_like_for_long_term/ektvq72/,1,Antibe Therapeutics.,2019-04-13
126,belds,ektx8q3,/r/pennystocks/comments/bcr5fr/what_are_some_stocks_that_you_like_for_long_term/ektx8q3/,1,"I’ve heard the name but haven’t looked into them in depth, just looked into them now and it seems fairly promising. They have existing tomato greenhouses that they’re converting into marijuana grow houses so that could give them an edge over other companies that are starting from scratch. 



I’m cautious about Canadian companies that are just starting out because I feel that in the relatively near future there could possibly be overproduction of weed in the country and that could cause problems for the smaller grow ops, possibly putting some of them out of business. 



In the US, craft beers are really blowing up in terms of popularity and if Canada is similar in that respect then I could see something like craft weed doing well even in an over saturated market but I’m not sure if there are companies like that exactly. Also the market might have to mature a bit before that picks up. 



Just my 2 cents. I’m no expert and am relatively new to this but I’ve done a ton of research in the sector",2019-04-13
127,gitbse,ekty7l1,/r/pennystocks/comments/bcr5fr/what_are_some_stocks_that_you_like_for_long_term/ekty7l1/,1,Any news when they sre making that investment?,2019-04-13
128,growtreesplantseeds,ektyagy,/r/pennystocks/comments/bcr5fr/what_are_some_stocks_that_you_like_for_long_term/ektyagy/,1,"I appreciate the insight and definitely share your same sentiment about overproduction. It might not happen for a few years but I agree that the money will then be in marketing, brands, concentrates and edibles/beverages.",2019-04-13
129,Shambala92000,ektymwb,/r/pennystocks/comments/bcr5fr/what_are_some_stocks_that_you_like_for_long_term/ektymwb/,1,Second TEUM.,2019-04-13
130,Shambala92000,ektys28,/r/pennystocks/comments/bcr5fr/what_are_some_stocks_that_you_like_for_long_term/ektys28/,1,This should be a good week. We’ll be very happy in 4-5 weeks I believe.,2019-04-13
131,foghornleghorn,ektyw1o,/r/pennystocks/comments/bcr5fr/what_are_some_stocks_that_you_like_for_long_term/ektyw1o/,1,WRR has potential from the DD I've done.,2019-04-13
132,Shambala92000,ektyw62,/r/pennystocks/comments/bcr5fr/what_are_some_stocks_that_you_like_for_long_term/ektyw62/,1,667% this year!? Wow.,2019-04-13
133,BigShoots,ektyzvf,/r/pennystocks/comments/bcr5fr/what_are_some_stocks_that_you_like_for_long_term/ektyzvf/,1,It's lost nearly half its value this year though - why is that?,2019-04-13
134,inv998,ektzbo5,/r/pennystocks/comments/bcr5fr/what_are_some_stocks_that_you_like_for_long_term/ektzbo5/,1,"That has to be an very old price target  - not valid - you won't find any analyst covering this stock.

[https://www.tipranks.com/stocks/prpo/price-target](https://www.tipranks.com/stocks/prpo/price-target)",2019-04-13
135,drew739-,ektznhz,/r/pennystocks/comments/bcs57b/stocks_available_on_wealthsimple_trade/ektznhz/,1,Webull?,2019-04-13
136,soccergoon13,eku0bun,/r/pennystocks/comments/bcr5fr/what_are_some_stocks_that_you_like_for_long_term/eku0bun/,1,"I am long on SHMP, with the hope that they license their tanks/technology/patent to Big Food / Big Retailer.

If they can't figure it out soon (by end of 2019) I'll probably take my losses in Feb/Mar of 2020 for tax loss harvesting",2019-04-13
137,Shambala92000,eku0cra,/r/pennystocks/comments/bcr5fr/what_are_some_stocks_that_you_like_for_long_term/eku0cra/,1,I’m in on AQB too. What about a small to mid cap for a quick profit? GLUU. CEI. NVAX? I don’t trust any Chinese companies anymore. Shorting HEXO BILI IQ QTT,2019-04-13
138,i_am_trippin_balls,eku1bg1,/r/pennystocks/comments/bcr5fr/what_are_some_stocks_that_you_like_for_long_term/eku1bg1/,1,I'm no expert(meaning I could be very wrong) but I think because its losing in the mobile gaming area to fortnite. However I think it's a good buy because it's at a low price and they announced they are releasing call duty mobile later this year. Activision is the biggest gaming name out there and if cod mobile does well I beleive their stock will be restored to previous value or go even higher. Their profits are still solid if you look at last quarter and I dont see any reason it should go down too much more. I bought a few shares at 43.10 and holding.,2019-04-13
139,skipsthecat,eku3p30,/r/pennystocks/comments/bcr5fr/what_are_some_stocks_that_you_like_for_long_term/eku3p30/,1,"$SHMP
https://microcapdaily.com/naturalshrimp-inc-otcqb-shmp-stock-price-attempts-to-grow/123929/",2019-04-13
140,jaysbora,ekub81e,/r/pennystocks/comments/bcr5fr/what_are_some_stocks_that_you_like_for_long_term/ekub81e/,1,"Disney, BP,Ford, CVS",2019-04-13
141,j0shyuaa,ekuc5bz,/r/pennystocks/comments/bcr5fr/what_are_some_stocks_that_you_like_for_long_term/ekuc5bz/,1,They've already invested so that must tell you something.,2019-04-13
142,MentalTadpole,ekucb3z,/r/pennystocks/comments/bcr5fr/what_are_some_stocks_that_you_like_for_long_term/ekucb3z/,1,"$SSFT - a artifical intelligence (AI) tech company trading on the OTC. It is still quite undiscovered but I suspect it wont be for very much longer. They are based in silicon valley. In 2018 they acquired a tech company called Cornerstone Technologies which is estimated to do $13M in annual revenue. In 2018 they completed audit of financials and uplisted to OTCQB, reduced outstanding share count by 48%, did deals with the San Jose Sharks, Goldengate Bridge, Exterro, and signed agreement to acquire AI company called Hotify (who has deal with Nvidia). Recently they have also signed AI deal with a fortune 1000 tech company and signed LOI to acquire 2 more AI companies, one of which is generating revenue and running at a 40%profit 

Definitely worth doing the research. It is trading at .20 now but I think it is worth much much more",2019-04-13
143,alilfishy,ekucmdo,/r/pennystocks/comments/bcr5fr/what_are_some_stocks_that_you_like_for_long_term/ekucmdo/,1,We are waiting on LPAD and FDA approval. Study was stooped early by FDA for efficacy. Once LPAD approval comes (expects any day) then the buyers will come. This will be direct competition to an inferior product that Pfizer currently has. 10 yr exclusivity for this product. Each billion for buyout is approx $30 per share. My PT is $100/share and been holding almost a yr now. This is my favorite stock I have ever had,2019-04-13
144,alilfishy,ekucrd8,/r/pennystocks/comments/bcr5fr/what_are_some_stocks_that_you_like_for_long_term/ekucrd8/,1,Read a little about their product neutrolin for use in catheters. This will be a game changed at preventing infections. A large Research Study was stopped early by FDA due to efficacy.,2019-04-13
145,MillwrightTight,ekudeko,/r/pennystocks/comments/bcr5fr/what_are_some_stocks_that_you_like_for_long_term/ekudeko/,1,Agreed. Scored some more shares with the recent drop in price. Serious bargain right now IMO,2019-04-13
146,jmb00308986,ekudjf7,/r/pennystocks/comments/bcv0pt/fcel/ekudjf7/,1, My buddy has held it for like 2 years. Never made shit. Finally dumped,2019-04-13
147,TheBazaarTrades,ekuf5mg,/r/pennystocks/comments/bclebx/has_anyone_heard_about_gern/ekuf5mg/,1,I appreciate the insightful opinions it really means a lot to me. I'll be watching it since it looks like on the chart for a potential breakout depending on different scenario theories.,2019-04-13
148,Shambala92000,ekufpm5,/r/pennystocks/comments/bcr5fr/what_are_some_stocks_that_you_like_for_long_term/ekufpm5/,1,"I just looked and I bought 1 share at $8 last month to watch it. Once it popped to over $10.50 I felt I had missed my opportunity. 
You must be very pleased. Congratulations.",2019-04-13
149,PhylosopherKyng,ekul50j,/r/pennystocks/comments/bcr5fr/what_are_some_stocks_that_you_like_for_long_term/ekul50j/,1,"VRUS, man. VYST and LFAP are good options as well. But dude, VRUS is going to be monumental.",2019-04-13
150,TheMaji,ekuu9pv,/r/pennystocks/comments/bcr5fr/what_are_some_stocks_that_you_like_for_long_term/ekuu9pv/,1,CTDT,2019-04-13
151,Whipple24,ekuz3z7,/r/pennystocks/comments/bcr5fr/what_are_some_stocks_that_you_like_for_long_term/ekuz3z7/,1,Vangaurd,2019-04-13
152,Magicdonvito,ekv23fm,/r/pennystocks/comments/bcr5fr/what_are_some_stocks_that_you_like_for_long_term/ekv23fm/,1,"TEUM is already priced in for crazy high expectations. There’s more downside of those expectations aren’t met.

I wouldn’t buy here. 

It looks interesting as that sector is growing well but eh.",2019-04-13
153,Magicdonvito,ekv255g,/r/pennystocks/comments/bcr5fr/what_are_some_stocks_that_you_like_for_long_term/ekv255g/,1,INP.V (Input Capital),2019-04-13
154,IrRoscoeMr,ekv3k5g,/r/pennystocks/comments/bcr5fr/what_are_some_stocks_that_you_like_for_long_term/ekv3k5g/,1,MRS,2019-04-13
155,Crawlzzz,ekv50ud,/r/pennystocks/comments/bcv0pt/fcel/ekv50ud/,1,Held it for a while. No action so I dumped Friday.,2019-04-13
156,airforceyooper,ekv5rzt,/r/pennystocks/comments/bcr5fr/what_are_some_stocks_that_you_like_for_long_term/ekv5rzt/,1,I think you're in the wrong sub.  There's nothing about penny stocks that equates to long term hold or growth.  Penny stocks are dirt cheap for a reason.  You'll probably find what you're looking for in the stocks sub.,2019-04-13
157,hydragyrum2,ekv73x5,/r/pennystocks/comments/bcr5fr/what_are_some_stocks_that_you_like_for_long_term/ekv73x5/,1,"PKG.CN (ParcelPal) is a great one! It’s the Uber of delivery for anything. I’ve been in since 0.24 and they are up to 0.33 now. In most recent news. They recently hit a milestone and delivered 2 million packages. They have an agreement with Amazon currently in the some states. They will be delivering cannabis for Choom in Canada and will soon operate in Ontario. Also, been hearing some rumors about partnering with some major, major retail brands (but not yet confirmed).",2019-04-13
158,alilfishy,ekvqm3z,/r/pennystocks/comments/bcr5fr/what_are_some_stocks_that_you_like_for_long_term/ekvqm3z/,1,"It's a good setup so far but nothing is for certain. We need approval and while it's looking promising, not guaranteed. I'm cautiously optimistic!",2019-04-13
159,MalmDresser,ekvwbjo,/r/pennystocks/comments/bcr5fr/what_are_some_stocks_that_you_like_for_long_term/ekvwbjo/,1,Second this.,2019-04-13
160,gravballe,ekwbcx8,/r/pennystocks/comments/bcr5fr/what_are_some_stocks_that_you_like_for_long_term/ekwbcx8/,1,Nlst mostly just my lottery ticket that I refuse to give up.,2019-04-13
161,Creativity_Rater,ekwhr1j,/r/pennystocks/comments/bcr5fr/what_are_some_stocks_that_you_like_for_long_term/ekwhr1j/,1,"Yeah, I don't trust many long term plays in general, but especially right now when the market is so high.",2019-04-13
162,Creativity_Rater,ekwipu9,/r/pennystocks/comments/bcr5fr/what_are_some_stocks_that_you_like_for_long_term/ekwipu9/,1,"I think small to mid cap for quick profit is the move, but I'm not confident in my knowledge of the markets for the stocks you listed. A quick look at NVAX shows some wonderful signs (inside/institutional buying, an investigation tampering value, a lot of firms suggesting shareholders buy, and their website shows their publications). As long as there are no toxic debt loans I do think I'll hop into NVAX. I cant give an educated opinion on the others lol.",2019-04-13
163,[deleted],ekws401,/r/pennystocks/comments/bclebx/has_anyone_heard_about_gern/ekws401/,1,[removed],2019-04-13
164,MrBombassThicc,ekx6ijr,/r/pennystocks/comments/bcqrir/vtl/ekx6ijr/,1,"VTL was removed from Robinhood, anyone know why? It just happened.",2019-04-13
165,transitmap,ekx7abn,/r/pennystocks/comments/bcs57b/stocks_available_on_wealthsimple_trade/ekx7abn/,1,"According to the site, a stock or ETF must; be common, actively listed on TSX, TSXV, NYSE, NASDAQ, be CDS eligible, have a 52 week high that is OVER $0.50, have an average daily volume of 50,000 shares. 

I too am putting together a list of 5-10 companies, but it’s difficult to check all the boxes and have potential for growth.",2019-04-13
166,Shambala92000,ekxcs28,/r/pennystocks/comments/bcr5fr/what_are_some_stocks_that_you_like_for_long_term/ekxcs28/,1,Mandatory question. What are you eyeing this week?,2019-04-13
167,Brrrooooo,ekxmjmv,/r/pennystocks/comments/bcqrir/vtl/ekxmjmv/,1,1:40 reverse split,2019-04-13
168,rootchakra111,ekxnrft,/r/pennystocks/comments/bckufe/who_here_has_bought_timothy_sykes_vip_program_and/ekxnrft/,1,"When i was looking into it a rep told me it was 3,500",2019-04-13
169,Jpaperz,ekxqaro,/r/pennystocks/comments/bcv0pt/fcel/ekxqaro/,1,Im holding as well .27-.29 seems to be the buy range the last month,2019-04-13
170,ManofMods,eky0d34,/r/pennystocks/comments/bcr5fr/what_are_some_stocks_that_you_like_for_long_term/eky0d34/,1,$[PKG.CN](https://PKG.CN) (Parcelpal),2019-04-13
171,ManofMods,eky2lxm,/r/pennystocks/comments/bcr5fr/what_are_some_stocks_that_you_like_for_long_term/eky2lxm/,1,"Parcelpal has got to be one of the best investment oppurtunities i've seen, yet few speak of it. I say buy in before the hype comes. Once Parcelpal hits the high .20 again then i'm gonna buy more.",2019-04-13
172,ManofMods,eky2mnx,/r/pennystocks/comments/bcr5fr/what_are_some_stocks_that_you_like_for_long_term/eky2mnx/,1,So is every other penny stock.,2019-04-13
173,BeemoHeez,eky5z1b,/r/pennystocks/comments/bclebx/has_anyone_heard_about_gern/eky5z1b/,1,How are we feeling about this today,2019-04-13
174,abaddon2025,eky78lz,/r/pennystocks/comments/bclebx/has_anyone_heard_about_gern/eky78lz/,1,"Well I’m up around 80% so I’m ok, I just wanted to know what others thought.",2019-04-13
175,Shambala92000,eky9wv8,/r/pennystocks/comments/bcr5fr/what_are_some_stocks_that_you_like_for_long_term/eky9wv8/,1,I just bought 5 grand at 8.55. Saw the dip and couldn’t find anything negative let’s hope it has a bright future.,2019-04-13
176,Shambala92000,ekydjsd,/r/pennystocks/comments/bcr5fr/what_are_some_stocks_that_you_like_for_long_term/ekydjsd/,1,"I really appreciate you sharing. I tried to buy 5 grand of SNES this morning at 9. I should have upped my limit price a cent or 2 and I would have gotten in on the 12% boost today. I hate when that happens. 
Lots of dips today. I picked up CRMD, BILI, IQ. Added to Castlight(CSLT) and TEUM. If I had more I would go all in on Cloudera. I need to do more research. It is way to cheap. 
AQB will be on the back burner for now GLUU and PLUG intrigue me as well. Not yet though.",2019-04-13
177,ocelotwhere,ekyza3g,/r/pennystocks/comments/bcr5fr/what_are_some_stocks_that_you_like_for_long_term/ekyza3g/,1,"ORHOF, MDCL, SNNVF, CVSI",2019-04-13
178,amg,ekzbc67,/r/pennystocks/comments/bcr5fr/what_are_some_stocks_that_you_like_for_long_term/ekzbc67/,1,"Hey! Thanks for all your insight, just one question: why would Super Conductive have to keep diluting the stock? I'm still new here and I'm not sure what you mean.",2019-04-13
179,MrBombassThicc,ekzfqt6,/r/pennystocks/comments/bcqrir/vtl/ekzfqt6/,1,Thanks boss 😎😎😎,2019-04-13
180,Airfuir,ekzkf9r,/r/pennystocks/comments/bcr5fr/what_are_some_stocks_that_you_like_for_long_term/ekzkf9r/,1,To raise additional capital as time goes on,2019-04-13
181,mtooth,ekznnif,/r/pennystocks/comments/bcr5fr/what_are_some_stocks_that_you_like_for_long_term/ekznnif/,1,"I should preface and say that $SCON is by far the most risky of the three I mentioned.  I included it just as a fun gamble I suppose as it's also the only one of the three that could maybe turn a $1k investment into $100k or $1mm.  This company has been a terrible investment for the previous decade (the [horrible chart](https://finviz.com/quote.ashx?t=SCON&amp;ty=c&amp;ta=0&amp;p=m) says it all visually).  So I know it's a bit hard to believe this could be a good investment going forward.  I do have a good thesis on why I think it could work, maybe I'll do a followup post on that later.

*Short answer your question*: They have about $1.6MM in annual revenue (almost entirely from Department of Energy research grants which will end soon...) and they spent about $9MM last year.  So in order to make up that difference they sell a lot of stock occasionally.  The stock chart is so bad because they keep issuing new shares of stock, diluting the total supply and driving down the price per share.",2019-04-13
182,amg,ekzo9oz,/r/pennystocks/comments/bcr5fr/what_are_some_stocks_that_you_like_for_long_term/ekzo9oz/,1,"You sold me. I'm in it with you bud.

If it helps it's because it sounds like you're writing about an old friend.",2019-04-13
183,PhylosopherKyng,el001k8,/r/pennystocks/comments/bcr5fr/what_are_some_stocks_that_you_like_for_long_term/el001k8/,1,"That's a stupid response. If you disagree about VRUS then by all means explain why, but otherwise I'm just going to assume you're an ignorant fool who draws overly broad generalizations lacking any nuance or detailed understanding. If you really think VRUS is just another over-hyped penny stock you really need to do some DD.",2019-04-13
184,0ldmanwinter,el00pxg,/r/pennystocks/comments/bcr5fr/what_are_some_stocks_that_you_like_for_long_term/el00pxg/,1,"People are also concerned loot boxes will become banned. A lot of their revenue is tied to this, EA’s too.",2019-04-13
185,ManofMods,el0vy0u,/r/pennystocks/comments/bcr5fr/what_are_some_stocks_that_you_like_for_long_term/el0vy0u/,1,"It is, look back at this post a year from now and you'll see that i'm right.",2019-04-13
186,InternetApprentice,el2i07f,/r/pennystocks/comments/bcr5fr/what_are_some_stocks_that_you_like_for_long_term/el2i07f/,1,"Capstone Turbine, $CPST",2019-04-13
187,cjbri20,el59km3,/r/pennystocks/comments/bcr5fr/what_are_some_stocks_that_you_like_for_long_term/el59km3/,1,GE,2019-04-13
188,belds,el5a3w9,/r/pennystocks/comments/bcr5fr/what_are_some_stocks_that_you_like_for_long_term/el5a3w9/,1,Hmm Wow that’s low. I’m definitely gonna look into this. I’m sure I’ll figure it out when I research but do you know what caused it to drop so much?,2019-04-13
189,cjbri20,el5agim,/r/pennystocks/comments/bcr5fr/what_are_some_stocks_that_you_like_for_long_term/el5agim/,1,"Ha, yes... lots of things. And for good reason. But Larry Culp is the right guy to man the ship. Things are turning. 2-4 year play to double / triple your monies.",2019-04-13
190,belds,el5c4fy,/r/pennystocks/comments/bcr5fr/what_are_some_stocks_that_you_like_for_long_term/el5c4fy/,1,I got a ton of replies in this thread and I haven’t done the research on GE yet but I think this may be one of the best suggestions. Thank you!,2019-04-13
191,cjbri20,el5cp0m,/r/pennystocks/comments/bcr5fr/what_are_some_stocks_that_you_like_for_long_term/el5cp0m/,1,"Yeah it’s a def a value play, def not a penny stock tho lol",2019-04-13
192,ManofMods,el6lx33,/r/pennystocks/comments/bcr5fr/what_are_some_stocks_that_you_like_for_long_term/el6lx33/,1,"All Penny stocks have potential, yet so little fulfill it. What makes you think this one will be different?",2019-04-13
193,throwaway19969,em3520l,/r/pennystocks/comments/bcr5fr/what_are_some_stocks_that_you_like_for_long_term/em3520l/,1,Hey hey...recommend more stocks. Those picks were amazing,2019-04-13
194,blind_mowing,em40y8m,/r/pennystocks/comments/bcr5fr/what_are_some_stocks_that_you_like_for_long_term/em40y8m/,1,?,2019-04-13
