,author,id,url,score,text,date
0,Ian1314,e7g7k48,/r/pennystocks/comments/9moy62/czni_news_out_joining_the_mjcannabis_sector/e7g7k48/,1,Price target?,2018-10-09
1,CaptainWeee,e7g7lpw,/r/pennystocks/comments/9moy62/czni_news_out_joining_the_mjcannabis_sector/e7g7lpw/,1,.004ish probably have a two day run on the news.,2018-10-09
2,Ian1314,e7g8qkh,/r/pennystocks/comments/9moy62/czni_news_out_joining_the_mjcannabis_sector/e7g8qkh/,1,In at 0.0019,2018-10-09
3,Boston_06,e7g8wod,/r/pennystocks/comments/9moy62/czni_news_out_joining_the_mjcannabis_sector/e7g8wod/,1,"These guys are all over the place, motorcycle manufacturing,  food industry and marijuana. Curious to see how their wholsale baking portion can be utilized in the weed game.",2018-10-09
4,mchgrms,e7g9m53,/r/pennystocks/comments/9moy62/czni_news_out_joining_the_mjcannabis_sector/e7g9m53/,1,"I'd be in a few bucks if HIPH was doing a bit better this morning :D

Look's like they're holding at 0.002, they also have a couple large orders on deck waiting to pass through, curious if their boom will hit around lunch or after.",2018-10-09
5,mchgrms,e7g9zit,/r/pennystocks/comments/9moy62/czni_news_out_joining_the_mjcannabis_sector/e7g9zit/,1,They've got some hella large orders coming through. Everyone better be ready to sell by Thursday lol.,2018-10-09
6,CaptainWeee,e7gb3qx,/r/pennystocks/comments/9moy62/czni_news_out_joining_the_mjcannabis_sector/e7gb3qx/,1,"Some idiot kept selling their shit at .0020 every time it broke above it they’d dump into the bid, if people knew how to trade this would have been a lot higher by now. Almost a 100 mil in volume and we’re near the close of yesterday. Smh. See how the rest of the day goes.",2018-10-09
7,jdbrownie88,e7gcoye,/r/pennystocks/comments/9mpgq8/rnx_gold_discovery/e7gcoye/,1,"Interesting company and a significant find, but, sounds like there isn’t enough geologic understanding to make the assumptions in the mock feasibility study. And, their stock price looks like a cryptocurrency.",2018-10-09
8,GlowingPants,e7gdadl,/r/pennystocks/comments/9moy62/czni_news_out_joining_the_mjcannabis_sector/e7gdadl/,1,"This is too fucking funny haha. 

“If people knew how to trade” 

How’s that hiph going lmfao ",2018-10-09
9,FearoTheFearless,e7gerfy,/r/pennystocks/comments/9mpyp0/rcgp/e7gerfy/,1,"What do you think is the price target, its already hitting past 2.50.",2018-10-09
10,NikoSleeps,e7gewzu,/r/pennystocks/comments/9mpgq8/rnx_gold_discovery/e7gewzu/,1,"I too bought into this a week and a bit ago @ $0.98 and bought down to $0.91. If I had more funds to throw at it I would. I too follow on what goes down on [CEO.ca](https://CEO.ca) and reading it just makes me want to buy more since they keep finding nuggets of gold but no news comes out. I believe they are waiting on an article to come out from [seekingalpha.com](https://seekingalpha.com) and it should make it go up a hair or two. 

20K worth of shares and I am sweating my 2.1K of shares LOL I'll be watching you play on the moon from the ground I guess 

&amp;#x200B;

&amp;#x200B;",2018-10-09
11,TheCameraLikesMe,e7gfyfl,/r/pennystocks/comments/9mq6b0/3_marijuana_stocks_that_gained_over_150_in/e7gfyfl/,1,i like ICNAF,2018-10-09
12,dmarie26,e7gg382,/r/pennystocks/comments/9mq6b0/3_marijuana_stocks_that_gained_over_150_in/e7gg382/,1,PYX,2018-10-09
13,CaptainWeee,e7gg3j3,/r/pennystocks/comments/9moy62/czni_news_out_joining_the_mjcannabis_sector/e7gg3j3/,1,Going great another article out just now 🙂 https://www.networknewswire.com/networknewsbreaks/networknewsbreaks-american-premium-water-corp-hiph-brings-first-hydro-nano-cbd-beverage-to-market/‬,2018-10-09
14,JeauxPelle,e7gk6as,/r/pennystocks/comments/9mpgq8/rnx_gold_discovery/e7gk6as/,1,Yeah not totally sure what’s going on with this. Got in couple weeks ago .24 cents and cashed out last week at .93,2018-10-09
15,CaptainWeee,e7gkbmm,/r/pennystocks/comments/9moy62/czni_news_out_joining_the_mjcannabis_sector/e7gkbmm/,1,New $HIPH CEO tweet out: “This is an interesting development especially with new NAFTA agreement. When Farm bill passes will be interesting to see if Wal Mart US will allow CBD - big box retailers are a distribution goal for $HIPH https://bloom.bg/2CCov22,2018-10-09
16,TheFoodWhisperer,e7gn6kp,/r/pennystocks/comments/9mn8tc/week_40_stock_picking_contest_results_the_winner/e7gn6kp/,1,Damn lol we kinda suck,2018-10-09
17,JonTargaryanTheFirst,e7gofob,/r/pennystocks/comments/9mpgq8/rnx_gold_discovery/e7gofob/,1,"I'm in at 96 cents which was a bit high. But I do believe this stock will sell for 1,25 + come Christmas. I'm going to buy more this week as long as it stays at around ,75.",2018-10-09
18,LandmanCA,e7goi4g,/r/pennystocks/comments/9moy62/czni_news_out_joining_the_mjcannabis_sector/e7goi4g/,1,"I'm up over a 1000 bucks in total on HIPH and MLHC. This guy has been solid, and has been getting the early info in. I'm pretty impressed so far. ",2018-10-09
19,GlowingPants,e7gonwm,/r/pennystocks/comments/9moy62/czni_news_out_joining_the_mjcannabis_sector/e7gonwm/,1,"I was in HIPH, my concern is HIPH, don’t know too much about MLHC to form an opinion. I don’t see much strength in HIPH compared to the competition. At an overvalued hype price, it’s very possible it will continue to fall as it did today. ",2018-10-09
20,otcstocks21,e7gqhhl,/r/pennystocks/comments/9mr83g/rcgp_latest_update_from_ceo_on_october_8th_news/e7gqhhl/,1,"Great DD, good work there, this is a going to be a money maker. Float is super low news on the way. Easy money good call! ",2018-10-09
21,otcstocks21,e7gqii9,/r/pennystocks/comments/9mpyp0/rcgp/e7gqii9/,1,$5+,2018-10-09
22,silverlakes123,e7gqkk3,/r/pennystocks/comments/9mr83g/rcgp_latest_update_from_ceo_on_october_8th_news/e7gqkk3/,1,"Agreed, the 284k float is getting locked, it’s just a matter of time until this takes off to $5+",2018-10-09
23,otcstocks21,e7gqvtz,/r/pennystocks/comments/9mr83g/rcgp_latest_update_from_ceo_on_october_8th_news/e7gqvtz/,1,Such a perfect setup price action always follows volume its coming here imo. ,2018-10-09
24,redder_then_it,e7grpen,/r/pennystocks/comments/9mra1r/new_to_penny_stocks/e7grpen/,1,Have you bought a lottery ticket before? Not much different. ,2018-10-09
25,otcstocks21,e7grrxp,/r/pennystocks/comments/9mr83g/rcgp_latest_update_from_ceo_on_october_8th_news/e7grrxp/,1,Check out ATPT filings came up on skull and crossbones trip play. Could run pretty thin for trips.,2018-10-09
26,MrVolatility,e7gs1nh,/r/pennystocks/comments/9mra1r/new_to_penny_stocks/e7gs1nh/,1,"Yeah just go ahead and send me your money, it will be easier and will stay in the US",2018-10-09
27,CaptainWeee,e7gvm4b,/r/pennystocks/comments/9mq6b0/3_marijuana_stocks_that_gained_over_150_in/e7gvm4b/,1,$HIPH,2018-10-09
28,CaptainWeee,e7gvwac,/r/pennystocks/comments/9moy62/czni_news_out_joining_the_mjcannabis_sector/e7gvwac/,1,We’ll be fine. CDEL and two other MMs have been trying to force sellers into their bids all day. The threadline at .05 held where it bounced. Let’s see if they start pushing it up from here.,2018-10-09
29,CaptainWeee,e7gwry1,/r/pennystocks/comments/9moy62/czni_news_out_joining_the_mjcannabis_sector/e7gwry1/,1,$HIPH Back up bid creeping up now above .05 established the third leg base here.,2018-10-09
30,fargalicious,e7gwu9e,/r/pennystocks/comments/9mrzf0/jugr_juggernaut_exploration_took_a_big_hit_today/e7gwu9e/,1,I agree I think it’s an overreaction. Wasn’t too excited to see that this morning. You got in at a killer time ,2018-10-09
31,This_is-my_swamp,e7gwva2,/r/pennystocks/comments/9mpgq8/rnx_gold_discovery/e7gwva2/,1,"Just asking but why do you think it will sell for 1.25+ come Christmas?

&amp;#x200B;",2018-10-09
32,dirtybacon77,e7gwvkf,/r/pennystocks/comments/9mpgq8/rnx_gold_discovery/e7gwvkf/,1,I keep seeing it is halted. Can’t buy in :(,2018-10-09
33,Hyqb,e7gxavj,/r/pennystocks/comments/9mra1r/new_to_penny_stocks/e7gxavj/,1,Sell low buy high,2018-10-09
34,TotesMessenger,e7gz8ho,/r/pennystocks/comments/9mrzf0/jugr_juggernaut_exploration_took_a_big_hit_today/e7gz8ho/,1,"I'm a bot, *bleep*, *bloop*. Someone has linked to this thread from another place on reddit:

- [/r/canadianinvestor] [$JUGR Juggernaut Exploration took a big hit today](https://www.reddit.com/r/CanadianInvestor/comments/9mshyq/jugr_juggernaut_exploration_took_a_big_hit_today/)

&amp;nbsp;*^(If you follow any of the above links, please respect the rules of reddit and don't vote in the other threads.) ^\([Info](/r/TotesMessenger) ^/ ^[Contact](/message/compose?to=/r/TotesMessenger))*",2018-10-09
35,1Dru,e7gzpvi,/r/pennystocks/comments/9mpgq8/rnx_gold_discovery/e7gzpvi/,1,"Damn it man, I’m pissed about this. I heard about this just prior to hearing about LODE. But I could never get it to show up for me on Robinhood. ",2018-10-09
36,kingami413,e7h01lu,/r/pennystocks/comments/9mq6b0/3_marijuana_stocks_that_gained_over_150_in/e7h01lu/,1,"Ive been buying up everything I can in the cannabis industry for the last 6 months, so far its paid off beautifully. ",2018-10-09
37,[deleted],e7h0qkv,/r/pennystocks/comments/9mpgq8/rnx_gold_discovery/e7h0qkv/,1,[removed],2018-10-09
38,RustySpunes,e7h0xn3,/r/pennystocks/comments/9msnon/brokerage_firm/e7h0xn3/,1,Sorry I know of just yield brokers 📛,2018-10-09
39,GGEORGE2,e7h25pb,/r/pennystocks/comments/9mrzf0/jugr_juggernaut_exploration_took_a_big_hit_today/e7h25pb/,1,"I’m the Juggernaut, Bitch!",2018-10-09
40,kingami413,e7h2kdd,/r/pennystocks/comments/9msspz/xxii_is_the_new_igc/e7h2kdd/,1,Facts. Ive been buying it up like a fat kid with cupcakes,2018-10-09
41,AciDeity,e7h2nts,/r/pennystocks/comments/9mra1r/new_to_penny_stocks/e7h2nts/,1,lol so what I’m getting from this is it’s not worth my time,2018-10-09
42,ToastyBoyxd,e7h3jdn,/r/pennystocks/comments/9msspz/xxii_is_the_new_igc/e7h3jdn/,1,why ,2018-10-09
43,ToastyBoyxd,e7h3uz0,/r/pennystocks/comments/9mq6b0/3_marijuana_stocks_that_gained_over_150_in/e7h3uz0/,1,L,2018-10-09
44,GzusWritesGzusWalks,e7h4qg8,/r/pennystocks/comments/9msspz/xxii_is_the_new_igc/e7h4qg8/,1,Proof,2018-10-09
45,goosetavio,e7h63f8,/r/pennystocks/comments/9msspz/xxii_is_the_new_igc/e7h63f8/,1,"idk if this is saying theyre good or bad. 

i would go anywhere near igc so all this tells me and ANYONE whos read news on igc lately is that xxi is a scam too lol ",2018-10-09
46,CaptainWeee,e7h7cza,/r/pennystocks/comments/9mq6b0/3_marijuana_stocks_that_gained_over_150_in/e7h7cza/,1,W tomorrow ,2018-10-09
47,justbeaguy,e7h7fir,/r/pennystocks/comments/9mq6b0/3_marijuana_stocks_that_gained_over_150_in/e7h7fir/,1,"Almost everyone and their mother in North America is investing in Canadian cannabis companies. 

America's been very clear they are likely to not allow people into the country who invest in the stocks. 

I do not touch anything cannabis related, until a few months after it is legalized. 

Let the Smoke Clear and then go from there. Pun intended . ",2018-10-09
48,ApeScape55,e7h7u8z,/r/pennystocks/comments/9mpgq8/rnx_gold_discovery/e7h7u8z/,1,"If they find more gold, then its going to be way above $1+.

&amp;#x200B;

They found 3 large nuggets of gold, and they barely started, i doubt they will find such large pieces of gold again, but I am sure they haven't gathered the rest of it hiding in the mine. 

&amp;#x200B;",2018-10-09
49,getoffmylawn13,e7h8b2x,/r/pennystocks/comments/9msspz/xxii_is_the_new_igc/e7h8b2x/,1,I've been loading up TRPX hoping the same for that one. Super low float and low cap. XXII might be on my list now too.,2018-10-09
50,Denio595,e7h8xz7,/r/pennystocks/comments/9mra1r/new_to_penny_stocks/e7h8xz7/,1,Buy something now that you think people will pay more for later.,2018-10-09
51,Boxcars2,e7h91mf,/r/pennystocks/comments/9msspz/xxii_is_the_new_igc/e7h91mf/,1,"Look for a drop in price in the coming weeks before this quarter's earnings. Hoping that the FDA will make up their minds about low nicotine cigarettes. XXII supposedly has the lowest nicotine cigarette available. Once the FDA ball gets rolling, this company will see big (positive) changes, in my opinion. If you are in, hold hold hold. If you want in, wait for a drop hopefully soon. 

I bought my first wave of shares last year around this time and I got a Christmas card signed by HSIII, added bonus!",2018-10-09
52,Juve94,e7hawgl,/r/pennystocks/comments/9mtvw3/snapchat_about_to_be_a_penny_stock/e7hawgl/,1,"Considering there was a report today that they are almost out of money...

I wouldn’t invest!!",2018-10-09
53,justilitax,e7haxra,/r/pennystocks/comments/9msspz/xxii_is_the_new_igc/e7haxra/,1,$XXII makes me horny.,2018-10-09
54,Diddy43,e7hazxp,/r/pennystocks/comments/9mtvw3/snapchat_about_to_be_a_penny_stock/e7hazxp/,1,How does it work if someone like facebook bought them? How does it work stock wise?,2018-10-09
55,thadtheking,e7hb0fw,/r/pennystocks/comments/9msspz/xxii_is_the_new_igc/e7hb0fw/,1,No thanks. I learned my lesson with this one already.,2018-10-09
56,itsnotmenope,e7hbnkl,/r/pennystocks/comments/9mq6b0/3_marijuana_stocks_that_gained_over_150_in/e7hbnkl/,1,Lol.... I honestly use government banking to invest in weed hahahaha,2018-10-09
57,LAVISHSAV4GE,e7hbry3,/r/pennystocks/comments/9mttok/is_plug_a_good_buy/e7hbry3/,1,$FCEL,2018-10-09
58,thebullishbearish,e7hbxuz,/r/pennystocks/comments/9mtvw3/snapchat_about_to_be_a_penny_stock/e7hbxuz/,1,"Well u would get cash or fb stock in consideration for snap shares. 

However that will never happen, fb has no need for snap and could easily create its own snap style platform for much cheaper than buying snap. 

Fb is not in the biz of buying companies in financial distress, if anyone was gonna buy them they would have done so already. ",2018-10-09
59,WenMun,e7hf8fc,/r/pennystocks/comments/9mtvw3/snapchat_about_to_be_a_penny_stock/e7hf8fc/,1,Facebook did offered them 10 billion buy out before IPO but  Ceo got greedy and said no. ,2018-10-09
60,SedarCDN,e7hfh03,/r/pennystocks/comments/9mrycu/flyvsnacn_thoughts/e7hfh03/,1,"FLY- move on imo. Not much financially to like here. Share structure just keeps getting beat on. 

",2018-10-09
61,Kevenm7,e7hfm0l,/r/pennystocks/comments/9mttok/is_plug_a_good_buy/e7hfm0l/,1,Stay Away .... Run .....Far Far Away From Plug,2018-10-09
62,nervouswiggles,e7hhomy,/r/pennystocks/comments/9mq6b0/3_marijuana_stocks_that_gained_over_150_in/e7hhomy/,1,CVSI ,2018-10-09
63,vakavaka,e7hizjy,/r/pennystocks/comments/9mqd23/rshn_bdci/e7hizjy/,1,Gee thanks,2018-10-09
64,Kungpaodofu,e7hjpiq,/r/pennystocks/comments/9mrirq/october_09_2018_tomorrows_daily_rpennystocks/e7hjpiq/,1,"Well, I got into NIO last week so I got lucky there. SDPI is giving me solid returns. Might pick up some ACRX.",2018-10-09
65,TintStuff,e7hk952,/r/pennystocks/comments/9mtvw3/snapchat_about_to_be_a_penny_stock/e7hk952/,1,Twitter finally turned a profit in February after 12 years of loosing money. Snap has a massive user base still. They aren't just gonna turn over.,2018-10-09
66,bakthi,e7hlv53,/r/pennystocks/comments/9mttok/is_plug_a_good_buy/e7hlv53/,1,"RH analysts rating are misleading - they don’t carry date when those recommendations made, who are those analysts, what is their background.. don’t make any of your decisions based on that.. do DD",2018-10-09
67,O0redstorm0o,e7hm8e1,/r/pennystocks/comments/9mrzf0/jugr_juggernaut_exploration_took_a_big_hit_today/e7hm8e1/,1,Over reaction to what?,2018-10-09
68,whb11,e7hmxwg,/r/pennystocks/comments/9mqd23/rshn_bdci/e7hmxwg/,1,Holy crap... RSHN made a comeback?! That was my first penny stock I traded in college from .0004 and followed it up to .01.. this was back in 2006 or 2007.. I took a look awhile back and saw it was back at .0001 and figured it was gone forever. Had no idea it could still have legs after all these years!,2018-10-09
69,Juve94,e7hn5a4,/r/pennystocks/comments/9mtvw3/snapchat_about_to_be_a_penny_stock/e7hn5a4/,1,"Yes but there is a key difference that you are missing. Twitter has the appeal of celebrity interaction and ultimately the main form of communication for the POTUS. 

Instagram basically created their own version of Snapchat to their already appealing and populated platform. On top of that, they are running their version of Snapchat better than Snapchat is running the original! ",2018-10-09
70,mrsandmamj,e7houq8,/r/pennystocks/comments/9msspz/xxii_is_the_new_igc/e7houq8/,1,Not if you held...,2018-10-09
71,thatguybuddy,e7hp3n3,/r/pennystocks/comments/9mrzf0/jugr_juggernaut_exploration_took_a_big_hit_today/e7hp3n3/,1,News on the cores.  35 holes completed as opposed to the 60 they had planned or hoped to complete. Of the 35 not the stellar news they were previously hyped about. ,2018-10-09
72,isotropy,e7hqtwz,/r/pennystocks/comments/9mrycu/flyvsnacn_thoughts/e7hqtwz/,1,"I wish I didn't agree with you. At this point, i'm hoping for the best, but i'm treating it as dead money.",2018-10-09
73,raw_testosterone,e7hsnp3,/r/pennystocks/comments/9msspz/xxii_is_the_new_igc/e7hsnp3/,1,No way that’s actually cool. I wish I got recognition for being a shareholder at other companies,2018-10-09
74,PM_ur_tots,e7hus3u,/r/pennystocks/comments/9mpgq8/rnx_gold_discovery/e7hus3u/,1,I never have a problem finding it. Maybe try comstock ,2018-10-09
75,StevenMcphearson,e7hvi21,/r/pennystocks/comments/9mtvw3/snapchat_about_to_be_a_penny_stock/e7hvi21/,1,Buy puts ,2018-10-09
76,Boxcars2,e7hvt6g,/r/pennystocks/comments/9msspz/xxii_is_the_new_igc/e7hvt6g/,1,Yeah it was a really nice surprise! Seems like a great group of people at that company!,2018-10-09
77,TomarikFTW,e7hwqlf,/r/pennystocks/comments/9msspz/xxii_is_the_new_igc/e7hwqlf/,1,I agree with you. Users should start posting their holdings if they're going to recommend a stock without any DD.,2018-10-09
78,mynamesrei,e7hx4tf,/r/pennystocks/comments/9mra1r/new_to_penny_stocks/e7hx4tf/,1,DD,2018-10-09
79,Astroboy7877,e7hx66w,/r/pennystocks/comments/9mra1r/new_to_penny_stocks/e7hx66w/,1,"I’ll give you some actual advice and let me know if you have any specific questions.

1. Do your own research. I can’t stress this enough. Don’t take anyone’s stock tip at face value, do your DD (due diligence) and research whatever company you’re buying.

2. This is a penny stock sub and while many penny stocks can bring incredible returns, most will not and there are companies that will prey on gullibility. There are great companies with low valuations, often because of large R&amp;D costs associated with bringing their product to market. It can also be the CEO’s 8th business after running the previous 7 into the ground. Make sure you know WHY a company has the valuation it does and WHY you THINK it will have a higher valuation in the future.

3. You’re new so I would say, if you’ve followed the first two suggestions to the best of your ability, pick stocks that you’re comfortable with and believe in, invest in some shares (be cautious with the amount), and just check in on them occasionally. You can follow news and keep doing research, but don’t be that person that buys shares at $1, panics, sells at $0.85 and then the stock goes to $10. 

4. RESEARCH",2018-10-09
80,JonTargaryanTheFirst,e7hx8zw,/r/pennystocks/comments/9mpgq8/rnx_gold_discovery/e7hx8zw/,1,"All the research I've done says the stock should already sell for 1.25+(Without finding more gold). They also have a lot of reserves in nickel which is something electrical car manufacturing use a lot. You should of course do your own research and evaluation. Just saying that I will be adding to my position all week. Next week when there is more news we could see a steady rise. I don't see this stock as a pennystock where I can make a few bucks fast. I see this as a long position, I will maybe even hold for a year+.",2018-10-09
81,SedarCDN,e7hxf4g,/r/pennystocks/comments/9mrycu/flyvsnacn_thoughts/e7hxf4g/,1,"Lick your wounds. Sleep better, and better yet learn what not to look for. ",2018-10-09
82,AciDeity,e7hxwit,/r/pennystocks/comments/9mra1r/new_to_penny_stocks/e7hxwit/,1,Finally some sound advice thank you!,2018-10-09
83,davidb686,e7hzkos,/r/pennystocks/comments/9msspz/xxii_is_the_new_igc/e7hzkos/,1,Sold last week... Maybe I should buy back in but I'm not sure uggghh,2018-10-09
84,TheBatmanofRH,e7i7jsl,/r/pennystocks/comments/9msspz/xxii_is_the_new_igc/e7i7jsl/,1,It’s the other way around! XXII was hot last fall,2018-10-09
85,Victor_27,e7i8d80,/r/pennystocks/comments/9msnon/brokerage_firm/e7i8d80/,1,If you're interested you could sign up to Webull. Webull is a commission free trading platform similiar to Robinhood but with better analyzes and trading hours. https://act.webull.com/i/y1FxthZSrIc6,2018-10-09
86,skinMARKdraws,e7i8znl,/r/pennystocks/comments/9msspz/xxii_is_the_new_igc/e7i8znl/,1,I would. ,2018-10-09
87,skinMARKdraws,e7i93y4,/r/pennystocks/comments/9msspz/xxii_is_the_new_igc/e7i93y4/,1,Thinking about getting more. Really curious to where the market is going to be going after this whole legalization in Canada. I want to see where cigarettes turn from here. Especially since the shift in the Truth commercials went from hard-drugs to cigarettes. Wonder if it’s gonna shift towards pills. ,2018-10-09
88,Djpaulmarco,e7ib6x3,/r/pennystocks/comments/9msspz/xxii_is_the_new_igc/e7ib6x3/,1,Igc is nothing like XXII which is long term play. Most you will get is 20 cents up and down . Except for yesterday good day,2018-10-09
89,barrell_goat69,e7idgrj,/r/pennystocks/comments/9msspz/xxii_is_the_new_igc/e7idgrj/,1,I got one of those cards too last year! It was super awesome,2018-10-09
90,OIC_U812,e7ieriy,/r/pennystocks/comments/9mtvw3/snapchat_about_to_be_a_penny_stock/e7ieriy/,1,"SnapChat lost a ton of users with their forced update to a platform that is now confusing and cluttered.  I was one of those users that stop using it as often for that reason.

They do have a nice portfolio of IP so there is the potential that another company might purchase them to obtain the IP for their own use of licensing.  

That said if there was a management change that could bring a more intuitive update to the platform they might be able to gain their user base back but the current CEO and management thumbed their nose at the complaints of their users and forgot who they work for.  Developers did a piss poor job of alpha and beta testing major changes to a successful platform with their main user base and competitors took full advantage of giving those pissed off users what they wanted.  Welcome to the world of tech media.

This is a prime example of what happens to companies that think they know what's best for their users and don't respond to feedback.  The CEO's ""Steve Jobs"" approach to forcing his vision onto users was way too early for this company.

Should they miraculously release an update that brings back millions of users and find a less annoying way to place advertisements then this stock may have some life left to it.  If not then buying at rock bottom may pay off if Amazon or Disney decides to acquire them for IP.",2018-10-09
91,ApeScape55,e7if561,/r/pennystocks/comments/9mpgq8/rnx_gold_discovery/e7if561/,1,"More NR, more gold, and more gold coming on its way.

&amp;#x200B;

[http://www.rncminerals.com/2018-10-10-RNC-Minerals-Announces-90-kg-Specimen-Gold-Slab-Recovered-from-Fathers-Day-Vein-Development-Area-at-the-Beta-Hunt-Mine#assets\_all](http://www.rncminerals.com/2018-10-10-RNC-Minerals-Announces-90-kg-Specimen-Gold-Slab-Recovered-from-Fathers-Day-Vein-Development-Area-at-the-Beta-Hunt-Mine#assets_all)",2018-10-09
92,ApeScape55,e7if5rm,/r/pennystocks/comments/9mpgq8/rnx_gold_discovery/e7if5rm/,1,You may have to use a different broker.,2018-10-09
93,ApeScape55,e7if7ew,/r/pennystocks/comments/9mpgq8/rnx_gold_discovery/e7if7ew/,1,"I  recommend using something other than robinhood, its a free app, so it has its limitations.",2018-10-09
94,thebullishbearish,e7ilklv,/r/pennystocks/comments/9ms8zt/patv_ptotf_moving/e7ilklv/,1,New all time highs today on a horrible day for markets. Very positive sign. ,2018-10-09
95,ToastyBoyxd,e7im272,/r/pennystocks/comments/9mq6b0/3_marijuana_stocks_that_gained_over_150_in/e7im272/,1,okay u right,2018-10-09
96,DiligentOrdinary,e7imfep,/r/pennystocks/comments/9mttok/is_plug_a_good_buy/e7imfep/,1,"RH analysts are updated like once a year, they're incredibly unreliable.",2018-10-09
97,LiveFromJeffsHouse,e7iogre,/r/pennystocks/comments/9mttok/is_plug_a_good_buy/e7iogre/,1,"Yep, the analyst review of Tesla still talks about their “new acquisition” of Solarcity. ",2018-10-09
98,CaptainWeee,e7irzu8,/r/pennystocks/comments/9mq6b0/3_marijuana_stocks_that_gained_over_150_in/e7irzu8/,1,Haha weeeeee!!!!,2018-10-09
99,Cameltotem,e7iuz8c,/r/pennystocks/comments/9ms8zt/patv_ptotf_moving/e7iuz8c/,1,Been holding for 8 months :),2018-10-09
100,Joncas94,e7iv6ac,/r/pennystocks/comments/9mpgq8/rnx_gold_discovery/e7iv6ac/,1,"I bought at 1.15, yolo",2018-10-09
101,thebullishbearish,e7ivg0g,/r/pennystocks/comments/9ms8zt/patv_ptotf_moving/e7ivg0g/,1,"Good man. Been holding for since almost day 1 but i am surprised how little talk there has been on redit. Seems most penny stock buyers want hmny or drys lol. 

Huge news on patriot lately with cisco bringing them in to show products off to some partners at a conference and the pentagon also getting a demo. 

Good luck ",2018-10-09
102,Cameltotem,e7j0uo8,/r/pennystocks/comments/9ms8zt/patv_ptotf_moving/e7j0uo8/,1,"Yeah great news coming. 

Not sure why Patriot one is under the radar. Only regret is buying 80% of the stock at the ATH back when we hit 2.4. 

Oh well :)",2018-10-09
103,thebullishbearish,e7j1205,/r/pennystocks/comments/9ms8zt/patv_ptotf_moving/e7j1205/,1,"Good pun “under the radar” lolol

Well u r back in the black today 

Good luck ",2018-10-09
104,PlanetaOTC,e7j2gmp,/r/pennystocks/comments/9mtkwj/subpenny_to_watch_cfgx/e7j2gmp/,1,I had a post about it opened 24 days ago,2018-10-09
