,author,id,url,score,text,date
233,jameson62,fdadnru,/r/pennystocks/comments/ej7hti/a_few_nice_penny_stocks_to_watch_inpx_rttr_and/fdadnru/,1,"classic ""penny stock"" company imo.  not a whole lot out there but it trades like it is. Who knows what is up with them.",2020-01-03
234,BarryMcCochner,fdbea2n,/r/pennystocks/comments/ejn3ow/oil_stocks/fdbea2n/,1,Nasdaq.com is the shit.,2020-01-03
235,TeamMee,fdbnz5f,/r/pennystocks/comments/ejiqab/1k_two_days_in_a_row/fdbnz5f/,1,Thanks for the advice.,2020-01-03
236,MotleyCrooi,fdduq8i,/r/pennystocks/comments/ejdran/inpx_47_premarket_current_538am/fdduq8i/,1,Trade didn't go the way I was expecting it to. Holding onto my 8k shares for a better day.,2020-01-03
237,Jpaperz,fddxx1b,/r/pennystocks/comments/ejdran/inpx_47_premarket_current_538am/fddxx1b/,1,"Same, i wanted to sell at .55 at open and buy OCGN at open",2020-01-03
238,TeamMee,fdextdy,/r/pennystocks/comments/ejiqab/1k_two_days_in_a_row/fdextdy/,1,Didn't set a stop loss. Lesson learned.,2020-01-03
239,MidWestMind,fdez8ad,/r/pennystocks/comments/ejiqab/1k_two_days_in_a_row/fdez8ad/,1,I sold at 10.14 and bought back in at 9.    I’ll wait a bit,2020-01-03
240,RZN_AZ,fdfa4qc,/r/pennystocks/comments/ejjpic/kmph/fdfa4qc/,1,"Vanguard a very trusted investor seems to keep adding 

[https://money.cnn.com/quote/shareholders/shareholders.html?symb=KMPH&amp;subView=institutional](https://money.cnn.com/quote/shareholders/shareholders.html?symb=KMPH&amp;subView=institutional)",2020-01-03
241,yoloJMIA,fdfvkzp,/r/pennystocks/comments/ejbbac/simple_questions_january_03_2020/fdfvkzp/,1,"I'm new to trading penny stocks and am looking for a program or site to screen OTC's that will send me alerts when certain conditions are met. My broker is Fidelity, and the filters in Active Trader Pro seem to only screen tickers on the major exchanges. Any recommendations are appreciated!",2020-01-03
242,rudethirteen,fdfxrzh,/r/pennystocks/comments/ejiqab/1k_two_days_in_a_row/fdfxrzh/,1,How bad did that split hurt?,2020-01-03
243,MidWestMind,fdfzmqq,/r/pennystocks/comments/ejiqab/1k_two_days_in_a_row/fdfzmqq/,1,"down $500 for the day, sold SAVA this morning at 10.14 to lock gains, bought back in around 9 thinking that was the low of the day.    I was supposed to drop some i to NDRA, which I wish I had, but too emotional to SAVA and trying to double dip.     

Down 8% over all, but most of that is from my INPX that I kept from the other day.",2020-01-03
244,rudethirteen,fdfzu77,/r/pennystocks/comments/ejiqab/1k_two_days_in_a_row/fdfzu77/,1,"Some people skeptical about it coming back up. I sold my sava as well. Ended down 4.8% on the day. 
With inpx being a bust right now.... I'm going to ride it out and see if I cant make something back....",2020-01-03
245,MidWestMind,fdg10xj,/r/pennystocks/comments/ejiqab/1k_two_days_in_a_row/fdg10xj/,1,"I bought back half my original position in SAVA, it can drop down to $2 for me lose the money from last week, i’ll sell if it drops below 7.25ish. 

RH glitched at opening, accidentally double ordered 2000 shares of RTTR.   Ended up being my steady rock for the day.",2020-01-03
246,rudethirteen,fdg1yd0,/r/pennystocks/comments/ejiqab/1k_two_days_in_a_row/fdg1yd0/,1,I'm going to clear my portfolio and rebuild it. Got a little sloppy went a little too heavy on the bios. Had alot of bad results.,2020-01-03
247,That_Julian,fdg45gf,/r/pennystocks/comments/ejbqh3/free_trading_app_better_than_robinhood_and_webull/fdg45gf/,1,No u.,2020-01-03
248,Born_OG,fdhlkn6,/r/pennystocks/comments/ejjpic/kmph/fdhlkn6/,1,Well this aged very well! Thanks for the tip. You still holding?,2020-01-03
249,anarchofundalist,fdhlnrf,/r/pennystocks/comments/ejjpic/kmph/fdhlnrf/,1,Right?! Yeah I’m still holding...424 shares. You?,2020-01-03
250,Born_OG,fdhmxjy,/r/pennystocks/comments/ejjpic/kmph/fdhmxjy/,1,"I bought a thousand and sold 250 @ $.50. 

I think I’m going to hold and hope it goes to .60. Might be smart to get out now though.",2020-01-03
251,anarchofundalist,fdhngxb,/r/pennystocks/comments/ejjpic/kmph/fdhngxb/,1,"Yeah, I’m very conflicted...I know it could reset and drop back down, but I also know they’re supposed to file with the FDA any day now. Argh.",2020-01-03
252,Born_OG,fdj8tyb,/r/pennystocks/comments/ejjpic/kmph/fdj8tyb/,1,Yeah tough calls for sure. Would be amazing to see another jump!,2020-01-03
253,skurddd,fdjtjva,/r/pennystocks/comments/ejbbac/simple_questions_january_03_2020/fdjtjva/,1,"I just started with Bux Zero; so far only European options.

I am mostly interested in startups... but since this is my first try at stock trading i was wondering if there is a good read that summarizes the essence.

Eager to learn.

&amp;#x200B;

Any tips on good stocks are welcome",2020-01-03
254,europeein-OG,fdju5hd,/r/pennystocks/comments/ejbewv/aqua_metals_screaming_fire_sale_on_a_solid/fdju5hd/,1,Good call on AQMS!,2020-01-03
255,elliottttttt,fdnq7xf,/r/pennystocks/comments/ejjpic/kmph/fdnq7xf/,1,Thanks for this! I bought 5000 shares yesterday at 50 cents got out at 61.  It’s mooning now so I regret the sale but can’t argue with profit!,2020-01-03
256,512kg,fdnqf41,/r/pennystocks/comments/ejjpic/kmph/fdnqf41/,1,"Holding 2100 since 0,39",2020-01-03
257,Jpaperz,feocydu,/r/pennystocks/comments/ejdran/inpx_47_premarket_current_538am/feocydu/,1,Have you kept a tab on those?,2020-01-03
258,MVPkraty,feotm7q,/r/pennystocks/comments/ejdran/inpx_47_premarket_current_538am/feotm7q/,1,Only a little. I have some RTTR that’s down a bit,2020-01-03
259,Jpaperz,feou3on,/r/pennystocks/comments/ejdran/inpx_47_premarket_current_538am/feou3on/,1,"I sold them all for SPY call yolos for next month, but they all hit if you bought last month :)",2020-01-03
260,TestingTheCat,ffg9t3q,/r/pennystocks/comments/ejbewv/aqua_metals_screaming_fire_sale_on_a_solid/ffg9t3q/,1,30% bump coming next week - it will cycle up and then back to around 0.90 to 1.00.,2020-01-03
261,europeein-OG,ffh11qp,/r/pennystocks/comments/ejbewv/aqua_metals_screaming_fire_sale_on_a_solid/ffh11qp/,1,I took a loss on it. 7% to be exact but still am watching it,2020-01-03
262,2020start,fjexoh3,/r/pennystocks/comments/ejjpic/kmph/fjexoh3/,1,Nda is filed,2020-01-03
