,author,id,url,score,text,date
98,silverlakes123,dwfzzn0,/r/pennystocks/comments/87vnxh/wrfx/dwfzzn0/,1,"That’s odd, I know if you might be using robin hood you may not be able to find it. I’ve got friends who use that and sometimes can’t find the stock symbol. The name of the company is Worldflix inc. if you want to look them up online ",2018-03-28
99,Shull-z,dwg00i3,/r/pennystocks/comments/87vnxh/wrfx/dwg00i3/,1,Hmm alright thanks!,2018-03-28
100,alucarddrol,dwg17k7,/r/pennystocks/comments/87t6mo/thoughts_on_apps/dwg17k7/,1,I don't know,2018-03-28
101,TripsByMonday,dwg6udz,/r/pennystocks/comments/87vnxh/wrfx/dwg6udz/,1,Pump n dump,2018-03-28
102,inflatable_pickle,dwgb0qq,/r/pennystocks/comments/87vnxh/wrfx/dwgb0qq/,1,That’s what I’m here for. Tell me more.,2018-03-28
103,SamWright85,dwgddv3,/r/pennystocks/comments/87si41/best_time_to_buy_in/dwgddv3/,1,"BPMX is probably going down to .05 cents per share. Just saying. My reasoning being, the lack of communication from company heads, and lack of tangible proof of concept will drive the hardcore guys away over time. Think of investing like the ocean, tides come in, and tides go out, and all the while, you never really can say which one will be the biggest. BPMX is a message in a bottle on that ocean tide. Mark this as a prophesy
",2018-03-28
104,youngKING25,dwgebx9,/r/pennystocks/comments/87o31b/vate/dwgebx9/,1,"Thoughts on the recent hybrid aspirin articles I've read? Company Hydrogen Sulfide and another agent?

I'm long and am hoping for news/partnership sooner rather than later. Thanks for your comments btw. Insightful ",2018-03-28
105,Mikeyt1250,dwggdtq,/r/pennystocks/comments/87o31b/vate/dwggdtq/,1,They own the patent. Those articles are from 2012. Bashers gonna bash.,2018-03-28
106,lurkinglimabean,dwgmz3m,/r/pennystocks/comments/87s34s/what_exactly_am_i_doing_wrong/dwgmz3m/,1,"Learn ta my dude, support/resistance, MACD, SRSI.... all the good stuff and youll never need to chase stocks. Also you need to buy the hype sell the news. Be wary of ppl hyping up stocks because they already got it cheap and are looking to profit from your losses. Most ""highly profitable"" penny stocks are just pump and dumps so unless you see the price action narrowing and seeing smaller swings dont invest. ***buy support, sell resistance*** set tight stop losses and always have a target price to get out and dont get greedy when your in the green take the free money while you have it...",2018-03-28
107,ctvette2003,dwgu1ba,/r/pennystocks/comments/87vnxh/wrfx/dwgu1ba/,1,"Not even close, been in for 2 yrs. Look into Mick Davis and Ron Pitcock and  you will see how real this is. Biggest OCat runner in 2018 save this post. Longs have 2.6 billion nshares locked up and inhabe the list of names and their holding's",2018-03-28
108,ComptonCap,dwgvqau,/r/pennystocks/comments/87si41/best_time_to_buy_in/dwgvqau/,1,"Time in the market always beats Timing the market.
If you’re trying to pick entries brush up on technical analysis.",2018-03-28
109,MyCatDorito,dwgwbh3,/r/pennystocks/comments/87vjrr/andi/dwgwbh3/,1,[Andi!](https://youtu.be/2bIDGDbupgE),2018-03-28
110,berto0311,dwgzns5,/r/pennystocks/comments/87nxc2/how_do_you_deal_with_your_loses/dwgzns5/,1,I drink alot,2018-03-28
111,Morsyn,dwh35ao,/r/pennystocks/comments/87s34s/what_exactly_am_i_doing_wrong/dwh35ao/,1,"I hope to god you didn't listen to the people who told you to buy NVCN, lol",2018-03-28
112,EpicFartBlaster7,dwhahn8,/r/pennystocks/comments/87si41/best_time_to_buy_in/dwhahn8/,1,"Plant a flag in that turd, pharmabro.",2018-03-28
113,LandmanCA,dwhg8e8,/r/pennystocks/comments/87o31b/vate/dwhg8e8/,1,"Just wanted to thank you for the info. Doubled down at $0.40, Looking forward to the next few weeks! ",2018-03-28
114,WonkyWombat321,dwibqq2,/r/pennystocks/comments/87s34s/what_exactly_am_i_doing_wrong/dwibqq2/,1,"Don't follow the crowd. It's how most lose $$ in pennyland. Make your own decisions. If you're discovering your stocks from social media...reddit, ihub, FB group, YT channel then that is a huge problem. The majority of the stocks everyone is screaming about on here have already hit their peak. As the first comment eludes to you're chasing which is what the pumpers want you to do.",2018-03-28
115,iX__Xi,dwja9nm,/r/pennystocks/comments/87s34s/what_exactly_am_i_doing_wrong/dwja9nm/,1,Does it work the same way for large investment as well? divide one-time buying to several days in a correction period?,2018-03-28
116,austxtencentbaba,dwkt7by,/r/pennystocks/comments/87s34s/what_exactly_am_i_doing_wrong/dwkt7by/,1,That’s the only way to invest large amounts. You always want to have a little extra cash to buy in when it dips more. ,2018-03-28
117,fluke42,dwm21vj,/r/pennystocks/comments/87si41/best_time_to_buy_in/dwm21vj/,1,I buy when people complain about stocks going red,2018-03-28
118,flydrip,dwnbw2t,/r/pennystocks/comments/87s34s/what_exactly_am_i_doing_wrong/dwnbw2t/,1,Yes,2018-03-28
119,Saints420Fan,dwne9yu,/r/pennystocks/comments/87s34s/what_exactly_am_i_doing_wrong/dwne9yu/,1,You need to do better due diligence. For example if you see something making a run up 500% already you shouldn’t be salivating at this since it’s probably going to come back dow to earth. Find one that’s going to have a good 10k or other filing that hasn’t lifted off yet - then get in early! If you’re chasing then you’ll never get out in time for the dump ,2018-03-28
120,fatfood13,dwon0le,/r/pennystocks/comments/87nxc2/how_do_you_deal_with_your_loses/dwon0le/,1,DRINK,2018-03-28
121,fxcode,dx0nlzm,/r/pennystocks/comments/87s34s/what_exactly_am_i_doing_wrong/dx0nlzm/,1,😂,2018-03-28
