,author,id,url,score,text,date
496,bighead-100,fo8gza0,/r/pennystocks/comments/g6b7z9/decn_annual_report_whos_read_it/fo8gza0/,2,I just read the report and sounds like they right on track. Wonder what a fair valuation of this company will be in a month. I see a way if this works out that they are in the 5 dollar range. Thoughts?,2020-04-22
497,Mustelll,fo8h4d8,/r/pennystocks/comments/g6b7z9/decn_annual_report_whos_read_it/fo8h4d8/,2,Remindme! 1 hour,2020-04-22
498,ShitPostGuy,fo8h4j5,/r/pennystocks/comments/g6b7z9/decn_annual_report_whos_read_it/fo8h4j5/,5,"I’m a consultant in the med device industry. If the FDA approves the product, they can contract out the manufacturing very quickly. Margins will go down, but will probably still be profitable.",2020-04-22
499,bighead-100,fo8h6fi,/r/pennystocks/comments/g6b7z9/decn_annual_report_whos_read_it/fo8h6fi/,1,Trump and DeWine and others eluding to this stock with a specific day sounds like a dog whistle to there friends to get in. Thoughts?,2020-04-22
500,Kyism,fo8h8bz,/r/pennystocks/comments/g698fw/will_decn_continue_to_rise_ive_just_learned_about/fo8h8bz/,2,That $19 projection was from like 10 years ago. That's not recent,2020-04-22
501,JohnnyLakefront,fo8hhnv,/r/pennystocks/comments/g67eri/another_decn_question/fo8hhnv/,2,"From DECNs CEO, Keith Berman, regarding tomorrows announcement:

&gt; ""Mr. Berman continued, ""Our discussion this coming Thursday will be longer than usual, and it will contain quite a bit of information, especially as we discuss the overwhelming response received from business and distributors for the purchase of the kits. We are overcome with optimism we are witnessing daily for this truly remarkable product.""",2020-04-22
502,Minds_Desire,fo8hkrk,/r/pennystocks/comments/g6b7z9/decn_annual_report_whos_read_it/fo8hkrk/,3,This would have happened weeks ago if it were the case.,2020-04-22
503,fistfulofsoap,fo8hmjf,/r/pennystocks/comments/g6b7z9/decn_annual_report_whos_read_it/fo8hmjf/,1,Good info.,2020-04-22
504,juliandr36,fo8hp2k,/r/pennystocks/comments/g698fw/will_decn_continue_to_rise_ive_just_learned_about/fo8hp2k/,1,"Ah, missed the date on that article then. Some articles don’t have dates which I hate because then you have no idea if it’s recent or not. Thank you!",2020-04-22
505,fistfulofsoap,fo8huhu,/r/pennystocks/comments/g6b7z9/decn_annual_report_whos_read_it/fo8huhu/,3,"I figured out what pisses me off about them. It’s their SHITTY website.

Would love to see $5. I got in at .20",2020-04-22
506,69this,fo8i0e6,/r/pennystocks/comments/g65q7a/i_couldnt_wait_till_tomorrow/fo8i0e6/,2,Someone's a little angry they missed this one,2020-04-22
507,ggnigg4z,fo8i59o,/r/pennystocks/comments/g6b7z9/decn_annual_report_whos_read_it/fo8i59o/,0,I didn't hear that who else did I didnt,2020-04-22
508,Isuckatgramar,fo8i8c6,/r/pennystocks/comments/g6b0y7/video_on_bbrw_released_today_that_gives_good/fo8i8c6/,1,What’s you’re honest expectations for this company,2020-04-22
509,chrysler82000,fo8i8nb,/r/pennystocks/comments/g65bjk/decn_exit_strategy/fo8i8nb/,1,DECN has nothing on WLL,2020-04-22
510,veryblueeyes,fo8iev3,/r/pennystocks/comments/g6b7z9/decn_annual_report_whos_read_it/fo8iev3/,1,"Are you kidding me? NBY it IS in California as well:

NovaBay Pharmaceuticals, Inc.
2000 Powell Street, Suite 1150
Emeryville, CA 94608",2020-04-22
511,AgtMScarn,fo8ig7x,/r/pennystocks/comments/g6bgtt/oas_about_to_take_off_all_signs_look_good/fo8ig7x/,1,"I'm a little fuzzy on placing an order during after hours. Let's say with this stock it closed at 0.28, but is up to 0.36 in after hours. If I place an order right now, do I get it at the price it's at at open tomorrow, or at the closing price from today, or at the current after hours price??",2020-04-22
512,youbetchaguy69,fo8iign,/r/pennystocks/comments/g6b9uf/hou_betapro_crude_oil_2x_daily_bull_etf/fo8iign/,1,Well to be precise 78.62 on April 22nd 2019,2020-04-22
513,AgtMScarn,fo8ilxn,/r/pennystocks/comments/g6b7bj/tsxcann_is_a_sleeping_giant_0135_long/fo8ilxn/,2,This,2020-04-22
514,BxMatt,fo8ilza,/r/pennystocks/comments/g684ps/ship/fo8ilza/,0,It’s not.,2020-04-22
515,575MV12,fo8isrd,/r/pennystocks/comments/g6bgtt/oas_about_to_take_off_all_signs_look_good/fo8isrd/,1,I believe you get it at the opening tomorrow.,2020-04-22
516,AgtMScarn,fo8iv14,/r/pennystocks/comments/g6bgtt/oas_about_to_take_off_all_signs_look_good/fo8iv14/,1,"Tough, would be nice if it worked the other way lol. Looks like it's gonna open high.",2020-04-22
517,IceNineOmega,fo8j3v0,/r/pennystocks/comments/g6bnl7/stock_alert_for_42320/fo8j3v0/,1,This was released this morning what makes you think its going to pop tomorrow?,2020-04-22
518,Slow_is_Fast,fo8j6rz,/r/pennystocks/comments/g6b7z9/decn_annual_report_whos_read_it/fo8j6rz/,0,"Do they have a news release scheduled for tomorrow? That’s been eluded to in their press conference from what I gather. 

But dang, still a tight sphincter.",2020-04-22
519,AgtMScarn,fo8j93b,/r/pennystocks/comments/g69nwh/is_it_too_late_to_invest_in_decn/fo8j93b/,1,Lol I can guarantee DSS plummets 10% in the first 20 minutes of the day tomorrow.,2020-04-22
520,drpepper456,fo8j978,/r/pennystocks/comments/g6aofb/yall_need_to_chill/fo8j978/,9,"Isn't it better to have everybody asking, rather than nobody asking? Isn't a pool of knowledge and experience more valuable than none at all? 

For instance, I'm brand new here, I'm up 30% on DECN and never would have known about it except for this sub. I don't even know how the first person in found the company. So I can't find another like it, even if I wanted to. Unless things dramatically change tomorrow, I'll get lucky on this one and move to the next having learned a couple of things on DECN that will make me a better trader in the future. Right now, I don't even know what I don't know. So everybody presenting opinions helps me answer questions that I wouldn't have even thought of. 

Given that perspective, I would say everybody sitting on here running their mouths is still a positive, rather than a negative.",2020-04-22
521,Noexit007,fo8j9w6,/r/pennystocks/comments/g6bnl7/stock_alert_for_42320/fo8j9w6/,9,"Nothing like a post, that just links to another post without any information, that just links to a news article, that's from 8:00 am today meaning if it was going to go up based upon that, it would have gone up today.

What is this garbage ""alert""",2020-04-22
522,IceNineOmega,fo8jguh,/r/pennystocks/comments/g6bgtt/oas_about_to_take_off_all_signs_look_good/fo8jguh/,2,"I've been in on these guys way too long have had 8000 shares at 0.29 cents for about a week. Almost sold this morning at 0.34 but decided to take emotion out of.  It dropped pretty low and then thought I was gonna have to sit on it for another week.  Studied for a few hours picked up my phone and it was blowing up.  Pretty happy right now.  Hoping to make a quick K tomorrow and get out.

&amp;#x200B;

My DD dredged up some docs that showed they are in a good position to finish out the year in terms of capital.  Next year gas needs to rebound above 60 dollars a barrel or this company is dead.",2020-04-22
523,chrysler82000,fo8jp3o,/r/pennystocks/comments/g65bjk/decn_exit_strategy/fo8jp3o/,1,"&gt; Ohio Governor Mike DeWine 

Are you referring to this news conference? Did you listen to the boring blah blah for 90 minutes? Ugh, I did. At 51 minutes, grrrrr..... he mentions he may have news to announce tomorrow in regards to testing. Nice try pumping....I guess it could be somethin in regards to decn if your lookin for it

[https://www.wksu.org/post/watch-live-governor-mike-dewine-covid-19-press-conference](https://www.wksu.org/post/watch-live-governor-mike-dewine-covid-19-press-conference)",2020-04-22
524,mundane_marietta,fo8jph8,/r/pennystocks/comments/g6btlj/anyone_looking_at_or_holding_scon/fo8jph8/,1,isn't this the company destined for a reverse split in June?,2020-04-22
525,whiterhinoqueef,fo8jv1u,/r/pennystocks/comments/g6b7z9/decn_annual_report_whos_read_it/fo8jv1u/,2,They do need a better website. I don’t understand how some businesses have such shit websites and don’t care about it.,2020-04-22
526,MisterPicklecopter,fo8jv9u,/r/pennystocks/comments/g65q7a/i_couldnt_wait_till_tomorrow/fo8jv9u/,2,"Not sure if the organization has been named, just references to a plant in South Korea. Not sure which article had it originally, [but here's one](https://www.bloomberg.com/press-releases/2020-03-18/decn-s-genviro-tm-covid-19-rapid-kit-to-reap-huge-boost-from-3-16-fda-guidance-allowing-for-near-immediate-distrib) that mentions South Korea.",2020-04-22
527,nuubuser,fo8jzi0,/r/pennystocks/comments/g695pu/ohio_governor_eludes_to_decn_announcement_tomorrow/fo8jzi0/,1,Why NBY?,2020-04-22
528,chrysler82000,fo8k5gf,/r/pennystocks/comments/g65bjk/decn_exit_strategy/fo8k5gf/,1,"ugh.... people are so lazy, they refuse to do there own dd. I'm gonna have to be a better pumper and take advantage of these dummies",2020-04-22
529,fitzygerald19,fo8k81j,/r/pennystocks/comments/g6aofb/yall_need_to_chill/fo8k81j/,1,"I appreciate your position, and I’m not discouraging conversation about stocks that are clearly rising, but majority of posts regarding DECN are “how high can it go” and “should I buy, sell, or hold”, which aren’t precursors to intelligent discussion, whereas I’ve seen multiple other people post good DD on the company and upcoming events. That’s all that’s being said",2020-04-22
530,nuubuser,fo8kck8,/r/pennystocks/comments/g6b7z9/decn_annual_report_whos_read_it/fo8kck8/,1,Rumor?,2020-04-22
531,Quzyotto,fo8ke6b,/r/pennystocks/comments/g6au0a/opened_my_penny_stocks_trading_account_1_month/fo8ke6b/,-2,Addicted until your begginers luck runs out. You probably think you are the next Warren Buffet. Good good. Make an all in bet on some stock.,2020-04-22
532,IceNineOmega,fo8kffn,/r/pennystocks/comments/g6bnl7/stock_alert_for_42320/fo8kffn/,2,Yeah and if you look at the stock is did double volume today already. I’m not going to say it can’t go up. But I don’t think it is.,2020-04-22
533,Drummerboy2864,fo8ki4w,/r/pennystocks/comments/g6b7bj/tsxcann_is_a_sleeping_giant_0135_long/fo8ki4w/,1,"My only issue with your post is mentioning the costs incurred from procuring additional machinery. They would have to capitalize their equipment purchases and depreciate them over at least 5 years, in which case the expense would not impact Q4 2019 financials by much and will continue to beat down net profitability in the form of depreciation expense.",2020-04-22
534,Puttanas,fo8kmwc,/r/pennystocks/comments/g65q7a/i_couldnt_wait_till_tomorrow/fo8kmwc/,3,Get ETrade or TD as backup .. Robinhood doesn’t allow these type of stocks,2020-04-22
535,Neng1987,fo8kts1,/r/pennystocks/comments/g6aofb/yall_need_to_chill/fo8kts1/,1,"I got in around .09, took $2k profit and bought back in 3 more time for $550 and 300 gain.  As of now I’m up 1900 would most likely sell tomorrow as I’m not expecting great news(approval).",2020-04-22
536,drpepper456,fo8ktut,/r/pennystocks/comments/g6aofb/yall_need_to_chill/fo8ktut/,4,"I think my point, not well articulated, is that we take the good with the bad. Numpties like me won't contribute anything of value. Nevertheless, we love to hear ourselves talk. So, how high do you think it goes tomorrow?",2020-04-22
537,fitzygerald19,fo8l4oq,/r/pennystocks/comments/g6aofb/yall_need_to_chill/fo8l4oq/,1,"Haha your point was valid, and you’re not wrong, I just spend far too much time looking through these on my days off and should probably chill. Still, I’ll be tuning in on the announcement tomorrow and if it’s great news, my finger will be right on the trigger to buy back in",2020-04-22
538,nuubuser,fo8l5q1,/r/pennystocks/comments/g68o2d/decn_and_nby_are_both_finger_prick_tests_for/fo8l5q1/,1,NBY tests are from China?,2020-04-22
539,Eurothemist,fo8l653,/r/pennystocks/comments/g6c0bb/decn_question/fo8l653/,13,"DECN to $10 tomorrow,  we are all getting DECN tattoos on our asses to celebrate",2020-04-22
540,CharCoolkent,fo8l7fr,/r/pennystocks/comments/g67qcs/decn_or_pctl/fo8l7fr/,1,What time will the news come out?,2020-04-22
541,CharCoolkent,fo8la5p,/r/pennystocks/comments/g6c0bb/decn_question/fo8la5p/,1,What time will the news come out?,2020-04-22
542,JohnnyLakefront,fo8ld03,/r/pennystocks/comments/g6aofb/yall_need_to_chill/fo8ld03/,4,"people buy stocks at the highest they've ever been all the time.... 

Unless you're in a recession, you're probably buying a stock at the highest it's ever been.",2020-04-22
543,Eurothemist,fo8ld1j,/r/pennystocks/comments/g6c0bb/decn_question/fo8ld1j/,1,10:15,2020-04-22
544,worldrobotdomination,fo8leuq,/r/pennystocks/comments/g6b7yz/decn_tomorrow/fo8leuq/,3,"LONG: Maybe he will report that FDA has not responded yet, but there are orders PILING UP to fill when FDA finally approves everything.",2020-04-22
545,DerivativeOf0,fo8lf39,/r/pennystocks/comments/g6b7z9/decn_annual_report_whos_read_it/fo8lf39/,1,Could also be NBY.,2020-04-22
546,CharCoolkent,fo8lfbr,/r/pennystocks/comments/g6c0bb/decn_question/fo8lfbr/,1,10:15 EST?,2020-04-22
547,bboosie,fo8lgr4,/r/pennystocks/comments/g6c0bb/decn_question/fo8lgr4/,5,What color lambo do you guys want?,2020-04-22
548,isaac11117,fo8lh9r,/r/pennystocks/comments/g6c0bb/decn_question/fo8lh9r/,2,And matching lambos,2020-04-22
549,bighead-100,fo8lj8p,/r/pennystocks/comments/g6b7z9/decn_annual_report_whos_read_it/fo8lj8p/,1,Does this company have a news conference scheduled for tomorrow as DECN does.,2020-04-22
550,Cloudxixpuff,fo8lkik,/r/pennystocks/comments/g6bnl7/stock_alert_for_42320/fo8lkik/,3,Dude its topsecret248,2020-04-22
551,Eurothemist,fo8lppf,/r/pennystocks/comments/g6c0bb/decn_question/fo8lppf/,1,I believe yes,2020-04-22
552,reddef,fo8lrrw,/r/pennystocks/comments/g6b7z9/decn_annual_report_whos_read_it/fo8lrrw/,1,Biomerica.,2020-04-22
553,nickef,fo8lyz0,/r/pennystocks/comments/g695pu/ohio_governor_eludes_to_decn_announcement_tomorrow/fo8lyz0/,1,"NBY signed a distribution agreement. Nothing with FDA yet, but I think it’s coming and I think Mike was talking about NBY. I hold both, but it doesn’t make any sense for Mike to tout something with more information in a day or two if he’s talking about DECN. DECN doesn’t even have a functional test available. They’re still trying to get their hands on blood samples if I remember correctly. He had to be referencing NBY. He wants tests yesterday not in a couple months/end of year.",2020-04-22
554,nickef,fo8m0kc,/r/pennystocks/comments/g695pu/ohio_governor_eludes_to_decn_announcement_tomorrow/fo8m0kc/,1,See my comment above.,2020-04-22
555,reddef,fo8m6cq,/r/pennystocks/comments/g6b7z9/decn_annual_report_whos_read_it/fo8m6cq/,1,NovaBay,2020-04-22
556,juliandr36,fo8m6qm,/r/pennystocks/comments/g698fw/will_decn_continue_to_rise_ive_just_learned_about/fo8m6qm/,2,"I honestly went through that, I skipped ahead a bit in places but didn’t hear anything about genviro or DECN... what was I supposed to gather from this video? I must’ve missed it. Sorry!",2020-04-22
557,Jamon_User,fo8m9ei,/r/pennystocks/comments/g6c0bb/decn_question/fo8m9ei/,2,Matte black with gold accents for me.,2020-04-22
558,575MV12,fo8mb8y,/r/pennystocks/comments/g6c0bb/decn_question/fo8mb8y/,11,"If it did hit $10 tomorrow, I’d get a tattoo of DECN on my knuckles....to always remember where I came from",2020-04-22
559,FSUag,fo8mdnb,/r/pennystocks/comments/g69g6x/tops/fo8mdnb/,2,"Apologies it was actually 3 weeks ago they sold those ships. 

Here is the link: https://www.google.com/amp/s/seekingalpha.com/amp/news/3556434-top-ships-set-to-complete-sale-of-two-vessels-for-20m

My opinion on another run is essentially valueless. To be completely honest with you I’ve been burned by this stock, so I choose to stay away. Oil will inevitably rebound though.",2020-04-22
560,575MV12,fo8mdw3,/r/pennystocks/comments/g6c0bb/decn_question/fo8mdw3/,2,Balloon White,2020-04-22
561,JohnnyLakefront,fo8mhhh,/r/pennystocks/comments/g6b7z9/decn_annual_report_whos_read_it/fo8mhhh/,3,"&gt; Do they have the resources to pull this off?

they took out a near 0% interest loan to buy manufacturing equipment and supplies, as well as float them for the year to pull it off. First wave of tests are supposed to be ready around may, which is in like a week. 

So, yea.

It's definitely an underdog story, but we're in a forum for penny stocks. They're all underdog stories, the point is that this one might actually pull it off.",2020-04-22
562,whiterhinoqueef,fo8mnp5,/r/pennystocks/comments/g6c0bb/decn_question/fo8mnp5/,1,I’ve heard PST but I’ve also heard EST. I have no clue lol,2020-04-22
563,Shakwando,fo8mq5t,/r/pennystocks/comments/g6c0bb/decn_question/fo8mq5t/,3,DECN purple.  It's a new official lambo color option.,2020-04-22
564,bigbudala,fo8mrto,/r/pennystocks/comments/g6c0bb/decn_question/fo8mrto/,1,Can someone buy me one since I’m not able to buy OTC stocks 🙄,2020-04-22
565,Frank_red,fo8mtmy,/r/pennystocks/comments/g6au0a/opened_my_penny_stocks_trading_account_1_month/fo8mtmy/,2,I have been at it for months and I have not come close to this.  Congrats! Can you give me a few tips on trading?,2020-04-22
566,ChefPauley,fo8mtnh,/r/pennystocks/comments/g6bgtt/oas_about_to_take_off_all_signs_look_good/fo8mtnh/,1,Place a limit order at what you are willing to go in at. Wake up early and do some DD and watch it!,2020-04-22
567,Shakwando,fo8mu0z,/r/pennystocks/comments/g6bnl7/stock_alert_for_42320/fo8mu0z/,1,"I'm just a post, inside a post linking to another post.",2020-04-22
568,Eudamonia,fo8n2qc,/r/pennystocks/comments/g68o2d/decn_and_nby_are_both_finger_prick_tests_for/fo8n2qc/,1,"Saw this in Seeking alpha:

NovaBay Pharmaceuticals (NYSEMKT:NBY) is up 111% premarket on the heels of an agreement with Shenzhen Microprofit Biotech Co., Ltd. to become the exclusive U.S. distributor of a rapid, finger stick test to determine the presence of COVID-19

So I assume",2020-04-22
569,veryblueeyes,fo8n2vd,/r/pennystocks/comments/g6c0bb/decn_question/fo8n2vd/,0,No. To profit you will need to buy NBY.,2020-04-22
570,justl1ve,fo8n5w5,/r/pennystocks/comments/g6au0a/opened_my_penny_stocks_trading_account_1_month/fo8n5w5/,3,U think $Trnx might go up anytime soon,2020-04-22
571,randomdudeinFL,fo8na92,/r/pennystocks/comments/g65bjk/decn_exit_strategy/fo8na92/,1,"“Thursday April 23 on issues concerning the progress of our GenViro! Covid-19 test kits as well as other company crucial business issues.”

I’m in med device...just starting to look at this, because I’m looking for my next short term stock play.  

Just my opinion, but the first sentence in the quote indicates delays of some sort.  Tbh, I haven’t researched enough to have an idea of what those delays might be with this company.  It seems it would either be something that would delay EUA from the FDA or concerns with their manufacturing scalability if EUA goes through.  The latter could be tied to financial challenges.  Can’t access their balance sheet on Yahoo, but I do see the negative cash flow.  Seems like financial issues could be resolved by a big government order, though, if they really have a winner.  

The release did say they would be talking, “longer than usual”, which I’m not sure what usual is for them.  They will likely cover their issues but will spend a fair amount of time to try and ensure that confidence isn’t lost over whatever issues they present. 

It’s an interesting play...not sure which side I fall on yet...",2020-04-22
572,[deleted],fo8ni5x,/r/pennystocks/comments/g67eri/another_decn_question/fo8ni5x/,1,[removed],2020-04-22
573,MattGiberti,fo8nn8u,/r/pennystocks/comments/g6au0a/opened_my_penny_stocks_trading_account_1_month/fo8nn8u/,3,God damn dude,2020-04-22
574,broker_than_broke,fo8nu8p,/r/pennystocks/comments/g6au0a/opened_my_penny_stocks_trading_account_1_month/fo8nu8p/,4,Ban him,2020-04-22
575,SuperExtrovert,fo8o4l7,/r/pennystocks/comments/g6au0a/opened_my_penny_stocks_trading_account_1_month/fo8o4l7/,1,Outside of indicators what gives you confidence to take a current position? Research? I need to develop a better strategy. I can only find stocks that only move 10 cents.,2020-04-22
576,broker_than_broke,fo8o90v,/r/pennystocks/comments/g6au0a/opened_my_penny_stocks_trading_account_1_month/fo8o90v/,2,You're telling me you learned all this in a month? I'm still learning. Also RH pre market buy is 6am pst/9am est. Webull is 4 am pay/ 7am est. Most RH users miss out on premarket. Ban!,2020-04-22
577,jagbath,fo8obxe,/r/pennystocks/comments/g6au0a/opened_my_penny_stocks_trading_account_1_month/fo8obxe/,1,Damn someone’s gotta show me how to do that.,2020-04-22
578,Bubbs77,fo8ocjf,/r/pennystocks/comments/g6a7ij/tim_sykes_anyone/fo8ocjf/,1,"Here’s the deal. Tim Sykes can help you find your own watch list. He tells you that you can use his but prefers you learn how to find your own. But what happens once you find your own?? Do you know what to do with it?? Tim can help you with that too. A lot of guys like to bash him. One set of guys are just born with the right genes. They understand the market like Neo in the matrix. They are just highly intelligent highly functional people that walk through some things in life with ease. These guys don’t understand how everyone doesn’t see how easy it all is. Other guys have put in all the long and hard work for years and are finally profitable and think everyone should gruel it out on their own while trying to feel their way around in the dark. So they bash Tim. Some guys bash Tim because others bash tim and it makes them feel tough like a dude with a fake twitter handle. Here’s the deal. Tim is not the best trader out there and admits as much. He pushes a lot of material because it makes him tons of money and he likes what he does. You don’t need everything Tim puts out. But if you are trying to learn his bread and butter on trading he can help you lay a foundation on the basics that you can learn in a 30hr course for a few hundred bucks verses years of studying and loosing money. I taught myself how to trade long term stocks and have done fairly well, but it’s slow money. Day trading (fast money) was kicking my tail so I watched Tim’s how to make millions and now I’m profitable on 70-80% of my trades. And my losses are minimal because I cut losses before I get in to deep Tim’s foundation material did not make me millions but it did help me get past months or years of trial and error and I’m profitable. I get his watch list and sometimes don’t look at it for days. Often times I find he didn’t trad anything I did and sometimes we both traded the same stocks. He helped me find the right ones to look at and what to do once I found them. Don’t go overboard with all his stuff. A lot of it is repetitive but most is helpful. One or two of his video seminars will cover pretty much all he’s got. I have friends that lay for the full subscription and use the active message board. They have got some good info there at times and had their ass handed to them other times. So I would be careful relying on any message board. I trade what the chart tells me not some message board full of gamblers. Hope this helps",2020-04-22
579,Zb2211,fo8os8b,/r/pennystocks/comments/g65q7a/i_couldnt_wait_till_tomorrow/fo8os8b/,2,Man I lost some much on SBES I should have joined DECN,2020-04-22
580,juliandr36,fo8ozut,/r/pennystocks/comments/g698fw/will_decn_continue_to_rise_ive_just_learned_about/fo8ozut/,2,Nevermind :),2020-04-22
581,BlueDirector,fo8p03a,/r/pennystocks/comments/g6c0bb/decn_question/fo8p03a/,3,i’m holding you to this,2020-04-22
582,juliandr36,fo8p4xw,/r/pennystocks/comments/g6aofb/yall_need_to_chill/fo8p4xw/,1,"I get what you’re saying. I’m new to investing and any tiny bit of info even if it’s a dumb question sparks brand new info for me. Opinions are guidance. Investing is all a guessing game anyway. I hope to not be asking dumb questions soon! I’m finding new resources every day, including this sub I find like 3 hours ago :)",2020-04-22
583,ninodenino,fo8peru,/r/pennystocks/comments/g6c0bb/decn_question/fo8peru/,1, Yes,2020-04-22
584,_ba2,fo8pmju,/r/pennystocks/comments/g65q7a/i_couldnt_wait_till_tomorrow/fo8pmju/,1,Damn I just opened a account and I’m glad I wire transferred it because it was directly there. Only downside was I got in at 0.37,2020-04-22
585,Uncle_Jer,fo8pw3d,/r/pennystocks/comments/g6aofb/yall_need_to_chill/fo8pw3d/,3,You’re new to investing which is great and you just found this subreddit which is great but it doesn’t mean it’s a good idea to just jump on what half the idiots including myself are saying,2020-04-22
586,CharCoolkent,fo8pzsu,/r/pennystocks/comments/g6c0bb/decn_question/fo8pzsu/,2,Thanks:) Just put in order for 33 shares,2020-04-22
587,PupPop,fo8q20y,/r/pennystocks/comments/g69rzj/denburydnr_aint_playing/fo8q20y/,1,That's nearly 100% gain. What would drive that to happen?,2020-04-22
588,iheartaginganddying,fo8q3ta,/r/pennystocks/comments/g6c0bb/decn_question/fo8q3ta/,3,Wow you’re gonna be rich!!!!!! Lol,2020-04-22
589,[deleted],fo8q5s6,/r/pennystocks/comments/g6c0bb/decn_question/fo8q5s6/,1,[deleted],2020-04-22
590,[deleted],fo8q80p,/r/pennystocks/comments/g6c0bb/decn_question/fo8q80p/,1,[deleted],2020-04-22
591,[deleted],fo8qbxy,/r/pennystocks/comments/g6c0bb/decn_question/fo8qbxy/,1,[deleted],2020-04-22
592,mooosch,fo8qi3y,/r/pennystocks/comments/g6c0bb/decn_question/fo8qi3y/,1,Not it,2020-04-22
593,CharCoolkent,fo8qigv,/r/pennystocks/comments/g6c0bb/decn_question/fo8qigv/,1,lol,2020-04-22
594,DiarrheaShitSoup,fo8qizc,/r/pennystocks/comments/g65q7a/i_couldnt_wait_till_tomorrow/fo8qizc/,1,"&gt;buy the rumor sell the news

Kek, Iove it. New one on me",2020-04-22
