,title,id,author,url,score,num_comments,text,date,link
0,GUSH shares??,fojm1f,bangbrigade,https://www.reddit.com/r/pennystocks/comments/fojm1f/gush_shares/,1,3,Were they not just at .50 a share?? Looked at Robinhood and it shows no history of their shares being that low. I’m also pretty sure I bought more than 3 shares but that’s what it’s saying right now. Can someone clear this up? I’m pretty new to this and don’t know what’s going on.,2020-03-25,https://www.reddit.com/r/pennystocks/comments/fojm1f/gush_shares/
1,MIST,fojjln,Ramrod454,https://www.reddit.com/r/pennystocks/comments/fojjln/mist/,1,10,Dropped 87% yesterday. Hadn’t heard about it before today. Maybe something to watch?,2020-03-25,https://www.reddit.com/r/pennystocks/comments/fojjln/mist/
2,GASL,fojgd8,codygray27,https://www.reddit.com/r/pennystocks/comments/fojgd8/gasl/,1,1,Is is gonna boom?,2020-03-25,https://www.reddit.com/r/pennystocks/comments/fojgd8/gasl/
3,$JNUG,fole6k,balanarllds,https://www.reddit.com/r/pennystocks/comments/fole6k/jnug/,1,9,"JNUG hit $6 after-market. JDST now at $2.20.   
Will JNUG goes up to $7 or $8 or... JDST with a comeback.

This stocks is killing me for weeks!",2020-03-25,https://www.reddit.com/r/pennystocks/comments/fole6k/jnug/
4,Peix?,fol6jg,knopucs,https://www.reddit.com/r/pennystocks/comments/fol6jg/peix/,1,0,"Has been steady, anyone else see this one possibly increasing?",2020-03-25,https://www.reddit.com/r/pennystocks/comments/fol6jg/peix/
5,"Senate, White House reach $2 trillion stimulus deal to blunt coronavirus fallout",fokvr2,Purplepunch36,https://www.reddit.com/r/pennystocks/comments/fokvr2/senate_white_house_reach_2_trillion_stimulus_deal/,1,6,https://www.washingtonpost.com/us-policy/2020/03/24/trump-coronavirus-congress-economic-stimulus/,2020-03-25,https://www.reddit.com/r/pennystocks/comments/fokvr2/senate_white_house_reach_2_trillion_stimulus_deal/
6,CLWD,fokv4f,benjaminspaper,https://www.reddit.com/r/pennystocks/comments/fokv4f/clwd/,1,0,[removed],2020-03-25,https://www.reddit.com/r/pennystocks/comments/fokv4f/clwd/
7,$GRYO,fokowf,benjaminspaper,https://www.reddit.com/r/pennystocks/comments/fokowf/gryo/,1,0,[removed],2020-03-25,https://www.reddit.com/r/pennystocks/comments/fokowf/gryo/
8,BPY AP TAC OCC KRA SOHO,fokkjb,DragonElder,https://www.reddit.com/r/pennystocks/comments/fokkjb/bpy_ap_tac_occ_kra_soho/,1,6,This is my watch list what do you guys think?,2020-03-25,https://www.reddit.com/r/pennystocks/comments/fokkjb/bpy_ap_tac_occ_kra_soho/
9,Just wondering could we allow polls on this sub? It would be cool if you could post your watch list and people could vote for which one they thought was the best.,fokfmu,DragonElder,https://www.reddit.com/r/pennystocks/comments/fokfmu/just_wondering_could_we_allow_polls_on_this_sub/,1,3,This may just be me but I think it would be a good tool for this sub to have.,2020-03-25,https://www.reddit.com/r/pennystocks/comments/fokfmu/just_wondering_could_we_allow_polls_on_this_sub/
10,All aboard the $TTOO train!,foib02,Monte204,https://www.reddit.com/r/pennystocks/comments/foib02/all_aboard_the_ttoo_train/,1,21,Up 109% and I’m expecting it to shoot up at open!,2020-03-25,https://www.reddit.com/r/pennystocks/comments/foib02/all_aboard_the_ttoo_train/
11,Just asking....,foiap4,rayrod354,https://www.reddit.com/r/pennystocks/comments/foiap4/just_asking/,1,6,"What’s call mean?

What’s put mean?  

What’s the difference between a share and buys?  

What’s a contract?  

Newbie here.  Sorry.",2020-03-25,https://www.reddit.com/r/pennystocks/comments/foiap4/just_asking/
12,Starting a discord channel,fohflz,Greenman8291,https://www.reddit.com/r/pennystocks/comments/fohflz/starting_a_discord_channel/,1,3,"Starting a discord channel for people who do investing and trading. It will have different chats for different areas of the market. Political chat since everyone loves being a politician lately, and some general news chat. If you want to take a look its. https://discord.gg/zQwUTq
I am not trying to have this end up like wsb lol. Just for newbies and some more experienced people who want to be able to talk to each other and post information.",2020-03-25,https://www.reddit.com/r/pennystocks/comments/fohflz/starting_a_discord_channel/
13,What should I invest in tomorrow?,fohefr,TheKing3ringz,https://www.reddit.com/r/pennystocks/comments/fohefr/what_should_i_invest_in_tomorrow/,1,30,"Willing to go all in.  Have $2500 in Robin Hood right now, looking to double it.   Please help.  Thank you!",2020-03-25,https://www.reddit.com/r/pennystocks/comments/fohefr/what_should_i_invest_in_tomorrow/
14,Biggest mistake you can make is FOMO and Greed,foh1m4,xElectricblaze,https://www.reddit.com/r/pennystocks/comments/foh1m4/biggest_mistake_you_can_make_is_fomo_and_greed/,1,46,"So I fucked up big time today. What was my biggest win yet became the worst day of trading for me.

So I have a relatively small account. a very small account actually. I only started with $100 2 weeks ago. throughout those 2 weeks I took small gains here in there of small plays and grew to $150. I was one of the people who say IMAC this morning and said oh 250% is defiantly the peak and checked it an hour later to only see it go to 500%. So I said fuck it and went all in on IMAC (which you should never do) at 2.44 per share. Seeing how my account was so small as long as I cut my losses quick (this is ironic me saying this later) It would of been fine. Im also at work while all of this is happening too. about 10 minutes later IMAC shoots up to 3.60 a share and stalls at that price for about 5 minutes. THIS is when I should of sold my shares because I was at 79% \^ or something and would of gotten an easy 77 dollar profit. But like a fool I got very greedy and wanted it to go higher, well it shot down to 3.00 a share and I panic sold. still not a bad loss I still profited 48 dollars which was awesome BUT 5 about an hour later the stock shot up to 4.15 and I was infuriated and FOMO kicked in and I bought it being greedy and wanting to get more out of it. long story short I kept panic selling and FOMO buying and had my worst day of all time trading so far. the reason I'm posting this is so no newbie does the same mistake I did. Im sure a lot of decent trader will see this and call me a retard and I'm totally ok with this because I am LOL its a lesson learned for me and hopefully I helped someone that will one day be in this situation and will remember what happened to my dumbass and just take their profits quick. Next time I wont let this happen to me lesson learned. I would post photos but it wont let me for some reason",2020-03-25,https://www.reddit.com/r/pennystocks/comments/foh1m4/biggest_mistake_you_can_make_is_fomo_and_greed/
15,Why not play options instead of penny stock?,fogk3f,AcrobaticWord2,https://www.reddit.com/r/pennystocks/comments/fogk3f/why_not_play_options_instead_of_penny_stock/,1,3,"We all know these penny stocks are very risky. Right now you can get in after the hype and it seems like even after 300%, only a couple like Codx and BMRA went on to do an addition 4-600%.  Everything else is up 1-400% premarket and is usually done after one day.  The other option is picking a company that hasn’t run up yet and wait for news that may or may not come.

With the penny stocks you can get lucky and see 1-500% gains, but usually you will miss out unless you spread your money out thin.

With options, you can leverage and use the same money on a penny stock that can have the same payoff on blue chip stocks.  Only you aren’t at risk of being left holding after a pump and dump or getting involved with shady companies.  If you are right your bets can still pay off big.

I’m buying penny stocks while I wait for options to be approved, If you can afford it you should check them out instead",2020-03-25,https://www.reddit.com/r/pennystocks/comments/fogk3f/why_not_play_options_instead_of_penny_stock/
16,Is it a good time to buy DECN dip?,foyit7,pjawz,https://www.reddit.com/r/pennystocks/comments/foyit7/is_it_a_good_time_to_buy_decn_dip/,1,1,"what the targets, averages, etc that people have set to get in and out?",2020-03-25,https://www.reddit.com/r/pennystocks/comments/foyit7/is_it_a_good_time_to_buy_decn_dip/
17,Novacyt Covid19 tests worldwide !,foy5hs,ghabrouch,https://www.reddit.com/r/pennystocks/comments/foy5hs/novacyt_covid19_tests_worldwide/,1,9,"https://www.google.com/amp/s/www.zonebourse.com/amp/NOVACYT-11681992/actualite/Novacyt-accord-de-fabrication-pour-un-test-Covid-19-30224548/

Use google translate and prepare your Euros ;)",2020-03-25,https://www.reddit.com/r/pennystocks/comments/foy5hs/novacyt_covid19_tests_worldwide/
18,"INO, short term bag holders",foxnd7,thatsAChopbro,https://www.reddit.com/r/pennystocks/comments/foxnd7/ino_short_term_bag_holders/,1,0,[removed],2020-03-25,https://www.reddit.com/r/pennystocks/comments/foxnd7/ino_short_term_bag_holders/
19,Play for open tomorrow what is looking like a money printer right now?,foxjze,aaronelmthegreat,https://www.reddit.com/r/pennystocks/comments/foxjze/play_for_open_tomorrow_what_is_looking_like_a/,1,21,Sorry i’m new to this and have very little clue of what i’m doing,2020-03-25,https://www.reddit.com/r/pennystocks/comments/foxjze/play_for_open_tomorrow_what_is_looking_like_a/
20,$GCGX,foxgs7,pjawz,https://www.reddit.com/r/pennystocks/comments/foxgs7/gcgx/,1,4,"Just increased my position with the news they are putting out, feeling bullish!",2020-03-25,https://www.reddit.com/r/pennystocks/comments/foxgs7/gcgx/
21,MFA BOOMING!!! Trust your gut!,fox9cv,RecycledLube,https://www.reddit.com/r/pennystocks/comments/fox9cv/mfa_booming_trust_your_gut/,1,33,"I bought MFA at $0.30 and it went up 227% today. Now at $1.26. Trust your instincts with penny stocks. They are already so cheap, the only way they can really go is up, and if not you’ll lose only a few bucks.",2020-03-25,https://www.reddit.com/r/pennystocks/comments/fox9cv/mfa_booming_trust_your_gut/
22,What are your bags?,fowyb3,thrilhouse03,https://www.reddit.com/r/pennystocks/comments/fowyb3/what_are_your_bags/,1,39,"What heavy bags is everyone currently holding?

Mine:

AYTU
COCP
HTBX
OPK
TBLT
WTRH

Really hoping for a run-up on these so I can unload.",2020-03-25,https://www.reddit.com/r/pennystocks/comments/fowyb3/what_are_your_bags/
23,Tomorrow March 26th,fowl56,Tmac1066,https://www.reddit.com/r/pennystocks/comments/fowl56/tomorrow_march_26th/,1,8,"Anyone have any ideas on what to buy today for tomorrow? I’m out of ideas, this market is so unpredictable now with the stimulus factor coming into play.",2020-03-25,https://www.reddit.com/r/pennystocks/comments/fowl56/tomorrow_march_26th/
24,DECN,fowfc8,ricky_rhino,https://www.reddit.com/r/pennystocks/comments/fowfc8/decn/,1,27,Will DECN bounce back,2020-03-25,https://www.reddit.com/r/pennystocks/comments/fowfc8/decn/
25,iBio is surging,fow7kb,Imaginary_Subject,https://www.reddit.com/r/pennystocks/comments/fow7kb/ibio_is_surging/,1,5,Anyone know what's causing this? Up 10% so far. I haven't heard any news.,2020-03-25,https://www.reddit.com/r/pennystocks/comments/fow7kb/ibio_is_surging/
26,"FDA orders AYTU to relabel, possibly pushing distribution into late next week.",for4ff,daniellyaa,https://www.reddit.com/r/pennystocks/comments/for4ff/fda_orders_aytu_to_relabel_possibly_pushing/,1,13,"Unfortunately we won’t be seeing profits due to distribution this week. Personally I’m going to hold and may even buy more at this low to push my average down. 


https://www.aspendailynews.com/news/pitkin-county-looks-to-private-sector-testing-options-no-guarantees/article_fa7dbfd2-6e40-11ea-badd-8f00f2869131.html",2020-03-25,https://www.reddit.com/r/pennystocks/comments/for4ff/fda_orders_aytu_to_relabel_possibly_pushing/
27,ASTC Runup,for1y8,Al319,https://www.reddit.com/r/pennystocks/comments/for1y8/astc_runup/,1,3,"This stock is up 400% and climbing, not just some of these stock people are posting that already went up 100% and going down. This is a good chance for risk takers and for quick profits if you jump in in the right time. I know we a lot of us missed out on IMAC yesterday",2020-03-25,https://www.reddit.com/r/pennystocks/comments/for1y8/astc_runup/
28,AYTU bounce back?,foqyix,yesyesyesyesyesokyes,https://www.reddit.com/r/pennystocks/comments/foqyix/aytu_bounce_back/,1,7,AYTU has decreased big time... I should have sold at 1.99 but I sold at 1.74.. I'm thinking of buying back in at some point. Do y'all think it will increase again? And how low do you think it will drop. My guess is 1.50s...,2020-03-25,https://www.reddit.com/r/pennystocks/comments/foqyix/aytu_bounce_back/
29,$ASTC,foqxz1,Infamous-Icon,https://www.reddit.com/r/pennystocks/comments/foqxz1/astc/,1,5,Look at it climb!!,2020-03-25,https://www.reddit.com/r/pennystocks/comments/foqxz1/astc/
30,TTOO,foqrvx,JoeyPeake,https://www.reddit.com/r/pennystocks/comments/foqrvx/ttoo/,1,9,It's going to the moon baby! Yee-haw.,2020-03-25,https://www.reddit.com/r/pennystocks/comments/foqrvx/ttoo/
31,AYTU,foqnox,mattl1028,https://www.reddit.com/r/pennystocks/comments/foqnox/aytu/,1,6,What’s going on with aytu,2020-03-25,https://www.reddit.com/r/pennystocks/comments/foqnox/aytu/
32,ONDK,foqlmt,NYCHammer,https://www.reddit.com/r/pennystocks/comments/foqlmt/ondk/,1,0,How are we feeling about ONDK? We have a masssssive morning,2020-03-25,https://www.reddit.com/r/pennystocks/comments/foqlmt/ondk/
33,Hungry,foqief,Phathose024,https://www.reddit.com/r/pennystocks/comments/foqief/hungry/,1,6,Mfa has extra bonus sauce that you can dip your biscuits in,2020-03-25,https://www.reddit.com/r/pennystocks/comments/foqief/hungry/
34,$DECN at $0.11 this morning if anyone wants back in,foqd5q,Nickjersey,https://www.reddit.com/r/pennystocks/comments/foqd5q/decn_at_011_this_morning_if_anyone_wants_back_in/,1,5,Seems the ultimate testing goal is a finger prick test and that's what $DECN is working on: https://twitter.com/grosven/status/1242273974332968960,2020-03-25,https://www.reddit.com/r/pennystocks/comments/foqd5q/decn_at_011_this_morning_if_anyone_wants_back_in/
35,$CSPS News! CoronaVirus screening launch update: $10K a day from services!,foq8i5,CaptainWeee,https://www.reddit.com/r/pennystocks/comments/foq8i5/csps_news_coronavirus_screening_launch_update_10k/,1,4,,2020-03-25,/r/PennyHaven/comments/foq838/csps_news_coronavirus_screening_launch_update_10k/
36,MFA Financial,foq63m,blackfordtruck,https://www.reddit.com/r/pennystocks/comments/foq63m/mfa_financial/,1,12,It’s going up!,2020-03-25,https://www.reddit.com/r/pennystocks/comments/foq63m/mfa_financial/
37,Should I leave AYTU,foq4td,BigBoys2020,https://www.reddit.com/r/pennystocks/comments/foq4td/should_i_leave_aytu/,1,0,[removed],2020-03-25,https://www.reddit.com/r/pennystocks/comments/foq4td/should_i_leave_aytu/
38,$XSPA XpresSpa Announces Partnership with Relevant Healthcare,foq3cd,Purplepunch36,https://www.reddit.com/r/pennystocks/comments/foq3cd/xspa_xpresspa_announces_partnership_with_relevant/,1,21,https://finance.yahoo.com/news/xpresspa-announces-partnership-relevant-healthcare-130010579.html,2020-03-25,https://www.reddit.com/r/pennystocks/comments/foq3cd/xspa_xpresspa_announces_partnership_with_relevant/
39,"$GCGX Huge news just out AGAIN "".... is pleased to announce that we are currently working to finalize a deal that will book 7 figure revenues for Q1""",foq194,virus_stocks100,https://www.reddit.com/r/pennystocks/comments/foq194/gcgx_huge_news_just_out_again_is_pleased_to/,1,7," https://twitter.com/Global\_GCGXOTC/status/1242791018329706498?s=20 

&gt; ""$GCGX is pleased to announce that we are currently working to finalize a deal that will book 7 figure revenues for Q1 - We look forward to growing this revenue number quarter over quarter with our Oil Operation moving into full swing.  Updates to follow...."" 

This is massive. We are talking multi millions now PER quarter. Im glad they pulled it off, they had so many bashers doubting they would even get a licence lol. Now they have like 6 licences, medical licence, oil operation is in full swing now, and now about to record first ever revenues, and its in the millions. 

$0.01 today or tomorrow easy. When revs come out for first quarter, I think $0.05 is easy. 

Happy trading today!",2020-03-25,https://www.reddit.com/r/pennystocks/comments/foq194/gcgx_huge_news_just_out_again_is_pleased_to/
40,Bsgm corona treatment 90%,fopwl4,sicklynsaucy,https://www.reddit.com/r/pennystocks/comments/fopwl4/bsgm_corona_treatment_90/,1,2,,2020-03-25,/r/RobinHoodPennyStocks/comments/fop9e0/bsgm_corona_treatment/
41,Buy the dip? Or is it too late? I wanted to buy UAL but I’m not sure,fopu0c,got78622,https://www.reddit.com/r/pennystocks/comments/fopu0c/buy_the_dip_or_is_it_too_late_i_wanted_to_buy_ual/,1,0,,2020-03-25,https://www.reddit.com/r/pennystocks/comments/fopu0c/buy_the_dip_or_is_it_too_late_i_wanted_to_buy_ual/
42,$HAPP,fopnxf,janedole1998,https://www.reddit.com/r/pennystocks/comments/fopnxf/happ/,1,2,Get in... it’s moving quick!,2020-03-25,https://www.reddit.com/r/pennystocks/comments/fopnxf/happ/
43,Hold those AYTU Bags...,fopkcu,fishrunhike,https://www.reddit.com/r/pennystocks/comments/fopkcu/hold_those_aytu_bags/,1,59,"https://www.aspendailynews.com/news/pitkin-county-looks-to-private-sector-testing-options-no-guarantees/article_fa7dbfd2-6e40-11ea-badd-8f00f2869131.html

FDA ordered them to re-label their test kits.",2020-03-25,https://www.reddit.com/r/pennystocks/comments/fopkcu/hold_those_aytu_bags/
44,OPK NEWS 3/25 2 NEW STUDIES,fop7sf,jtabone04,https://www.reddit.com/r/pennystocks/comments/fop7sf/opk_news_325_2_new_studies/,1,0, [https://www.globenewswire.com/news-release/2020/03/25/2006165/0/en/OPKO-Health-Reports-Interim-Results-for-Two-Ongoing-RAYALDEE-Studies.html](https://www.globenewswire.com/news-release/2020/03/25/2006165/0/en/OPKO-Health-Reports-Interim-Results-for-Two-Ongoing-RAYALDEE-Studies.html),2020-03-25,https://www.reddit.com/r/pennystocks/comments/fop7sf/opk_news_325_2_new_studies/
45,What are you guys loading up on for Unemployment announcement,fow4e8,LaminateBody8,https://www.reddit.com/r/pennystocks/comments/fow4e8/what_are_you_guys_loading_up_on_for_unemployment/,1,8,"I believe it happening on April 3rd... this months unemployment was insane, especially with benefits from stim package. Thoughts?",2020-03-25,https://www.reddit.com/r/pennystocks/comments/fow4e8/what_are_you_guys_loading_up_on_for_unemployment/
46,IFP.TO,fow2ue,revoltinglemur,https://www.reddit.com/r/pennystocks/comments/fow2ue/ifpto/,1,0," A lumber company in canada, seems to be having pretty volatile jumps. Bought yesterday at about 5.25, sold at 6.50 today. Waiting for it to drop again and buy back in. Huge company here in cananda that makes good cash, and they would be considered an essential service now as well",2020-03-25,https://www.reddit.com/r/pennystocks/comments/fow2ue/ifpto/
47,EKSO Bionics,fovrpq,Freezod,https://www.reddit.com/r/pennystocks/comments/fovrpq/ekso_bionics/,1,4,"EKSO Bionics

EKSO announced a reverse stock split today. How does this affect my shares? Sorry for being a newb to the stock game.",2020-03-25,https://www.reddit.com/r/pennystocks/comments/fovrpq/ekso_bionics/
48,LOOPSHARE (LPPPF) Prospective Thoughts,fovpu7,scoopstheIII,https://www.reddit.com/r/pennystocks/comments/fovpu7/loopshare_lpppf_prospective_thoughts/,1,1,"Hey guys, just wondering what are some thoughts on the ride sharing brand LOOPSHARE. Seems like they had some promise at the beginning of 2019, but have dwindled greatly since then. Thoughts as to which direction theyre heading?",2020-03-25,https://www.reddit.com/r/pennystocks/comments/fovpu7/loopshare_lpppf_prospective_thoughts/
49,$FONU just got granted NEW custodian by the courts. The new entity already confirmed that a profitable company will be reverse merging into. Time to load.,fovnyz,virus_stocks100,https://www.reddit.com/r/pennystocks/comments/fovnyz/fonu_just_got_granted_new_custodian_by_the_courts/,1,1,"I metnioned this last week when it was .0004 and still in the courts. Check it out. Its DONE! 

 [https://www.clarkcountycourts.us/Portal/Case/CaseDetail?eid=XIz6kL8PArG3QwgBMnSASg2&amp;tabIndex=3](https://www.clarkcountycourts.us/Portal/Case/CaseDetail?eid=XIz6kL8PArG3QwgBMnSASg2&amp;tabIndex=3) 

Scroll down. Motion passed, new custodianship granted. This new custodian just released this (below)

 https://twitter.com/unimanageassoc/status/1242820042737229826?s=20 

When this happens, the reverse merger, we are talking at least $0.01.",2020-03-25,https://www.reddit.com/r/pennystocks/comments/fovnyz/fonu_just_got_granted_new_custodian_by_the_courts/
50,/u/Best_Instruction is by far the best trader on this subreddit,fovbuz,MutedBet8,https://www.reddit.com/r/pennystocks/comments/fovbuz/ubest_instruction_is_by_far_the_best_trader_on/,1,10,"He's one of the best traders I've seen on any forum. I know this may come off as ass kissing, but listening to his advice has made me a great trader. I've seen him actually make traders profitable with simple advice. It happened to me. You have to understand how to trade. No pumping or anything dumb. He's simply shorting spikes of buying. Having traded for years also, I found his advice to be the most spot on out of all given. 

Everyone appreciates your help /u/Best_Instruction, I just wanted to personally thank you. Times with corona are hard. I'm happy to see drastic improvement in my own trading.",2020-03-25,https://www.reddit.com/r/pennystocks/comments/fovbuz/ubest_instruction_is_by_far_the_best_trader_on/
51,DECN DROPPING,fov9dk,DuhYes,https://www.reddit.com/r/pennystocks/comments/fov9dk/decn_dropping/,1,11,Buy more??? or sell at 60% loss,2020-03-25,https://www.reddit.com/r/pennystocks/comments/fov9dk/decn_dropping/
52,What's everyone's play for the end of trade today?,fov159,pesti13nce,https://www.reddit.com/r/pennystocks/comments/fov159/whats_everyones_play_for_the_end_of_trade_today/,1,26,"I lucked out and got in on MFA and TAT, but I'd love to hear what people are looking at. 

I also got in on the JDST boat very low, going to ride that out.",2020-03-25,https://www.reddit.com/r/pennystocks/comments/fov159/whats_everyones_play_for_the_end_of_trade_today/
53,Any Canadian penny stock that you guys have eye on,foutj9,Nastu_727,https://www.reddit.com/r/pennystocks/comments/foutj9/any_canadian_penny_stock_that_you_guys_have_eye_on/,1,17,"Currently live in Canada and wants to invest in some good low price penny stocks here. Any advise or tips that you guys have , please share and also any share that good to buy after exchange?",2020-03-25,https://www.reddit.com/r/pennystocks/comments/foutj9/any_canadian_penny_stock_that_you_guys_have_eye_on/
54,Mfa,fouf57,Brother-brigham,https://www.reddit.com/r/pennystocks/comments/fouf57/mfa/,1,0,[removed],2020-03-25,https://www.reddit.com/r/pennystocks/comments/fouf57/mfa/
55,MFA,fouek9,cmd720,https://www.reddit.com/r/pennystocks/comments/fouek9/mfa/,1,6,It’s going up big today I got in at .77 now it’s up to 1.30,2020-03-25,https://www.reddit.com/r/pennystocks/comments/fouek9/mfa/
56,HTGM??,fou926,BigBoys2020,https://www.reddit.com/r/pennystocks/comments/fou926/htgm/,1,0,[removed],2020-03-25,https://www.reddit.com/r/pennystocks/comments/fou926/htgm/
57,Pattern day trader???,fou7v1,ZOCOM4146,https://www.reddit.com/r/pennystocks/comments/fou7v1/pattern_day_trader/,1,16,So fairly new to day trading and am wondering how y'all avoid being marked as a pattern day trader or at least how to avoid the consequences. Thanks!,2020-03-25,https://www.reddit.com/r/pennystocks/comments/fou7v1/pattern_day_trader/
58,We screwed up TTOO,fou5ix,Agnia_Barto,https://www.reddit.com/r/pennystocks/comments/fou5ix/we_screwed_up_ttoo/,1,12,"120Million bought today at around $0.80 vs typical 20 Million a day. Whom are we gonna sell it for more money? We broke it guys, it's gonna go down. Too much PR.",2020-03-25,https://www.reddit.com/r/pennystocks/comments/fou5ix/we_screwed_up_ttoo/
59,Shoutout to u/TheBazaarTrades for recommending XSPA a couple days ago!,fou4lj,------dudpool------,https://www.reddit.com/r/pennystocks/comments/fou4lj/shoutout_to_uthebazaartrades_for_recommending/,1,48,"Saw a well thought out post regarding its potential for growth from this user and decided to purchase a k in shares at $0.13, up to $0.39 right now with a partnership deal! 🚀",2020-03-25,https://www.reddit.com/r/pennystocks/comments/fou4lj/shoutout_to_uthebazaartrades_for_recommending/
60,DECN: DECN to Add 2nd Covid-19 Test Kit Using Antibody/Antigen Methodology as a Determination Test for Patients Who Previously Tested Positive for Covid-19,fou4ec,JohnnyLakefront,https://www.reddit.com/r/pennystocks/comments/fou4ec/decn_decn_to_add_2nd_covid19_test_kit_using/,1,13,"DECN announced this morning that they're making a second test kit to test for people who previously had COVID-19

This is a second product

Link: https://finance.yahoo.com/news/decn-add-2nd-covid-19-141500250.html",2020-03-25,https://www.reddit.com/r/pennystocks/comments/fou4ec/decn_decn_to_add_2nd_covid19_test_kit_using/
61,BNP,fotzx8,krspychicken,https://www.reddit.com/r/pennystocks/comments/fotzx8/bnp/,1,0,until tomorrow morning,2020-03-25,https://www.reddit.com/r/pennystocks/comments/fotzx8/bnp/
62,"JDST, is it time?",fotxyp,DommyTheTendy,https://www.reddit.com/r/pennystocks/comments/fotxyp/jdst_is_it_time/,1,25,$1.80 low. Gold is about to boom. Or should jnug run its course first?,2020-03-25,https://www.reddit.com/r/pennystocks/comments/fotxyp/jdst_is_it_time/
