,title,id,author,url,score,num_comments,text,date,link
0,Thoughts on BEMG,b4szkx,sergtheworm,https://www.reddit.com/r/pennystocks/comments/b4szkx/thoughts_on_bemg/,1,4,What you guys think? ,2019-03-24,https://www.reddit.com/r/pennystocks/comments/b4szkx/thoughts_on_bemg/
1,Services for subs,b4rv2c,SdotFray28,https://www.reddit.com/r/pennystocks/comments/b4rv2c/services_for_subs/,3,2,"Looking for a brokerage that trades .0001-.01 tickers, any help is appreciated",2019-03-24,https://www.reddit.com/r/pennystocks/comments/b4rv2c/services_for_subs/
2,$LPTX; is it another pump and dump?,b4ried,hogdur,https://www.reddit.com/r/pennystocks/comments/b4ried/lptx_is_it_another_pump_and_dump/,26,26,First ever post on Reddit so bare with me. Heard about LPTX on here early last week and got super hyped after following what happened with $BPTH. Did a bunch of my own research and it made LPTX sound very promising. I bought in around 1.8 last Thurs/Friday and decided to hold on thru the craziness of Monday. Just wondering if anyone else made the same move as me and what your thoughts are. ,2019-03-24,https://www.reddit.com/r/pennystocks/comments/b4ried/lptx_is_it_another_pump_and_dump/
3,VSHC boom week has come.,b4zzqj,NagelDonk,https://www.reddit.com/r/pennystocks/comments/b4zzqj/vshc_boom_week_has_come/,1,19,"Alright, I have been talking this stock for three weeks and this should be the boom week. News is coming out about a multi-million dollar merger which should send this to another 52 week high. Hoping for at least .5. If you get in now at .0129 then a .5 is surely worth it. Some say this will eventually hit .25, however be smart and take your money and run under .1",2019-03-24,https://www.reddit.com/r/pennystocks/comments/b4zzqj/vshc_boom_week_has_come/
4,"March 24, 2019 Tomorrow's Daily /r/Pennystocks Discussion! Monday Discussion thread!",b4zdsv,AutoModerator,https://www.reddit.com/r/pennystocks/comments/b4zdsv/march_24_2019_tomorrows_daily_rpennystocks/,11,7,"Please use this thread to discuss your plays of the day!

Since this thread is likely to fill up quickly, consider sorting the comments by ""new"" (instead of ""best"" or ""top"") to see the newest posts.
",2019-03-24,https://www.reddit.com/r/pennystocks/comments/b4zdsv/march_24_2019_tomorrows_daily_rpennystocks/
5,$UAVS,b51vyy,silviajulia,https://www.reddit.com/r/pennystocks/comments/b51vyy/uavs/,2,2,"So i got in at .58 expecting a nice bounce to happen immediately after the dump, well i was wrong, with earnings this thursday, and conference the 4/1, what should i do, take my loss, looks like she found her home at around the .50 range. ",2019-03-24,https://www.reddit.com/r/pennystocks/comments/b51vyy/uavs/
6,$BIOC,b51qv9,khonneak,https://www.reddit.com/r/pennystocks/comments/b51qv9/bioc/,2,0,What y'all think about $BIOC ER this week?,2019-03-24,https://www.reddit.com/r/pennystocks/comments/b51qv9/bioc/
7,Learning about WeBull,b51jlb,PolishBlunder,https://www.reddit.com/r/pennystocks/comments/b51jlb/learning_about_webull/,1,9,"For some reason I can't buy any stocks below 1 cent. 
It only gives me the sim holdings option. 
Can someone explain why?",2019-03-24,https://www.reddit.com/r/pennystocks/comments/b51jlb/learning_about_webull/
8,MONDAY #1 STOCK WATCH,b5178a,stl314314stl,https://www.reddit.com/r/pennystocks/comments/b5178a/monday_1_stock_watch/,44,64,\#1 stock you are watching for Monday and why?,2019-03-24,https://www.reddit.com/r/pennystocks/comments/b5178a/monday_1_stock_watch/
9,My Penny Stock Watch-List for the Week of 3.25.2019 💯💯📰📰,b50us7,Transparent_Traders,https://www.reddit.com/r/pennystocks/comments/b50us7/my_penny_stock_watchlist_for_the_week_of_3252019/,0,4," 

### When to use a Watch-list: [https://www.transparenttraders.me/2019/03/my-penny-stock-watch-list-for-week-of\_24.html](https://www.transparenttraders.me/2019/03/my-penny-stock-watch-list-for-week-of_24.html)",2019-03-24,https://www.reddit.com/r/pennystocks/comments/b50us7/my_penny_stock_watchlist_for_the_week_of_3252019/
10,Penny Stock Trading Live Stream Tomorrow 8:30AM!!!!,b4wl65,LongMomentumNvolume,https://www.reddit.com/r/pennystocks/comments/b4wl65/penny_stock_trading_live_stream_tomorrow_830am/,1,0,[removed],2019-03-24,https://www.reddit.com/r/pennystocks/comments/b4wl65/penny_stock_trading_live_stream_tomorrow_830am/
11,Bpth - Is someone able to post details of the run up,b4wbkw,StarrkC,https://www.reddit.com/r/pennystocks/comments/b4wbkw/bpth_is_someone_able_to_post_details_of_the_run_up/,1,0,"Is someone able to post the story on this one about the run up

What sparked it, what kept it going, what news sparked each run.

Has there been any similar incidents of parabolic ups. ",2019-03-24,https://www.reddit.com/r/pennystocks/comments/b4wbkw/bpth_is_someone_able_to_post_details_of_the_run_up/
12,Weekly stock recap $JAGX $DARE $VXRT $SPI,b4vns1,vytasmike,https://www.reddit.com/r/pennystocks/comments/b4vns1/weekly_stock_recap_jagx_dare_vxrt_spi/,3,0,"We got another week when healthcare sector stocks moved, especially these biotech stocks which are the majority of the healthcare sector's stocks.

&amp;#x200B;

But in comparison to what we witnessed past weeks the stocks getting slower a bit and it seems micro and nano-cap stock space getting back to normal rhythm. There are less easy opportunities to catch.

&amp;#x200B;

Let's now look at the main stocks that made big moves this week.

&amp;#x200B;

If you are like to watch the video rather than read check the recap video here: [https://youtu.be/HsY9FrkY9XM](https://youtu.be/HsY9FrkY9XM)

&amp;#x200B;

$JAGX the classic nano cap runner. The success in day trading penny stocks lies in the skill to catch momentum NANOCAP runner like $JAGX. If you are observing these stocks for some time you know that micro caps are not the big runners when comparing to nanocap stocks. Due to their size, these nano caps are the real runner and you should be focusing on them if you are interested in day trading multiple hundred percentages gaining stocks. As well there were no news associated with the move and this should not be something you should worry about while day trading is more technical based trading anyways. Positive news can help bring more attention from the general public which is great but the volume is anyways better predictor of such moves. So be more focused on volume rather on the news when day trading nanocap runners.

&amp;#x200B;

$DARE &amp; $SPI. I will talk about both of them while these stocks have the same feature in common which is observed can allow you to protect your downside if you are interested in day or swing trading by buying stocks or if you are interested in short selling these penny stocks. So the common feature is a big gap! I as well cautioned people not to buy $DARE after it gapped while big gaps are better predictors of the sell-off rather than buying opportunity. Same goes with $SPI and as well that this stock is former spiker/runner. Remember when trading micro and nao cap niche that big gaps should be looked with caution except if you are interested in short sell these stocks. 

&amp;#x200B;

$VXRT was stock that I still included in this week's recap because it was a good stock example of what to actually avoid if you are interested in buy big runners. This stock was a better short selling opportunity rather than buying because of the volatility. So to explain this in simple language, what do I mean by that? If you would look at $VXRT intraday chart price structure (I used 5 minutes candle chart) you would see that in first 10 minutes after market open this stock just jumped too fast without actually building momentum as $JAGX did. Due to such big volatile jump buying this stock is more like gambling rather than trading strong price action. The best way to trade this stock was to short sell it after it popped.

&amp;#x200B;

To finish here I would like to tell that in my opinion stock indices will move lower in upcoming weeks so be prepared and I do believe because of this we should see less easy opportunities in penny stock niche. But remember you can short sell stocks and make money on the way down and if you interested in buying you should wait for a better time but be ready because opportunities will without any doubt come back.",2019-03-24,https://www.reddit.com/r/pennystocks/comments/b4vns1/weekly_stock_recap_jagx_dare_vxrt_spi/
13,"$ECPN Business Update - “Oops, our bad”",b4xpyf,thundrcnt-,https://www.reddit.com/r/pennystocks/comments/b4xpyf/ecpn_business_update_oops_our_bad/,1,0,"I don’t deal much in micro caps these days, but I still indulge in a lottery ticket but here and there based on some short-term volume studies I use to identify potential pump and dumps. This one popped up on my radar about a month ago

Last week, they released their [yearly business update](https://www.elcapitanpmi.com/2019-business-updates/) and it’s worth a read because apparently their 2019 update is apologizing for all the incorrect press releases from 2018 ",2019-03-24,https://www.reddit.com/r/pennystocks/comments/b4xpyf/ecpn_business_update_oops_our_bad/
14,Anyone here invest in LDSR or RXMD?,b53dmf,peekurchoo,https://www.reddit.com/r/pennystocks/comments/b53dmf/anyone_here_invest_in_ldsr_or_rxmd/,8,2,"I used to flip LDSR but it's recently taken quite the hit. Holding RXMD in the meantime, which seems to be doing well.",2019-03-24,https://www.reddit.com/r/pennystocks/comments/b53dmf/anyone_here_invest_in_ldsr_or_rxmd/
15,$CGIX,b51yv8,vaneeladrop,https://www.reddit.com/r/pennystocks/comments/b51yv8/cgix/,6,2,Thoughts?,2019-03-24,https://www.reddit.com/r/pennystocks/comments/b51yv8/cgix/
