,title,id,author,url,score,num_comments,text,date,link
0,Any one still holding mrs?,ecfs4f,unkownsourcecode,https://www.reddit.com/r/pennystocks/comments/ecfs4f/any_one_still_holding_mrs/,1,7,Wondering your thoughts given such a poor downswing.,2019-12-18,https://www.reddit.com/r/pennystocks/comments/ecfs4f/any_one_still_holding_mrs/
1,Shorting penny stocks in USA,ec7idw,Camel-Kid,https://www.reddit.com/r/pennystocks/comments/ec7idw/shorting_penny_stocks_in_usa/,1,11,"I am wondering if it is legal to short penny stocks if I am a US citizen, if it is legal, which broker to use that is trustworthy and best for shortselling microcaps?",2019-12-18,https://www.reddit.com/r/pennystocks/comments/ec7idw/shorting_penny_stocks_in_usa/
2,ONTX - Another offering,ecd637,RamzFanz,https://www.reddit.com/r/pennystocks/comments/ecd637/ontx_another_offering/,1,8,"They sign a new deal for distribution, it's gonna run!

Then 5 minutes later do an offering.

F$%k!",2019-12-18,https://www.reddit.com/r/pennystocks/comments/ecd637/ontx_another_offering/
3,Which broker has no fee for OTC stocks? (2019),ecbqjv,Glock_21,https://www.reddit.com/r/pennystocks/comments/ecbqjv/which_broker_has_no_fee_for_otc_stocks_2019/,1,13,"I know of Firstrade but I'm not a big fan of the trading platform. 

Did any other brokers drop OTC / pink sheet fees ?",2019-12-18,https://www.reddit.com/r/pennystocks/comments/ecbqjv/which_broker_has_no_fee_for_otc_stocks_2019/
4,So $SBES should have stronger financials after selling those shares,eciimp,fluxburn65,https://www.reddit.com/r/pennystocks/comments/eciimp/so_sbes_should_have_stronger_financials_after/,1,0,[removed],2019-12-18,https://www.reddit.com/r/pennystocks/comments/eciimp/so_sbes_should_have_stronger_financials_after/
5,$QALB News,echqlr,CaptainWeee,https://www.reddit.com/r/pennystocks/comments/echqlr/qalb_news/,1,2,,2019-12-18,/r/PennyHaven/comments/echq9e/qalb_now_pink_current_filed_for_name_and_cusip/
6,I MADE 900K &amp; I CAN SHOW YOU EXACTLY HOW,eckonq,Aulsh99,https://www.reddit.com/r/pennystocks/comments/eckonq/i_made_900k_i_can_show_you_exactly_how/,1,25,"TO WHOM IT MAY CONCERN,

&amp;#x200B;

Let's be real, the only reason people look into stocks is to make money, that's a fact, why else would you spend your days watching youtube videos and analyzing chart patterns if you knew nothing would come out of it. Anyway I've made around 900k doing it so far, and I don't ever post on Reddit but I'm tired of all the bullshit ""guru's"" and ads, and timothy sykes and Jason bond or whoever the fuck. They don't care about your success, they only care about the money you give them, I, on the other hand, teach people, and I care about their success, I do a 1 on 1 video chat with my clients and I make sure they are performing well, answering their questions and tracking their progress. BUT I also just don't teach any guy/gal that reaches out to me and says ""omg omg how do I make money"" forget that. I teach the people who want. it. who take it seriously, who want financial freedom, who can't stand the thought of a 9-5 job and most importantly the people who do their research beforehand and come prepared, it also does cost money because people take things that are expensive way more seriously than free items. anyway,et me know if you're interested, my ig: aaron\_ulsh1 &amp; my email is aju199913@gmail.com",2019-12-18,https://www.reddit.com/r/pennystocks/comments/eckonq/i_made_900k_i_can_show_you_exactly_how/
7,ITRK opinions?,ecb4hm,fullsend01,https://www.reddit.com/r/pennystocks/comments/ecb4hm/itrk_opinions/,1,1,https://www.businesswire.com/news/home/20191216005704/en/Interlink-Announces-Letter-Intent-Merge-Loop-Media,2019-12-18,https://www.reddit.com/r/pennystocks/comments/ecb4hm/itrk_opinions/
8,INPX LETS GO,ecevnd,rmhayward32,https://www.reddit.com/r/pennystocks/comments/ecevnd/inpx_lets_go/,1,9,Have a look at INPEX just got awarded a government contract. I've easily made a 100 dollars just in the last two days. Another one to watch is NAKD. Rumor has it r/S is coming on the 20th trying to get as many .2 cent shares before then.,2019-12-18,https://www.reddit.com/r/pennystocks/comments/ecevnd/inpx_lets_go/
9,$SURG Multiple Technical Bull Signals in Play,ecefwd,stokpik,https://www.reddit.com/r/pennystocks/comments/ecefwd/surg_multiple_technical_bull_signals_in_play/,1,0,"SURG is setting up well with a base of support in place in the $0.25 to $0.30 area after breaking the downtrend line.  CCI is flashing a bull signal, MACD has a Bullish Divergence, and Ichimoku Cloud just flipped to ""Long Bias Ahead"". [See the chart...](https://www.tradingview.com/chart/SURG/CxoNgb7T-SURG-Multiple-Technical-Bull-Signals-in-Play/)",2019-12-18,https://www.reddit.com/r/pennystocks/comments/ecefwd/surg_multiple_technical_bull_signals_in_play/
10,Arch Biopartners Announces Metablok Achieves Primary Endpoints of Safety and Tolerability in Phase I Trial,eceezn,thesiscapitalInc,https://www.reddit.com/r/pennystocks/comments/eceezn/arch_biopartners_announces_metablok_achieves/,1,2,"TORONTO, Dec. 18, 2019 (GLOBE NEWSWIRE) -- Arch Biopartners Inc., (“Arch” or the “Company”) (TSX Venture: ARCH and OTCQB: ACHFF) announced today that the Phase I human trial of Metablok (LSALT peptide) has completed dosing of all scheduled volunteers and Metablok has met the primary endpoints of safety and tolerability. Metablok is the Company’s lead drug candidate for treating organ damage caused by inflammation.  


Metablok was well tolerated during the placebo-controlled trial and no drug-related adverse effects were observed in any of the forty-four volunteers, split into five groups. Three of the groups received either a low, medium or high single dose of Metablok and the remaining two groups received a low or medium single daily dose over three days.

Arch is expected to close the trial over the next week with a database lock in early 2020. Final results and study reports will be released over the next 3 months.

During this time, Arch management will begin preparations to engage the U.S. FDA in discussion regarding a New Drug Application and Phase II trial for Metablok.

**Metablok Phase I clinical trial**

Arch has been conducting the Phase I clinical trial for Metablok with healthy volunteers in Melbourne, Australia. The Phase I trial is a double-blind, placebo-controlled, randomized, single and multiple ascending dose study to evaluate the safety and pharmacokinetic profile of Metablok.

The successful Phase I trial is expected to be followed by a Phase II trial to investigate Metablok’s efficacy at preventing inflammation related acute kidney injury in patients undergoing cardiac surgery.

**Cardiac Surgery-Associated Acute Kidney Injury**

Acute kidney injury (AKI) represents an additional challenge for patients recovering from cardiac surgery. AKI occurs in approximately 30% of patients that undergo cardiac bypass surgery with approximately 5-7% of patients requiring dialysis. For patients who recover from the need for dialysis or mild AKI, there is a greater likelihood of developing chronic kidney disease in future than those who did not have AKI.

Currently, no specific therapies exist to prevent AKI. Worldwide, there are over one million patients per year that have cardiac surgery procedures. 

Inflammation is known to contribute to AKI related to ischemia-reperfusion and other insults to the kidney that may occur in the course of cardiac surgery. 

Metablok is a novel therapeutic agent that may protect the kidneys and prevent AKI in patients undergoing cardiac surgery.

**About Arch Biopartners**

Arch Biopartners Inc. is a clinical stage company focused on the development of innovative technologies that have the potential to make a significant medical or commercial impact.  Arch is developing a drug library, led by Metablok, to produce new drug candidates that inhibit organ inflammation caused via the DPEP-1 pathway.

For more information on Arch Biopartners, its technologies and other public documents Arch has filed on SEDAR, please visit [www.archbiopartners.com](https://www.globenewswire.com/Tracker?data=k86y5QMVhLdikzVfFxw-gre4JymWtlKM9QmC_Pmcw1e4U-PcDFxqFKj_FIXxedQLFP1Pz4CaLnD7svbnldLVSi5BzKV_QpxbxC3GwMn5dVw=)

The Company has 59,462,302 common shares outstanding.

**Forward-Looking Statements**  


All statements, other than statements of historical fact, in this news release are forward looking statements that involve various risks and uncertainties, including, without limitation, statements regarding the future plans and objectives of the Company. There can be no assurance that such statements will prove to be accurate. Actual results and future events could differ materially from those anticipated in such statements. These and all subsequent written and oral forward-looking statements are based on the estimates and opinions of management on the dates they are made and are expressly qualified in their entirety by this notice. The Company assumes no obligation to update forward-looking statements should circumstances or management’s estimates or opinions change.

*Neither TSX Venture Exchange nor its Regulation Services Provider (as that term is defined in the policies of the TSX Venture Exchange) accepts responsibility for the adequacy or accuracy of this release.*

📷For more information, please contact:  Richard Muruve Chief Executive Officer Arch Biopartners, Inc.  647-428-7031 info@archbiopartners.com",2019-12-18,https://www.reddit.com/r/pennystocks/comments/eceezn/arch_biopartners_announces_metablok_achieves/
11,ACHV Thoughts?,ecdest,waner007,https://www.reddit.com/r/pennystocks/comments/ecdest/achv_thoughts/,1,1,"I think this is a real buying opportunity.  Just plummeted due to an offering needed to fund their phase 3 trial for their smoking cessation drug that has shown great results in phase 2. I think at the least it’s an easy 2 bagger in the next couple weeks. Do your own due diligence of course, but I’m buying the drop.",2019-12-18,https://www.reddit.com/r/pennystocks/comments/ecdest/achv_thoughts/
