,title,id,author,url,score,num_comments,text,date,link
0,$BRKK,axfh5c,canieatthis1,https://www.reddit.com/r/pennystocks/comments/axfh5c/brkk/,1,4,Anyone still playing this? Just curious on thoughts. ,2019-03-05,https://www.reddit.com/r/pennystocks/comments/axfh5c/brkk/
1,Investing in Canadian markets,axesa2,KratorOfKruma,https://www.reddit.com/r/pennystocks/comments/axesa2/investing_in_canadian_markets/,1,3,"Anyone have any good insights into canadian markets?  Looking to get involved for shits an giggles, but need to keep it canadian!",2019-03-05,https://www.reddit.com/r/pennystocks/comments/axesa2/investing_in_canadian_markets/
2,LEAS!!!,axekmo,Karpit,https://www.reddit.com/r/pennystocks/comments/axekmo/leas/,9,23,Just came to say I just started trading a few weeks ago and I’m glad I jumped on the LEAS train when I did!,2019-03-05,https://www.reddit.com/r/pennystocks/comments/axekmo/leas/
3,$ICON,axecrt,poopiebutwhole,https://www.reddit.com/r/pennystocks/comments/axecrt/icon/,1,0,"!!!

",2019-03-05,https://www.reddit.com/r/pennystocks/comments/axecrt/icon/
4,OTC #Watchlist 3/5,axlb8g,daytradeguru,https://www.reddit.com/r/pennystocks/comments/axlb8g/otc_watchlist_35/,1,0,[removed],2019-03-05,https://www.reddit.com/r/pennystocks/comments/axlb8g/otc_watchlist_35/
5,JMU gained +170% yesterday. Will it run for another day?,axkilu,vytasmike,https://www.reddit.com/r/pennystocks/comments/axkilu/jmu_gained_170_yesterday_will_it_run_for_another/,2,5,"Hello traders,

&amp;#x200B;

yesterday it seems all traders on Twitter noticed low floating (only 40k shares!) nano-cap stock $JMU after a huge increase in price and volume. No news, no fundamental reason to explain the move only technicals. Low float + huge demand = price imbalance which leads to huge price swings. 

&amp;#x200B;

Let us know if you have any info on the stock move. 

&amp;#x200B;

I don't know how about you but I do not really expect much from these quickly spiking stocks. In general, they tend to run for a day or two and crash or slowly sell off. We had many previous runners in these past weeks like $SOLO, $ZSAN, $BPTH and more. All of them trade now in a small range with no real action and slowly fading away. I do think $JMU is no exception.

&amp;#x200B;

Do you think $JMU will run today? Tomorrow? Let us know your position on this stock.

&amp;#x200B;

$JMU video: [https://youtu.be/WJq1TA23mhk](https://youtu.be/WJq1TA23mhk)",2019-03-05,https://www.reddit.com/r/pennystocks/comments/axkilu/jmu_gained_170_yesterday_will_it_run_for_another/
6,Upcoming plays?,axgoec,filthycasual4,https://www.reddit.com/r/pennystocks/comments/axgoec/upcoming_plays/,0,3,Anyone have any upcoming potential plays? Not sure If I want to hop in LEAS tomorrow but is there any other RMs that people are aware of?,2019-03-05,https://www.reddit.com/r/pennystocks/comments/axgoec/upcoming_plays/
7,Anyone following $BMIX?,axfthj,arkitector,https://www.reddit.com/r/pennystocks/comments/axfthj/anyone_following_bmix/,0,3,"[https://www.prnewswire.com/news-releases/brazil-minerals-inc-advances-late-stage-gold-and-diamond-area-300789836.html](https://www.prnewswire.com/news-releases/brazil-minerals-inc-advances-late-stage-gold-and-diamond-area-300789836.html)

&amp;#x200B;

Seems like there could be something here. Thoughts?",2019-03-05,https://www.reddit.com/r/pennystocks/comments/axfthj/anyone_following_bmix/
8,One-Hour Delivery Service Holds Potential to Disrupt Industry,axq2dz,capitalgrowth,https://www.reddit.com/r/pennystocks/comments/axq2dz/onehour_delivery_service_holds_potential_to/,5,7,[http://www.streetwisereports.com/article/2019/03/04/one-hour-delivery-service-holds-potential-to-disrupt-industry.html](http://www.streetwisereports.com/article/2019/03/04/one-hour-delivery-service-holds-potential-to-disrupt-industry.html),2019-03-05,https://www.reddit.com/r/pennystocks/comments/axq2dz/onehour_delivery_service_holds_potential_to/
9,$DSS up 70% today!,axpwwq,leothelion634,https://www.reddit.com/r/pennystocks/comments/axpwwq/dss_up_70_today/,6,1,Anyone get in on the DSS move today?,2019-03-05,https://www.reddit.com/r/pennystocks/comments/axpwwq/dss_up_70_today/
10,Guides for Using ThinkOrSwim to Buy Pennystocks on RobinHood,axploe,Pollymath,https://www.reddit.com/r/pennystocks/comments/axploe/guides_for_using_thinkorswim_to_buy_pennystocks/,0,4,"I know Robinhood's OTC offerings are slim, but I'd like to dip my toes into the world of using ThinkOrSwim for research, and Robinhood for buying. Once I've figured that out, I can either do a TD or eTrade account, or abandon the idea altogether. 

Has anyone seen any guides on using ThinkOrSwim to find penny-ish stocks on Robinhood? ",2019-03-05,https://www.reddit.com/r/pennystocks/comments/axploe/guides_for_using_thinkorswim_to_buy_pennystocks/
11,I posted about $RXMD a few days ago but...,axpkzv,canieatthis1,https://www.reddit.com/r/pennystocks/comments/axpkzv/i_posted_about_rxmd_a_few_days_ago_but/,8,4,"In the past 6 trading days the SMA50 crossed above the SMA200 and the share price has crossed both including the SMA20 today. 

This is setting up for a run, &amp; the last time the 50 crossed the 200 it went from .04 - .26. 

Just needs volume and the rest will fall into place. ",2019-03-05,https://www.reddit.com/r/pennystocks/comments/axpkzv/i_posted_about_rxmd_a_few_days_ago_but/
12,UBQU reports a net profit in 2018,axp7lz,TwoPornsPlease,https://www.reddit.com/r/pennystocks/comments/axp7lz/ubqu_reports_a_net_profit_in_2018/,1,5,"[UBQU reported earnings of $3,760,099 and net earnings of $5,275](https://globenewswire.com/news-release/2019/03/04/1745886/0/en/Ubiquitech-Reports-2018-Gross-Annual-Revenues-of-3-760-099.html)

Not bad for a new CBD oil company. Price is trip-zeros currently. ",2019-03-05,https://www.reddit.com/r/pennystocks/comments/axp7lz/ubqu_reports_a_net_profit_in_2018/
13,2 Simple Day Trading Strategies,axp1n4,SoQrates,https://www.reddit.com/r/pennystocks/comments/axp1n4/2_simple_day_trading_strategies/,122,13,"Since my last post got so much positive feedback I've decided to release another tips video. This would be ideal for beginners who just don't quite understand technical analysis yet. Day trading can be frustrating and confusing at times and I'm just here to simply it as much as I can and for free. 

[2 Simple Day Trading Strategies Part 1](https://youtu.be/3-JdES9NWOA)",2019-03-05,https://www.reddit.com/r/pennystocks/comments/axp1n4/2_simple_day_trading_strategies/
14,KRFG thoughts?,axp0vc,financenoob4,https://www.reddit.com/r/pennystocks/comments/axp0vc/krfg_thoughts/,2,11,"Anyone still in KRFG? Looks like it's falling pretty hard after 3 days of run. You guys think it's over, or hold?",2019-03-05,https://www.reddit.com/r/pennystocks/comments/axp0vc/krfg_thoughts/
15,SRMX #winning,axow8a,Kokid3g1,https://www.reddit.com/r/pennystocks/comments/axow8a/srmx_winning/,0,5,Just enjoying my fluke winning streak today. I think this one may just have legs though. They just got an update from T-Mobile...,2019-03-05,https://www.reddit.com/r/pennystocks/comments/axow8a/srmx_winning/
16,Anyone familiar or heard of Stock Talk Central?,axoqfj,atxtradingco,https://www.reddit.com/r/pennystocks/comments/axoqfj/anyone_familiar_or_heard_of_stock_talk_central/,0,0,"Found this forum like a week or two ago. They got some good content on the site but they have posted a weekly penny watchlist that I have been trading and actually been really successful on. I have traded 6 of the ones posted and made money on each one. Wanted to see if I just stumbled on something or if this is well known.  


Also they have a weekly watchlist they email out for free but I haven't received an email yet, wanted to see if anyone else may have or already is a part of it?

Here is the site if you aren't familiar with it, curious to see if anyone else has been on it: [https://stocktalkcentral.com](https://stocktalkcentral.com)",2019-03-05,https://www.reddit.com/r/pennystocks/comments/axoqfj/anyone_familiar_or_heard_of_stock_talk_central/
17,$SHLDQ - Anyone making successful trades on them?,axocj3,mchgrms,https://www.reddit.com/r/pennystocks/comments/axocj3/shldq_anyone_making_successful_trades_on_them/,0,0,"I haven't been following them for long, but their earnings report is supposed to be Thursday... what should be expected? Has anyone had success trading them since they've fallen so much?",2019-03-05,https://www.reddit.com/r/pennystocks/comments/axocj3/shldq_anyone_making_successful_trades_on_them/
18,"$SDVI Signature Devices, Inc. Announces Launch of Knoton on iOS and Android App Stores",axob49,louied91,https://www.reddit.com/r/pennystocks/comments/axob49/sdvi_signature_devices_inc_announces_launch_of/,0,1,"[https://www.otcmarkets.com/stock/SDVI/news/Signature-Devices-Inc-Announces-Launch-of-Knoton-on-iOS-and-Android-App-Stores?id=220303](https://www.otcmarkets.com/stock/SDVI/news/Signature-Devices-Inc-Announces-Launch-of-Knoton-on-iOS-and-Android-App-Stores?id=220303)

&amp;#x200B;

IRVINE, CA, March 05, 2019 (GLOBE NEWSWIRE) -- via NEWMEDIAWIRE -- Signature Devices, Inc. (OTC PINK: SDVI), and its subsidiary Innovo Technology, today announced the official release of its Internet of Things Knoton device on both the Google app play store and iTunes app store.  


The Knoton is a next-generation Internet of Things device that utilizes inputs from a variety of motion sensors, ambient sensors, high-resolution cameras, and an always-connected modem. In conjunction with location GPS data and a next generation back-end AI cloud, the Knoton app and associated array of devices address the many needs in the connected device space which are currently lacking in the IoT marketplace.

“With the official release of the Knoton Apps, starting with our FREE apps now available on the iTunes and Google Play store, Signature Devices, Inc. is ready to work with investors and technology enthusiasts worldwide interested in utilizing the platform for their needs,” says Inas Azzam, CEO of SDVI.

One of the most important applications that the Knoton system provides is in the creation of the Knoton Emergency Notification System (ENS) which will be of enormous benefit in urgent situations especially in school settings.

“The latest headlines are filled almost daily with news of horrific incidents, such as shootings, at our schools and universities which is especially depressing considering these are our places of learning,” says Mr. Azzam. “Implementation of the Knoton ENS can potentially go a long way towards minimizing the effect and scope of the tragedies at our schools,” continues Mr. Azzam.

The Knoton will be able to add a layer of protection to any pre-existing school defense ecosystem by acting as an instant emergency alert system that will be able to activate a pre-alert scenario by simply pressing a button on any Knoton hardware strategically placed throughout the school locale.  The Knoton ENS will provide instant pre-set text alerts to all students, faculty, administrators and just as importantly notify parents and law enforcement of the emergency.

Further enhancements to the Knoton system will allow for instant E911 triggers to local law enforcement in addition to activating a loud audio signal within the school. SDVI’s refinement to the AI back end will in the future also allow for automatic activation of the Knoton ENS by utilizing algorithms that recognize say gunshot sounds.  

“While the Knoton will be excellent in the school setting, it will certainly not be limited to that application. Our Knoton product line will touch on the most important and sensitive aspects of people’s daily lives,” says Mr. Ghassan Elkhatib, Director of IoT Hardware and Artificial Intelligence.

The Knoton technology will be applicable to a variety of situations such as with the following use cases:

* Child safety and tracking. The Knoton can become the ultimate family bodyguard! With its built in L5 signal based GPS motion and ambient sensors, the Knoton can react to scenarios that protect, track and interact with the child.  
* Personal emergency and notification system. The Knoton provides the ultimate 24-7 personal security! The hardware device is easily carried or can also be installed on any iOS or Android mobile device for easy access. In case of emergency, a variety of alarms, messages, audio/video recordings, and a connection to 911 can be activated with a simple press of a button. In addition GPS location data and camera data (identified on Google map for immediate navigation), as defined by the user, can be transmitted creating the ultimate beacon!
* Infant monitoring and prevention of flip induced sudden death syndrome. The Knoton is the ultimate infant life-saver! The technology allows for effective monitoring of infants at home. Images and video of the infant can be analyzed locally to generate the fastest response time in case the infant flips over on their face and is unable to breathe. 
* Facial recognition of registered perpetrators. The Knoton will be your child’s best friend! The Knoton can scan and view the surrounding of the user thereby identifying other faces. These scanned faces will be continuously sent back to the cloud based back end AI which can use algorithms to match the images to registered perpetrators and notify parents, guardians, or law enforcement based on predefined criteria.
* Home automation (with the use of the included Wi-Fi connectivity). The Knoton can provide peace of mind at home! By utilizing the home’s wifi network the Knoton creates realistic physical switches that can perform automated tasks such as lighting control, shade control, scenario automation, etc. The user will in essence have a go to “physical switch” for automated tasks at home without relying on an embedded program within a mobile device or tablet.
* Silent alarm applications. The Knoton is perfect for when you need to be discreet! The Knoton’s extreme connectivity flexibility enables enterprises, banks, retail places, homes, to have a silent alarm virtually anywhere needed; inside a drawer, under a desk, inside a walk-in fridge, etc.
* Blockchain compatible. Designed for the future! The Knoton will be one of the first IoT blockchain devices that can verify and securely validate any transaction. This will be a first in the IoT cryptocurrency and cryptography on-the-go ecosystem.

The Knoton is available for free on the Android Google Play app store here:

[https://play.google.com/store/apps/details?id=knoton.knoton](https://www.globenewswire.com/Tracker?data=bmQmY1ErqAbmFy2xUJ-Z79fcWvC_7dX5GiKrNXJ7tW9ZFQ9VNd1cWZDCMk0lpNoQcev4871sNQ3kVTrZmfEwV1YgMeoPfUxaDxbX8GEDJVtvsLuQ3t6LmnII6l1NhPZXM01x0ne9tgEUoHlDrCX9hf3-69mHbzz0CyBAjmGC0wipebTqEUGFm8wnYG9x6_j_)

The Knoton is also available for free for iOS devices and can be found here:

[https://itunes.apple.com/us/app/knoton/id1436430361?mt=8](https://www.globenewswire.com/Tracker?data=bmQmY1ErqAbmFy2xUJ-Z71E9cifMyB8Xq9jW8dRDczBEyooXdPrNNgK4nI8hRGdMnQA8fB3avZ-yClTS3__aTGEI4rhYLqqM5Kt9bsD4oydbQLg0IfsniP7-cdxaiRRCHUDKb3FNpboz7zlTAqSBmvhWe13JFupu1-Eo7BhUtKAPH3y9HFQbjlgLD93qFtuI)

The full details of the product can be found on the company website here:

[https://innovotech.io/knoton](https://www.globenewswire.com/Tracker?data=bmQmY1ErqAbmFy2xUJ-Z7zL7bQaZUUjbDjDRi3FX2nONtCpU7RKJFsml372DAu8UxiVQe2G0ejGsssIYPSjxbCt9W980leLm4zu3mlBZIj4=)

You can also follow the company on Twitter for small updates and announcements,

[https://twitter.com/SignatureDevice](https://www.globenewswire.com/Tracker?data=bmQmY1ErqAbmFy2xUJ-Z73oRtv5IyQPpa3j0xTB7880cGHUtnap8oSfhXXiqvdvWblKGwmxu8OMvvi_oUAma2h6qZGgJF3fyq7gmr4C7ELNrrhxzUE60lW5aDAwASRHD)",2019-03-05,https://www.reddit.com/r/pennystocks/comments/axob49/sdvi_signature_devices_inc_announces_launch_of/
19,"March 05, 2019 Tomorrow's Daily /r/Pennystocks Discussion - What are your Wednesday plays?",axo5of,AutoModerator,https://www.reddit.com/r/pennystocks/comments/axo5of/march_05_2019_tomorrows_daily_rpennystocks/,1,0,"Please use this thread to discuss your plays of the day!

Since this thread is likely to fill up quickly, consider sorting the comments by ""new"" (instead of ""best"" or ""top"") to see the newest posts.
",2019-03-05,https://www.reddit.com/r/pennystocks/comments/axo5of/march_05_2019_tomorrows_daily_rpennystocks/
20,$EAPH,axo4p7,Mhouse12,https://www.reddit.com/r/pennystocks/comments/axo4p7/eaph/,1,0,"Easton Signs Agreement to Acquire Commercial Bakery with Projected Revenues Over $20,000,000 per Year and Positioned to Enter the Cannabis Edibles Market

Making its move into the pot game!

[News](https://globenewswire.com/news-release/2019/03/05/1748247/0/en/Easton-Signs-Agreement-to-Acquire-Commercial-Bakery-with-Projected-Revenues-Over-20-000-000-per-Year-and-Positioned-to-Enter-the-Cannabis-Edibles-Market.html)",2019-03-05,https://www.reddit.com/r/pennystocks/comments/axo4p7/eaph/
21,where can you deposit pink sheet stocks?,axn3u7,frankpin,https://www.reddit.com/r/pennystocks/comments/axn3u7/where_can_you_deposit_pink_sheet_stocks/,1,0,[removed],2019-03-05,https://www.reddit.com/r/pennystocks/comments/axn3u7/where_can_you_deposit_pink_sheet_stocks/
22,$TRQ,axn35a,vikingsarega-y,https://www.reddit.com/r/pennystocks/comments/axn35a/trq/,1,4,Currently holding 200 shares considering buying more. What are your guys thoughts on this company.,2019-03-05,https://www.reddit.com/r/pennystocks/comments/axn35a/trq/
23,TRDX,axmweq,NagelDonk,https://www.reddit.com/r/pennystocks/comments/axmweq/trdx/,1,0,TRDX is looking good,2019-03-05,https://www.reddit.com/r/pennystocks/comments/axmweq/trdx/
24,$SKPO,axmq1u,ASASSN-15lh,https://www.reddit.com/r/pennystocks/comments/axmq1u/skpo/,1,0,Been bagholding this for a bit in anticipation for the next oil boom..  Seeing some movement after being dead for a while..  hmmm..  never know!,2019-03-05,https://www.reddit.com/r/pennystocks/comments/axmq1u/skpo/
25,RYU,axmq0g,Smilezp12,https://www.reddit.com/r/pennystocks/comments/axmq0g/ryu/,1,2,What’s your guys take on RYU?,2019-03-05,https://www.reddit.com/r/pennystocks/comments/axmq0g/ryu/
26,$LEAS,axmgsg,Nottheface1337,https://www.reddit.com/r/pennystocks/comments/axmgsg/leas/,4,17,Great time to get in...filings coming this week and great dip today after huge profits yesterday 👌,2019-03-05,https://www.reddit.com/r/pennystocks/comments/axmgsg/leas/
27,"$GBHL News out ""Global Entertainment Holdings, Inc. (OTC:GBHL) Seeks Redemption On Its Flag Ship App""",axme3v,health_Stocks,https://www.reddit.com/r/pennystocks/comments/axme3v/gbhl_news_out_global_entertainment_holdings_inc/,1,0,[removed],2019-03-05,https://www.reddit.com/r/pennystocks/comments/axme3v/gbhl_news_out_global_entertainment_holdings_inc/
28,$WIN,axm972,canieatthis1,https://www.reddit.com/r/pennystocks/comments/axm972/win/,29,39,"BUY BUY BUY 


indstream Holdings, Inc. Receives Court Approval of “First Day” Motions to Support Normal Business Operations 

Source: GlobeNewswire Inc. 

Windstream Holdings, Inc. (NASDAQ: WIN) (the “Company”) today announced that the Company has received approvals from the U.S. Bankruptcy Court for the Southern District of New York (the “Court”) for the “First Day” motions related to the voluntary Chapter 11 petitions filed on February 25, 2019. 
Notably, the Court granted Windstream interim approval to access up to $400 million of its $1 billion in debtor-in-possession (“DIP”) financing. This financing, combined with access to the cash generated by the Company’s ongoing operations, is available to meet Windstream’s operational needs and continue operating its business as usual. 

“We are pleased to have received approval of our First Day motions, which will enable Windstream to continue normal business operations as we continue paying our employees, maintaining our relationships with our vendors and business partners and serving our customers as usual,” said Tony Thomas, president and chief executive officer. “Our focus going forward is on serving our customers and maintaining the strong operational momentum we are seeing across our business. We appreciate the prompt action by the Court in approving our First Day motions.” 

In addition to interim approval to access up to $400 million of the $1 billion in DIP financing, Windstream received Court approval to, among other things, operate in the normal course of business without interruption or disruption to its relationships with its customers, vendors, channel partners and employees. Windstream will pay vendors in full for all goods received and services provided to the Company after the filing date, February 25, 2019. ",2019-03-05,https://www.reddit.com/r/pennystocks/comments/axm972/win/
29,$ARSN on the move,axm82l,chrish_850,https://www.reddit.com/r/pennystocks/comments/axm82l/arsn_on_the_move/,2,2,"I can’t remember who alerted the sub of this last week but I jumped in at .0199

Anyone else have a position?",2019-03-05,https://www.reddit.com/r/pennystocks/comments/axm82l/arsn_on_the_move/
30,CPHI UP 17.14% Today 🇨🇳🇨🇳🇨🇳🇨🇳,axm7pe,upennflex,https://www.reddit.com/r/pennystocks/comments/axm7pe/cphi_up_1714_today/,1,0,[removed],2019-03-05,https://www.reddit.com/r/pennystocks/comments/axm7pe/cphi_up_1714_today/
31,Any thoughts on DRIO?,axm2v1,OttoAppelquist,https://www.reddit.com/r/pennystocks/comments/axm2v1/any_thoughts_on_drio/,1,0,[removed],2019-03-05,https://www.reddit.com/r/pennystocks/comments/axm2v1/any_thoughts_on_drio/
32,US Cannabis Company Shows Off Product Line-Up At Trade Show As They Prepare To Uplist To Higher Exchange.,axlsel,health_Stocks,https://www.reddit.com/r/pennystocks/comments/axlsel/us_cannabis_company_shows_off_product_lineup_at/,1,0,[removed],2019-03-05,https://www.reddit.com/r/pennystocks/comments/axlsel/us_cannabis_company_shows_off_product_lineup_at/
33,CIFS ATIS NCTY PETZ,axlqas,calvin50,https://www.reddit.com/r/pennystocks/comments/axlqas/cifs_atis_ncty_petz/,2,2,"These look to be good players for the day .
If any look good to caution going in first thing ",2019-03-05,https://www.reddit.com/r/pennystocks/comments/axlqas/cifs_atis_ncty_petz/
34,$PSIQ - 152 page filing just hit the SEC - Uplisting to OTCQB a go!,axropy,health_Stocks,https://www.reddit.com/r/pennystocks/comments/axropy/psiq_152_page_filing_just_hit_the_sec_uplisting/,1,0,[removed],2019-03-05,https://www.reddit.com/r/pennystocks/comments/axropy/psiq_152_page_filing_just_hit_the_sec_uplisting/
35,$GDET Whos in for the $0.01 Rally? 📈,axrdmt,miamidd12,https://www.reddit.com/r/pennystocks/comments/axrdmt/gdet_whos_in_for_the_001_rally/,33,25,Currently long 500k shares waiting for the next run ,2019-03-05,https://www.reddit.com/r/pennystocks/comments/axrdmt/gdet_whos_in_for_the_001_rally/
36,$GDET Catch the next run 📈🚀💰,axr7k9,daytradeguru,https://www.reddit.com/r/pennystocks/comments/axr7k9/gdet_catch_the_next_run/,1,0,"DD: https://www.stock-alerts.io/trading-reports/gdet-trading-report/

https://www.facebook.com/298472654229686/posts/436931200383830?sfns=mo",2019-03-05,https://www.reddit.com/r/pennystocks/comments/axr7k9/gdet_catch_the_next_run/
37,$LEAS,axkapz,tpschroering,https://www.reddit.com/r/pennystocks/comments/axkapz/leas/,1,0,[removed],2019-03-05,https://www.reddit.com/r/pennystocks/comments/axkapz/leas/
38,First trade in years this past week/ ( YRIV ),axk5uw,KetoPhilCollins,https://www.reddit.com/r/pennystocks/comments/axk5uw/first_trade_in_years_this_past_week_yriv/,13,4,"Good morning, everyone!  I hope you have a great week!!  I made my first trade in many years this past week.  I told myself that I would take notes as I researched, bought, held, and sold.  

&amp;#x200B;

I got lucky with YRIV and some good news late in the week after buying and was in before the weekend HYPE !

&amp;#x200B;

This write up is really just for ME to try and remember how I felt and what I was thinking , but I figured I would share in case a brand new person is wondering ""what is someone else doing in this position!""  I was totally lost when I first tried this a few years ago, but this past week I was more comfortable scanning, buying, not over reacting, and selling for a profit. 

&amp;#x200B;

[http://www.kineticincline.com/finance/penny-stock-trading-thoughts-during-a-trade/](http://www.kineticincline.com/finance/penny-stock-trading-thoughts-during-a-trade/)

&amp;#x200B;

Hope you all have a GREEN DAY!!!

&amp;#x200B;

&amp;#x200B;",2019-03-05,https://www.reddit.com/r/pennystocks/comments/axk5uw/first_trade_in_years_this_past_week_yriv/
39,Trading from Taiwan,axk230,Gecko8908,https://www.reddit.com/r/pennystocks/comments/axk230/trading_from_taiwan/,1,1,"Hey y’all! I’m new to this subreddit, and I’m wondering what platform would be a good place to start. I guess I could go into google and hash it out with all the scammers out there, but I was hoping before I threw my hard earned cash down the toilet, I could find a few suggestions here to throw it down the toilet in a more trader like fashion 😬 I’ve never traded penny stocks, but been involved in forex and commodities for a year an a half. So I guess I’m looking for a platform that gives access to a multitude of penny stocks ",2019-03-05,https://www.reddit.com/r/pennystocks/comments/axk230/trading_from_taiwan/
40,Thoughts on SGYP?,axjjjg,Altruistic-Values,https://www.reddit.com/r/pennystocks/comments/axjjjg/thoughts_on_sgyp/,2,5,"Am looking at purchasing shortly and wanted any advice available, thanks",2019-03-05,https://www.reddit.com/r/pennystocks/comments/axjjjg/thoughts_on_sgyp/
