,title,id,author,url,score,num_comments,text,date,link
63,Can't sell my DECN stock on TD AMERITRADE? Help please!,fotsap,Kyism,https://www.reddit.com/r/pennystocks/comments/fotsap/cant_sell_my_decn_stock_on_td_ameritrade_help/,1,11,"Hi all I'm waiting on the phone with customer support but I have 6600 shares of DECN I bought on TD Ameritrade. It will not let me sell them because it says

&gt; Your buying power will be below zero ($17,503.24) if this order is accepted.

I do not understand? On Robinhood I can simply buy and sell.",2020-03-25,https://www.reddit.com/r/pennystocks/comments/fotsap/cant_sell_my_decn_stock_on_td_ameritrade_help/
64,"If you’re printing puts, please buy the stock as well. Don’t be a full bear be a bearull.",fotooy,killax_13,https://www.reddit.com/r/pennystocks/comments/fotooy/if_youre_printing_puts_please_buy_the_stock_as/,1,0,[removed],2020-03-25,https://www.reddit.com/r/pennystocks/comments/fotooy/if_youre_printing_puts_please_buy_the_stock_as/
65,ASTC Isnt done yet boys get in on it before its too late,fotlqe,16anon76,https://www.reddit.com/r/pennystocks/comments/fotlqe/astc_isnt_done_yet_boys_get_in_on_it_before_its/,1,5,Almost 450% rise today big money here,2020-03-25,https://www.reddit.com/r/pennystocks/comments/fotlqe/astc_isnt_done_yet_boys_get_in_on_it_before_its/
66,XSPA... a potential HODL continuation? Yes,fothe2,TheBazaarTrades,https://www.reddit.com/r/pennystocks/comments/fothe2/xspa_a_potential_hodl_continuation_yes/,1,52,"I truly amaze myself. For those who got in either in the middle ground of 0.30, or the top at 0.50, do not lose heart. A catalyst like this is a clear sign continuation for potential gold mine here. Do not fret, whether you bought low or high, ignore the noises. Trust yourself, ignore the comments.

So, let's get down to business. 0.37 and over is likely a continuation bullish. Supernova runner if it can manage to break 0.58. I am getting silly DMs people telling me to sell, but I am not. I know this will break more than a $1 with this partnership and the struggle to fight and aid people with the care needed especially elders.

Keynotes: We're lacking hospital beds, so this is a key supernova hint.",2020-03-25,https://www.reddit.com/r/pennystocks/comments/fothe2/xspa_a_potential_hodl_continuation_yes/
67,$MCEP,fotf8q,theflemingo69,https://www.reddit.com/r/pennystocks/comments/fotf8q/mcep/,1,0,[removed],2020-03-25,https://www.reddit.com/r/pennystocks/comments/fotf8q/mcep/
68,Anything on OPGEN?,fotdp8,Wesmess10,https://www.reddit.com/r/pennystocks/comments/fotdp8/anything_on_opgen/,1,0,[removed],2020-03-25,https://www.reddit.com/r/pennystocks/comments/fotdp8/anything_on_opgen/
69,Contact Isolation Rooms post-COVID pandemic (ALPP),fot731,FarmBella,https://www.reddit.com/r/pennystocks/comments/fot731/contact_isolation_rooms_postcovid_pandemic_alpp/,1,0,"I might be late to the party because I’m really new at this. But ALPP was awarded contracts for hospital isolation rooms on 3/19. 

From healthcare/hospital  experience, I believe this will be a big discussion once COVID crisis goes away and hospitals revaluate their negative and positive pressure rooms.",2020-03-25,https://www.reddit.com/r/pennystocks/comments/fot731/contact_isolation_rooms_postcovid_pandemic_alpp/
70,Time to pull out of aytu?,fot6s6,Sidesalad37,https://www.reddit.com/r/pennystocks/comments/fot6s6/time_to_pull_out_of_aytu/,1,12,Not looking good,2020-03-25,https://www.reddit.com/r/pennystocks/comments/fot6s6/time_to_pull_out_of_aytu/
71,"I have 800$ , need help with puts",fosywu,Phathose024,https://www.reddit.com/r/pennystocks/comments/fosywu/i_have_800_need_help_with_puts/,1,5,"I’ve lost 1k already , I don’t know what I’m doing .",2020-03-25,https://www.reddit.com/r/pennystocks/comments/fosywu/i_have_800_need_help_with_puts/
72,SRNE still a good play?,fosvh1,sambeads,https://www.reddit.com/r/pennystocks/comments/fosvh1/srne_still_a_good_play/,1,6,I really thought this was going somewhere. Been sitting at a minor loss for a week or two. Anyone else been keeping an eye on this one?,2020-03-25,https://www.reddit.com/r/pennystocks/comments/fosvh1/srne_still_a_good_play/
73,PLUG is back up to pre-virus numbers,fostup,Agnia_Barto,https://www.reddit.com/r/pennystocks/comments/fostup/plug_is_back_up_to_previrus_numbers/,1,3,FCEL next? Who's still holding?,2020-03-25,https://www.reddit.com/r/pennystocks/comments/fostup/plug_is_back_up_to_previrus_numbers/
74,Advice for a beginner please,fostpt,panth3r_,https://www.reddit.com/r/pennystocks/comments/fostpt/advice_for_a_beginner_please/,1,3,"Hello Everyone,

I'm a student from the UK and I would to enter the share trading market. I understand the risks and benefits associated with share trading. I have some money to throw away. I'm struggling to understand some basic stuff it seems. 
I opened an account with fidelity and found out that they don't have US shares. I tried to open an account with TD Ameritrade but can't since I am a UK citizen. Also while in fidelity I noticed a charge of £10 per transaction for shares. Now I read on reviews (https://www.stockbrokers.com/guides/online-stock-brokers)  that on these platforms stock trading is free. What does that mean if i faced a charge of £10? Where can i buy the shares you guys posting about in this subreddit? (AYTU) Also, I'm planning on only investing around £100 so the charges for transaction is important, what is a good cheap platform to get started on?

Thanks in advance.",2020-03-25,https://www.reddit.com/r/pennystocks/comments/fostpt/advice_for_a_beginner_please/
75,Stock up on IBIO.,fostpk,sjybpysleep,https://www.reddit.com/r/pennystocks/comments/fostpk/stock_up_on_ibio/,1,23,The tests are now here. We need the cure. And it's pretty cheap.. You know these penny companies. They are working hard to to fill orders.,2020-03-25,https://www.reddit.com/r/pennystocks/comments/fostpk/stock_up_on_ibio/
76,NBR,fosskb,huttbwpgp,https://www.reddit.com/r/pennystocks/comments/fosskb/nbr/,1,2,NBR undervalued on the intraday. .56 cents is an excellent price.,2020-03-25,https://www.reddit.com/r/pennystocks/comments/fosskb/nbr/
77,$500 to spend,fosmfr,OkQuail2,https://www.reddit.com/r/pennystocks/comments/fosmfr/500_to_spend/,1,14,I’ve got $500 to spend on stocks... I’m not planning on touching for 5 years minimum. Why would be good to invest in? Oil? Airlines? Real estate? Cruise ships? Thanks!!!,2020-03-25,https://www.reddit.com/r/pennystocks/comments/fosmfr/500_to_spend/
78,TPTW,fosmc9,Jdubya0822,https://www.reddit.com/r/pennystocks/comments/fosmc9/tptw/,1,0,[removed],2020-03-25,https://www.reddit.com/r/pennystocks/comments/fosmc9/tptw/
79,GRPN?,fosmae,asommers98,https://www.reddit.com/r/pennystocks/comments/fosmae/grpn/,1,3,Thoughts on Groupon? They hit a 52-week low last Thursday but has been steadily recovering this week.,2020-03-25,https://www.reddit.com/r/pennystocks/comments/fosmae/grpn/
80,Is it to late for ttoo?,fosm61,Phathose024,https://www.reddit.com/r/pennystocks/comments/fosm61/is_it_to_late_for_ttoo/,1,3,Bought in at .94 cents 😷,2020-03-25,https://www.reddit.com/r/pennystocks/comments/fosm61/is_it_to_late_for_ttoo/
81,TTOO bounceback,fosjed,cjd53172,https://www.reddit.com/r/pennystocks/comments/fosjed/ttoo_bounceback/,1,7,TTOO is up .42 on the day so far 108% increase through the day. This may continue to move up as well.,2020-03-25,https://www.reddit.com/r/pennystocks/comments/fosjed/ttoo_bounceback/
82,MFA Financial,fosfnv,Cdavid160,https://www.reddit.com/r/pennystocks/comments/fosfnv/mfa_financial/,1,43,"I got 1K shares last night at $0.36 each, this is my first stock market investment ever. When the hell should I get out?!",2020-03-25,https://www.reddit.com/r/pennystocks/comments/fosfnv/mfa_financial/
83,Beginner here,fosda4,25bradley,https://www.reddit.com/r/pennystocks/comments/fosda4/beginner_here/,1,2,What are some of your top 5 stocks that i should look to get into and research?  need help starting out,2020-03-25,https://www.reddit.com/r/pennystocks/comments/fosda4/beginner_here/
84,Opinions on TOPS [earnings call tomorrow],fos4i1,s6dative,https://www.reddit.com/r/pennystocks/comments/fos4i1/opinions_on_tops_earnings_call_tomorrow/,1,0,[removed],2020-03-25,https://www.reddit.com/r/pennystocks/comments/fos4i1/opinions_on_tops_earnings_call_tomorrow/
85,VueScan Pro Crack v9.7.26 Full Latest Free Download 2020,fos2hx,azharferozi,https://www.reddit.com/r/pennystocks/comments/fos2hx/vuescan_pro_crack_v9726_full_latest_free_download/,1,0,[removed],2020-03-25,https://www.reddit.com/r/pennystocks/comments/fos2hx/vuescan_pro_crack_v9726_full_latest_free_download/
86,$DLCR,fos2gn,canieatthis1,https://www.reddit.com/r/pennystocks/comments/fos2gn/dlcr/,1,8,"If .0013s fall without news of becoming pink, this could be a big run when it actually does become a pink limited. There is hardly any resistance between now and .0035, anyone have thoughts?",2020-03-25,https://www.reddit.com/r/pennystocks/comments/fos2gn/dlcr/
87,Thoughts on $MARK?,fory5p,iheartaginganddying,https://www.reddit.com/r/pennystocks/comments/fory5p/thoughts_on_mark/,1,0,[removed],2020-03-25,https://www.reddit.com/r/pennystocks/comments/fory5p/thoughts_on_mark/
88,Thoughts on portfolio,forufv,orangeliketrump,https://www.reddit.com/r/pennystocks/comments/forufv/thoughts_on_portfolio/,1,0,"https://imgur.com/a/jfIywDu

Thanks, trying to learn",2020-03-25,https://www.reddit.com/r/pennystocks/comments/forufv/thoughts_on_portfolio/
89,DECN making a second test,forsbg,mycamelspider,https://www.reddit.com/r/pennystocks/comments/forsbg/decn_making_a_second_test/,1,0,[removed],2020-03-25,https://www.reddit.com/r/pennystocks/comments/forsbg/decn_making_a_second_test/
90,jdst?,forq6m,EB4950,https://www.reddit.com/r/pennystocks/comments/forq6m/jdst/,1,15,feel like its low asf rn. could only go up from here?,2020-03-25,https://www.reddit.com/r/pennystocks/comments/forq6m/jdst/
91,SCYX?,forgrk,blackfordtruck,https://www.reddit.com/r/pennystocks/comments/forgrk/scyx/,1,0,Thoughts?,2020-03-25,https://www.reddit.com/r/pennystocks/comments/forgrk/scyx/
92,MFA 🚀🚀,for6ly,Jkelley69,https://www.reddit.com/r/pennystocks/comments/for6ly/mfa/,1,4,"MFA Dropped roughly $2.50 yesterday, sense has risen 118%.",2020-03-25,https://www.reddit.com/r/pennystocks/comments/for6ly/mfa/
93,I’m hungry,for5zi,Phathose024,https://www.reddit.com/r/pennystocks/comments/for5zi/im_hungry/,1,3,TTOO thoughts? I have puts early this morning . Average weight for sale off ?,2020-03-25,https://www.reddit.com/r/pennystocks/comments/for5zi/im_hungry/
94,AYTU Distribution &amp; sales,fomw01,INKOSI-Yaw,https://www.reddit.com/r/pennystocks/comments/fomw01/aytu_distribution_sales/,1,2,"With its distribution and sales that are coming up how quick will it go past $3? 
Will it go past $2 again today?",2020-03-25,https://www.reddit.com/r/pennystocks/comments/fomw01/aytu_distribution_sales/
95,KOS Pattern,fomkm6,jacobbodd,https://www.reddit.com/r/pennystocks/comments/fomkm6/kos_pattern/,1,2,"KOS has been jumping up .10 every day at open currently at .80 . It is an oil stock so who knows if it will keep going up, but this has happened every day for about 4 days.",2020-03-25,https://www.reddit.com/r/pennystocks/comments/fomkm6/kos_pattern/
96,"USLG, potential contender?",fp0vhi,HereForTheMoney420,https://www.reddit.com/r/pennystocks/comments/fp0vhi/uslg_potential_contender/,1,0,[removed],2020-03-25,https://www.reddit.com/r/pennystocks/comments/fp0vhi/uslg_potential_contender/
97,ALT,fp0lor,rockandahardplace08,https://www.reddit.com/r/pennystocks/comments/fp0lor/alt/,1,2,"the technical analysis has changed on this one over to strong buy, any new thoughts? I have been holding 1000 shares for a while now, it stayed steady at $3 when everything else was crashing so I have my hopes with it, seems like any good news could make it go for a run.",2020-03-25,https://www.reddit.com/r/pennystocks/comments/fp0lor/alt/
98,"For experienced Penny Stock investors, what videos or books if any would you recommend to a beinninger?",fp0c4g,Bsizzle1024,https://www.reddit.com/r/pennystocks/comments/fp0c4g/for_experienced_penny_stock_investors_what_videos/,1,9,"Had some luck with penny stocks but would like to take my approach to a whole new level. What to look for in a stock, when to sell out, or when to hold...etc?",2020-03-25,https://www.reddit.com/r/pennystocks/comments/fp0c4g/for_experienced_penny_stock_investors_what_videos/
99,MARK,fp0ahs,rockandahardplace08,https://www.reddit.com/r/pennystocks/comments/fp0ahs/mark/,1,6,"any thoughts? looks like they have some pretty sweet technology for scanning groups of people for fever, its almost like facial recognition but to see if people are sick, technology like this might have a real market in the near future but when i look into the company myself it seems to have mixed thoughts, im not sure who the company owes money to. Do you guys know any other companies like this selling this kind of technology?",2020-03-25,https://www.reddit.com/r/pennystocks/comments/fp0ahs/mark/
100,Trying to learn more about trading?,fp07jy,yaoninja,https://www.reddit.com/r/pennystocks/comments/fp07jy/trying_to_learn_more_about_trading/,1,2,"Join our Discord: https://discord.gg/tgj4f6y

You can learn more about stocks, options, straddles, strangles, support, resistance, and naked calls and puts.

Free to join and check out what other people are talking about.",2020-03-25,https://www.reddit.com/r/pennystocks/comments/fp07jy/trying_to_learn_more_about_trading/
101,XSPA dropping :(,fp011x,PrettyDeal,https://www.reddit.com/r/pennystocks/comments/fp011x/xspa_dropping/,1,0,[removed],2020-03-25,https://www.reddit.com/r/pennystocks/comments/fp011x/xspa_dropping/
102,$PRED,fozrb2,slabbywabby,https://www.reddit.com/r/pennystocks/comments/fozrb2/pred/,1,6,"What are people’s thoughts on $PRED? Big jump today on the announcement of their test kit, but will this continue? Seems like they have a lot of stuff in the works and do not want to announce everything at once. 


https://www.google.com/amp/s/finance.yahoo.com/amphtml/news/predictive-technology-group-announces-launch-120010967.html",2020-03-25,https://www.reddit.com/r/pennystocks/comments/fozrb2/pred/
103,DECN,fozbma,Nice-Location,https://www.reddit.com/r/pennystocks/comments/fozbma/decn/,1,74,"I see A LOT of people on here freaking out about DECN dropping, unless there's some insider trading going on, (which would explain why it's dropping) which I highly doubt for a penny stock! 

Please stop freaking out people, who cares if it goes down to even 0.010 it wasn't even that high to begin with only peaking at .25. And when you compare it to other companies like AYTU, Ibio, etc etc who are around 1.30 per share, DECN still has plenty of room to grow. They will get FDA approval, it doesn't make sense why there diabetes test strips would get FDA approval but the Covid 19 test kits don't? Especially when you have investors investing 13 Million into this project. 

People are most likely selling because there's been no new news recently. Sorry that the CEO couldn't update you people on a day to day basis about his company. He's got bigger things to worry about. 

Now stop freaking out. 

Someone had to say it.",2020-03-25,https://www.reddit.com/r/pennystocks/comments/fozbma/decn/
104,Trading &amp; Investing In A Bear Market📉,foz2cw,mtmtrader,https://www.reddit.com/r/pennystocks/comments/foz2cw/trading_investing_in_a_bear_market/,1,4,"As you most likely already know, the market has been a **bloodbath** over the past month or so due to fears of the [coronavirus](https://www.who.int/health-topics/coronavirus#tab=tab_1) and its effect on the economy. Businesses have been closing and people have been ordered to stay at home to prevent the spread the disease. Inevitably, this will affect the economy and the stock market. Since all of this started happening, $SPY *(the ETF tracking the S&amp;P 500)* has fallen over 35% from its high of $339.08 in February 2020 to its recent low of $218.26 in March 2020.

A lot of people are under the impression that money can't be made in the market with such bearish conditions, which is **not** true. A bear market actually offers plenty of opportunities that are not always available in a bull market. In this post I'll be sharing some tips on how to handle the current market conditions, and how you can take advantage of it for both [day trading](https://masterthemarket.teachable.com/blog/197973/day-trading-vs-swing-trading) and long-term investing profits!

When it comes to day trading in a bear market, it's extra important to manage your risk. Bearish conditions typically bring along increased **volatility** in the market. That volatility is a great thing for day trading... but it can also be *terrible* thing. If you're not properly managing your risk, you should expect larger drawdowns and losses on your positions than you're typically used to while the market's volatility is high.

Obviously this is something most traders want to avoid, because managing risk properly is the name of the game. Because of that, I recommend trading with smaller-than-usual position sizes to offset the increased volatility. For example, if an average day trade position size for you is $10,000, you may want to try cutting that down to maybe $7,500, $5,000, or even less to avoid dealing with increased risk in a volatile market.

You may be worried that smaller positions will also take away from your profits, which should **not** be the case. You have to keep in mind that the increased volatility also can work in your favor when you're on the right side of a trade. If done properly, you should be both risking and profiting the same as you would on an average trade, even with a fraction of the position size.

Position size aside, it may be more difficult to find winning trades in a bear market if you only buy and sell. Instead, bear markets offer great [short-selling](https://www.youtube.com/watch?v=3vn-nKBn8fs&amp;t=2s) opportunities. Short-selling lets us profit from stocks going down, which can be a huge benefit in the weakness of a bear market.

**Here's a rundown on how short-selling works:**

**1.** You place an order to short-sell 100 shares of stock symbol ABC.

**2.** That order automatically requests to borrow 100 shares of ABC from your broker.

**3.** You sell the borrowed shares when you believe the price is going to go down.

**4.** Later you buy back the shares (*or cover*), which automatically returns them to your broker.

**5.** You either profit or lose the difference between where you bought and sold, multiplied by the number of shares traded.

You **always** want to buy low and sell high in the market! The only difference with short-selling is that you're selling high first and hopefully buying low after, which is easier in a bear market.

Even though I personally am mostly a short-term trader, I'm still excited about the long-term investment opportunities that this market selloff will offer too. Eventually, $SPY and the S&amp;P 500 will be back at their highs. This selloff is only making the future return to the highs more profitable for those that take advantage of it!

Now is not the time to afraid of the market and not the time to be afraid of losing... even though most people are. **Warren Buffett** even said *""Be fearful when others are greedy. Be greedy when others are fearful.""* The fear in the market is higher than it's been in a long time, which means it's almost time to get greedy and buy, buy, and some more.

Although, it's important to not buy all at once. You can never expect to buy at the exact bottom, so it's better to **slowly** build a position over days, weeks or even months rather than buying your full position all at once. If you're planning on investing $10,000 into the market, you may want to buy $2,000 at a time as the price bottoms out.

Alternatively, you can also wait for the bottom of the selloff to be confirmed and for the price to start bouncing back up. By doing this you're guaranteeing that you are not buying the exact bottom, but you can also be confident that the selloff is over and the price is likely to start its climb back up.

Regardless, there is a lot more strategy to investing than most people think. You can't always find winners by buying into well-known companies. You should be doing some [fundamental analysis](https://www.youtube.com/watch?v=GLG8OPk0xAM) to find strong companies that will survive a recession and even out-perform the market. Looking for things like quarter over quarter and annual EPS growth, growing revenues, and high institutional ownership is a great start for a long-term investment.

On the technical side, it's best to see that the individual stock is performing better than $SPY and the S&amp;P 500. As I mentioned, $SPY is currently down about 35% from its highs at the time of this writing. A good investment is likely to also be dragged down by the market, but not a full 35%.

I hope this post calms some nerves about the current market selloff we're facing and gives you some ideas on how you can take advantage of it.

FULL BLOG: [https://masterthemarket.teachable.com/blog/203768/trading-investing-in-a-bear-market](https://masterthemarket.teachable.com/blog/203768/trading-investing-in-a-bear-market)",2020-03-25,https://www.reddit.com/r/pennystocks/comments/foz2cw/trading_investing_in_a_bear_market/
105,$TTOO Is the Next $IMAC,foo8j3,stocksrcool,https://www.reddit.com/r/pennystocks/comments/foo8j3/ttoo_is_the_next_imac/,1,18,"Big news came out this morning, and the price has already increased substantially.",2020-03-25,https://www.reddit.com/r/pennystocks/comments/foo8j3/ttoo_is_the_next_imac/
106,Purchase Price Change,foo5uv,blackfordtruck,https://www.reddit.com/r/pennystocks/comments/foo5uv/purchase_price_change/,1,13,"I use TDA and I’ve noticed over the last 2 days my purchase price of AYTU keeps changing, and I double checked to make sure I was looking at the right number and it’s definitely the purchase price. I got back in yesterday at 1.85 and now my purchase price is showing 2.05? Does anyone know why this is?",2020-03-25,https://www.reddit.com/r/pennystocks/comments/foo5uv/purchase_price_change/
107,Thoughts on $RWT,fonuo5,KingNickyThe1st,https://www.reddit.com/r/pennystocks/comments/fonuo5/thoughts_on_rwt/,1,1,"Bought a few hundred shares at 3.30 yesterday, down to 2.80 now. It was just upgraded to ""outperform"" from JMP secuirites this AM with a fair price of $10. Thinking of buying a few hundred more if it opens under 3. These REITs scare me, but don't see this company dropping more as it was trading around 17 2 weeks ago.",2020-03-25,https://www.reddit.com/r/pennystocks/comments/fonuo5/thoughts_on_rwt/
