,author,id,url,score,text,date
116,skeemon,dvrr8d8,/r/pennystocks/comments/84ol5y/whats_everyones_long_term_holds/dvrr8d8/,1,"No one on the outside has any 100% certainty that the trial has gone well or what the results are. What is encouraging now, is that the study has been completed in its entirety and now we simply wait for findings.  That alone means that no side effects were adverse enough to bring the study to an immediate stop.  The main question now is if the drug can produce the desired effect of pain reduction and reduced inflammation more effectively/safely than Naproxen, with reduced GI damage + without affecting blood pressure, which are central issues with NSAIDs. I believe in the science and promising previous findings which lead to this trial. (Ranging from one dose of Naproxen causing the same level of gastric damage in rats as a 90 times larger dose of ATB346 ... Right up to previous studies being terminated only because of people lying about pre-existing medical conditions, NOT due to adverse side effects of the drug itself.) I believe in Dr. John Wallce, a shockingly accomplished world-leading researcher/biomedical scientist. One look at his resume will tell the story.  I'd encourage you to look at their website and read their investor presentation, and I'd also encourage you to search through u/PerfectRectangle 's comment history.  He works in the medical space, is intimately involved in the industry and has accumulated hundreds of thousands of shares. In his comments you'll find solid intel, bias-free trails of independent information to begin exploring, including links to videos of Dr Wallace presenting at a scientific conference - which was what helped sell me on Antibe, I bought shortly after.  I haven't even scratched the surface.  Hopefully PerfectRectangle can add key gems that I have surely omitted.  There are many.  Research will convince you this has huge potential.  Cheers!",2018-03-15
117,silverwhere81,dvrrd0v,/r/pennystocks/comments/84ol5y/whats_everyones_long_term_holds/dvrrd0v/,1,"Nothing now.  JET.V was to be a ultra low-cost carrier (ULCC) airline.  However, the recent news they've run into issues leasing jets for a Q2 operation.  Now a major carrier in Canada (Westjet) is introducing a ULCC known as SWOOP.  SWOOP will operate out of the secondary airports just as JET.V planned in June 2018.  JET.V may try to still lease jets and compete, but they will be late to the game with a very strong competition. DUMP your shares, no revenue for awhile.",2018-03-15
118,psinsyd,dvrs3b5,/r/pennystocks/comments/84obrk/jbzyd_is_now_almost_400_a_share_after_postreverse/dvrs3b5/,1,"Looks like Yahoo is displaying correctly again.  Showing 3.65 currently, up 1.35 or 58.7%.",2018-03-15
119,360walkaway,dvrtd3u,/r/pennystocks/comments/84ol5y/whats_everyones_long_term_holds/dvrtd3u/,1,Blozf... go go cannabis stock.,2018-03-15
120,jackfondu,dvruhux,/r/pennystocks/comments/84okki/march_15_2018_tomorrows_daily_rpennystocks/dvruhux/,1,"averaging out my HVBTF, good dip below $1 rn imo",2018-03-15
121,TheLastNatives,dvruyq3,/r/pennystocks/comments/84muc3/explain_this_to_me_like_im_an_idiot/dvruyq3/,1,"I dip, you dip, we dip",2018-03-15
122,holeeray,dvrv55t,/r/pennystocks/comments/84o0yt/bioa_earnings_call_tonight_at_4pm_after_market/dvrv55t/,1,"I dunno if you're being an ass or asking seriously, but yeah, they announced that they put in for an extension.",2018-03-15
123,Impreziv,dvrve29,/r/pennystocks/comments/84ol5y/whats_everyones_long_term_holds/dvrve29/,1,ELTP,2018-03-15
124,mistertyz,dvrwj99,/r/pennystocks/comments/84ol5y/whats_everyones_long_term_holds/dvrwj99/,1,"Same story, different numbers. I feel your pain even at my 4500 shares. GLTA jet holders",2018-03-15
125,queenslandbananas,dvrwnop,/r/pennystocks/comments/84p26k/bvtk_ecrypt_one_patent_rejected_final_rejection/dvrwnop/,1,"&gt; The dilution stage is basically over.

Pure wishful thinking. ",2018-03-15
126,AcadianMan,dvrx4dx,/r/pennystocks/comments/84ol5y/whats_everyones_long_term_holds/dvrx4dx/,1,I am also in the long game on this one.,2018-03-15
127,InspirationalQuoter,dvrx5i0,/r/pennystocks/comments/84ol5y/whats_everyones_long_term_holds/dvrx5i0/,1,I don’t think I have the balls to hold beyond tomorrow. ,2018-03-15
128,AcadianMan,dvrx6uy,/r/pennystocks/comments/84ol5y/whats_everyones_long_term_holds/dvrx6uy/,1,"DCTH, OMVS and BYSD  :(",2018-03-15
129,JohnnyChimpo13,dvrxjdc,/r/pennystocks/comments/84p26k/bvtk_ecrypt_one_patent_rejected_final_rejection/dvrxjdc/,1,4 billion shares were diluted over the summer and only 1.5 billion since September. VNDM has been off the ask for awhile now and BMICs barely been hitting it. They update every 2 weeks and it's been less and less every time.  Last update showed a whopping 20 million share increase. There's just not much left to convert ,2018-03-15
130,dkingo,dvry1r7,/r/pennystocks/comments/84oq13/how_do_i_get_into_this/dvry1r7/,1,Try a discord channel. This is ours. We trade pennystocks ETFs options crypto and forex. https://discord.gg/kVMzmcA,2018-03-15
131,life256,dvry8tg,/r/pennystocks/comments/84ol5y/whats_everyones_long_term_holds/dvry8tg/,1,"$HUSA is going to be insane. Holding for a few months now, about 1500 shares. 

Expectations are $1 by Summer, $5 within a year or so. 

Or at least I hope so.... Lol

*Sobbing*",2018-03-15
132,wodentx,dvryfum,/r/pennystocks/comments/84o0yt/bioa_earnings_call_tonight_at_4pm_after_market/dvryfum/,1,"Was actually being serious.   I found the article, and read that the earnings call was being postponed, but was curious if the already call took place to announce the postponement or conversation about other dealings outside of earnings.    ",2018-03-15
133,marek3220,dvrzezv,/r/pennystocks/comments/84ol5y/whats_everyones_long_term_holds/dvrzezv/,1,How exactly? This company doesn't seem to be doing anything. Very vague broad statements and nothing to show for it financially,2018-03-15
134,vegan-weirdo,dvrzf54,/r/pennystocks/comments/84nlvn/checkout_sgrp_flying_under_the_radar_at_159/dvrzf54/,1,Pump it baby ,2018-03-15
135,Atotallyrandomname,dvs0n2l,/r/pennystocks/comments/84ol5y/whats_everyones_long_term_holds/dvs0n2l/,1,TRTC,2018-03-15
136,drgreenthumbatx420,dvs1do4,/r/pennystocks/comments/84ol5y/whats_everyones_long_term_holds/dvs1do4/,1,How many shares do you hold if you don't mind me asking?,2018-03-15
137,AgentOrange256,dvs1u5m,/r/pennystocks/comments/84ol5y/whats_everyones_long_term_holds/dvs1u5m/,1,Why do they have no revenue?,2018-03-15
138,rektamo,dvs2qxu,/r/pennystocks/comments/84ol5y/whats_everyones_long_term_holds/dvs2qxu/,1,"They acquired the graphite production center and began mining recently, no revenue till early 2019 into 2020",2018-03-15
139,AgentOrange256,dvs2scq,/r/pennystocks/comments/84ol5y/whats_everyones_long_term_holds/dvs2scq/,1,"Ya but the company is like 40 years old, how can they not have revenue?",2018-03-15
140,rektamo,dvs2vj9,/r/pennystocks/comments/84ol5y/whats_everyones_long_term_holds/dvs2vj9/,1,"New ceo, new strategy. Switching over to meet demand for the electric car revolution in the upcoming years. Graphite’s mixed into the lithium batteries. They have some interesting stuff on their press releases all look promising ",2018-03-15
141,rektamo,dvs2vxb,/r/pennystocks/comments/84ol5y/whats_everyones_long_term_holds/dvs2vxb/,1,"New ceo, new strategy. Switching over to meet demand for the electric car revolution in the upcoming years. Graphite’s mixed into the lithium batteries. They have some interesting stuff on their press releases all look promising ",2018-03-15
142,unpronounceable,dvs426a,/r/pennystocks/comments/84oq13/how_do_i_get_into_this/dvs426a/,1,"Heads up, in Canada, one can only use ameritrade for paper trading, they don't allow Canadians to trade with real money on the platform.",2018-03-15
143,skeemon,dvs4c42,/r/pennystocks/comments/84ol5y/whats_everyones_long_term_holds/dvs4c42/,1,"I have 58,500 @0.184",2018-03-15
144,skeemon,dvs4iqy,/r/pennystocks/comments/84ol5y/whats_everyones_long_term_holds/dvs4iqy/,1,"Provided you were in early enough that you're in the green currently, I would suggest considering taking out your original investment and letting the profit ride. In that case, even if it goes to 0.00, which it won't, you haven't lost a cent. ",2018-03-15
145,erkaaj,dvsaru7,/r/pennystocks/comments/84ol5y/whats_everyones_long_term_holds/dvsaru7/,1,I like it when someone else is convinced by essentially the same reasona. Holding through results as well. Good luck man,2018-03-15
146,SketchyCharmander,dvsb3lk,/r/pennystocks/comments/84okki/march_15_2018_tomorrows_daily_rpennystocks/dvsb3lk/,1,“It has to go up eventually”,2018-03-15
147,LWTTRADING,dvsc8jj,/r/pennystocks/comments/84j5n4/what_apps_can_be_used_to_buy_pennystocks_in_europe/dvsc8jj/,1,"Tradezero is good all round 

https://www.youtube.com/watch?v=m86k2WcfqM4",2018-03-15
148,LWTTRADING,dvsci4t,/r/pennystocks/comments/84oq13/how_do_i_get_into_this/dvsci4t/,1,"My advice would be to study as much as possible and start to save up, the more you start with the higher chance you have of success, we have 5 guys in the chatroom who finally became profitable and it was a long journey with many big speed bumps. The thing we mainly see is finding difference gambling and making a good trade. We have a currently free chatroom if you want to join drop us a message",2018-03-15
149,LWTTRADING,dvscilb,/r/pennystocks/comments/84ol5y/whats_everyones_long_term_holds/dvscilb/,1,Long term hold on a penny stock? risky... ,2018-03-15
150,Saints420Fan,dvse7j8,/r/pennystocks/comments/84ol5y/whats_everyones_long_term_holds/dvse7j8/,1,"Zero toxic notes (recently paid off noted on last 8k in February), SEC filer, 61.5m O/S, $1.15 million in financing and est. EPS of .04 . Been as steady as she comes the last 3 months - taken from iHub forums I frequent ",2018-03-15
151,vegan-weirdo,dvsfw8a,/r/pennystocks/comments/84muc3/explain_this_to_me_like_im_an_idiot/dvsfw8a/,1,"You're an idiot (as requested) 

It was pumped, now it's falling. 

Happens everyday ",2018-03-15
152,toidboigler,dvsmhca,/r/pennystocks/comments/84ol5y/whats_everyones_long_term_holds/dvsmhca/,1,"&gt; I like it when someone else is convinced by essentially the same reasona

That's called confirmation bias. It's the main reason people end up as mystified bagholders.",2018-03-15
153,erkaaj,dvsn3va,/r/pennystocks/comments/84ol5y/whats_everyones_long_term_holds/dvsn3va/,1,"Not necessarily. Confirmation bias is liking something because of the results, not the reasons. For instance, if I side with an argument just because they support my conclusion then I am guilty of confirmation bias. I am not saying because he/she supports my position I like it, rather the process of conviction is that which I like.",2018-03-15
154,drgreenthumbatx420,dvsnmq7,/r/pennystocks/comments/84ol5y/whats_everyones_long_term_holds/dvsnmq7/,1,Jeeeeeeeeeezus. Well I think I may grab another chunk as a yolo play on next week's results and then see what happens. ,2018-03-15
155,palidon,dvsq8oc,/r/pennystocks/comments/84obrk/jbzyd_is_now_almost_400_a_share_after_postreverse/dvsq8oc/,1,if i was holding jbzy how do i sell it? do i just have to wait until my shares transfer? how long does it take for shares to transfer? the stock is showing as a number in my position statement,2018-03-15
156,Hold_onto_yer_butts,dvsqde0,/r/pennystocks/comments/84nop1/xxii_fdas_anprm_released_today_looking_to_mandate/dvsqde0/,1,Why calls? These things are as expensive as the underlying due to the IV...,2018-03-15
157,Schepp5,dvst3em,/r/pennystocks/comments/84oq13/how_do_i_get_into_this/dvst3em/,1,"The people saying they did well with ""warrior training"" probably lost their shit too - they are just too proud or ashamed to admit it.  It's like people that promote MLM schemes and say how great it is when they have actually paid more money than they have received ",2018-03-15
158,[deleted],dvsue6z,/r/pennystocks/comments/84ol5y/whats_everyones_long_term_holds/dvsue6z/,1,[removed],2018-03-15
159,Hamsmelly,dvsv27k,/r/pennystocks/comments/84oq13/how_do_i_get_into_this/dvsv27k/,1,"&gt; Be a value investor
&gt; focus on penny stocks.

pick one

",2018-03-15
160,JustCallMeAtom,dvsv3am,/r/pennystocks/comments/84oq13/how_do_i_get_into_this/dvsv3am/,1,? Not all penny stocks are vaporware.,2018-03-15
161,rektamo,dvt11b4,/r/pennystocks/comments/84ol5y/whats_everyones_long_term_holds/dvt11b4/,1,"It’s risky but if you do the research and see a company with a breakthrough and vision and you go long on them, you just made a hefty cash out",2018-03-15
162,RazsterOxzine,dvt1hi1,/r/pennystocks/comments/84ol5y/whats_everyones_long_term_holds/dvt1hi1/,1,I just got into it today. Guess I should keep buying more since it keeps dipping.,2018-03-15
163,SuperScuba,dvt2nr2,/r/pennystocks/comments/84p26k/bvtk_ecrypt_one_patent_rejected_final_rejection/dvt2nr2/,1,"Thanks Johnny, I was about to ask the same question.  Haha.",2018-03-15
164,omega12345A,dvt38re,/r/pennystocks/comments/84ol5y/whats_everyones_long_term_holds/dvt38re/,1,"You're in my thoughts and prayers

",2018-03-15
165,AnomalyNexus,dvt6mis,/r/pennystocks/comments/84nop1/xxii_fdas_anprm_released_today_looking_to_mandate/dvt6mis/,1,"Not really.

They were only like 10% OTM when I bought them, which on that batshit crazy stock seemed quite plausible. And wasn't too expensive cause 24h expiry.

100% loss, but overall a good play - could have paid off massively and I knew the 100% loss outcome was likely.

I also bought 20 grand worth of straight stock though....",2018-03-15
166,AcadianMan,dvt7yr8,/r/pennystocks/comments/84ol5y/whats_everyones_long_term_holds/dvt7yr8/,1,Tanks I need it lol,2018-03-15
167,wcsbackwards,dvtaync,/r/pennystocks/comments/84obrk/jbzyd_is_now_almost_400_a_share_after_postreverse/dvtaync/,1,Also curious about the answers to your questions. Etrade is showing JBZY as $0.00 in my portfolio.,2018-03-15
168,boats_n_hoess,dvtb4cl,/r/pennystocks/comments/84ol5y/whats_everyones_long_term_holds/dvtb4cl/,1,I’ve got about the same amount in this as you and for the same amount of time. All we can do is pray. ,2018-03-15
169,ForAnarchy,dvtbk9d,/r/pennystocks/comments/84nlvn/checkout_sgrp_flying_under_the_radar_at_159/dvtbk9d/,1,Not enough people point that out. I’m sure the hundreds of millions that Pandora is pulling in revenue looks great if you neglect ant expenses.,2018-03-15
170,life256,dvtbn91,/r/pennystocks/comments/84ol5y/whats_everyones_long_term_holds/dvtbn91/,1,"For the sake of your boats and hoes. 

I hope so too. ",2018-03-15
171,palidon,dvtc072,/r/pennystocks/comments/84obrk/jbzyd_is_now_almost_400_a_share_after_postreverse/dvtc072/,1,"It'll transfer and show as jbzyd, it's up too, at least for me :)",2018-03-15
172,MissLisaDi,dvtdvod,/r/pennystocks/comments/84obrk/jbzyd_is_now_almost_400_a_share_after_postreverse/dvtdvod/,1,"yes, me too. i’m so confused. i bought 3000 shared at $0.0165. am i losing money here?",2018-03-15
173,Fakefat,dvtjtb7,/r/pennystocks/comments/84obrk/jbzyd_is_now_almost_400_a_share_after_postreverse/dvtjtb7/,1,"You will now have 30 shares... today it closed at $2.97 pps. Everything should switch over here real soon, if it hasn’t already. ",2018-03-15
174,SHlTBOX,dvtlhe8,/r/pennystocks/comments/84nuku/tnke_showing_out/dvtlhe8/,1,Anyone going back in? I’m tempted at ~002,2018-03-15
175,JulyOf98,dvtnid9,/r/pennystocks/comments/84ol5y/whats_everyones_long_term_holds/dvtnid9/,1,Why summer? You think they'll finally have a partnership by then that'll definitely take us all to the moon!,2018-03-15
176,MyCatDorito,dvtpqae,/r/pennystocks/comments/84ol5y/whats_everyones_long_term_holds/dvtpqae/,1,Because we're all going to buy as many shares as we can and sell them for like $40 this summer. ,2018-03-15
177,WuTangFinancial3636,dvts0b3,/r/pennystocks/comments/84oq13/how_do_i_get_into_this/dvts0b3/,1,"Stock Wars on the iPhone App Store, it’s cheesy but allows you to gain an understanding of price movements.",2018-03-15
178,WonkyWombat321,dvu1mvc,/r/pennystocks/comments/84ol5y/whats_everyones_long_term_holds/dvu1mvc/,1,$UCPA - because reasons. If you can find a way to hate this stock give up investing today.,2018-03-15
179,JakeWasAlreadyTaken,dvu1ygr,/r/pennystocks/comments/84j5ab/what_are_some_penny_stocks_that_are_just_taking/dvu1ygr/,1,"Not true. Just two days ago, DXR moved up 30% and consolidated before it moved up to 160% up.

Keep an eye out on the top movers of the day and you’ll find good trading opportunities.",2018-03-15
180,LWTTRADING,dvu6mrz,/r/pennystocks/comments/84ol5y/whats_everyones_long_term_holds/dvu6mrz/,1,I totally agree with that the fact of finding a good pennystock with good SEC fillings is very very hard... Best one i see recently (not really a penny stock) is GVSC - They hold alot of assets with dropbox and spotify who both have IPO's coming up so this should run but wont hold more than a week weeks at best,2018-03-15
181,queenslandbananas,dvud042,/r/pennystocks/comments/84j5ab/what_are_some_penny_stocks_that_are_just_taking/dvud042/,1,"That's nice. Do you care to list all the times something moved up only to collapse the next day (or even the next hour?) Otherwise you are just extrapolating from a sample size of 1, which is really quite a dumb thing to do.",2018-03-15
182,[deleted],dvujitw,/r/pennystocks/comments/84j5ab/what_are_some_penny_stocks_that_are_just_taking/dvujitw/,1,[deleted],2018-03-15
183,queenslandbananas,dvujrcd,/r/pennystocks/comments/84j5ab/what_are_some_penny_stocks_that_are_just_taking/dvujrcd/,0,"&gt; Actually, DXR moved 60% up one day and closed 90% up the next. 



&gt; And since you asked, here’s a list of tickers that moved up one day and either kept going the next or consolidated.

That's *exactly* what I wasn't asking for. I'm sorry that you're having trouble understanding my quite simple point. Finding a list of data points that confirms a hypothesis without looking for data points that disconfirm said hypothesis is awful methodology.

To break it down even more simply so that there's a chance you might understand, why don't you try and assemble a list of tickers that moved up and then *weren't* able to sustain the move. Until you try to do that,  your list of data points has no meaning whatsoever.

",2018-03-15
184,[deleted],dvukbp6,/r/pennystocks/comments/84j5ab/what_are_some_penny_stocks_that_are_just_taking/dvukbp6/,1,[deleted],2018-03-15
185,queenslandbananas,dvumfy6,/r/pennystocks/comments/84j5ab/what_are_some_penny_stocks_that_are_just_taking/dvumfy6/,0,"&gt; And I’m giving you all of those tickers because with all of them, even if you bought after a major spike, you would still have made a lot of money, as much as 3.5x your principal.

Why aren't you also listing the ones that, after a major spike, don't do up further, and so that you wouldn't make money on, or that you would even lose money on? Do you really think that such stocks don't exist? Do you think you have the ability ahead of time to know the difference?  (Hint: you don't.) If so, how?
",2018-03-15
186,[deleted],dvunklg,/r/pennystocks/comments/84j5ab/what_are_some_penny_stocks_that_are_just_taking/dvunklg/,1,[deleted],2018-03-15
187,queenslandbananas,dvunrqk,/r/pennystocks/comments/84j5ab/what_are_some_penny_stocks_that_are_just_taking/dvunrqk/,1,"&gt; Learn how to read a chart and buy them once they break over yesterday’s highs or important resistance on high volume, and use a stop loss.

Have you done a careful study to see if this statistical hypothesis is actually correct? I bet you haven't. I have. 

I'm sorry that you're struggling with your feelings over all this. Let me assure you that I have no interest in looking at your past comments to dig up something irrelevant. I care much less about you than you seem to care about me.",2018-03-15
188,DudelyMore,dvw5h3o,/r/pennystocks/comments/84ol5y/whats_everyones_long_term_holds/dvw5h3o/,1,"Learned your lesson. Always take the money. Leave some in to hold a position, sure, but ALWAYS claim big gains on risky low/microcap stocks.",2018-03-15
189,DudelyMore,dvw5k3q,/r/pennystocks/comments/84obrk/jbzyd_is_now_almost_400_a_share_after_postreverse/dvw5k3q/,1,Fidelity is quarantining JBZY temporarily because it doesn't want to risk giving the other brokerage accounts herpes.,2018-03-15
190,turnip5000,dvwb2xb,/r/pennystocks/comments/84ol5y/whats_everyones_long_term_holds/dvwb2xb/,1,"Indeed I did. I was sure when it was at $1.42, that if I sold, it would inevitably go to $1.50 the next day! LOL",2018-03-15
191,DudelyMore,dvwf601,/r/pennystocks/comments/84ol5y/whats_everyones_long_term_holds/dvwf601/,1,"I've lost out on 1000% gains before because I didn't sell my PT. Watched it hit, go higher, then give it all up. Never again.",2018-03-15
192,TheBigBarnOwl,dvx3lvq,/r/pennystocks/comments/84p26k/bvtk_ecrypt_one_patent_rejected_final_rejection/dvx3lvq/,1,tell that to $RKDA,2018-03-15
193,TheBigBarnOwl,dvx3mvr,/r/pennystocks/comments/84p26k/bvtk_ecrypt_one_patent_rejected_final_rejection/dvx3mvr/,1,until they rs,2018-03-15
194,WonkyWombat321,dvx91bl,/r/pennystocks/comments/84nlvn/checkout_sgrp_flying_under_the_radar_at_159/dvx91bl/,1,"Also following that, stock price =/= market cap. Drives me nuts when someone tells me a stock is undervalued because it's only trading at X. Or worse they compare the stock price of two companies as if that's a relevant metric.",2018-03-15
195,SenTedStevens,dvywwnc,/r/pennystocks/comments/84ol5y/whats_everyones_long_term_holds/dvywwnc/,1,Here's hoping. I bought this stock at $1.90 and have been hemorrhaging money ever since. ,2018-03-15
196,InspirationalQuoter,dvzpi54,/r/pennystocks/comments/84ol5y/whats_everyones_long_term_holds/dvzpi54/,1,Well it paid off! What’s your strategy this week? Are you holding long for a buyout/partnership? I wonder how the day will go; I’m feeling the fomo and want to buy more but know I shouldn’t buy more. ,2018-03-15
197,skeemon,dvzrb5r,/r/pennystocks/comments/84ol5y/whats_everyones_long_term_holds/dvzrb5r/,1,I'm holding 100%. Not even going to chance dumping and reloading. The better the results the higher chance of a partnership/buyout and that's what I'm here for! And these results are great! ,2018-03-15
198,Anderjesse,dw2yyxe,/r/pennystocks/comments/84ltt5/alberta_partial_upgrading_bshv/dw2yyxe/,1,Unfortunately the oil industry is part of the second industrial revolution and we are unable to sustain our environment and economy this using this crude(pun inteneddd ) source of energy. Dead end my man. Green is the future,2018-03-15
199,ManWithManyTalents,dxiwvhm,/r/pennystocks/comments/84ol5y/whats_everyones_long_term_holds/dxiwvhm/,1,You still holding this?,2018-03-15
200,ManWithManyTalents,dxixabc,/r/pennystocks/comments/84ol5y/whats_everyones_long_term_holds/dxixabc/,1,Should I go in on this still,2018-03-15
201,life256,dxiyxtm,/r/pennystocks/comments/84ol5y/whats_everyones_long_term_holds/dxiyxtm/,1,Sure am... Looks to be a longer hold than I was expecting. I have just avg down when I can. ,2018-03-15
202,ManWithManyTalents,dxiyzrx,/r/pennystocks/comments/84ol5y/whats_everyones_long_term_holds/dxiyzrx/,1,Any other recommendations?,2018-03-15
203,life256,dxj11c5,/r/pennystocks/comments/84ol5y/whats_everyones_long_term_holds/dxj11c5/,1,$NVCN is super low right now. ,2018-03-15
