,author,id,url,score,text,date
910,MeIn2016LUL,fo5kwvs,/r/pennystocks/comments/g5rn7c/decn_pumpers/fo5kwvs/,1,"No, you should love pumpers and become one yourself 😁",2020-04-22
911,MeIn2016LUL,fo5kz1z,/r/pennystocks/comments/g5rn7c/decn_pumpers/fo5kz1z/,1,That's the spirit.,2020-04-22
912,HazyCreature,fo5kzds,/r/pennystocks/comments/g5tvtk/options_trading_beginner/fo5kzds/,1,Check out r/robinhoodyachtclub questions like this are what we do,2020-04-22
913,HazyCreature,fo5l0y1,/r/pennystocks/comments/g5tvtk/options_trading_beginner/fo5l0y1/,2,Appreciate the shoutout 👍,2020-04-22
914,matt_ks,fo5l2ao,/r/pennystocks/comments/g5t75u/ysk_ptd_pattern_day_trader_only_applies_to_margin/fo5l2ao/,1,You would need a significant cash account because it takes a few days for a trade to settle. So your money is technically tied up till it settles a few days later.,2020-04-22
915,saxomophone25,fo5lb3w,/r/pennystocks/comments/g5u5rl/5000_into_raytheon/fo5lb3w/,3,"I don’t know Exxon Mobil, especially with the cheap price in oil rn...",2020-04-22
916,elky74,fo5luy0,/r/pennystocks/comments/g5stsf/what_is_your_acceptable_profit_percentage/fo5luy0/,2,"There is a Trailing stop limit as well. At least on ToS there is. I’ve also found I can use the advanced orders feature to group one or two different sell orders automatically to a buy order. In other words I can place a stop limit buy for xyz at $10, limit at $12. If the order is filled, It triggers a profit stop at $15, or a stop loss at $9. Whichever comes first.

I am very new to this though, and I’m still trying to find my strategy. Good luck!",2020-04-22
917,SwimmingJunky,fo5m2pa,/r/pennystocks/comments/g5u5rl/5000_into_raytheon/fo5m2pa/,1,"Exxon's not going away anytime soon.  And oil being cheap means you can scoop up shares for cheap.  Oil's not gonna stay cheap for long.  So if you're planning on holding long, oil being cheap right now shouldn't matter.",2020-04-22
918,richasalannister,fo5m6j4,/r/pennystocks/comments/g5thvi/simple_question_on_buying_and_selling_stocks/fo5m6j4/,1,Who do you use that doesn't charge? I was using ally ans eye hit with that charge. I'm already up enough that I'll still make money but if I can find a place that doesn't charge me it would be ideal,2020-04-22
919,School_IT_Hero,fo5m7g7,/r/pennystocks/comments/g5tvtk/options_trading_beginner/fo5m7g7/,2,Shit i appreciate the knowledge!! what i learned might feed my family someday so thanks,2020-04-22
920,Stockleezy,fo5m9it,/r/pennystocks/comments/g5u5rl/5000_into_raytheon/fo5m9it/,1,"Rtx is new ticker they just did a split.

I'm in 50 shares at 50 each",2020-04-22
921,sliight,fo5mir4,/r/pennystocks/comments/g5t75u/ysk_ptd_pattern_day_trader_only_applies_to_margin/fo5mir4/,2,"True, but it lets you sell on trade 4 vs holding overnight. Plus having your entire short trading account invested is fairly dangerous, unless of course just using spare funds to gamble...",2020-04-22
922,[deleted],fo5mkll,/r/pennystocks/comments/g5tej1/pctl/fo5mkll/,1,[removed],2020-04-22
923,JohnnyLakefront,fo5mlj2,/r/pennystocks/comments/g5rn7c/decn_pumpers/fo5mlj2/,1,because they fucked something up....,2020-04-22
924,got_some_tegridy,fo5mlnc,/r/pennystocks/comments/g5thvi/simple_question_on_buying_and_selling_stocks/fo5mlnc/,1,"Please keep in mind this is 5 trading days, not business days. I'm pretty new, and I thought I was able to day trade one day because it was the 5th business day, however the Friday before was Good Friday... So I bought some shares, went to sell at $120 profit then was forced to hold and watch it drop until -$230.... All part of the learning.",2020-04-22
925,mickmoon,fo5mo36,/r/pennystocks/comments/g5tjzx/mbrx_hold_or_sell/fo5mo36/,2,Hold with a stop loss at .95 if it turns the other way. looks bullish and due for a move up,2020-04-22
926,Demosama,fo5nbbq,/r/pennystocks/comments/g5t2no/first_patient_to_recover_from_covid19_by_using/fo5nbbq/,3,I think there are many people recovering from the disease already. The tricky part is how to treat the elderly and people with preexisting conditions.,2020-04-22
927,MaRrDuKzAyA,fo5nc1j,/r/pennystocks/comments/g5tej1/pctl/fo5nc1j/,3,Fidelity is the way to go..,2020-04-22
928,2020vw69,fo5njbw,/r/pennystocks/comments/g5t75u/ysk_ptd_pattern_day_trader_only_applies_to_margin/fo5njbw/,1,"This can end up leading to a good faith violation right? Say you make one day trade, but another security and sell it before funds settle, assuming you do t have cash to cover both transactions.",2020-04-22
929,allisonthepants,fo5npwj,/r/pennystocks/comments/g5tej1/pctl/fo5npwj/,1,If they do I'm not familiar with it,2020-04-22
930,t4nader,fo5nqy5,/r/pennystocks/comments/g5t2no/first_patient_to_recover_from_covid19_by_using/fo5nqy5/,2,Another good point I heard today is they need to find a way to provide a “counter measure” for those that have been working the front lines. I.e. doctors and nurses. It wasn’t referred to as a vaccine not sure how they worded it.,2020-04-22
931,WeirReady,fo5o7qd,/r/pennystocks/comments/g5s19x/denbury_dnr/fo5o7qd/,1,"Joshyuaa - Anything else you actually know about about REI? also while i'm at it, any other good plays?",2020-04-22
932,lukestarlord1,fo5ocwi,/r/pennystocks/comments/g5stsf/what_is_your_acceptable_profit_percentage/fo5ocwi/,1,Moon only,2020-04-22
933,Kyism,fo5oinh,/r/pennystocks/comments/g5tej1/pctl/fo5oinh/,-2,You sound like a cons-man trying to sell me something. There is no money in this stock. Atleast not any in the short term. Who wants to hold onto a pennystock for a year+ to make 50%-100% gains in profit when you can make that in a day on the right pennystock,2020-04-22
934,allisonthepants,fo5oqo7,/r/pennystocks/comments/g5tej1/pctl/fo5oqo7/,5,"Imo if you do just a little research you'll see the potential yourself.  I've made 60% profit so far.  I have nothing to gain, just letting people know about a stock i believe in",2020-04-22
935,luisv23,fo5p1mj,/r/pennystocks/comments/g5u5rl/5000_into_raytheon/fo5p1mj/,1,Love that stock!!!!,2020-04-22
936,RemindMeBot,fo5pmhe,/r/pennystocks/comments/g5t2no/first_patient_to_recover_from_covid19_by_using/fo5pmhe/,2,"I will be messaging you in 23 hours on [**2020-04-23 03:58:06 UTC**](http://www.wolframalpha.com/input/?i=2020-04-23%2003:58:06%20UTC%20To%20Local%20Time) to remind you of [**this link**](https://np.reddit.com/r/pennystocks/comments/g5t2no/first_patient_to_recover_from_covid19_by_using/fo5ki3o/?context=3)

[**1 OTHERS CLICKED THIS LINK**](https://np.reddit.com/message/compose/?to=RemindMeBot&amp;subject=Reminder&amp;message=%5Bhttps%3A%2F%2Fwww.reddit.com%2Fr%2Fpennystocks%2Fcomments%2Fg5t2no%2Ffirst_patient_to_recover_from_covid19_by_using%2Ffo5ki3o%2F%5D%0A%0ARemindMe%21%202020-04-23%2003%3A58%3A06%20UTC) to send a PM to also be reminded and to reduce spam.

^(Parent commenter can ) [^(delete this message to hide from others.)](https://np.reddit.com/message/compose/?to=RemindMeBot&amp;subject=Delete%20Comment&amp;message=Delete%21%20g5t2no)

*****

|[^(Info)](https://np.reddit.com/r/RemindMeBot/comments/e1bko7/remindmebot_info_v21/)|[^(Custom)](https://np.reddit.com/message/compose/?to=RemindMeBot&amp;subject=Reminder&amp;message=%5BLink%20or%20message%20inside%20square%20brackets%5D%0A%0ARemindMe%21%20Time%20period%20here)|[^(Your Reminders)](https://np.reddit.com/message/compose/?to=RemindMeBot&amp;subject=List%20Of%20Reminders&amp;message=MyReminders%21)|[^(Feedback)](https://np.reddit.com/message/compose/?to=Watchful1&amp;subject=RemindMeBot%20Feedback)|
|-|-|-|-|",2020-04-22
937,ShortLeftEye,fo5q3r5,/r/pennystocks/comments/g5tej1/pctl/fo5q3r5/,1,😂,2020-04-22
938,DidYouReadThatThing,fo5q4yd,/r/pennystocks/comments/g5t75u/ysk_ptd_pattern_day_trader_only_applies_to_margin/fo5q4yd/,1,If you’re trading regular stocks it’s T+2 so a sell on monday is ready to spend Wednesday.,2020-04-22
939,DidYouReadThatThing,fo5q8o8,/r/pennystocks/comments/g5t75u/ysk_ptd_pattern_day_trader_only_applies_to_margin/fo5q8o8/,1,If you go to balances you’ll see “settled funds to trade”,2020-04-22
940,MaRrDuKzAyA,fo5qp1p,/r/pennystocks/comments/g5umq6/where_can_i_buy_this_stock/fo5qp1p/,1,Fidelity has it. I’m sure TD Ameritrade and Schwab do too. Fidelity is pretty awesome though. No commission trades too! Just search RZREF.,2020-04-22
941,BotchJobb,fo5qxcc,/r/pennystocks/comments/g5thvi/simple_question_on_buying_and_selling_stocks/fo5qxcc/,1,He said Schwab above,2020-04-22
942,Kyism,fo5rw5l,/r/pennystocks/comments/g5tej1/pctl/fo5rw5l/,1,im probably gonna invest in it,2020-04-22
943,Kyism,fo5s8zv,/r/pennystocks/comments/g5rn7c/decn_pumpers/fo5s8zv/,1,lol this nerd wants all the lambos for himself like all DECN bashers,2020-04-22
944,MMNA6,fo5sqrh,/r/pennystocks/comments/g5tvtk/options_trading_beginner/fo5sqrh/,1,"https://youtu.be/SD7sw0bf1ms

Watch this. Pause and take notes. Trust me, it’s all you’ll need.",2020-04-22
945,Dhegxkeicfns,fo5txzw,/r/pennystocks/comments/g5t2no/first_patient_to_recover_from_covid19_by_using/fo5txzw/,1,"Indeed, a study found something like 4% of a random sample who weren't supposed to be infected had antibodies already.

The acute cases, specifically with pneumonia, are the ones that need help, and they need it to work quickly.

There are a number of trials happening right now. 

I'm following $CYDY, they treat with some sort of antibodies delivered by inhaler. They're already up from that news like a week ago so now it's a gamble on how effective the treatment is.",2020-04-22
946,EazyPeazyLemonSqueaz,fo5u1no,/r/pennystocks/comments/g5t2no/first_patient_to_recover_from_covid19_by_using/fo5u1no/,1,"Definitely not a vaccine, this is a treatment or possible cure",2020-04-22
947,sebask8s,fo5u63f,/r/pennystocks/comments/g5rq8i/ston/fo5u63f/,1,Pretty sure it’s Getting Delisted.,2020-04-22
948,Cerebral_Degenerate,fo5vl7v,/r/pennystocks/comments/g5rq8i/ston/fo5vl7v/,1,They have 6 months to return to $1.00 per share to regain compliance. Doesn’t affect any business and everything else is in compliance. Business is tough right now because many people can’t even have funerals for loved ones. In the summer when lockdowns relax I have a feeling things will spike for them with people having services to make up for ones they weren’t able to hold during previous months,2020-04-22
949,PupPop,fo5x3tg,/r/pennystocks/comments/g5stsf/what_is_your_acceptable_profit_percentage/fo5x3tg/,1,To me a trailing stop limit seems objectively better.,2020-04-22
950,JuiceNJ,fo5ysyl,/r/pennystocks/comments/g5s19x/denbury_dnr/fo5ysyl/,1,I’ll still prob buy a couple shares. u never kno,2020-04-22
951,cruzbmx,fo62pfq,/r/pennystocks/comments/g5t2no/first_patient_to_recover_from_covid19_by_using/fo62pfq/,1,RemindMe! 5 hours,2020-04-22
952,Breadwinner562,fo68pio,/r/pennystocks/comments/g5ykbd/what_stock_are_you_guys_buying/fo68pio/,1,$BOOB,2020-04-22
953,PrecipitousKites,fo69sog,/r/pennystocks/comments/g5ykbd/what_stock_are_you_guys_buying/fo69sog/,1,Every comment in this thread is going to be someone trying to pump their stocks. Take it with a grain of salt,2020-04-22
954,whalemoot,fo6a8wv,/r/pennystocks/comments/g5tej1/pctl/fo6a8wv/,1,"Well. I guess they do have a sign on the door. 

https://www.google.com/maps/place/4235+Commerce+St,+Little+River,+SC+29566/@33.859997,-78.6612304,3a,19.9y,49.44h,90.68t/data=!3m7!1e1!3m5!1sKBoq9YwPsvzfQS0ofAboHw!2e0!6s%2F%2Fgeo0.ggpht.com%2Fcbk%3Fpanoid%3DKBoq9YwPsvzfQS0ofAboHw%26output%3Dthumbnail%26cb_client%3Dsearch.gws-prod.gps%26thumb%3D2%26w%3D86%26h%3D86%26yaw%3D71.938324%26pitch%3D0%26thumbfov%3D100!7i13312!8i6656!4m5!3m4!1s0x89007d86424e8791:0x167216855d3e5bc5!8m2!3d33.8601121!4d-78.6609102",2020-04-22
955,donaldsenpai,fo6ag30,/r/pennystocks/comments/g5t2no/first_patient_to_recover_from_covid19_by_using/fo6ag30/,1,Are you guys buying ADMA?,2020-04-22
956,pitystonks,fo6ajdu,/r/pennystocks/comments/g5ykbd/what_stock_are_you_guys_buying/fo6ajdu/,1,It all depends on your plans I tried to swing trade that away if something does pop up I can burn a few day trades on it.,2020-04-22
957,Semper_Rejecto,fo6bhug,/r/pennystocks/comments/g5rs7g/bbrw_obv_1_month_chart/fo6bhug/,1,"You are comparing two different companies. There is the pet supply business one which has all the troubles. And BrewBilt that has all the assets. BrewBilt acquired the pet supply company, reuplisted to the OTC under a new ticker name and is in the process of off loading the pet supply business.

&amp;#x200B;

BrewBilt has product and income. They have orders and money coming in. They also have a very low float which even if the diluted with 100,000,000 more shares the stock should be trading at $0.18 a share. 

&amp;#x200B;

Time and time again people don't read enough and are quick to spread untruths and misrepresentations.

&amp;#x200B;

Why do I even bother?",2020-04-22
958,pathrowaway555,fo6bsoz,/r/pennystocks/comments/g5ykbd/what_stock_are_you_guys_buying/fo6bsoz/,1,This^^^ but also buy DECN,2020-04-22
959,callumb314,fo6bxoh,/r/pennystocks/comments/g5t2no/first_patient_to_recover_from_covid19_by_using/fo6bxoh/,1,People have been recovering. How do we know it was the plasma therapy that influenced the recovery?,2020-04-22
960,chrysler82000,fo6c1hv,/r/pennystocks/comments/g5rn7c/decn_pumpers/fo6c1hv/,1,with all the hype it's impossible to not make a few bucks here. Timing is everything. I got my sell in at .6 Gonna take my $$ and get the hell out,2020-04-22
961,BuyHexoShares,fo6cbuc,/r/pennystocks/comments/g5ykbd/what_stock_are_you_guys_buying/fo6cbuc/,1,ATE antibe therapeutics. Results for phase 2b imminent,2020-04-22
962,Arniescc,fo6cqyw,/r/pennystocks/comments/g5rn7c/decn_pumpers/fo6cqyw/,1,"There is supposed to be an announcement Thursday,maybe we will know then. I have a lot of this stock and believe they have potential.",2020-04-22
963,Cloudxixpuff,fo6dgpg,/r/pennystocks/comments/g5zb2j/nby_hold_or_sell/fo6dgpg/,1,I'm new to this but I feel like it will pop the next time it gets good PR.  Idk though,2020-04-22
964,morad_,fo6drio,/r/pennystocks/comments/g5umq6/where_can_i_buy_this_stock/fo6drio/,1,You can start off with a free stock,2020-04-22
965,Shellhead_Reddit,fo6e9hx,/r/pennystocks/comments/g5t2no/first_patient_to_recover_from_covid19_by_using/fo6e9hx/,1,Remindme! 8 hours,2020-04-22
966,[deleted],fo6eiad,/r/pennystocks/comments/g5ykbd/what_stock_are_you_guys_buying/fo6eiad/,1,[removed],2020-04-22
967,Aborder19,fo6erj1,/r/pennystocks/comments/g5tjzx/mbrx_hold_or_sell/fo6erj1/,1,"Possibly too late but it looks like they're investing a bit more into the covid19 situation, even bringing in head of NIAID to their development team. I personally bought too high and am stuck riding it out a bit but best of luck to everyone else.

https://finance.yahoo.com/news/moleculin-announces-head-niaid-antiviral-113000421.html",2020-04-22
968,[deleted],fo6fg5y,/r/pennystocks/comments/g5tej1/pctl/fo6fg5y/,1,[removed],2020-04-22
969,t4nader,fo6fk1i,/r/pennystocks/comments/g5t2no/first_patient_to_recover_from_covid19_by_using/fo6fk1i/,1,Ya I know I wasn’t referring to the first comment or question just adding what I heard.,2020-04-22
970,Cloudxixpuff,fo6fmhs,/r/pennystocks/comments/g5u5rl/5000_into_raytheon/fo6fmhs/,1,If I had money I'd put it into Raytheon.,2020-04-22
971,Ansiroth,fo6fncd,/r/pennystocks/comments/g5xynv/vxrt_3_day_run/fo6fncd/,1,I been playing VXRT for a while. Making good tendies. I think it has a shot at rising decently or even drastically short term.,2020-04-22
972,ZAYN91,fo6fzeo,/r/pennystocks/comments/g5zb2j/nby_hold_or_sell/fo6fzeo/,1,"If you’re trading, get out, take your loss, &amp; use it as a learning lesson. Entry &amp; exit points are important to assess in your trading plan. Instead of waiting weeks, months, or years for $NBY to recover, you sell &amp; use this money to trade other stocks, learn, &amp; grow your account. 

If you’re investing, review their charts, fundamentals, financial statements, balance sheets, guidance for upcoming quarter, expected news to determine if you should hold $NBY for the long term.",2020-04-22
973,alfalfa1985,fo6ggad,/r/pennystocks/comments/g5zb2j/nby_hold_or_sell/fo6ggad/,1,Hold. It's slowly going up rn.,2020-04-22
974,ZAYN91,fo6gnrh,/r/pennystocks/comments/g5tjzx/mbrx_hold_or_sell/fo6gnrh/,1,"It’s up pre market today. If you’re trading, sell it for a smaller loss &amp; move on",2020-04-22
975,[deleted],fo6hn71,/r/pennystocks/comments/g5t2no/first_patient_to_recover_from_covid19_by_using/fo6hn71/,1,[removed],2020-04-22
976,mydogeatstoomuch,fo6i4hk,/r/pennystocks/comments/g5zt2e/reminder_that_decns_test_will_be_a_finger_prick/fo6i4hk/,1,Any reason why the ticker symbol does not show up on Robinhood?,2020-04-22
977,IHaveRedSocks,fo6i6f1,/r/pennystocks/comments/g5zt2e/reminder_that_decns_test_will_be_a_finger_prick/fo6i6f1/,1,They don’t do pinks,2020-04-22
978,mydogeatstoomuch,fo6i9bh,/r/pennystocks/comments/g5zt2e/reminder_that_decns_test_will_be_a_finger_prick/fo6i9bh/,1,Ahh ok. Thank you,2020-04-22
979,morad_,fo6it76,/r/pennystocks/comments/g60i1g/any_oil_stocks_i_really_need_to_keep_an_eye_on/fo6it76/,1,Pnfx,2020-04-22
980,morad_,fo6ivqm,/r/pennystocks/comments/g60i1g/any_oil_stocks_i_really_need_to_keep_an_eye_on/fo6ivqm/,1,Join the discord it’s free https://discord.gg/R697UQ,2020-04-22
981,BatangPasawaylol,fo6iykl,/r/pennystocks/comments/g60i1g/any_oil_stocks_i_really_need_to_keep_an_eye_on/fo6iykl/,1,Could not find it,2020-04-22
982,Fukitright,fo6jdf9,/r/pennystocks/comments/g5qyqp/question_about_charles_schwab_please/fo6jdf9/,1,Well. Learned something new,2020-04-22
983,Stuxnet15,fo6jnrp,/r/pennystocks/comments/g5zt2e/reminder_that_decns_test_will_be_a_finger_prick/fo6jnrp/,1,Fuck. That.,2020-04-22
984,CivicGuyRob,fo6jo5j,/r/pennystocks/comments/g5u5rl/5000_into_raytheon/fo6jo5j/,1,Royal Dutch Shell has excellent financials as well.,2020-04-22
985,boolonprime,fo6kc19,/r/pennystocks/comments/g5u5rl/5000_into_raytheon/fo6kc19/,1,GREAT BUY THEY ALWAYS HAVE GOOD MILITARY CONTRCTS COMING IN,2020-04-22
986,whiterhinoqueef,fo6kohn,/r/pennystocks/comments/g5t75u/ysk_ptd_pattern_day_trader_only_applies_to_margin/fo6kohn/,1,Ah I see that now. I’ve just been looking at the Cash in positions. Thanks,2020-04-22
987,justusingredditUSA,fo6l83n,/r/pennystocks/comments/g5zt2e/reminder_that_decns_test_will_be_a_finger_prick/fo6l83n/,1,Don’t think that’s how it’s done. From what my fiancé told me. It’s exactly how they do a flu test. And well... blood ain’t supposed to come out Chief.,2020-04-22
988,Intermittent_Fisting,fo6lr6v,/r/pennystocks/comments/g5zt2e/reminder_that_decns_test_will_be_a_finger_prick/fo6lr6v/,1,Hmm.. stock stopped at .2425 yesterday.. Bids are already at .2530 before open... I was hoping for a dip.. doesn't look like it's going to happen..,2020-04-22
989,MeIn2016LUL,fo6lvu6,/r/pennystocks/comments/g5rn7c/decn_pumpers/fo6lvu6/,1,It depends on when you got in. I still think these levels($0.20-$0.30) are high priced and it can plummet down very quickly.,2020-04-22
990,jorgenvonstrangle420,fo6m3pd,/r/pennystocks/comments/g5t2no/first_patient_to_recover_from_covid19_by_using/fo6m3pd/,1,You guys wanna buy MDMA?,2020-04-22
991,alexesver,fo6muis,/r/pennystocks/comments/g5zt2e/reminder_that_decns_test_will_be_a_finger_prick/fo6muis/,1,Yeah I was gonna sell some and buy a dip but we may not go down much today.,2020-04-22
992,BuzzyShizzle,fo6mvrm,/r/pennystocks/comments/g5zt2e/reminder_that_decns_test_will_be_a_finger_prick/fo6mvrm/,1,"There are antibody blood test for COVID test too, but it doesn't always yield a positive in early infection.",2020-04-22
993,Jeffrooow,fo6mwh4,/r/pennystocks/comments/g5tvtk/options_trading_beginner/fo6mwh4/,1,Def worth the time thanks !,2020-04-22
994,Boatsssandhoesss,fo6mx3y,/r/pennystocks/comments/g6188l/gonna_play_some_denburydnr_today/fo6mx3y/,1,Any reason why?,2020-04-22
995,throwawaybugsting,fo6myad,/r/pennystocks/comments/g5zt2e/reminder_that_decns_test_will_be_a_finger_prick/fo6myad/,1,My order is being rejected on questrade,2020-04-22
996,FrogMaxx,fo6n7yi,/r/pennystocks/comments/g61a19/current_state_of_xspa/fo6n7yi/,1,Volume is still extremely high I’m holding,2020-04-22
997,dcarr0126,fo6nb47,/r/pennystocks/comments/g5zt2e/reminder_that_decns_test_will_be_a_finger_prick/fo6nb47/,1,"As far as our tests, this is the correct way. Lots of false negatives because of improper testing. As painful as this looks (and is) this should be a good test lol.",2020-04-22
998,plaguebearer666,fo6nbdg,/r/pennystocks/comments/g5t2no/first_patient_to_recover_from_covid19_by_using/fo6nbdg/,1,The beginning of ”the vaccine”,2020-04-22
999,gottchanow,fo6ncc8,/r/pennystocks/comments/g5ykbd/what_stock_are_you_guys_buying/fo6ncc8/,1,"Aik, Tops, shmp, SGMD, scm, save, PAVM, MMTIF, KNTNF, decn, avxl, xspa,",2020-04-22
1000,plaguebearer666,fo6ndc5,/r/pennystocks/comments/g5t2no/first_patient_to_recover_from_covid19_by_using/fo6ndc5/,1,Yes. Winn-Dixie twenty minutes.,2020-04-22
1001,plaguebearer666,fo6nea0,/r/pennystocks/comments/g5t2no/first_patient_to_recover_from_covid19_by_using/fo6nea0/,1,Because bill gates said so.,2020-04-22
1002,thelegend27______,fo6nh35,/r/pennystocks/comments/g5zt2e/reminder_that_decns_test_will_be_a_finger_prick/fo6nh35/,1,Glad I grabbed more yesterday!,2020-04-22
1003,gottchanow,fo6nh7z,/r/pennystocks/comments/g5urfb/corg/fo6nh7z/,1,So in other words buy?,2020-04-22
1004,alexesver,fo6nmr9,/r/pennystocks/comments/g5zt2e/reminder_that_decns_test_will_be_a_finger_prick/fo6nmr9/,1,Good chance we go for a ride today with people loading up for tomorrows news.  I wanna try and sneak in a sell and buy on a dip but idk we may not get that today.,2020-04-22
1005,justusingredditUSA,fo6nnzw,/r/pennystocks/comments/g5zt2e/reminder_that_decns_test_will_be_a_finger_prick/fo6nnzw/,1,Y’all gotten one?,2020-04-22
1006,sanders04,fo6not9,/r/pennystocks/comments/g61a19/current_state_of_xspa/fo6not9/,1,I really wish I was able to buy when it dipped into the .40s but I missed it. I'm holding with the shares that I do have.,2020-04-22
1007,Its_me_Nick,fo6nr4u,/r/pennystocks/comments/g61de3/aytu_being_investigated_for_securities_fraud/fo6nr4u/,1,and by awesome of course I mean FML,2020-04-22
1008,BuzzyShizzle,fo6nsyv,/r/pennystocks/comments/g5zt2e/reminder_that_decns_test_will_be_a_finger_prick/fo6nsyv/,1,Test? No but I live with someone on a COVID response team in a hospital so when the cheap test start comin around probably.,2020-04-22
1009,awestonian,fo6nt6r,/r/pennystocks/comments/g61a19/current_state_of_xspa/fo6nt6r/,1,Yeah I missed it too. Oh well ig I'll be on the lookout now haha.,2020-04-22
1010,justusingredditUSA,fo6nuor,/r/pennystocks/comments/g5zt2e/reminder_that_decns_test_will_be_a_finger_prick/fo6nuor/,1,You’ve gotten this already?,2020-04-22
1011,liamchop93,fo6nwkd,/r/pennystocks/comments/g61de3/aytu_being_investigated_for_securities_fraud/fo6nwkd/,1,Now it might go up lol,2020-04-22
1012,fitzygerald19,fo6nyya,/r/pennystocks/comments/g61de3/aytu_being_investigated_for_securities_fraud/fo6nyya/,1,"I think this article ran last week, and just got reprinted again last night",2020-04-22
1013,JohnE777,fo6o1gx,/r/pennystocks/comments/g5urfb/corg/fo6o1gx/,1,I would never tell anyone to buy but I would suggest looking into it. Think a break out is coming IMO,2020-04-22
1014,dcarr0126,fo6o241,/r/pennystocks/comments/g5zt2e/reminder_that_decns_test_will_be_a_finger_prick/fo6o241/,1,"I have not, no symptoms, no reason, but have performed many.",2020-04-22
1015,Its_me_Nick,fo6o3bj,/r/pennystocks/comments/g61de3/aytu_being_investigated_for_securities_fraud/fo6o3bj/,1,Oh that’s fun! So they’re just gonna re-run it every now and then to try and kill any positive momentum? Lol,2020-04-22
1016,thelegend27______,fo6o4bz,/r/pennystocks/comments/g5zt2e/reminder_that_decns_test_will_be_a_finger_prick/fo6o4bz/,1,"Definitely, I wanna try and lock in a little profit just in case",2020-04-22
1017,benchieepenchie,fo6o5bw,/r/pennystocks/comments/g5ykbd/what_stock_are_you_guys_buying/fo6o5bw/,1,"I just bought HAPP and left AGEN. 

Mark my words:
AGEN will go to the moon and HAPP will go bankrupt",2020-04-22
1018,alexesver,fo6o6ee,/r/pennystocks/comments/g5zt2e/reminder_that_decns_test_will_be_a_finger_prick/fo6o6ee/,1,If it hits 34-36 I may go ahead and pull,2020-04-22
1019,jordan5968,fo6o7p1,/r/pennystocks/comments/g6188l/gonna_play_some_denburydnr_today/fo6o7p1/,1,what made u buy,2020-04-22
1020,DonJuan_69,fo6o8y9,/r/pennystocks/comments/g61e8v/so_how_exactly_is_every_fucking_oil_company_up/fo6o8y9/,1,People want cash money bby,2020-04-22
1021,gottchanow,fo6ob47,/r/pennystocks/comments/g61de3/aytu_being_investigated_for_securities_fraud/fo6ob47/,1,Frankly glad I took my losses on this and got out. All the news about this company gives me anxiety,2020-04-22
1022,Noexit007,fo6odie,/r/pennystocks/comments/g61de3/aytu_being_investigated_for_securities_fraud/fo6odie/,1,This news came out mid last week I think. Or its a 2nd investigation. EIther way if you were not out of AYTU by the end of last week... ouch.,2020-04-22
1023,gottchanow,fo6odjm,/r/pennystocks/comments/g61a19/current_state_of_xspa/fo6odjm/,1,I'm holding.,2020-04-22
1024,gottchanow,fo6og62,/r/pennystocks/comments/g612xv/cocp_penny_pharma_stock_you_should_put_on_your/fo6og62/,1,Seems to be holding steady at 1.13,2020-04-22
1025,aliiirsss,fo6oggx,/r/pennystocks/comments/g60i1g/any_oil_stocks_i_really_need_to_keep_an_eye_on/fo6oggx/,1,Kos,2020-04-22
1026,thelegend27______,fo6ohqt,/r/pennystocks/comments/g5zt2e/reminder_that_decns_test_will_be_a_finger_prick/fo6ohqt/,1,"Likewise, ill probably keep a good bit for tomorrow too",2020-04-22
1027,ConfidentMorning9,fo6ohs8,/r/pennystocks/comments/g61a19/current_state_of_xspa/fo6ohs8/,1,going down as well as aytu.  might get lucky and get another PR pump or two before they fade into obscurity,2020-04-22
