,author,id,url,score,text,date
0,[deleted],dz0ehk7,/r/pennystocks/comments/8jiv5h/top_marijuana_stocks_51418/dz0ehk7/,1,[removed],2018-05-15
1,JulyOf98,dz0hgo6,/r/pennystocks/comments/8jlesu/ubqu_hemplife_today_to_expand_into_multibillion/dz0hgo6/,1,"Do you think it'll pop off anytime soon though, volume is almost non-existent at the moment and seems to be a floater stock.",2018-05-15
2,Hold_onto_yer_butts,dz0oepi,/r/pennystocks/comments/8jleq3/vet_online_supply_9m_2018_projections/dz0oepi/,1,[https://i.imgur.com/D4qZBiW.png](https://i.imgur.com/D4qZBiW.png?1),2018-05-15
3,vakavaka,dz0p6pd,/r/pennystocks/comments/8jleq3/vet_online_supply_9m_2018_projections/dz0p6pd/,1,Man I rode them for a while but after all the DD I think it’s just a dude working out of his shed diluting for cash.,2018-05-15
4,Hold_onto_yer_butts,dz0ubio,/r/pennystocks/comments/8jleq3/vet_online_supply_9m_2018_projections/dz0ubio/,1,"&gt;after all the DD

Care to share?",2018-05-15
5,Derp2638,dz0vrkh,/r/pennystocks/comments/8jmso3/4_hot_penny_stocks_that_could_see_outsized_gains/dz0vrkh/,1,"Their Tuesday morning play is very interesting. However, that store strictly relies on location based.  ",2018-05-15
6,beerruns,dz0wt5f,/r/pennystocks/comments/8jnaat/adac_announces_it_is_obtaining_as9100/dz0wt5f/,1, http://www.globenewswire.com/news-release/2018/05/15/1503705/0/en/Adama-Technologies-Announces-Plan-to-Pursue-Contracts-With-Boeing-Lockheed-Martin-and-Parker-Hannifin.html,2018-05-15
7,Flash_ina_pan,dz0yo15,/r/pennystocks/comments/8jleq3/vet_online_supply_9m_2018_projections/dz0yo15/,1,"Like a quarter super glued to the floor, the bagholding is strong on this one.",2018-05-15
8,McLurkleton,dz102oq,/r/pennystocks/comments/8jleq3/vet_online_supply_9m_2018_projections/dz102oq/,1,"I looked up the [corporate headquarters address](https://goo.gl/maps/C7AK7x17zyQ2) that was listed on Etrade, looks like a rural address with a shed next to a double wide trailer.",2018-05-15
9,_huntah,dz114l0,/r/pennystocks/comments/8jnqau/may_15_2018_tomorrows_daily_rpennystocks/dz114l0/,1,Well bought back into $TGGI and held $EQLB. Let’s just say it’s not going well. ,2018-05-15
10,Magickarploco,dz13j02,/r/pennystocks/comments/8jleq3/vet_online_supply_9m_2018_projections/dz13j02/,1,Spot on assessment.,2018-05-15
11,edgelordkys,dz15rf3,/r/pennystocks/comments/8jnqau/may_15_2018_tomorrows_daily_rpennystocks/dz15rf3/,1,yeah what the hell is up (or should i say down) with $TGGI??,2018-05-15
12,_huntah,dz16zhv,/r/pennystocks/comments/8jnqau/may_15_2018_tomorrows_daily_rpennystocks/dz16zhv/,1, I was glad to be out of it then I saw all the hype and got back in. Hopefully it comes through. ,2018-05-15
13,3sgte_sw20,dz1b19b,/r/pennystocks/comments/8jnqau/may_15_2018_tomorrows_daily_rpennystocks/dz1b19b/,1,Yeah.... keeping a close eye on TGGI.... My account is bleeding cash at the moment. ,2018-05-15
14,personable_finance,dz1m769,/r/pennystocks/comments/8jp6o1/possible_akers_buyout/dz1m769/,1,terrible article,2018-05-15
15,Luffykyle,dz1utzr,/r/pennystocks/comments/8jp6o1/possible_akers_buyout/dz1utzr/,1,You’re a 3rd rate redditor with a Fourth rate comment. ,2018-05-15
16,personable_finance,dz1v5tq,/r/pennystocks/comments/8jp6o1/possible_akers_buyout/dz1v5tq/,1,settle down there champ. sorry if that was your article. shoulda put more metrics into it.,2018-05-15
17,shrance84,dz1zmo6,/r/pennystocks/comments/8jnqau/may_15_2018_tomorrows_daily_rpennystocks/dz1zmo6/,1,I still have faith and I’m down $500.  We should see another run. ,2018-05-15
18,Mudruck1,dz244zs,/r/pennystocks/comments/8jnqau/may_15_2018_tomorrows_daily_rpennystocks/dz244zs/,1,"IAN ianthus, like this one a lot. ",2018-05-15
19,sisev,dz27l8a,/r/pennystocks/comments/8jnqau/may_15_2018_tomorrows_daily_rpennystocks/dz27l8a/,1,SANP looking to take off,2018-05-15
20,houseflip,dz2es9w,/r/pennystocks/comments/8jp6o1/possible_akers_buyout/dz2es9w/,1,"anyone can write a blog post titled ""who will buy xxxxx"" \- this means nothing in reality.",2018-05-15
21,olivertwist225,dz2hfha,/r/pennystocks/comments/8jnqau/may_15_2018_tomorrows_daily_rpennystocks/dz2hfha/,1,Good pick. Or MPX.,2018-05-15
22,olivertwist225,dz2hge9,/r/pennystocks/comments/8jnqau/may_15_2018_tomorrows_daily_rpennystocks/dz2hge9/,1,I feel sorry for you guys buying into the hype. ,2018-05-15
23,shrance84,dz2o15n,/r/pennystocks/comments/8jnqau/may_15_2018_tomorrows_daily_rpennystocks/dz2o15n/,1,A lot of times that hype makes me money.   Sometimes t doesn’t.  ,2018-05-15
24,olivertwist225,dz2oflj,/r/pennystocks/comments/8jnqau/may_15_2018_tomorrows_daily_rpennystocks/dz2oflj/,1,True. Doesn't look like the case this time. Just a few weeks ago a buddy was hyping up LRGR. 500% gains and tanked hard the day I was trying to make a move. Glad I didn't. ,2018-05-15
25,swolltoots,dz2w7j0,/r/pennystocks/comments/8jp6o1/possible_akers_buyout/dz2w7j0/,1,^tl;dr This site isn’t one to put faith in and I’m kind of a dick.,2018-05-15
26,swolltoots,dz2w9j0,/r/pennystocks/comments/8jp6o1/possible_akers_buyout/dz2w9j0/,1,^tl;dr This site isn’t one to put faith in and I’m kind of a dick.,2018-05-15
27,Senecany,dz325u2,/r/pennystocks/comments/8jleq3/vet_online_supply_9m_2018_projections/dz325u2/,1,So short the stock?,2018-05-15
28,shrance84,dz349ge,/r/pennystocks/comments/8jnqau/may_15_2018_tomorrows_daily_rpennystocks/dz349ge/,1,"I finally got at .0005 for a loss of $500.   Fortunately, SAFS which was my last hype play, woke up today.  I put a lot in SAFS when they went pink and have been waiting since. 10,000,000 shares and holding. ",2018-05-15
29,McLurkleton,dz362ad,/r/pennystocks/comments/8jleq3/vet_online_supply_9m_2018_projections/dz362ad/,1,It's currently at $0.0012 so not much downside.,2018-05-15
30,Senecany,dz36rt1,/r/pennystocks/comments/8jleq3/vet_online_supply_9m_2018_projections/dz36rt1/,1,DAMN it has really tanked since the last pump,2018-05-15
