,author,id,url,score,text,date
0,6n1ck9,emsoial,/r/pennystocks/comments/blziez/watchlist_58/emsoial/,1,"Do penny stock investors care at all about what the companies are offering, the value and disruption of their respective products/services?  Or is it just about being hopeful and lucky?",2019-05-08
1,HomelesToast,emsom1m,/r/pennystocks/comments/blziez/watchlist_58/emsom1m/,1,"Generally look for a few things, volume, rsi, percent change, and news pushing the stock up or down",2019-05-08
2,cbreunig1,emsszrd,/r/pennystocks/comments/blziez/watchlist_58/emsszrd/,1,Yes,2019-05-08
3,yeah-me-too-,emsta2a,/r/pennystocks/comments/bm0asu/geecf_can_anyone_explain_the_sudden_boom/emsta2a/,1,Pump and dump,2019-05-08
4,6n1ck9,emstn8y,/r/pennystocks/comments/blziez/watchlist_58/emstn8y/,1,I KNEW IT!,2019-05-08
5,CrossDamon,emsvoz7,/r/pennystocks/comments/bm0asu/geecf_can_anyone_explain_the_sudden_boom/emsvoz7/,1,"On May 3rd volume increase as the s/s was updated and there is a good reason. The key is in the subsidiaries of GEECF. The main one is Sahara Petroleum which GEECF owns 85% this company. 

Corporate profile on otcmarkets.com 

Global Environmental Energy Corp., is a fully integrated energy company operating through its subsidiaries Sahara Petroleum Exploration Corp., and Biosphere Development Corp. Sahara Petroleum Exploration Corp., is an independent oil and gas company whose interests include traditional oil and gas exploration, refining and production. 

Current s/s updated on otcmarkets.com 

As of May 3 2019

Market Cap 
660,704 

Authorized Shares 
500,000,000 

Outstanding Shares 
471,931,618 

Restricted 
268,420,832 

Unrestricted 
203,510,786 

Held at DTC 
134,327,432 

Float 
Not Available 

This is what is going on with Sahara Petroleum. Sahara Petroleum just received the equivalent of $4.1 million U.S. dollars from a defamation suit against the company. This judgement was settled in Sahara's favor December 10, 2018!",2019-05-08
6,techhacker100,emsxxde,/r/pennystocks/comments/bm0asu/geecf_can_anyone_explain_the_sudden_boom/emsxxde/,1,This means even more blue skys from here right,2019-05-08
7,Keebsstock,emsy8gu,/r/pennystocks/comments/bm0rkt/watchlist_58/emsy8gu/,1,"You short selling, or are you expecting these to raise in value?",2019-05-08
8,market_notify,emsz53f,/r/pennystocks/comments/blziez/watchlist_58/emsz53f/,1,These are not investments - they are trading vehicles. Typically penny stocks are filled with dilution and have no revenue.,2019-05-08
9,mfrumen,emt6d5s,/r/pennystocks/comments/bm22b3/may_7th_gluu_18_down/emt6d5s/,1,Not really a penny stock. But if I were you I'd just hold. From the articles I've read it still seems like gluu is a pretty cheap stock and its just over reaction.,2019-05-08
10,that_black_dude94,emt8pq6,/r/pennystocks/comments/bm22b3/may_7th_gluu_18_down/emt8pq6/,1,Keep it. Some game will come out and make it shoot up sooner or later.,2019-05-08
11,jerbear102,emtc1dh,/r/pennystocks/comments/bm0asu/geecf_can_anyone_explain_the_sudden_boom/emtc1dh/,1,Found an article discussing GEECF: [https://pennystocks.com/featured/2019/05/06/can-i-buy-these-penny-stocks-on-robinhood-2-are-up-over-1000/](https://pennystocks.com/featured/2019/05/06/can-i-buy-these-penny-stocks-on-robinhood-2-are-up-over-1000/),2019-05-08
12,jordanjbarta,emtnq2d,/r/pennystocks/comments/bm4frh/bemg_thoughts/emtnq2d/,1,"IMO, yes. Ticker change and uplist to OTCQB.
I think we can easily run past $.20.",2019-05-08
13,thrift365,emtotwc,/r/pennystocks/comments/bm0asu/geecf_can_anyone_explain_the_sudden_boom/emtotwc/,1,"Some idiots confused(knowingly?) Sahara Petroleum Exploration Corp(a defunct POS subsidiary of GEECF) with Sahara Group(a multi-national billion dollar company). 

Basically the only thing in common was the word Sahara, absolutely no connection between the two companies.",2019-05-08
14,jacquelynspitta,emtoywg,/r/pennystocks/comments/bm4frh/bemg_thoughts/emtoywg/,1,I think so too I’m buying,2019-05-08
15,thrift365,emtp09v,/r/pennystocks/comments/bm0asu/geecf_can_anyone_explain_the_sudden_boom/emtp09v/,1,"That’s Sahara Group, Sahara Petroleum is a POS defunct subsidiary that hasn’t made a peep in over 10 years.

Sahara Petroleum Exploration Corp:

https://www.bloomberg.com/research/stocks/private/snapshot.asp?privcapid=21853931

Sahara Group:

https://www.bloomberg.com/research/stocks/private/snapshot.asp?privcapid=261041851


Quit spreading the BS, this thing is done.",2019-05-08
16,Slydew,emtp2qk,/r/pennystocks/comments/bm4frh/bemg_thoughts/emtp2qk/,1,"I'm in on a small position. 20k shares at .064. 

I think there's potential in the business and it seems to be turning decent revenue. That being said. Writing stuff online to look good is as easy as creating an email list. So ultimately who knows. 

Trust in your own DD, everything's a gamble, as there is always a chance for the unknown to happen.",2019-05-08
17,cac21,emtpby7,/r/pennystocks/comments/bm22b3/may_7th_gluu_18_down/emtpby7/,1,Double down pussy,2019-05-08
18,crypto_tradez,emtqi7t,/r/pennystocks/comments/bm4frh/bemg_thoughts/emtqi7t/,1,"The CEO responded to shareholder saying their S1 will be filed within 30 days... in other words, they will be uplisting. So, May and June this stock should be trading over .50, easy. Heard it here first",2019-05-08
19,jarred_tok,emtrhvm,/r/pennystocks/comments/bm4frh/bemg_thoughts/emtrhvm/,1,"Its rare you get a stock like this on the OTC. I think within 2 years, they will be on NASDAQ - not kidding.",2019-05-08
20,techhacker100,emtsrtq,/r/pennystocks/comments/bm5112/psiq_to_acquire_80_of_ecoland_including_multiple/emtsrtq/,1,This is huge...,2019-05-08
21,freshbalk2,emtt2c5,/r/pennystocks/comments/bm4frh/bemg_thoughts/emtt2c5/,1,I like their subsidiary’s,2019-05-08
22,freshbalk2,emtt553,/r/pennystocks/comments/bm4frh/bemg_thoughts/emtt553/,1,I don’t know if it’s rare but I do like it,2019-05-08
23,whatsmyname17,emtu3st,/r/pennystocks/comments/bm5112/psiq_to_acquire_80_of_ecoland_including_multiple/emtu3st/,1,"Seems very interesting. I have never messed around with penny stocks so I am unfamiliar. Once the acquisition is complete, what do you think the stock would rise too? Just trying to get a feel for how penny stocks would fluctuate and what their potential ceiling would be in a situation like this. 

Is it uncommon to see a cheap penny stock like this hit $3.00? Thanks in advance",2019-05-08
24,usalakerssuns,emtu6hx,/r/pennystocks/comments/bm4frh/bemg_thoughts/emtu6hx/,1,Where do you buy BEMG?,2019-05-08
25,couchtomatopotato,emtuha9,/r/pennystocks/comments/bm3l01/ucso_breaking_news/emtuha9/,1,"hmmm, not as big as they seem to think...",2019-05-08
26,techhacker100,emtuig5,/r/pennystocks/comments/bm5112/psiq_to_acquire_80_of_ecoland_including_multiple/emtuig5/,1,The last time I've seen something like this was with $IGNG. It went up 700% in one day...,2019-05-08
27,jordanjbarta,emtv2c7,/r/pennystocks/comments/bm5j0b/bemg_ceo_just_confirmed_finra_ticker_change_and/emtv2c7/,1,Yes! Big news,2019-05-08
28,[deleted],emtv9bb,/r/pennystocks/comments/bm4frh/bemg_thoughts/emtv9bb/,1,[removed],2019-05-08
29,Prometheus013,emtvc69,/r/pennystocks/comments/bm4frh/bemg_thoughts/emtvc69/,1,Tried buying yesterday can't on my TFSA account with quest trade,2019-05-08
30,jordanjbarta,emtviq1,/r/pennystocks/comments/bm5iet/bemg/emtviq1/,1,People are taking profit. Happens all day everyday on every stock.,2019-05-08
31,BullsNation__21,emtvlqt,/r/pennystocks/comments/bm4frh/bemg_thoughts/emtvlqt/,1,I use etrades platform,2019-05-08
32,PlutoPatata,emtw020,/r/pennystocks/comments/bm51d5/otc_watchlist_58/emtw020/,1,$PDPR going to pop,2019-05-08
33,whatsmyname17,emtwsio,/r/pennystocks/comments/bm5112/psiq_to_acquire_80_of_ecoland_including_multiple/emtwsio/,1,So would it be wise to buy 100 shares of this stock with a $5 commission or at that rate should you buy more?,2019-05-08
34,derbs361,emtwt1q,/r/pennystocks/comments/bm5nfo/kgkg_hope_you_all_listened/emtwt1q/,1,I have to say that I bought on your suggestion and I have not been disappointed... this thing is going places imo,2019-05-08
35,MakeAgrabahGreatAgan,emtx850,/r/pennystocks/comments/bm5j0b/bemg_ceo_just_confirmed_finra_ticker_change_and/emtx850/,1,Noice,2019-05-08
36,indeedItIsI,emtyadr,/r/pennystocks/comments/bm4frh/bemg_thoughts/emtyadr/,1,I bought on fidelity,2019-05-08
37,dcstockjvm,emtzt33,/r/pennystocks/comments/bm5nfo/kgkg_hope_you_all_listened/emtzt33/,1,That’s awesome man. Good luck to us!,2019-05-08
38,kenmlin,emu0rxr,/r/pennystocks/comments/bm22b3/may_7th_gluu_18_down/emu0rxr/,1,I thought Zynga was the best way to go.,2019-05-08
39,PPCCNNSS,emu1xrm,/r/pennystocks/comments/bm5nfo/kgkg_hope_you_all_listened/emu1xrm/,1,"$5! Really! 52 wk low .0072, 52 wk high .14. It's on the high side right now and no catalyst. You sure your not just trying to dump your shares on anyone.",2019-05-08
40,powerrob_,emu28fj,/r/pennystocks/comments/bm5112/psiq_to_acquire_80_of_ecoland_including_multiple/emu28fj/,1,I sold off some Honeywell stock to purchase. Lets ride.,2019-05-08
41,monclerman,emu2u2m,/r/pennystocks/comments/bm5112/psiq_to_acquire_80_of_ecoland_including_multiple/emu2u2m/,1,Honestly traders beware... this just had a massive selloff that sent the stock down -25% in one day. It takes a beating constantly and has all the characteristics of a pump and dump scam. I held this for a while and watched it flounder on fake news. Be cautious,2019-05-08
42,wanderlei_new_nose,emu2z3k,/r/pennystocks/comments/bm5nfo/kgkg_hope_you_all_listened/emu2z3k/,1,When is the next earnings report on KGKG?,2019-05-08
43,dcstockjvm,emu30xo,/r/pennystocks/comments/bm5nfo/kgkg_hope_you_all_listened/emu30xo/,1,I have money and all the time in the world. 3-5 years my friend. I don’t sell for beer money.,2019-05-08
44,dcstockjvm,emu34ob,/r/pennystocks/comments/bm5nfo/kgkg_hope_you_all_listened/emu34ob/,1,Probably Friday if it goes with release history.,2019-05-08
45,PPCCNNSS,emu3jx9,/r/pennystocks/comments/bm5nfo/kgkg_hope_you_all_listened/emu3jx9/,1,"Good for you, that doesn't change the facts.  This post is BS. ""$5""! Amazing that yours annoying it again at its high point.",2019-05-08
46,Dallas2143,emu45n4,/r/pennystocks/comments/bm5nfo/kgkg_hope_you_all_listened/emu45n4/,1,"Should have bought when it was .07. I’m wary of pumpers but this thing is moving.

What’s a good price to get in at? What makes you so confident they will keep growing and not fall apart like many penny stocks",2019-05-08
47,oinkoinkacab,emu4h44,/r/pennystocks/comments/bm5nfo/kgkg_hope_you_all_listened/emu4h44/,1,"$5 ain’t gonna happen, I’d be able to quit my job if it did, but it won’t because in 3-5 years monster and red bull will be selling their own cbd energy drinks and no one will remember kgkg",2019-05-08
48,dcstockjvm,emu4hqn,/r/pennystocks/comments/bm5nfo/kgkg_hope_you_all_listened/emu4hqn/,1,There will be pullback. I would wait for the dip to be honest. I would say get in around .10. Just being honest. But who knows.,2019-05-08
49,dcstockjvm,emu4uu0,/r/pennystocks/comments/bm5nfo/kgkg_hope_you_all_listened/emu4uu0/,1,"Just took a screenshot. Let’s reevaluate this in 3-5 years. I was told SHMP was too high when it was at .10 by people like you but went on to .90s and made $300K. I’ll keep living with my BS and money, lmao.",2019-05-08
50,PPCCNNSS,emu54il,/r/pennystocks/comments/bm5nfo/kgkg_hope_you_all_listened/emu54il/,1,Are you dumb? This isn't about SHMP. Stick to the facts.,2019-05-08
51,dcstockjvm,emu5ith,/r/pennystocks/comments/bm5nfo/kgkg_hope_you_all_listened/emu5ith/,1,Jealousy is not a good look bro.,2019-05-08
52,TimmyTurnerTuTurntUp,emu5jx9,/r/pennystocks/comments/bm6ehu/marijuana_sector_impact_from_china_trade_deal/emu5jx9/,1,Will take a look thanks,2019-05-08
53,himynameiscolin,emu5xw5,/r/pennystocks/comments/bm5j0b/bemg_ceo_just_confirmed_finra_ticker_change_and/emu5xw5/,1,"What is the source for this?

I spent an hour researching this company last night and couldn’t find any reliable source for info other than their own Twitter &amp; their own press releases. News about an uplist has been floating around on Reddit for a solid year. Same with the Lyft/Uber partnership. And yet not a single reliable source has covered it. 

Most of the Reddit users pumping BEMG have post histories that are almost exclusively dedicated to that one stock.

This sounds like textbook pump &amp; dump BS to me. Convince me otherwise.",2019-05-08
54,PPCCNNSS,emu620l,/r/pennystocks/comments/bm5nfo/kgkg_hope_you_all_listened/emu620l/,1,"Lol, the only one trying to justify them self is you. Why would I be jealous of a person such as yourself.  What don't I be just like you and lie to people so I can make .01 on a stock when I'm making so much more? Jealous? Lol, your a joke. Is you Real name Tim by the way?",2019-05-08
55,wanderlei_new_nose,emu68t9,/r/pennystocks/comments/bm5nfo/kgkg_hope_you_all_listened/emu68t9/,1,I really hope they talk about how much they are selling on amazon. That will be a big indicator,2019-05-08
56,dcstockjvm,emu6qta,/r/pennystocks/comments/bm5nfo/kgkg_hope_you_all_listened/emu6qta/,1,I don’t have to justify myself.. all people have to do is look at my post history on this board.  Speaks for itself. No need to lie. Enjoy making your $5-10 gains today bud. Wasted enough time on you.,2019-05-08
57,dcstockjvm,emu7br8,/r/pennystocks/comments/bm5nfo/kgkg_hope_you_all_listened/emu7br8/,1,I’m thinking a big deal is in the works.,2019-05-08
58,PPCCNNSS,emu7hsy,/r/pennystocks/comments/bm5nfo/kgkg_hope_you_all_listened/emu7hsy/,1,"So you stated: you have money, done this for 3-5 years, made money on SHMP, and don't have to justify yourself after you done so. Your a joke.",2019-05-08
59,LAVISHSAV4GE,emu7kxy,/r/pennystocks/comments/bm5nfo/kgkg_hope_you_all_listened/emu7kxy/,1,I’m sure I’m gonna kick myself after not buying this just like I did with $SHMP after your heads up. But I feel I’m too late with the already 100% gains in the past week in $KGKG,2019-05-08
60,dcstockjvm,emu7r7y,/r/pennystocks/comments/bm5nfo/kgkg_hope_you_all_listened/emu7r7y/,1,3-5 years of holding KGKG.  Reading is fundamental.  Of course KGKG is not going to $5 now. You lack common sense.,2019-05-08
61,NAMRAmusica,emu7r97,/r/pennystocks/comments/bm5nfo/kgkg_hope_you_all_listened/emu7r97/,1,Looking quite overbought at $.13....need some consistent support build there before we could even have a conversation above $.50/share.,2019-05-08
62,Dumbalucky,emu7v15,/r/pennystocks/comments/bm4frh/bemg_thoughts/emu7v15/,1,Since it's OTC questrade won't let you buy it on TFSA or RRSP. You need to use your margin account. I'm waiting for mine to activate so that I can buy in some before the IPO.,2019-05-08
63,PearlyBakerBest,emu7ycb,/r/pennystocks/comments/bm6nq3/kgkg/emu7ycb/,1,"do you own or just observing?   
Its up almost like 50% the last 2 days",2019-05-08
64,PPCCNNSS,emu7z0v,/r/pennystocks/comments/bm5nfo/kgkg_hope_you_all_listened/emu7z0v/,1,Or your post just doesn't matter,2019-05-08
65,dcstockjvm,emu815q,/r/pennystocks/comments/bm5nfo/kgkg_hope_you_all_listened/emu815q/,1,"I agree with you, pullback is coming.",2019-05-08
66,dcstockjvm,emu8599,/r/pennystocks/comments/bm5nfo/kgkg_hope_you_all_listened/emu8599/,1,"Wait for the pullback.. I think, but you never know. Once it pulls back. Get in. This is a long time winner.",2019-05-08
67,Mister2JZ-GTE,emu863e,/r/pennystocks/comments/bm5j0b/bemg_ceo_just_confirmed_finra_ticker_change_and/emu863e/,1,You DYOR.  Nice for not buying this pump and dump.,2019-05-08
68,wanderlei_new_nose,emu880s,/r/pennystocks/comments/bm5nfo/kgkg_hope_you_all_listened/emu880s/,1,Gut feeling or anything you can share why?,2019-05-08
69,dcstockjvm,emu8hd4,/r/pennystocks/comments/bm5nfo/kgkg_hope_you_all_listened/emu8hd4/,1,"Whatever floats your boat bud, just trying to make some money and help others as well.",2019-05-08
70,dcstockjvm,emu8oks,/r/pennystocks/comments/bm5nfo/kgkg_hope_you_all_listened/emu8oks/,1,Just on the shareholder group some of the distributors keep saying things are in the works. Company cut shares down to build confidence for major players.  They are almost national and getting attention. 85% gut. Just being honest.,2019-05-08
71,tpschroering,emu8uvk,/r/pennystocks/comments/bm6nq3/kgkg/emu8uvk/,1,I own,2019-05-08
72,PPCCNNSS,emu8yfn,/r/pennystocks/comments/bm5nfo/kgkg_hope_you_all_listened/emu8yfn/,1,"You bought 425,175 shares of KGKG at .06 and now that it has doubled in price you repost it!  What a help you are, enjoy shaming people.",2019-05-08
73,dcstockjvm,emu8z6n,/r/pennystocks/comments/bm6nq3/kgkg/emu8z6n/,1,Legit OTC Company that’s for sure. Maybe a little overbought but it’s going places.,2019-05-08
74,PearlyBakerBest,emu90qn,/r/pennystocks/comments/bm6nq3/kgkg/emu90qn/,1,"nice. me too.   
I bought in at 8 cents. super new to this whole thing, but it's been fun so far. 

was thinking of selling today.",2019-05-08
75,tpschroering,emu9977,/r/pennystocks/comments/bm6nq3/kgkg/emu9977/,1,I’m gonna hold longer since I bought in at .11,2019-05-08
76,PearlyBakerBest,emu9fs9,/r/pennystocks/comments/bm6nq3/kgkg/emu9fs9/,1,"makes sense.   
I mean i dont' know much about much but it seems that the company is conducting themselves with eyes on the future.",2019-05-08
77,baconbacon666,emuclcz,/r/pennystocks/comments/bm22b3/may_7th_gluu_18_down/emuclcz/,1,"It's just 15% down today, hopefully we will see a successful recovery before the end of the month!",2019-05-08
78,baconbacon666,emucryf,/r/pennystocks/comments/bm22b3/may_7th_gluu_18_down/emucryf/,1,Improved a little today. I'm even tempted to get some more stocks.,2019-05-08
79,baconbacon666,emucw9i,/r/pennystocks/comments/bm22b3/may_7th_gluu_18_down/emucw9i/,1,"I'm not into gambling, sorry",2019-05-08
80,baconbacon666,emucwsz,/r/pennystocks/comments/bm22b3/may_7th_gluu_18_down/emucwsz/,1,WORD,2019-05-08
81,LysolButtWipe,emue4bv,/r/pennystocks/comments/bm4frh/bemg_thoughts/emue4bv/,1,"same here. Because it's a registered account, Need to use a margin account on QT",2019-05-08
82,cac21,emuebqx,/r/pennystocks/comments/bm22b3/may_7th_gluu_18_down/emuebqx/,1,ily,2019-05-08
83,LysolButtWipe,emufbs3,/r/pennystocks/comments/bm4frh/bemg_thoughts/emufbs3/,1,same here.,2019-05-08
84,Nico_trader,emufjrj,/r/pennystocks/comments/bm5iet/bemg/emufjrj/,1,Company responsed. Filing their S1. People who sold told will be kicking them selves! haha. funny,2019-05-08
85,Dumbalucky,emufmbo,/r/pennystocks/comments/bm4frh/bemg_thoughts/emufmbo/,1,Good thing we didn't buy yet. Stock dipped approximately 30%,2019-05-08
86,ChingChangChui,emugcl6,/r/pennystocks/comments/bm5nfo/kgkg_hope_you_all_listened/emugcl6/,1,"How did this stock go from almost $3000/share in 2011 to $.13/share as it is now?

&amp;#x200B;

Generally curious. Thanks!",2019-05-08
87,SNPowers86,emuhgk9,/r/pennystocks/comments/bm6nq3/kgkg/emuhgk9/,1,Don’t they will dump it later today tomorrow morning latest,2019-05-08
88,Dallas2143,emuiycl,/r/pennystocks/comments/bm4frh/bemg_thoughts/emuiycl/,1,Crashed hard today. Buying opportunity? Or just bull shit,2019-05-08
89,dcstockjvm,emujmr2,/r/pennystocks/comments/bm5nfo/kgkg_hope_you_all_listened/emujmr2/,1,The company bought out a previous company ticker.,2019-05-08
90,InvestedLawyer,emuk2rp,/r/pennystocks/comments/bm6nq3/kgkg/emuk2rp/,1,"I agree, I was in at .08 and got out at 14.1, expecting a dump in the next few days. I do like the company so I may buy back in when/if that happens.",2019-05-08
91,hydragyrum2,emukc8v,/r/pennystocks/comments/bm51d5/otc_watchlist_58/emukc8v/,1,"$YBIN
New discovery of updated website. Synrgycorp.com

Check the bottom where it says “for more information on Yaboo” (ybin) reverse merger in play. Just waiting on the super 8K any day now.",2019-05-08
92,dogbreath67,emukoq7,/r/pennystocks/comments/bm85fm/bemg_at_04/emukoq7/,1,"I hope so, lost a lot of money so far",2019-05-08
93,n0j0ke,emum6bn,/r/pennystocks/comments/bm85fm/bemg_at_04/emum6bn/,1,Same here man. Same here.,2019-05-08
94,sasa_spl,emummsf,/r/pennystocks/comments/bm8hpi/positions_on_bemg/emummsf/,1,I help but honestly this drop does not look good. Im okay with holding it for a few months anyways,2019-05-08
95,carribeancoffee,emumuq0,/r/pennystocks/comments/bm51d5/otc_watchlist_58/emumuq0/,1,"See this! $ABCE

[conta.cc/2HdHsI6](https://conta.cc/2HdHsI6) 

Definitely should be on your #watchlist.",2019-05-08
96,ApolloMac,emunacn,/r/pennystocks/comments/bm8hpi/positions_on_bemg/emunacn/,1,"This might be a stupid question but why does the Uber IPO matter for BEMG?  I realize they announced a partnership, I just don't understand why the Uber IPO would affect the stock price of BEMG in any way.",2019-05-08
97,nogreen4me,emuoke9,/r/pennystocks/comments/bm8hpi/positions_on_bemg/emuoke9/,1,"From my understanding, it will simply bring more attention to the company. As Uber is listed, many will do research on whether or not they will buy in on initial offering. Along the way many will pick up on the partnership with BEMG and decide to invest in the company as well. It’s a symbiotic relationship, so if Uber does well, BEMG will likely follow.

The question is if Uber does well. I’m under the impression they will. As always, DYOR.",2019-05-08
98,techhacker100,emuomkx,/r/pennystocks/comments/bm4frh/bemg_thoughts/emuomkx/,1,I might put in a limit buy order for 3 cents,2019-05-08
99,kquillen07,emuosvp,/r/pennystocks/comments/bm85fm/bemg_at_04/emuosvp/,1,same boat getting nervous,2019-05-08
100,ExarKun21,emuozx8,/r/pennystocks/comments/bm8hpi/positions_on_bemg/emuozx8/,1,"I held 67,000 shares. Waiting for Uber. Expecting to break past 0.10.",2019-05-08
101,NG06,emupkdl,/r/pennystocks/comments/bm606i/mrs_mission_ready_solutions_the_real_10x_bagger/emupkdl/,1,So what’s your future price prediction for this stock?,2019-05-08
102,jordanjbarta,emuql9p,/r/pennystocks/comments/bm85fm/bemg_at_04/emuql9p/,1,You only lose money if you sell.,2019-05-08
103,jordanjbarta,emuqmdi,/r/pennystocks/comments/bm85fm/bemg_at_04/emuqmdi/,1,Don't get nervous - All in good time.,2019-05-08
104,Edubs814,emurtef,/r/pennystocks/comments/bm94vj/wkhs/emurtef/,1,"holy shit, yea.",2019-05-08
105,ApolloMac,emustj1,/r/pennystocks/comments/bm8hpi/positions_on_bemg/emustj1/,1,"Thanks.  That's solid logic.  I'm not in on BEMG currently, but it got a lot of attention in the last 2 days, for obvious reasons.",2019-05-08
106,n0j0ke,emuttsw,/r/pennystocks/comments/bm85fm/bemg_at_04/emuttsw/,1,Facts that I live by. Though I do plan on selling some losses this year. Stocks that I have held on to for a couple of years that aren't going anywhere. Get some capital back to reinvest in other stocks. Plus get to put the losses against my gains for taxes next year.,2019-05-08
107,jmb00308986,emuuzea,/r/pennystocks/comments/bm94vj/wkhs/emuuzea/,1,"Better grab and go. Set a stop loss before it drops back off. It has gained on hype, i call it finish up of opening point, but I thinks it’s gonna pull back a little after folks grab their gains.",2019-05-08
108,dreamcar88,emuvay0,/r/pennystocks/comments/bm94vj/wkhs/emuvay0/,1,unreal stared all day at it,2019-05-08
109,HolySazed,emuvoj5,/r/pennystocks/comments/bm94vj/wkhs/emuvoj5/,1,its dropping now.,2019-05-08
110,spitfire4,emuwiuq,/r/pennystocks/comments/bm5nfo/kgkg_hope_you_all_listened/emuwiuq/,1,Good call on KGKG. How did you end up finding it? What's your screening process like?,2019-05-08
111,kquillen07,emuwl71,/r/pennystocks/comments/bm9py8/kgkg_psiq_atev_abce/emuwl71/,1,KGKG Sponsors World Champion and World Record Holder Ski Jumper Ryan Dodd,2019-05-08
112,Creativity_Rater,emux4yd,/r/pennystocks/comments/bm9py8/kgkg_psiq_atev_abce/emux4yd/,1,"I am huge on ABCE, I think it will be a good short play. S-1 is providing funding and the market cap (even when counting the conversions) compared to profit is absolutely absurd. Plus they're going to be using the new funding on something.",2019-05-08
113,Dumbalucky,emux99y,/r/pennystocks/comments/bm85fm/bemg_at_04/emux99y/,1,"I wasn't lucky enough to buy into this on Monday but now that it's back down, I hope to get in before the IPO. One man's loss is another man's gain. Funny game this is.",2019-05-08
114,Dallas2143,emuxxr5,/r/pennystocks/comments/bm85fm/bemg_at_04/emuxxr5/,1,How are they related to Uber?,2019-05-08
115,Dallas2143,emuy77a,/r/pennystocks/comments/bm5nfo/kgkg_hope_you_all_listened/emuy77a/,1,What makes you so confident they can grow and have a consistent value above 1$ a share? I’m not trying to have a mean tone but I have a hard time finding more information than fluff on them. Hard to do due diligence as a result.,2019-05-08
116,nitrouz,emuz1t7,/r/pennystocks/comments/bm606i/mrs_mission_ready_solutions_the_real_10x_bagger/emuz1t7/,1,"Think about it - if they can get 10% of the 4 Billion for the next 365 days, that's 400 million for one year. Upon expiry next March of the bridge contract, the next contract would be $33 billion split 6 ways. They're trying to figure out what will happen with ADS Tactical, hence the bridge contract for this year. ADS will get kicked out.

This is life changing money - easily $5 within 2 years.",2019-05-08
117,Creativity_Rater,emuz7u2,/r/pennystocks/comments/bm5nfo/kgkg_hope_you_all_listened/emuz7u2/,1,"I found their first energy drink in NC without looking for it, both my friend and I thought it tasted terrible (I tried it because I made a killing on the stock), and when I went back to the store the two employees there had tried it and thought the same. So its good news that it is real.. but I agree with you when you say red bull and monster can crush kgkg.",2019-05-08
