,author,id,url,score,text,date
109,queenslandbananas,e1hak8o,/r/pennystocks/comments/8un846/just_started_with_penny_stocks_what_the_hell_to_do/e1hak8o/,1,"The most important thing is not to believe a word anyone says about how company XXX is great. Pretty much all pennystocks are crap and their overall PPS trajectory is massively downwards; there is no reliable way to distinguish the 0.1% for which this is not the case, other than luck. Even the pennystocks that really sound like they have potential are almost all pure garbage. Grab profits while you can and cut losses early; if that's not the game you want to play, then stick with regular stocks. Even if it is the game you want to play bear in mind that you'll probably lose.",2018-06-28
110,queenslandbananas,e1ham8m,/r/pennystocks/comments/8un846/just_started_with_penny_stocks_what_the_hell_to_do/e1ham8m/,1,lol ,2018-06-28
111,queenslandbananas,e1hapad,/r/pennystocks/comments/8un8ut/how_do_penny_stocks_work/e1hapad/,1,Pump -&gt; dilution -&gt; reverse split -&gt; pump -&gt; dilution -&gt; reverse split -&gt; ...,2018-06-28
112,Cameltotem,e1hc9vl,/r/pennystocks/comments/8un846/just_started_with_penny_stocks_what_the_hell_to_do/e1hc9vl/,1,"Pennystocks will leave you depressed. They can go sideways for years, just pick a meme stock if you want cash fast",2018-06-28
113,CaptainWeee,e1hce0k,/r/pennystocks/comments/8un846/just_started_with_penny_stocks_what_the_hell_to_do/e1hce0k/,1,BYOC BRVRF MLTC UCRP - My plays. Do your own DD on them. I won’t say why they’re great because I’ll have a bunch of clowns claiming nonsense.,2018-06-28
114,bla2bla1bla,e1hdmj4,/r/pennystocks/comments/8un846/just_started_with_penny_stocks_what_the_hell_to_do/e1hdmj4/,1,Uh little thing to add about smaller accounts and new traiders. You will not be able to day trade starting out. Different brokers have different rules about that. So I would plan on strategies for at least a few days.,2018-06-28
115,jyangx1,e1hdvog,/r/pennystocks/comments/8un846/just_started_with_penny_stocks_what_the_hell_to_do/e1hdvog/,1,Buy gnca ,2018-06-28
116,headcampcounciler,e1heayf,/r/pennystocks/comments/8un846/just_started_with_penny_stocks_what_the_hell_to_do/e1heayf/,1,dont invest in penny stocks only trade them. Even if u buy one share of a higher priced stock itlldo better for you in the long run than those penny stocks will,2018-06-28
117,john_17824,e1hg23c,/r/pennystocks/comments/8un846/just_started_with_penny_stocks_what_the_hell_to_do/e1hg23c/,1,Could you also send me resources by any chance? i'm keen on learning the ropes :) ,2018-06-28
118,headcampcounciler,e1hg4bq,/r/pennystocks/comments/8un846/just_started_with_penny_stocks_what_the_hell_to_do/e1hg4bq/,1,"Gotchu
",2018-06-28
119,fami420,e1hhljb,/r/pennystocks/comments/8un846/just_started_with_penny_stocks_what_the_hell_to_do/e1hhljb/,1,Margin is  the devil's  tool do not ever fuck with it if your not ready to blow up your whole account  no joke ,2018-06-28
120,vytasmike,e1hicah,/r/pennystocks/comments/8un8ut/how_do_penny_stocks_work/e1hicah/,1,"Yes!!! You will be great in this market:) BTW thanks for idea for the ""How do penny stocks work vol. 2"".  This is very true with at least 70&amp;#37; of penny stocks.",2018-06-28
121,ConditionalDew,e1hisjk,/r/pennystocks/comments/8un846/just_started_with_penny_stocks_what_the_hell_to_do/e1hisjk/,1,Stop. Just buy Facebook and Amazon then hold until you retire.,2018-06-28
122,readeetsux,e1hj2pb,/r/pennystocks/comments/8un846/just_started_with_penny_stocks_what_the_hell_to_do/e1hj2pb/,1,Hey me too please.,2018-06-28
123,headcampcounciler,e1hj5ut,/r/pennystocks/comments/8un846/just_started_with_penny_stocks_what_the_hell_to_do/e1hj5ut/,1,"Link is zerodha.com/varsity

Found this today. Its made from a guy in india so the markets he trades on r diff but the way one invest is the same despite country of origin. It has lots of chspters on all the importsnt concepts. For starters id avoid options and learn tech analysis fundamentals and trading psychology. If your interested in building a correspondence im looking for people to review strats with as i make them for myself",2018-06-28
124,manasotaguy,e1hkgrv,/r/pennystocks/comments/8un846/just_started_with_penny_stocks_what_the_hell_to_do/e1hkgrv/,1,"There are some decent grabs out there, just gotta know what to look for and when to get out.
My Watchlist rn: ONTX, LHSIF, AKS, and taking a close look at ZNGA (against my better judgement).",2018-06-28
125,manasotaguy,e1hkj7p,/r/pennystocks/comments/8unma5/a_tip_u_will_be_grateful_for_it_will_make_u/e1hkj7p/,1,Really? Trying to run a pump and dump using a Reddit Penny Stock forum with such little traffic? 🙄🙄,2018-06-28
126,StephenT1520,e1hoily,/r/pennystocks/comments/8unma5/a_tip_u_will_be_grateful_for_it_will_make_u/e1hoily/,1,He's been pushing ABIO for 2 weeks. Guaranteed it would be $2.07 by end of June 🤭,2018-06-28
127,chris886,e1hot6h,/r/pennystocks/comments/8un846/just_started_with_penny_stocks_what_the_hell_to_do/e1hot6h/,1,"I think the PDT rules are pretty much the same across the board no?

You are allowed to complete three ‘day trades’, or buying/selling a stock on the same day, within any five consecutive day period. A fourth day trade in that period will have you account frozen for 90 days and you will only be allowed to sell out of existing positions. 

Some people get offshore brokerages to counter this, others get multiple accounts to increase their limit. ",2018-06-28
128,Bull_Market_Bully,e1hu2c7,/r/pennystocks/comments/8un846/just_started_with_penny_stocks_what_the_hell_to_do/e1hu2c7/,1,^This,2018-06-28
129,houseflip,e1hvv4i,/r/pennystocks/comments/8un846/just_started_with_penny_stocks_what_the_hell_to_do/e1hvv4i/,1,"i'm sorry but i must clarify your statement. any normal broker will let you daytrade with no limits on age of account or size of account. the issue begins when you use margin accounts, and begin to daytrade with under $25k. you can daytrade in a cash account 100 times if you have the cash. you can daytrade 100 times with a $1000 cash account if the trades are small enough. but as a new trader yes you should be looking at a few days or more.",2018-06-28
130,autistswan,e1hw2rl,/r/pennystocks/comments/8un846/just_started_with_penny_stocks_what_the_hell_to_do/e1hw2rl/,1,I would like resources as well please.,2018-06-28
131,houseflip,e1hw8cc,/r/pennystocks/comments/8un846/just_started_with_penny_stocks_what_the_hell_to_do/e1hw8cc/,1,"this is only margin account. a cash account will never get frozen because they won't let you spend unsettled money. and even with margin a lot of people think their account will be frozen, but many times you can simply convert your account back to a cash account and daytrade as much as you want, albeit smaller buying power.",2018-06-28
132,TJames6210,e1hwwno,/r/pennystocks/comments/8un846/just_started_with_penny_stocks_what_the_hell_to_do/e1hwwno/,1,Take your money to the casino instead. ,2018-06-28
133,BocajZeravla,e1i0cgd,/r/pennystocks/comments/8un846/just_started_with_penny_stocks_what_the_hell_to_do/e1i0cgd/,1,"me to please.
",2018-06-28
134,circlysquare25,e1i0k7u,/r/pennystocks/comments/8un846/just_started_with_penny_stocks_what_the_hell_to_do/e1i0k7u/,1,Buy CEI when the pullback plateaus,2018-06-28
135,tuenchilada,e1i17zj,/r/pennystocks/comments/8uffdv/made_60k_40_today_these_stocks_will_pump_tomorrow/e1i17zj/,1,It’s all bull. ,2018-06-28
136,chris886,e1i1gbx,/r/pennystocks/comments/8un846/just_started_with_penny_stocks_what_the_hell_to_do/e1i1gbx/,1,Hmm interesting. Didn’t know that.  I haven’t used margin but I believe you also typically can’t trade margin on OTC stocks right?  So it would likely be a non issue?,2018-06-28
137,drgreenthumbatx420,e1i1upi,/r/pennystocks/comments/8ujlst/anyone_in_on_cei/e1i1upi/,1,Goooooooood damn I'm glad I didn't let the fomo get me,2018-06-28
138,biscuiteater69,e1i1v5g,/r/pennystocks/comments/8uffdv/made_60k_40_today_these_stocks_will_pump_tomorrow/e1i1v5g/,1,"OP, check your PM",2018-06-28
139,circlysquare25,e1i1vy7,/r/pennystocks/comments/8ujlst/anyone_in_on_cei/e1i1vy7/,1,Yeah boiiii its way down good time to hop in before the bounce back,2018-06-28
140,circlysquare25,e1i1xgi,/r/pennystocks/comments/8ujlst/anyone_in_on_cei/e1i1xgi/,1,$GEVO is having a reset too it’s no penny stock but it has potential ,2018-06-28
141,woodspider,e1i2qdj,/r/pennystocks/comments/8un846/just_started_with_penny_stocks_what_the_hell_to_do/e1i2qdj/,1,Can I get those links?,2018-06-28
142,drgreenthumbatx420,e1i42mk,/r/pennystocks/comments/8ujlst/anyone_in_on_cei/e1i42mk/,1,I dunno man. Think I'll give it a few days to drop like a rock in true cei fashion lol. ,2018-06-28
143,circlysquare25,e1i4yet,/r/pennystocks/comments/8ujlst/anyone_in_on_cei/e1i4yet/,1,"Maybe I’ll sell my shares I just bought😂😂
",2018-06-28
144,iLatvian,e1i5v1u,/r/pennystocks/comments/8un846/just_started_with_penny_stocks_what_the_hell_to_do/e1i5v1u/,1,can you send me the info please,2018-06-28
145,headcampcounciler,e1i74lw,/r/pennystocks/comments/8un846/just_started_with_penny_stocks_what_the_hell_to_do/e1i74lw/,1,Read above comment its in the first link ur gonna have to type it in.,2018-06-28
146,NikoSleeps,e1i8clc,/r/pennystocks/comments/8umbcd/xiaomi_ipo/e1i8clc/,1,How does one access the Hong Kong Market? I play in the TSX and NASDAQ sandbox and haven't ever moved into another market. I looked into it online and not much info on upcoming IPOs that don't exist and how to buy shares the moment it comes out,2018-06-28
147,OmenQtx,e1ia4ha,/r/pennystocks/comments/8un8ut/how_do_penny_stocks_work/e1ia4ha/,1,"Buy high, hold forever.",2018-06-28
148,[deleted],e1ic3xa,/r/pennystocks/comments/8uffdv/made_60k_40_today_these_stocks_will_pump_tomorrow/e1ic3xa/,1,[removed],2018-06-28
149,[deleted],e1j3cre,/r/pennystocks/comments/8un846/just_started_with_penny_stocks_what_the_hell_to_do/e1j3cre/,1,[removed],2018-06-28
150,I_Be_Strokin_it,e1jghhp,/r/pennystocks/comments/8uffdv/made_60k_40_today_these_stocks_will_pump_tomorrow/e1jghhp/,1,What is your reasoning for this?,2018-06-28
151,I_Be_Strokin_it,e1jgphf,/r/pennystocks/comments/8uffdv/made_60k_40_today_these_stocks_will_pump_tomorrow/e1jgphf/,1,"3) PLG

insider info is this stock will hit 2-3 dollars within 2 months. their mines have more platinum/gold than predicted. news release comes out in a week. 


I will shit my pants if this actually happens!!! Hell, even if it gets to one dollar, I'll still shit my pants!!! Please be right, please be right, please be right!!!! Will be buying a yacht.",2018-06-28
152,ihateyourmustache,e1jqygr,/r/pennystocks/comments/8un846/just_started_with_penny_stocks_what_the_hell_to_do/e1jqygr/,1,I’m pretty sure you have 1000% chances making money trading than at the casino.,2018-06-28
153,houseflip,e1ly9o2,/r/pennystocks/comments/8ul4at/cpow_reinstatement_play/e1ly9o2/,1,your posting news from 2011.. were in 2018 son.,2018-06-28
154,1moreinch,e1m1t6p,/r/pennystocks/comments/8un846/just_started_with_penny_stocks_what_the_hell_to_do/e1m1t6p/,1, Could you also send me resources ? I really appreciate it.,2018-06-28
155,solecalibur,e1pvgwe,/r/pennystocks/comments/8un846/just_started_with_penny_stocks_what_the_hell_to_do/e1pvgwe/,1,"Mind sending me those resources?
",2018-06-28
156,mirawiel,e1qp8hz,/r/pennystocks/comments/8uffdv/made_60k_40_today_these_stocks_will_pump_tomorrow/e1qp8hz/,1,"i was wrong about this one

dont take my advice anymore. it seems the whole market is taking a shit

i lost 1-2 percent. not too much. hope yall didnt go broke taking my advice

if i find any decent picks ill let ya know. but for the most part i just trade off instinct and reading graphs propery",2018-06-28
157,I_Be_Strokin_it,e1r83oi,/r/pennystocks/comments/8uffdv/made_60k_40_today_these_stocks_will_pump_tomorrow/e1r83oi/,1,Anymore news on PLG? I loaded up with about 50k shares around 0.10.,2018-06-28
158,mirawiel,e1r8r10,/r/pennystocks/comments/8uffdv/made_60k_40_today_these_stocks_will_pump_tomorrow/e1r8r10/,1,"sell 40k for proffit . i think its at 0.11 now

keep 1000 dollars in PLG as it should slowly rise. as it rises put in slightly more.  and id slowly trade pennystocks using my strategy for now as i think that would make more money than PLG in the longrun



heres my basic strat. or use your own

as for my usual pennystock strategy. my normal plan is to find a pennystock that has made 15% + gains and seems to have high volume and strong movement in either direction. which likely means theres some kind of hype giving the stock life . then i try to identify where i think the lowest floor of the stock is. the price shouldnt drip beloe the ""floor"" usually

once i identify what i think the lowest ""floor"" is. i throw 100 dollars in when it seems to be trending up. then i wait for it to dip down. when it dips a bit down. i throw in 300 more when it seems the dip is over

then if it dips more. i wait and throw in another 300 when i think that dip is over

if i have correctly judged the ""floor"" of the stock, then the price shouldnt drop below the floor. if it dips to the floor, i put in another 300 dollars and it should climb back to my original buy point. once it gains back, i make money from all lower dips i put money into

thats my usual plan i do if i have no nice picks to work with. the main important / hard part of the method is being right when you judge where the real floor of the stock is. judge wrong and you can get screwed",2018-06-28
159,taylormade567,e1s3h8e,/r/pennystocks/comments/8uffdv/made_60k_40_today_these_stocks_will_pump_tomorrow/e1s3h8e/,1,So no more 2-3 dollars in the coming months for PLG? ,2018-06-28
160,pinetree_chopper,e1seod9,/r/pennystocks/comments/8un846/just_started_with_penny_stocks_what_the_hell_to_do/e1seod9/,1,I would also like this info. If you can need some advise. ,2018-06-28
161,mirawiel,e1sh2uy,/r/pennystocks/comments/8uffdv/made_60k_40_today_these_stocks_will_pump_tomorrow/e1sh2uy/,1,"it will pump but i dont know when

few cent increase 1day then up slowly after that

make money elsewhere until then",2018-06-28
162,headcampcounciler,e1vdc7o,/r/pennystocks/comments/8un846/just_started_with_penny_stocks_what_the_hell_to_do/e1vdc7o/,1,Sent link above,2018-06-28
163,headcampcounciler,e1vdcht,/r/pennystocks/comments/8un846/just_started_with_penny_stocks_what_the_hell_to_do/e1vdcht/,1,Linked above,2018-06-28
164,headcampcounciler,e1vdcs3,/r/pennystocks/comments/8un846/just_started_with_penny_stocks_what_the_hell_to_do/e1vdcs3/,1,Linked above,2018-06-28
165,Sfogliatella,e1xpw86,/r/pennystocks/comments/8ul4at/cpow_reinstatement_play/e1xpw86/,1,Any news on this,2018-06-28
166,B4bradley,e264vrh,/r/pennystocks/comments/8uk2jk/shmn_dd_post_current_financials_dropping_any/e264vrh/,1,Why are they still not current?,2018-06-28
167,B4bradley,e26506c,/r/pennystocks/comments/8uk88a/idgc_claims_to_have_new_management/e26506c/,1,Newbie here: what are the signs to look for right before a pump?,2018-06-28
168,Stocksnmoney2,e270al8,/r/pennystocks/comments/8uk2jk/shmn_dd_post_current_financials_dropping_any/e270al8/,1,TA never called back OTC so it was stuck in limbo. CEO called TA and got him to call and confirm with OTC. Very soon it will be up,2018-06-28
169,Gcu12,e2bbzi4,/r/pennystocks/comments/8un846/just_started_with_penny_stocks_what_the_hell_to_do/e2bbzi4/,1,"Hey, have a look at HHSE, they are one of the very few REAL pinksheet stocks. They've been in business for 23 years, no dilution for +3 year! On the verge to launch their streaming service Myflix. For more info read their blog.

[http://hannoverhousemovies.blogspot.com/](http://hannoverhousemovies.blogspot.com/)

A simple calc will show that with 100.000 subscipers to Myflix HHSE will have an intrensic value of .019!! That's \~x10 from current PPS, and 100.000 users should be within reach really fast",2018-06-28
170,blu3cap,e3msaxq,/r/pennystocks/comments/8un846/just_started_with_penny_stocks_what_the_hell_to_do/e3msaxq/,1,Send me rescources too please,2018-06-28
171,Anthonyvanvolkinburg,e3sro59,/r/pennystocks/comments/8un846/just_started_with_penny_stocks_what_the_hell_to_do/e3sro59/,1,I’ve been buying and selling APTO. Ive made pretty good money for what I have invested. I’m also starting to watch NVAX. ,2018-06-28
172,[deleted],e9jtybs,/r/pennystocks/comments/8un846/just_started_with_penny_stocks_what_the_hell_to_do/e9jtybs/,1,[removed],2018-06-28
173,[deleted],e9oq7tq,/r/pennystocks/comments/8un846/just_started_with_penny_stocks_what_the_hell_to_do/e9oq7tq/,1,[removed],2018-06-28
174,[deleted],e9qpclx,/r/pennystocks/comments/8un846/just_started_with_penny_stocks_what_the_hell_to_do/e9qpclx/,1,[removed],2018-06-28
175,[deleted],ea3nryd,/r/pennystocks/comments/8un846/just_started_with_penny_stocks_what_the_hell_to_do/ea3nryd/,1,[removed],2018-06-28
176,[deleted],eab8wb3,/r/pennystocks/comments/8un846/just_started_with_penny_stocks_what_the_hell_to_do/eab8wb3/,1,[removed],2018-06-28
177,[deleted],ead2wr9,/r/pennystocks/comments/8un846/just_started_with_penny_stocks_what_the_hell_to_do/ead2wr9/,1,[removed],2018-06-28
