,title,id,author,url,score,num_comments,text,date,link
0,Which stocks are best to buy in to during this large market drop?,ckxvhl,ziDyLaNiz,https://www.reddit.com/r/pennystocks/comments/ckxvhl/which_stocks_are_best_to_buy_in_to_during_this/,29,23,"WKHS took a big hit and will likely go back up in the next few days. REKR is also a promising stock that has fallen with the news.

What other stocks took big hits that would be good to buy in to during the drop?",2019-08-02,https://www.reddit.com/r/pennystocks/comments/ckxvhl/which_stocks_are_best_to_buy_in_to_during_this/
1,Discord group for trading Stocks and Options,ckxsk1,RealPaleontologist,https://www.reddit.com/r/pennystocks/comments/ckxsk1/discord_group_for_trading_stocks_and_options/,1,4,"Hey everyone, I created a discord group for trading recently, where we discuss and keep each other up to date with the news, filings, etc. Join us if you would like. No payment of any sort, no pump and dumps, no BS. We keep it organized, to the point and civil.   


[https://discord.gg/ZkBw9bj](https://discord.gg/ZkBw9bj)",2019-08-02,https://www.reddit.com/r/pennystocks/comments/ckxsk1/discord_group_for_trading_stocks_and_options/
2,$NAKD,ckxmfg,mcjunkidunks,https://www.reddit.com/r/pennystocks/comments/ckxmfg/nakd/,1,0,Thoughts on Naked Brand stock?,2019-08-02,https://www.reddit.com/r/pennystocks/comments/ckxmfg/nakd/
3,$MJTV-will it ever come back up? Is it worth jumping in now? Shares are .0004,ckx2vi,Mr-B3burl,https://www.reddit.com/r/pennystocks/comments/ckx2vi/mjtvwill_it_ever_come_back_up_is_it_worth_jumping/,1,0,[removed],2019-08-02,https://www.reddit.com/r/pennystocks/comments/ckx2vi/mjtvwill_it_ever_come_back_up_is_it_worth_jumping/
4,"Simple Questions - August 02, 2019",cl08m9,AutoModerator,https://www.reddit.com/r/pennystocks/comments/cl08m9/simple_questions_august_02_2019/,1,3,"This thread is for simple questions that don't warrant their own thread as well as general discussion. We strongly encourage you to check the sidebar before posting. Please feel free to engage and discuss topics with other members of the community.

**IMPORTANT: Downvotes are strongly discouraged. Sorting by ""New"" is strongly encouraged.**",2019-08-02,https://www.reddit.com/r/pennystocks/comments/cl08m9/simple_questions_august_02_2019/
5,ELI5 why would I buy a call when I could just buy the stock ? And sell when it increases in price without the risk of a time limit ?,cl023k,CobaltLives,https://www.reddit.com/r/pennystocks/comments/cl023k/eli5_why_would_i_buy_a_call_when_i_could_just_buy/,1,0,,2019-08-02,https://www.reddit.com/r/pennystocks/comments/cl023k/eli5_why_would_i_buy_a_call_when_i_could_just_buy/
6,IMTL news coming today,cl2xhg,Bubbs77,https://www.reddit.com/r/pennystocks/comments/cl2xhg/imtl_news_coming_today/,22,19,"    Morning folks, looks like today is big decision day for IMTL. The Fotofy launch news should be out any time today And we have seen accumulation anticipating this. We’ve had a nice run since first alert and now we have to decide what to hold and what to sell. I see value in a long term position but the unwritten rules of OTC say sell the news, and take profits. I’m still last minute building my strategy so I hope you guys have your own. 

     I can’t help but think of Monster energy drinks. One of the inspirations for me playing penny’s. Somewhere along the line some guys bought at .11 and sold at .30 and made a nice paycheck. A few years later it’s at 50.00. I’m sure they were happy they made money but dang look what they could have made. Haa. I think I have a little case of FOMO  :)

     Those are rare finds but I can’t help but think IMTL has some hold potential. Anyhow. Rules is rules. Watch close today and good luck to all.",2019-08-02,https://www.reddit.com/r/pennystocks/comments/cl2xhg/imtl_news_coming_today/
7,How can I take the next step forward?,cl2ipw,PopperChopper,https://www.reddit.com/r/pennystocks/comments/cl2ipw/how_can_i_take_the_next_step_forward/,4,3,"So I have set up a brokerage account. I have bought and sold some stocks. I have joined a few communities. I have made a little bit and lost quite a bit more. Basically I have fooled around with a few grand to try and get the hang of things.

I'm looking for how to take the next step. I want to learn some more technical terms. I want to learn where to find stocks that are undervalued and I want to learn how I can tell for myself that they are undervalued. I have read a couple books and a lot of articles. But I am having a hard time trying to weed out what is bullshit and what isn't. 

I don't have a big pile of cash to put into this but I have a steady stream of income to put into it. I am ok to take risk since I am investing money that I'm free to part with. I have some stocks that I plan on being long on (for example the company that I work for) but I also don't mind doing a bit of day trading with some of it. But maybe not sit and watch all day kind of day trading. 

Apologies for any ignorance. Apologies for asking a repeated question. And many thanks for anyone who can help.",2019-08-02,https://www.reddit.com/r/pennystocks/comments/cl2ipw/how_can_i_take_the_next_step_forward/
8,TTCM is up 20% this morning,cl4b6j,Boardathome,https://www.reddit.com/r/pennystocks/comments/cl4b6j/ttcm_is_up_20_this_morning/,1,0,[removed],2019-08-02,https://www.reddit.com/r/pennystocks/comments/cl4b6j/ttcm_is_up_20_this_morning/
9,OTC #Watchlist 8/2 📈🚀💰,cl4246,miamidd12,https://www.reddit.com/r/pennystocks/comments/cl4246/otc_watchlist_82/,1,1,"
$AABB $INSO $KALY $ECDP $WRFX $TRBO $ZVTK $ETKR $VRUS $QEGY $GDET $XALL $CMGO $QPRC $ARSN $NSPX $DRVD $DEVM $INKW $MGON $VCEX $VNUE $IGMB $LRDR $ASKH $REPO $AURI $MCTC $WMTM $GMNI $DLOC $TSOI $INND $HXPN $TCEL $GIFX $HZHI $ASCK

Source: https://t.me/stock_alerts",2019-08-02,https://www.reddit.com/r/pennystocks/comments/cl4246/otc_watchlist_82/
10,Undervalued Stock Picks,cl3l25,kismethavok,https://www.reddit.com/r/pennystocks/comments/cl3l25/undervalued_stock_picks/,0,5,"No guarantee of any movement today or even next week on some of these, but each of them is currently undervalued IMO for various reasons.

MTLO.v - Fear and lack of news has caused it to drop down more than it probably should have, one good PR will send it back up. Do your DD and you won't mind holding for a bit.

TRQ - I've watched this mining stock drop when reality set in, then again from the same news coming out in their Q2. Project is too big to fail and minority shareholders of TRQ are protected from RIO so they can't fuck us. 

SCYX - With the current outbreak and spread of MDR Candida Auris this stock is going to be worth a fortune. Their new treatment seems promising (quoted from CDC) with the novel approach and in vitro and in vivo treatment options it will be an indispensable asset in dealing with C. Auris.",2019-08-02,https://www.reddit.com/r/pennystocks/comments/cl3l25/undervalued_stock_picks/
11,$CBWTF has been under VALX’s thumb for the last couple hours,cl7vzk,thundrcnt-,https://www.reddit.com/r/pennystocks/comments/cl7vzk/cbwtf_has_been_under_valxs_thumb_for_the_last/,0,0,"Recent good news, guessing something else is in the PR pipeline... I’d really just like to get more than my current +5% and walk though",2019-08-02,https://www.reddit.com/r/pennystocks/comments/cl7vzk/cbwtf_has_been_under_valxs_thumb_for_the_last/
12,"August 02, 2019 Tomorrow's Daily /r/Pennystocks Discussion - What are your Friday / weekend plays?",cl7o30,AutoModerator,https://www.reddit.com/r/pennystocks/comments/cl7o30/august_02_2019_tomorrows_daily_rpennystocks/,1,3,"Please use this thread to discuss your plays of the day!

Since this thread is likely to fill up quickly, consider sorting the comments by ""new"" (instead of ""best"" or ""top"") to see the newest posts.",2019-08-02,https://www.reddit.com/r/pennystocks/comments/cl7o30/august_02_2019_tomorrows_daily_rpennystocks/
13,$DCOP is picking up volume today!,cl5nlb,BSchneids19,https://www.reddit.com/r/pennystocks/comments/cl5nlb/dcop_is_picking_up_volume_today/,1,2,Possible chance to make some quick coin if this volume keeps up.,2019-08-02,https://www.reddit.com/r/pennystocks/comments/cl5nlb/dcop_is_picking_up_volume_today/
14,Weird Market,cl5ceq,Make_America_love_,https://www.reddit.com/r/pennystocks/comments/cl5ceq/weird_market/,1,0,[removed],2019-08-02,https://www.reddit.com/r/pennystocks/comments/cl5ceq/weird_market/
15,Any one in on Gentechholdings for long term? $gteh,cl57bc,that_other_guy_,https://www.reddit.com/r/pennystocks/comments/cl57bc/any_one_in_on_gentechholdings_for_long_term_gteh/,1,1,"There a CBD company looking to be the Starbucks of CBD teas, coffees and treats. They just leased there first property and have plans underway for a second one. Trading for about .016 right now. Anyone else following/in on them?",2019-08-02,https://www.reddit.com/r/pennystocks/comments/cl57bc/any_one_in_on_gentechholdings_for_long_term_gteh/
16,"$INVU has set a shareholder webinar for August, confirming announcement to be made after closing Triton deal.",cl53bp,canuck_bux,https://www.reddit.com/r/pennystocks/comments/cl53bp/invu_has_set_a_shareholder_webinar_for_august/,1,1,"The other week, I think first week of July, they closed their deal with Triton. You got on the website, they say now a shareholder webinar will be in august. The last one they did in June, they announced their big acquisition and that they integrated one of their platforms with Telegram. 

&amp;#x200B;

Anyone have a guess to what they could be announcing this time?

&amp;#x200B;

 [https://www.otcmarkets.com/stock/INVU/news/Passion-Purpose-Progress?id=233582](https://www.otcmarkets.com/stock/INVU/news/Passion-Purpose-Progress?id=233582)",2019-08-02,https://www.reddit.com/r/pennystocks/comments/cl53bp/invu_has_set_a_shareholder_webinar_for_august/
17,thoughts?,cl9wnx,Phache-Naim,https://www.reddit.com/r/pennystocks/comments/cl9wnx/thoughts/,0,2,"So technically not a penny stock... i mean kinda above a penny stock.... maybe just a bit... or something

but i cant find other good subs for this im sorry! every other sub i look at is much more dead than this!

so looking at HTZ i think it looks like it has potential? on the charts it has a pretty consistent spiking pattern, and looks like it is headed close to support or consolidation and soon will be headed back up. for a short term investment it looks like it could provide maybe 20% returns or more. volume over the past couple days has looked nice as well. just wondering if i am missing anything.

sorry again for wrong sub, but if someone knows a active sub that touches on this more i would welcome that knowledge (subs like r/swingtrade or r/swingtrading and similar subs are very slow to respond and have low activity)",2019-08-02,https://www.reddit.com/r/pennystocks/comments/cl9wnx/thoughts/
18,APHA Stock Chart Technical Analysis 8/2/2019,clbs3l,tradewithtylernet,https://www.reddit.com/r/pennystocks/comments/clbs3l/apha_stock_chart_technical_analysis_822019/,1,0,[removed],2019-08-02,https://www.reddit.com/r/pennystocks/comments/clbs3l/apha_stock_chart_technical_analysis_822019/
19,Are These 2 Penny Stocks To Buy Or Sell For August?,clb8fq,Transparent_Traders,https://www.reddit.com/r/pennystocks/comments/clb8fq/are_these_2_penny_stocks_to_buy_or_sell_for_august/,2,8," **$CPRX $FIT** 

&amp;#x200B;

[SEE ARTICLE HERE](https://www.transparenttraders.me/2019/08/are-these-2-penny-stocks-to-buy-or-sell.html)",2019-08-02,https://www.reddit.com/r/pennystocks/comments/clb8fq/are_these_2_penny_stocks_to_buy_or_sell_for_august/
20,BCCI closed up 9.92% today,clazau,esoteric82,https://www.reddit.com/r/pennystocks/comments/clazau/bcci_closed_up_992_today/,8,7,I've been holding since February trying to recoup losses on this. For the most part it's been red virtually every day. It's suddenly up almost 10 percent on no news and low volume. Any thoughts on why this would be the case?,2019-08-02,https://www.reddit.com/r/pennystocks/comments/clazau/bcci_closed_up_992_today/
