,title,id,author,url,score,num_comments,text,date,link
66,$CLVS Short squeeze opportunity,g4u9sv,MoltenCare,https://www.reddit.com/r/pennystocks/comments/g4u9sv/clvs_short_squeeze_opportunity/,1,3,"I know this is not technically a penny stock but there is some opportunity here. 49% of shares are held by institutions. Its been on a 5 day bull trend, and 34% of shares outstanding are short! If the upwards pressure persists shorts will be forced to cover and squeeze this thing through the roof. Go check it out.

https://preview.redd.it/izk4a606lzt41.png?width=2336&amp;format=png&amp;auto=webp&amp;s=e33a96e5ae0a7b26c184df3b1688525e5922ff05",2020-04-20,https://www.reddit.com/r/pennystocks/comments/g4u9sv/clvs_short_squeeze_opportunity/
67,PCTL?! WTF,g4u51n,yesyesyesyesyesokyes,https://www.reddit.com/r/pennystocks/comments/g4u51n/pctl_wtf/,1,4,What is going onnnnn. It should be going UP!!!,2020-04-20,https://www.reddit.com/r/pennystocks/comments/g4u51n/pctl_wtf/
68,OWCP - up 91%,g4u4ue,StotiousSteak,https://www.reddit.com/r/pennystocks/comments/g4u4ue/owcp_up_91/,1,0,Been holding this since the big cannabis jump a couple years ago and I haven’t looked at it in a LONG time. Do your DD - just wanted to put it on the radar for you all.,2020-04-20,https://www.reddit.com/r/pennystocks/comments/g4u4ue/owcp_up_91/
69,OPK,g4u4c4,Patburns81,https://www.reddit.com/r/pennystocks/comments/g4u4c4/opk/,1,0,[removed],2020-04-20,https://www.reddit.com/r/pennystocks/comments/g4u4c4/opk/
70,INO,g4u2kn,JOANGC,https://www.reddit.com/r/pennystocks/comments/g4u2kn/ino/,1,5,Growing today!!  Do you know why?,2020-04-20,https://www.reddit.com/r/pennystocks/comments/g4u2kn/ino/
71,IDEX - Operations Back to Normal; Announces New EV Orders &amp; Announces Q1 2020 Earnings Call,g4tzhm,SureSpeech5,https://www.reddit.com/r/pennystocks/comments/g4tzhm/idex_operations_back_to_normal_announces_new_ev/,1,6,Anyone interested in the EV sector ?,2020-04-20,https://www.reddit.com/r/pennystocks/comments/g4tzhm/idex_operations_back_to_normal_announces_new_ev/
72,OPK on the move,g4tz8l,anton_arn,https://www.reddit.com/r/pennystocks/comments/g4tz8l/opk_on_the_move/,1,0,[removed],2020-04-20,https://www.reddit.com/r/pennystocks/comments/g4tz8l/opk_on_the_move/
73,Is there a stock quote tracker that sorts all by cheapest stocks?,g4tyq3,SEND_ME_UR_SONGS,https://www.reddit.com/r/pennystocks/comments/g4tyq3/is_there_a_stock_quote_tracker_that_sorts_all_by/,1,3,"Title. A long time ago I found a website that I've since lost which sorted a ton of stocks by price, so I could find the lowest and do research from there. Is there anything like this that y'all know about?",2020-04-20,https://www.reddit.com/r/pennystocks/comments/g4tyq3/is_there_a_stock_quote_tracker_that_sorts_all_by/
74,OVID -- Biotech riding wave of Gilead?,g4tym5,mem0ri,https://www.reddit.com/r/pennystocks/comments/g4tym5/ovid_biotech_riding_wave_of_gilead/,1,0,"New here ... not sure if OVID fully qualifies as a ""penny stock"" as it's $3.50 ... but it does have low volume, low market-cap, and is highly speculative ... so I figured this was the right place to ask. If I'm wrong -- please forgive me and go ahead and remove this post.

With Gilead Sciences (a much more well-established biotech) going up and up based on their preliminary test results of remdesivir as an effective treatment for COVID-19 ... other biotechs are moving upwards, likely by simple association with the industry.

Does anyone have an opinion on OVID and its potential strength vs risk?",2020-04-20,https://www.reddit.com/r/pennystocks/comments/g4tym5/ovid_biotech_riding_wave_of_gilead/
75,P/L Neutrality Complex,g4txg2,Knight_Aero,https://www.reddit.com/r/pennystocks/comments/g4txg2/pl_neutrality_complex/,1,0,"Don't you love getting wrecked in your first trade of the day and then making back that lost pretty much equally the very next trade, then having little or no buying power for the rest of the day so you don't really go green or red by much?...ya that's been my Monday for the past three weeks or so. I am pretty much that one meme about contemplating existence. Who else thinks about the meaning of a neutral P/L...this is a safe...ish space.",2020-04-20,https://www.reddit.com/r/pennystocks/comments/g4txg2/pl_neutrality_complex/
76,Should I buy out?,g4z37a,basketballer0502,https://www.reddit.com/r/pennystocks/comments/g4z37a/should_i_buy_out/,1,7,"Been trying to learn how to invest as well as how to ""play"" penny stocks. Not remember where I saw it but I bought XSPA 100@0.225, it's now at 0.52, I've held on to this for atleast 10 days. My commission is well covered, should I sell this now?",2020-04-20,https://www.reddit.com/r/pennystocks/comments/g4z37a/should_i_buy_out/
77,NAT is taking off with record low oil prices,g4z1bn,jschoff155,https://www.reddit.com/r/pennystocks/comments/g4z1bn/nat_is_taking_off_with_record_low_oil_prices/,1,3,,2020-04-20,https://i.redd.it/k9urzyw7u0u41.jpg
78,MVIS,g4yzzm,wastedtimepiece,https://www.reddit.com/r/pennystocks/comments/g4yzzm/mvis/,1,6,MVIS is down to a low .24 and frequently bounces to .30. Decent time to load up IMO,2020-04-20,https://www.reddit.com/r/pennystocks/comments/g4yzzm/mvis/
79,Here are your oil gems ladies and gents be cautious though any one of these can declare bankruptcy like $WLL did. Oil ETF: $DRIP Oil Stocks: $NBR $DNR $XOG $NE $OAS $RIG $CRC $MRO $SU $MPC $OXY,g4yzez,CaptainWeee,https://www.reddit.com/r/pennystocks/comments/g4yzez/here_are_your_oil_gems_ladies_and_gents_be/,0,45,Add anymore in the comments that you know of thanks! All are pennystocks except the last 3 however all are down over -80% and have 300-1000% bounce potential.,2020-04-20,https://www.reddit.com/r/pennystocks/comments/g4yzez/here_are_your_oil_gems_ladies_and_gents_be/
80,WTI Crude,g4yxmg,bingwrite,https://www.reddit.com/r/pennystocks/comments/g4yxmg/wti_crude/,1,0,WTI just dipped below $2. A 22 year low for crude oil... economy stimulation is looking rough.,2020-04-20,https://www.reddit.com/r/pennystocks/comments/g4yxmg/wti_crude/
81,Tops is mooning. Oil is negative. Tankers are a go.,g4yt2g,DjangoNinja,https://www.reddit.com/r/pennystocks/comments/g4yt2g/tops_is_mooning_oil_is_negative_tankers_are_a_go/,1,0,[removed],2020-04-20,https://www.reddit.com/r/pennystocks/comments/g4yt2g/tops_is_mooning_oil_is_negative_tankers_are_a_go/
82,Is RNET a buy or a sell?,g4yjkm,Dhwanik02,https://www.reddit.com/r/pennystocks/comments/g4yjkm/is_rnet_a_buy_or_a_sell/,1,6,Bought some at $1.12 today. What would you guys like to say?,2020-04-20,https://www.reddit.com/r/pennystocks/comments/g4yjkm/is_rnet_a_buy_or_a_sell/
83,UAVS is low and coming back up,g4y5dt,bamboojerry,https://www.reddit.com/r/pennystocks/comments/g4y5dt/uavs_is_low_and_coming_back_up/,1,4,"Landing the contract is what gave them a spike, now they’re in for some growth and it’s starting. Going for a ride",2020-04-20,https://www.reddit.com/r/pennystocks/comments/g4y5dt/uavs_is_low_and_coming_back_up/
84,XSPA,g4xzzh,TheLegend087,https://www.reddit.com/r/pennystocks/comments/g4xzzh/xspa/,1,18,"Wow!? Another surge??

Ty for the advice on this one",2020-04-20,https://www.reddit.com/r/pennystocks/comments/g4xzzh/xspa/
85,Bioc,g4xywr,scott6657,https://www.reddit.com/r/pennystocks/comments/g4xywr/bioc/,1,1,"Any thoughts, 1 more jump maybe?",2020-04-20,https://www.reddit.com/r/pennystocks/comments/g4xywr/bioc/
86,Late Afternoon Runners?,g4xymo,MadReaper1,https://www.reddit.com/r/pennystocks/comments/g4xymo/late_afternoon_runners/,1,6,MVIS is around support and has some room to jump. What are you guys looking at?,2020-04-20,https://www.reddit.com/r/pennystocks/comments/g4xymo/late_afternoon_runners/
87,"April 20, 2020 Tomorrow's Daily /r/Pennystocks Discussion - Tuesday plays!",g4xwfg,AutoModerator,https://www.reddit.com/r/pennystocks/comments/g4xwfg/april_20_2020_tomorrows_daily_rpennystocks/,1,9,"Please use this thread to discuss your plays of the day!

Since this thread is likely to fill up quickly, consider sorting the comments by ""new"" (instead of ""best"" or ""top"") to see the newest posts.",2020-04-20,https://www.reddit.com/r/pennystocks/comments/g4xwfg/april_20_2020_tomorrows_daily_rpennystocks/
88,Food Industry Stocks That Could Take Off Once Things Open Up,g4xtly,FlutGOS,https://www.reddit.com/r/pennystocks/comments/g4xtly/food_industry_stocks_that_could_take_off_once/,1,9,"I have a feeling that when things start opening up, that the restaurant industry is going to be the first to see the public's cash. The first thing that people will want to do is go out to eat. What are some of the current penny stocks that could see a spike soon after things open back up? This could be food suppliers, actual restaurants, etc.",2020-04-20,https://www.reddit.com/r/pennystocks/comments/g4xtly/food_industry_stocks_that_could_take_off_once/
89,I found a way to ‘score sectors’. I find the averages for certain stats then find if a sector is above average for that stat. Max is 18. I’m working on a way to find good stocks in each sector.,g4xtg6,DragonElder,https://www.reddit.com/r/pennystocks/comments/g4xtg6/i_found_a_way_to_score_sectors_i_find_the/,1,1,"Utilities 2 ['ROE', 'Perf Year']

Technology 12 ['Float Short', 'ROE', 'RSI', 'Gap', 'Change', 'Perf Week', 'Perf Month', 'Volatility W', 'Volatility M', 'SMA20', 'SMA50', 'SMA200']

Industrial Goods 11 ['Inst Own', 'Float Short', 'RSI', 'Gap', 'Change', 'Perf Week', 'Volatility W', 'Volatility M', 'SMA20', 'SMA50', 'SMA200']

Healthcare 13 ['P/B', 'Curr R', 'RSI', 'Gap', 'Rel Volume', 'Change', 'Perf Week', 'Perf Month', 'Perf Year', 'Volatility W', 'SMA20', 'SMA50', 'SMA200']

Financial 4 ['ROE', 'Debt/Eq', 'Perf Month', 'Volatility M']

Consumer Goods 14 ['Inst Own', 'Float Short', 'ROE', 'Debt/Eq', 'RSI', 'Gap', 'Change', 'Perf Week', 'Perf Month', 'Perf Year', 'Volatility W', 'SMA20', 'SMA50', 'SMA200']

Conglomerates 5 ['Inst Own', 'ROE', 'Curr R', 'Rel Volume', 'Perf Year']

Basic Materials 7 ['P/B', 'Inst Own', 'Float Short', 'ROE', 'Debt/Eq', 'Volatility W', 'Volatility M']

Services 9 ['Inst Own', 'Float Short', 'ROE', 'Debt/Eq', 'Gap', 'Perf Week', 'Perf Month', 'Volatility W', 'Volatility M']",2020-04-20,https://www.reddit.com/r/pennystocks/comments/g4xtg6/i_found_a_way_to_score_sectors_i_find_the/
90,AKRX,g4xs51,CashKay,https://www.reddit.com/r/pennystocks/comments/g4xs51/akrx/,1,0,[removed],2020-04-20,https://www.reddit.com/r/pennystocks/comments/g4xs51/akrx/
91,ATE (Antibe Therapeutics Inc),g4xk7d,PennyStockWorth,https://www.reddit.com/r/pennystocks/comments/g4xk7d/ate_antibe_therapeutics_inc/,1,0,[removed],2020-04-20,https://www.reddit.com/r/pennystocks/comments/g4xk7d/ate_antibe_therapeutics_inc/
92,If DECN Doesn’t Rise I’m Screwed,g4xgsw,whiterhinoqueef,https://www.reddit.com/r/pennystocks/comments/g4xgsw/if_decn_doesnt_rise_im_screwed/,1,57,I bought a lot of shares of DECN at .25 last Friday. I know the news wasn’t necessarily going to come out this weekend but I’m planning on it happening soon. I’m going to be in big trouble if it doesn’t go back up. I bought a brand new water bed this weekend without telling my wife. She hasn’t found out yet thankfully but I better have the DECN money by the time she checks the credit card statements. Has anyone ever been in this situation? What should I tell my wife if she sees the bill before DECN goes up?,2020-04-20,https://www.reddit.com/r/pennystocks/comments/g4xgsw/if_decn_doesnt_rise_im_screwed/
93,DECN - Fud or valid? Seen on DECN message board,g4xgnx,vastlywealthy,https://www.reddit.com/r/pennystocks/comments/g4xgnx/decn_fud_or_valid_seen_on_decn_message_board/,1,1,"https://academic.oup.com/cid/article/doi/10.1093/cid/ciaa149/5734265 

This paper states that hospitalised Covid 19 patients had viral loads of between 9.9x10^2 (i.e 990) and 1.2*10^8 (i.e 120million) virus particles per ml of sample. 

Now this paper - upon which the alleged DECN tech is purported to be based - using clean virus samples in pure buffer, with background subtraction correction for the electrolytes, - can detect virus particles - (Not covid ones btw) - in the range of 10^11 (a hundred billion) to 10^14 ( a hundred thousand billion ) 

https://www.ncbi.nlm.nih.gov/pmc/articles/PMC4563260/ 

I would venture to suggest that if you are hospitalised with 100million vp/ml showing up in your system, you are quite likely long since dead by the time that you have a hundred billion of the things per ml in your system. 

10^11 is stated as the theoretical lowest detection limited of the described approach. The practical lowest detection limit will likely be higher still. 

That's before you've taken into account background effects from all the other gubbins that is present in a blood sample, not to mention the fact that the publsihed paper does not even cover Covid 19 and also states : 
Although some overlap is apparent between the three clusters of data points, the graph clearly shows that it is possible to distinguish between virus types on this basis, independent of their concentrations.It should be noted, however, that this investigation was performed for only these three viruses, and it would be premature to extrapolate the results to other virus types. 


These are good Scientists and this is a great paper. But what it is NOT is a description of a product that could be used to diagnose Covid 19 in whole blood samples at the point of care setting. 

The guys in the nice labs, all the fancy equipment and the Ph.Ds were only able to find them with impedance at 1000 times the high end of the concentrations they are at in hospitalsed patients. 

DECNs glucose meter with the impedance based hematocrit correction cannot and will not detect the Corona Virus 

At least 1000 times too insensitive to work",2020-04-20,https://www.reddit.com/r/pennystocks/comments/g4xgnx/decn_fud_or_valid_seen_on_decn_message_board/
94,Xeris Pharmaceuticals. Earnings (expected) May 14.,g4xgdh,DanteFavella,https://www.reddit.com/r/pennystocks/comments/g4xgdh/xeris_pharmaceuticals_earnings_expected_may_14/,1,4,"Tried to cross post from r/RobinhoodPennyStocks

XERS all good news

[DO YOUR OWN DD. NOT FINANCIAL ADVICE. CURRENTLY TRADING AT $1.85](https://stocktwits.com/symbol/XERS) 

[4 weeks ago. Zacks upgrade. ](https://www.marketbeat.com/stocks/NASDAQ/XERS/?utm_source=404Redirect&amp;amp;amp;amp;amp;utm_medium=404Redirect)

[3 weeks ago. Makes a grant for a new employee to receive shares, during Corona.](https://www.businesswire.com/news/home/20200327005539/en/)

[Stock target price: $12+](https://www.tickerreport.com/banking-finance/5425685/svb-leerink-comments-on-xeris-pharmaceuticals-incs-q2-2020-earnings-nasdaqxers.html)

[Today positive news on one of their drugs in phase1](https://www.businesswire.com/news/home/20200420005197/en/)

What they are working on:
[One approved. One in phase 3. Three in phase 2 and one in phase 1. ](https://www.xerispharma.com/research-development/pipeline)

From their last earnings call. 
[“... 2019 was a transformative year for Xeris. We had a number of major accomplishments and milestones, of which the most significant achievement was the FDA approval of our first product, Gvoke, the first and only approved liquid-stable glucagon for rescue in severe hypoglycemia in 2 presentations: the Gvoke prefilled syringe and the Gvoke HypoPen auto-injector. It's important to note that both presentations were approved in September, with the Gvoke prefilled syringe selling now and the Gvoke HypoPen becoming available in July.”](https://finance.yahoo.com/news/edited-transcript-xers-oq-earnings-232919010.html?guccounter=1&amp;amp;amp;amp;amp;guce_referrer=aHR0cHM6Ly93d3cuZ29vZ2xlLmNvbS8&amp;amp;amp;amp;amp;guce_referrer_sig=AQAAAJoz4qySwq6QQV0Srkl9ry8E1MvViWStLYNZkUQ4TzAENvhYYjMhsZikWPep__arz5fMfgAnIzLksakqdfC8fkQJbqZW4teMngOB_QKl1TcPF7JhT09Cu2w9S9pOgcAuQW314uWDrg5GFlSHbedYtm9gts8EU8ZLNcf0UARjEJDy)",2020-04-20,https://www.reddit.com/r/pennystocks/comments/g4xgdh/xeris_pharmaceuticals_earnings_expected_may_14/
95,Why has XSPA been rising so steadily?,g4x8ye,Waccamaw407,https://www.reddit.com/r/pennystocks/comments/g4x8ye/why_has_xspa_been_rising_so_steadily/,1,9,When do you think it’s gonna crash?,2020-04-20,https://www.reddit.com/r/pennystocks/comments/g4x8ye/why_has_xspa_been_rising_so_steadily/
96,Thoughts on $UAVS,g4x5na,Doing-the-most,https://www.reddit.com/r/pennystocks/comments/g4x5na/thoughts_on_uavs/,1,4,Is this a good buy $uavs,2020-04-20,https://www.reddit.com/r/pennystocks/comments/g4x5na/thoughts_on_uavs/
97,JNUG,g4x3gd,wflores170,https://www.reddit.com/r/pennystocks/comments/g4x3gd/jnug/,1,1,With the reverse split coming up for JNUG what is everyone’s thoughts on this.  A lot of doom and gloom pulled out then it went up and I’ve taken some profits.  But not sure if it’ll go one way or the other after the split,2020-04-20,https://www.reddit.com/r/pennystocks/comments/g4x3gd/jnug/
98,Any hope for ecor and novn,g4wz2a,okkchill,https://www.reddit.com/r/pennystocks/comments/g4wz2a/any_hope_for_ecor_and_novn/,1,2,been bagholding for 2 weeks now at .99 and .46,2020-04-20,https://www.reddit.com/r/pennystocks/comments/g4wz2a/any_hope_for_ecor_and_novn/
99,"Sooo, Oil is to become a penny stock",g4wy6r,_Scrypto_,https://www.reddit.com/r/pennystocks/comments/g4wy6r/sooo_oil_is_to_become_a_penny_stock/,1,5,What happens now? Will they crash completely and pull everything else?,2020-04-20,https://www.reddit.com/r/pennystocks/comments/g4wy6r/sooo_oil_is_to_become_a_penny_stock/
100,What happen with DECN,g4wpw2,Doing-the-most,https://www.reddit.com/r/pennystocks/comments/g4wpw2/what_happen_with_decn/,1,24,Saw during The Weeknd this was being pumped heavy,2020-04-20,https://www.reddit.com/r/pennystocks/comments/g4wpw2/what_happen_with_decn/
101,Buy ICO ETF?? Thoughts??,g4wlv3,Jackiohh,https://www.reddit.com/r/pennystocks/comments/g4wlv3/buy_ico_etf_thoughts/,1,0,[removed],2020-04-20,https://www.reddit.com/r/pennystocks/comments/g4wlv3/buy_ico_etf_thoughts/
102,$SHIP direct offering @ $0.12 of ~60Million shares 'on or about' April 22nd 2020,g51tm1,DarkWebTerminator,https://www.reddit.com/r/pennystocks/comments/g51tm1/ship_direct_offering_012_of_60million_shares_on/,1,9,source:  [https://finance.yahoo.com/news/seanergy-maritime-holdings-corp-announces-130010954.html](https://finance.yahoo.com/news/seanergy-maritime-holdings-corp-announces-130010954.html),2020-04-20,https://www.reddit.com/r/pennystocks/comments/g51tm1/ship_direct_offering_012_of_60million_shares_on/
103,Thoughts on UCO?,g51kf5,KeanuReevesdoorman,https://www.reddit.com/r/pennystocks/comments/g51kf5/thoughts_on_uco/,1,7,"Oil is the cheapest it’s ever been (inflation adjusted) and there is no clear sign that it’s going higher soon.

But I’m curious what others thoughts are on funds like UCO for a long play. Where obviously the price is crazy low - id assume when states start reopening that speculation alone would make it rally 30-40-60%.

Would love some input.",2020-04-20,https://www.reddit.com/r/pennystocks/comments/g51kf5/thoughts_on_uco/
104,NOVN MUST BUY HURRY,g51971,dlizano,https://www.reddit.com/r/pennystocks/comments/g51971/novn_must_buy_hurry/,1,9,Don’t wait,2020-04-20,https://www.reddit.com/r/pennystocks/comments/g51971/novn_must_buy_hurry/
105,Should I sell EROS?,g516am,xBananaYT,https://www.reddit.com/r/pennystocks/comments/g516am/should_i_sell_eros/,1,6,"They were looking pretty good especially with the merger with STX however, after a down 20% day I'm wondering if I should sell. Thoughts?",2020-04-20,https://www.reddit.com/r/pennystocks/comments/g516am/should_i_sell_eros/
106,What's going on with decn?,g50y5k,s6dative,https://www.reddit.com/r/pennystocks/comments/g50y5k/whats_going_on_with_decn/,1,4,I thought it was supposed to make big gains?,2020-04-20,https://www.reddit.com/r/pennystocks/comments/g50y5k/whats_going_on_with_decn/
107,Xspa? .74 during after hours?! Folks I think we just orbited around the entire solar system🚀🚀🚀🚀🚀🚀,g50xzi,Groovytime2,https://www.reddit.com/r/pennystocks/comments/g50xzi/xspa_74_during_after_hours_folks_i_think_we_just/,2,40,,2020-04-20,https://i.redd.it/11f1o1zdc1u41.jpg
108,XSPA After Hours 30%,g50w95,MoltenCare,https://www.reddit.com/r/pennystocks/comments/g50w95/xspa_after_hours_30/,1,24,"30% and climbing, broke out right after the bell. Look for it to gap up tomorrow morning.",2020-04-20,https://www.reddit.com/r/pennystocks/comments/g50w95/xspa_after_hours_30/
109,Got played by you $DECN pumpers,g50tpe,Doing-the-most,https://www.reddit.com/r/pennystocks/comments/g50tpe/got_played_by_you_decn_pumpers/,1,0,[removed],2020-04-20,https://www.reddit.com/r/pennystocks/comments/g50tpe/got_played_by_you_decn_pumpers/
110,$PCTL,g50htu,Geo81,https://www.reddit.com/r/pennystocks/comments/g50htu/pctl/,6,21,"Beautiful chart! Cup&amp;handle completing! Boom time!: 

And it is worth noting that tomorrow, Tuesday, will be the end of the 5th week of this consolidation pattern, which William J. O'Neil, publisher of Investor's Business Daily, and Owner of O'Neil &amp; Co, one of the top institutional research firms on Wall street, says in his books is the minimum duration of an ideal Cup &amp; Handle chart pattern. I mentioned this duration last week as something I would gladly wait for until the breakout occurs, and now we are there. Will it happen? Tomorrow, Wednesday, this week, very possibly! The way this chart looks, the 50dma and 200dma both now uptrending, all secondary indicators favorable, I wouldn't be surprised if this broke out tomorrow! But I suspect it will shortly regardless! 

And the timing from the fundamental side is fantastic, with much more news likely to be coming as we go forward, very positive news, in a host of areas, not just purchase orders, which will be among them. Fundamentals and technicals lining up together! Fantastic! 

This is the real deal, and the chart and timing are perfect for a major breakout and new uptrend beginning! 

And when it breaks out, I could easily see it running thru the key $.094 resistance and the nearby natural resistance at $.10, to begin the climb! If it does so on big volume, and then follows thru, that's the key final ingredient. And remember, the market invests on future value, to the greatest extent with strong growth companies, especially early in their growth, which is exactly what we have here, but in this case, with every reason to believe that growth not only will be accelerating, but will be going on for many years to come, globally! 

Long &amp; Strong! Into dollar land and beyond! 

GLTA",2020-04-20,https://www.reddit.com/r/pennystocks/comments/g50htu/pctl/
111,Gold penny stocks,g5078n,WorriedPanda_45,https://www.reddit.com/r/pennystocks/comments/g5078n/gold_penny_stocks/,2,3,Started to look into Gold penny stocks.  So far looking at PGM and BTU V.  What do you guys think about them?,2020-04-20,https://www.reddit.com/r/pennystocks/comments/g5078n/gold_penny_stocks/
112,Oil &amp; Gas Penny Stocks FTW,g5053l,PSMM2004,https://www.reddit.com/r/pennystocks/comments/g5053l/oil_gas_penny_stocks_ftw/,1,0,[removed],2020-04-20,https://www.reddit.com/r/pennystocks/comments/g5053l/oil_gas_penny_stocks_ftw/
113,Am I missing something,g502ne,MobilesuitBF,https://www.reddit.com/r/pennystocks/comments/g502ne/am_i_missing_something/,2,0,"https://bovnews.com/2020/04/20/time-to-invest-in-biontech-se-bntx-and-inpixon-inpx/

Wouldn't this indicate INPX is going bankrupt? I don't understand why it's a buy.",2020-04-20,https://www.reddit.com/r/pennystocks/comments/g502ne/am_i_missing_something/
114,Thoughts on MBRX,g4zodt,AltruisticBag4,https://www.reddit.com/r/pennystocks/comments/g4zodt/thoughts_on_mbrx/,1,0,[removed],2020-04-20,https://www.reddit.com/r/pennystocks/comments/g4zodt/thoughts_on_mbrx/
115,SHIP volume,g4zjk5,trey_mont,https://www.reddit.com/r/pennystocks/comments/g4zjk5/ship_volume/,2,11,Unusually high volume on SHIP. 144M when the average is 36M. Any thoughts on this?,2020-04-20,https://www.reddit.com/r/pennystocks/comments/g4zjk5/ship_volume/
116,ETP,g4zeju,tacopacc,https://www.reddit.com/r/pennystocks/comments/g4zeju/etp/,1,9,"Bought in at .52, keep holding or sell?",2020-04-20,https://www.reddit.com/r/pennystocks/comments/g4zeju/etp/
117,MPRX?,g4zciq,AltruisticBag4,https://www.reddit.com/r/pennystocks/comments/g4zciq/mprx/,1,0,[removed],2020-04-20,https://www.reddit.com/r/pennystocks/comments/g4zciq/mprx/
118,SHIP,g4z903,StockHoosier,https://www.reddit.com/r/pennystocks/comments/g4z903/ship/,1,0,[removed],2020-04-20,https://www.reddit.com/r/pennystocks/comments/g4z903/ship/
119,"$GHSI Slowly climbing, news coming this week.",g53n8p,N_reverie,https://www.reddit.com/r/pennystocks/comments/g53n8p/ghsi_slowly_climbing_news_coming_this_week/,1,4,"Seems to be on the rise. The CEO is presenting at an investors conference on April 22nd. Does something like that tend to drive up the value? 

I bought in at .48 so I'm hoping this is a rebound.",2020-04-20,https://www.reddit.com/r/pennystocks/comments/g53n8p/ghsi_slowly_climbing_news_coming_this_week/
120,RMBL,g53me4,Tmac1066,https://www.reddit.com/r/pennystocks/comments/g53me4/rmbl/,1,4,"Anyone watching/holding/buying/selling RumbleOn Inc? 


Pros:
-Roughly 840 million in revenue last year
-Insurance PR coming any day now

Cons:
-suspended payouts to vendors due to COVID 19





Feel free to comment with your thoughts.",2020-04-20,https://www.reddit.com/r/pennystocks/comments/g53me4/rmbl/
121,DECN?,g53l9i,gio-chris91,https://www.reddit.com/r/pennystocks/comments/g53l9i/decn/,1,7,"https://www.businessinsider.com/maryland-larry-hogan-coronavirus-test-kits-south-korea-2020-4

Think this was DECN?  Maybe some good news tomorrow?",2020-04-20,https://www.reddit.com/r/pennystocks/comments/g53l9i/decn/
