,title,id,author,url,score,num_comments,text,date,link
0,Best place to trade penny stocks?,cd1tff,StandardLifeMe,https://www.reddit.com/r/pennystocks/comments/cd1tff/best_place_to_trade_penny_stocks/,1,0,[removed],2019-07-14,https://www.reddit.com/r/pennystocks/comments/cd1tff/best_place_to_trade_penny_stocks/
1,"What are some promising stocks with market caps under $10m? OTC included, list your favorites.",cd4jnj,tmh0312,https://www.reddit.com/r/pennystocks/comments/cd4jnj/what_are_some_promising_stocks_with_market_caps/,5,8,Add a brief description on why you like them if you have the time. Thanks and good luck everybody!,2019-07-14,https://www.reddit.com/r/pennystocks/comments/cd4jnj/what_are_some_promising_stocks_with_market_caps/
2,Gold Stocks Are Outpacing The Market: Some Smaller Cap Names To Consider,cd408l,driv818,https://www.reddit.com/r/pennystocks/comments/cd408l/gold_stocks_are_outpacing_the_market_some_smaller/,1,0,[removed],2019-07-14,https://www.reddit.com/r/pennystocks/comments/cd408l/gold_stocks_are_outpacing_the_market_some_smaller/
3,ANTIBE THERAPEUTICS,cd3zsx,iamtheonewhoknockseh,https://www.reddit.com/r/pennystocks/comments/cd3zsx/antibe_therapeutics/,14,28,"About to buy my first ever penny stocks on this company after reading a few posts on this sub, any of you guys holding major positions?",2019-07-14,https://www.reddit.com/r/pennystocks/comments/cd3zsx/antibe_therapeutics/
4,scanner,ccxa8d,stock_scanner,https://www.reddit.com/r/pennystocks/comments/ccxa8d/scanner/,1,0,[removed],2019-07-14,https://www.reddit.com/r/pennystocks/comments/ccxa8d/scanner/
5,"Chinese mining company just bought out by Gold Giant Wanying Group - Someone translated website, they are entering USA now with name change of China Shouguan Investment Group $CHSO",cd6b4a,weed_trader,https://www.reddit.com/r/pennystocks/comments/cd6b4a/chinese_mining_company_just_bought_out_by_gold/,67,26,"[https://www.marketwatch.com/investing/stock/chso](https://www.marketwatch.com/investing/stock/chso)

&amp;#x200B;

Did anyone read this over the weekend from SRF Group, talking about the recent merger of Wanying Group and $CHSO - Translation on website says they are entering USA with name change of $CHSO.

&amp;#x200B;

Just translated (excuse the minor translated errors) [https://i.imgur.com/iZeaHUR.png](https://i.imgur.com/iZeaHUR.png)

&amp;#x200B;

On the Wanying group website,

&gt;""In the equity investment secotr, Wanying group has obtained the actual control of listed company for USA entrance (name change to be initiated). Now actively engaged in mergers and acquisitions with a number of domestic and Hong Kong listed companies.""",2019-07-14,https://www.reddit.com/r/pennystocks/comments/cd6b4a/chinese_mining_company_just_bought_out_by_gold/
6,"July 14, 2019 Tomorrow's Daily /r/Pennystocks Discussion! Monday Discussion thread!",cd640q,AutoModerator,https://www.reddit.com/r/pennystocks/comments/cd640q/july_14_2019_tomorrows_daily_rpennystocks/,2,4,"Please use this thread to discuss your plays of the day!

Since this thread is likely to fill up quickly, consider sorting the comments by ""new"" (instead of ""best"" or ""top"") to see the newest posts.",2019-07-14,https://www.reddit.com/r/pennystocks/comments/cd640q/july_14_2019_tomorrows_daily_rpennystocks/
7,$TCON,cd8lmy,jacobmmel,https://www.reddit.com/r/pennystocks/comments/cd8lmy/tcon/,2,0,"This stock is looking like it has the potential to be a good play. I recently bought 130 shares of this on Friday and plan to purchase more tomorrow as long as nothing tanks. The monthly chart seems to have some support around the $0.50 mark, and the daily looks like it is setting up for a breakout. I'm gonna be cautious though because the weekly charts have been downtrending, so if the price falls below that support level  this week, I will sell off and take a very minimal loss.",2019-07-14,https://www.reddit.com/r/pennystocks/comments/cd8lmy/tcon/
8,FLKS &amp; Salarius new merger Research &amp; Links provided,cd7yh1,Rafyy37,https://www.reddit.com/r/pennystocks/comments/cd7yh1/flks_salarius_new_merger_research_links_provided/,5,6,"FLKS Salarius research with new merger   ""We recently completed a $6.4 million series A raise, and we anticipate that Flex will bring approximately $3.3 to $3.5 million to the transaction. Also, we have tremendous support from the Cancer Prevention Research Institute of Texas ($9.1M remaining of an $18.7M award) and the National Pediatric Cancer Foundation, who is paying a large part of the Ewing sarcoma clinical program. So, the funding and support that Salarius receives is substantial, coming from many areas. ""    


Raised funding into own private company &amp; STILL has more funding from cancer research institues to afford investing in FLKS in January to fund them into mid 2020!     


""Salarius will house itself at Johnson &amp; Johnson's JLABS @ TMC"" - 2016  ""formed in a partnership between Johnson &amp; Johnson..."" - 2016 also   


 "" What we're able to do, now that we have a merged company, is take those resources and in 2019 focus on the execution of our clinical programs with our lead compound, Seclidemstat, for which we received IND activation in March 2018. ""   
 IND activation 1 year and 4 months a go,    
Clincical trials completed  15 Sep 2018 &amp; 20 December 2018   


 TLDR; it looks like Salarius finally in 8 years being a private company, have done enough clinical trials with acceptance of an IND to further their clinical studies. My previous post has links that indicate they worked alongside some big pharmaceutical companies in the stock market (more than one). It looks to be, being the private company they have invested in FLKS in January funding them for an additional year while funding their own clinical studies for cancer.    


Also looks that they would rather be their own pubilc company, why is this important? For a private company to jump into the stock market on a merger of another stock that has plummeted from $20 to 0.30c, to fund them in January 2019 and to continue their merger after seeing the stocks performance over the past 6 months still under $1 puts them at a big risk, risk's companies wouldn't take, risk's that could ruin business's and companies, risk's that most people only take when they're sure of something",2019-07-14,https://www.reddit.com/r/pennystocks/comments/cd7yh1/flks_salarius_new_merger_research_links_provided/
9,Eyen,cd7h7f,engages,https://www.reddit.com/r/pennystocks/comments/cd7h7f/eyen/,3,4,"Price dropped by almost half this month. Then they announced a public offering last week. Is that related? I did some dd on eyenovia earlier this year, but I took a hit anyways. Should I stay away or is this an opportunity now?",2019-07-14,https://www.reddit.com/r/pennystocks/comments/cd7h7f/eyen/
10,Working on an Indicator to Day Trade Penny Stocks. Have Some Questions,cd6xkq,alkjdasoad,https://www.reddit.com/r/pennystocks/comments/cd6xkq/working_on_an_indicator_to_day_trade_penny_stocks/,4,2,"New to the community here. All these years I've been day trading options. Recently started making my own indicator (for the ThinkorSwim platform). Randomly came across a few penny stocks and surprisingly the signals were fairly accurate on penny stocks (although I designed the indicator to work with large caps).

Here are a few examples: https://imgur.com/a/J5I9tZ8

My observation: The signals tend to be very reliable on stocks that gapped up overnight. (bigger the gap the better)

My question: Does anyone know a scanner that I can use to look for big gap ups and downs on penny stocks? I'm currently using the default Gap Up and Gap Down scanners in ThinkorSwim. Not sure if that should be enough or is there a specialized one for penny stocks.",2019-07-14,https://www.reddit.com/r/pennystocks/comments/cd6xkq/working_on_an_indicator_to_day_trade_penny_stocks/
11,keep an eye on #MTLO,cd0qgu,WeHaveSomeQuestions,https://www.reddit.com/r/pennystocks/comments/cd0qgu/keep_an_eye_on_mtlo/,19,9,"earnings this week. bruce linton is going to be handling acquisitions for them going forward. things could heat up quickly. i’m in deep and hoping this stock makes me a millionaire.

GLTA!

do your own DD",2019-07-14,https://www.reddit.com/r/pennystocks/comments/cd0qgu/keep_an_eye_on_mtlo/
