,title,id,author,url,score,num_comments,text,date,link
122,Shoutout to these guys for the tip on the profits for today!,g53dky,Thedrp8,https://www.reddit.com/r/pennystocks/comments/g53dky/shoutout_to_these_guys_for_the_tip_on_the_profits/,1,5,,2020-04-20,https://i.redd.it/qu6a87ekz1u41.jpg
123,So this happened today. 420 @ $4.20 on 4/20,g531j4,GalwayGus,https://www.reddit.com/r/pennystocks/comments/g531j4/so_this_happened_today_420_420_on_420/,1,13,,2020-04-20,https://i.redd.it/wjuqy1i7w1u41.jpg
124,Trading Platforms?,g52xza,jcktffy98,https://www.reddit.com/r/pennystocks/comments/g52xza/trading_platforms/,1,3,What is the best trading platform for penny stocks? I currently am in on robin hood but want options with OTC stocks. I enjoy the user friendly and simple platform RH offers.,2020-04-20,https://www.reddit.com/r/pennystocks/comments/g52xza/trading_platforms/
125,"Hi, does anyone know with what broker i can buy the stocks PCTL and HPMM? Dont find them on robinhood",g52wo6,perosel,https://www.reddit.com/r/pennystocks/comments/g52wo6/hi_does_anyone_know_with_what_broker_i_can_buy/,1,0,[removed],2020-04-20,https://www.reddit.com/r/pennystocks/comments/g52wo6/hi_does_anyone_know_with_what_broker_i_can_buy/
126,SHIP moving huge after hours,g52pqy,contents_under_psi,https://www.reddit.com/r/pennystocks/comments/g52pqy/ship_moving_huge_after_hours/,1,10,This thing is like the super volcano under Yellowstone National Park getting ready to blow,2020-04-20,https://www.reddit.com/r/pennystocks/comments/g52pqy/ship_moving_huge_after_hours/
127,$NAT,g52p43,sjqueen,https://www.reddit.com/r/pennystocks/comments/g52p43/nat/,1,14,Will NAT has another ride tomorrow? Or is it too late to jump in?,2020-04-20,https://www.reddit.com/r/pennystocks/comments/g52p43/nat/
128,Looking at price trends of penny stocks. Every stock is below 5$ and over 50k volume. Enjoy! I’m excited for later this week when I have more data.,g52d5e,DragonElder,https://www.reddit.com/r/pennystocks/comments/g52d5e/looking_at_price_trends_of_penny_stocks_every/,1,4,,2020-04-20,https://docs.google.com/document/d/1LHRQJ9dvLs0-riaY4-mqIBZRkSrySWKdZtKsrsY7fUY
129,Tits &amp; Spas,g52bdz,peteyadig,https://www.reddit.com/r/pennystocks/comments/g52bdz/tits_spas/,1,7,"I always see the phrase, ""can't go tits up,"" but am not sure what it means. So, I ask, did XSPA go tits up today?",2020-04-20,https://www.reddit.com/r/pennystocks/comments/g52bdz/tits_spas/
