,title,id,author,url,score,num_comments,text,date,link
0,BLPG Movement,818hj0,TheMuscle,https://www.reddit.com/r/pennystocks/comments/818hj0/blpg_movement/,1,0,What is making this move?  I can't find any info that would make this jump to it's highest point in 2+ years. ,2018-03-01,https://www.reddit.com/r/pennystocks/comments/818hj0/blpg_movement/
1,"Just keep holding, folks",818amk,ryoon21,https://www.reddit.com/r/pennystocks/comments/818amk/just_keep_holding_folks/,24,15,"For anyone feeling uneasy today, the market is down as a whole. Either buy or hold today, but don’t do anything drastic. 

Just my two cents...",2018-03-01,https://www.reddit.com/r/pennystocks/comments/818amk/just_keep_holding_folks/
2,Thoughts on $RYU.VN,8180z0,18spencer,https://www.reddit.com/r/pennystocks/comments/8180z0/thoughts_on_ryuvn/,9,11,Been on my radar for a while. Want others opinions. ,2018-03-01,https://www.reddit.com/r/pennystocks/comments/8180z0/thoughts_on_ryuvn/
3,GRXXF broke $1.00 today,817xeb,Amanofinfinitejest,https://www.reddit.com/r/pennystocks/comments/817xeb/grxxf_broke_100_today/,0,0,"Anyone out there still holding?
What is the ceiling?",2018-03-01,https://www.reddit.com/r/pennystocks/comments/817xeb/grxxf_broke_100_today/
4,The 3 cheapest shares on robinhood...,815jgy,suitology,https://www.reddit.com/r/pennystocks/comments/815jgy/the_3_cheapest_shares_on_robinhood/,28,31,"The 3 cheapest shares on robinhood today are

CEI started today at 7.5 cents and ended the day at 11.

JrJr currently 13.7 cents a share

Jagx 14.5

Of these 3 CEI holds the largest chance of duplicating BPMX 's 60% gain in 2.5 days.",2018-03-01,https://www.reddit.com/r/pennystocks/comments/815jgy/the_3_cheapest_shares_on_robinhood/
5,Suggestions?,811qb1,Gregmattucci113,https://www.reddit.com/r/pennystocks/comments/811qb1/suggestions/,1,0,[removed],2018-03-01,https://www.reddit.com/r/pennystocks/comments/811qb1/suggestions/
6,VTNL!!!!!!!,811cf2,kingafrica1199,https://www.reddit.com/r/pennystocks/comments/811cf2/vtnl/,1,6,,2018-03-01,https://www.reddit.com/r/pennystocks/comments/811cf2/vtnl/
7,What’s your watch looking like for tomorrow ?,810y7q,sumonasty,https://www.reddit.com/r/pennystocks/comments/810y7q/whats_your_watch_looking_like_for_tomorrow/,5,9,,2018-03-01,https://www.reddit.com/r/pennystocks/comments/810y7q/whats_your_watch_looking_like_for_tomorrow/
8,GBHL Buying opp,814o9f,dlipseir,https://www.reddit.com/r/pennystocks/comments/814o9f/gbhl_buying_opp/,2,0,Dropped huge yesterday.  Great buying opp as its going to rise hardcore today.,2018-03-01,https://www.reddit.com/r/pennystocks/comments/814o9f/gbhl_buying_opp/
9,"Just Finished Tim Sykes' ""How To Make Millions"" Does This ELIF Sound Right?",814k1m,the_restlessartist,https://www.reddit.com/r/pennystocks/comments/814k1m/just_finished_tim_sykes_how_to_make_millions_does/,101,101,"Hey I'm brand-new here - nice to meet you! As the title says, I just finished Tim Sykes' ""How To Make Millions.""

I like to try to boil things down in my head into an ELIF format and I wanted to do that here and see if this makes sense to some of you more experienced traders here and if I'm getting anything mixed up or if you think you have some more insight to provide. 

Tim's Strategy In a Nutshell (or so I think):

* Each day look at stocks that have the biggest percentage gains

* From that list, look for stocks priced below $10 (usually), that are trading 200,000 to 2 million shares a day (sometimes higher is okay), that have a $10 million to $500 million market cap.

* Avoid any on the list that are biotech, financial, commodity, REITs, or SPACs (usually - there are exceptions, but these are the best practices for most of the time).

* Once you have your list of stocks that fit these criteria, begin searching for news on why they have spiked so much. Focus on tangible news - press releases, articles, analysis, contracts, earnings reports - something that may explain the spike (and that is able to be shared and spread). 

* Go long on the stock if it has ""broken out"" of its multi-day (or multi-month) ""technical resistance"" - go short if it has broken down through technical support. 

* Look to profit 15% to 50% typically - cut losses quickly

* It's a good idea to buy close to market close and sell on market opens - Fridays at market close are great if news can travel over the weekend for people who are looking for ""good plays"" on the following Monday that will cause spikes on Monday morning. 

That's my ""ELIF"" nutshell and I wanted to see if this is a strategy you've heard before or utilize or if it sounds like I'm comprehending it correctly. 

A Little About Me: I've been a direct response copywriter for financial publications (financial advisories like for Motley Fool, Money Map Press, Agora Financial and more). 

But I've never traded . 

Recently - after freelancing for years - I was provided more-or-less an ultimatum. Either I go work in-office in Baltimore  (at one of the offices of these $150 million-plus direct marketing financial advisory publishers) or I don't. But if I don't I will likely stop receiving contract work as they are all putting an emphasis on building in-house teams. 

That would mean my source of income would pretty much dry up (I get paid $10,000 per promotion and 5% royalties per paid sign-up, so it would be a really bad source of income to lose).

I like working from home. I started being a writer in the online marketing space so I could work from home from anywhere.

I live abroad in Thailand (US citizen) and I don't want to move back to the boring US - especially when I'm banging hot Thai bar girls and Swedish backpackers and can work in my boxers. 

I've got three months to make a decision and I've decided my only other viable option is to finally start trading - especially since I have a knowledge of market psychology and how people make fear-greed decisions due to my copywriting background. And I've written and researched so many promotions (and they're 90% research) I feel like I have the really good ability to sniff out news and do the necessary leg work to make smart decisions due to the discipline I cultivated as a copywriter. 

Since January of this year I've made $40,000 and I thought...fuck it. That's literally enough to live on for at least a year or two pretty comfortably even if I put $10,000 into a brokerage account. 

So I'm studying as much as I can, but I want to start trading and learning as soon as I can. 

Hope to be active in here. 

[EDIT]: Okay...seems like this subreddit is full of trolls. I'm off to bed. Will leave this up in the off-chance somebody who is experienced can provide me some insight. Otherwise I'll just delete in the morning and stay the fuck out of this sub. Good lord. ",2018-03-01,https://www.reddit.com/r/pennystocks/comments/814k1m/just_finished_tim_sykes_how_to_make_millions_does/
10,"Confessions of a Market Maker - Good read, found posted on Ihub",8199s5,palidon,https://www.reddit.com/r/pennystocks/comments/8199s5/confessions_of_a_market_maker_good_read_found/,24,2,"Confessions of a Market Maker:

*A Note from hawkstar*
I agree with most of what the author has written below and believe he provides a powerful incite into what goes on behind the screen. During this post he advocates going long with your investments, BUT you must be careful and know the difference between INVESTING and TRADING highly volatile penny-stocks; most of the time with volatile penny-stocks you must get in and take your profit quickly, but if you find a solid company with solid management, business plan, revenues, low debt, and a growing market share then that would be the type of acceptable long term investing the author is referring to.


Author Unkown:
""I was an OTC MM for about 10 years ending in the late 80's. Since then I have been strictly an investor. Since I have not been that up to date in MM rules I will only make statements that I feel fairly confident are still accurate regarding these activities. By and large most MM don't have a clue nor do they care to learn, about the fundamentals of the stocks they trade.

They just try to make orderly markets. When dealing with BB stocks it is very easy for a MM to get trapped into being short in dealing in a fast moving market. Reason being; most of the MM's in this stock are what are called ""wholesalers"" this means they don't have retail brokers ""working"" the stocks.
So they have to rely on what's known as the ""call"" from larger retail houses. If a ""Big"" retail firm like an E-trade calls up a market maker to purchase say 5,000 shares of a stock, they expect to get an ""execution"" from that market maker. If he turns them down, or only gives a partial then the ""Big"" firm will go to another MM.

If this second MM ""fills the order"" then that ""Big"" firm has a moral obligation to continue to give future ""business"" in that stock to that MM who performed (his life blood). This will go on until he ""fails"" to perform and so on.

Contrary to popular opinion the ""Big"" firms Do NOT neccessarily go to the ""Low Offer"" to fill a buy order (Or high bid for a sell). They ""Go"" to who they think will perform to fill the order and expect that MM to ""match"" the ""low offer"" in the case of a buy (bid in the case of a sell). Even though this MM might in fact be the ""high bid"" and not really want to sell any more.
As a wholesaler he must perform or he will get a reputation as a ""non-performer"" with the ""Big"" houses and will cease getting ""calls"" which means he will soon go out of business. I mentioned above that this activity is very significant to BB stocks. I say this because most of the trades in these BB stocks are ""unsolicited"" and are done through discount houses.

With the above groundwork laid, let me try to explain how market makers get short even if they like the Company; Lets say that a stock (shell) has been lying quietly at $.25 bid $.50 offered. A limit order comes into one of the MM's to Buy at $.50 for a thousand shares. Prior to this trade that MM may be ""flat"" (neither long or short any shares). He fills the order and is now short 1,000 shares. He may raise his bid hoping to find a seller to ""flatten"" out his position. But before he realizes it a wave of buyers have come in and cleared out all the $.50 offers. Now the stock is $.50 bid .75 offered. Here comes that ""Big"" firm he just sold the 1,000 shares to at .50 with another bid for 1000 at .75. He makes this print. Now he is short 2,000 at an average of .625. The market keeps moving and now its .75 bid 1.00 offered. Now he has to make a decision.

Just like investors, MM Hate to take a loss. So 9 times out of 10 he will now sell 2000 at 1.00 making him short 4000 but with an average .81. At this time he would love to see a seller at .75 so he can cover his short and make a few bucks.
But instead the market keeps moving up. Now it is 1.00 to 1.25 and here comes the buyer again at 1.25. He doesn't want to lose the call so now he needs to sell 4,000 at 1.25 to keep his break even point above the bid. Now he is short 8,000. Market moves up to 1.25 bid 1.50 offer here comes the buyer now he feels he must sell 8000 here because ""stocks don't go up forever"".

Now he is short 16,000. And so on and so on. If the stock keeps moving up, before he realizes it he could be short 50k or 100k shares (depending how big his bank is). _________________________

Finally the market closes for the day and on paper he may look all right in that his ""break even"" price may be around the closing price. But now he has to figure out how to entice sellers so he can cover this short. It is important to note that if this happened to one MM it has probably happened to most all of them.
Some ways MM's entice sellers; Run the stock up with a ""tight spread"" in a fast market, then ""open"" up the spread to slow down the buying interest. After it has ""cooled off"" for a little while lower the offer below the last trade right after a small piece trades on the offer then tighten the spread so that the sellers feel they can take a ""quick profit"" by ""hitting the bid"" on the tight spread.

Once the selling starts the MM's will walk it down quickly by only making small prints on the way down with the tight spread. Another way is by running the stock up in the morning, averaging up their short then use the above technique to walk it down in the afternoon.

Hopefully after doing this for several days, it will demoralize the buyers. The volume will dry up and the sellers will materialize thinking that the game is over.
Contrary to popular opinion, MM usually Do Not Cover in Fast moving markets either Up or Down if they are short. They Short More. They usually try to cover after the frenzy is out of the market. There are many other techniques they use but the above are the most popular.
This technique works about 9 times out of 10 particularly in a BB market. However that is because 9 out of 10 BB stocks are BS. Remember what I said above. Most MM's don't have a clue as to the value of a Company until they get trapped. If the Company has solid fundementals and a bright future. Then the stock will do very well. And the activity that caused the situation will prove to even help the future stock activity because it created an audience.""



Market Maker's Operating Procedure

The savvy long-term investors never chase stocks up. For the most part that is momentum players and daytraders where most of it or what follows is dumb money. Instead the long-term investors use a couple of simple strategies in order to position themselves. One is to find a stock no one immediately sees has huge potential and accumulate. Long-term investors are not interested in trading against the public mind or the dumb money. That's where the majority of the money can be made but even more can be made if the base of a stock is held extremely strong by investors. However the second is not to doubt the research which is the underlying basis for going long and holding.

More and more investors are winning the game nowadays despite all bashers that float through the Internet that has become part of the game. Floor traders of market makers often watch CNBC, news wires and bulletin boards in order to follow the market during trading session. OTC BB market makers (MMs) don't use fundamental and technical analysis. However, what they do realize is a lot of dumb money does use this newest nitch charting or TA (Technical Analysis) to run a stock either up or down. To the MMs this is like taking candy from a baby. Simply they will paint the tape and use whatever tactic to affect the charting bands. Thus the public and dumb money they will have eating out of their hands. Effectively the MMs can show a strong stock growing weak by manipulating the close price in order to generate selling volume, delaying trading time to manipulate trading activities, or even stalling the ask without honoring orders to hold a stock price.
MMs follow a simple code of business when making a market in a stock especially an OTC BB. That is the level that stocks will seek that yields the most volume. Now this is very important because they make money on the volume buying at the bid and selling at the ask. In other words, by making the market they are buying low and selling high. Now smart money adheres to that rule, so do all the market makers. They could careless whether the stock is at $83 or at $0.23. All they care about is the action thus being able to sell stock at the offer (The high) and buy stock at the bid (The low). To increase their profitability, they make the spread as great as possible on as many shares as they can especially if the volume falls off.

When they have mostly all ""buy"" orders, that's not the price that's going to yield the most volume. They need both buy and sells to get the maximum action. Remember, MMs play the volume. If the volume decreases and there are mostly Buys that become a one way volume, Buy volume. So what they do is let the stock run up to a price where it runs out of steam. They fill all the buy orders there that they can and then comes the pullback one way or another naturally or induced. During the pull back they can buy tons of shares and flip them to those averaging down or trying to catch the bounce. At some price, the stock will be relatively stable and yield the most volume. Now that is the average price you will see
The average price is the point where a stock seeks a level where MMs can profit on the most volume. So during the day that is the price that MMs and momentum/day traders want to see the stock at. Why? Because they know the public and dumb money was chasing the price thing up. Most of the time, the MMs love a flurry of Market Orders which is a dead sign of an artificial run or momentum. Merely it is money in the bank for them. Most get hung in a momentum or day trade or by the tactics of Market makers, who are in the business to screw the public every chance they get and the NASD is not going to do anything about it. They are merely making the market liquid is there reasoning.

The market makers have created an added complication to the OTCBB's chaos of the already volatile intra-day price movements created by dumb money, momentum and day-traders. MMs can not relate to long-term holders in the OTC BB. That makes absolutely no sense what so ever. They feel a large percentage of trades in the OTC BB market consist of short-term or day-trades, MMs merely view the barrage of buy and sell orders as relatively neutral to the market. How they figure it is when the average dumb money buys shares in a company, the MMs feel or rather know with some certainty it is very likely that dumb money will want to sell back those shares relatively quick on the slightest drop.

Now somewhat comfortable with this logic the MMs merely short sells into the buying and attempts to take the stock down in an effort to ""shake out"" the weak. Since it is tough to know for sure whether a move is the beginning of a trend, or a routine shake out, this type of deception works quite well for the MMs. What the long-termers do to a stock is surprise the MMs because instead of falling the shorting has no effect and the price goes up. Now that puts the MM at selling low through shorting and thus having to buy high in order to cover.
Boy, when this happens, the MMs are not very happy campers. The investors and traders are supposed to be doing that no them. Now it becomes time to pull out every trick and tactic in the book in order to attempt to get a Bear Raid at every dollar mark or percent from where the stock started. Could be a penny in smaller priced securities? What MMs do is give you a chance to make a small amount of money for your momentum and day trading style by shorting it at these levels and trying to get a bear raid each time. Each failure is compounding the MMs short position so they let it go to the next level. Now come more deliberate tactics MMs use to coerce Bear Raid or panic selling.

Once the MM is caught short and the strength of the buy is overpowering the MM will want to cover his short position. So the MMs call up one of his friendly MMs and says some like ""the weather is sure rough today."" The MM along with the other ""friendly MM initiates a down tick about the same time. Now this can also be done with a certain amount of shares such as an infamous 100 shares flag. This down tick gives the illusion of weakness designed to hopefully begin the bear raid of selling. The fickle, fearful, day trader, momentum and short term begin to sell out allowing the MM to cover his short position at lower prices. They will move it down quickly to get it to a price of least financial damage. Problem they have is long-term investors in the OTC BB. They start accumulating and buying comes flying in when they take it too far thus the MMs took it to the point of volume again and not only investors the other MMs step in the make money on the spread.

Alas the poor MM does not get to cover. Now comes various tactics like stalling, boxing, or even locking the Bid and Ask for a while.

Of course, MMs aggressively deny any sort of collusion designed to fix quotes or spreads, but a recent SEC investigation tells another story.

MMs have a vast resource of tactics and it would take probably more than my lifetime to figure them all out.

So how do investors somehow manage to overcome the obvious deception in OTCBB arena? One answer is indirection trading style by going long which the MMs do not expect. In the war between investors and public companies on the OTC BB vs the MMs, if the MMs have all the advantages due to position or other factors, direct confrontation such as momentum or day trading hitting the stock is a definite death sentence.

However, an indirect approach tends to weaken the path of least resistance before slowly overcoming it. The most effective way is long-term investors slowly accumulating and holding thus drawing the MMs out of its defenses making them as naked as their short position. This is war so this slow accumulation and holding for the long term easily achieves the desired effect to force MMs to cover and knock off the tactics or bury themselves deeper.

The MMs when caught will especially use every trick and tactic in the book to get a Bear Raid thus playing on the individual fear of most people. The MMs feel they have information and position advantages over the investors as long as the holding of the stock is in weak hands or short term holders. Since they are OTC BB MMs who believe all OTCBB companies are not worth investing and management is ineffective regardless what is happening within the company.Furthermore, MMs know they are in the position to impose a great deal of influence in OTC BB stocks trading when it suits their needs.

This inherent power of position enables the MMs to move the markets at any time up or down. As a result, the only way to draw them out of their favorable position is going long. Now this does not mean just any company but to effectively nail the MMs, Longs must find the great company on the floor and accumulate long before the MM tactics and games begin. ",2018-03-01,https://www.reddit.com/r/pennystocks/comments/8199s5/confessions_of_a_market_maker_good_read_found/
11,been looking at ATOS for a bit,81677x,ekhatch99,https://www.reddit.com/r/pennystocks/comments/81677x/been_looking_at_atos_for_a_bit/,1,4,what do yall think about it,2018-03-01,https://www.reddit.com/r/pennystocks/comments/81677x/been_looking_at_atos_for_a_bit/
12,$DRWN,81668m,LandmanCA,https://www.reddit.com/r/pennystocks/comments/81668m/drwn/,11,6,"Announced they were buying back shares, up 42% yesterday and 10% this morning. Any thoughts? Purchase more, wait for a dip, GTFO??? ",2018-03-01,https://www.reddit.com/r/pennystocks/comments/81668m/drwn/
13,$ETBI 4 Filings and a corporate update in one day,8165gd,defectivetrekkie,https://www.reddit.com/r/pennystocks/comments/8165gd/etbi_4_filings_and_a_corporate_update_in_one_day/,2,0,"ETBI really getting their shit together today releasing 4 SEC filings and a corporate update, this is gonna run for sure. 

Filings: https://www.otcmarkets.com/stock/ETBI/disclosure
Corporate Update: http://www.digitaljournal.com/pr/3679182",2018-03-01,https://www.reddit.com/r/pennystocks/comments/8165gd/etbi_4_filings_and_a_corporate_update_in_one_day/
14,$ACRL - Check them out,8161ds,xlogit3k,https://www.reddit.com/r/pennystocks/comments/8161ds/acrl_check_them_out/,2,0,"https://imgur.com/eJRwJvb

Recent interview with the CEO
https://upticknewswire.com/interview-ceo-glenn-grant-of-atacama-resources-international-inc-otcpink-acrl/?utm_source=feedburner&amp;utm_medium=twitter&amp;utm_campaign=Feed%3A+UptickNewswire+%28Uptick+Newswire%29

https://www.otcmarkets.com/stock/ACRL/profile",2018-03-01,https://www.reddit.com/r/pennystocks/comments/8161ds/acrl_check_them_out/
15,Ride MYO to earnings,815z7a,FishySushi,https://www.reddit.com/r/pennystocks/comments/815z7a/ride_myo_to_earnings/,2,2,"Basically every big name pumper is swinging this stock to earnings next Wednesday March 7th. They announced yesterday their earnings date which is why it started rallying. This is a great buy and it'll only continue to rally til Wednesday at least. Even if their ER isn't good, which I don't think will happen, you can still buy the rumor sell the news. I'm expecting $7-8 range. I'm in at 4.10",2018-03-01,https://www.reddit.com/r/pennystocks/comments/815z7a/ride_myo_to_earnings/
16,"March 01, 2018 /r/Pennystocks Monthly Watch List",815x4i,AutoModerator,https://www.reddit.com/r/pennystocks/comments/815x4i/march_01_2018_rpennystocks_monthly_watch_list/,4,12,"
Post your watch list for this month! 
",2018-03-01,https://www.reddit.com/r/pennystocks/comments/815x4i/march_01_2018_rpennystocks_monthly_watch_list/
17,AMFE good entry point,815x07,IntrepidBlock,https://www.reddit.com/r/pennystocks/comments/815x07/amfe_good_entry_point/,1,1,[removed],2018-03-01,https://www.reddit.com/r/pennystocks/comments/815x07/amfe_good_entry_point/
18,CEI mentioned in an article about hot stocks,817f5w,suitology,https://www.reddit.com/r/pennystocks/comments/817f5w/cei_mentioned_in_an_article_about_hot_stocks/,7,16,https://stocknewsgazette.com/2018/03/01/choosing-between-hot-stocks-camber-energy-inc-cei-allied-healthcare-products-inc-ahpi/,2018-03-01,https://www.reddit.com/r/pennystocks/comments/817f5w/cei_mentioned_in_an_article_about_hot_stocks/
