,title,id,author,url,score,num_comments,text,date,link
0,$ADMP,dmy8ci,cirenosral,https://www.reddit.com/r/pennystocks/comments/dmy8ci/admp/,14,31,What are your thoughts on getting in before FDA approval. I’m in at .71 and it seems to have a great uptrend.,2019-10-25,https://www.reddit.com/r/pennystocks/comments/dmy8ci/admp/
1,$CLSD $PDLI $SEOVF,dmxazv,knott4shore,https://www.reddit.com/r/pennystocks/comments/dmxazv/clsd_pdli_seovf/,3,0,[https://stock-watch.market/6v2rb](https://stock-watch.market/6v2rb),2019-10-25,https://www.reddit.com/r/pennystocks/comments/dmxazv/clsd_pdli_seovf/
2,$CEI reverse split?,dmvzee,Mike_Lamydia-Burns,https://www.reddit.com/r/pennystocks/comments/dmvzee/cei_reverse_split/,3,4,Announced last night. Ive seen some people say this will result in a short term surge before it comes back down to earth. Any thoughts?,2019-10-25,https://www.reddit.com/r/pennystocks/comments/dmvzee/cei_reverse_split/
3,List of All Business Models,dmrta5,711794151,https://www.reddit.com/r/pennystocks/comments/dmrta5/list_of_all_business_models/,13,0,,2019-10-25,https://www.reddit.com/r/Business_Ideas/comments/desv9v/list_of_all_business_models/
4,"October 25, 2019 Tomorrow's Daily /r/Pennystocks Discussion - What are your Friday / weekend plays?",dn1962,AutoModerator,https://www.reddit.com/r/pennystocks/comments/dn1962/october_25_2019_tomorrows_daily_rpennystocks/,1,0,"Please use this thread to discuss your plays of the day!

Since this thread is likely to fill up quickly, consider sorting the comments by ""new"" (instead of ""best"" or ""top"") to see the newest posts.",2019-10-25,https://www.reddit.com/r/pennystocks/comments/dn1962/october_25_2019_tomorrows_daily_rpennystocks/
5,"Simple Questions - October 25, 2019",dmt7ol,AutoModerator,https://www.reddit.com/r/pennystocks/comments/dmt7ol/simple_questions_october_25_2019/,2,4,"This thread is for simple questions that don't warrant their own thread as well as general discussion. We strongly encourage you to check the sidebar before posting. Please feel free to engage and discuss topics with other members of the community.

**IMPORTANT: Downvotes are strongly discouraged. Sorting by ""New"" is strongly encouraged.**",2019-10-25,https://www.reddit.com/r/pennystocks/comments/dmt7ol/simple_questions_october_25_2019/
