,author,id,url,score,text,date
0,Poc4e,fhcxdwx,/r/pennystocks/comments/f2je7p/psychedelic_drug_companies_gear_up_to_list_on/fhcxdwx/,1,Hey look... it’s this guy again !!!,2020-02-12
1,Shawn7387,fhcxq6p,/r/pennystocks/comments/f2je7p/psychedelic_drug_companies_gear_up_to_list_on/fhcxq6p/,1,"What’s the beef? It’s an emerging drug, someone is going to produce it eventually. 

Actual question",2020-02-12
2,Roots_on_up,fhd0tpy,/r/pennystocks/comments/f2je7p/psychedelic_drug_companies_gear_up_to_list_on/fhd0tpy/,1,"This user spams this stuff. Don't get me wrong, I love drugs, but this isn't a drug subreddit it's an investment subreddit, and as anyone who happened to buy in on marijuana stocks can attest just cuz something is fun doesn't mean it is profitable.",2020-02-12
3,Holy_crow_above_me,fhd2hqi,/r/pennystocks/comments/f2je7p/psychedelic_drug_companies_gear_up_to_list_on/fhd2hqi/,1,GTFO,2020-02-12
4,Organic-Brotha,fhd2qc5,/r/pennystocks/comments/f2je7p/psychedelic_drug_companies_gear_up_to_list_on/fhd2qc5/,1,"I wasn’t all that interested until I read this 

“ Mind Medicine counts former Canopy Growth Corp. co-chief executive officer Bruce Linton as a director and Shark Tank star Kevin O’Leary as an investor.”

I love the people involved and I want in...
THE BRUCE IS LOOSE and I’m all for it",2020-02-12
5,Bobb95,fhd3a4l,/r/pennystocks/comments/f2je7p/psychedelic_drug_companies_gear_up_to_list_on/fhd3a4l/,1,"Because you bought the top. There's no psilocybin, ketamine or LSD stock yet.",2020-02-12
6,Roots_on_up,fhd3dqp,/r/pennystocks/comments/f2je7p/psychedelic_drug_companies_gear_up_to_list_on/fhd3dqp/,1,I didn't buy at all. It was a bad idea then and this is a bad idea now.,2020-02-12
7,Bobb95,fhd3oa7,/r/pennystocks/comments/f2je7p/psychedelic_drug_companies_gear_up_to_list_on/fhd3oa7/,1,"No, I'm saying you bought the marijuana stocks top, which is why you say it's not profitable. It was obviously very profitable for those who got in early.",2020-02-12
8,Roots_on_up,fhd407j,/r/pennystocks/comments/f2je7p/psychedelic_drug_companies_gear_up_to_list_on/fhd407j/,1,"Oh right, the old in and out, like me and your mom",2020-02-12
9,AzHighways,fhd4doe,/r/pennystocks/comments/f2je7p/psychedelic_drug_companies_gear_up_to_list_on/fhd4doe/,1,I made an absolute killing in 2012. Here we go again,2020-02-12
10,qwerty12345qazwsx,fhd4z1n,/r/pennystocks/comments/f2ibko/myft_what_with_all_the_volume_report_just_came/fhd4z1n/,1,It had 868 million price?  How is that possible?,2020-02-12
11,Bobb95,fhd5yzu,/r/pennystocks/comments/f2je7p/psychedelic_drug_companies_gear_up_to_list_on/fhd5yzu/,1,"Serious question, how old are you? What do you think investing is, other than finding opportunities before the greater public?",2020-02-12
12,Roots_on_up,fhd8dod,/r/pennystocks/comments/f2je7p/psychedelic_drug_companies_gear_up_to_list_on/fhd8dod/,1,Sorry what was the serious question?,2020-02-12
13,crunchone,fhd8ou8,/r/pennystocks/comments/f2je7p/psychedelic_drug_companies_gear_up_to_list_on/fhd8ou8/,1,"As much of a wiener as OP is for constantly spamming this shit in this sub.

I plan on jumping into this for the quick swing in the beginning and I found out that MMED is going to list in the first week of March because of this",2020-02-12
14,NeoMalthus,fhd901x,/r/pennystocks/comments/f2je7p/psychedelic_drug_companies_gear_up_to_list_on/fhd901x/,1,Blocked. Druggy idiot get a fucking life you stupid shill.,2020-02-12
15,afrothunda104,fhd9dm0,/r/pennystocks/comments/f2je7p/psychedelic_drug_companies_gear_up_to_list_on/fhd9dm0/,1,It was a good idea then; I made a bunch of money.,2020-02-12
16,Bobb95,fhdabi6,/r/pennystocks/comments/f2je7p/psychedelic_drug_companies_gear_up_to_list_on/fhdabi6/,1,Instead of trying to be le quirky redditor try to think about why marijuana wasn't profitable for you,2020-02-12
17,Roots_on_up,fhdajco,/r/pennystocks/comments/f2je7p/psychedelic_drug_companies_gear_up_to_list_on/fhdajco/,1,The  le what? The same reason Tesla wasn't profitable for me. I didn't invest. How many times do people usually have to repeat themselves in a conversation with you?,2020-02-12
18,Bobb95,fhdaqy0,/r/pennystocks/comments/f2je7p/psychedelic_drug_companies_gear_up_to_list_on/fhdaqy0/,1,"Well your first comment in this thread contained this:  

&gt;as anyone who happened to buy in on marijuana stocks can attest just cuz something is fun doesn't mean it is profitable.

???",2020-02-12
19,MrVolatility,fhdd75s,/r/pennystocks/comments/f2je7p/psychedelic_drug_companies_gear_up_to_list_on/fhdd75s/,1,This guy would scam his own grand daughter,2020-02-12
20,JEAOMA,fhdfkqw,/r/pennystocks/comments/f2je7p/psychedelic_drug_companies_gear_up_to_list_on/fhdfkqw/,1,"Bet he bought into this one, if not let me get 35k shares of it and gift it to him",2020-02-12
21,dumbwaeguk,fhdgire,/r/pennystocks/comments/f2je7p/psychedelic_drug_companies_gear_up_to_list_on/fhdgire/,1,was there no growth in any weed stock after IPO? I think getting in early on psychs and then pulling out after the first peak might be a fair short-term strategy,2020-02-12
22,dumbwaeguk,fhdgt7o,/r/pennystocks/comments/f2je7p/psychedelic_drug_companies_gear_up_to_list_on/fhdgt7o/,1,give me the tl;dr on why you hate this guy so much,2020-02-12
23,pleasegivefreestuff,fhdhkwj,/r/pennystocks/comments/f2je7p/psychedelic_drug_companies_gear_up_to_list_on/fhdhkwj/,1,Been spamming investment subs recently. Could be a shill based off the frequency and repeated message,2020-02-12
24,dumbwaeguk,fhdi1qy,/r/pennystocks/comments/f2je7p/psychedelic_drug_companies_gear_up_to_list_on/fhdi1qy/,1,"Isn't all investment advice shilling? If someone buys a stock you're holding, it goes up in value.",2020-02-12
25,pleasegivefreestuff,fhdiov6,/r/pennystocks/comments/f2je7p/psychedelic_drug_companies_gear_up_to_list_on/fhdiov6/,1,Nah I’d say it stays as advice until you continuously spread the message to the point where you question their motives,2020-02-12
26,AntiGenocider,fhdkbfs,/r/pennystocks/comments/f2je7p/psychedelic_drug_companies_gear_up_to_list_on/fhdkbfs/,1,The Vancouver natural resource sector would have figured out these charlatans a lot quicker than the pot sector did.,2020-02-12
27,dumbwaeguk,fhdpksv,/r/pennystocks/comments/f2je7p/psychedelic_drug_companies_gear_up_to_list_on/fhdpksv/,1,Their motives are to drive up share value.,2020-02-12
28,TendiesSlut,fhe0kn1,/r/pennystocks/comments/f2je7p/psychedelic_drug_companies_gear_up_to_list_on/fhe0kn1/,1,This one might be good. 👀,2020-02-12
29,ryu123f,fhe5r0a,/r/pennystocks/comments/f2qmds/need_help_which_stocks_to_invest_in_long_term/fhe5r0a/,1,I’d recommend WORK if you haven’t already. It’s a long term move Imo,2020-02-12
30,BigEppyW,fhe60rd,/r/pennystocks/comments/f2qmds/need_help_which_stocks_to_invest_in_long_term/fhe60rd/,1,"Agreed. WORK is consistent income, but not glamorous.",2020-02-12
31,JWTrader,fhe69z3,/r/pennystocks/comments/f2qmds/need_help_which_stocks_to_invest_in_long_term/fhe69z3/,1,I'd recommend staying away from pennies long term.,2020-02-12
32,qwerty12345qazwsx,fhe8uiw,/r/pennystocks/comments/f2rfl9/021220_morning_watchlist/fhe8uiw/,1,Buy more ONTX?,2020-02-12
33,fatdungus,fhe8xuu,/r/pennystocks/comments/f2rfl9/021220_morning_watchlist/fhe8xuu/,1,Bought in at .56 was debating on buying more,2020-02-12
34,Greedy_Chemistry,fhe9zt5,/r/pennystocks/comments/f2rfl9/021220_morning_watchlist/fhe9zt5/,1,"I bought when it was around .70, and then more around .50, debating whether or not to grab more, just waiting on that info from yesterdays conference to really come out and see some movement.

&amp;#x200B;

Currently in the red though so?",2020-02-12
35,zrivers,fheb6cn,/r/pennystocks/comments/f2rfl9/021220_morning_watchlist/fheb6cn/,1,It’s not dropping below it’s resistance at .47,2020-02-12
36,meowoofmeow,fheb8an,/r/pennystocks/comments/f2rfl9/021220_morning_watchlist/fheb8an/,1,Waiting for the press conference to sell AIM or sell now since it's high?,2020-02-12
37,kmg6284,fhecn04,/r/pennystocks/comments/f2rfl9/021220_morning_watchlist/fhecn04/,1,"doing well on $AIM now, thanks to this sub.",2020-02-12
38,cocoaflavorbutthole,fhecntl,/r/pennystocks/comments/f2qmds/need_help_which_stocks_to_invest_in_long_term/fhecntl/,1,ATE.V,2020-02-12
39,inyourmomsbed,fhedzy8,/r/pennystocks/comments/f2rfl9/021220_morning_watchlist/fhedzy8/,1,Any idea what time it begins?,2020-02-12
40,JWTrader,fheespc,/r/pennystocks/comments/f2rfl9/021220_morning_watchlist/fheespc/,1,3pm et,2020-02-12
41,YoungOrthodox95,fhegfow,/r/pennystocks/comments/f2svjz/should_i_still_get_into_aim_today/fhegfow/,1,Wondering the same thing,2020-02-12
42,2words4me,fhegjzc,/r/pennystocks/comments/f2rfl9/021220_morning_watchlist/fhegjzc/,1,Sell a portion of your shares to hedge a bit if you don’t want to gamble on the presser.,2020-02-12
43,YoungOrthodox95,fhegkd0,/r/pennystocks/comments/f2rfl9/021220_morning_watchlist/fhegkd0/,1,Too late to buy into AIM?,2020-02-12
44,Jaxon9182,fhegkwe,/r/pennystocks/comments/f2svjz/should_i_still_get_into_aim_today/fhegkwe/,1,Feels like we missed it imo,2020-02-12
45,Organic-Brotha,fheho1u,/r/pennystocks/comments/f2sdy2/if_you_havent_done_so_already_get_out_of_byoc/fheho1u/,1,Very rarely do you see people on this sub openly admit mistakes or make retractions. You sir get my upvote,2020-02-12
46,AverageJoeTrader40,fhei94h,/r/pennystocks/comments/f2sdy2/if_you_havent_done_so_already_get_out_of_byoc/fhei94h/,1,"I dont usually post tickers because I dont like people losing money due to me. However, if I do, I will accept my shame.",2020-02-12
47,Greedy_Chemistry,fheifkf,/r/pennystocks/comments/f2svjz/should_i_still_get_into_aim_today/fheifkf/,1,"I got in yesterday at 1.01 and sold off at 1.50, a profit is a profit to me!",2020-02-12
48,Aezu,fheimjd,/r/pennystocks/comments/f2svjz/should_i_still_get_into_aim_today/fheimjd/,1,"Shot up without really any major catalyst. Bought in at 1$, sold at 1.42 which covered my investment. Sitting at 1 contact basically free stock rn. Just gonna observe but it's gonna pullback for sure.",2020-02-12
49,Jaxon9182,fhejho6,/r/pennystocks/comments/f2tdvy/codx_and_ontx/fhejho6/,1,ONTX might go back up in anticipation for the conference next weekend,2020-02-12
50,youvebeengreggd,fhejy2f,/r/pennystocks/comments/f2sdy2/if_you_havent_done_so_already_get_out_of_byoc/fhejy2f/,1,"Hey man, you're not responsible for people buying into a ""tip"". Especially if you then post a warning about how you got duped.

Even if you were a ""shill"" this is still nice to see.",2020-02-12
51,Greedy_Chemistry,fhek1cj,/r/pennystocks/comments/f2tdvy/codx_and_ontx/fhek1cj/,1,I thought yesterday’s conference would move it around more. Let’s hope for next weekend,2020-02-12
52,aleden28281,fhek4hu,/r/pennystocks/comments/f2sdy2/if_you_havent_done_so_already_get_out_of_byoc/fhek4hu/,1,"No issue dude, no way u could have known. I experienced the same thing with TEUM. On paper it was experiencing explosive growth in revenue but as was revealed several months ago, they had apparently inflated their revenues for almost 2 years by over 40%. This tanked the stock 60% in one day and it had lost even more in the days beforehand. Luckily the CEO was removed but I’m still super wary of the company. It sucks when shit like this happens but there’s almost no way of knowing it unless you’re an insider.",2020-02-12
53,flyyoufools97,fhekgti,/r/pennystocks/comments/f2sdy2/if_you_havent_done_so_already_get_out_of_byoc/fhekgti/,1,Upvoting so you get more visibility!,2020-02-12
54,AverageJoeTrader40,fhelukp,/r/pennystocks/comments/f2sdy2/if_you_havent_done_so_already_get_out_of_byoc/fhelukp/,1,I really hope the CEO of BYOC is removed. Since he has taken over he has done his best to screw over investors.,2020-02-12
55,aleden28281,fhemo5n,/r/pennystocks/comments/f2sdy2/if_you_havent_done_so_already_get_out_of_byoc/fhemo5n/,1,"Yea, unfortunately there are lots of companies like this with CEOs whose whole purpose is to continuously squeeze money out of investors based on false pretenses and don’t have any intention to further the company in terms of financial success. The business isn’t to sell products or services, it’s to mislead people into giving them money. Fucked up.",2020-02-12
56,ghettoemt,fheno8j,/r/pennystocks/comments/f2tdvy/codx_and_ontx/fheno8j/,3,"I’m in on ONTX at .41. Wanted to take my profits yesterday but got greedy. Now I’ll let it ride til the next conference and hope for the best. If nothing happens there, I’ll hold on til June.",2020-02-12
57,Greedy_Chemistry,fhenpis,/r/pennystocks/comments/f2tdvy/codx_and_ontx/fhenpis/,1,"Yup that’s my game plan, not a bad plan at that",2020-02-12
58,craigstercraig,fhent5o,/r/pennystocks/comments/f2svjz/should_i_still_get_into_aim_today/fhent5o/,1,"I’d say there’s likely to be a sell off at the interview, or at least its 50/50. I wouldn’t risk it at this point. I’d consider looking at spwr, its high atm so maybe wait for a dip, and sell at or pay close attention to the eps at 4:30",2020-02-12
59,AshTheDead1te,fheq2jc,/r/pennystocks/comments/f2u15h/ontx_ogen_mistakes/fheq2jc/,1,"How high do you think ONTX will go up? I bought in at $.47, so anything is a profit if it stays above but want to pull out obviously best time.",2020-02-12
60,BigPoppaTrav,fheq7mu,/r/pennystocks/comments/f2svjz/should_i_still_get_into_aim_today/fheq7mu/,1,Think it's worth buying again at the dip? I bought at 1.06 and sold at 1.43!,2020-02-12
61,Jaxon9182,fheqhjq,/r/pennystocks/comments/f2tdvy/codx_and_ontx/fheqhjq/,1,I jumped back in ONTX at 0.5199 and feel good that it will climb up again,2020-02-12
62,vantyle,fheqj31,/r/pennystocks/comments/f2u15h/ontx_ogen_mistakes/fheqj31/,1,I'm right there with you. I was not expecting that huge sell-off.,2020-02-12
63,Johan47x,fheqmqr,/r/pennystocks/comments/f2sdy2/if_you_havent_done_so_already_get_out_of_byoc/fheqmqr/,1,Thanks for the heads up!,2020-02-12
64,vantyle,fhequgo,/r/pennystocks/comments/f2tdvy/codx_and_ontx/fhequgo/,1,"I have both and missed getting out at the top. I'm not sure about ONTX, but I think CODX will hopefully rebound if the FDA approves their coronavirus test kits.",2020-02-12
65,RamzFanz,fhermcz,/r/pennystocks/comments/f2u15h/ontx_ogen_mistakes/fhermcz/,1,"That's very hard to say. 

This should be a volatile month with catalysts. I look at it from a swing play point of view. You're up nicely now and re-entries might be possible. It depends on your goals for this trade.

I'm hoping to be out before the final conference on the 26th though unless something changes.",2020-02-12
66,AshTheDead1te,fhersxg,/r/pennystocks/comments/f2u15h/ontx_ogen_mistakes/fhersxg/,1,"Well a $1 would be nice but I will probably pull what I put in when it hits .70 and let the profit ride after that, can’t decide.",2020-02-12
67,RamzFanz,fhes0kp,/r/pennystocks/comments/f2u15h/ontx_ogen_mistakes/fhes0kp/,1,"Yeah, that was a huge overreaction from the hype/panic traders.

I still expect to exit in the high .60's/low .70's at some point before the end of February, but we shall see.

Great volume, several catalysts, and it's on a lot of people's radar.",2020-02-12
68,Jaxon9182,fhescxg,/r/pennystocks/comments/f2u15h/ontx_ogen_mistakes/fhescxg/,2,I bought into ONTX this morning and think I'll make a nice profit throughout this week,2020-02-12
69,RamzFanz,fhesqsk,/r/pennystocks/comments/f2u15h/ontx_ogen_mistakes/fhesqsk/,1,"Yeah, if I had exited wisely, I would have bought right back in on that drop. This should be a volatile month for swinging.",2020-02-12
70,RamzFanz,fhet213,/r/pennystocks/comments/f2u15h/ontx_ogen_mistakes/fhet213/,2,"I'll be surprised if it hits $1 before P3 results.

It seems to me it would take unexpected catalysts.

Good luck!",2020-02-12
71,Aezu,fhetp46,/r/pennystocks/comments/f2svjz/should_i_still_get_into_aim_today/fhetp46/,1,If you're trading for the day most likely yeah. I'd say under 1.40,2020-02-12
72,RamzFanz,fhevouh,/r/pennystocks/comments/f2je7p/psychedelic_drug_companies_gear_up_to_list_on/fhevouh/,1,"...which is spamming for their own selfish purposes, not to give pertinent advice to the community.

It doesn't take a post every day pumping a stock or sector to inform others.

So, no, not all advice is shilling. I share information when I think I've found a good trade, never to drive up the price, which almost couldn't even happen from posting here.

Spamming is of no value to us.",2020-02-12
73,RamzFanz,fhewcrb,/r/pennystocks/comments/f2tdvy/codx_and_ontx/fhewcrb/,1,"It ran from .38 to .75 in 5 trading days.

You really expected more?",2020-02-12
74,FunnyFisherman1,fhez5ln,/r/pennystocks/comments/f2sdy2/if_you_havent_done_so_already_get_out_of_byoc/fhez5ln/,1,OMG story of my life. Oh a penny stock that isn’t worth a shit...what’s the next “sure thing”?,2020-02-12
75,czubizzle,fhezoha,/r/pennystocks/comments/f2u15h/ontx_ogen_mistakes/fhezoha/,1,"A lesson I learned (the hard way) is that playing a run-up AND playing a reaction seldom works out in your favor. If you're seeing pre-anticipatory run-up and you want to ride it, then do so but be wary that the market will probably correct itself after said anticipation ends....case and point: ontx had a good run up because of an investor meeting yesterday and then a selloff/correction right after.",2020-02-12
76,AverageJoeTrader40,fhf0bqs,/r/pennystocks/comments/f2sdy2/if_you_havent_done_so_already_get_out_of_byoc/fhf0bqs/,1,Being an asshole to people trying to help and be proactive. That's a great way to get ahead in life.,2020-02-12
77,Greedy_Chemistry,fhf1wwt,/r/pennystocks/comments/f2tdvy/codx_and_ontx/fhf1wwt/,1,Not necessarily more. But to go up back around .70 due to the conference buzz was sort of expected. Trust me when I say I’m playing around with small amounts to get a better understanding of the market and resistance.,2020-02-12
78,Jaxon9182,fhf5kan,/r/pennystocks/comments/f2u15h/ontx_ogen_mistakes/fhf5kan/,1,"It should, if it hits 0.60 today then I'm selling it and will wait for the next dip, otherwise I'll hold out, already up 9% for me today (gotta love penny stocks)",2020-02-12
79,worldrobotdomination,fhf5oal,/r/pennystocks/comments/f2t0us/digif_crypto_boosting_this_stock_up_100/fhf5oal/,1,DIGAF,2020-02-12
80,pleasegivefreestuff,fhf78xq,/r/pennystocks/comments/f2sdy2/if_you_havent_done_so_already_get_out_of_byoc/fhf78xq/,1,Good on you taking the high road,2020-02-12
81,SpammerPenguin,fhf7mcv,/r/pennystocks/comments/f2rfl9/021220_morning_watchlist/fhf7mcv/,1,"So all of my plays today have pretty much come to a close. Today was my first day going after stocks from my own personal watch list. Overall it went pretty well! 

I bought in ABEO at 3.06 and sold at 3.25, DRRX at 2.01 and sold at 2.1, and I'm currently in LCTX at 1.52. Not expecting much to happen there but they have a showing on the 18th so I;m expecting a bump in the coming days.",2020-02-12
82,AverageJoeTrader40,fhf87j1,/r/pennystocks/comments/f2sdy2/if_you_havent_done_so_already_get_out_of_byoc/fhf87j1/,1,That was not the first draft response haha,2020-02-12
83,skooch98,fhf8xys,/r/pennystocks/comments/f2wyws/aabb_worth_the_risk/fhf8xys/,1,Been adding a ton in .0020 - .0030 channel. Lots of volume and company seems undervalued.,2020-02-12
84,mmelnik,fhf94e4,/r/pennystocks/comments/f2x9v4/new_to_this_whats_hot_and_why/fhf94e4/,2,Just do some scrolling on stock subs. You’ll figure it out soon enough.,2020-02-12
85,skooch98,fhf9rdm,/r/pennystocks/comments/f2wyws/aabb_worth_the_risk/fhf9rdm/,1,"Think if we break .0030s on volume, it’ll take off",2020-02-12
86,bkmunsey,fhfeic9,/r/pennystocks/comments/f2wyws/aabb_worth_the_risk/fhfeic9/,1,"Just bought 150000 to start, will probably pick up more and hope for .01 in the future haha",2020-02-12
87,DarthCrackers,fhfidxi,/r/pennystocks/comments/f2vlpj/mgen/fhfidxi/,2,might still be a bit risky entering now before you see a confirmed uptrend. Could just keep falling. It spiked because f good news and now its correcting. Might want to wait more more news to by in or wait for a couple days in the green before buying in. just my conservative opinion. happy trading!,2020-02-12
88,kmunro1984,fhfjg0q,/r/pennystocks/comments/f2vlpj/mgen/fhfjg0q/,1,Much appreciated,2020-02-12
89,HarshTruth69,fhfm0mg,/r/pennystocks/comments/f2qmds/need_help_which_stocks_to_invest_in_long_term/fhfm0mg/,1,long term for pennies is like 3 days... on my paper trading I bought INPX at .5 it tanked by half almost but I held onto it cause I could feel it going up a lot and sure enough on the 6th it exploded and I could have made 52X my money if it was a real trade but it's fine I still have something to look forward to,2020-02-12
90,KingMulah,fhfmrqh,/r/pennystocks/comments/f2zag8/anyone_manage_to_get_from_100k_to_2m/fhfmrqh/,4,No. We are all poor there is no hope.,2020-02-12
91,qwerty12345qazwsx,fhfms56,/r/pennystocks/comments/f2zag8/anyone_manage_to_get_from_100k_to_2m/fhfms56/,3,So you mean you're spending all your $100k on penny stocks?,2020-02-12
92,leftoutcast,fhfn8g0,/r/pennystocks/comments/f2zag8/anyone_manage_to_get_from_100k_to_2m/fhfn8g0/,1,"Look at SBES,UNVC,ENRT,these are very close to making millionaires out of lots of people.",2020-02-12
93,HarshTruth69,fhfn96x,/r/pennystocks/comments/f2zag8/anyone_manage_to_get_from_100k_to_2m/fhfn96x/,-1,"No I'm fundraising atm but I'll have 200k or more and I'm going to risk at least 100k

If I did it for real when I started my sim paper trading account I would have 5.2 million right now and it would have taken 3 days [ lol ] [ inpx .5 buy in 20.00 sell in on the 6th ]

EZ come ez go

It's indicated in my birth chart that windfalls could happen and I'm still a big NOOB at stocks and something intuitively told me you need to buy INPX at .5 for all your 100K$ sim money and I did and it tanked to almost half shortly after but I knew to hold on to it and it raised dramatically on the 6th but had a reverse split on the 7th 

I didn't check it on the 6th at all which I obviously wouldn't do if it was real money and I would have effectively turned the 100K into 5.2 million... but yes I would risk a lot on penny stocks for the chance at a windfall",2020-02-12
94,HarshTruth69,fhfna4g,/r/pennystocks/comments/f2zag8/anyone_manage_to_get_from_100k_to_2m/fhfna4g/,2,lol FeelsBadMan,2020-02-12
95,Ramon_1990,fhfnd7a,/r/pennystocks/comments/f2u15h/ontx_ogen_mistakes/fhfnd7a/,1,I’m down £19k on both...,2020-02-12
96,pleasegivefreestuff,fhfneq1,/r/pennystocks/comments/f2zag8/anyone_manage_to_get_from_100k_to_2m/fhfneq1/,2,IMO if you have that type of money and obviously willing to take the risk. Do options. Maximum growth potential over a short time,2020-02-12
97,HarshTruth69,fhfnetr,/r/pennystocks/comments/f2zag8/anyone_manage_to_get_from_100k_to_2m/fhfnetr/,1,"Why do you say that and I still don't know much about stocks in general much less penny stocks

But I Do know penny stocks carry more danger and potential windfalls and some companies are basically trying to scam",2020-02-12
98,HarshTruth69,fhfnigj,/r/pennystocks/comments/f2zag8/anyone_manage_to_get_from_100k_to_2m/fhfnigj/,1,Any thoughts on how I can go from 100K to 5m+ ?,2020-02-12
99,leftoutcast,fhfnjyk,/r/pennystocks/comments/f2zag8/anyone_manage_to_get_from_100k_to_2m/fhfnjyk/,1,"I follow these guys on twitter,have made buys from their advice but bailed out too soon,uh AMD for instance.Im sticking with them this time.",2020-02-12
100,leftoutcast,fhfnt88,/r/pennystocks/comments/f2zag8/anyone_manage_to_get_from_100k_to_2m/fhfnt88/,1,"Buy 1m shares of UNVC for around 10k right now,that should give you around 1 miliion shares,its gonna go to at least 5.00 a share.",2020-02-12
101,HarshTruth69,fhfnwyp,/r/pennystocks/comments/f2zag8/anyone_manage_to_get_from_100k_to_2m/fhfnwyp/,1,What is options and where can I learn good information about it ?,2020-02-12
102,HarshTruth69,fhfnxzv,/r/pennystocks/comments/f2zag8/anyone_manage_to_get_from_100k_to_2m/fhfnxzv/,1,be careful they aren't pump and dump hypers and then they dump before you dump,2020-02-12
103,HarshTruth69,fhfo0cp,/r/pennystocks/comments/f2zag8/anyone_manage_to_get_from_100k_to_2m/fhfo0cp/,1,How do you know or why do you believe it will?,2020-02-12
104,HarshTruth69,fhfo33n,/r/pennystocks/comments/f2zag8/anyone_manage_to_get_from_100k_to_2m/fhfo33n/,1,"&gt; UNVC

univec right ? for .0093 ?",2020-02-12
105,leftoutcast,fhfo3zu,/r/pennystocks/comments/f2zag8/anyone_manage_to_get_from_100k_to_2m/fhfo3zu/,1,"No these guys are not,but people are trying though.Ive been in this one for 3 years im staying.",2020-02-12
106,HarshTruth69,fhfo4ym,/r/pennystocks/comments/f2zag8/anyone_manage_to_get_from_100k_to_2m/fhfo4ym/,1,I'm not sure about that but if it works for you let me know I would like to hear success stories,2020-02-12
107,leftoutcast,fhfo5mh,/r/pennystocks/comments/f2zag8/anyone_manage_to_get_from_100k_to_2m/fhfo5mh/,1,"Thats it,do you have twitter?",2020-02-12
108,HarshTruth69,fhfo78a,/r/pennystocks/comments/f2zag8/anyone_manage_to_get_from_100k_to_2m/fhfo78a/,1,I do have twitter,2020-02-12
109,leftoutcast,fhfo9gb,/r/pennystocks/comments/f2zag8/anyone_manage_to_get_from_100k_to_2m/fhfo9gb/,1,"Just research Dr.David Dalton,see what he going to do with a cannabis patch",2020-02-12
110,leftoutcast,fhfocto,/r/pennystocks/comments/f2zag8/anyone_manage_to_get_from_100k_to_2m/fhfocto/,1,"Search for Mikey1818,scroll through his profile see who interacts with him and what they talk about.",2020-02-12
111,HarshTruth69,fhfogta,/r/pennystocks/comments/f2zag8/anyone_manage_to_get_from_100k_to_2m/fhfogta/,1,should I Follow him or will doing that get me blocked?,2020-02-12
112,HarshTruth69,fhfoj3i,/r/pennystocks/comments/f2zag8/anyone_manage_to_get_from_100k_to_2m/fhfoj3i/,1,"&gt; Mikey1818

Is there a way to buy and sell penny stocks automatically once it hits a certain price?",2020-02-12
