,title,id,author,url,score,num_comments,text,date,link
0,Have you been trading for a long time but you couldn't make it yet ?,8ss3cb,Mr-Houssine,https://www.reddit.com/r/pennystocks/comments/8ss3cb/have_you_been_trading_for_a_long_time_but_you/,0,15,"Have you been trading for a long time but you couldn't make it yet ?

Have you bought a lot of courses and tried a lot of strategies but none of them worked ?

If so you're in the right place and i'm not here to sell you anything

Hi my name is Houssine and i've been in the trading space for 4 years now, The first three years i was trading forex but i didn't 
succeed and then i get into trading stocks in the fourth year and i've been trading in demo account for a long time and then i become a profitable stock trader thank god.

As you can see in the screenshots my success rate is more than 60% and From January to Mai i've made 6.321 USD risking 150 USD per trade but in the last two months i've doubled the risk.

January's Screenshot : http://prntscr.com/jxmgjq

February's Screenshot : http://prntscr.com/jxmhnu

March's Screenshot : http://prntscr.com/jxmhtd

April's Screenshot : http://prntscr.com/jxmi4q

Mai's Screenshot : http://prntscr.com/jxmics

Anaway the issue is that i've been struggling to get the capital to open a real account

So i thought i'll look for one person no more who's interested in learning to trade and i'll teach him FOR FREE one on one live through SKYPE.

In exchange you will share with me 35% from the Profit at the end of each month for the next 3 months in a row and then everybody goes his way.

But there are rules to be qualified

1- You need to have a background about trading stocks at least the basics 
2- You need to be fast at executing trades and familiar with hot keys

So if you're qualified send me a message at : damon.ffx@gmail.com",2018-06-21,https://www.reddit.com/r/pennystocks/comments/8ss3cb/have_you_been_trading_for_a_long_time_but_you/
1,BYOC BRVRF UCRP MLTC All Running 👌 Many catalysts coming on all 4,8ss0p4,CaptainWeee,https://www.reddit.com/r/pennystocks/comments/8ss0p4/byoc_brvrf_ucrp_mltc_all_running_many_catalysts/,1,0,[removed],2018-06-21,https://www.reddit.com/r/pennystocks/comments/8ss0p4/byoc_brvrf_ucrp_mltc_all_running_many_catalysts/
2,CELZ,8st6gy,roshanfre1,https://www.reddit.com/r/pennystocks/comments/8st6gy/celz/,9,3,Finally trading over $.03!,2018-06-21,https://www.reddit.com/r/pennystocks/comments/8st6gy/celz/
3,Anyone got a way in ToS to view where the volume is flowing?,8sswej,Teutonicz,https://www.reddit.com/r/pennystocks/comments/8sswej/anyone_got_a_way_in_tos_to_view_where_the_volume/,3,2,"Say I gotta list of 200 stocks. I want to see which one is getting the most volume... like rank them by the 2 minute candles

I want to see if the stock I am is getting its share of volume or if it is petering out relative to the rest of the 200 stocks on my watchlist",2018-06-21,https://www.reddit.com/r/pennystocks/comments/8sswej/anyone_got_a_way_in_tos_to_view_where_the_volume/
4,Come hangout live on Bulli$h $tock Alerts!,8ssl29,xlogit3k,https://www.reddit.com/r/pennystocks/comments/8ssl29/come_hangout_live_on_bullih_tock_alerts/,1,2,"Lots of people live right now talking about OTC stocks, come check it out. 


https://discord.gg/XPc5Rgv",2018-06-21,https://www.reddit.com/r/pennystocks/comments/8ssl29/come_hangout_live_on_bullih_tock_alerts/
5,Canadian marijuana legalization and MJ stocks- what do you think investors can expect to see in the sector and when?,8ssiiw,driv818,https://www.reddit.com/r/pennystocks/comments/8ssiiw/canadian_marijuana_legalization_and_mj_stocks/,1,0,[removed],2018-06-21,https://www.reddit.com/r/pennystocks/comments/8ssiiw/canadian_marijuana_legalization_and_mj_stocks/
6,Yet another BIOAQ thread,8ssbrb,quietboltaction,https://www.reddit.com/r/pennystocks/comments/8ssbrb/yet_another_bioaq_thread/,2,4,Down 27% since market opens.  Are people still holding? Cutting your losses now?  Just wondering peoples opinions again on this,2018-06-21,https://www.reddit.com/r/pennystocks/comments/8ssbrb/yet_another_bioaq_thread/
7,BVTK,8ssa28,cpt_Earl,https://www.reddit.com/r/pennystocks/comments/8ssa28/bvtk/,16,20,"I've owned BVTK for a while, waiting for it to take off. Does anyone know if this company is just fake news or what? They have pretty solid reports and revenues but nothing has happened. Is is just unheard of?",2018-06-21,https://www.reddit.com/r/pennystocks/comments/8ssa28/bvtk/
8,"The talk is ticker ABIO a Biotech company that is only .53 cents today by between will Go up to $2.07 There getting FDA.APPROVAL and The European Board of Cardiology just bought Shares in the company,and is sponsoring them, They know something BUY ABIO=$$$$$$$",8suia4,FollowmeMakeMillions,https://www.reddit.com/r/pennystocks/comments/8suia4/the_talk_is_ticker_abio_a_biotech_company_that_is/,0,6,"The talk is ticker ABIO a Biotech  company that is only .53 cents today by between will Go up to $2.07 There getting FDA.APPROVAL and The European Board of Cardiology  just bought Shares in the company,and is sponsoring  them, They know something  BUY ABIO=$$$$$$$",2018-06-21,https://www.reddit.com/r/pennystocks/comments/8suia4/the_talk_is_ticker_abio_a_biotech_company_that_is/
9,"June 21, 2018 Tomorrow's Daily /r/Pennystocks Discussion - What are your plays for Thursday??",8su43c,AutoModerator,https://www.reddit.com/r/pennystocks/comments/8su43c/june_21_2018_tomorrows_daily_rpennystocks/,2,2,"Please use this thread to discuss your plays of the day!

Since this thread is likely to fill up quickly, consider sorting the comments by ""new"" (instead of ""best"" or ""top"") to see the newest posts.
",2018-06-21,https://www.reddit.com/r/pennystocks/comments/8su43c/june_21_2018_tomorrows_daily_rpennystocks/
10,Lithium Chile – Why Its Undervalued?,8stxdp,TrueInvestor,https://www.reddit.com/r/pennystocks/comments/8stxdp/lithium_chile_why_its_undervalued/,5,4,"Lithium Chile Inc. (OTC:LTMCF), (TSX.V:LITH) stock has been pretty much range bound this month so far, trading mostly between $0.74 and $0.79. Still, in the last one-month, the stock has returned over 14&amp;#37;. Sociedad Quimica y Minera De Chile (SQM) dropped more than 10&amp;#37; in the same period.",2018-06-21,https://www.reddit.com/r/pennystocks/comments/8stxdp/lithium_chile_why_its_undervalued/
11,Does $HMNY have a future?,8sthap,Petroselinum_,https://www.reddit.com/r/pennystocks/comments/8sthap/does_hmny_have_a_future/,7,24,"Or is this thing headed to 0?

$AMC has launched a competing subscription product, and so have several other movie theater companies. Some say MovePass' competitors' subscription services are inferior, but that's debatable. After all, AMC's subscription service, for example, offers 3 movies per week, unlimited viewings of the same film, discounted food/drink + free upgrades, and all that for just $19.95. A lot more flexibility and added perks for a few more bucks a month. Plus, one movie a day vs. 3 movies a week isn't a huge difference. Unless consumers are intentionally trying to milk the life out of MoviePass, nobody is realistically going  to see seven films a week, let alone even 3.

The point is, $HMNY looks like it's in really bad shape. The stock has been crazily volatile for the pass few days, their cash burn rate has nearly doubled, they might need $1.2b more in capital, stock dilution is occurring at a crazy rate, and they're floating a reverse stock split in June (which will almost definitely lead to further downside).

So on to the question - does $HMNY even have a future? Is the $12-$15 target price by analysts on TipRanks even legit? Or is this the end of MoviePass as we know? 

TL;DR $HMNY doesn't look too hot right now, and MoviePass is getting pummeled. Reverse split in the mix. What to do?
   ",2018-06-21,https://www.reddit.com/r/pennystocks/comments/8sthap/does_hmny_have_a_future/
12,"The talk is ticker ABIO a Biotech company that is only .53 cents today by between will Go up to $2.07 There getting FDA.APPROVAL and The European Board of Cardiology just bought Shares in the company,and is sponsoring them, They know something BUY ABIO=$$$$$$$",8stgy4,FollowmeMakeMillions,https://www.reddit.com/r/pennystocks/comments/8stgy4/the_talk_is_ticker_abio_a_biotech_company_that_is/,0,6,"The talk is ticker ABIO a Biotech  company that is only .53 cents today by between will Go up to $2.07 There getting FDA.APPROVAL and The European Board of Cardiology  just bought Shares in the company,and is sponsoring  them, They know something  BUY ABIO=$$$$$$$",2018-06-21,https://www.reddit.com/r/pennystocks/comments/8stgy4/the_talk_is_ticker_abio_a_biotech_company_that_is/
13,"I have $10 spare from my actual stocks, what should I buy?",8sobo0,ALT173869,https://www.reddit.com/r/pennystocks/comments/8sobo0/i_have_10_spare_from_my_actual_stocks_what_should/,1,0,[removed],2018-06-21,https://www.reddit.com/r/pennystocks/comments/8sobo0/i_have_10_spare_from_my_actual_stocks_what_should/
