,title,id,author,url,score,num_comments,text,date,link
0,VIBI next huge runner,b7cxny,silverlakes123,https://www.reddit.com/r/pennystocks/comments/b7cxny/vibi_next_huge_runner/,8,8,"VIBI Has a 52 week high of .69! Dilution ended Friday, as of March 28th the OS was only 597 million. Patent recently approved, watch for huge news to come out. https://www.otcmarkets.com/stock/VIBI/news/Vilacto-Bio-Canada-Patent-LACTOACTIVE-Granted?id=221596 Carmen Electra developed a skin care line with them https://www.tripveel.com/tripveel/carmen-electra-vilact-skincare 

https://twitter.com/silverlakes123/status/1111995303786356737?s=21

VIBI at the Oscars this year!!! This is about to retest the 52 week high! https://m.youtube.com/watch?v=GZdfHqov6nE&amp;feature=youtu.be",2019-03-30,https://www.reddit.com/r/pennystocks/comments/b7cxny/vibi_next_huge_runner/
1,screener for revenue,b7cf4r,scatfestshitparty,https://www.reddit.com/r/pennystocks/comments/b7cf4r/screener_for_revenue/,18,6,Does anyone know of any screener (paid or otherwise) where I can filter by revenue for a particular year?  (I'm focusing on companies under the 50 million dollar value range.),2019-03-30,https://www.reddit.com/r/pennystocks/comments/b7cf4r/screener_for_revenue/
2,Cheapest penny stock available on Robinhood?,b75vt5,Calithrix,https://www.reddit.com/r/pennystocks/comments/b75vt5/cheapest_penny_stock_available_on_robinhood/,0,19,I don't care about the risk I just want to throw some money to say I have a thousand shares of a company. Only looking to spend $20 or something just for fun. Don't care if it all gets lost its better than smoking weed or going out to eat. ,2019-03-30,https://www.reddit.com/r/pennystocks/comments/b75vt5/cheapest_penny_stock_available_on_robinhood/
3,FDA Approval Calendar,b74x7v,Leonidas_4,https://www.reddit.com/r/pennystocks/comments/b74x7v/fda_approval_calendar/,5,3,"Hello All,

Just wondering if anyone has preferred sites/sources that they use when searching for catalysts such as FDA Approval calendars ect. Thank you!",2019-03-30,https://www.reddit.com/r/pennystocks/comments/b74x7v/fda_approval_calendar/
4,"No PDT, margin broker with low fees?",b7fzpl,KomandoMetz,https://www.reddit.com/r/pennystocks/comments/b7fzpl/no_pdt_margin_broker_with_low_fees/,4,13,"Title. I'm looking for a broker that has no PDT and offers margin, 5:1 or more.
Preferably low order fees. Monthly platform/software fees are okish I guess.
Are there brokers out there to offer this kind of stuff?
I've been looking for a while now and can't seem to find any.
I'm not US. I'm from EU.
Would be great if someone could give advice!
Greetings 🙂",2019-03-30,https://www.reddit.com/r/pennystocks/comments/b7fzpl/no_pdt_margin_broker_with_low_fees/
5,tim sykes dvds for sale take advantage or youll miss out. read text,b76cc0,Bigmeechlui,https://www.reddit.com/r/pennystocks/comments/b76cc0/tim_sykes_dvds_for_sale_take_advantage_or_youll/,0,4," Selling all of Steven Dux, Tim Grittani, and Timothy Sykes stock trading technique DVDs All Digitial  I have all of the DVDs all digital for sell very CHEAP. Msg me or email me BEFORE BUYING at jloja13@icloud.com ",2019-03-30,https://www.reddit.com/r/pennystocks/comments/b76cc0/tim_sykes_dvds_for_sale_take_advantage_or_youll/
6,KULR Technology Group (OTCQB: KUTG) 10-K is out,b7dzaq,supernova2020,https://www.reddit.com/r/pennystocks/comments/b7dzaq/kulr_technology_group_otcqb_kutg_10k_is_out/,1,2,"KUTG 10-K for fiscal year ended 12/31/18 is out. The Company is focused on E-Mobility (electric transportation) markets, which perhaps represents a logical progression from the high-performance aerospace market solutions it has provided in the past. The Company also speaks to potential synergistic acquisitions as part of its growth strategy. 

 [https://www.sec.gov/Archives/edgar/data/1662684/000114420419017012/tv516626\_10k.htm](https://www.sec.gov/Archives/edgar/data/1662684/000114420419017012/tv516626_10k.htm)   
",2019-03-30,https://www.reddit.com/r/pennystocks/comments/b7dzaq/kulr_technology_group_otcqb_kutg_10k_is_out/
7,Lode-,b7a5nq,KennyKray,https://www.reddit.com/r/pennystocks/comments/b7a5nq/lode/,0,8,"I wanna know what you all think about Lode.  Dont waste my time telling me Bullshit, I wanna know what you Think.  If you dont often have thoughts of your own, I'm not talking to you.  

Do you have ideas on Price Target, Timeframe,  Likelyhood of all of these transactions going through.  Timeframe of when we will see a 43-101. Any other concerns, comments or thoughts.


Full Disclosure I have 20k shares of Lode",2019-03-30,https://www.reddit.com/r/pennystocks/comments/b7a5nq/lode/
8,What's everyones take on VYST?,b79dub,gwaxler95,https://www.reddit.com/r/pennystocks/comments/b79dub/whats_everyones_take_on_vyst/,1,2,VYST to be or not to bee,2019-03-30,https://www.reddit.com/r/pennystocks/comments/b79dub/whats_everyones_take_on_vyst/
