,author,id,url,score,text,date
113,leftoutcast,fhfokv6,/r/pennystocks/comments/f2zag8/anyone_manage_to_get_from_100k_to_2m/fhfokv6/,1,"You can follow him,he will answer questions if you want,very friendly.",2020-02-12
114,HarshTruth69,fhfonb9,/r/pennystocks/comments/f2zag8/anyone_manage_to_get_from_100k_to_2m/fhfonb9/,1,Can't find much on mikey1818,2020-02-12
115,leftoutcast,fhfoo3n,/r/pennystocks/comments/f2zag8/anyone_manage_to_get_from_100k_to_2m/fhfoo3n/,1,"In my IRA from Schwab there is,depends on who your with.You set a limit for both.",2020-02-12
116,leftoutcast,fhfos2x,/r/pennystocks/comments/f2zag8/anyone_manage_to_get_from_100k_to_2m/fhfos2x/,1,@mikeyt1836,2020-02-12
117,HarshTruth69,fhfowzl,/r/pennystocks/comments/f2zag8/anyone_manage_to_get_from_100k_to_2m/fhfowzl/,1,"&gt; IRA from Schwab 

What is this?",2020-02-12
118,HarshTruth69,fhfoxlo,/r/pennystocks/comments/f2zag8/anyone_manage_to_get_from_100k_to_2m/fhfoxlo/,1,"&gt; @mikeyt1836

ok one sec checking it out now",2020-02-12
119,JHay1984,fhfoxlz,/r/pennystocks/comments/f2wyws/aabb_worth_the_risk/fhfoxlz/,1,The question is do you feel like tying up $500 to make $5 in 6 months?,2020-02-12
120,leftoutcast,fhfoy7o,/r/pennystocks/comments/f2zag8/anyone_manage_to_get_from_100k_to_2m/fhfoy7o/,1,Are you in the states?,2020-02-12
121,HarshTruth69,fhfp49j,/r/pennystocks/comments/f2zag8/anyone_manage_to_get_from_100k_to_2m/fhfp49j/,1,I am--VA,2020-02-12
122,leftoutcast,fhfpapw,/r/pennystocks/comments/f2zag8/anyone_manage_to_get_from_100k_to_2m/fhfpapw/,1,"Ok,i talk to a lot of foreigners on here,anyway Individual retirement account,similiar to a 401-k.Buy and sell but not frequently like a day trader.You dont pay tax on the proceeds until you withdraw it.",2020-02-12
123,HarshTruth69,fhfpi5i,/r/pennystocks/comments/f2zag8/anyone_manage_to_get_from_100k_to_2m/fhfpi5i/,1,Hmm I'll send u a chat message,2020-02-12
124,leftoutcast,fhfpkgo,/r/pennystocks/comments/f2zag8/anyone_manage_to_get_from_100k_to_2m/fhfpkgo/,1,That be better,2020-02-12
125,bkmunsey,fhfqhsv,/r/pennystocks/comments/f2wyws/aabb_worth_the_risk/fhfqhsv/,1,"I'm not foreseeing making $5, however it does only rise a tenth of a cent or whatever then I will cut it loose. I do plan to load more",2020-02-12
126,qwerty12345qazwsx,fhfsaba,/r/pennystocks/comments/f2zag8/anyone_manage_to_get_from_100k_to_2m/fhfsaba/,1,That's the disadvantage of paper trading.  You don't have the pressure/emotion and you can freely buy any penny stock and say that you made money without risk.,2020-02-12
127,rabbitfoot442,fhfsiaf,/r/pennystocks/comments/f2zag8/anyone_manage_to_get_from_100k_to_2m/fhfsiaf/,1,"You'll need about 10MM to turn that into 2MM with option ... I'm going to save you a lifetime of hell ,stay away from option !",2020-02-12
128,RZN_AZ,fhfsvzo,/r/pennystocks/comments/f2zag8/anyone_manage_to_get_from_100k_to_2m/fhfsvzo/,1,Wait till the market has election pull back,2020-02-12
129,HarshTruth69,fhfu3ra,/r/pennystocks/comments/f2zag8/anyone_manage_to_get_from_100k_to_2m/fhfu3ra/,1,Yeah :/,2020-02-12
130,TheBazaarTrades,fhfuwto,/r/pennystocks/comments/f2sdy2/if_you_havent_done_so_already_get_out_of_byoc/fhfuwto/,1,Well said. I was worried if this was BIOC I read it wrong.,2020-02-12
131,snowowl2002,fhfwch6,/r/pennystocks/comments/f2sdy2/if_you_havent_done_so_already_get_out_of_byoc/fhfwch6/,1,Thanks for info,2020-02-12
132,scarface910,fhfyxfz,/r/pennystocks/comments/f2sdy2/if_you_havent_done_so_already_get_out_of_byoc/fhfyxfz/,1,Because most of the time those people are also intentionally feeding false information. OP just has integrity,2020-02-12
133,jshea621,fhfzcdz,/r/pennystocks/comments/f2zag8/anyone_manage_to_get_from_100k_to_2m/fhfzcdz/,1,YouTube and r/options r/wallstreetbets for your gains or losses. Or both,2020-02-12
134,DarthCrackers,fhg02bu,/r/pennystocks/comments/f30lqc/keep_an_eye_on_fnhi/fhg02bu/,1,What made it spike today? Didn't see any recent news pop up.,2020-02-12
135,TastyFriedChicken,fhg1g4f,/r/pennystocks/comments/f2sdy2/if_you_havent_done_so_already_get_out_of_byoc/fhg1g4f/,1,I got out around .003 yesterday. So I still made a nice return on this stock overall.,2020-02-12
136,leadrain86,fhg1hfe,/r/pennystocks/comments/f2sdy2/if_you_havent_done_so_already_get_out_of_byoc/fhg1hfe/,1,"This is why I have a $1 and above only rule.  If the company is so shitty, it can’t stay compliant, I want no part.",2020-02-12
137,leblaun,fhg1jd8,/r/pennystocks/comments/f30lqc/keep_an_eye_on_fnhi/fhg1jd8/,1,"The confirmation for sales on amazon came out recently, that may have caused the surge.",2020-02-12
138,DarthCrackers,fhg1la9,/r/pennystocks/comments/f2zag8/anyone_manage_to_get_from_100k_to_2m/fhg1la9/,1,take a look at r/wallstreetbets. Enter at your own risk though :),2020-02-12
139,TastyFriedChicken,fhg1n09,/r/pennystocks/comments/f2zrcl/dos_and_donts_of_penny_stock_investing/fhg1n09/,1,"Do:
Only invest a small portion of you portfolio.
Learn about other investment options at the same time. Like options.",2020-02-12
140,skooch98,fhg32n4,/r/pennystocks/comments/f2x9v4/new_to_this_whats_hot_and_why/fhg32n4/,1,"In sub pennies. AABB has been heavily accumulated in the past week and a half. In my opinion, once it breaks over .003, it’ll run.",2020-02-12
141,SgtLincolnOsiris7,fhg3eho,/r/pennystocks/comments/f2zag8/anyone_manage_to_get_from_100k_to_2m/fhg3eho/,1,"It’s a scam. One good way to get the true situation of a penny stock is to look them up on otcmarkets.com,  search for UNVC on there and you will see they are not even current in filing with the SEC, additionally there is actually a warning message that they might not be truthful and to invest with caution. 

You telling me a company who cant even do the proper paperwork for the sec is about to strike the deal of a lifetime with CVS!? You think CVS would do business with a company who currently has potential investors warned they could get screwed? This is how you know man. Also you’ll notice they are saying they are “sourcing” their CBD from Israel. This is another usual red flag, whenever an important aspect of the company is occurring or operating out of the country = lying because who is going to go to Israel to check.

Another red flag is constant “any day now news will hit, don’t be on the sidelines”, after many times of it not happening = means it’s not happening. Pumpers continue to pump while they offload enormous amount of shares while trying not to be obvious and tank the price. 

Many people who own a lot of shares of something will try to tell you it’s great so you will buy and buy, which drives the price up so they can sell to you, they are trying to make you a fool. 

Try not to be their fool",2020-02-12
142,MaStNu,fhg3wo9,/r/pennystocks/comments/f2zrcl/dos_and_donts_of_penny_stock_investing/fhg3wo9/,1,"Watch a stock for awhile jumping in... know the sector, watch level 2, research as much as you can, know the seasonal cycles, use smaller orders, be careful of low volume (easy to buy hard to sell)...",2020-02-12
143,superbeaver28,fhg5nyi,/r/pennystocks/comments/f2sdy2/if_you_havent_done_so_already_get_out_of_byoc/fhg5nyi/,1,Username checks out,2020-02-12
144,cheap-beers,fhg5vj6,/r/pennystocks/comments/f2sdy2/if_you_havent_done_so_already_get_out_of_byoc/fhg5vj6/,1,"My rule just depends on what market it trades on. no regulation means no investing lol, barring maybe some crazy exception",2020-02-12
145,leadrain86,fhg64oe,/r/pennystocks/comments/f2sdy2/if_you_havent_done_so_already_get_out_of_byoc/fhg64oe/,1,"Right, I just lost on a lot of trades on sub $1 stocks that were just doing every shady thing possible to try to get back above $1 and avoid resplitting. And really...I mainly trade $2 stocks and up, because even stocks between $1 and $2 do the same pump and dumps.  I find that once they clear $2 the hype is at least halfway legit and they are less likely to dump on me.",2020-02-12
146,thatsAChopbro,fhg8emo,/r/pennystocks/comments/f2zag8/anyone_manage_to_get_from_100k_to_2m/fhg8emo/,1,I went from 147.00 to 146.56 today,2020-02-12
147,HarshTruth69,fhgaz7i,/r/pennystocks/comments/f2zag8/anyone_manage_to_get_from_100k_to_2m/fhgaz7i/,1,xD,2020-02-12
148,HarshTruth69,fhgb2az,/r/pennystocks/comments/f2zag8/anyone_manage_to_get_from_100k_to_2m/fhgb2az/,1,I think so too and thanks for the info,2020-02-12
149,HarshTruth69,fhgb9ng,/r/pennystocks/comments/f2zag8/anyone_manage_to_get_from_100k_to_2m/fhgb9ng/,1,gotcha,2020-02-12
150,HarshTruth69,fhgba6m,/r/pennystocks/comments/f2zag8/anyone_manage_to_get_from_100k_to_2m/fhgba6m/,1,gotcha,2020-02-12
151,HarshTruth69,fhgbb5o,/r/pennystocks/comments/f2zrcl/dos_and_donts_of_penny_stock_investing/fhgbb5o/,1,I'm looking into options right now,2020-02-12
152,HarshTruth69,fhgbcur,/r/pennystocks/comments/f2zrcl/dos_and_donts_of_penny_stock_investing/fhgbcur/,1,gotcha,2020-02-12
153,HarshTruth69,fhgbeee,/r/pennystocks/comments/f2zag8/anyone_manage_to_get_from_100k_to_2m/fhgbeee/,1,Didn't know about OTCMarkets.com,2020-02-12
154,SgtLincolnOsiris7,fhgds8o,/r/pennystocks/comments/f2zag8/anyone_manage_to_get_from_100k_to_2m/fhgds8o/,1,"It’s the first thing I check. Saves a lot of time. If the company is not even current with their paperwork then I know there is no “deal of a lifetime”.  

A great thing about otcmarkets.com is that it is one of the few places where you can find the float of a stock. This is the second thing I look at. A company could be 100% legit with a great product but if there are 2 billion shares out in the float then it’s really hard for a companies stock price to be worth much.",2020-02-12
155,crappy_giraffe,fhgevub,/r/pennystocks/comments/f2sdy2/if_you_havent_done_so_already_get_out_of_byoc/fhgevub/,1,To no ones surprise.,2020-02-12
156,RamzFanz,fhgg3m6,/r/pennystocks/comments/f2u15h/ontx_ogen_mistakes/fhgg3m6/,1,Where did you enter?,2020-02-12
157,FilthyRedditses,fhggdmq,/r/pennystocks/comments/f2sdy2/if_you_havent_done_so_already_get_out_of_byoc/fhggdmq/,1,A shill? You mean like u/cannabisinvestor ?,2020-02-12
158,RamzFanz,fhggf4n,/r/pennystocks/comments/f2u15h/ontx_ogen_mistakes/fhggf4n/,1,"Yes, all true, but ONTX didn't have any of the expected news.

If they had announced a partnership as expected, it could have run for a day or two longer.

I normally sell the news, I just over-played it this time around.",2020-02-12
159,Capt__Obvious-_-,fhggsrd,/r/pennystocks/comments/f2sdy2/if_you_havent_done_so_already_get_out_of_byoc/fhggsrd/,1,"I lost $97,000.00
Thx for the tip.





Jkjk",2020-02-12
160,livestrong2209,fhgixf2,/r/pennystocks/comments/f2sdy2/if_you_havent_done_so_already_get_out_of_byoc/fhgixf2/,1,"Why would you get out of ""Bring Your Own Cock"". Really need to just double down and go balls deep into this one.",2020-02-12
161,crappy_giraffe,fhgjaa0,/r/pennystocks/comments/f30lqc/keep_an_eye_on_fnhi/fhgjaa0/,1,"""collects intellectual property"" hmmm",2020-02-12
162,livestrong2209,fhgjec2,/r/pennystocks/comments/f2sdy2/if_you_havent_done_so_already_get_out_of_byoc/fhgjec2/,1,"Why would anyone be feeding false information on penny stocks...

https://youtu.be/sxRStrx8xtc",2020-02-12
163,1141LLHH11,fhgmpfl,/r/pennystocks/comments/f2zag8/anyone_manage_to_get_from_100k_to_2m/fhgmpfl/,1,But 100 Tesla shares and you can probably hit half a million.,2020-02-12
164,KK198,fhgqrad,/r/pennystocks/comments/f30dk1/wow_igpk_filed_its_s1_new_chart_analysis_out_now/fhgqrad/,1,Do you seriously think they can get out from it?,2020-02-12
165,KK198,fhgre1l,/r/pennystocks/comments/f2zrcl/dos_and_donts_of_penny_stock_investing/fhgre1l/,1,"Do: day or swing trade
Dont: invest",2020-02-12
166,brad24_53,fhgvpve,/r/pennystocks/comments/f2sdy2/if_you_havent_done_so_already_get_out_of_byoc/fhgvpve/,1,That movie is a timeless classic.,2020-02-12
167,Martin_Birch,fhh36e8,/r/pennystocks/comments/f2zag8/anyone_manage_to_get_from_100k_to_2m/fhh36e8/,1,I was up about 800% in 2019 but I only started with $10k so it will take me a few years but that's cool as I am not in a hurry,2020-02-12
168,Ruffalobro,fhh4egj,/r/pennystocks/comments/f2sdy2/if_you_havent_done_so_already_get_out_of_byoc/fhh4egj/,1,How does anyone know really that he isn't shorting the stock?,2020-02-12
169,Dragnskull,fhh7ouo,/r/pennystocks/comments/f2sdy2/if_you_havent_done_so_already_get_out_of_byoc/fhh7ouo/,1,in the words of internet people everywhere: for the lul.,2020-02-12
170,FunnyFisherman1,fhhcaml,/r/pennystocks/comments/f2sdy2/if_you_havent_done_so_already_get_out_of_byoc/fhhcaml/,1,"Didn’t think I was being the a-hole, just frustrated at the whole penny stock thing. I do appreciate the help and DD that people do, but am I not allowed to be a little bit bitter at the whole thing? If not, fine I’ll just sit back and 🤬",2020-02-12
171,AverageJoeTrader40,fhhcgse,/r/pennystocks/comments/f2sdy2/if_you_havent_done_so_already_get_out_of_byoc/fhhcgse/,1,Glad to hear it!,2020-02-12
172,AverageJoeTrader40,fhhcn08,/r/pennystocks/comments/f2sdy2/if_you_havent_done_so_already_get_out_of_byoc/fhhcn08/,1,"Do you understand the requirements of shorting a penny? I'm trading byoc and dubs/trips, do you really think I have the capital required to short this? Come on now.",2020-02-12
173,AverageJoeTrader40,fhhcp5k,/r/pennystocks/comments/f2sdy2/if_you_havent_done_so_already_get_out_of_byoc/fhhcp5k/,1,"I was probably just being over sensitive, I'm very pissed off about this one. Sorry mate, GL to you.",2020-02-12
174,FunnyFisherman1,fhhcxbr,/r/pennystocks/comments/f2sdy2/if_you_havent_done_so_already_get_out_of_byoc/fhhcxbr/,1,"Yeah, you’d think I’d learn my lesson by now. I guess this is what a gambling addiction is like...if I could just dig myself out of this hole.😩",2020-02-12
175,Tim-jasper-jim,fhhku92,/r/pennystocks/comments/f30dk1/wow_igpk_filed_its_s1_new_chart_analysis_out_now/fhhku92/,1,I've got faith in it. No evidence what so ever tho besides the debt free status,2020-02-12
176,bttfchase,fhhojcw,/r/pennystocks/comments/f30lqc/keep_an_eye_on_fnhi/fhhojcw/,1,I've bought some as well. Probably won't let it get too high before selling. How long are you planning on holding?,2020-02-12
177,leblaun,fhhpk8h,/r/pennystocks/comments/f30lqc/keep_an_eye_on_fnhi/fhhpk8h/,1,Not sure. It hasn’t shown any signs of stopping. Today alone it’s hovering at about a 20% increase. Do you have a set date or price range?,2020-02-12
178,BrettaBmon,fhhq4sp,/r/pennystocks/comments/f30lqc/keep_an_eye_on_fnhi/fhhq4sp/,1,This going to peak or is there still time to buy in?,2020-02-12
179,bttfchase,fhhqghe,/r/pennystocks/comments/f30lqc/keep_an_eye_on_fnhi/fhhqghe/,1,No. I won't let it get too high. I'm kind of a newbie here and was given money from my father in law as a gift to invest and I want to try to make a small profit from it. Not will to be TOO risky right now,2020-02-12
180,leblaun,fhhquzt,/r/pennystocks/comments/f30lqc/keep_an_eye_on_fnhi/fhhquzt/,1,"I wouldn’t know. It’s grown significantly this week, but there isn’t much data to judge it off of. It seems like it’s in the correct industry to grow but you never know.",2020-02-12
181,leblaun,fhhqykn,/r/pennystocks/comments/f30lqc/keep_an_eye_on_fnhi/fhhqykn/,1,"Yeah, I mean if you do not invest too much into it there isn’t much risk. Unfortunately the company’s shares are new so it’s hard to judge its volatility or growth.",2020-02-12
182,BrettaBmon,fhhra7k,/r/pennystocks/comments/f30lqc/keep_an_eye_on_fnhi/fhhra7k/,1,Fair enough. I saw your post last night and didn’t think it would jump so fast this morning... thanks for the tip though!,2020-02-12
183,HarshTruth69,fhi36w5,/r/pennystocks/comments/f2zag8/anyone_manage_to_get_from_100k_to_2m/fhi36w5/,1,nice,2020-02-12
184,HarshTruth69,fhi3bve,/r/pennystocks/comments/f2zrcl/dos_and_donts_of_penny_stock_investing/fhi3bve/,1,I'm still a newbie what is swing trading? And day trading is within the same day usually right?,2020-02-12
185,HarshTruth69,fhi3cri,/r/pennystocks/comments/f2zag8/anyone_manage_to_get_from_100k_to_2m/fhi3cri/,1,too little lol,2020-02-12
186,HarshTruth69,fhi3il2,/r/pennystocks/comments/f2zag8/anyone_manage_to_get_from_100k_to_2m/fhi3il2/,1,what is float ? { Still a newbie },2020-02-12
187,SgtLincolnOsiris7,fhiaxmb,/r/pennystocks/comments/f2zag8/anyone_manage_to_get_from_100k_to_2m/fhiaxmb/,1,"The amount of stock available to the public. The amount of outstanding shares = insiders shares + public shares. 
Float = public shares",2020-02-12
188,tboydoboe,fhjwlsy,/r/pennystocks/comments/f2u15h/ontx_ogen_mistakes/fhjwlsy/,1,So how does everyone feel about ONTX now and on Friday tomorrow 2-14-2020. The drug is in Phase 3. Being used all over the world. When it’ll be approved by the FDA it just might take off. I’ve been hearing sometime this month the clearance will happen.: ) 🚀,2020-02-12
189,Cows_Go_Huh,fhlq1wq,/r/pennystocks/comments/f2zrcl/dos_and_donts_of_penny_stock_investing/fhlq1wq/,1,Swing is a few days to a month.,2020-02-12
190,HarshTruth69,fhn6u7i,/r/pennystocks/comments/f2zag8/anyone_manage_to_get_from_100k_to_2m/fhn6u7i/,1,gotcha,2020-02-12
191,RamzFanz,fhnfpn5,/r/pennystocks/comments/f2u15h/ontx_ogen_mistakes/fhnfpn5/,1,Results aren't due until June(ish).,2020-02-12
192,tboydoboe,fhnftso,/r/pennystocks/comments/f2u15h/ontx_ogen_mistakes/fhnftso/,1,Thank you.,2020-02-12
193,usafreefall1234,fhqfu9r,/r/pennystocks/comments/f2zag8/anyone_manage_to_get_from_100k_to_2m/fhqfu9r/,1,Someone on r/wallstreetbets made several million.. i dont remember how much.. r/wsbgod i think is who..,2020-02-12
194,HarshTruth69,fhqfzbn,/r/pennystocks/comments/f2zag8/anyone_manage_to_get_from_100k_to_2m/fhqfzbn/,1,nice but I heard wallstreetbets is meme-y and kinda not good,2020-02-12
195,usafreefall1234,fhqg1yf,/r/pennystocks/comments/f2zag8/anyone_manage_to_get_from_100k_to_2m/fhqg1yf/,1,Ive only been on it for about a week,2020-02-12
196,HarshTruth69,fhqyn90,/r/pennystocks/comments/f2zag8/anyone_manage_to_get_from_100k_to_2m/fhqyn90/,2,I have no idea so I'm not taking any action for better or worse... I'm still learning,2020-02-12
197,ItsEntirelyPosssible,fizmt6a,/r/pennystocks/comments/f2je7p/psychedelic_drug_companies_gear_up_to_list_on/fizmt6a/,1,Im still confused on how to trade this.  You cant buy neo only stocks on td ameritrade.  Ive looked at tons of neo listed stocks. If they trade on neo alone then you cant trade them with any old broker.  Any incite into this?,2020-02-12
198,ItsEntirelyPosssible,fizmup3,/r/pennystocks/comments/f2je7p/psychedelic_drug_companies_gear_up_to_list_on/fizmup3/,1,Im still confused on how to trade this.  You cant buy neo only stocks on td ameritrade.  Ive looked at tons of neo listed stocks. If they trade on neo alone then you cant trade them with any old broker.  Any incite into this?,2020-02-12
199,Bck2BckAAUNatlChamps,fvyqicr,/r/pennystocks/comments/f2zucz/any_of_you_holding_pwrmf/fvyqicr/,1,"Bump:  Been a while since I've heard much about this stock.  Yes, holding!  Curious if anyone has any new insights.",2020-02-12
