,author,id,url,score,text,date
0,Tylerrtien,e817ys0,/r/pennystocks/comments/9pes8y/hsgx_questions/e817ys0/,1,"Thats only if they dont get approval from FDA meeting. Id hold and wait until its closer to that date. Since youre up profit, you could sell some as it rise thru the week, and decide what to do with the rest on the 30th",2018-10-19
1,doingbig2017,e8198pw,/r/pennystocks/comments/9pes8y/hsgx_questions/e8198pw/,1,HOLD,2018-10-19
2,Sloom732,e81a9x8,/r/pennystocks/comments/9pes8y/hsgx_questions/e81a9x8/,1,"Find the DD on this subreddit. And make your decision from there. 
I'm in 400 share at .62 ~I'm holding til 1 and swing trade it from there. ",2018-10-19
3,ilyellow,e81ckuo,/r/pennystocks/comments/9pes8y/hsgx_questions/e81ckuo/,1,I bought at $0.51 and sold for $0.72. I am definitely not holding through data. I also won’t be surprised if it comes back down in the $0.50s range before data comes out and then I can buy back in and sell again before it’s released. ,2018-10-19
4,hiegear,e81dyfy,/r/pennystocks/comments/9pes8y/hsgx_questions/e81dyfy/,1,"Same as this guy, except .54 and .75 👍",2018-10-19
5,Lukeaboss12,e81i6kp,/r/pennystocks/comments/9pes8y/hsgx_questions/e81i6kp/,1,same except 0.55 and 0.72,2018-10-19
6,Lukeaboss12,e81jbcv,/r/pennystocks/comments/9pfy4a/what_happened_to_hsgx_on_september_4/e81jbcv/,1,i believe that is when they missed FDA approval,2018-10-19
7,Fillertracks,e81lsvi,/r/pennystocks/comments/9pfy4a/what_happened_to_hsgx_on_september_4/e81lsvi/,1,They just missed by two patients their internal end point set 10 years prior,2018-10-19
8,itsmelledkindofweird,e81mujb,/r/pennystocks/comments/9pfy4a/what_happened_to_hsgx_on_september_4/e81mujb/,1,"Holy shit that’s crazy, my birthday is June 14th!",2018-10-19
9,turbocrackpipe,e81n823,/r/pennystocks/comments/9pes8y/hsgx_questions/e81n823/,1,Same .586 to .905,2018-10-19
10,jantzid,e81pe4z,/r/pennystocks/comments/9pes8y/hsgx_questions/e81pe4z/,1,It is going to go above $1 before a quick pre meeting correction ,2018-10-19
11,jantzid,e81phmh,/r/pennystocks/comments/9pfy4a/what_happened_to_hsgx_on_september_4/e81phmh/,1,"69%&lt;71%. Gold this stock, neocart is going to work!",2018-10-19
12,Thvt-One,e81ufk2,/r/pennystocks/comments/9phc1j/how_often_do_big_runners_come_around/e81ufk2/,1,Need to know this too. ,2018-10-19
13,givemeyourskin,e81vbw3,/r/pennystocks/comments/9phc1j/how_often_do_big_runners_come_around/e81vbw3/,1,Connect closing bell app. Very useful information,2018-10-19
14,DavidHill76,e81wzu0,/r/pennystocks/comments/9phc1j/how_often_do_big_runners_come_around/e81wzu0/,1,"How big is Big? When I was doing penny stocks, I noticed one about one every three weeks to a month. But not necessarily ""big runners""

",2018-10-19
15,ryancoon82,e81ysg2,/r/pennystocks/comments/9phc1j/how_often_do_big_runners_come_around/e81ysg2/,1,Watch for $RDGL today to make a run. Big announcement at a veterinarian conference about breakthrough cancer treatment. ,2018-10-19
16,madnessguy67,e81z4em,/r/pennystocks/comments/9phc1j/how_often_do_big_runners_come_around/e81z4em/,1,If you look at finviz it's everyday,2018-10-19
17,rieboldt,e821yhb,/r/pennystocks/comments/9phc1j/how_often_do_big_runners_come_around/e821yhb/,1,Do you subscribe?,2018-10-19
18,Mejibray,e822jdq,/r/pennystocks/comments/9phc1j/how_often_do_big_runners_come_around/e822jdq/,1,Look for low-float high volume penny stocks. Then you look at their technical charts like MACD and bollinger band to determine if they are a good buy. I try not to be too greedy so I cut loose if I can make 30%. Trade small trade often. Pretty easy to make couple hundred bucks a day even in a down market. ,2018-10-19
19,RealGsDontSleep,e8270we,/r/pennystocks/comments/9phc1j/how_often_do_big_runners_come_around/e8270we/,1,I dont see any app called this ,2018-10-19
20,amAZZiEng,e8280dg,/r/pennystocks/comments/9pjtah/buyingbin_to_ipo_on_robinhood/e8280dg/,1,"When the day comes, then you will be able to buy Robinhood on Robinhood. ",2018-10-19
21,bellegunness,e828fei,/r/pennystocks/comments/9pjh0s/integrated_cannabis_company_inc_icnaf_to_acquire/e828fei/,1,I bought 400 shares yesterday.... We'll see how it does. ,2018-10-19
22,CopperNickus,e828m9j,/r/pennystocks/comments/9phc1j/how_often_do_big_runners_come_around/e828m9j/,1,https://closingbell.co/   iOS app,2018-10-19
23,Jake10873,e82c4ug,/r/pennystocks/comments/9pkc9l/mlhc_pumping_upon_news_release/e82c4ug/,1,Great find!! Did some DD and it looks like they already have a strong presence in the branding industry. If this talk of their interest in joining the cbd market for branding purposes is true then we could see a big mover here!!,2018-10-19
24,Xerethor,e82d1mw,/r/pennystocks/comments/9pkc9l/mlhc_pumping_upon_news_release/e82d1mw/,1,Holding almost a million shares.  MLH is a lion in waiting...,2018-10-19
25,ylanthomas525,e82d6ty,/r/pennystocks/comments/9pjtah/buyingbin_to_ipo_on_robinhood/e82d6ty/,1,"I think it will depend on the exchange the stock is traded on. I have run into several stocks available on TD that I can't purchase on Robinhood, though they are typically foreign/foreign markets.",2018-10-19
26,RealGsDontSleep,e82dpk0,/r/pennystocks/comments/9phc1j/how_often_do_big_runners_come_around/e82dpk0/,1,Ah I see I'm on android bummer,2018-10-19
27,Courtnall14,e82guy2,/r/pennystocks/comments/9pjh0s/integrated_cannabis_company_inc_icnaf_to_acquire/e82guy2/,1,"I bought 200 last week.  Typically when one company buys another, the one that does the buying takes a little bit of a short term loss.  The theory is they're taking on (more?) debt when they make the purchase.  The company that gets bought usually sees a rise in stock price. 

[Here is a better explanation.]( https://www.investopedia.com/ask/answers/203.asp)

However as I type this, they're up 5+%.  So who knows.  


",2018-10-19
28,xXFoxyGrandpaXx,e82gx14,/r/pennystocks/comments/9pkxvy/cannabis/e82gx14/,1,I noticed that too. I’ll put 500 in and see where it goes ,2018-10-19
29,A2CKilla,e82hem0,/r/pennystocks/comments/9pkc9l/mlhc_pumping_upon_news_release/e82hem0/,1,"Still holding 10k shares, hope this baby pops soon!! ",2018-10-19
30,-walkingonair-,e82i8vh,/r/pennystocks/comments/9phc1j/how_often_do_big_runners_come_around/e82i8vh/,1,Ahh I wish I saw your comment 5 hours ago. Nice callout!,2018-10-19
31,A2CKilla,e82iij2,/r/pennystocks/comments/9plbbx/weeeeeeeeeeeee/e82iij2/,1,"You're no captain wee, throw this person off the ship  ",2018-10-19
32,RayTheMaster,e82ijc0,/r/pennystocks/comments/9pkf95/dcix_buy_buy_buy/e82ijc0/,1,I'll a few bucks on that,2018-10-19
33,RayTheMaster,e82ijrk,/r/pennystocks/comments/9pkf95/dcix_buy_buy_buy/e82ijrk/,1,*throw,2018-10-19
34,ryancoon82,e82ioxn,/r/pennystocks/comments/9phc1j/how_often_do_big_runners_come_around/e82ioxn/,1,The keynote speaker is tomorrow morning. The real gains are expected to come next week when all of the articles are released. I’d still suggest buying today. ,2018-10-19
35,-walkingonair-,e82iy6s,/r/pennystocks/comments/9phc1j/how_often_do_big_runners_come_around/e82iy6s/,1,"Awesome, thanks for the insight! I'll do some dd and may do just that. You mind sharing how you discovered this ticker? I'm still establishing a trading system and can't seem to find the right sources ",2018-10-19
36,Xerethor,e82j34l,/r/pennystocks/comments/9plbbx/weeeeeeeeeeeee/e82j34l/,1,Perfect time to buy.,2018-10-19
37,ryancoon82,e82j7ea,/r/pennystocks/comments/9phc1j/how_often_do_big_runners_come_around/e82j7ea/,1,"This might sound crazy - I was looking up a pot stock on twitter and I saw these accounts arguing over RDGL’s 8k. So I bought a 100k at .008 and the more I read, the more excited I get about it. So I keep buying more. The results on their tests are really staggering. ",2018-10-19
38,NikoSleeps,e82jaum,/r/pennystocks/comments/9pkf95/dcix_buy_buy_buy/e82jaum/,1,Good buy. Had a pullback from todays high but I like where this one is going,2018-10-19
39,RayTheMaster,e82ji2q,/r/pennystocks/comments/9pkf95/dcix_buy_buy_buy/e82ji2q/,1,I just hope it dosen't dump hard before november,2018-10-19
40,-walkingonair-,e82jm34,/r/pennystocks/comments/9phc1j/how_often_do_big_runners_come_around/e82jm34/,1,Dang no way. That must have taken some guts. Wish I could trade like that lol. Glad it worked out for you! I'll have to read into the filings too. Thanks again! You know those guys´ twitter account so I can follow them in hopes of them mentioning another pumper lmfao,2018-10-19
41,HeavilyInvested,e82l5eb,/r/pennystocks/comments/9plbbx/weeeeeeeeeeeee/e82l5eb/,1,Unbelievable opportunity. By year's end we will see .30. ,2018-10-19
42,ryancoon82,e82l9dy,/r/pennystocks/comments/9phc1j/how_often_do_big_runners_come_around/e82l9dy/,1,"His screen name is Jonathan Jula @wallstreetmyway is his @. He’s usually in the know of what’s about to blow up, not sure how. He’s made me some money. Good luck. ",2018-10-19
43,-walkingonair-,e82lfr4,/r/pennystocks/comments/9phc1j/how_often_do_big_runners_come_around/e82lfr4/,1,"You're the greatest! Thanks man. I read into RDGL...wow, their technology seems far superior to traditional methods of eliminating tumors. It's unreal. How far can a stock like this go?? It already made a bit return in past few days. I utterly suck at predicting the immense amount a stock can climb ",2018-10-19
44,ryancoon82,e82lpb3,/r/pennystocks/comments/9phc1j/how_often_do_big_runners_come_around/e82lpb3/,1,"Hold on tightly. Look at RDGL chart from 2006-2008. Company has had past success, portions of it have been bought out and some failures sprinkled in through there has led to this moment. ",2018-10-19
45,mchgrms,e82ltmx,/r/pennystocks/comments/9plbbx/weeeeeeeeeeeee/e82ltmx/,1,They're up over 300% since I put them on my watch list in August lol. You don't have to be bitter about making bad plays on them 🤣,2018-10-19
46,-walkingonair-,e82luxk,/r/pennystocks/comments/9phc1j/how_often_do_big_runners_come_around/e82luxk/,1,I was actually reading about them (i just realised) from a post dating back to 2006...lmao my fail. Have they been working on this gel (that solidifies inside body once reaches body temp eliminating use for metal seeds) for the past 12 years? Or is this some new tech they are working on that caused recent bullish activity?,2018-10-19
47,-walkingonair-,e82lx8h,/r/pennystocks/comments/9phc1j/how_often_do_big_runners_come_around/e82lx8h/,1,"https://investorshub.advfn.com/Vivos-Inc-RDGL-6924/

I just read over this. Gave a nice summation of the company (but this is 2006).",2018-10-19
48,trlanthier,e82mur7,/r/pennystocks/comments/9plbbx/weeeeeeeeeeeee/e82mur7/,1,Not fast enough for me lol,2018-10-19
49,givemeyourskin,e82nbi0,/r/pennystocks/comments/9phc1j/how_often_do_big_runners_come_around/e82nbi0/,1,"Here's the link to the app via iTunes
https://itunes.apple.com/us/app/closingbell/id883723875?mt=8",2018-10-19
50,ma-stro,e82nmri,/r/pennystocks/comments/9pjtah/buyingbin_to_ipo_on_robinhood/e82nmri/,1,"It's an American company, so I imagine that won't be an issue. Presuming it will intro in a local market, have you ever bought into an IPO from robinhood and is there anything I should consider in advance? Thanks!",2018-10-19
51,Denio595,e82ohur,/r/pennystocks/comments/9plbbx/weeeeeeeeeeeee/e82ohur/,1,REDDIT STOCK SEASON WOOOOOOOOOOOOOO WE R ALL GONNA GO BROKE BECAUSE WE JUST TRADE STOCKS ON FIRE WOOOOOO AND WE DON'T LEARN ANYTHING FROM TRADING WOOOOOOOO TO DA CENTER OF DA EARTH DARK SKYS AHEAD DA TRAIN IS FALLING OFF DA TRAKS.,2018-10-19
52,ckbikes1,e82oul3,/r/pennystocks/comments/9phc1j/how_often_do_big_runners_come_around/e82oul3/,1,Look at PLAG this morning!,2018-10-19
53,Denio595,e82pyrh,/r/pennystocks/comments/9pm8zp/hiph_huge_find/e82pyrh/,1,IF YOU DON'T BUY YOU DUMB,2018-10-19
54,Xerethor,e82q6mx,/r/pennystocks/comments/9pm8zp/hiph_huge_find/e82q6mx/,1,Hahaha,2018-10-19
55,Xerethor,e82qgrj,/r/pennystocks/comments/9pm8zp/hiph_huge_find/e82qgrj/,1,Just added,2018-10-19
56,CaptainWeee,e82qilg,/r/pennystocks/comments/9pm8zp/hiph_huge_find/e82qilg/,1,Lmfaooooo,2018-10-19
57,GlowingPants,e82qjkm,/r/pennystocks/comments/9plbbx/weeeeeeeeeeeee/e82qjkm/,1,oh my god i laughed so hard,2018-10-19
58,Xerethor,e82r299,/r/pennystocks/comments/9pm8zp/hiph_huge_find/e82r299/,1,Could be an EOD announcement?,2018-10-19
59,Joeyschmo102,e82r4c1,/r/pennystocks/comments/9pmej2/im_looking_for_a_stock_to_buy/e82r4c1/,1,GBTC,2018-10-19
60,Xerethor,e82r4sg,/r/pennystocks/comments/9plbbx/weeeeeeeeeeeee/e82r4sg/,1,How about the CEO sitting down with owner of LaCroix right now?,2018-10-19
61,squatsforthethots69,e82raqr,/r/pennystocks/comments/9pmej2/im_looking_for_a_stock_to_buy/e82raqr/,1,RNX,2018-10-19
62,CaptainWeee,e82rrth,/r/pennystocks/comments/9pm8zp/hiph_huge_find/e82rrth/,1,These deals take time. Probably an announcement about something within the next two months.,2018-10-19
63,WenMun,e82sk7q,/r/pennystocks/comments/9pjtah/buyingbin_to_ipo_on_robinhood/e82sk7q/,1,Some platform let you preset the price you want to buy a day before IPO comes out.  Ipo is a gamble some drop some gain some open higher than end of day vice versa. ,2018-10-19
64,A2CKilla,e82t5vq,/r/pennystocks/comments/9pm8zp/hiph_huge_find/e82t5vq/,1,Eye eye captain ,2018-10-19
65,I_Zeig_I,e82tgi2,/r/pennystocks/comments/9pmej2/im_looking_for_a_stock_to_buy/e82tgi2/,1,This guy knows what he's doin,2018-10-19
66,acrotalus,e82tiv4,/r/pennystocks/comments/9pmej2/im_looking_for_a_stock_to_buy/e82tiv4/,1,RDGL ,2018-10-19
67,CaptainWeee,e82u6ku,/r/pennystocks/comments/9pm8zp/hiph_huge_find/e82u6ku/,1,Let’s close her green boys time to get the word out 🤑,2018-10-19
68,SwiggittySwaggitty,e82ua3v,/r/pennystocks/comments/9pm8zp/hiph_huge_find/e82ua3v/,1,"Lol I doubt the green close, but next week is looking very promising. Go HIPH!!",2018-10-19
69,CaptainWeee,e82ul8w,/r/pennystocks/comments/9pm8zp/hiph_huge_find/e82ul8w/,1,Next week should be just as active news wise as this week was 🤑🤑🤑,2018-10-19
70,rugby_shirt,e82vbnv,/r/pennystocks/comments/9pn0tt/pura_just_got_short_squeezed_d/e82vbnv/,1,I like $PURA,2018-10-19
71,rugby_shirt,e82vcdr,/r/pennystocks/comments/9pn0tt/pura_just_got_short_squeezed_d/e82vcdr/,1,Also like $GRNH and $SPLIF,2018-10-19
72,Xerethor,e82vdfn,/r/pennystocks/comments/9pn0tt/pura_just_got_short_squeezed_d/e82vdfn/,1,HIPH,2018-10-19
73,FoxRaine,e82vfmn,/r/pennystocks/comments/9pn0tt/pura_just_got_short_squeezed_d/e82vfmn/,1,"I also own tons of shares in HIPH lol, my other favorite :D",2018-10-19
74,SaveMyElephants,e82vi38,/r/pennystocks/comments/9pmej2/im_looking_for_a_stock_to_buy/e82vi38/,1,BLGV stacked board of directors,2018-10-19
75,CaptainWeee,e82vs6d,/r/pennystocks/comments/9pm8zp/hiph_huge_find/e82vs6d/,1,Flagging upwards again here we go 😎,2018-10-19
76,Ghostmouse88,e82vzda,/r/pennystocks/comments/9pm8zp/hiph_huge_find/e82vzda/,1,La Croix had a huge scandal recently regarding chemicals in their drinks.,2018-10-19
77,HeavilyInvested,e82wbyu,/r/pennystocks/comments/9pn0tt/pura_just_got_short_squeezed_d/e82wbyu/,1,🤑🤑🤑🤑🤑 HIPH,2018-10-19
78,CaptainWeee,e82wdha,/r/pennystocks/comments/9pm8zp/hiph_huge_find/e82wdha/,1,Yeah I heard but all we need is for their parent company to buy a % of ours like Coke did Monster and we’re gucci 😎🤑🤑🤑,2018-10-19
79,CaptainWeee,e82we7z,/r/pennystocks/comments/9pm8zp/hiph_huge_find/e82we7z/,1,CDEL and NITE getting ready to run it up now boys here we go 😎,2018-10-19
80,HeavilyInvested,e82wikz,/r/pennystocks/comments/9pm8zp/hiph_huge_find/e82wikz/,1,Strong close for the week. Coming now. ,2018-10-19
81,RealGsDontSleep,e82wthm,/r/pennystocks/comments/9phc1j/how_often_do_big_runners_come_around/e82wthm/,1,Android user :'((,2018-10-19
82,CaptainWeee,e82wyew,/r/pennystocks/comments/9pm8zp/hiph_huge_find/e82wyew/,1,Here we go she’s breaking .09 boys!!!,2018-10-19
83,ChamberofSarcasm,e82xeu1,/r/pennystocks/comments/9pm8zp/hiph_huge_find/e82xeu1/,1,Uh yeah. Already knew they owned La Croix. They own lots of things.  ,2018-10-19
84,vietong,e82xo6e,/r/pennystocks/comments/9pmej2/im_looking_for_a_stock_to_buy/e82xo6e/,1,HIPH,2018-10-19
85,houseflip,e82yakf,/r/pennystocks/comments/9pmej2/im_looking_for_a_stock_to_buy/e82yakf/,1,"LCLP just bought stake in vidbox, their in mexican walmarts. like redbox. its been getting big volume ever since",2018-10-19
86,chimp1992,e82ylf5,/r/pennystocks/comments/9pmc0o/october_19_2018_tomorrows_daily_rpennystocks/e82ylf5/,1,"RNX, news should come through on Monday/Tuesday on their 'golden bootleg', a massive chunk of gold that they've been attempting to extract into one contiguous slab for auctioning. Also waiting on gold production for Q3, expecting them to beat the 30-35 K oz of gold indicated from the 60 m3 blast in the ""Father's Day Vein"".",2018-10-19
87,ma-stro,e82zeod,/r/pennystocks/comments/9pjtah/buyingbin_to_ipo_on_robinhood/e82zeod/,1,That's good to know. Thanks!,2018-10-19
88,7ounce,e83099u,/r/pennystocks/comments/9pmej2/im_looking_for_a_stock_to_buy/e83099u/,1,NXEN,2018-10-19
89,AdviceManimal,e830xlw,/r/pennystocks/comments/9pm8zp/hiph_huge_find/e830xlw/,1,"Does anyone have any background on why this used to be like a trillion dollars/share? 

https://finance.yahoo.com/chart/HIPH#eyJpbnRlcnZhbCI6IndlZWsiLCJwZXJpb2RpY2l0eSI6MSwiY2FuZGxlV2lkdGgiOjEuNDI4NTcxNDI4NTcxNDI4Niwidm9sdW1lVW5kZXJsYXkiOnRydWUsImFkaiI6dHJ1ZSwiY3Jvc3NoYWlyIjp0cnVlLCJjaGFydFR5cGUiOiJsaW5lIiwiZXh0ZW5kZWQiOmZhbHNlLCJtYXJrZXRTZXNzaW9ucyI6e30sImFnZ3JlZ2F0aW9uVHlwZSI6Im9obGMiLCJjaGFydFNjYWxlIjoibGluZWFyIiwicGFuZWxzIjp7ImNoYXJ0Ijp7InBlcmNlbnQiOjEsImRpc3BsYXkiOiJISVBIIiwiY2hhcnROYW1lIjoiY2hhcnQiLCJ0b3AiOjB9fSwic2V0U3BhbiI6eyJiYXNlIjoiYWxsIiwibXVsdGlwbGllciI6MX0sImxpbmVXaWR0aCI6Miwic3RyaXBlZEJhY2tncm91ZCI6dHJ1ZSwiZXZlbnRzIjp0cnVlLCJjb2xvciI6IiMwMDgxZjIiLCJldmVudE1hcCI6eyJjb3Jwb3JhdGUiOnt9LCJzaWdEZXYiOnt9fSwic3ltYm9scyI6W3sic3ltYm9sIjoiSElQSCIsInN5bWJvbE9iamVjdCI6eyJzeW1ib2wiOiJISVBIIn0sInBlcmlvZGljaXR5IjoxLCJpbnRlcnZhbCI6IndlZWsiLCJzZXRTcGFuIjp7ImJhc2UiOiJhbGwiLCJtdWx0aXBsaWVyIjoxfX1dLCJjdXN0b21SYW5nZSI6bnVsbCwic3R1ZGllcyI6eyJ2b2wgdW5kciI6eyJ0eXBlIjoidm9sIHVuZHIiLCJpbnB1dHMiOnsiaWQiOiJ2b2wgdW5kciIsImRpc3BsYXkiOiJ2b2wgdW5kciJ9LCJvdXRwdXRzIjp7IlVwIFZvbHVtZSI6IiMwMGIwNjEiLCJEb3duIFZvbHVtZSI6IiNGRjMzM0EifSwicGFuZWwiOiJjaGFydCIsInBhcmFtZXRlcnMiOnsid2lkdGhGYWN0b3IiOjAuNDUsImNoYXJ0TmFtZSI6ImNoYXJ0In19LCLigIxtYeKAjCAoNTAsQyxtYSwwKSI6eyJ0eXBlIjoibWEiLCJpbnB1dHMiOnsiUGVyaW9kIjo1MCwiRmllbGQiOiJDbG9zZSIsIlR5cGUiOiJzaW1wbGUiLCJPZmZzZXQiOjAsImlkIjoi4oCMbWHigIwgKDUwLEMsbWEsMCkiLCJkaXNwbGF5Ijoi4oCMbWHigIwgKDUwLEMsbWEsMCkifSwib3V0cHV0cyI6eyJNQSI6IiNhZDZlZmYifSwicGFuZWwiOiJjaGFydCIsInBhcmFtZXRlcnMiOnsiY2hhcnROYW1lIjoiY2hhcnQifX19fQ%3D%3D",2018-10-19
90,z0syn,e831gm1,/r/pennystocks/comments/9pm8zp/hiph_huge_find/e831gm1/,1,Lmao what the fuck is this link,2018-10-19
91,FoxRaine,e831lod,/r/pennystocks/comments/9pkc9l/mlhc_pumping_upon_news_release/e831lod/,1,"I'm gonna buy 300k shares as soon as the market opens lol I was looking at this ticker for a little while and especially after some DD, this stock is becoming really enticing :)",2018-10-19
92,ashfactz,e831yni,/r/pennystocks/comments/9pnchl/thoughts_on_mining_companies_rnx_or_wm/e831yni/,1,LODE ,2018-10-19
93,MataLeao87,e831yvc,/r/pennystocks/comments/9pm8zp/hiph_huge_find/e831yvc/,1,Reverse stock split?,2018-10-19
94,AdviceManimal,e833wnh,/r/pennystocks/comments/9pm8zp/hiph_huge_find/e833wnh/,1,Haha lazy c+p,2018-10-19
95,HitlersSpecialFlower,e83463o,/r/pennystocks/comments/9pmej2/im_looking_for_a_stock_to_buy/e83463o/,1,"Stacked, like they work out and get massive gains from the Bicep department? ",2018-10-19
96,AdamCaveRoberts,e83480y,/r/pennystocks/comments/9pnchl/thoughts_on_mining_companies_rnx_or_wm/e83480y/,1,Can you expand? Have they discovered some shit ? It looks like the stock is in a down trend. ,2018-10-19
97,HitlersSpecialFlower,e834tl5,/r/pennystocks/comments/9pn0tt/pura_just_got_short_squeezed_d/e834tl5/,1,"I'm new here, why does everyone put a dollar sign in front of the name? ",2018-10-19
98,gazgunz,e8351zi,/r/pennystocks/comments/9pm8zp/hiph_huge_find/e8351zi/,1,I’ve been riding this since 1 cent,2018-10-19
99,CaptainWeee,e835gw2,/r/pennystocks/comments/9pm8zp/hiph_huge_find/e835gw2/,1,That’s back when the POS CEO Albert did like 7 R/S’s got ousted now Ryan took over last year around this time and did more in one year than he did in the last 19 years before then.,2018-10-19
100,gazgunz,e836hgn,/r/pennystocks/comments/9pkc9l/mlhc_pumping_upon_news_release/e836hgn/,1,Pump and D scam piece of shit with a gazillion shares even after the reduced share amount good luck hitting a penny ,2018-10-19
101,drdivincenzo78,e8375k6,/r/pennystocks/comments/9pmej2/im_looking_for_a_stock_to_buy/e8375k6/,1,MNKD ,2018-10-19
102,01123581321AhFuckIt,e837jgs,/r/pennystocks/comments/9pmc17/what_mobile_app_do_you_guys_use/e837jgs/,1,Reddit ,2018-10-19
103,Zulumus,e838no1,/r/pennystocks/comments/9pm8zp/hiph_huge_find/e838no1/,1,That scandal was a joke. The person suing was trying to get a quick buck by making a headline so LaCroix would settle quickly ,2018-10-19
104,fatlipcurti,e839mog,/r/pennystocks/comments/9pmej2/im_looking_for_a_stock_to_buy/e839mog/,1,N.TO,2018-10-19
105,HodlGang_HodlGang,e839mvi,/r/pennystocks/comments/9pmc17/what_mobile_app_do_you_guys_use/e839mvi/,1,RobinHood ,2018-10-19
106,ashfactz,e83fxj2,/r/pennystocks/comments/9pnchl/thoughts_on_mining_companies_rnx_or_wm/e83fxj2/,1,"These guys did a good job on their DD 
https://www.reddit.com/r/RobinHoodPennyStocks/comments/9l5ssf/dd_on_lode_part_2_or_why_i_learned_to_love/?st=JNGQH28R&amp;sh=55f7ac13",2018-10-19
107,ashfactz,e83fz05,/r/pennystocks/comments/9pnchl/thoughts_on_mining_companies_rnx_or_wm/e83fz05/,1,https://www.reddit.com/r/RobinHoodPennyStocks/comments/9l5ssf/dd_on_lode_part_2_or_why_i_learned_to_love/?st=JNGQIBU7&amp;sh=2fe0d1d0,2018-10-19
108,tophouseblock,e83gws0,/r/pennystocks/comments/9pmej2/im_looking_for_a_stock_to_buy/e83gws0/,1,BINGO,2018-10-19
109,bigmikey69er,e83hitp,/r/pennystocks/comments/9pmej2/im_looking_for_a_stock_to_buy/e83hitp/,1,ATE.V,2018-10-19
110,LordFrakington,e83i1p6,/r/pennystocks/comments/9pm8zp/hiph_huge_find/e83i1p6/,1,Where can I buy It I only have robinhood at the moment,2018-10-19
111,ablindlemon,e83jcl6,/r/pennystocks/comments/9pmc17/what_mobile_app_do_you_guys_use/e83jcl6/,1,"For mobile I use webull charts and funding on rh.... dont ask why because idk. Otherwise, ToS when at home",2018-10-19
112,ablindlemon,e83jejy,/r/pennystocks/comments/9pes8y/hsgx_questions/e83jejy/,1,.65 -&gt; .87,2018-10-19
113,CaptainWeee,e83k9qt,/r/pennystocks/comments/9pm8zp/hiph_huge_find/e83k9qt/,1,You need to get another broker Robinhood doesn’t let you buy a lot of different plays.,2018-10-19
114,blinkssb,e83kloe,/r/pennystocks/comments/9pjh0s/integrated_cannabis_company_inc_icnaf_to_acquire/e83kloe/,1,625 from me ,2018-10-19
115,Buffett95,e83kns0,/r/pennystocks/comments/9pmc17/what_mobile_app_do_you_guys_use/e83kns0/,1,Any suggested apps for IOS? ,2018-10-19
116,xander1323,e83m5iu,/r/pennystocks/comments/9pmc17/what_mobile_app_do_you_guys_use/e83m5iu/,1,E*TRADE ,2018-10-19
117,SamWright85,e83m7r6,/r/pennystocks/comments/9pmej2/im_looking_for_a_stock_to_buy/e83m7r6/,1,Kind of enjoying RDGL atm. But don't take advice from strangers on the internet. Do your own DD my friend!,2018-10-19
118,HotWeedMusic,e83md34,/r/pennystocks/comments/9pmej2/im_looking_for_a_stock_to_buy/e83md34/,1,USUK,2018-10-19
119,holdtayl,e83n4qd,/r/pennystocks/comments/9pkxvy/cannabis/e83n4qd/,1,You have my interest? Any ideas as to why a spike in October?  Start of Q4 ;),2018-10-19
120,5mashfactor,e83n62m,/r/pennystocks/comments/9pmej2/im_looking_for_a_stock_to_buy/e83n62m/,1,TRXC,2018-10-19
121,GlowingPants,e83netl,/r/pennystocks/comments/9pkc9l/mlhc_pumping_upon_news_release/e83netl/,1,"Understand how the stock market works please. At a revenue base of 8 million, and the subsidiaries making millions of dollars for the year. At 0.01$ with 5,000,000,000 shares, their company value is quickly heading to 50 million dollars. So yes, it’s very realistic. ",2018-10-19
122,Sittin_on_a_toilet,e83o5ru,/r/pennystocks/comments/9pmej2/im_looking_for_a_stock_to_buy/e83o5ru/,1,Your concept of buying stocks that become more valuable is an awesome idea. Why hasn't anyone else thought of that?,2018-10-19
123,TapRack623,e83ohl5,/r/pennystocks/comments/9pmej2/im_looking_for_a_stock_to_buy/e83ohl5/,1,Bpmx,2018-10-19
124,Lukeqanderson,e83ompq,/r/pennystocks/comments/9pmc0o/october_19_2018_tomorrows_daily_rpennystocks/e83ompq/,1,ICTV,2018-10-19
125,moarann,e83s6kr,/r/pennystocks/comments/9pmej2/im_looking_for_a_stock_to_buy/e83s6kr/,1,This guy. True wallstreet bettor.,2018-10-19
126,forropdx,e83szro,/r/pennystocks/comments/9pmej2/im_looking_for_a_stock_to_buy/e83szro/,1,You're right sir. As soon as bitcoin comes back this is going to $15.00 fast,2018-10-19
127,gazgunz,e83t70u,/r/pennystocks/comments/9pkc9l/mlhc_pumping_upon_news_release/e83t70u/,1,Yeah fucken right this is a shell piece of shit ,2018-10-19
128,Joesmithers,e83ty9w,/r/pennystocks/comments/9pm8zp/hiph_huge_find/e83ty9w/,1,What brokerage do you guys use to to buy said stock? It’s not on Robinhood ,2018-10-19
129,gazgunz,e83ub92,/r/pennystocks/comments/9pm8zp/hiph_huge_find/e83ub92/,1,"Any real brokerage, Robinhood is a pos",2018-10-19
130,gazgunz,e83uc9d,/r/pennystocks/comments/9pm8zp/hiph_huge_find/e83uc9d/,1,I got in at a penny sold all at 12 cents I hope I don’t regret it,2018-10-19
131,gazgunz,e83udzp,/r/pennystocks/comments/9pmej2/im_looking_for_a_stock_to_buy/e83udzp/,1,"Is this a long term play? Got in at a penny got
Out at 12 cents hope I don’t regret selling all",2018-10-19
132,gazgunz,e83ufe2,/r/pennystocks/comments/9phc1j/how_often_do_big_runners_come_around/e83ufe2/,1,What do u consider a small float ,2018-10-19
