,author,id,url,score,text,date
96,1000thusername,eitnm1t,/r/pennystocks/comments/b29mr3/ive_read_online_that_avita_medical_will_be_listed/eitnm1t/,1,"I believe that already happened last week. 

Today I think the minor pullback is profit taking because lots of folks made 30+% in four days’ time, and that’s not speaking for those who have held since it was much lower. (My first lot was +92% at COB Friday.) 

I think the fun is just beginning for this one. ",2019-03-17
97,psxpetey,eitstw9,/r/pennystocks/comments/b271ht/is_it_even_possible_to_short_penny_stocks/eitstw9/,1,"The amount he charges x the amount of students he has among his DVD revenue profitly stocks to trade etc.

Steven mostly shorts I don’t follow his trades because I don’t want to pay for profitly. He still trades low floaters though. ",2019-03-17
98,JakAndDax,eiup25y,/r/pennystocks/comments/b24ew0/nanocaps_keep_producing_great_day_trading/eiup25y/,1,"Just a theory, but Guy Gentile CEO of Swiss America Securities dba SureTrader, believes someone is running an algorithm on these low float biotech stocks. Not sure but massive volume, short squeezing and bagging longs have been aggressively exaggerated after BPTH. 

He was hired by the FBI to uncover these pump and dump stick manipulators. Do your own due diligence. Most would say he’s paranoid, but if he starts to recognize algo’s, I believe it because he has helped create them. 

TLDR: an algorithmic trader(s) are manipulating these stocks and cashing in hard on longing and shorting these stocks.",2019-03-17
99,houseflip,eivecnd,/r/pennystocks/comments/b271ht/is_it_even_possible_to_short_penny_stocks/eivecnd/,1,"haha ya. i should say they aren't complete scams, as you will def learn something, but you can learn the same exact stuff on youtube for free even losing trading with tiny test money is more of a valuable learning experience.",2019-03-17
100,HodlMyMoon,eiw3g6f,/r/pennystocks/comments/b271ht/is_it_even_possible_to_short_penny_stocks/eiw3g6f/,1,"Check out this dudes channel, he is extremely helpful and isn’t trying to sell a get rich quick scheme. https://www.youtube.com/channel/UCq0BCGckWWjrnV8YdYO24JA the knowledge he shares on his page, people like Tim would charge hundreds for. His chat group is also awesome too, he post lots of free tutorials that have changed my stock trading game for the better. ",2019-03-17
101,Goddard15,eixu7sm,/r/pennystocks/comments/b271ht/is_it_even_possible_to_short_penny_stocks/eixu7sm/,1,You just don’t want it enough /s,2019-03-17
102,LanceOnRoids,eiy0hd8,/r/pennystocks/comments/b271ht/is_it_even_possible_to_short_penny_stocks/eiy0hd8/,1,Fuck off liar,2019-03-17
103,DonOfGuan,eiyb6jm,/r/pennystocks/comments/b271ht/is_it_even_possible_to_short_penny_stocks/eiyb6jm/,1,What do you think ‘short selling’ is?  When you sell a stock short the shares aren’t fabricated just for you.  You’re essentially borrowing shares and repaying them once you close your position,2019-03-17
104,betterbydesign,eiye5vf,/r/pennystocks/comments/b271ht/is_it_even_possible_to_short_penny_stocks/eiye5vf/,1,You are definitely on roids.,2019-03-17
105,Dallas343,eiysegn,/r/pennystocks/comments/b271ht/is_it_even_possible_to_short_penny_stocks/eiysegn/,1,What’s the broker? Interesting ,2019-03-17
106,houseflip,eiytjbh,/r/pennystocks/comments/b271ht/is_it_even_possible_to_short_penny_stocks/eiytjbh/,1,"""centerpoint"" and ""interactive brokers""",2019-03-17
107,DillonSyp,eizmrur,/r/pennystocks/comments/b271ht/is_it_even_possible_to_short_penny_stocks/eizmrur/,1,The thing about shorting a stock is there has to be shares available to borrow. I feel like that would be one of the top issues *if* the broker even allows it.,2019-03-17
108,Nounoon,eizu4xg,/r/pennystocks/comments/b271ht/is_it_even_possible_to_short_penny_stocks/eizu4xg/,1,"If there was really an easy and risk free way to make lots of money, it would not be something you’d advertise on YouTube as it would most probably kill the deal.",2019-03-17
109,coolman2311,ej01zia,/r/pennystocks/comments/b271ht/is_it_even_possible_to_short_penny_stocks/ej01zia/,1,I mean its much easier to buy index funds all these people make me laugh,2019-03-17
110,gageboi8,ej4m7xd,/r/pennystocks/comments/b271ht/is_it_even_possible_to_short_penny_stocks/ej4m7xd/,1,"He’s just picking off of a very illegal scheme in a way that is very grey line illegal, don’t try this",2019-03-17
111,montclearman,ej76zwn,/r/pennystocks/comments/b271ht/is_it_even_possible_to_short_penny_stocks/ej76zwn/,1,I mean its easy when you have a trust to back you up lol,2019-03-17
112,nameihadtomakeup,ej7asu9,/r/pennystocks/comments/b271ht/is_it_even_possible_to_short_penny_stocks/ej7asu9/,1,This dudes seem some shit,2019-03-17
113,nameihadtomakeup,ej7b63p,/r/pennystocks/comments/b271ht/is_it_even_possible_to_short_penny_stocks/ej7b63p/,1,Lol ironically the person getting paid by the advertiser is the only one getting rich in that scheme,2019-03-17
114,alexdexter1965,ejfhdv5,/r/pennystocks/comments/b271ht/is_it_even_possible_to_short_penny_stocks/ejfhdv5/,1," 

looking for steven dux dvd or tim sykes dvds? email me for more info [hotlinexz@gmail](mailto:hotlinexz@gmail). com",2019-03-17
115,allthethrowaways1212,emill87,/r/pennystocks/comments/b271ht/is_it_even_possible_to_short_penny_stocks/emill87/,1,The collateral obligation for each share is marked at $1.00 though.,2019-03-17
116,KingKC612,epyexzz,/r/pennystocks/comments/b271ht/is_it_even_possible_to_short_penny_stocks/epyexzz/,1,These big super nova plays happen with out without Sykes. You are very naive. The big hot plays in the market trade 20-50-100 mil shares in a day. That's not being manipulated by Tim and his chat lol.,2019-03-17
117,KingKC612,epyf2nj,/r/pennystocks/comments/b271ht/is_it_even_possible_to_short_penny_stocks/epyf2nj/,1,He often trades with a 12k account to teach so no shit.,2019-03-17
