,author,id,url,score,text,date
0,arraysStartAtOne,ds40jpn,/r/pennystocks/comments/7nrcjt/any_new_news_from_jbzy/ds40jpn/,2,"Nothing new has been introduced, just market trading activity",2018-01-03
1,Moed69,ds43j9d,/r/pennystocks/comments/7nroia/vjet_is_doing_well_going_to_launch_this_spring/ds43j9d/,1,Holding strong 💪 ,2018-01-03
2,Kiheiboy,ds48t22,/r/pennystocks/comments/7nrh49/ppcb/ds48t22/,1,It looks like it’s dump...,2018-01-03
3,smackmyteets,ds48x38,/r/pennystocks/comments/7nroia/vjet_is_doing_well_going_to_launch_this_spring/ds48x38/,1,Lmao. What did you get in at?,2018-01-03
4,Trashwille,ds4f06w,/r/pennystocks/comments/7ns01d/otc_marijuana_stocks_6706057430_total_volume_today/ds4f06w/,1,True bubble ,2018-01-03
5,Moed69,ds4iytm,/r/pennystocks/comments/7nroia/vjet_is_doing_well_going_to_launch_this_spring/ds4iytm/,1,Myself at 0.40$ ,2018-01-03
6,tkaran,ds4j8ec,/r/pennystocks/comments/7nroia/vjet_is_doing_well_going_to_launch_this_spring/ds4j8ec/,1,"got it at.80 cents, was 40 cent less then a week ago",2018-01-03
7,nomsekki,ds4l8pn,/r/pennystocks/comments/7nrcjt/any_new_news_from_jbzy/ds4l8pn/,1,I expect the PPS to continue plummeting.,2018-01-03
8,Moed69,ds4lbav,/r/pennystocks/comments/7nroia/vjet_is_doing_well_going_to_launch_this_spring/ds4lbav/,1,"I can see it hitting around 3$ per share this coming spring when they start announcing their progress. Good investment. 
Thumb up to all the holders 👍",2018-01-03
9,Gabenism,ds4m0oy,/r/pennystocks/comments/7ns01d/otc_marijuana_stocks_6706057430_total_volume_today/ds4m0oy/,1,"While I don't think the marijuana market is necessarily a bubble, I do believe there are a number of pitfalls to see through before real predictions can be made. I also never buy stocks that have political limiters, and marijuana stocks have just that. It's the same reason I fear Crypto trading. But I'm in that for the short run.",2018-01-03
10,Xray_Mind,ds4mlg5,/r/pennystocks/comments/7nroia/vjet_is_doing_well_going_to_launch_this_spring/ds4mlg5/,1,What is their ticker on TD?,2018-01-03
11,yyofchina,ds4n4s8,/r/pennystocks/comments/7nroia/vjet_is_doing_well_going_to_launch_this_spring/ds4n4s8/,1,"JETMF, just looked it up. seems kind of high to be jumping in now though",2018-01-03
12,smackmyteets,ds4nw79,/r/pennystocks/comments/7nroia/vjet_is_doing_well_going_to_launch_this_spring/ds4nw79/,1,Wow. Canadian stock is over $1 this mornin,2018-01-03
13,dylan9596,ds4p06h,/r/pennystocks/comments/7nv8oc/myhi_doing_very_well_last_couple_of_days/ds4p06h/,1,"Up 150% since the market opened up for the week! Crazy, wish I bought in yesterday morning ",2018-01-03
14,Moed69,ds4pg9g,/r/pennystocks/comments/7nroia/vjet_is_doing_well_going_to_launch_this_spring/ds4pg9g/,1,Jet.v,2018-01-03
15,dylan9596,ds4phdm,/r/pennystocks/comments/7nva87/whats_everyones_long_term_marijuana_stock_holdings/ds4phdm/,1,ACBFF been in since 4.75  😊,2018-01-03
16,rieboldt,ds4qyj0,/r/pennystocks/comments/7nv83o/phot_coming_back_as_weed_rallies/ds4qyj0/,1,I’ve been holding for YEARS! This is awesome. 40k shares. Thanks to Cali and their cube “grow at home” kit! ,2018-01-03
17,gauchedamned,ds4ru2p,/r/pennystocks/comments/7nva87/whats_everyones_long_term_marijuana_stock_holdings/ds4ru2p/,1,"ACBFF @ 1.86  
APHGF @ 10.18 ",2018-01-03
18,B-to-the-S-81,ds4rusm,/r/pennystocks/comments/7nva87/whats_everyones_long_term_marijuana_stock_holdings/ds4rusm/,1,"Haha, been sitting in mine since $1.95. ",2018-01-03
19,dylan9596,ds4s9v1,/r/pennystocks/comments/7nva87/whats_everyones_long_term_marijuana_stock_holdings/ds4s9v1/,1,Debating on whether to sell now or hold till July-Canada/country-wide legalization ,2018-01-03
20,sublime19,ds4sj77,/r/pennystocks/comments/7nva87/whats_everyones_long_term_marijuana_stock_holdings/ds4sj77/,1,"I've only invested in Canadian stocks thru my TFSA but my holdings have been:

Canopy Growth @ 2.51/share

Aphria @ 2.04/share

Organigram @ 1.50/share

Tetra Bio Pharma @ .05/share (formerly GrowPros and I swing traded this a little.

Namaste @ .15/share

Only big player I've missed out on is Aurora although I feel they're the riskiest. ",2018-01-03
21,rieboldt,ds4sjyk,/r/pennystocks/comments/7nva87/whats_everyones_long_term_marijuana_stock_holdings/ds4sjyk/,1,"TMN, PHOT, ACB, APH, ",2018-01-03
22,Xray_Mind,ds4t0ug,/r/pennystocks/comments/7nv83o/phot_coming_back_as_weed_rallies/ds4t0ug/,1,Hoping it keeps on keeping on,2018-01-03
23,cmarkcity,ds4t6uh,/r/pennystocks/comments/7nv8oc/myhi_doing_very_well_last_couple_of_days/ds4t6uh/,1,I DID buy in yesterday morning! lol. Its up 70% from just yesterday!,2018-01-03
24,Xray_Mind,ds4tygb,/r/pennystocks/comments/7nv55d/chit_buying_250000000_in_assets_up_300/ds4tygb/,1,"Wow. $250,000,000 in preferred stock options acquired, And a $100,000,000 ICO planned.

This could get interesting.

In before explosion ",2018-01-03
25,Tazzure,ds4ub8p,/r/pennystocks/comments/7nvsaz/thoughts_on_riot_and_btcs/ds4ub8p/,1,"RIOT is a pump and dump dude, you trolling?",2018-01-03
26,Bionicbuk,ds4uc93,/r/pennystocks/comments/7nv83o/phot_coming_back_as_weed_rallies/ds4uc93/,1,Love seeing this come back. Like the Phoenix 🔥,2018-01-03
27,zimzambIe,ds4v1wt,/r/pennystocks/comments/7nvsaz/thoughts_on_riot_and_btcs/ds4v1wt/,1,Stop investing you’re going to lose all your money,2018-01-03
28,Phoenixvibe,ds4v9u2,/r/pennystocks/comments/7nva87/whats_everyones_long_term_marijuana_stock_holdings/ds4v9u2/,1,Doja all the way and re-evaluate once they’re acquired by one of the bigger dogs.,2018-01-03
29,MSE93,ds4vqaa,/r/pennystocks/comments/7nva87/whats_everyones_long_term_marijuana_stock_holdings/ds4vqaa/,1,Have money invested in YiLo.  Could be risky since the shares aren't trading yet.  I think of it as a long term investment.,2018-01-03
30,JojenCopyPaste,ds4wdtt,/r/pennystocks/comments/7nvu95/spcl_anyone/ds4wdtt/,1,If it goes to .0009 I'm there,2018-01-03
31,manniscule,ds4wqr4,/r/pennystocks/comments/7nw5kk/what_new_markets_do_you_expect_to_emerge_in_the/ds4wqr4/,1,"Weed stocks gains +100% just this month alone, and longterm canadian weedstocksbthere is still a lot of money to be made!",2018-01-03
32,cmarkcity,ds4yagd,/r/pennystocks/comments/7nw5kk/what_new_markets_do_you_expect_to_emerge_in_the/ds4yagd/,1,No arguments there! But I have noticed that the prime time to have invested was early November. I have actually yet to find a weed stock that has not been climbing since November (I assume from the vote for recreational legalization in California and some other states),2018-01-03
33,travelingattorney,ds4ynf0,/r/pennystocks/comments/7nv8oc/myhi_doing_very_well_last_couple_of_days/ds4ynf0/,1,"I was in at $0.17 and sold 80% of my holdings at $0.42, my only regret was taking such a small position, but any win is better than a loss.  
",2018-01-03
34,manniscule,ds4ypna,/r/pennystocks/comments/7nw5kk/what_new_markets_do_you_expect_to_emerge_in_the/ds4ypna/,1,"Yeah if its long term, you can make a lot just dont panic and sell like most new investors in weed",2018-01-03
35,thehouse211,ds4zm8h,/r/pennystocks/comments/7nvu95/spcl_anyone/ds4zm8h/,1,NOT AGAIN,2018-01-03
36,Duri1,ds4zub7,/r/pennystocks/comments/7nrh49/ppcb/ds4zub7/,1,Up to .25 now coulda made an easy 40% I bought in at open and couldn’t be happier,2018-01-03
37,DP688,ds50wmy,/r/pennystocks/comments/7nv83o/phot_coming_back_as_weed_rallies/ds50wmy/,1,$1 please 😂,2018-01-03
38,Talonx4,ds53tv6,/r/pennystocks/comments/7nv8oc/myhi_doing_very_well_last_couple_of_days/ds53tv6/,1,Lol I tried to tell you all to buy it.  ,2018-01-03
39,sp1d3rboi,ds546cb,/r/pennystocks/comments/7nw1q0/nspr/ds546cb/,1,Waiting myself here. Keeping hoping the latest news will cause some movement upward. ,2018-01-03
40,impulsiveinvestor,ds54xi8,/r/pennystocks/comments/7nv83o/phot_coming_back_as_weed_rallies/ds54xi8/,1,"Tell me they had a R/S, how did they get up so high? They had a shit ton of shares this time last year....",2018-01-03
41,krayis,ds574nj,/r/pennystocks/comments/7nw1q0/nspr/ds574nj/,1,Been holding for months,2018-01-03
42,lunchbox_6,ds57ovq,/r/pennystocks/comments/7nvu95/spcl_anyone/ds57ovq/,1,"Lol, I’m basically getting rid of everything I have this thing is garbage there’s rumours now the pixel deal never went through because they couldn’t cover the note",2018-01-03
43,Hamsmelly,ds5874b,/r/pennystocks/comments/7nx2mm/might_be_a_silly_question_but_how_does_a_us/ds5874b/,1,give a friend or family member your e-trade credentials and have them stand on the other side of the boarder so you can just shout out your desired positions to them,2018-01-03
44,LightBearCares,ds59up4,/r/pennystocks/comments/7nw1q0/nspr/ds59up4/,1,"Holding it since early December also. Wish I could buy more shares, but 710 shares is all I can do for now. In it for the long term.",2018-01-03
45,DaboSweedy,ds5aq3u,/r/pennystocks/comments/7nw5kk/what_new_markets_do_you_expect_to_emerge_in_the/ds5aq3u/,1,Id say it was 2 years ago in fact haha,2018-01-03
46,janus_marine,ds5c0vx,/r/pennystocks/comments/7nva87/whats_everyones_long_term_marijuana_stock_holdings/ds5c0vx/,1,"I have over 650k shares of ERBB lol.  

I either wasted 1100 bucks or set myself up a nice boost to the retirement fund.",2018-01-03
47,remeshk,ds5cfot,/r/pennystocks/comments/7nvu95/spcl_anyone/ds5cfot/,1,Where can buy this ?,2018-01-03
48,Nrse24,ds5cnxf,/r/pennystocks/comments/7nx2mm/might_be_a_silly_question_but_how_does_a_us/ds5cnxf/,1,"Use TD ameritrade or Etrade, you can use these platforms to buy OTC stocks",2018-01-03
49,postalemployed,ds5crui,/r/pennystocks/comments/7nxjna/args/ds5crui/,1,"im probably not correct for doing it but I sold,  I am very new to trading and wanted to take my profits for now, if it keeps going up Ill miss out on that but can put the money in another stock(which could go up or down) and if it goes down Ill buy more...*fingers crossed*  (as a side note, I did not find any new news when the spiked happened so at a 20% spike sounds like a peak, but more of a feeling)",2018-01-03
50,rektamo,ds5cyaw,/r/pennystocks/comments/7nva87/whats_everyones_long_term_marijuana_stock_holdings/ds5cyaw/,1,"😂 even if it randomly bounces back up to let’s say $20 thats 13,000,000 and a big F u to everyone who’s doubted ya",2018-01-03
51,queenslandbananas,ds5czjl,/r/pennystocks/comments/7nxrqd/how_we_made_52290_on_teum_ltea_and_kem_100/ds5czjl/,1,"&gt; 100% Trading Accuracy 

What does that even mean? Sounds like nonsense to me. ",2018-01-03
52,stickmalone,ds5d5wq,/r/pennystocks/comments/7nv83o/phot_coming_back_as_weed_rallies/ds5d5wq/,1,How high will it go?,2018-01-03
53,Nrse24,ds5dage,/r/pennystocks/comments/7nwayt/if_anyone_want_a_bit_of_reading_take_a_look_new/ds5dage/,1,Thanks for this info!,2018-01-03
54,daytrader99b,ds5dfmm,/r/pennystocks/comments/7nxrqd/how_we_made_52290_on_teum_ltea_and_kem_100/ds5dfmm/,1,100 winning. 3/3 on trades for today. ,2018-01-03
55,janus_marine,ds5di25,/r/pennystocks/comments/7nva87/whats_everyones_long_term_marijuana_stock_holdings/ds5di25/,1,"Dude at a 1,100.00 buy in if it went to a buck and I pulled 650k+ out of it that'd be more than enough for me. Realistically I'd prob pull like 150k out, spread it around to more safer investments and keep like 10k to blow like a maniac, and leave the rest in there to see what happens",2018-01-03
56,rektamo,ds5dogj,/r/pennystocks/comments/7nva87/whats_everyones_long_term_marijuana_stock_holdings/ds5dogj/,1,"Hey people had luckier moments, with a potentially pro pot nation you never know these days. What did you use to buy it? ",2018-01-03
57,tomboulanger12,ds5dssy,/r/pennystocks/comments/7nx2mm/might_be_a_silly_question_but_how_does_a_us/ds5dssy/,1,Use fidelity ,2018-01-03
58,janus_marine,ds5dt1y,/r/pennystocks/comments/7nva87/whats_everyones_long_term_marijuana_stock_holdings/ds5dt1y/,1,"Yeah, it's pure lotto ticket, but I mean...hey I'm up 22% already and pot has only been recreationally legal in that state 2 days lol.  ERBB owns *whole town* in CA.  Whatever they do, and however many bazillions of shares are out there, I still feel like it's not a longshot at all that the price is going to go up.  It's just a matter of how much :)",2018-01-03
59,rektamo,ds5dvwh,/r/pennystocks/comments/7nva87/whats_everyones_long_term_marijuana_stock_holdings/ds5dvwh/,1,"Regardless you never know, and long term I believe it’ll be legal everywhere and all of these stocks end up going big like the pharmaceutical ones ",2018-01-03
60,[deleted],ds5dwda,/r/pennystocks/comments/7nx2mm/might_be_a_silly_question_but_how_does_a_us/ds5dwda/,1,[removed],2018-01-03
61,apexgtp,ds5easg,/r/pennystocks/comments/7nx2mm/might_be_a_silly_question_but_how_does_a_us/ds5easg/,1,It’s 2018! Use your rotary phone! ,2018-01-03
62,[deleted],ds5eg2i,/r/pennystocks/comments/7nvu95/spcl_anyone/ds5eg2i/,1,[removed],2018-01-03
63,OsamaBinLifting,ds5emot,/r/pennystocks/comments/7nva87/whats_everyones_long_term_marijuana_stock_holdings/ds5emot/,1,Same boat. Those 400 percent gains are super tempting to cash out on but then it's a matter of finding the right price to get back in,2018-01-03
64,Ebailey0360,ds5fc47,/r/pennystocks/comments/7nx7nc/mict_thoughts_of_hitting_17/ds5fc47/,1,"I had a similar question, I posted to stocks got no answers but what’s to hope for and when to cash out?? Got in at .99",2018-01-03
65,AzProdigy602,ds5fn0d,/r/pennystocks/comments/7nxjna/args/ds5fn0d/,1,Yeah I sold 25% of shares just so I profited. Going to see how the market opens tomorrow.,2018-01-03
66,LandmanCA,ds5g5bk,/r/pennystocks/comments/7nx2mm/might_be_a_silly_question_but_how_does_a_us/ds5g5bk/,1,Questrade!,2018-01-03
67,queenslandbananas,ds5gk47,/r/pennystocks/comments/7nxrqd/how_we_made_52290_on_teum_ltea_and_kem_100/ds5gk47/,1,"Thanks for reporting that after the fact, that is very useful! 

",2018-01-03
68,ill_communicator,ds5gw1x,/r/pennystocks/comments/7nwayt/if_anyone_want_a_bit_of_reading_take_a_look_new/ds5gw1x/,1,Do you know of any listed on the LSE?,2018-01-03
69,Moed69,ds5hre0,/r/pennystocks/comments/7nwayt/if_anyone_want_a_bit_of_reading_take_a_look_new/ds5hre0/,1,"Not sure what your asking,  LSE?",2018-01-03
70,ill_communicator,ds5hzns,/r/pennystocks/comments/7nwayt/if_anyone_want_a_bit_of_reading_take_a_look_new/ds5hzns/,1,"London stock exchange, I’m looking to invest in this industry from a UK perspective.",2018-01-03
71,ill_communicator,ds5i1p5,/r/pennystocks/comments/7nwayt/if_anyone_want_a_bit_of_reading_take_a_look_new/ds5i1p5/,1,"London stock exchange, I’m looking to invest in this industry from a UK perspective.",2018-01-03
72,Hold_onto_yer_butts,ds5iza1,/r/pennystocks/comments/7nxrqd/how_we_made_52290_on_teum_ltea_and_kem_100/ds5iza1/,1,Dude you keep forgetting to switch from your alt account.,2018-01-03
73,Moed69,ds5j60i,/r/pennystocks/comments/7nwayt/if_anyone_want_a_bit_of_reading_take_a_look_new/ds5j60i/,1,"Let me see what I can find for you. 
Give me a few min. ",2018-01-03
74,JojenCopyPaste,ds5jwl6,/r/pennystocks/comments/7nx2mm/might_be_a_silly_question_but_how_does_a_us/ds5jwl6/,1,"Some are listed in the States on OTC, as a different ticker than the Canadian one. For instance Aurora Cannabis is ACB in Canada and ACBFF in the US.  So I guess you have to research whether the stock you want has an American symbol on OTC.",2018-01-03
75,zimzambIe,ds5k833,/r/pennystocks/comments/7ny9xz/is_360_blockchain_worth_it/ds5k833/,1,Blockchain as a whole is oversaturated just keep your eye out for the next buzzword hype play,2018-01-03
76,marcom2,ds5kzkt,/r/pennystocks/comments/7nva87/whats_everyones_long_term_marijuana_stock_holdings/ds5kzkt/,1,Just curious but why are you going with them ,2018-01-03
77,Hokuwa,ds5lo96,/r/pennystocks/comments/7nyw68/watch_these_4_stocks_if_you_want_to_profit/ds5lo96/,1,"Please man, talk less - more stocks. I gave you 5 minutes and learned nothing but a bad discord awaits me.",2018-01-03
78,zimzambIe,ds5lth9,/r/pennystocks/comments/7nxrqd/how_we_made_52290_on_teum_ltea_and_kem_100/ds5lth9/,1,You’re trash,2018-01-03
79,Budd0413,ds5lvm3,/r/pennystocks/comments/7nxrqd/how_we_made_52290_on_teum_ltea_and_kem_100/ds5lvm3/,1,This is like the discord....sell trash all day ,2018-01-03
80,Golightly2-,ds5mx5a,/r/pennystocks/comments/7nw1q0/nspr/ds5mx5a/,1,This seems like a good considering high past prices as you can gauge what its potential rise could be. What are thoughts on its potential ,2018-01-03
81,badwolf,ds5n1dq,/r/pennystocks/comments/7nx2mm/might_be_a_silly_question_but_how_does_a_us/ds5n1dq/,1,Interactive Brokers supports exchanges from around the world. They are usually the best for trading on non-domestic markets.,2018-01-03
82,t0kiwart00th,ds5nlb2,/r/pennystocks/comments/7nva87/whats_everyones_long_term_marijuana_stock_holdings/ds5nlb2/,1,"mydx   

I made some money on it last summer on one of its runs and got back in at an average around .006.  one of their analyzers have potential in the pot market, but the water analyzers reach outside the industry.  They're applying for medical device license in Canada as well.  

But, I'm an idiot, so I don't know what I'm talking about really.  YOLO, chicken tenders, yachts, etc....


",2018-01-03
83,wbcinvesting,ds5nt7v,/r/pennystocks/comments/7nva87/whats_everyones_long_term_marijuana_stock_holdings/ds5nt7v/,1,"I have CVSI and AMMJ for long-term holds. Their financials are great and definitely have enough working capital to last them for over a year. Now, it's a waiting a game for them to make a big jump.",2018-01-03
84,Alapahax2,ds5oqh7,/r/pennystocks/comments/7ny589/how_can_i_buy_otc_stocks_in_the_uk/ds5oqh7/,1,Through Questrade!,2018-01-03
85,ModerateStockTrader,ds5owpu,/r/pennystocks/comments/7nusa9/thoughts_on_mrphf/ds5owpu/,1,"I ran across it and liked it. They have a lot to prove however. I would research into when they were BCC and what their story was then as well as why their press releases sound so good considering they have a low share price.

Regardless though, they'll get sucked up in the hype and perform well.",2018-01-03
86,Alapahax2,ds5p0mp,/r/pennystocks/comments/7nva87/whats_everyones_long_term_marijuana_stock_holdings/ds5p0mp/,1,"Supreme/FIRE - ACB/Aurora - Radient Technologies/RTI - GoldenLeaf/GLD
Organigram/OGI Harvest/HVST ",2018-01-03
87,ModerateStockTrader,ds5p485,/r/pennystocks/comments/7nvsaz/thoughts_on_riot_and_btcs/ds5p485/,1,Says the guy in SANP.,2018-01-03
88,ModerateStockTrader,ds5p7c6,/r/pennystocks/comments/7nvsaz/thoughts_on_riot_and_btcs/ds5p7c6/,1,They both are crashing and at least one will bottom out next week. Depending on where you got in you can sell on a rebound or be left holding.,2018-01-03
89,lunchbox_6,ds5p7jb,/r/pennystocks/comments/7nvu95/spcl_anyone/ds5p7jb/,1,News flash. Don’t ,2018-01-03
90,zimzambIe,ds5paj5,/r/pennystocks/comments/7nvsaz/thoughts_on_riot_and_btcs/ds5paj5/,1,I’m in at .0005 tell me how I’m bad at investing,2018-01-03
91,la_tete_finance,ds5pdmb,/r/pennystocks/comments/7ny589/how_can_i_buy_otc_stocks_in_the_uk/ds5pdmb/,1,Questrade is limited to Canadians isn't it?,2018-01-03
92,Alapahax2,ds5pnrz,/r/pennystocks/comments/7ny589/how_can_i_buy_otc_stocks_in_the_uk/ds5pnrz/,1,I'm not to sure but I figure you can invest in any market from Questrade. So in return I'm sure you could sign up from anywhere considering you sign up.online and need a Bankwire or draft in order to deposit. My guess,2018-01-03
93,ModerateStockTrader,ds5puhw,/r/pennystocks/comments/7nw9n2/stlt_8k_to_sell_in_walmart/ds5puhw/,1,"Great find! Can I ask how you got word of this? Are you a traditional trader with actual company and product researching talent that helps you find products before they launch? If so, discuss more and your process of finding companies and stocks as well as their products when they are due for sale.",2018-01-03
94,JacksOffWithIcyHot,ds5sum7,/r/pennystocks/comments/7nxjna/args/ds5sum7/,1,Wait for it to dip and buy on the next pump,2018-01-03
95,FondleMeh,ds5tb9y,/r/pennystocks/comments/7nva87/whats_everyones_long_term_marijuana_stock_holdings/ds5tb9y/,1,TRTC,2018-01-03
96,[deleted],ds5uvfg,/r/pennystocks/comments/7nva87/whats_everyones_long_term_marijuana_stock_holdings/ds5uvfg/,1,[removed],2018-01-03
97,I_love_Hou_2,ds5x3s7,/r/pennystocks/comments/7nx2mm/might_be_a_silly_question_but_how_does_a_us/ds5x3s7/,1,Who has the best fees?,2018-01-03
98,Phoenixvibe,ds5z23j,/r/pennystocks/comments/7nva87/whats_everyones_long_term_marijuana_stock_holdings/ds5z23j/,1,The company is a solid one. The CEO.once owned SAXX and sold it for big money. He’s openly announced doing the same in this new venture. They are well on the way as a top 10 company in this sector. It’s a safe bet. Good luck!,2018-01-03
99,marcom2,ds61sqp,/r/pennystocks/comments/7nva87/whats_everyones_long_term_marijuana_stock_holdings/ds61sqp/,1,"Gonna do a bit more research on them but they look good, been looking for a decent company around this price point ",2018-01-03
100,TintStuff,ds62d0d,/r/pennystocks/comments/7nvu95/spcl_anyone/ds62d0d/,1,They defaulted on a recent loan for 68k and settled for 336k to be issued in shares...,2018-01-03
101,user_dan,ds653au,/r/pennystocks/comments/7ny9xz/is_360_blockchain_worth_it/ds653au/,1,"$BKLLF appears to be consolidating and it's in a good location. At like .18, the consolidation is broken, so you would know quickly and cheaply if you are wrong. Though, it is a super thin stock, so it will be difficult to sell on a stop.

If you are interested in cryptos, $PRELF is setting up great and is buyable now. $BTCS as well, but a few cents lower. $MGTI is great, but it would be better to start or add in the 3s.",2018-01-03
102,user_dan,ds659y9,/r/pennystocks/comments/7nusa9/thoughts_on_mrphf/ds659y9/,1,"I bought it this week because it has not really participated in the rally. It has great structure and is just starting to break out.

The measured move takes it to 2.00, but who knows where it will go.",2018-01-03
103,user_dan,ds65j5p,/r/pennystocks/comments/7nvsaz/thoughts_on_riot_and_btcs/ds65j5p/,1,"The crypto stocks have NOT been tracking the price of bitcoin. The recent crypto stock high flyers need a few weeks to consolidate and develop.

I have been looking to start a position in $BTCS at .17-.18, with a tight stop at .15 or so. It is at the lower end of a developing consolidation pattern. Good location.

$RIOT terrifies me. Sorry!

$PRELF is setting up great and is buyable now. $MGTI is my favorite, but I would not initiate here.. 3s might be a better location.",2018-01-03
104,peacefulpete,ds67x8l,/r/pennystocks/comments/7nva87/whats_everyones_long_term_marijuana_stock_holdings/ds67x8l/,1,"Damn, I would’ve gotten greedy with a lot of those gains already. Good job ",2018-01-03
105,contikipaul,ds6b2b1,/r/pennystocks/comments/7nx2mm/might_be_a_silly_question_but_how_does_a_us/ds6b2b1/,1,"Almost all Canadian stocks are tradable here with a normal brokerage account, a couple of penny stocks on the TSX Venture you need to buy as a true foreign issue.   What company, I will look up either the ADR or the 5-digit foreign symbol you can use.

",2018-01-03
106,Alapahax2,ds6cthd,/r/pennystocks/comments/7ny9xz/is_360_blockchain_worth_it/ds6cthd/,1,I just sold mine. You need patience with them. I do like this company though later on in the near future. ,2018-01-03
107,yezy99,ds6ghxh,/r/pennystocks/comments/7nva87/whats_everyones_long_term_marijuana_stock_holdings/ds6ghxh/,1,"Weeds rally ends today as Sessions announces that FED's can now prosecute those selling in legal states under federal law if they want, reversing the Obama policy from 2013. If I was yall I'd get out now take ya profits and run run run...",2018-01-03
108,rektamo,ds6gj40,/r/pennystocks/comments/7nva87/whats_everyones_long_term_marijuana_stock_holdings/ds6gj40/,1,"Most companies included are Canadian I think it’ll be fine, dipped today a bit cause of the panic it caused ",2018-01-03
109,yezy99,ds6htww,/r/pennystocks/comments/7nva87/whats_everyones_long_term_marijuana_stock_holdings/ds6htww/,1,Gonna have a domino effect I think. Unless your significantly up I'd still get out now maybe consider buying back in later ,2018-01-03
110,rektamo,ds6kcjb,/r/pennystocks/comments/7nva87/whats_everyones_long_term_marijuana_stock_holdings/ds6kcjb/,1,I’ll cash out for now see how it plays off in the months that come good looks ,2018-01-03
111,creepn1,ds6kxc9,/r/pennystocks/comments/7nv83o/phot_coming_back_as_weed_rallies/ds6kxc9/,1,...and [KABOOM...](https://apnews.com/19f6bfec15a74733b40eaf0ff9162bfa),2018-01-03
112,dak1b2006,ds6ux7x,/r/pennystocks/comments/7nva87/whats_everyones_long_term_marijuana_stock_holdings/ds6ux7x/,1,$INSY $XXII $MJX $TRVN,2018-01-03
113,TugMyJohnston,ds70y8d,/r/pennystocks/comments/7nv8oc/myhi_doing_very_well_last_couple_of_days/ds70y8d/,1,I lost all of my profits in the last 2months because of this stock in the last 2 days. Stay away in my op,2018-01-03
114,ill_communicator,ds7xkjf,/r/pennystocks/comments/7nwayt/if_anyone_want_a_bit_of_reading_take_a_look_new/ds7xkjf/,1,"&gt; GLEN

thanks! i'll look into my broker charges for US and Canadian stock",2018-01-03
115,ModerateStockTrader,ds9w1j2,/r/pennystocks/comments/7ny9xz/is_360_blockchain_worth_it/ds9w1j2/,1,PRELF is great. I'm not sure why it's not in the high 3's. MGTI will probably never go back lower than the low 4's or high 3's. What are your thoughts on BTCS? Do you just ride the wave?,2018-01-03
