,author,id,url,score,text,date
0,cobowobo,eptkh8n,/r/pennystocks/comments/bvyubz/everyone_ready_for_the_upcoming_week/eptkh8n/,1,Mainly focusing on crypto next week exception is hope to load up on some more WKHS at a lower rate.,2019-06-02
1,raw_testosterone,epu4mo8,/r/pennystocks/comments/bvyubz/everyone_ready_for_the_upcoming_week/epu4mo8/,1,No idea. Hoping to get lucky,2019-06-02
2,goldenboypwner,epu4uxw,/r/pennystocks/comments/bvyubz/everyone_ready_for_the_upcoming_week/epu4uxw/,1,Best of luck then bro😁,2019-06-02
3,CrossDamon,epua5rr,/r/pennystocks/comments/bw1kbz/aveo_is_set_for_a_break_out_this_week_anyone_else/epua5rr/,1,I am now,2019-06-02
4,bawkawteep,epuhm75,/r/pennystocks/comments/bw1kbz/aveo_is_set_for_a_break_out_this_week_anyone_else/epuhm75/,1,How high you think it'll go?,2019-06-02
5,gravballe,epuhxbr,/r/pennystocks/comments/bvyubz/everyone_ready_for_the_upcoming_week/epuhxbr/,1,please be this week arci do their sale.,2019-06-02
6,Anarkrist,epukxyv,/r/pennystocks/comments/bw1kbz/aveo_is_set_for_a_break_out_this_week_anyone_else/epukxyv/,1,I'm gonna throw a buck at it at various levels...,2019-06-02
7,CrossDamon,eputl8a,/r/pennystocks/comments/bw1kbz/aveo_is_set_for_a_break_out_this_week_anyone_else/eputl8a/,1,🚀🚀🚀🚀,2019-06-02
8,AllOutMovies,epuy4sj,/r/pennystocks/comments/bw3kpr/is_there_a_stock_screener_that_you_can_control/epuy4sj/,1,"ThinkorSwim provides an on-demand feature where you can go back to previous days/weeks/months even years on any given trading day. However, scanners are not available on the on-demand feature. So I usually look for which stocks had an earnings report that day to know it’s gonna be in play. You have to get TD Ameritrade to get ThinkorSwim but it’s a very resourceful tool.",2019-06-02
9,Stockbaron,epve7i1,/r/pennystocks/comments/bw1kbz/aveo_is_set_for_a_break_out_this_week_anyone_else/epve7i1/,1,"With volume if it breaks a $1, easily 1.50, likely more. A few months ago it broke to 1.85. There were huge insider buys last week at 1.14 a share. So you want to be first in on this.",2019-06-02
10,justinswagvila,epvi9sd,/r/pennystocks/comments/bw1kbz/aveo_is_set_for_a_break_out_this_week_anyone_else/epvi9sd/,1,Why is it set for a break out?,2019-06-02
11,JayBlRD,epvp11n,/r/pennystocks/comments/bw1kbz/aveo_is_set_for_a_break_out_this_week_anyone_else/epvp11n/,1,Looks like a good setup given the conditions on Friday I’m watching it in the morning now,2019-06-02
12,Wild_Luxray,epvrbe4,/r/pennystocks/comments/bw1kbz/aveo_is_set_for_a_break_out_this_week_anyone_else/epvrbe4/,1,"Going long for 100 shares, if the price keeps climbing I'll get a call or two also",2019-06-02
13,JLevPark,epxc8fg,/r/pennystocks/comments/bvxp0p/bullish_penny_stocks_110_for_the_week_of_632019/epxc8fg/,1,Beginning to love this user,2019-06-02
14,Transparent_Traders,epxcagm,/r/pennystocks/comments/bvxp0p/bullish_penny_stocks_110_for_the_week_of_632019/epxcagm/,1,Yep lot of money made on these plays.,2019-06-02
15,JLevPark,epxcdvq,/r/pennystocks/comments/bvxp0p/bullish_penny_stocks_110_for_the_week_of_632019/epxcdvq/,1,At this point I'm willing to do anything to help this page out lol I'll keep visiting your site for ad revenue,2019-06-02
16,Transparent_Traders,epxclxl,/r/pennystocks/comments/bvxp0p/bullish_penny_stocks_110_for_the_week_of_632019/epxclxl/,1,Awesome.  Thank you.,2019-06-02
17,wadester007,epxihb6,/r/pennystocks/comments/bvxp0p/bullish_penny_stocks_110_for_the_week_of_632019/epxihb6/,1,Same,2019-06-02
