,author,id,url,score,text,date
103,Denio595,f829n0g,/r/pennystocks/comments/dy89ae/for_the_novice_who_is_looking_to_make_some_gains/f829n0g/,1,buy some .0001 stock without a bloated float in september.  sell it at .0008,2019-11-18
104,ssjinblue,f82fpim,/r/pennystocks/comments/dxxsk5/has_anyone_actually_made_money_from_penny_stocks/f82fpim/,1,Short Term yes. I positioned when it was $0.05 and got out $0.11. Risky.,2019-11-18
105,jameson62,f82jwvh,/r/pennystocks/comments/dxw7d3/some_biotech_catalyst_penny_stocks_to_watch_this/f82jwvh/,1,consolidated a little. Still holding its support for now it looks like.,2019-11-18
106,Zulumus,f82qpt8,/r/pennystocks/comments/dy7l8b/spso_q3/f82qpt8/,1,"5,000 shares at .0217, I’ll wait for a dip and probably pick up some more.",2019-11-18
107,[deleted],f849b26,/r/pennystocks/comments/dxxsk5/has_anyone_actually_made_money_from_penny_stocks/f849b26/,1,[removed],2019-11-18
108,veilwalker,f84oywl,/r/pennystocks/comments/dy89ae/for_the_novice_who_is_looking_to_make_some_gains/f84oywl/,1,"Wait, people buy penny stocks to hold?",2019-11-18
109,alaskaj1,f84q3fr,/r/pennystocks/comments/dy3brz/how_to_trade_us_penny_stocks_from_the_uk_without/f84q3fr/,1,I just got an alert on the app that robinhood is launching in the UK in 2020.,2019-11-18
110,jackm831,f84qnw0,/r/pennystocks/comments/dy3brz/how_to_trade_us_penny_stocks_from_the_uk_without/f84qnw0/,1,[Robinhood is launching in the UK](uk.robinhood.com/rhf),2019-11-18
111,jackm831,f84qpjk,/r/pennystocks/comments/dy3brz/how_to_trade_us_penny_stocks_from_the_uk_without/f84qpjk/,1,[Robinhood is launching in the UK](uk.robinhood.com/rhf),2019-11-18
112,joe1587,f88amx1,/r/pennystocks/comments/dxxsk5/has_anyone_actually_made_money_from_penny_stocks/f88amx1/,1,I think the biggest piece of advice is TAKE PROFITS... We get greedy and want more and then wind up losing more. So sell when you have profit don't wait for it to come up more.,2019-11-18
113,gabazine,f8b0p3y,/r/pennystocks/comments/dxxsk5/has_anyone_actually_made_money_from_penny_stocks/f8b0p3y/,1,"Hi, nice stock gains, can you suggest any others",2019-11-18
114,Rally12345,f93s7c8,/r/pennystocks/comments/dxwtuu/pareteum_teum_opinions/f93s7c8/,1,"Reverse split, bankruptcy imminent. Mgmt engaged in fraud by lying about their financials for nearly 2 years.  They are self-destructing.",2019-11-18
115,SapientSerpent,f9747f8,/r/pennystocks/comments/dxxsk5/has_anyone_actually_made_money_from_penny_stocks/f9747f8/,1,"ATNM, garbage company with an absolutely amazing drug.

ONTX, meh drug, ride the pump and dump with everyone else

AGRX:  great company, ok drug.  I got in at .57 asp but will jump on FDA approval, which with 95% certainty will happen, plan to sell some and keep rest for likely buyout once it makes it to market",2019-11-18
116,SapientSerpent,f974fdw,/r/pennystocks/comments/dxxsk5/has_anyone_actually_made_money_from_penny_stocks/f974fdw/,1,Sell SOME to take a profit and ride the free shares left over,2019-11-18
117,peakfreak18,f9mux1z,/r/pennystocks/comments/dy3ykj/plx_fda_preapproval/f9mux1z/,1,"Bought based on this, up nearly 40%. Thanks for the tip!",2019-11-18
118,SpaceCatVII,fanei8g,/r/pennystocks/comments/dxxsk5/has_anyone_actually_made_money_from_penny_stocks/fanei8g/,1,Check out Altium (on the ASX). $0.10 in 2011 to ~$35.00 today,2019-11-18
119,SpaceCatVII,fanennt,/r/pennystocks/comments/dxxsk5/has_anyone_actually_made_money_from_penny_stocks/fanennt/,1,He said *make money* not *lose money*.,2019-11-18
