,author,id,url,score,text,date
0,[deleted],dvcxl9c,/r/pennystocks/comments/82ufk8/best_penny_stocks_right_now/dvcxl9c/,1,[removed],2018-03-08
1,HotFudgeMuffin,dvcxtyd,/r/pennystocks/comments/82ufk8/best_penny_stocks_right_now/dvcxtyd/,1,"I’m invested in MJNA and it seems like a good bet, with good projections and legalization coming.",2018-03-08
2,olivertwist225,dvcy5kh,/r/pennystocks/comments/82ufk8/best_penny_stocks_right_now/dvcy5kh/,1,Advt is one of my favorites in the cannabis sector. ,2018-03-08
3,ThisIsMyStocksAlt,dvcz3rf,/r/pennystocks/comments/82ufk8/best_penny_stocks_right_now/dvcz3rf/,1,AKER volume is way up against a whale around its day high. ,2018-03-08
4,hkbk2011,dvd0amj,/r/pennystocks/comments/82ufk8/best_penny_stocks_right_now/dvd0amj/,1,Nvcn. ,2018-03-08
5,finch5,dvd11lp,/r/pennystocks/comments/82ufk8/best_penny_stocks_right_now/dvd11lp/,1,Niiice. Thanks for this. ,2018-03-08
6,getoffmylawn13,dvd18s8,/r/pennystocks/comments/82ufk8/best_penny_stocks_right_now/dvd18s8/,1,"BYSD. Been holding long for a bit, crypto play plus a legit ceo. Hoping my gamble can pay off.",2018-03-08
7,Sluttywife08,dvd1hgt,/r/pennystocks/comments/82ub8k/great_day_for_marijuana_stocks_3718/dvd1hgt/,1,Not really.,2018-03-08
8,Adlm-tradepost,dvd3qvc,/r/pennystocks/comments/82ufk8/best_penny_stocks_right_now/dvd3qvc/,1,ATRS for break out &amp; IPNX for Short squeeze . Short term trades. Bought both yesterday.,2018-03-08
9,SaitoPrecise7,dvd43pe,/r/pennystocks/comments/82ufk8/best_penny_stocks_right_now/dvd43pe/,1,B P M X ,2018-03-08
10,TheCaIifornian,dvd53no,/r/pennystocks/comments/82vbbe/inpx_bpmx_repeat/dvd53no/,1,Have a look at INPX’s 5 year and let me know how you feel about it. ,2018-03-08
11,OmenQtx,dvd6fk8,/r/pennystocks/comments/82ufk8/best_penny_stocks_right_now/dvd6fk8/,1,BYOC,2018-03-08
12,DreDay9,dvd6pve,/r/pennystocks/comments/82ufk8/best_penny_stocks_right_now/dvd6pve/,1,Thoughts on PLM?,2018-03-08
13,AdamCaveRoberts,dvd820t,/r/pennystocks/comments/82ufk8/best_penny_stocks_right_now/dvd820t/,1,Moon,2018-03-08
14,Chickachic-aaaaahhh,dvd8mqj,/r/pennystocks/comments/82vbbe/inpx_bpmx_repeat/dvd8mqj/,1,This right hurr,2018-03-08
15,erkaaj,dvd9md0,/r/pennystocks/comments/82ub8k/great_day_for_marijuana_stocks_3718/dvd9md0/,1,"If you are in it for a quick buck, then this is probably a good buy. But in 6 months none of these will survive the competition from the big guys.",2018-03-08
16,mog75,dvdboee,/r/pennystocks/comments/82ufk8/best_penny_stocks_right_now/dvdboee/,1,"oh shit, the top isnt bpmx anymore. NEW PENNYSTOCK MEME FOR THE NEXT WEEEK BOIS",2018-03-08
17,rowlzies,dvdct3j,/r/pennystocks/comments/82ufk8/best_penny_stocks_right_now/dvdct3j/,1,$HS $UAV,2018-03-08
18,13MSC,dvddqx9,/r/pennystocks/comments/82ufk8/best_penny_stocks_right_now/dvddqx9/,1,Husa,2018-03-08
19,DogFarts,dvdf0pr,/r/pennystocks/comments/82ufk8/best_penny_stocks_right_now/dvdf0pr/,1,Tggi and hcti. Huge volume ,2018-03-08
20,Jredrum,dvdg84t,/r/pennystocks/comments/82wi37/pump_and_dumps_from_a_selfmade_millionaire_trader/dvdg84t/,1,Pro tip: start with a million dollars,2018-03-08
21,novruzj,dvdhipn,/r/pennystocks/comments/82ufk8/best_penny_stocks_right_now/dvdhipn/,1,Right now? NSPR maybe,2018-03-08
22,FuckGasparGomez,dvdhpqt,/r/pennystocks/comments/82vbbe/inpx_bpmx_repeat/dvdhpqt/,1,what ever dude ill see you on the moon shorty ,2018-03-08
23,ErectGainz,dvdi0l9,/r/pennystocks/comments/82ufk8/best_penny_stocks_right_now/dvdi0l9/,1,"HIPH
They will be releasing their new hydrogen water by this Summer.",2018-03-08
24,ryanheis,dvdic67,/r/pennystocks/comments/82wi37/pump_and_dumps_from_a_selfmade_millionaire_trader/dvdic67/,1,"Get the fuck out of here with that tim sykes bullshit
",2018-03-08
25,avaldez321,dvdiiss,/r/pennystocks/comments/82wi37/pump_and_dumps_from_a_selfmade_millionaire_trader/dvdiiss/,1,Just get a small loan of a million dollars,2018-03-08
26,riscphree,dvdjkvj,/r/pennystocks/comments/82ufk8/best_penny_stocks_right_now/dvdjkvj/,1,$LDSR has been moving .....,2018-03-08
27,SikoraP13,dvdjz4r,/r/pennystocks/comments/82ufk8/best_penny_stocks_right_now/dvdjz4r/,1,...isn't water already 1/3 hydrogen...?,2018-03-08
28,ErectGainz,dvdkzqa,/r/pennystocks/comments/82ufk8/best_penny_stocks_right_now/dvdkzqa/,1,"My mistake, I meant to say Hydrogen infused CBD water. An article I read said it will release in this Summer.",2018-03-08
29,[deleted],dvdl6a3,/r/pennystocks/comments/82ufk8/best_penny_stocks_right_now/dvdl6a3/,1,[removed],2018-03-08
30,SikoraP13,dvdlp09,/r/pennystocks/comments/82ufk8/best_penny_stocks_right_now/dvdlp09/,1,"That makes a lot more sense, haha.  And it's okay, I mean't to type 2/3's so we're right there together.",2018-03-08
31,sup278,dvdlxlg,/r/pennystocks/comments/82vbbe/inpx_bpmx_repeat/dvdlxlg/,1,Low rn,2018-03-08
32,IGOSODAMNHAM,dvdlyfz,/r/pennystocks/comments/82y073/aker_a_break_under_60_and_this_falls_to_at_least/dvdlyfz/,1,There it goes. Hit .55. Probably got a lot lower to go. https://imgur.com/JaGI7o6,2018-03-08
33,Hemb,dvdm1oh,/r/pennystocks/comments/82y073/aker_a_break_under_60_and_this_falls_to_at_least/dvdm1oh/,1,I'm curious how you can tell that it's being held up by a prop bid?  Where can I find info like that?,2018-03-08
34,Alex123432,dvdmevl,/r/pennystocks/comments/82y5te/looks_like_bpmx_isnt_going_to_the_moon/dvdmevl/,1,"One bad day doesn't mean shit, if Apple were to have a red day does that mean they're going bankrupt? Or whatever? No. This is a sale take advantage of it, and as far as I can tell there's no specific reason for the dip but just overall market fear",2018-03-08
35,Giodan1026,dvdmg8q,/r/pennystocks/comments/82y5te/looks_like_bpmx_isnt_going_to_the_moon/dvdmg8q/,1,so I should put away the tin-foil conspiracy hats?,2018-03-08
36,Highneedbulletdeed,dvdmi2d,/r/pennystocks/comments/82xd8c/xxii_watch_this_one_today/dvdmi2d/,1,Been hearing that song and dance for a year. They need to get their shit together ,2018-03-08
37,zooantharia,dvdmi3k,/r/pennystocks/comments/82y5te/looks_like_bpmx_isnt_going_to_the_moon/dvdmi3k/,1,Didn't the price double in the last two months? ,2018-03-08
38,seebz69,dvdmksi,/r/pennystocks/comments/82y5te/looks_like_bpmx_isnt_going_to_the_moon/dvdmksi/,1,Did u just compare an OTC penny stock to Apple.. lmfao,2018-03-08
39,Alex123432,dvdmly7,/r/pennystocks/comments/82y5te/looks_like_bpmx_isnt_going_to_the_moon/dvdmly7/,1,Yes please. And overall even if these tarrifs get signed it's almost nothing in the long run. I wish people would keep emotions out of politics and emotions and politics out of money. I don't think people actaully realize how much other countries already tax American countries. And we don't do anything in return. A trade war will most likely not happen. And if it does it will actaully be quick and easy for the US. It's been proven over and over again that the media has a second narrative idk why investors are listen ij ng to them,2018-03-08
40,Alex123432,dvdmp4n,/r/pennystocks/comments/82y5te/looks_like_bpmx_isnt_going_to_the_moon/dvdmp4n/,1,Yes I did because it's a legit comoany that's not gonna disappear tmr as long as the world doesn't disappear tmr,2018-03-08
41,IGOSODAMNHAM,dvdmpnp,/r/pennystocks/comments/82y073/aker_a_break_under_60_and_this_falls_to_at_least/dvdmpnp/,1,"It was pretty obvious if you read LVL 2. Most brokers have it. TOS make sure you subscribe to live lvl 2, which is free.",2018-03-08
42,seebz69,dvdmwdu,/r/pennystocks/comments/82y5te/looks_like_bpmx_isnt_going_to_the_moon/dvdmwdu/,1,"Look whos in the white house, the world could very well dissapear tomorrow. Haha ill remain opptimisic but i believe $SRPT is a safer alternative..",2018-03-08
43,Alex123432,dvdn1vy,/r/pennystocks/comments/82y5te/looks_like_bpmx_isnt_going_to_the_moon/dvdn1vy/,1,"This is a prime example. Who the fuck cares who's in the white house? Today he's in there tomorrow will be someone else. And my oither philosophy when it comes to investing is that, if the world goes down the shitter so far that my investments all default go bankrupt whatever. Then I most likely have other problems to worry about that money probably can't solve, such as surviving the apocalypse... since that's the only situation where the stock market won't recover.",2018-03-08
44,seebz69,dvdn4ug,/r/pennystocks/comments/82y5te/looks_like_bpmx_isnt_going_to_the_moon/dvdn4ug/,1,"Wow this conversation got irrelevant, really fast.. i was clearly being sarcastic. good day sir. ",2018-03-08
45,alexela805,dvdnhhx,/r/pennystocks/comments/82y5te/looks_like_bpmx_isnt_going_to_the_moon/dvdnhhx/,1,Fear is the worst thing in the stock market. People are just panicking but it will go back up,2018-03-08
46,IGOSODAMNHAM,dvdnhj6,/r/pennystocks/comments/82y5te/looks_like_bpmx_isnt_going_to_the_moon/dvdnhj6/,1,"It's a pump Bioturd. I dono why this sub and so many new traders are always trading Bio penny stocks. This trash came from .01 to over .30. Maybe it goes higher, but not something I would hold overnight.",2018-03-08
47,IGOSODAMNHAM,dvdni14,/r/pennystocks/comments/82y5te/looks_like_bpmx_isnt_going_to_the_moon/dvdni14/,1,"It's a pump Bioturd. I dono why this sub and so many new traders are always trading Bio penny stocks. This trash came from .01 to over .30. Maybe it goes higher, but not something I would hold overnight.",2018-03-08
48,Hemb,dvdnl2v,/r/pennystocks/comments/82y073/aker_a_break_under_60_and_this_falls_to_at_least/dvdnl2v/,1,This is exactly what I was looking for! Thanks for helping out a newbie.  And nice prediction btw.,2018-03-08
49,Alex123432,dvdns91,/r/pennystocks/comments/82y5te/looks_like_bpmx_isnt_going_to_the_moon/dvdns91/,1,Why are you in this sub if it's all trash in here? I've been watching this sub for a few months now and this is the only one I see potential in. It's not a pump this company needs 1 dollar to avoid delisting ,2018-03-08
50,seebz69,dvdnxdk,/r/pennystocks/comments/82y5te/looks_like_bpmx_isnt_going_to_the_moon/dvdnxdk/,1,Agreed. I red flagged this stock 2 days ago with warning signs of a pump and everyone just bashed me. Smh,2018-03-08
51,Ragefan66,dvdo4an,/r/pennystocks/comments/82y55r/ntlk_has_seen_a_good_boom_any_one_else_here_own/dvdo4an/,1,Good position to short IMO. This will touch 290 before blasting back into the 300's again. Expect to see 290 in next 30 days,2018-03-08
52,ZIgnorantProdigy,dvdo5n7,/r/pennystocks/comments/82xd8c/xxii_watch_this_one_today/dvdo5n7/,1,"Yeah I've had it for a while, about even now. That's why I'm very interested in the call. Hoping there will be some actual substance and not just ""we are positioned well in the future""",2018-03-08
53,jeahh,dvdoe5a,/r/pennystocks/comments/82y5te/looks_like_bpmx_isnt_going_to_the_moon/dvdoe5a/,1,"I think it’s funny that people think huge price appreciation is 100% synonymous with pumping. 

Stocks go up that do well and are growing.

Typical OTC stigma talk.. sheeple",2018-03-08
54,Highneedbulletdeed,dvdof6o,/r/pennystocks/comments/82xd8c/xxii_watch_this_one_today/dvdof6o/,1,Yeah I hear you. Not being a negative Nancy but I've held it for so long and heard about catalysts that you get cynical ,2018-03-08
55,Giodan1026,dvdof6r,/r/pennystocks/comments/82y5te/looks_like_bpmx_isnt_going_to_the_moon/dvdof6r/,1,I love you,2018-03-08
56,ZIgnorantProdigy,dvdokvs,/r/pennystocks/comments/82yfdm/jagx_the_next_bpmx/dvdokvs/,1,was directed to it at .14 .... so upset I didn't/still don't have any free funds,2018-03-08
57,Giodan1026,dvdoxg8,/r/pennystocks/comments/82y5te/looks_like_bpmx_isnt_going_to_the_moon/dvdoxg8/,1,I know. I’m just pulling everyone’s legs because the hype yesterday. Including my own haha,2018-03-08
58,_Jrt,dvdozgl,/r/pennystocks/comments/82y5te/looks_like_bpmx_isnt_going_to_the_moon/dvdozgl/,1,Wait til earnings..,2018-03-08
59,Giodan1026,dvdp0uy,/r/pennystocks/comments/82y5te/looks_like_bpmx_isnt_going_to_the_moon/dvdp0uy/,1,Lol tis but a sarcastic post about the hype yesterday ,2018-03-08
60,itzjamesftw,dvdp583,/r/pennystocks/comments/82y5te/looks_like_bpmx_isnt_going_to_the_moon/dvdp583/,1,"Yes. 

I have no idea what ""the moon"" means to these kids.

Yolo investers.",2018-03-08
61,heckyakittens,dvdpirl,/r/pennystocks/comments/82ykmm/vtnl/dvdpirl/,1,"Holding 20,000. Bought in around the 0.005 mark sadly, but have some semblance of hope.",2018-03-08
62,jigre1,dvdpl7u,/r/pennystocks/comments/82y5te/looks_like_bpmx_isnt_going_to_the_moon/dvdpl7u/,1,"I hope more people think like you, I'll take the discounts!",2018-03-08
63,Flash_ina_pan,dvdpldj,/r/pennystocks/comments/82ykmm/vtnl/dvdpldj/,1,"The bag is heavy, but I'm not in in any great amount. I don't gamble with money I can't afford to lose.",2018-03-08
64,seebz69,dvdpw7z,/r/pennystocks/comments/82ykmm/vtnl/dvdpw7z/,1,My buddy texted me yesterday saying his actual vet was talking about this company and their CBD drops for pets. (He lives in Colorado) Thought it was interesting that real vets may become advocates for it. Ill hope for the best :),2018-03-08
65,Highneedbulletdeed,dvdq1id,/r/pennystocks/comments/82yfdm/jagx_the_next_bpmx/dvdq1id/,1,Jagx is a pretty common pump and dump. Ah I see it's in mid pump right now ,2018-03-08
66,kylesatwork,dvdq53f,/r/pennystocks/comments/82yitz/website_search_volumetraffic_vs_stock_price/dvdq53f/,1,Amazon,2018-03-08
67,Giodan1026,dvdq70s,/r/pennystocks/comments/82y5te/looks_like_bpmx_isnt_going_to_the_moon/dvdq70s/,1,Haha,2018-03-08
68,skrfs,dvdqizs,/r/pennystocks/comments/82yitz/website_search_volumetraffic_vs_stock_price/dvdqizs/,1,/r/pennystocks ,2018-03-08
69,holeeray,dvdrcmj,/r/pennystocks/comments/82ykmm/vtnl/dvdrcmj/,1,"350k shares averaged to $.0038 here so a bit baggy.  I'm not 100% on the share buyback, but there's supposed to be some kind of product release on the 15th so I'll be holding until then at least.",2018-03-08
70,seebz69,dvdrhrm,/r/pennystocks/comments/82ykmm/vtnl/dvdrhrm/,1,"Dan Rushford, CEO, stated, “In the past 60 days the company has announced orders for $3.7M for our CBD Pet Drops and Treats. We have announced our new CBD Oral Pet Sprays being available on March 15, 2018. We will also roll out our new Pet Performance Products next week.  As we exceed our projections, we have instituted a share buy-back program for March-2018 as a part of retiring 80% of our float.”",2018-03-08
71,holeeray,dvdro0y,/r/pennystocks/comments/82ykmm/vtnl/dvdro0y/,1,"I only say I'm not 100% on the share buyback because there's some uncertainty about the share buyback because there are reports of an increase in AS from last week.  L2 showed some major blocks bought yesterday so that might be the buyback in action.  If it is, it's good timing.  VTNL could fly next week on PR.",2018-03-08
72,seebz69,dvdrqzr,/r/pennystocks/comments/82ykmm/vtnl/dvdrqzr/,1,"I really appreciate the input, thanks!",2018-03-08
73,FuckGasparGomez,dvdrvva,/r/pennystocks/comments/82yfdm/jagx_the_next_bpmx/dvdrvva/,1,"They are all pump n dumps, nobody here wants and will believe that because they all wanna get rich quick off a 25 dollar investiment on robin hood. lol aha",2018-03-08
74,clarky2o2o,dvdsq3a,/r/pennystocks/comments/82ykmm/vtnl/dvdsq3a/,1,Who did you broker with? Ally wont deal with anything less than 1 cent.,2018-03-08
75,IGOSODAMNHAM,dvdsqlm,/r/pennystocks/comments/82y5te/looks_like_bpmx_isnt_going_to_the_moon/dvdsqlm/,1,"What do you see potential about this stock? Seriously? It has to be $1 to avoid delisting? So upcoming reverse split? Just because something has to be 1$ doesn't mean it will go there by people buying it. I bet the CEO wants the stock to be at $100, the market doesn't agree.",2018-03-08
76,seebz69,dvdsu7p,/r/pennystocks/comments/82ykmm/vtnl/dvdsu7p/,1,"I use schwab, most people use robinhood.",2018-03-08
77,meetballin25,dvdsuy6,/r/pennystocks/comments/82yy2r/when_to_sell_jagx/dvdsuy6/,1,Now,2018-03-08
78,meetballin25,dvdsvdc,/r/pennystocks/comments/82ycmz/jagx/dvdsvdc/,1,Down,2018-03-08
79,avaldez321,dvdsy9l,/r/pennystocks/comments/82yy2r/when_to_sell_jagx/dvdsy9l/,1,5 minutes ago,2018-03-08
80,Rafa101010,dvdt0x0,/r/pennystocks/comments/82ycmz/jagx/dvdt0x0/,1,I was able to sell at .38 and made about $200 so I’m not mad haha. ,2018-03-08
81,brink8704,dvdt2yn,/r/pennystocks/comments/82yy2r/when_to_sell_jagx/dvdt2yn/,1,Thanks for the advice. Made $60. Not bad for one of my first investments!,2018-03-08
82,Alex123432,dvdt6xh,/r/pennystocks/comments/82y5te/looks_like_bpmx_isnt_going_to_the_moon/dvdt6xh/,1,"New drug approval coming soon, earnings report, possible buytouts/mergers. It's got more potential then your first 3 children",2018-03-08
83,Numero_Jones,dvdtoqa,/r/pennystocks/comments/82yy2r/when_to_sell_jagx/dvdtoqa/,1,Not yet !,2018-03-08
84,meetballin25,dvdtv4m,/r/pennystocks/comments/82yy2r/when_to_sell_jagx/dvdtv4m/,1,Why,2018-03-08
85,ryoon21,dvdtv8d,/r/pennystocks/comments/82ufk8/best_penny_stocks_right_now/dvdtv8d/,1,My current money maker is ADAC. I bought in at 0.0315. It’s currently .079 but got as high as 0.0893 today. Just got news recently that it qualifies for another tier of the OTC markets. I’m holding for now. ,2018-03-08
86,catchingtherosemary,dvdtxbn,/r/pennystocks/comments/82yitz/website_search_volumetraffic_vs_stock_price/dvdtxbn/,1,as someone who is working on a computer program that trades stocks this is a great idea and i might steal it.,2018-03-08
87,ryoon21,dvdtyh3,/r/pennystocks/comments/82ufk8/best_penny_stocks_right_now/dvdtyh3/,1,I have some in HIPH. It’s only been a disappointment but I’m hoping for some more positive news. ,2018-03-08
88,Newflyer3,dvdu1dk,/r/pennystocks/comments/82ycmz/jagx/dvdu1dk/,1,Scalped it from 0.24 to 0.34 with 17000 shares so made a hair under $3000? Missed the 0.44 run up but idgaf,2018-03-08
89,Psychonaut_funtime,dvdu5vp,/r/pennystocks/comments/82ycmz/jagx/dvdu5vp/,1,So not one to hold for a bit?,2018-03-08
90,hkbk2011,dvdu6f3,/r/pennystocks/comments/82ycmz/jagx/dvdu6f3/,1,good call,2018-03-08
91,Newflyer3,dvdu82r,/r/pennystocks/comments/82ycmz/jagx/dvdu82r/,1,I see upside in the coming weeks but I need money to avg down on BPMX right now,2018-03-08
92,skazzy2,dvdug3f,/r/pennystocks/comments/82yfdm/jagx_the_next_bpmx/dvdug3f/,1,Got in at .18 and out at .32. Looks like pump is done. Missed .44 mark an hour ago.,2018-03-08
93,Psychonaut_funtime,dvdurax,/r/pennystocks/comments/82ycmz/jagx/dvdurax/,1,"Nice, I just started trading about 3 months ago and in the same boat. This place has helped me research instead of just scrolling the interwebs.",2018-03-08
94,FuckGasparGomez,dvdvitc,/r/pennystocks/comments/82y5te/looks_like_bpmx_isnt_going_to_the_moon/dvdvitc/,1,"this isnt ihub sucker, we dont blindly promote crap. we are realist here. ",2018-03-08
95,Alex123432,dvdvk6q,/r/pennystocks/comments/82y5te/looks_like_bpmx_isnt_going_to_the_moon/dvdvk6q/,1,Check the rest of the comment string sucker,2018-03-08
96,[deleted],dvdvlm7,/r/pennystocks/comments/82yy2r/when_to_sell_jagx/dvdvlm7/,1,[removed],2018-03-08
97,FuckGasparGomez,dvdvmcv,/r/pennystocks/comments/82y5te/looks_like_bpmx_isnt_going_to_the_moon/dvdvmcv/,1,come get me we bpmx gets over 3 dollars. it never will. SCAM ,2018-03-08
98,Mjeffe10,dvdvvkg,/r/pennystocks/comments/82xd8c/xxii_watch_this_one_today/dvdvvkg/,1,Sold today on accident. Set a 4% trailing stop. It was up like 9% and just fell. I’m done with this. ,2018-03-08
99,Alex123432,dvdw5di,/r/pennystocks/comments/82y5te/looks_like_bpmx_isnt_going_to_the_moon/dvdw5di/,1,"Ok why do you say that, you want to play the game of not being a blind sucker. What I think is that you missed out then bought yesterday then panic sold today and lost big. Why do you say it's a scam I've given reasons why it's not. Your turn to prove me wrong",2018-03-08
100,Rafa101010,dvdx3r3,/r/pennystocks/comments/82ycmz/jagx/dvdx3r3/,1,Same boat for me! It’s been a great start to investing. ,2018-03-08
101,cowfantry,dvdxl8u,/r/pennystocks/comments/82ykmm/vtnl/dvdxl8u/,1,Robinhood doesn't support these penny stocks. Their cheapest is like .09 last I checked. ,2018-03-08
102,FuckGasparGomez,dvdxoqi,/r/pennystocks/comments/82y5te/looks_like_bpmx_isnt_going_to_the_moon/dvdxoqi/,1,"SCAM,THIS STOCK WILL GO BACK TOO UNDER A PENNY. BUYER BEWARE. MARK MY WORDS THIS IS GOING BACK TO 01.  GET OUT NOW!!!!!! ;)",2018-03-08
103,Alex123432,dvdxpyj,/r/pennystocks/comments/82y5te/looks_like_bpmx_isnt_going_to_the_moon/dvdxpyj/,1,Lmao this man just wants a bigger dip to buy in cuz he missed out and has no proof that it's a scam...,2018-03-08
104,Alex123432,dvdxrx2,/r/pennystocks/comments/82y5te/looks_like_bpmx_isnt_going_to_the_moon/dvdxrx2/,1,"Poor thing, didn't anyone ever tell you that time in the market beats timing the market? Just buy in and be happy in a month instead of trying to make a dip",2018-03-08
105,Alex123432,dvdxvzh,/r/pennystocks/comments/82y5te/looks_like_bpmx_isnt_going_to_the_moon/dvdxvzh/,1,Holy shit looking at your comment history I feel there's a good chance you're still a minor and can't even invest in securities yet maybe that's why you're so salty,2018-03-08
106,FuckGasparGomez,dvdy49p,/r/pennystocks/comments/82y5te/looks_like_bpmx_isnt_going_to_the_moon/dvdy49p/,1,"lol yeah you  guys got me, my ONE comment on a reddit forum will dramatically effect the stock price....lol sad, you clearly dont know what your doing. ",2018-03-08
107,Alex123432,dvdy6aw,/r/pennystocks/comments/82y5te/looks_like_bpmx_isnt_going_to_the_moon/dvdy6aw/,1,Looking through your history it's more then one comment,2018-03-08
108,FuckGasparGomez,dvdy99s,/r/pennystocks/comments/82y5te/looks_like_bpmx_isnt_going_to_the_moon/dvdy99s/,1,id actually be surprised is you even had more than 200 dollars into this stock. ,2018-03-08
109,honorarytitle,dvdyfxr,/r/pennystocks/comments/82zn27/thoughts_on_bravatek/dvdyfxr/,1,I held them for awhile. They seem like a cold turd. Sold them for a small loss about two weeks ago,2018-03-08
110,Thundersnow69,dvdyha8,/r/pennystocks/comments/82yy2r/when_to_sell_jagx/dvdyha8/,1,It would be a good idea to have an exit strategy before you invest in a trade. I usually have a specific price point in mind. When it crosses that I’ll take my modest gains on a consistent basis instead of riding the roller coaster...,2018-03-08
111,DogsAndCatsAndRats,dvdyod4,/r/pennystocks/comments/82zn27/thoughts_on_bravatek/dvdyod4/,1,They seem pretty stagnate. I may throw 50 bucks at it and check on it in a few years.,2018-03-08
112,skrfs,dvdys8e,/r/pennystocks/comments/82yitz/website_search_volumetraffic_vs_stock_price/dvdys8e/,1,haha feel free that's why I posted it. Let me know if you can make any relevant information with it. I feel like it would work best for small cap B to C companies. ,2018-03-08
113,roverttt,dvdz01c,/r/pennystocks/comments/82y5te/looks_like_bpmx_isnt_going_to_the_moon/dvdz01c/,1,"They chose not to reverse split, the deadline has passed, meaning as a company they are confident they can hit that mark before delis ting. Either you're shorting and trying to further kill confidence or you are just throwing out uninformed criticisms which make you just as bad as the people on this sub who throw out things like ""this is going to the moon"" having done little to no research on a stock. ",2018-03-08
114,deadrail,dvdzm0e,/r/pennystocks/comments/82zmar/jagx/dvdzm0e/,1,"I'm pissed I bought it at ,
.13 last week sold two days ago and it jumped nearly 20 cents since....fuck me",2018-03-08
115,le_saint94,dvdzy5r,/r/pennystocks/comments/82vbbe/inpx_bpmx_repeat/dvdzy5r/,1,Seems to have found its bottom at 1.15. I’m waiting for a breakout confirmation at 1.57,2018-03-08
116,Icemanrussian,dvdzzb9,/r/pennystocks/comments/82y2t8/grxxf_about_to_break_125/dvdzzb9/,1,I tried to buy a fair amount of shares but the transcation kept getting declined. Know what gives?,2018-03-08
117,brink8704,dve09xv,/r/pennystocks/comments/82yy2r/when_to_sell_jagx/dve09xv/,1,That's good advice. I really appreciate it.,2018-03-08
118,Highneedbulletdeed,dve0dqn,/r/pennystocks/comments/82zmar/jagx/dve0dqn/,1,Pump and dump. Wait for the incoming dump,2018-03-08
119,erkaaj,dve1dff,/r/pennystocks/comments/82ufk8/best_penny_stocks_right_now/dve1dff/,1,Zero management; Good luck boiiis,2018-03-08
120,erkaaj,dve1g96,/r/pennystocks/comments/82zmar/jagx/dve1g96/,1,"FDA approval is not a pump. But it will dump, yes.",2018-03-08
121,IGOSODAMNHAM,dve1ol5,/r/pennystocks/comments/82y5te/looks_like_bpmx_isnt_going_to_the_moon/dve1ol5/,1,They have no money. FDA approval for a bioturd means they need to simulate for funds to move further. Their ER is only blowing cash. So you are holding this stock that was .01 recently in hopes for a buyout. Ok...,2018-03-08
122,IGOSODAMNHAM,dve1w6e,/r/pennystocks/comments/82y5te/looks_like_bpmx_isnt_going_to_the_moon/dve1w6e/,1,You are a future bag holder IMO.,2018-03-08
123,Rugius,dve22k1,/r/pennystocks/comments/82yy2r/when_to_sell_jagx/dve22k1/,1,"""There is no such thing as a bad profit""  

You'll never regret gains -- you'll always regret the baghold.  Don't get greedy and just take the profits when you want and don't despair if you miss out on a few more %",2018-03-08
124,TheLastNatives,dve3kz1,/r/pennystocks/comments/82ykmm/vtnl/dve3kz1/,1,I'm holding on for awhile. Grabbed 30k a little late at 0.003. ,2018-03-08
125,TasteMyLumpia23,dve3lis,/r/pennystocks/comments/82ufk8/best_penny_stocks_right_now/dve3lis/,1,$JAGX just got [FDA approval](https://finance.yahoo.com/news/fda-indicates-jaguars-reasonable-expectation-140000352.html?.tsrc=rss) today and its skyrocketing with huge volume,2018-03-08
126,RustySpunes,dve45yd,/r/pennystocks/comments/82yy2r/when_to_sell_jagx/dve45yd/,1,What made you buy in when you did?chance/luck or did you have any good reason to? ,2018-03-08
