,author,id,url,score,text,date
100,leadrain86,dup0ypl,/r/pennystocks/comments/7zidlc/best_recommendations_for_robinhood/dup0ypl/,1,"$IDXG, very undervalued currently, will run up to 1.40 soon. 

$MYO, also undervalued, great entry at 3.70 to 3.80 right now, ER in March more than likely, could run up alot, as they ramped up their sales, paid some debt and are looking solid. 

$CERC, another biotech that is in the black, has cash on hand for all their expenses, already popped back near 4$, watch for a red day or two to re enter imo. 

$MTBC, hovering around 4$, building support, ER coming up that should show alot of growth, should run to 5$ soon. 

$CHFS, low float, easy to swing and day trade, not a solid company, but trades from 3 to 3.50 pretty regularly, and can spike very high any time it gets volume, any time you see it drop significantly, you can swing overnight for a nice gain. 

Just be smart and do your DD. Don’t trade through ERs and events, trade the run up to the day of and sell before. 

Don’t swing trade just to swing trade (a habit I had to break). Only swing when you really see the potential, ER runups, conference run ups are easy 1 to 2 week plays where you can minimize risk and cash in decent. ",2018-02-22
101,BowB4Me,dup1bd8,/r/pennystocks/comments/7zhrcn/i_have_more_unrealized_gains_than_ever_before_and/dup1bd8/,1,"No offense, but you don’t deserve to be up 1000% if you don’t know what to do here. ",2018-02-22
102,BowB4Me,dup1ei2,/r/pennystocks/comments/7zh8xc/mysz/dup1ei2/,1,It’s a scam ,2018-02-22
103,MillionaireBy24,dup4wa4,/r/pennystocks/comments/7zhrcn/i_have_more_unrealized_gains_than_ever_before_and/dup4wa4/,1,Any advice on what platform to get started on with these pennystocks?,2018-02-22
104,Secret4gentMan,dup60o2,/r/pennystocks/comments/7zhrcn/i_have_more_unrealized_gains_than_ever_before_and/dup60o2/,1,"If I were in your position, I'd sell enough so I still make it out ahead if it crashes, if it doesn't crash, you'll still make more money.

Secure some gains then ride out the rest until your target hits (assuming it does) would be what I'd do.",2018-02-22
105,queenslandbananas,dup8pff,/r/pennystocks/comments/7zhrcn/i_have_more_unrealized_gains_than_ever_before_and/dup8pff/,1,"OK, so you don't actually have an exit strategy ... got it.",2018-02-22
106,LWTTRADING,dup9i0t,/r/pennystocks/comments/7zh8xc/mysz/dup9i0t/,1,ON OUR CHATS WATCH TODAY FOR SURE,2018-02-22
107,uglypelican,dupd0ng,/r/pennystocks/comments/7zhrcn/i_have_more_unrealized_gains_than_ever_before_and/dupd0ng/,1,"my personal opinion. sell 80%. take that 40k and stuff it away. Let that other 20% ride, or slowly sell off if it goes up. Great job, I would love to hit a big one like this.",2018-02-22
108,xlogit3k,dupempx,/r/pennystocks/comments/7zh6xx/etrade_or_td_ameritrade/dupempx/,1,Schwab is my favorite with the StreetSmart Edge platform. ,2018-02-22
109,awanderingfire,dupey21,/r/pennystocks/comments/7zg46d/aprn/dupey21/,1,Hmmm perhaps but given WMT's recent results (missing their eCommerce growth forecast) I doubt a company like APRN would be high up on their list of potential acquisitions. ,2018-02-22
110,Arrublac814,dupezv2,/r/pennystocks/comments/7zg46d/aprn/dupezv2/,1,Honestly the is why they might want to join forces.  They can help each other out.   Blue apron kills it with online marketing ! ,2018-02-22
111,falloffthetower,dupg504,/r/pennystocks/comments/7zg46d/aprn/dupg504/,1,"So.. They tell you how to make food? Give you food? 

The JRE is a nice. But beware of this kind of shit. Very short lived.",2018-02-22
112,honorarytitle,dupggy3,/r/pennystocks/comments/7zgx8q/february_22_2018_tomorrows_daily_rpennystocks/dupggy3/,1,"I think everyone has the same, but AKER and MYSZ. ",2018-02-22
113,LandmanCA,dupmc53,/r/pennystocks/comments/7zh8xc/mysz/dupmc53/,1,Sold! At 2.07 this morning. Glad to be outta there 😉,2018-02-22
114,deadfermata,dupniwv,/r/pennystocks/comments/7zh8xc/mysz/dupniwv/,1,Aha. Good you were able to make some $. Still holding for post episode. GL!,2018-02-22
115,[deleted],dupof7e,/r/pennystocks/comments/7zhrcn/i_have_more_unrealized_gains_than_ever_before_and/dupof7e/,1,[removed],2018-02-22
116,RandomT9,duppr1k,/r/pennystocks/comments/7zh6xx/etrade_or_td_ameritrade/duppr1k/,1,"TD Ameritrade comes with L2 which is pretty big.  But ETrade allows me to use more funds immediately for trading (after your first transfer) which is nice.  ETrade also converted my DOLV to JBZY stock immediately so I could still trade them a day after whereas Ameritrade took a few days and people couldn't trade their shares. (For penny stocks, sometimes a few days and make or break the bank.)",2018-02-22
117,ifknlovecoryinthehou,dupyuaa,/r/pennystocks/comments/7zaxfu/ldsr_looking_real_nice/dupyuaa/,1,Bought 500k shares at .0002 and sold half at .003 so I hope it goes up more but if not it's all good already made a decent profit ,2018-02-22
118,Makeshift5,duq6qn8,/r/pennystocks/comments/7zhrcn/i_have_more_unrealized_gains_than_ever_before_and/duq6qn8/,5,"No, Warren, the guy who runs the buffet told me that. ",2018-02-22
119,Derp2638,duqcs36,/r/pennystocks/comments/7zg46d/aprn/duqcs36/,1,"Walmart already has a partnership with them I think. Also, only reason why I don’t like it is the biggest reason :It’s pretty expensive. Why pay for a service when I could order a pizza or chicken fingers or fries for roughly the same price ",2018-02-22
120,SuperHeroUndies,duqwz4w,/r/pennystocks/comments/7zh6xx/etrade_or_td_ameritrade/duqwz4w/,1,"Tos runs like crap on my Mac. The web platform runs great. 

Tos more feels like a mobile platform because I runs great on my tablet and phone. 

",2018-02-22
121,LucefieD,durs4mn,/r/pennystocks/comments/7zaxfu/ldsr_looking_real_nice/durs4mn/,2,"Yea she went ham lol, it pulled back on friday though. We shall see what happens next week. Expecting some juicy PRs the closer we get to gdpr though so I figure we shall still see it go higher in the coming month or so even if it does pull way back. ",2018-02-22
122,d0ckellis,dus0a65,/r/pennystocks/comments/7zhrcn/i_have_more_unrealized_gains_than_ever_before_and/dus0a65/,1,"take some out incrementally, or at least take out your principal  ",2018-02-22
123,RogueLeaderJ,dusc2w8,/r/pennystocks/comments/7zhrcn/i_have_more_unrealized_gains_than_ever_before_and/dusc2w8/,1,"Well, my philosophy is, if its a life changing amount of money and you have it in your hands now, cash out and start looking for your next bet.  Don't have to sell all of it, but hell, even 10k can change a life a lot  ",2018-02-22
124,RogueLeaderJ,dusc7j1,/r/pennystocks/comments/7zhrcn/i_have_more_unrealized_gains_than_ever_before_and/dusc7j1/,1,"Well, some of them you can do robinhood with no comission.  But a lot of them you can't get on there.  I'd look for lowest commision you can find.  Some places offer no commision first 500 trades or so.  ",2018-02-22
125,levishazam,dusqquc,/r/pennystocks/comments/7zhrcn/i_have_more_unrealized_gains_than_ever_before_and/dusqquc/,1,"Pull out, don’t be greedy. ",2018-02-22
126,deadfermata,dutdqzt,/r/pennystocks/comments/7zh8xc/mysz/dutdqzt/,1,interview was solid!,2018-02-22
127,honorarytitle,dutwyck,/r/pennystocks/comments/7zh8xc/mysz/dutwyck/,1,"Can’t find a link, do you have one? Unfortunately, missed the airing",2018-02-22
128,WelvinK,duu8osr,/r/pennystocks/comments/7zidlc/best_recommendations_for_robinhood/duu8osr/,1,How do you play tops? i’ve tried 3 times and taken an L every single play ,2018-02-22
129,Chickachic-aaaaahhh,duu9uy7,/r/pennystocks/comments/7zidlc/best_recommendations_for_robinhood/duu9uy7/,1,Patience,2018-02-22
130,yragoam,duv175b,/r/pennystocks/comments/7zh6xx/etrade_or_td_ameritrade/duv175b/,1,"I'm thinking about moving from RH to TD, what was the transfer process like? 
I understand there might be a $75 fee from RH to transfer? ",2018-02-22
131,tibxero,duv54hl,/r/pennystocks/comments/7zh8xc/mysz/duv54hl/,1,Man.........what happened today? I can't find any news that explains a 14% drop (as of 11am PST). Thoughts?,2018-02-22
132,acquiesce,duwppji,/r/pennystocks/comments/7zft6g/aker_short_term_or_long_term/duwppji/,1,"&gt; Unlikely to have substantial movements for a while until studies are finalize with results and movement towards FDA approval.

AKER up to $0.70 today (23%).  Hiyooooo.",2018-02-22
133,seanxor,duxge2r,/r/pennystocks/comments/7zhrcn/i_have_more_unrealized_gains_than_ever_before_and/duxge2r/,1,"I am curious, what did you end up doing? Are you still holding?",2018-02-22
134,Derp2638,dv1vlty,/r/pennystocks/comments/7zeps6/goph_is_the_gift_that_keeps_on_giving/dv1vlty/,1,We will see next week what it’s job is with earnings ,2018-02-22
135,acquiesce,dv24qmh,/r/pennystocks/comments/7zh6xx/etrade_or_td_ameritrade/dv24qmh/,1,I use TDA for 'fun' stocks and Vanguard for long term.  TDA is great.  ,2018-02-22
136,Denniss_c,dvfa1xc,/r/pennystocks/comments/7zhrcn/i_have_more_unrealized_gains_than_ever_before_and/dvfa1xc/,1,"Just wondering, how’d you come across this stock early on? Any websites or forums you specifically monitor?",2018-02-22
