,title,id,author,url,score,num_comments,text,date,link
19,4 Biotech Stocks Making Moves on Wednesday (2/6/19),antgrk,zurikokhafintl,https://www.reddit.com/r/pennystocks/comments/antgrk/4_biotech_stocks_making_moves_on_wednesday_2619/,1,4,"CORAL GABLES, FL / ACCESSWIRE / February 6, 2019 /  In order for the  biotech stock  market to be successful, companies in the industry are tasked with not only maintaining a constant stream of innovative drug treatments as medical experts discover new diseases, but they must also meet the de...
In case you are interested https://marketwirenews.com/news-releases/4-biotech-stocks-making-moves-on-wednesday-2-6-19--7637606.html 
",2019-02-06,https://www.reddit.com/r/pennystocks/comments/antgrk/4_biotech_stocks_making_moves_on_wednesday_2619/
20,$BSEG Big Screen Entertainment Moves into Social Media Content Releasing a Kelly LeBrock Mystery,ant17z,louied91,https://www.reddit.com/r/pennystocks/comments/ant17z/bseg_big_screen_entertainment_moves_into_social/,1,0,"[https://www.otcmarkets.com/stock/BSEG/news/Big-Screen-Entertainment-Moves-into-Social-Media-Content-Releasing-a-Kelly-LeBrock-Mystery?id=217707](https://www.otcmarkets.com/stock/BSEG/news/Big-Screen-Entertainment-Moves-into-Social-Media-Content-Releasing-a-Kelly-LeBrock-Mystery?id=217707)

BEVERLY HILLS, Calif., Feb. 06, 2019 (GLOBE NEWSWIRE) -- Eighties icon Kelly LeBrock (Weird Science) stars in an upcoming mystery series from Big Screen Entertainment Group (OTC:BSEG).  


“Tales From a Hidden Chamber” will be an eight part thriller for social media platforms with each episode between 5 and 15 minutes long to fit the format of Facebook video, YouTube and IGTV, Instagram’s new video platform.

The series, about what lurks behind a two-way mirror, also stars Erin Cahill (How I Met Your Mother) and aims to expand film company BSEG’s web presence and impact.

“Our goal is to make Big Screen a well-known and much-loved brand over social media,” says Sandro Monetti, BSEG’s Head of Content Development.

Creating such content for the web - which increases visibility, awareness and sales of the company’s films – is a key part of that process.

“Tales From a Hidden Chamber” is directed by Big Screen’s Stephen Eckelberry, an expert in the multi-platform space with over 1 million views on Facebook of a recently produced video.

“The days of relying solely on distributors to promote independent product are over,” says Eckelberry, agreeing that with self-distribution a reality, advertising via social media is the key to boosting sales and expanding one’s brand.

This series will be released the third week of April 2019 on IGTV, Facebook and the Big Screen Entertainment YouTube Channel.",2019-02-06,https://www.reddit.com/r/pennystocks/comments/ant17z/bseg_big_screen_entertainment_moves_into_social/
21,Edible and Vape Play. Nutritional High International Inc EAT.CN,answso,thatguybuddy,https://www.reddit.com/r/pennystocks/comments/answso/edible_and_vape_play_nutritional_high/,1,0,"New [video posted from the company](https://youtu.be/6EcGJ8fcB4I).

Company [Website](https://www.nutritionalhigh.com/).

Canada to allow edibles and vape products in October 2019. Building the brand in legal states currently. They don't grow!! Its a different approach to investing in the MJ market. 

&amp;#x200B;",2019-02-06,https://www.reddit.com/r/pennystocks/comments/answso/edible_and_vape_play_nutritional_high/
