,author,id,url,score,text,date
102,thatguybuddy,efzjpta,/r/pennystocks/comments/ao7kdr/ryu_apparel_inc_ryuv_timing_the_turning_point/efzjpta/,1,I have been outspoken of how useless he seems to have been. But I think we are turning the corner. https://twitter.com/muise_/status/1085267543021871104?s=21 I blasted my own investment which most people will not do but I want an open and honest dialog. ,2019-02-07
103,sds0918,efzkoak,/r/pennystocks/comments/ao85qd/mnga_how_do_i_sue_you_bastards/efzkoak/,1,Seriously.  Fuck this guys.   I bought 395 shares the day before.   Now I have 19.  What the fuck! ,2019-02-07
104,rafiki_knows_deway,efzluss,/r/pennystocks/comments/ao85qd/mnga_how_do_i_sue_you_bastards/efzluss/,1,Sameee,2019-02-07
105,ExplodingOranges,efzo0uq,/r/pennystocks/comments/ao85qd/mnga_how_do_i_sue_you_bastards/efzo0uq/,1,Hahahahahahahahahahah. ,2019-02-07
106,bralyo,efzqn0i,/r/pennystocks/comments/ao85qd/mnga_how_do_i_sue_you_bastards/efzqn0i/,1,What's coming?,2019-02-07
107,mbr902000,efzqp76,/r/pennystocks/comments/ao85qd/mnga_how_do_i_sue_you_bastards/efzqp76/,1,"Lol, you do realize pennystocks are all turds and do this all the time, right? Go do some research on SIPC, classic scam. You dont think theres something fishy when a company is selling oil one day, booze the next day, weed the day after that...lmfao. Sorry for your loss dude, but these are all pump and dumps",2019-02-07
108,Kithlak,efzr53f,/r/pennystocks/comments/ao85qd/mnga_how_do_i_sue_you_bastards/efzr53f/,1,Lol don't trade penny stocks if you're new to the game. Check out the psychology of trading series on YouTube to get some basic ideas about getting a good foundation.,2019-02-07
109,Bearcat1504,efzshtz,/r/pennystocks/comments/anyia1/shmp_last_chance_to_get_in/efzshtz/,1,Have you not looked at this companies balance sheet? Last reporting they had less than $5K of cash on hand and more than $580K in accounts payable and $224K in long term debt... looks like a bubble that’s going to pop any moment. ,2019-02-07
110,dcstockjvm,efzsl1l,/r/pennystocks/comments/anyia1/shmp_last_chance_to_get_in/efzsl1l/,1,They have been diluting. They will be fine. Big investors have arrived. Their balance sheet is the least of my worries right now. ,2019-02-07
111,Skeptophile,efztp6t,/r/pennystocks/comments/ao85qd/mnga_how_do_i_sue_you_bastards/efztp6t/,1,"That in itself isn't the issue, you own the same percentage of the company.",2019-02-07
112,oelhayek,efzwy1y,/r/pennystocks/comments/ao85qd/mnga_how_do_i_sue_you_bastards/efzwy1y/,1,What’s an RS? ,2019-02-07
113,houseflip,efzxbwd,/r/pennystocks/comments/ao85qd/mnga_how_do_i_sue_you_bastards/efzxbwd/,1,"someone will definitely sue them, and you will get something in the mail about it. its usually someone that lost millions and turns it into a class action. but typically id only expect 1-10% of your losses back .",2019-02-07
114,dazedyouth,efzxejw,/r/pennystocks/comments/ao85qd/mnga_how_do_i_sue_you_bastards/efzxejw/,1,"Some RS work some don't.  I knew mgna was gonna be a disaster because they're diluting.  Earnings call was a joke, they'd gotten all these big contracts and share price never popped..  just count it as a learning experience and move on ...

In a case where it worked -- it was with AMMA, the RS made me a bunch of money.

Depends on the situation.  With AMMA (now word) a profitable company bought the shell company and the stock shot up to $10 on opening after the RS.   I'm risk adverse and any time a shitty shell co pops like this I'm out --so I sold it that second it bumped.  

Took profits then went into Cron..  been a good couple of weeks - up about 240%

I'd advise you to visit stocktwits in combo with Reddit

And lemme know if you get a class action against mgna - I'll join in...",2019-02-07
115,dazedyouth,efzxky4,/r/pennystocks/comments/ao85qd/mnga_how_do_i_sue_you_bastards/efzxky4/,1,So much this.. all these pennies are turds.  But turds are highly volitile and if you pay attention u can. Make some great gains,2019-02-07
116,dazedyouth,efzxpg6,/r/pennystocks/comments/ao85qd/mnga_how_do_i_sue_you_bastards/efzxpg6/,1,Yeah -- please don't give them any more of your money.    ,2019-02-07
117,dazedyouth,efzxq6k,/r/pennystocks/comments/ao85qd/mnga_how_do_i_sue_you_bastards/efzxq6k/,1,You should.  Revenge is always fun,2019-02-07
118,dazedyouth,efzxs13,/r/pennystocks/comments/ao85qd/mnga_how_do_i_sue_you_bastards/efzxs13/,1,RS on RH take forever to get sorted out...  They lock you out for a while when they happen.   ,2019-02-07
119,dazedyouth,efzxv78,/r/pennystocks/comments/ao85qd/mnga_how_do_i_sue_you_bastards/efzxv78/,1,And they give you cash in your account for the ones that don't add up to the reverse split (say u had 18 and the RS was 20/1) they'd give you cash since you didn't have 20,2019-02-07
120,dazedyouth,efzxwbu,/r/pennystocks/comments/ao85qd/mnga_how_do_i_sue_you_bastards/efzxwbu/,1,Oh Jesus 😂 pumping on Reddit now lol,2019-02-07
121,dazedyouth,efzxwz4,/r/pennystocks/comments/ao85qd/mnga_how_do_i_sue_you_bastards/efzxwz4/,1,Another RS,2019-02-07
122,TheMobDecider,efzylh3,/r/pennystocks/comments/anyia1/shmp_last_chance_to_get_in/efzylh3/,1,I was tempted to gamble last night when I read this. Had a good feeling after doing a little research. Obviously Im a little bitch. Grats to all the guys with the balls to actually do it.,2019-02-07
123,BearStearnsToTheMoon,efzywrk,/r/pennystocks/comments/ao85qd/mnga_how_do_i_sue_you_bastards/efzywrk/,1,Reverse split,2019-02-07
124,Skeptophile,efzzmpo,/r/pennystocks/comments/ao85qd/mnga_how_do_i_sue_you_bastards/efzzmpo/,1,"Yup, reminds me of the post on WSB of a negative review on Robinhood's app screeching about the same thing and RH explaining what a reverse split is to him.",2019-02-07
125,oelhayek,efzzqg3,/r/pennystocks/comments/ao85qd/mnga_how_do_i_sue_you_bastards/efzzqg3/,1,Thank you ,2019-02-07
126,Matthews413,eg00gb8,/r/pennystocks/comments/ao85qd/mnga_how_do_i_sue_you_bastards/eg00gb8/,1,"1 million a month sales. 1.3 million a minth expenses. Sales and profit. I agree long term they will eork this out, they have good products and are heading in the right direction but they need to stop bleeding money kr the share price will continue to plummet.",2019-02-07
127,sds0918,eg011mf,/r/pennystocks/comments/ao85qd/mnga_how_do_i_sue_you_bastards/eg011mf/,1,"Considering reverse splits tend to lead to the absolute tanking of a stock, like exhibited here, I don’t give a shit  if I still own a piece of it.   ",2019-02-07
128,Skeptophile,eg01bbp,/r/pennystocks/comments/ao85qd/mnga_how_do_i_sue_you_bastards/eg01bbp/,1,"Yeah because the company is a steaming pile of shit as shown by it's price chart, no offense, and indeed RS are usually done when a company tanks, another great example is HMNY. But your comment implies you were robbed of 376 shares, which you haven't.",2019-02-07
129,Jpaperz,eg02dz2,/r/pennystocks/comments/ao85qd/mnga_how_do_i_sue_you_bastards/eg02dz2/,1,"All of yall that are hating are going to be super salty 😂😂, and none of you research anything except the chart, long term for sure lol",2019-02-07
130,tibbykush,eg02id2,/r/pennystocks/comments/ao442q/premier_health_group_phgi_phgrf_announces/eg02id2/,1,Can RHT get in too!! ,2019-02-07
131,Touchemybody,eg041dd,/r/pennystocks/comments/ao442q/premier_health_group_phgi_phgrf_announces/eg041dd/,1,Fidelity or TD Ameritrade ,2019-02-07
132,tibbykush,eg0557g,/r/pennystocks/comments/ao7kdr/ryu_apparel_inc_ryuv_timing_the_turning_point/eg0557g/,1,I’m going down with the ship! Locked till 10$ ,2019-02-07
133,teamrd,eg05ht0,/r/pennystocks/comments/ao85qd/mnga_how_do_i_sue_you_bastards/eg05ht0/,1,Thanks for the tip on stocktwits. I’m new to trading but I’m a believer in cbd and mj in general. Thanks for sharing your knowledge.,2019-02-07
134,braygotit,eg07kr7,/r/pennystocks/comments/anyia1/shmp_last_chance_to_get_in/eg07kr7/,1,Still testing tech. Not supposed to have cash in hand yet. ,2019-02-07
135,outerdrive313,eg09m4s,/r/pennystocks/comments/ao85qd/mnga_how_do_i_sue_you_bastards/eg09m4s/,1,"In a relationship, you're not entitled to not have your heart broken. In stocks, you're not entitled to not have staggering losses.

One of the many reasons I don't hold stocks overnight.",2019-02-07
136,outerdrive313,eg09o70,/r/pennystocks/comments/ao85qd/mnga_how_do_i_sue_you_bastards/eg09o70/,1,"&gt; kids be crying on here 

My sides 😂😂",2019-02-07
137,forgetmenot88,eg0d2ud,/r/pennystocks/comments/anyia1/shmp_last_chance_to_get_in/eg0d2ud/,1,Thank you! This is one of my first few penny stocks I’ve bought. I bought it honestly as a gamble right when it was at .03. I saw your post and some other posts on here and really believe in their technology. ,2019-02-07
138,karthus25,eg0eqnj,/r/pennystocks/comments/ao85qd/mnga_how_do_i_sue_you_bastards/eg0eqnj/,1,Dude tell me about it. I dropped 1k on thia company the day before the reverse split and ended up selling all about 175 stock after the r/s at a 50% loss. First time putting any major amount of money into stocks and I fucked up.,2019-02-07
139,dawsonj20,eg0hqfk,/r/pennystocks/comments/ao85qd/mnga_how_do_i_sue_you_bastards/eg0hqfk/,1,Link?,2019-02-07
140,BigGreenCandles,eg0hziy,/r/pennystocks/comments/ao85qd/mnga_how_do_i_sue_you_bastards/eg0hziy/,1,Look at it this morning guys! 😂😂😂 Should’ve just flushed my money down the toilet. Thank God it was only $150. ,2019-02-07
141,SenTedStevens,eg0i1zc,/r/pennystocks/comments/ao85qd/mnga_how_do_i_sue_you_bastards/eg0i1zc/,1,Rally Sport.,2019-02-07
142,dcstockjvm,eg0j66e,/r/pennystocks/comments/anyia1/shmp_last_chance_to_get_in/eg0j66e/,1,Very welcome! Glad you got in. It’s only going to climb!,2019-02-07
143,littlejohnnynomad,eg0l6ad,/r/pennystocks/comments/ao85qd/mnga_how_do_i_sue_you_bastards/eg0l6ad/,1,http://lmgtfy.com/?q=youtube+the+psychology+of+trading,2019-02-07
144,dawsonj20,eg0ljpk,/r/pennystocks/comments/ao85qd/mnga_how_do_i_sue_you_bastards/eg0ljpk/,1,"And which of those is the ""series"" op was suggesting?",2019-02-07
145,Ektairul,eg0manb,/r/pennystocks/comments/ao85qd/mnga_how_do_i_sue_you_bastards/eg0manb/,1,I'm kinda new to this kinda thing what should I research for ,2019-02-07
146,psxpetey,eg0ot3o,/r/pennystocks/comments/ao85qd/mnga_how_do_i_sue_you_bastards/eg0ot3o/,1,This is why we look at sec filings bro,2019-02-07
147,mannyceballos,eg0q0n7,/r/pennystocks/comments/anyia1/shmp_last_chance_to_get_in/eg0q0n7/,1,"SHMP @ .40 

when the real thing comes around everyone is gun shy 

Everyone is so used to the pump and dump when real company does something innovative and spends the money to patent everyone stands and watches it go by",2019-02-07
148,dcstockjvm,eg0q2s8,/r/pennystocks/comments/anyia1/shmp_last_chance_to_get_in/eg0q2s8/,1,It’s at 50 cents now! ,2019-02-07
149,johne724,eg0qdyq,/r/pennystocks/comments/anyia1/shmp_last_chance_to_get_in/eg0qdyq/,1,"THANK YOU, got in at .45",2019-02-07
150,dcstockjvm,eg0rtix,/r/pennystocks/comments/anyia1/shmp_last_chance_to_get_in/eg0rtix/,1,Very welcome! Good luck! ,2019-02-07
151,Dr_Emmet_Brown,eg0rzcy,/r/pennystocks/comments/ao85qd/mnga_how_do_i_sue_you_bastards/eg0rzcy/,1,Everyone wants 100%+ gains. Just take 5-10% and gtfo when it’s penny garbage ,2019-02-07
152,langlee6,eg0ucp4,/r/pennystocks/comments/ao7kdr/ryu_apparel_inc_ryuv_timing_the_turning_point/eg0ucp4/,1,600$ in clothing is like 4 pieces of clothing at RYU,2019-02-07
153,BigGreenCandles,eg0uwhm,/r/pennystocks/comments/ao85qd/mnga_how_do_i_sue_you_bastards/eg0uwhm/,1,Lesson learned ,2019-02-07
154,driv818,eg0vqtr,/r/pennystocks/comments/ao442q/premier_health_group_phgi_phgrf_announces/eg0vqtr/,1,I use TD ameritrade Think or Swim,2019-02-07
155,driv818,eg0vtlw,/r/pennystocks/comments/ao442q/premier_health_group_phgi_phgrf_announces/eg0vtlw/,1,Im not sure how that works but I think it would make more sense to trade it on the Canadian Market no?,2019-02-07
156,driv818,eg0vxql,/r/pennystocks/comments/ao442q/premier_health_group_phgi_phgrf_announces/eg0vxql/,1,me too,2019-02-07
157,el__whisper,eg0w08n,/r/pennystocks/comments/anyia1/shmp_last_chance_to_get_in/eg0w08n/,1,Still good to jump in? Currently at 0.51,2019-02-07
158,dcstockjvm,eg0w4cs,/r/pennystocks/comments/anyia1/shmp_last_chance_to_get_in/eg0w4cs/,1,I think so. Should make a little bc of news next week. Play conservative tho,2019-02-07
159,el__whisper,eg0w8xa,/r/pennystocks/comments/anyia1/shmp_last_chance_to_get_in/eg0w8xa/,1,Alright. Appreciate your help! ,2019-02-07
160,inv998,eg0z36y,/r/pennystocks/comments/ao442q/premier_health_group_phgi_phgrf_announces/eg0z36y/,1,PHGRF currently  has a paid stock promotion  -  stock touts or stock promoters will disseminate favorable information (the “Information”) about publicly traded  stocks.,2019-02-07
161,guns_ensure_liberty,eg0zyqz,/r/pennystocks/comments/anyia1/shmp_last_chance_to_get_in/eg0zyqz/,1,"I got in at .45 also. I started paper trading it a week ago at .07. Kicked myself in the nuts for not purchasing at the start of its move. That being said,  I'm happy to take the current 28% so far today. ",2019-02-07
162,johne724,eg101i6,/r/pennystocks/comments/anyia1/shmp_last_chance_to_get_in/eg101i6/,1,"I like your user name, but I love guns more xD",2019-02-07
163,cannainform2,eg109o9,/r/pennystocks/comments/ao442q/premier_health_group_phgi_phgrf_announces/eg109o9/,1,Well that makes much more sense... can stand those guys,2019-02-07
164,dcstockjvm,eg12kww,/r/pennystocks/comments/anyia1/shmp_last_chance_to_get_in/eg12kww/,1,Did you get in? ,2019-02-07
165,TimmyTurnerTuTurntUp,eg132xf,/r/pennystocks/comments/ao442q/premier_health_group_phgi_phgrf_announces/eg132xf/,1,It has for a while but just because it's being marketed doesn't mean it's necessarily a bad thing.  Look at allllll the marijuana stocks that nearly every single one of them have been promoted,2019-02-07
166,driv818,eg1368p,/r/pennystocks/comments/ao442q/premier_health_group_phgi_phgrf_announces/eg1368p/,1,That's true...no one complains when they are making money,2019-02-07
167,amphetaminesfailure,eg13pal,/r/pennystocks/comments/anyia1/shmp_last_chance_to_get_in/eg13pal/,1,"&gt; when the real thing comes around everyone is gun shy
&gt; 
&gt; 

Pretty much what I said in another comment yesterday.  I get some great leads from this sub....but the majority of users here are not great investors.  The reason most people on this sub say there's no money to be made in penny stocks is because they are blinded to actual potential in these companies.  *Everything* is a pump and dump to them.  I flip a lot pump and dump stocks every week to make a few hundred dollars, and that money goes into a handful of big potentials every year.  Most of them end up not going anywhere, but the ones that do more than make up for it.  I got a downpayment for my current house with that strategy.  Wouldn't surprise me  if SHMP pays off the rest of my mortgage in the next five years time.",2019-02-07
168,go_sloe1484,eg14y74,/r/pennystocks/comments/anyia1/shmp_last_chance_to_get_in/eg14y74/,1,"Thank you for your advice, I’m staring at 0.63 now and kicking myself for not getting in when you said ",2019-02-07
169,PCisBadLoL,eg15z7g,/r/pennystocks/comments/anyia1/shmp_last_chance_to_get_in/eg15z7g/,1,"Yikes, up 50% today



Guess I missed the train on this one",2019-02-07
170,littlejohnnynomad,eg15zfv,/r/pennystocks/comments/ao85qd/mnga_how_do_i_sue_you_bastards/eg15zfv/,1,"Did you read the search results? It's literally the first link. You know, the one with the name OP clearly stated.",2019-02-07
171,dawsonj20,eg16t2k,/r/pennystocks/comments/ao85qd/mnga_how_do_i_sue_you_bastards/eg16t2k/,1,"&gt; psychology of trading

Did you click on it? It's not a series called ""psychology of trading"".

Either be helpful or don't say anything. It's easy to not be an asshole.",2019-02-07
172,beggs204,eg16xwp,/r/pennystocks/comments/anyia1/shmp_last_chance_to_get_in/eg16xwp/,1,you're\*,2019-02-07
173,dcstockjvm,eg17k63,/r/pennystocks/comments/anyia1/shmp_last_chance_to_get_in/eg17k63/,1,It’s okay beggs.. you’ll get the next one. ,2019-02-07
174,littlejohnnynomad,eg18u7i,/r/pennystocks/comments/ao85qd/mnga_how_do_i_sue_you_bastards/eg18u7i/,1,"Fair point, sorry. Just looked now on my phone and actually can't find it. Will find the link for you when I'm home ",2019-02-07
175,Xeniox,eg191xc,/r/pennystocks/comments/anyia1/shmp_last_chance_to_get_in/eg191xc/,1,Skrimps! ,2019-02-07
176,el__whisper,eg1hgsx,/r/pennystocks/comments/anyia1/shmp_last_chance_to_get_in/eg1hgsx/,1,No I didn’t. :( Maybe next time tho! ,2019-02-07
177,[deleted],eg1qwkh,/r/pennystocks/comments/ao7kdr/ryu_apparel_inc_ryuv_timing_the_turning_point/eg1qwkh/,1,[removed],2019-02-07
178,BigGreenCandles,eg1u0cl,/r/pennystocks/comments/ao85qd/mnga_how_do_i_sue_you_bastards/eg1u0cl/,1,I’ll be happy to participate even if I only get $5 back. Scumbags. If I was in Florida someone would get a beat down. Just on principle. I don’t like people stealing from me. ,2019-02-07
179,HenryTheRabbit,eg1uc0i,/r/pennystocks/comments/anyia1/shmp_last_chance_to_get_in/eg1uc0i/,1,IS IT TOO LATE??,2019-02-07
180,dcstockjvm,eg1vhua,/r/pennystocks/comments/anyia1/shmp_last_chance_to_get_in/eg1vhua/,1,Depends if news drop Monday ,2019-02-07
181,psxpetey,eg1yg50,/r/pennystocks/comments/ao85qd/mnga_how_do_i_sue_you_bastards/eg1yg50/,1,even if you do sometimes it doesn't go your way that's the problem with stocks but it makes it a lot easier to avoid reverse splits,2019-02-07
182,3849sfordays,eg27061,/r/pennystocks/comments/ao621q/nxmr_about_to_explode/eg27061/,1,Is it? ,2019-02-07
183,GlobalVagabond,eg2mmav,/r/pennystocks/comments/ao7l59/igpk_tweet_out_huge_we_are_rolling_those_forward/eg2mmav/,1,Really looking forward to this,2019-02-07
184,inv998,eg3cd4n,/r/pennystocks/comments/ao442q/premier_health_group_phgi_phgrf_announces/eg3cd4n/,1,Some things to consider. The stock was under suspension for about 2 months last year.  The Dominican business was discontinued. They also invested in a gold company which is now delisted.  Since September 2017  Issued and Outstanding shares have gone from 35 million to 61 million. ,2019-02-07
185,Flyingd202,eg54ojj,/r/pennystocks/comments/anyia1/shmp_last_chance_to_get_in/eg54ojj/,1,"To everyone who got in, congratulations. Always happy to see profits made. As someone who is only 21 and still in college, I can’t invest too much yet and have mainly just been doing a lot of DD to try and learn. I’ll see you all in a couple years!Good luck to you all!",2019-02-07
186,POOP_BLASTER,eg5b4ck,/r/pennystocks/comments/ao85qd/mnga_how_do_i_sue_you_bastards/eg5b4ck/,1,Ridiculous shit,2019-02-07
187,harmboi,eg5ylv0,/r/pennystocks/comments/ao85qd/mnga_how_do_i_sue_you_bastards/eg5ylv0/,1,Ya I had over 1000 shares and then had 60.  I had no idea a RS was coming,2019-02-07
188,CrossDamon,eg5zk1f,/r/pennystocks/comments/anyia1/shmp_last_chance_to_get_in/eg5zk1f/,1,Same boat for me as well,2019-02-07
189,[deleted],eg627af,/r/pennystocks/comments/anyia1/shmp_last_chance_to_get_in/eg627af/,1,[removed],2019-02-07
190,inv998,eg6p9es,/r/pennystocks/comments/ao442q/premier_health_group_phgi_phgrf_announces/eg6p9es/,1,"Yes many stocks are promoted and you can still profit on them. They have spent approx 19% of the companies cash assets on the current promotion (300,000 Cash) - not a minor amount.  Not included is the 500,000 shares given to the promoter. You could argue that this not best use of the money depending on your point of view.",2019-02-07
191,[deleted],eg7oyus,/r/pennystocks/comments/anyia1/shmp_last_chance_to_get_in/eg7oyus/,1,[removed],2019-02-07
192,StylishEuro,eg7txf0,/r/pennystocks/comments/ao85qd/mnga_how_do_i_sue_you_bastards/eg7txf0/,1,"No one stole from you, you idiot. If you’re going to give someone a beat down give it to yourself for buying a nonsense penny stock",2019-02-07
193,BigGreenCandles,eg83h1e,/r/pennystocks/comments/ao85qd/mnga_how_do_i_sue_you_bastards/eg83h1e/,1,Go fuck your mudder ,2019-02-07
194,primus_suckss,eg85hmj,/r/pennystocks/comments/anyia1/shmp_last_chance_to_get_in/eg85hmj/,1,Oh no I misses the ride :(,2019-02-07
195,dcstockjvm,eg85jpk,/r/pennystocks/comments/anyia1/shmp_last_chance_to_get_in/eg85jpk/,1,News not out yet. Still got time! ,2019-02-07
196,Zwickz26,eg8m603,/r/pennystocks/comments/ao621q/nxmr_about_to_explode/eg8m603/,1,"hit 0.1 today, so 2x since my post. ",2019-02-07
197,3849sfordays,eg9jf6x,/r/pennystocks/comments/ao621q/nxmr_about_to_explode/eg9jf6x/,1,.0009 now,2019-02-07
198,KingMushroomIV,egahfuf,/r/pennystocks/comments/anyia1/shmp_last_chance_to_get_in/egahfuf/,1,Bet u glad now,2019-02-07
199,Zwickz26,egbk67y,/r/pennystocks/comments/ao621q/nxmr_about_to_explode/egbk67y/,1,"you added a 0 

&amp;#x200B;

don't miss out!",2019-02-07
200,3849sfordays,egcbje4,/r/pennystocks/comments/ao621q/nxmr_about_to_explode/egcbje4/,1,Oh my bad. Dipped today tho. ,2019-02-07
201,SedarCDN,ege6kp2,/r/pennystocks/comments/ao7kdr/ryu_apparel_inc_ryuv_timing_the_turning_point/ege6kp2/,1,"Serial diluter, not profitable with expenses and net losses increasing.

Ongoing $6m financing. Over 300m shares— roll back is coming.

Avoid this venture garbage. ",2019-02-07
202,thatguybuddy,ege7882,/r/pennystocks/comments/ao7kdr/ryu_apparel_inc_ryuv_timing_the_turning_point/ege7882/,1,So your saying you are not interested in investing with them today?,2019-02-07
203,greenthumbindustries,egednj3,/r/pennystocks/comments/ao7kdr/ryu_apparel_inc_ryuv_timing_the_turning_point/egednj3/,1,"They'll probably get a random run-up at some point, usually happens with this stock, then sold down.",2019-02-07
204,Zwickz26,egeexil,/r/pennystocks/comments/ao621q/nxmr_about_to_explode/egeexil/,1,"yep, low ass volume too.  

&amp;#x200B;

IF this merger/rebranding news doesn't happen soon i'm pulling the plug.",2019-02-07
205,vinabate,egesz00,/r/pennystocks/comments/ao7kdr/ryu_apparel_inc_ryuv_timing_the_turning_point/egesz00/,1,Very frustrating to hold. Bought at 0.25 and 0.10. Never thought in a million years it would be down to 0.07. Loosing my patience... ,2019-02-07
206,thatguybuddy,egetzjh,/r/pennystocks/comments/ao7kdr/ryu_apparel_inc_ryuv_timing_the_turning_point/egetzjh/,1,Its a love hate. So much angers me with them. Im just back in again because I see light on the horizon for the first time in a year.,2019-02-07
207,3headed__monkey,egewoys,/r/pennystocks/comments/anyia1/shmp_last_chance_to_get_in/egewoys/,1,How you guys are doing 😂😂,2019-02-07
208,dcstockjvm,egewu52,/r/pennystocks/comments/anyia1/shmp_last_chance_to_get_in/egewu52/,1,Got out yesterday ✌🏽,2019-02-07
209,greenthumbindustries,eggmmsi,/r/pennystocks/comments/ao7kdr/ryu_apparel_inc_ryuv_timing_the_turning_point/eggmmsi/,1,"u/thatguybuddy check out that massive insider buy yesterday, thoughts?",2019-02-07
210,thatguybuddy,eggo3lg,/r/pennystocks/comments/ao7kdr/ryu_apparel_inc_ryuv_timing_the_turning_point/eggo3lg/,1,looks like he sold and then jumped back in lower. Seems like a common practice in these kinda stocks. I guess its better he his back then no one at all. Shows he is still here to accomplish what he has said he has set out to do. ,2019-02-07
211,greenthumbindustries,eggoavd,/r/pennystocks/comments/ao7kdr/ryu_apparel_inc_ryuv_timing_the_turning_point/eggoavd/,1,"
I took half my position yesterday, have bids if it goes lower. If anything this company will be bought out. Would totally make sense for Lulu to buy it out and rebrand it to like Lulu active or something. ",2019-02-07
212,thatguybuddy,eggqvar,/r/pennystocks/comments/ao7kdr/ryu_apparel_inc_ryuv_timing_the_turning_point/eggqvar/,1,I would like Goose or some one high end with no active profile to jump on it.,2019-02-07
213,SedarCDN,eggui3j,/r/pennystocks/comments/ao7kdr/ryu_apparel_inc_ryuv_timing_the_turning_point/eggui3j/,1,It’s just not investable at this point. Valuation still extreme and fundamentals don’t justify it. ,2019-02-07
