,title,id,author,url,score,num_comments,text,date,link
0,"Watchlist for Monday CELZ, EBIO, ANDI, FUSZ",8e88hf,dirtywiggles,https://www.reddit.com/r/pennystocks/comments/8e88hf/watchlist_for_monday_celz_ebio_andi_fusz/,15,26,I think CELZ is always in as a morning spiker. ANDI is coming back a bit even though it is a risky company now. Emphasis on watch. EBIO is a buy as it is hitting major news sources and rated as a buy by Simply Wall Street and Seeking alpha. I expect a large morning spike in EBIO and CELZ. Will be watched all day. FUSZ is running hard but it has to be watched if it will continue or fall. Not touching until mid day. Will update this more. ,2018-04-23,https://www.reddit.com/r/pennystocks/comments/8e88hf/watchlist_for_monday_celz_ebio_andi_fusz/
1,Most undervalued Blockchain play $CRYP $CRYBF,8e7up8,capitalgrowth,https://www.reddit.com/r/pennystocks/comments/8e7up8/most_undervalued_blockchain_play_cryp_crybf/,3,1,"Read the catalysts coming !
https://www.stockwatch.com/News/Item.aspx?bid=Z-C%3aCRYP-2591606&amp;symbol=CRYP&amp;region=C",2018-04-23,https://www.reddit.com/r/pennystocks/comments/8e7up8/most_undervalued_blockchain_play_cryp_crybf/
2,Have Blockchain Tech Investors Found the Holy Grail?,8e7uel,capitalgrowth,https://www.reddit.com/r/pennystocks/comments/8e7uel/have_blockchain_tech_investors_found_the_holy/,0,2,"$BLOK $BKKPF
https://www.entrepreneur.com/article/312127",2018-04-23,https://www.reddit.com/r/pennystocks/comments/8e7uel/have_blockchain_tech_investors_found_the_holy/
3,New 52w High coming this week for $IME $IMEXF,8e7tp2,capitalgrowth,https://www.reddit.com/r/pennystocks/comments/8e7tp2/new_52w_high_coming_this_week_for_ime_imexf/,1,2,"THE NEXT BIG THING IN CANCER DETECTION
https://www.imaginmedicalstock.com/",2018-04-23,https://www.reddit.com/r/pennystocks/comments/8e7tp2/new_52w_high_coming_this_week_for_ime_imexf/
4,$AKER is shit,8e7b7w,Cts--V,https://www.reddit.com/r/pennystocks/comments/8e7b7w/aker_is_shit/,0,11,"$ATOS is also shit. Don't fall for the news. 

If you haven't got into $MYO yet, you should. ",2018-04-23,https://www.reddit.com/r/pennystocks/comments/8e7b7w/aker_is_shit/
5,TNREF/TRO cheap prior to summer exploration. Gold @ $1320!!,8edqdo,CanadianBeerCan,https://www.reddit.com/r/pennystocks/comments/8edqdo/tnreftro_cheap_prior_to_summer_exploration_gold/,10,0,"TNREF/TRO cheap right now. Going into summer drilling to expand high grade gold zone and permitting a highly profitable test mining operation for BC multi-metal project. Gold is hot hot hot!

As far as I can tell float is ridiculously low so it wouldn't take much to hit .20 on this or even higher.",2018-04-23,https://www.reddit.com/r/pennystocks/comments/8edqdo/tnreftro_cheap_prior_to_summer_exploration_gold/
6,"April 23, 2018 Tomorrow's Daily /r/Pennystocks Discussion - Tuesday plays!",8edjw7,AutoModerator,https://www.reddit.com/r/pennystocks/comments/8edjw7/april_23_2018_tomorrows_daily_rpennystocks/,6,2,"Please use this thread to discuss your plays of the day!

Since this thread is likely to fill up quickly, consider sorting the comments by ""new"" (instead of ""best"" or ""top"") to see the newest posts.
",2018-04-23,https://www.reddit.com/r/pennystocks/comments/8edjw7/april_23_2018_tomorrows_daily_rpennystocks/
7,$LXRP Lexaria Achieves Significant Breakthrough in Alternative Nicotine Delivery Technology,8ee2ly,Laker_Gev,https://www.reddit.com/r/pennystocks/comments/8ee2ly/lxrp_lexaria_achieves_significant_breakthrough_in/,15,4,https://www.networknewswire.com/news-article/,2018-04-23,https://www.reddit.com/r/pennystocks/comments/8ee2ly/lxrp_lexaria_achieves_significant_breakthrough_in/
