,author,id,url,score,text,date
133,1827338989,e83unl2,/r/pennystocks/comments/9pn0tt/pura_just_got_short_squeezed_d/e83unl2/,1,"Its a cashtag, similar to a hashtag. You can search it on twitter to see what ppl are saying.",2018-10-19
134,HitlersSpecialFlower,e83usgl,/r/pennystocks/comments/9pn0tt/pura_just_got_short_squeezed_d/e83usgl/,1,"Neat, thanks ",2018-10-19
135,1827338989,e83ut0u,/r/pennystocks/comments/9phc1j/how_often_do_big_runners_come_around/e83ut0u/,1,"Under 10m is small, imo ",2018-10-19
136,vietong,e83uy4k,/r/pennystocks/comments/9pmej2/im_looking_for_a_stock_to_buy/e83uy4k/,1,"Definitely some growth long term, I would hold it’s not too late!",2018-10-19
137,reverendcat,e83w90m,/r/pennystocks/comments/9pmej2/im_looking_for_a_stock_to_buy/e83w90m/,1,Buy SWOL now!,2018-10-19
138,newmeforever,e83wsvm,/r/pennystocks/comments/9pmej2/im_looking_for_a_stock_to_buy/e83wsvm/,1,"Load up on shipper stocks - GLBS, TOPS, DCIX they will run soon",2018-10-19
139,LeadKisses,e8433l6,/r/pennystocks/comments/9pmc17/what_mobile_app_do_you_guys_use/e8433l6/,1,"Robin Hood. If you use a referral, they will give you a free share.",2018-10-19
140,Mejibray,e847muq,/r/pennystocks/comments/9phc1j/how_often_do_big_runners_come_around/e847muq/,1,"&gt; small float

Low float means that the available stocks that are being traded in the market are low. So if a company has 90% institutional ownership that leaves 10% available to trade within the market. That makes a stock easier to go up and down. 

That's why you also have to look at technical charts and the volume of the stock to make that decision to buy or not. 

",2018-10-19
141,CaptainWeee,e84bc92,/r/pennystocks/comments/9pm8zp/hiph_huge_find/e84bc92/,1,Lol yup,2018-10-19
142,CaptainWeee,e84bcwb,/r/pennystocks/comments/9pm8zp/hiph_huge_find/e84bcwb/,1,You might :-P get some Monday,2018-10-19
143,wastingmytime590,e84ilaw,/r/pennystocks/comments/9pmej2/im_looking_for_a_stock_to_buy/e84ilaw/,1,r/wallstreetbets,2018-10-19
144,BeligerentBlacksmith,e84iwh7,/r/pennystocks/comments/9po96j/medtainer_mdtr_capturing_larger_share_of_canadian/e84iwh7/,1,"I picked this up a few weeks ago right after they announced Auroras huge purchase. made about 60% and sold 8000/10000 shares. Hanging onto the last 2000 for the long haul as I believe these guys will grow like crazy. Being honest i haven’t looked into it a great deal but I like the lesser known brands that have solid product. A lot of people don’t seem to know who Medtainer is but they’re grinders are almost the equivalent of bic lighters where I’m from. Couple that in with the huge amount of packaging that weed is going to require and I think you’ve got solid growth opportunity. They’ve already had one big purchase from Aurora and it is my understanding that they’re currently working out some major purchases with a few other large cannabis companies. 

I’m not a professional so you probably shouldn’t listen to me but that’s my opinion. ",2018-10-19
145,GlowingPants,e84jhwq,/r/pennystocks/comments/9pkc9l/mlhc_pumping_upon_news_release/e84jhwq/,1,Thanks for the strong counterpoint dipshit,2018-10-19
146,gazgunz,e84jmd2,/r/pennystocks/comments/9pkc9l/mlhc_pumping_upon_news_release/e84jmd2/,1,Truth hurts sorry u fell for a scam ,2018-10-19
147,GlowingPants,e84jonr,/r/pennystocks/comments/9pkc9l/mlhc_pumping_upon_news_release/e84jonr/,1,Tell me information. You’re just saying nonsense. ,2018-10-19
148,Coopetition,e84ns2f,/r/pennystocks/comments/9pkf95/dcix_buy_buy_buy/e84ns2f/,1,Just put a stop loss in. ,2018-10-19
149,Xerethor,e84o85e,/r/pennystocks/comments/9po96j/medtainer_mdtr_capturing_larger_share_of_canadian/e84o85e/,1,"Very well said.  I think they’ll definitely get into the US market too, one of the reasons I snatched them up.",2018-10-19
150,supersb360,e84o90h,/r/pennystocks/comments/9pmej2/im_looking_for_a_stock_to_buy/e84o90h/,1,It’s revolutionary Watson!,2018-10-19
151,KommandoMetz,e84wawc,/r/pennystocks/comments/9pmej2/im_looking_for_a_stock_to_buy/e84wawc/,1,MNGA,2018-10-19
152,KommandoMetz,e84wkhi,/r/pennystocks/comments/9phc1j/how_often_do_big_runners_come_around/e84wkhi/,1,Quite often actually. Easily 1 runner with 100% per week. Couple 50% am many lower. Sometimes u get the occasional 200-300+ run. And at times (not often) u can see 500%+ a day. 1000% runs are not seen often though!,2018-10-19
153,KommandoMetz,e84wvc1,/r/pennystocks/comments/9phc1j/how_often_do_big_runners_come_around/e84wvc1/,1,"PM high volume is how u scan and find candidates! Professional software with real-time data (also pm and ah!), 1min -30sec candles, and the usual indicators is what u need. Bollinger, RSI, MACD. MA 20 MA 50. Etc.
I am using Trader Work Station from Interactive Brokers. It is great! The ""mosaic"" desktop layout is great to find volume surfers in pm!",2018-10-19
154,KommandoMetz,e84wyrm,/r/pennystocks/comments/9pmc17/what_mobile_app_do_you_guys_use/e84wyrm/,1,"WeBull, StockTwits, Interactive Brokers App, Investing.com app",2018-10-19
155,gazgunz,e84ydkh,/r/pennystocks/comments/9phc1j/how_often_do_big_runners_come_around/e84ydkh/,1,"Oh I know I meant like what amount do u consider small, just trying to get a diff perspective for me anything under 500M I like",2018-10-19
156,landob,e853w6f,/r/pennystocks/comments/9pnchl/thoughts_on_mining_companies_rnx_or_wm/e853w6f/,1,which means this is the perfect time to buy in,2018-10-19
157,throwaway1923791273,e85d8r9,/r/pennystocks/comments/9pmej2/im_looking_for_a_stock_to_buy/e85d8r9/,1,"VEIN. Cash on hand, no debt, drill program paid for and underway. ",2018-10-19
158,kat33c,e85k68u,/r/pennystocks/comments/9pkf95/dcix_buy_buy_buy/e85k68u/,1,I’m in,2018-10-19
159,WaxuTutu,e85nz2i,/r/pennystocks/comments/9phc1j/how_often_do_big_runners_come_around/e85nz2i/,1,How do you find penny stocks on here?,2018-10-19
160,Sneakeraddict525,e85o3ey,/r/pennystocks/comments/9pm8zp/hiph_huge_find/e85o3ey/,1,NBEV is a garbage company though. Could still run on speculation hmmm.,2018-10-19
161,bellegunness,e85p9cl,/r/pennystocks/comments/9pjh0s/integrated_cannabis_company_inc_icnaf_to_acquire/e85p9cl/,1,"I think. with the direction the marijuana industry is heading, I think the risk is worth it. 

Everything I had, with the exception of a penny stock, was down Friday. 

The only place I made any money was the penny stock. It was up 52% lol 

&amp;#x200B;",2018-10-19
162,CaptainWeee,e85p9g5,/r/pennystocks/comments/9pm8zp/hiph_huge_find/e85p9g5/,1,Agreed,2018-10-19
163,kemar7856,e85rmy7,/r/pennystocks/comments/9porwo/ophc_up_40_after_hours/e85rmy7/,1,can you imagine having this stock when it went from $1400 to $12 ,2018-10-19
164,Cidva,e85swxn,/r/pennystocks/comments/9pmc17/what_mobile_app_do_you_guys_use/e85swxn/,1,I use TDAmeritrade and thinkorswim and yahoo finance and simply Wall St all together on iOS ,2018-10-19
165,madnessguy67,e861m8x,/r/pennystocks/comments/9phc1j/how_often_do_big_runners_come_around/e861m8x/,1,Use the screener and set the amount you want. Penny stocks &lt;5,2018-10-19
166,gazgunz,e867v8k,/r/pennystocks/comments/9pm8zp/hiph_huge_find/e867v8k/,1,They will be,2018-10-19
167,WaxuTutu,e86fiqm,/r/pennystocks/comments/9pmc17/what_mobile_app_do_you_guys_use/e86fiqm/,1,Just get an Ally account and trade on yahoo finance,2018-10-19
168,[deleted],e86rruj,/r/pennystocks/comments/9pmej2/im_looking_for_a_stock_to_buy/e86rruj/,1,[removed],2018-10-19
169,Kdavydov,e877oro,/r/pennystocks/comments/9pn0tt/pura_just_got_short_squeezed_d/e877oro/,1,"PURA is off the to moon!!! No way of stopping it. Projected price is $1.12, how I would love to see $5.00+ ",2018-10-19
170,Denio595,e87hi3r,/r/pennystocks/comments/9pmej2/im_looking_for_a_stock_to_buy/e87hi3r/,1,The irony is this is obvious satire but was treated like a real post to bring out the hopeful pumpers.,2018-10-19
171,Awsome306,e87io78,/r/pennystocks/comments/9plbbx/weeeeeeeeeeeee/e87io78/,1,How do you buy it? If it's not on the NYSE. What brokers trade on the OTCMKTS?,2018-10-19
172,Xerethor,e87is5q,/r/pennystocks/comments/9plbbx/weeeeeeeeeeeee/e87is5q/,1,"As far as I Know, any broker beside Robinhood.  ",2018-10-19
173,qi2016,e87nhir,/r/pennystocks/comments/9pmej2/im_looking_for_a_stock_to_buy/e87nhir/,1,"Go to a casino and bet big or small on the dice, at least you have about 46% chance to double your money. ",2018-10-19
174,Chrisisvenom2,e87seon,/r/pennystocks/comments/9pkc9l/mlhc_pumping_upon_news_release/e87seon/,1,"Jesus, why can’t this be on Robinhood. I’m starting out and all these companies you guys share are never on it! Still, wishing you all success!",2018-10-19
175,summacumlaudekc,e87t4cd,/r/pennystocks/comments/9pm8zp/hiph_huge_find/e87t4cd/,1,Suggestion? ,2018-10-19
176,[deleted],e87t9ef,/r/pennystocks/comments/9pmc17/what_mobile_app_do_you_guys_use/e87t9ef/,1,[removed],2018-10-19
177,CaptainWeee,e87utjs,/r/pennystocks/comments/9pm8zp/hiph_huge_find/e87utjs/,1,Schwab And TDA,2018-10-19
178,smooferated,e88354v,/r/pennystocks/comments/9pn0tt/pura_just_got_short_squeezed_d/e88354v/,1,Well here goes....  in with $500 or so with you all on these penny stocks for Monday morning.  Have had some fun and success in the past solo.  My blue chips are disappointing.  Let’s see how much more I can lose!  Lol.,2018-10-19
179,ChamberofSarcasm,e883uo4,/r/pennystocks/comments/9pm8zp/hiph_huge_find/e883uo4/,1,"I'm skeptical of a company whose #1 boast on LinkedIn is, ""#1 water brand sold in Sri Lanka"". ",2018-10-19
180,[deleted],e886f8d,/r/pennystocks/comments/9pm8zp/hiph_huge_find/e886f8d/,1,[removed],2018-10-19
181,LotsoWatts,e88ds65,/r/pennystocks/comments/9pmej2/im_looking_for_a_stock_to_buy/e88ds65/,1,So many people do it that I'm not convinced it's satire,2018-10-19
182,ATShock,e88i4cw,/r/pennystocks/comments/9ph4b5/simple_questions_october_19_2018/e88i4cw/,1,"What site do you use to trade? I'm a rookie and have used Robinhood, but can't find any of the penny stocks mentioned on this sub.

&amp;#x200B;

Thanks!",2018-10-19
183,gazgunz,e88wjkr,/r/pennystocks/comments/9pm8zp/hiph_huge_find/e88wjkr/,1,"Good for you, don’t buy it then.",2018-10-19
184,ChamberofSarcasm,e891f2n,/r/pennystocks/comments/9pm8zp/hiph_huge_find/e891f2n/,1,Just posting what I found. ,2018-10-19
185,FoxRaine,e89a1ex,/r/pennystocks/comments/9pn0tt/pura_just_got_short_squeezed_d/e89a1ex/,1,Me too lol I'd make $35k xD,2018-10-19
186,dgfdfdfdf,e89irb7,/r/pennystocks/comments/9pm8zp/hiph_huge_find/e89irb7/,1,They need to hire a better advertising artist. Their branding is godawful ,2018-10-19
187,Awsome306,e89o1j8,/r/pennystocks/comments/9ph4b5/simple_questions_october_19_2018/e89o1j8/,1,"^Lol, same problem here. ",2018-10-19
188,TheSexyDuckling,e89olij,/r/pennystocks/comments/9pm8zp/hiph_huge_find/e89olij/,1,"Dumb question, but how does the historical market cap work with this? For example, the historical price in 2014 was $12 million due to reverse splits. But if you calculate the market cap back then compared to today's price it would be $667 trillion! How does the math work in this case?",2018-10-19
189,CaptainWeee,e89zyu9,/r/pennystocks/comments/9pm8zp/hiph_huge_find/e89zyu9/,1,Lol it wouldn’t because past events don’t count into the current physical price or market cap,2018-10-19
190,TheSexyDuckling,e8a061f,/r/pennystocks/comments/9pm8zp/hiph_huge_find/e8a061f/,1,Right but shouldn't the stock price * shares outstanding equal to the market cap. And these two values will simply be related by reciprocal during splits.,2018-10-19
191,PotNoodlez,e8a888y,/r/pennystocks/comments/9ph4b5/simple_questions_october_19_2018/e8a888y/,1,Me too,2018-10-19
192,NikoSleeps,e8akh37,/r/pennystocks/comments/9pkf95/dcix_buy_buy_buy/e8akh37/,1,"To those of you who bought, well done! I'll keep my eye out for the next one :) ",2018-10-19
193,ylanthomas525,e8alist,/r/pennystocks/comments/9pjtah/buyingbin_to_ipo_on_robinhood/e8alist/,1,"i placed a limit buy for the DBX IPO, my orders were cancelled. By the time I got an order in I already missed the initial gains, caught the losses though!",2018-10-19
194,dupajuda248,e8apqs3,/r/pennystocks/comments/9pn0tt/pura_just_got_short_squeezed_d/e8apqs3/,1,"Had 60,000 shares. Sold 20,000 now I’m playing with house money ",2018-10-19
195,chuckangel,e8b6jzk,/r/pennystocks/comments/9ph4b5/simple_questions_october_19_2018/e8b6jzk/,1,"Robinhood doesn't do the OTC stuff and their executes are rather poor for day trades.

I use thinkorswim. It's TDAmeritrade's app and it's free, but you need to have money in your account to get ""live"" pricing (otherwise it's either a 15 or 30 minute delay). By money, I mean, like $25 or $50. It's kinda overwhelming at first, but you get the hang of it and there's tons of tutorials and stuff. Before you know it, you'll be creating your own filters and scans and what not.

I tried eTrade's app, but scaling issues on my 4k monitor put an end to that (itty bitty tiny little fonts) and I didn't feel like trying to fix it. 
",2018-10-19
196,Nachious,e8bvb7h,/r/pennystocks/comments/9ph4b5/simple_questions_october_19_2018/e8bvb7h/,1,"Im new to trading and just wanted imput in Tim Sykes. I not realling to to join a webinar or classes by anyone. The reason is i don't trust anyone. I know they are good at what they do. I just dont know how i think about the guy. It like i hate his face but when he talks I listen. 

Do you guys have anyone i can maybe stuck with and listen to here and there. Or who to stay away from. Im trying to start a day to day routine for swing trading penny stocks. Im super new to this but for some reason I like it. Maybe because I have never blowen up an accout and looked down the barrel of a  shotgun yet. So I taking my time with it.",2018-10-19
197,Awsome306,e8c1i80,/r/pennystocks/comments/9ph4b5/simple_questions_october_19_2018/e8c1i80/,1,I was under the impression that TOS charged commissions? And pretty high commissions at that,2018-10-19
198,chuckangel,e8c3j6e,/r/pennystocks/comments/9ph4b5/simple_questions_october_19_2018/e8c3j6e/,1,"7.95 a trade.  Etrade is the same until you reach a threshold and drops to 4.95. I typically used etrade for most of mine, and td i kept a small amount for good setups. If you're only buying like 10 bucks worth of stock, i can see that being an issue, but my minimum position was around 500 to a thousand at the end of my trading ""career"" (i ended up putting it all in crypto.  Fuck it) ",2018-10-19
199,porcupinelmf,e8g4g3t,/r/pennystocks/comments/9ph4b5/simple_questions_october_19_2018/e8g4g3t/,1,"Long here, only Blue Chips. Learning about shorts.   
How do you determine which penny stock you want to buy? what are the criteria a penny needs to make me say ""ok, this has potential?"" Is it the same type of research when you are a buying for long term investment?  
And lastly, when is the right time to sell, especially when the stock is dangling in .90 cents, and never past a dollar",2018-10-19
200,Kdavydov,e8j7h2o,/r/pennystocks/comments/9pn0tt/pura_just_got_short_squeezed_d/e8j7h2o/,1,"I’d make half mill 😱 
Let’s c it happen ",2018-10-19
201,NikoSleeps,e8jnlc0,/r/pennystocks/comments/9pkf95/dcix_buy_buy_buy/e8jnlc0/,1,"After hours trading is over $2.00 now. From here on out, you should be at close to 50% gains if you bought when OP came out. Up to you guys on what you do now. Shipping season is just starting. ",2018-10-19
202,zloganrox08,e966ftx,/r/pennystocks/comments/9pmc17/what_mobile_app_do_you_guys_use/e966ftx/,1,"Do you ever have problems with stocks not showing up? I just downloaded robin hood and a bunch of stocks valued less than a penny don't show up, so i can't trade them",2018-10-19
203,LeadKisses,e96eea6,/r/pennystocks/comments/9pmc17/what_mobile_app_do_you_guys_use/e96eea6/,1,"Yeah, occasionally I come across something that's not on there. Let me know if you figure it out.",2018-10-19
204,zloganrox08,e96safd,/r/pennystocks/comments/9pmc17/what_mobile_app_do_you_guys_use/e96safd/,1,"I didn't, but i found out that supposedly fidelity, which i normally use, actually allows you to trade them, you just have to call first",2018-10-19
205,wall4ss,e9rbckx,/r/pennystocks/comments/9pmej2/im_looking_for_a_stock_to_buy/e9rbckx/,1,Hey! Bitcoin is back!,2018-10-19
206,WonkyWombat32,eazdyfk,/r/pennystocks/comments/9plzah/looking_at_these_great_potential/eazdyfk/,1,Still in $sgtn? They just had a shareholder meeting. Waiting on results to be published.,2018-10-19
207,Budd0413,eazuqtc,/r/pennystocks/comments/9plzah/looking_at_these_great_potential/eazuqtc/,1,"I am,  I believe Sgtn will be a monster when it starts moving ",2018-10-19
