,author,id,url,score,text,date
230,discobiskitz,fmlehb6,/r/pennystocks/comments/fvvkp7/xspa_possible_breakout_today/fmlehb6/,1,holding 5000 at .165,2020-04-06
231,KennyThaJet,fmlel1p,/r/pennystocks/comments/fvzc6w/kos/fmlel1p/,1,Couldn’t agree more! That’s another interesting aspect of KOS is their green initiative on climate change. The company also produces outstanding results such as “Kosmos has approximately 14.5 million barrels of oil hedged covering 2019 through 2020 “. With proven results of product I can’t imagine this company not 🚀 once corona and the oil war is over,2020-04-06
232,trentslade111,fmlemvg,/r/pennystocks/comments/fvznuf/decn_good_news/fmlemvg/,1,Seems like a good time to buy in right now given the circumstances fda approval would be imminent right?,2020-04-06
233,Purplepunch36,fmleq7m,/r/pennystocks/comments/fvz2xt/aytu/fmleq7m/,1,"Fuck AYTU, thorn in my side",2020-04-06
234,conorscottvanek,fmlerae,/r/pennystocks/comments/fvz5w1/trq_up_8_today_and_counting/fmlerae/,1,I read something about them facing investor revolt over the mine partly related to mismanagement. Thoughts on how this will affect the stock price?,2020-04-06
235,mattl1028,fmlet3n,/r/pennystocks/comments/fvz2xt/aytu/fmlet3n/,1,Fr like wtf it’s dropping straight down rn after a month of good news,2020-04-06
236,Purplepunch36,fmlewel,/r/pennystocks/comments/fvz2xt/aytu/fmlewel/,1,Basically where I'm at right now. It's frustrating to see that stock in my portfolio the other day where everything else is in the green,2020-04-06
237,KennyThaJet,fmlewzt,/r/pennystocks/comments/fvzc6w/kos/fmlewzt/,1,"I can’t imagine it will drop by a substantial amount Thursday (That’s a big IF it even drops). The oil war and Trumps stance on Oil has gained more press attention and without Corona this would be a hot topic for sure. I would wait for a lunch hour dip (11-1) in trading any day this week and make your buy then. No financial expert, just giving the advise that worked for me",2020-04-06
238,INKOSI-Yaw,fmlf0pc,/r/pennystocks/comments/fvz2xt/aytu/fmlf0pc/,1,"Yeah can’t wait to dump this 
Wouldn’t mind breaking even but it’s always like 10-20cents / share lower than my break even point 😂",2020-04-06
239,active_yesterday,fmlf6y1,/r/pennystocks/comments/fvw35r/amazing_stocks/fmlf6y1/,1,"Had 1000 shares of XSPA at .19, got out today at .35.",2020-04-06
240,allgaspedalnobrakes,fmlfeyg,/r/pennystocks/comments/fvzc6w/kos/fmlfeyg/,1,why thurs?,2020-04-06
241,Macd-Paragon,fmlfivv,/r/pennystocks/comments/fvz2xt/aytu/fmlfivv/,1,Buy high sell low,2020-04-06
242,INKOSI-Yaw,fmlfmyw,/r/pennystocks/comments/fvvp99/xspa_bring_it_out_boys_here_we_go/fmlfmyw/,1,This is the way,2020-04-06
243,chilybum,fmlfpaa,/r/pennystocks/comments/fvznuf/decn_good_news/fmlfpaa/,1,I didn't find  this in RH..where is this available?,2020-04-06
244,wastedtimepiece,fmlfq0b,/r/pennystocks/comments/fvzegd/mvis/fmlfq0b/,1,Buy at open sell around 10:30 is what makes me money. Hopefully next week they release their earnings. It should go up IMO based off of recent PR and an earnings trend moving upwards...but who knows. I’ve been loading up since it’s cheap right now.,2020-04-06
245,ArcticMonkeysCSULB,fmlfwc1,/r/pennystocks/comments/fvznuf/decn_good_news/fmlfwc1/,1,"It's an OTC wont be on there 
Need TD Ameritrade or schwab",2020-04-06
246,TaGeuelePutain,fmlg57n,/r/pennystocks/comments/fvxtar/how_to_use_volume_and_candlestick_pattern_to_spot/fmlg57n/,1,"thanks for the help. Do analysis of volume/price work on a longer-term chart? Like a week / month? I'm not in a position to make a lot of day trades atm, so have been holding for a bit longer than minutes",2020-04-06
247,Purplepunch36,fmlgb19,/r/pennystocks/comments/fvz2xt/aytu/fmlgb19/,1,"Not sure, this stock is bullshit and good PR doesn't do anything for it.",2020-04-06
248,InterimNihilist,fmlgq5u,/r/pennystocks/comments/fvz0f9/ibio/fmlgq5u/,1,its a pump and dump. a trap,2020-04-06
249,Dustyoa,fmlgw70,/r/pennystocks/comments/fvxtar/how_to_use_volume_and_candlestick_pattern_to_spot/fmlgw70/,1,"But what price should I buy in at? Teaching me how to figure it out does me no good when you can just tell me!!! /s

Good info, thanks!",2020-04-06
250,HereForTheMoney420,fmlgwyh,/r/pennystocks/comments/fvznuf/decn_good_news/fmlgwyh/,1,As someone with 6k shares at .12 this is definitely good news.,2020-04-06
251,anonomnomnomn,fmlh4cf,/r/pennystocks/comments/fvznuf/decn_good_news/fmlh4cf/,1,"Yeah I'm right there with you. It started to dip and I was like ""oh no""",2020-04-06
252,Snewbanks31,fmlh5e2,/r/pennystocks/comments/fvzc6w/kos/fmlh5e2/,1,Just a copy and a paste eh? Lol,2020-04-06
253,dirtysanchez1917,fmlh7mq,/r/pennystocks/comments/fvzc6w/kos/fmlh7mq/,1,You hate to see it ;~;,2020-04-06
254,SweatyLatina,fmlh7x9,/r/pennystocks/comments/fw0h0n/rwt_is_cheap_right_now/fmlh7x9/,1,I agree. They’re way oversold rn.,2020-04-06
255,trentslade111,fmlhait,/r/pennystocks/comments/fvz0f9/ibio/fmlhait/,1,Right,2020-04-06
256,HereForTheMoney420,fmlhbyy,/r/pennystocks/comments/fvznuf/decn_good_news/fmlhbyy/,1,"With DECN, AYTU, XSPA, &amp; CYDY I just keep telling myself, “someday...”",2020-04-06
257,IndependentComb3,fmlhl6n,/r/pennystocks/comments/fvz2xt/aytu/fmlhl6n/,1,"i’ve been holding onto this for a month. i reaaaallly thought this was gonna be a good stock and make me a few dollars but it has really disappointed. i’m glad everyone is on the same
boat as me but i’m hoping it reaches $2 so i can sell it off",2020-04-06
258,yesyesyesyesyesokyes,fmlhlhv,/r/pennystocks/comments/fvznuf/decn_good_news/fmlhlhv/,1,It's at 8 cents.. Why do you think it will explode,2020-04-06
259,mitchmav,fmlhllz,/r/pennystocks/comments/fw0cjr/decn_buy_while_its_cheap/fmlhllz/,1,"Been in, waiting for takeoff!",2020-04-06
260,discobiskitz,fmlhnqy,/r/pennystocks/comments/fvznuf/decn_good_news/fmlhnqy/,1,Don’t FOMO on this POS,2020-04-06
261,ninodenino,fmlhq70,/r/pennystocks/comments/fvznuf/decn_good_news/fmlhq70/,1,"It’s like playing the lottery dude, I have no fucking evidence on why or how or when this will explode but a little bit of hope and a little bit of praying that it does, if you had the opportunity to buy a legal money printer but the chance of it printing is 1/10000 for 9 cents you wouldn’t buy it?",2020-04-06
262,OperatOr118,fmlhsmz,/r/pennystocks/comments/fw0h0n/rwt_is_cheap_right_now/fmlhsmz/,1,Interesting. I wish I was more familiar with this stock to make a bigger move. Thank you though!,2020-04-06
263,anonomnomnomn,fmlhtkq,/r/pennystocks/comments/fvznuf/decn_good_news/fmlhtkq/,1,"Yeah I've got a hold on AYTU as well, bought in at 1.89. RIP",2020-04-06
264,CheechnStocks,fmlhw37,/r/pennystocks/comments/fvz2xt/aytu/fmlhw37/,1,"Hopped in last week at 1.58, thankfully not a lot but damn with all this good news and stuff going on but... wow. The disappointment is real lol. Holding till Friday or selling if I break even",2020-04-06
265,yesyesyesyesyesokyes,fmlhz2u,/r/pennystocks/comments/fvznuf/decn_good_news/fmlhz2u/,1,"I bought 55,000 shares of GCGX instead... I get what you are saying but I mean after Corona none of these companies will matter",2020-04-06
266,ninodenino,fmli20k,/r/pennystocks/comments/fvznuf/decn_good_news/fmli20k/,1,"Oh yeah exactly, I see no future in any of these stocks, I’m just trying to use this to make a quick buck, then I plan on investing in the long run",2020-04-06
267,fawkesmulder,fmliapj,/r/pennystocks/comments/fvz5w1/trq_up_8_today_and_counting/fmliapj/,1,"Could be positive honestly. The mine itself is enormous, the issues that tanked the stock price lie within the management.",2020-04-06
268,Murdoc555,fmlifyq,/r/pennystocks/comments/fvznuf/decn_good_news/fmlifyq/,1,Where's the news?,2020-04-06
269,Murdoc555,fmlil69,/r/pennystocks/comments/fw0cgs/decn_gets_covid_test_accepted_by_fda/fmlil69/,1,Where at? I can't find it.,2020-04-06
270,nuubuser,fmlivw8,/r/pennystocks/comments/fw0cjr/decn_buy_while_its_cheap/fmlivw8/,1,It actually went up quite nicely since Friday. Long term not sure. It is pump and dump stock. I got lots of them but not sure if I keep them,2020-04-06
271,Murdoc555,fmliz9j,/r/pennystocks/comments/fvznuf/decn_good_news/fmliz9j/,1,"Hahaha, same here. It was nice to see green after 2 weeks.",2020-04-06
272,FractalAsshole,fmlizmu,/r/pennystocks/comments/fw0t8y/very_significant_news_for_aker/fmlizmu/,1,Already jumped tho :/,2020-04-06
273,Arniescc,fmlj0qs,/r/pennystocks/comments/fw0cjr/decn_buy_while_its_cheap/fmlj0qs/,1,"It has test kits,not a pump and dump. They will be distributing soon. This virus will be around a long time . No cure for 12 months at least.",2020-04-06
274,LinkToUa,fmlj5b7,/r/pennystocks/comments/fw0t8y/very_significant_news_for_aker/fmlj5b7/,1,"Yeah you can’t rely on reddit for news, too slow",2020-04-06
275,pesti13nce,fmlj5my,/r/pennystocks/comments/fw0ua5/tops_on_the_rise_again/fmlj5my/,1,I got 600 @.19 gotta make up for JDST lol,2020-04-06
276,CrazyDiehl11,fmljaec,/r/pennystocks/comments/fw0ua5/tops_on_the_rise_again/fmljaec/,1,Not getting on that again. Good luck,2020-04-06
277,worldrobotdomination,fmljat8,/r/pennystocks/comments/fvznuf/decn_good_news/fmljat8/,1,[https://finance.yahoo.com/news/decn-files-finalized-fda-eua-141500072.html](https://finance.yahoo.com/news/decn-files-finalized-fda-eua-141500072.html),2020-04-06
278,Reddit_and_forgeddit,fmljfm5,/r/pennystocks/comments/fw0cgs/decn_gets_covid_test_accepted_by_fda/fmljfm5/,1,"The test isn’t accepted, it’s my understanding that the filing for acceptance has been accepted by FDA",2020-04-06
279,Reddit_and_forgeddit,fmljhpq,/r/pennystocks/comments/fw0cgs/decn_gets_covid_test_accepted_by_fda/fmljhpq/,1,"Td ameritrade or errands.  It’s an OTC, not on RH",2020-04-06
280,nuubuser,fmljmni,/r/pennystocks/comments/fw0cjr/decn_buy_while_its_cheap/fmljmni/,1,Honestly lots of them out there. Not really sure DECN can pull it off,2020-04-06
281,rocketpianoman,fmljq88,/r/pennystocks/comments/fvz2xt/aytu/fmljq88/,1,They just sold a buch of test kits to Denver PD. Hopefully we will see more good news soon,2020-04-06
282,ArcticMonkeysCSULB,fmljun7,/r/pennystocks/comments/fvznuf/decn_good_news/fmljun7/,1,"We back man, to the moon 🚀
We shall be rewarded for our 💎👐",2020-04-06
283,vantyle,fmljv65,/r/pennystocks/comments/fw0cgs/decn_gets_covid_test_accepted_by_fda/fmljv65/,1,This is true. OP needs to get the facts straight.,2020-04-06
284,discobiskitz,fmlloen,/r/pennystocks/comments/fw0ua5/tops_on_the_rise_again/fmlloen/,1,Whole markets up 20% today I feel a super crash coming on,2020-04-06
285,Neng1987,fmlm0re,/r/pennystocks/comments/fvznuf/decn_good_news/fmlm0re/,1,"I just did, 10k @.08. Will let it ride for a few days",2020-04-06
286,JohnnyLakefront,fmlm7vp,/r/pennystocks/comments/fvznuf/decn_good_news/fmlm7vp/,1,"There might not be an ""after Corona."" We could be stuck with this a long time.

Also, these viral tests aren't only for covid-19.",2020-04-06
287,thrilhouse03,fmlmj9a,/r/pennystocks/comments/fvz2xt/aytu/fmlmj9a/,1,"In at 1250 at $1.29, I’m holding.",2020-04-06
288,Vast_Cricket,fmlmk08,/r/pennystocks/comments/fvz2xt/aytu/fmlmk08/,1,unload,2020-04-06
289,Murdoc555,fmlmr7k,/r/pennystocks/comments/fw0cgs/decn_gets_covid_test_accepted_by_fda/fmlmr7k/,1,"Sorry, I meant the news. I got it now, thanks.",2020-04-06
290,conorscottvanek,fmln2l4,/r/pennystocks/comments/fw0cjr/decn_buy_while_its_cheap/fmln2l4/,1,"So I guess now it's more or less just a question of whether or not the test actually lives up to the hype, huh?",2020-04-06
291,Zultrek,fmlnif6,/r/pennystocks/comments/fw19em/akers/fmlnif6/,1,"may be too late, already peaking I think. A lot peaks at lunch it seems like with these type stocks then drop.",2020-04-06
292,oneallinticketplease,fmlnk6m,/r/pennystocks/comments/fw0h0n/rwt_is_cheap_right_now/fmlnk6m/,1,"$5,50 on wednesday lessgoooo (Y)",2020-04-06
293,XtremelyNooby,fmlnqjo,/r/pennystocks/comments/fw0cjr/decn_buy_while_its_cheap/fmlnqjo/,1,That is correct,2020-04-06
294,Purplepunch36,fmlo0hn,/r/pennystocks/comments/fw1gf2/the_next_potential_pop_stock_trnx/fmlo0hn/,1,I'll ride this short train for the week. I'd be happy to sell at .18 tbh,2020-04-06
295,coookiesfoo,fmlo8z2,/r/pennystocks/comments/fw1gf2/the_next_potential_pop_stock_trnx/fmlo8z2/,1,Wow this stock was worth thousands per share 4-5 years ago,2020-04-06
296,s6dative,fmloc7u,/r/pennystocks/comments/fw1gf2/the_next_potential_pop_stock_trnx/fmloc7u/,1,I Believe it was due to cuts. Not entirely sure.,2020-04-06
297,coookiesfoo,fmlofvz,/r/pennystocks/comments/fw1gf2/the_next_potential_pop_stock_trnx/fmlofvz/,1,Makes sense that way I don’t know how else that kind of drop could happen unless they were just reallyyy unlucky,2020-04-06
298,[deleted],fmlooym,/r/pennystocks/comments/fw1pzq/who_else_is_holding_ecor/fmlooym/,1,[removed],2020-04-06
299,conorscottvanek,fmlpgcd,/r/pennystocks/comments/fw1gf2/the_next_potential_pop_stock_trnx/fmlpgcd/,1,"All the makings of ""popping""... Such as?",2020-04-06
300,discobiskitz,fmlprbn,/r/pennystocks/comments/fw1ou9/is_another_crash_coming/fmlprbn/,1,yes,2020-04-06
301,s6dative,fmlpshi,/r/pennystocks/comments/fw1thy/thoughts_on_ibio/fmlpshi/,1,"It looks like it didnt get the memo that the market wasnt doing too hot until recently.

It also appears that trump has stock piled an no-FDA-approved cure for covid so idk what to think about pharmaceutical companies rn.

My guess is that covid is going to be a common cold type sickness in the next few years and people will be prescribed drugs or a yearly shot to keep from getting sick. 

Either way, my guess is it may be good to buy now, but dont expect the gains we all are hoping.",2020-04-06
302,PimpOfJoytime,fmlpskc,/r/pennystocks/comments/fw1ou9/is_another_crash_coming/fmlpskc/,1,"Cat ears,  baby. Look out for those cat ears.",2020-04-06
303,CivicGuyRob,fmlptxo,/r/pennystocks/comments/fw1pzq/who_else_is_holding_ecor/fmlptxo/,1,500 shares @ .90,2020-04-06
304,KennyThaJet,fmlpvyp,/r/pennystocks/comments/fvzc6w/kos/fmlpvyp/,1,That is the new expected Oil key leader meeting between Saudi Arabia and Russia,2020-04-06
305,PM_ME_BUTT_STUFFING,fmlpw46,/r/pennystocks/comments/fvxtar/how_to_use_volume_and_candlestick_pattern_to_spot/fmlpw46/,1,Thanks for this she dumbed it down enough for me!,2020-04-06
306,girlfrienddrama,fmlpxoj,/r/pennystocks/comments/fw1pzq/who_else_is_holding_ecor/fmlpxoj/,1,"50 shares at 2+, welp",2020-04-06
307,Kasket81,fmlq8lt,/r/pennystocks/comments/fvxtar/how_to_use_volume_and_candlestick_pattern_to_spot/fmlq8lt/,1,Thanks You!,2020-04-06
308,mattdbaby,fmlqdji,/r/pennystocks/comments/fw0ua5/tops_on_the_rise_again/fmlqdji/,1,What do you use to gauge “the whole market”?...,2020-04-06
309,s6dative,fmlqjte,/r/pennystocks/comments/fw1gf2/the_next_potential_pop_stock_trnx/fmlqjte/,1,"The volume is there. 
The value is low. 
The companies industry is unique. 

It will gain more traction once the market is safe but right now, it has never been lower and the buying of the stock looks like TOP when it took off. 

Since I posted, its gained 2.39% (in around 10 minutes) and should at least get back to .15 by the market close.",2020-04-06
310,TransSpeciesDog,fmlqtny,/r/pennystocks/comments/fvznuf/decn_good_news/fmlqtny/,1,I think it's up 40% today... that much closer to me breaking even...,2020-04-06
311,[deleted],fmlqyya,/r/pennystocks/comments/fw0ua5/tops_on_the_rise_again/fmlqyya/,1,[deleted],2020-04-06
312,discobiskitz,fmlr0le,/r/pennystocks/comments/fw0ua5/tops_on_the_rise_again/fmlr0le/,2,"Mostly just my inexperience. Was talking out my ass with the 20% number, but looking at everything on my screen, it’s green across the board everything gis being pumped up artificially. Why would CCL, CHEF,PK,ERI,MGM,DAL all be 20+% green when they have 0 revenue coming in? Things are about to tank to all time lows imo.

Edit: Cheesecake Factory can’t pay their rent, but their shares are up 10%? I’m not a professional but it seems like titties are being pumped",2020-04-06
313,chrysler82000,fmlrein,/r/pennystocks/comments/fw1thy/thoughts_on_ibio/fmlrein/,1,buy on margin and short sell. it's gonna be .2 before its 1.5,2020-04-06
314,mattdbaby,fmlrkrx,/r/pennystocks/comments/fw0ua5/tops_on_the_rise_again/fmlrkrx/,2,"I definitely agree. To me it seems inevitable that they have to come back down. Maybe a green open bleeding into red/even close tomorrow, then red on Wednesday and Thursday. similar to last week.",2020-04-06
315,conorscottvanek,fmlropw,/r/pennystocks/comments/fw1ou9/is_another_crash_coming/fmlropw/,1,"I'm thinking, among other things, the first of every month is gonna keep affecting things negatively as people struggle to pay rent and bills.",2020-04-06
316,benchieepenchie,fmlrp2c,/r/pennystocks/comments/fw1gf2/the_next_potential_pop_stock_trnx/fmlrp2c/,1,Lol reverse split,2020-04-06
317,s6dative,fmlrr5x,/r/pennystocks/comments/fw1ou9/is_another_crash_coming/fmlrr5x/,1,Smart thinking. That's definitely a huge pain.,2020-04-06
318,itsgatewood,fmlsh1x,/r/pennystocks/comments/fw28m8/callsputs_for_the_week/fmlsh1x/,1,Need some as well. Right now investing in XSPA.,2020-04-06
319,bendangs,fmlspoh,/r/pennystocks/comments/fw0cjr/decn_buy_while_its_cheap/fmlspoh/,1,Is this a day trade or week hold?,2020-04-06
320,johnDannis,fmlsq8f,/r/pennystocks/comments/fvxtar/how_to_use_volume_and_candlestick_pattern_to_spot/fmlsq8f/,1,"It cant be proven statistically that volume can be used.I think it’s better to not use it at all, but i can be wrong",2020-04-06
321,Arniescc,fmlswg0,/r/pennystocks/comments/fw0cjr/decn_buy_while_its_cheap/fmlswg0/,1,"I would hold til they get FDA temporary approval. It should go up the most at that time.That could be soon,so pay attention.Go to their site and look for updates.",2020-04-06
322,bendangs,fmlsxzn,/r/pennystocks/comments/fw0cjr/decn_buy_while_its_cheap/fmlsxzn/,1,"Thanks, I’m already up some money with it and don’t want to be greedy",2020-04-06
323,Triiiident,fmlt5t4,/r/pennystocks/comments/fw1pzq/who_else_is_holding_ecor/fmlt5t4/,1,Do you think it will jump,2020-04-06
324,Knight_Aero,fmlt97l,/r/pennystocks/comments/fw28m8/callsputs_for_the_week/fmlt97l/,1,XSPA looking good for a long play I think. An oil stock would be good to review depending on how the news today and tomorrow go I guess. IMIMF is an outside the box stock that is due to have some interesting news hopefully at meeting tomorrow and the end of the month. It has also been steadily bullish the last week or so.,2020-04-06
325,bendangs,fmltmgy,/r/pennystocks/comments/fw07qf/decn_files_finalized_fda_eua_application_for_its/fmltmgy/,1,"So I’m already up, do we think this is a day trade or keep holding. I don’t want to be greedy.",2020-04-06
326,pennysmash403,fmltq1w,/r/pennystocks/comments/fvznuf/decn_good_news/fmltq1w/,1,"24/7 bashers were a good sign lol , 400k here, too much potential here",2020-04-06
327,LoPriore,fmltvln,/r/pennystocks/comments/fvobwo/worried_by_the_xspa_aytu_colab/fmltvln/,1,longer hold for me - 39 cents took a little but im not done with xspa!!!,2020-04-06
328,IdonthaveCooties,fmlty31,/r/pennystocks/comments/fw0ua5/tops_on_the_rise_again/fmlty31/,1,Anyone who’s up on this - secure profits or you WILL lose all of it.,2020-04-06
329,LoPriore,fmluorl,/r/pennystocks/comments/fvz2xt/aytu/fmluorl/,1,did fine with it - all house money now,2020-04-06
330,Kyism,fmlv2pb,/r/pennystocks/comments/fvtb59/what_app_do_you_guys_recommend_for_otcpink_sheets/fmlv2pb/,1,"TD Ameritrade can buy those stocks that you can find on RobinHood. TD Ameritrade app is, in my opinion, very complex if you're coming from Robin Hood like I was. I would probably recommend downloading the Thinkorswim phone app which TD Ameritrade can be used with to trade.",2020-04-06
331,aaronmsmith82,fmlv323,/r/pennystocks/comments/fvwuhl/chk/fmlv323/,1,Crumbling. Avoid.,2020-04-06
332,NASDQTRDER,fmlvf7u,/r/pennystocks/comments/fw07qf/decn_files_finalized_fda_eua_application_for_its/fmlvf7u/,1,"That has to be your decision.  When I'm up, depending on how much, I decide to sell some to get profit and keep some for later.  The more you are making, the less you have to sell to get your initial investment back.",2020-04-06
333,PradoMV96,fmlvv4u,/r/pennystocks/comments/fw0h0n/rwt_is_cheap_right_now/fmlvv4u/,1,You think it'll reach the 5-6 dollar threshold?,2020-04-06
334,chrysler82000,fmlw9k4,/r/pennystocks/comments/fvz0f9/ibio/fmlw9k4/,1,it could be a AKER. or .20 next week,2020-04-06
335,MarvinRivas1221,fmlwsfo,/r/pennystocks/comments/fw33mk/penny_stocks_server/fmlwsfo/,0,JDST,2020-04-06
336,conorscottvanek,fmlxhbi,/r/pennystocks/comments/fw0cjr/decn_buy_while_its_cheap/fmlxhbi/,1,Anyone have experience on how long ACH transfers take on Ameritrade? I'm sitting here watching it move up waiting for my money to show up,2020-04-06
337,[deleted],fmlxk7f,/r/pennystocks/comments/fw0cgs/decn_gets_covid_test_accepted_by_fda/fmlxk7f/,1,[deleted],2020-04-06
338,redcloud722,fmlxkri,/r/pennystocks/comments/fw19em/akers/fmlxkri/,1,Yeah,2020-04-06
339,oneallinticketplease,fmlyage,/r/pennystocks/comments/fw0h0n/rwt_is_cheap_right_now/fmlyage/,1,Yea im looking at the chart,2020-04-06
340,bigreamingheadache,fmlyjhs,/r/pennystocks/comments/fw2lp6/sgbx/fmlyjhs/,1,Is there any reason why you expect it to rise again?,2020-04-06
341,Kyism,fmlyjkd,/r/pennystocks/comments/fw0cjr/decn_buy_while_its_cheap/fmlyjkd/,1,I think what makes DECN different is they have been in business for 18 years selling diabetic blood testing strips so they have the technology to make a blood strip test for Corona while other people are still making the swab test for corona,2020-04-06
342,bigreamingheadache,fmlylpo,/r/pennystocks/comments/fw2lp6/sgbx/fmlylpo/,1,Just looks like a pump.,2020-04-06
343,conorscottvanek,fmlz127,/r/pennystocks/comments/fw3b5z/ino/fmlz127/,1,"They are about to do trials for a COVID-19 vaccine candidate.

[https://news.robinhood.com/2dbe20bf-cec5-386b-8d38-40747e7befff/](https://news.robinhood.com/2dbe20bf-cec5-386b-8d38-40747e7befff/)",2020-04-06
344,jupiterlouis,fmlzl5z,/r/pennystocks/comments/fw3b5z/ino/fmlzl5z/,1,"Depending on how INO tracks through closing, i was planning on buying INO at the EOD so I could easily sell tomorrow asap if it pumps/dumps. I’m out of day trades so yeah.....

Hoping for a dip at EOD",2020-04-06
345,bigpapi836,fmlztu6,/r/pennystocks/comments/fw1ou9/is_another_crash_coming/fmlztu6/,1,"I don't like it. Gives me a final destination type of feeling. Before COVID-19 the market was not all green and up 20%, I would feel better if the range was between 2-7%",2020-04-06
346,trentslade111,fmlzvqm,/r/pennystocks/comments/fw3i0u/decn_or_antibe/fmlzvqm/,2,The decn fda approval should be imminent given the situation the world is in now,2020-04-06
347,mycamelspider,fmlzweo,/r/pennystocks/comments/fw0cgs/decn_gets_covid_test_accepted_by_fda/fmlzweo/,1,"Ah, yes. A misread by me.",2020-04-06
348,mycamelspider,fmm04cv,/r/pennystocks/comments/fw0cgs/decn_gets_covid_test_accepted_by_fda/fmm04cv/,1,"Yes, my mistake. But still great news. I'm trying to see if I can edit/delete my post. Still new here..",2020-04-06
349,Crackitup302,fmm06qi,/r/pennystocks/comments/fvz2xt/aytu/fmm06qi/,1,"Y’all know that it is being manipulated right? EVENTUALLY WE WILL SKY ROCKET.... Sabby is keeping it at these levels to accumulate as much as they can for cheap and once they collect all the shares they want they let it fly, sell half their shares and short the rest of the shares. Eventually this will fly but I’ll be selling when it does.. target for me is minimum $4. If you want to see how Sabby does it watch this video... Sabby will make money on the upside when he lets this rip and when he makes it bleed he will control the bleed and short it making money on the downside.",2020-04-06
350,conorscottvanek,fmm08yd,/r/pennystocks/comments/fw3i0u/decn_or_antibe/fmm08yd/,2,My biggest concern with DECN is that an inexpensive test that works within 15-30 seconds sounds too good to be true and isn't guaranteed to be approved. I'm still going to buy though. The potential reward outweighs the risk in my opinion. I'd love to see anything pertaining to the test's legitimacy if anyone has anything because all I know about it is it's been subimtted to the FDA for approval.,2020-04-06
351,jacobbodd,fmm0do9,/r/pennystocks/comments/fvxtar/how_to_use_volume_and_candlestick_pattern_to_spot/fmm0do9/,1,Speak for yourself sir. There's dumb people on every subreddit so.,2020-04-06
352,trentslade111,fmm0g2g,/r/pennystocks/comments/fvz0f9/ibio/fmm0g2g/,1,Yea I’m tryna find a balance in doing DD and not getting on a hype train too late,2020-04-06
353,rexbanner204,fmm0puq,/r/pennystocks/comments/fvvp99/xspa_bring_it_out_boys_here_we_go/fmm0puq/,2,You still in?,2020-04-06
354,jlmo9,fmm10h6,/r/pennystocks/comments/fw3qne/scyx/fmm10h6/,2,Personally I would not buy with the price that high. I would wait until it gets in the .75 range.,2020-04-06
355,jlmo9,fmm17vb,/r/pennystocks/comments/fw3i0u/decn_or_antibe/fmm17vb/,1,Buy selb when it gets around 1.80 then sell when it hits over 2. Made some decent money doing that,2020-04-06
356,scoot87,fmm18jj,/r/pennystocks/comments/fvznuf/decn_good_news/fmm18jj/,0,Corona will be with us for awhile,2020-04-06
357,CautiousParsnip,fmm1aik,/r/pennystocks/comments/fw1thy/thoughts_on_ibio/fmm1aik/,1,missed the ride on this one. IBIO mooned last month,2020-04-06
358,drunkfoowl,fmm1hgl,/r/pennystocks/comments/fw1ou9/is_another_crash_coming/fmm1hgl/,1,No,2020-04-06
359,jlmo9,fmm1hud,/r/pennystocks/comments/fw3sx2/aker/fmm1hud/,2,Is your goal only to break even? Not gonna make a lot of money that way. You could make 90 right now if you sold. So basically if it drops back down to 4.60 you lose 90 bucks,2020-04-06
360,CptCarpelan,fmm1ion,/r/pennystocks/comments/fw1gf2/the_next_potential_pop_stock_trnx/fmm1ion/,1,When are you intending on selling?,2020-04-06
