,author,id,url,score,text,date
0,[deleted],en6eth6,/r/pennystocks/comments/bnjoyx/bfnh_looks_good/en6eth6/,1,[removed],2019-05-12
1,tarkshank123,en6jcqi,/r/pennystocks/comments/bnjoyx/bfnh_looks_good/en6jcqi/,1,it’s saturday bro,2019-05-12
2,SensibleCreeper,en7ju2i,/r/pennystocks/comments/bnjoyx/bfnh_looks_good/en7ju2i/,1,"This just shouts how retarded this sub is. u/7inchheelz provides a shitty shout out without direction on why it might be good, no dd. Then you, u/tarkshank, come check out pennystocks on a saturday to tell u/7inchheelz that its Saturday.

This sub defines hypocrites. I guarantee 99% of the people who upvoted this nonsense wont be here in 3-6 months!",2019-05-12
3,Jpaperz,en7rmz2,/r/pennystocks/comments/bnjoyx/bfnh_looks_good/en7rmz2/,1,I 2nd the negative comment,2019-05-12
4,catchingtherosemary,en81s92,/r/pennystocks/comments/bnprii/leas_monday/en81s92/,1,I agree this is primed and ready to have hell of a run.  It's crazy that people can still get in at these prices.,2019-05-12
5,Silvered_Caparison,en81xrb,/r/pennystocks/comments/bnprii/leas_monday/en81xrb/,0,There were some hiccups in the paperwork and a lot of people bashing the stock so it kind of went back under the radar. It’s ready to run now though!,2019-05-12
6,gcbalarezo,en86u58,/r/pennystocks/comments/bnprii/leas_monday/en86u58/,1,Leas is ready to run beautifully.,2019-05-12
7,caffeinefreedom,en89v43,/r/pennystocks/comments/bnprii/leas_monday/en89v43/,1,Top three scam stock of the year,2019-05-12
8,SensibleCreeper,en8afwa,/r/pennystocks/comments/bnq82x/vshc_your_thoughts/en8afwa/,1,"So far they bought out a wellhead producer and are trying to push ball valve use. Ball valves are against many codes due to hammering of the fluids. Gate valves are used on all wellheads, but wellhead producers are a dime a dozen. Everything on paper looks too good to be true which makes me believe this could be a scam. Like a Russian oligarch is looking to launder his money, RMs with a ticker and buys failing companies to clean it.

My outlook his hugely speculative, but this shit happens all the time in pennystocks. I would need to see more on the companies they are buying out to see if they are legit or not.",2019-05-12
9,AmbiguousS,en8b0kq,/r/pennystocks/comments/bnprii/leas_monday/en8b0kq/,1,"agreed,hope this takes off;.",2019-05-12
10,Silvered_Caparison,en8cyzm,/r/pennystocks/comments/bnprii/leas_monday/en8cyzm/,1,Proof?,2019-05-12
11,amphetaminesfailure,en8czzk,/r/pennystocks/comments/bnprii/leas_monday/en8czzk/,1,Agree it's a scam but I made like 5 grand the last time it ran.  Wish I had grabbed a couple million last week at .0015 because I won't be surprised if it gets near a penny again.,2019-05-12
12,7inchheelz,en8ennp,/r/pennystocks/comments/bnjoyx/bfnh_looks_good/en8ennp/,1,I said it looks good it’s not my job to tell people why it looks good figure it out your damn self,2019-05-12
13,ThursdayKid,en8gnac,/r/pennystocks/comments/bnrgpt/appplatform_to_trade_penny_stocks/en8gnac/,1,TD Webbroker TFSA,2019-05-12
14,[deleted],en8gzh0,/r/pennystocks/comments/bnrgpt/appplatform_to_trade_penny_stocks/en8gzh0/,1,[removed],2019-05-12
15,born2rock4life,en8hab0,/r/pennystocks/comments/bnrgpt/appplatform_to_trade_penny_stocks/en8hab0/,1,TD is good. I prefer the thinkorswim platform of their in-house app,2019-05-12
16,Lmomoa,en8hg74,/r/pennystocks/comments/bnrgpt/appplatform_to_trade_penny_stocks/en8hg74/,1,What about one in Europe to trade US penny stocks that is not IB?,2019-05-12
17,NG06,en8hwjg,/r/pennystocks/comments/bnprii/leas_monday/en8hwjg/,1,What does this company do? And why is tomorrow supposed to go up?,2019-05-12
18,atallerballer,en8lv2r,/r/pennystocks/comments/bnprii/leas_monday/en8lv2r/,1,Gap and trap coming IMO.,2019-05-12
19,aCerealMurderer,en8ogkh,/r/pennystocks/comments/bnq82x/vshc_your_thoughts/en8ogkh/,1,I've had them for a month now and it's been great but am just starting out. It is concerning though to consider something scummy going on here as it has been so consistent for me,2019-05-12
20,gcbalarezo,en8ol4g,/r/pennystocks/comments/bnprii/leas_monday/en8ol4g/,1,You don’t have a valid reason to say that.,2019-05-12
21,catchingtherosemary,en8onzd,/r/pennystocks/comments/bnprii/leas_monday/en8onzd/,1,"It's crazy how many people still think this ticker is a ""scam"" without anything concrete to back up why this is a ""scam""... all the while IR has been completely open with investors and there is been 0 dilution.  That does not sound like scam to me.",2019-05-12
22,amphetaminesfailure,en8yqdt,/r/pennystocks/comments/bnprii/leas_monday/en8yqdt/,1," Former LEAS owner is in jail for fraud.  

Current owner is a strip club bouncer from New Jersey with no prior experience who somehow found a company with 50 million in assets that wants to RM into a shell with a bad reputation.  They're on their third attorney, with the second having a ban from working on the OTC.  

They've been trying to go current since February but keep getting the paperwork wrong.  

The company is still halted from trading in Canada.  

And apparently this company worth 50 million has just been sitting on their ass for a few months now while the shell continues to make mistake after mistake rather than pulling out and finding another to do a RM.  


It's not ""bashing"" to do DD, and post negative information when negative information is found.  

Again, I made money on it last time, and I wish I had gotten back in in the 1's last week.  I'm sure it will run close to or actually hit a penny this time.  

But it's a pump and dump.",2019-05-12
23,JonMQuiles,en9264g,/r/pennystocks/comments/bnprii/leas_monday/en9264g/,1,Yup,2019-05-12
24,Transparent_Traders,en95sjh,/r/pennystocks/comments/bnprii/leas_monday/en95sjh/,1,"Out of all the penny stock trading I've done, biggest bust I've had in the last 12 months is PDXP.",2019-05-12
25,Transparent_Traders,en965i8,/r/pennystocks/comments/bnrgpt/appplatform_to_trade_penny_stocks/en965i8/,1,You could always try suretrader or mintbroker.,2019-05-12
26,scarface910,en98bux,/r/pennystocks/comments/bnprii/leas_monday/en98bux/,1,Hahahahahahahahahhaahhaa,2019-05-12
27,scarface910,en98dqo,/r/pennystocks/comments/bnprii/leas_monday/en98dqo/,1,No answers. I think that says a lot about what the company does.,2019-05-12
28,Explosiveshitter44,en9epnx,/r/pennystocks/comments/bnprii/leas_monday/en9epnx/,1,"They managed to pump this company in a way that seems like they aren't pumping. But if you look closely the pump is there. I was fooled, as we're many others. The insiders are trying to cash out one more time without doing anything technically illegal.",2019-05-12
29,therealml,en9sxy1,/r/pennystocks/comments/bnprii/leas_monday/en9sxy1/,1,$BBDA is next get in while it’s cheap!,2019-05-12
30,Silvered_Caparison,ena1zfq,/r/pennystocks/comments/bnprii/leas_monday/ena1zfq/,1,"NO NON NO NO. TAKE YOURSELF BACK TO iHUB AND CRY YOUR TEARS INTO JANICE’S BOSOM. 

BASHER",2019-05-12
31,Silvered_Caparison,ena22d7,/r/pennystocks/comments/bnprii/leas_monday/ena22d7/,1, Nope. Gaps and gap.,2019-05-12
32,Silvered_Caparison,ena27b3,/r/pennystocks/comments/bnprii/leas_monday/ena27b3/,1,They own a squeaky clean shell. Need more info?,2019-05-12
33,Silvered_Caparison,ena2hln,/r/pennystocks/comments/bnprii/leas_monday/ena2hln/,1,"Bruh? IT IS A CLEAN SHELL...no debt, confirmed share structure ZERO dilution. THIS IS A SQUEAKY CLEAN LEGAL FRAME WORK!!!!!!!!!!!!

Maybe you should stick weed stocks.",2019-05-12
34,Silvered_Caparison,ena2l53,/r/pennystocks/comments/bnprii/leas_monday/ena2l53/,1,Holding 3.5 M. I’m am ready💰💰💰,2019-05-12
35,Silvered_Caparison,ena2y1n,/r/pennystocks/comments/bnprii/leas_monday/ena2y1n/,1,"No scam, just a CLEAN SHELL with unlimited potential.",2019-05-12
36,therealml,ena50uc,/r/pennystocks/comments/bnprii/leas_monday/ena50uc/,1,I’m currently holding 21 Million let’s make some money ; ),2019-05-12
37,atallerballer,ena6q0w,/r/pennystocks/comments/bnprii/leas_monday/ena6q0w/,1,"No news is out. No 8-k. You say 8-k is coming, but if it was anything good, you wouldn’t be telling us before it comes. 

You just think gap up for no reason? Fine. Then GUARANTEED GAP AND TRAP.",2019-05-12
38,Mace109,ena8p2p,/r/pennystocks/comments/bnprii/leas_monday/ena8p2p/,1,Yes. Yes we do.,2019-05-12
39,catchingtherosemary,enagw90,/r/pennystocks/comments/bnprii/leas_monday/enagw90/,1,people reallllly love to hate on LEAS,2019-05-12
40,Cryonyx,enah3hh,/r/pennystocks/comments/bnprii/leas_monday/enah3hh/,1,Lol. Calling people bashers is a major red flag to anyone trying to take pennies seriously,2019-05-12
41,catchingtherosemary,enah91n,/r/pennystocks/comments/bnprii/leas_monday/enah91n/,1,oh yeah because bashers don't exist and they don't affect price action yeah yeah,2019-05-12
42,Dickerson1120,enahqgc,/r/pennystocks/comments/bnprii/leas_monday/enahqgc/,1,https://twitter.com/kd11201/status/1127710171361349632?s=12,2019-05-12
43,Dickerson1120,enak4yn,/r/pennystocks/comments/bnprii/leas_monday/enak4yn/,1,https://twitter.com/kd11201/status/1127710171361349632?s=12,2019-05-12
44,amphetaminesfailure,enaxka4,/r/pennystocks/comments/bnprii/leas_monday/enaxka4/,1,Can you refute any of my points?,2019-05-12
45,Silvered_Caparison,enb4ce9,/r/pennystocks/comments/bnprii/leas_monday/enb4ce9/,1,Yes,2019-05-12
46,Silvered_Caparison,enb4ubd,/r/pennystocks/comments/bnprii/leas_monday/enb4ubd/,1,It’s funny how you’re quoting the exact same talking points that have been used on I had to try to discredit the stock. It’s obvious you have an agenda.,2019-05-12
47,amphetaminesfailure,enb5whl,/r/pennystocks/comments/bnprii/leas_monday/enb5whl/,1,"Nope.  Why are so many people who trade OTC so paranoid?  I hear that same thing on ihub.  

I have zero agenda.  I simply know a lot about LEAS because I had a decent size position back in February/March.  Like I already said, made good money on it.  

Im posting now for no other reason than the fact I saw this post.",2019-05-12
48,PPCCNNSS,enbfwdg,/r/pennystocks/comments/bnprii/leas_monday/enbfwdg/,1,There will be a R/R happening today. The folks that bought shares on Friday are prying on others advertising gaps and such....,2019-05-12
49,amphetaminesfailure,enbohb7,/r/pennystocks/comments/bnprii/leas_monday/enbohb7/,1,"You know what's funny?  The only people I see calling out ""bashers"" all make posts identical to each other.  Is there a course for pumping stocks that they all take?  They're so similar it's almost as if the same person has a 1000 different accounts.  

Same words and phrases, if on twitter same emojis/gifs (always cute ones, it's like they're trying to hard to make people think they're super friendly and nice people so you feel bad for calling them on their bullshit).",2019-05-12
50,markiemark621,enbygv0,/r/pennystocks/comments/bnrgpt/appplatform_to_trade_penny_stocks/enbygv0/,1,Td think or swim,2019-05-12
51,Silvered_Caparison,encvkfv,/r/pennystocks/comments/bnprii/leas_monday/encvkfv/,0,"Sure I would,I want you to make money. That’s how we make money in the stock market.",2019-05-12
52,caffeinefreedom,encwlst,/r/pennystocks/comments/bnprii/leas_monday/encwlst/,1,So how's that going today?,2019-05-12
53,Silvered_Caparison,encx5su,/r/pennystocks/comments/bnprii/leas_monday/encx5su/,1,Lol down. 8K coming 😎,2019-05-12
54,atallerballer,encytl9,/r/pennystocks/comments/bnprii/leas_monday/encytl9/,0,"But if I listened to you, I’d be losing already. It’s down 30% today already.",2019-05-12
55,Silvered_Caparison,end3y4u,/r/pennystocks/comments/bnprii/leas_monday/end3y4u/,1,It’s not a loss until you sell.,2019-05-12
56,Silvered_Caparison,ene6vb9,/r/pennystocks/comments/bnprii/leas_monday/ene6vb9/,0,Heard that same thing on ihub almost Word for Word.,2019-05-12
57,atallerballer,enfizms,/r/pennystocks/comments/bnprii/leas_monday/enfizms/,1,That’s false. LEAS is a loss immediately after you buy.,2019-05-12
58,amphetaminesfailure,enh111l,/r/pennystocks/comments/bnprii/leas_monday/enh111l/,1,How's LEAS doing this week buddy?,2019-05-12
59,Silvered_Caparison,enh60ad,/r/pennystocks/comments/bnprii/leas_monday/enh60ad/,1,It’s time to rip the dip my friend! Don’t miss out.,2019-05-12
60,AlarmedTeaching,ewcpf2i,/r/pennystocks/comments/bnrgpt/appplatform_to_trade_penny_stocks/ewcpf2i/,1,"There are many platforms to trade penny stocks, i was also searching about the method that how can i make money by trading penny stocks so i got a podcast about method of trading with penny stocks so i think it can help you to make a decision. You can get idea by this. 

 [https://shows.pippa.io/inpennystock/episodes/5d43b0a899dfe41447a3ffff](https://shows.pippa.io/inpennystock/episodes/5d43b0a899dfe41447a3ffff)",2019-05-12
61,Silvered_Caparison,ewmeala,/r/pennystocks/comments/bnprii/leas_monday/ewmeala/,1,Fuck...I was wrong LEAS IS A SCAM,2019-05-12
