,author,id,url,score,text,date
123,MarcellusBoom,dwc9vxy,/r/pennystocks/comments/879672/reverse_merger_plays/dwc9vxy/,1,It can be. ,2018-03-26
124,jonah3272,dwcbqjh,/r/pennystocks/comments/8795oa/fusz_anyone_spiked_to_194_this_morning_was_under/dwcbqjh/,1,I check your posts and comments daily haha. How do you keep picking winners,2018-03-26
125,Nezbotz,dwcbyvp,/r/pennystocks/comments/8795oa/fusz_anyone_spiked_to_194_this_morning_was_under/dwcbyvp/,1,"Looks like a bubble chart to me, but I might try to catch the bottom of the bull trap. ",2018-03-26
126,khaldrogospg,dwcdh1e,/r/pennystocks/comments/87agwt/gern_true_potential/dwcdh1e/,1,Hey boiz check out $ljpc. Will be a winner,2018-03-26
127,Sneakeraddict525,dwce1lj,/r/pennystocks/comments/876okk/aker/dwce1lj/,1,yet again everyone was in on Bpmx last week and now everyone is into Aker again,2018-03-26
128,p3nnst8r,dwcej21,/r/pennystocks/comments/87agwt/gern_true_potential/dwcej21/,1,I'm in for 4 calls 7APR20 calls @ .6 tomorrow.,2018-03-26
129,not_a_cup,dwcemh7,/r/pennystocks/comments/87agwt/gern_true_potential/dwcemh7/,1,"Most of your research isn't research, but just looking at the Robinhood chart and info. Actual DD: review products, what phases are they in, which are profitable, do they have competitors, what's their (and comps) revenue, what stages are they in (not even being in phase II isn't a great sign), cancer drugs take FOREVER, what's the management team? How's their presentations, do they have an investors section on their site, etc. ",2018-03-26
130,shemanneryes,dwcfhdo,/r/pennystocks/comments/878g8b/bpmx/dwcfhdo/,1,It was canceled due to weather,2018-03-26
131,baker_esq27,dwcfxsu,/r/pennystocks/comments/8795oa/fusz_anyone_spiked_to_194_this_morning_was_under/dwcfxsu/,1,"My very rudimentary understanding is they have a special type of software that allows advertisers to interrupt an advertisement with the option to purchase in the middle of the ad, or something of that nature. That was one of the first things I read about them about two months ago. I don’t know much more, and I don’t know if that’s entirely accurate.",2018-03-26
132,ritedamian,dwcfyg3,/r/pennystocks/comments/87agwt/gern_true_potential/dwcfyg3/,1,By research I meant a collaboration of data I collected from various news articles. Just wanted to sum up a chunck of the hype for people:),2018-03-26
133,ECHO-Respect,dwcggjr,/r/pennystocks/comments/87agwt/gern_true_potential/dwcggjr/,1,Don't be a dick. Just because OP didn't list info you felt they should have doesn't mean they didn't do their homework.,2018-03-26
134,dirtywiggle,dwciile,/r/pennystocks/comments/87cvuk/sfor_classic_double_top/dwciile/,1,Unless it breaks 0.0175 I am not touching it,2018-03-26
135,leadrain86,dwcixzb,/r/pennystocks/comments/87agwt/gern_true_potential/dwcixzb/,1,"Has nothing on the market yet though, so be careful. Has only two drugs both on phase two clinical trials. That’s it. So you’re one bad PR from dumping everything basically. 

They do have a good balance sheet, with cash on hand to fund them, and no debt. So that’s very good. 

I might add some tomorrow under 6$, and play the trendline. ",2018-03-26
136,not_a_cup,dwcli9m,/r/pennystocks/comments/87agwt/gern_true_potential/dwcli9m/,1,"I was trying to be constructive giving an idea of what he she really be looking at before making decisions. Didn't mean to come off as a dick, I'm on mobile. I am an asshole, but this comment wasn't meant to be dickish. ",2018-03-26
137,not_a_cup,dwclmc5,/r/pennystocks/comments/87agwt/gern_true_potential/dwclmc5/,1,"Definitely correct, I just wanted to point out other materials you should review before making a big decision to jump in. Gern has been doing great, but so has about every stock at one point. Don't get hyped into losing money, public companies have every detail about them available, make sure to look at everything",2018-03-26
138,ECHO-Respect,dwclrqk,/r/pennystocks/comments/87ay7n/aker/dwclrqk/,1,So then they've had tons of good news this week?,2018-03-26
139,HGTV-Addict,dwcnin3,/r/pennystocks/comments/87agwt/gern_true_potential/dwcnin3/,1,"I'm in it since $2. Kicking myself i was not in for more than I am. 
It has a lot of potential and a short timeframe to be a zero or Hero. Reminds me a lot of Dendreon in its hayday, however differs in that it is already showing positive results and significant extension of life in the trials, far beyond any other treatment. 

",2018-03-26
140,houseflip,dwczdo7,/r/pennystocks/comments/87ahgn/at_the_suggestion_of_ppl_here_i_bought_into_rhhnf/dwczdo7/,1,prob wont't touch this exact one...they usually creep slowly up the chart for days/couple weeks then randomly nosedive. i am confident this will happen to rhhbf. its just a matter of will it hit .80 $1 or $1.50 before it does decide to break down. simply watch the blatantly stairstepped chart hehe,2018-03-26
141,quazaat,dwd01x9,/r/pennystocks/comments/87agwt/gern_true_potential/dwd01x9/,1,I didn’t take it as dickish at all. I’m a noob to this. Right now I only have a few bucks in and I’m pretty much being a lemming. But we all learn as we go. ,2018-03-26
142,baker_esq27,dwd2c4a,/r/pennystocks/comments/879evq/ill_make_you_even_more_money_this_week_celz/dwd2c4a/,1, Wish I saw this yesterday AM lol. ,2018-03-26
143,Rugius,dwd2ye3,/r/pennystocks/comments/879evq/ill_make_you_even_more_money_this_week_celz/dwd2ye3/,1,"Cock Stocks are on fire.  (urology)

Don't sleep on AYTU if you get a pullback to a decent resistance",2018-03-26
144,er111a,dwd30rm,/r/pennystocks/comments/87a089/my_next_pick_is_rsii/dwd30rm/,1,Yes,2018-03-26
145,baker_esq27,dwd37ag,/r/pennystocks/comments/879evq/ill_make_you_even_more_money_this_week_celz/dwd37ag/,1,Can you please elaborate on “pullback to a decent resistance?”,2018-03-26
146,Rugius,dwd3il0,/r/pennystocks/comments/879evq/ill_make_you_even_more_money_this_week_celz/dwd3il0/,1,"Ya, look at a fucking chart.",2018-03-26
147,baker_esq27,dwd3tgz,/r/pennystocks/comments/879evq/ill_make_you_even_more_money_this_week_celz/dwd3tgz/,1,:),2018-03-26
148,Sfogliatella,dwd4jgi,/r/pennystocks/comments/879evq/ill_make_you_even_more_money_this_week_celz/dwd4jgi/,1,How high can it fly,2018-03-26
149,Rugius,dwd506r,/r/pennystocks/comments/879evq/ill_make_you_even_more_money_this_week_celz/dwd506r/,1,"There is no such thing as a bad profit.  

Who knows if it goes to .2 or .10 or .50.  

Just get out whenever you want because most are up 300% already which isnt a bad thing.",2018-03-26
150,CaptainWeee,dwdf84r,/r/pennystocks/comments/87a4fv/frfs_pump/dwdf84r/,1,"Yup. Easy flip, if the DD is actually true, this company will be looking to turn this ticker into a share selling scheme or possibly do what $DOLV did and pull a massive 1:100 Split after the R/M then sell it into oblivion.",2018-03-26
151,driv818,dwdhjm3,/r/pennystocks/comments/87ay7n/aker/dwdhjm3/,1,I can see this going to $1 ,2018-03-26
152,trollaweigh,dwdn4fm,/r/pennystocks/comments/875pgh/looking_for_a_vr_sex_penny_stock/dwdn4fm/,1,"/u/palsforever was setting up an indecent exposure type of, uh, release",2018-03-26
153,sabbathhb,dwdob4t,/r/pennystocks/comments/879evq/ill_make_you_even_more_money_this_week_celz/dwdob4t/,1,Stopping by to say thank you for the heads up. Much appreciated. ,2018-03-26
154,ICGunderson,dwepy6k,/r/pennystocks/comments/87ay7n/aker/dwepy6k/,1,"https://www.bizjournals.com/philadelphia/news/2018/03/26/akers-bio-signs-3-year-distribution-deal-with.html
After ER I don't care how it swings I will be hanging on to this one ",2018-03-26
155,Mefreh,dwf5u1v,/r/pennystocks/comments/87agwt/gern_true_potential/dwf5u1v/,1,"This post did not age well.

Wish I had sold yesterday. Dumped at a loss, might jump back in though!",2018-03-26
156,ritedamian,dwf9jne,/r/pennystocks/comments/87agwt/gern_true_potential/dwf9jne/,1,"I took a tumble but there is one tip I can give that never fail but I dont follow. Buy only on the dip, there is ALWAYS a dip.",2018-03-26
157,Dat_Doe,dwffxcw,/r/pennystocks/comments/875pgh/looking_for_a_vr_sex_penny_stock/dwffxcw/,1,IP - Imagination Park Entertainment ,2018-03-26
158,dfa24,dwgeojv,/r/pennystocks/comments/875pgh/looking_for_a_vr_sex_penny_stock/dwgeojv/,1,Boom,2018-03-26
159,bighdaddie,dwhtav4,/r/pennystocks/comments/879672/reverse_merger_plays/dwhtav4/,1,"It was great in the 90's. It doesn't work anymore, with rare exception. Who is going to buy your stock when you want to sell?",2018-03-26
160,mitchydeathbro,dwijj3j,/r/pennystocks/comments/87a8p9/nvcn_intends_to_monitor_the_market_value_between/dwijj3j/,1,What happened?! Woof. ,2018-03-26
161,mitchydeathbro,dwijmrz,/r/pennystocks/comments/87a8p9/nvcn_intends_to_monitor_the_market_value_between/dwijmrz/,1,"I got in last week at .101. Something told me to sell when it hit .12 Tuesday, but I hung on. Do you think it’ll drop even lower than it’s current .06?",2018-03-26
162,suitology,dwio58h,/r/pennystocks/comments/87a8p9/nvcn_intends_to_monitor_the_market_value_between/dwio58h/,1,"doubled down during the sale, got just under 6000 now",2018-03-26
163,suitology,dwio6nv,/r/pennystocks/comments/87a8p9/nvcn_intends_to_monitor_the_market_value_between/dwio6nv/,1,There is a lot of panic selling. I bought an extra 3000 shares at .06,2018-03-26
164,soupwillkillu,dwqow4z,/r/pennystocks/comments/87a8p9/nvcn_intends_to_monitor_the_market_value_between/dwqow4z/,1,How bout now? .039,2018-03-26
165,suitology,dwqs4yv,/r/pennystocks/comments/87a8p9/nvcn_intends_to_monitor_the_market_value_between/dwqs4yv/,1,Still holding,2018-03-26
166,mitchydeathbro,dwrr3ck,/r/pennystocks/comments/87a8p9/nvcn_intends_to_monitor_the_market_value_between/dwrr3ck/,1,You gonna buy even more now?,2018-03-26
167,suitology,dwrrloc,/r/pennystocks/comments/87a8p9/nvcn_intends_to_monitor_the_market_value_between/dwrrloc/,1,"If, God forbid, it drops to 1 cent. I'm still expecting a sizeable bump from two separate presentations this summer. ",2018-03-26
168,[deleted],dwvzlps,/r/pennystocks/comments/87a089/my_next_pick_is_rsii/dwvzlps/,1,[removed],2018-03-26
