,title,id,author,url,score,num_comments,text,date,link
0,Avita medical anyone?,99blxt,chacharealsmooth97,https://www.reddit.com/r/pennystocks/comments/99blxt/avita_medical_anyone/,9,9,"Just wondering on a few people’s thoughts on the stock as I’m new to pennystocks but have a v small position. With fda approval expected in Q3 2018, how high does a stock like this go sometimes? I know no one can tell how etc but if anyone could help with when to get out and not hold onto it?

Thanks any help appreciated ",2018-08-22,https://www.reddit.com/r/pennystocks/comments/99blxt/avita_medical_anyone/
1,Biotech Stocks To Watch,99dq7y,driv818,https://www.reddit.com/r/pennystocks/comments/99dq7y/biotech_stocks_to_watch/,1,2,"What do we think is gonna happen with GERN &amp; JNJ, yay or nay?

Does anyone know major pharma company supplying GTBP for the MTA?

Why would GILD sell candidate a phase 3 canidate to SRRA?

&amp;#x200B;

[https://smallcapreporter.whotrades.com/blog/43346532142](https://smallcapreporter.whotrades.com/blog/43346532142)",2018-08-22,https://www.reddit.com/r/pennystocks/comments/99dq7y/biotech_stocks_to_watch/
2,Have You Ever Seen A Penny Stock Go to Zero?,998j5x,RobertTanguay,https://www.reddit.com/r/pennystocks/comments/998j5x/have_you_ever_seen_a_penny_stock_go_to_zero/,1,0,[removed],2018-08-22,https://www.reddit.com/r/pennystocks/comments/998j5x/have_you_ever_seen_a_penny_stock_go_to_zero/
3,Anybody long any weed stocks overnight?,99h46c,Money_trip,https://www.reddit.com/r/pennystocks/comments/99h46c/anybody_long_any_weed_stocks_overnight/,1,0,[removed],2018-08-22,https://www.reddit.com/r/pennystocks/comments/99h46c/anybody_long_any_weed_stocks_overnight/
4,Pavm?,99gxpa,thenewricosuave,https://www.reddit.com/r/pennystocks/comments/99gxpa/pavm/,2,0,Oh man -9% after hours,2018-08-22,https://www.reddit.com/r/pennystocks/comments/99gxpa/pavm/
5,"$INND Just released 10-q ""$450,000 Cash Settlement Agreement""",99i4au,Brodmann,https://www.reddit.com/r/pennystocks/comments/99i4au/innd_just_released_10q_450000_cash_settlement/,5,4,"&amp;#x200B;

[http://archive.fast-edgar.com//20180822/AIA8U22CZ222T2Z2222M2MZPH93LZQ2272A2/](http://archive.fast-edgar.com//20180822/AIA8U22CZ222T2Z2222M2MZPH93LZQ2272A2/)",2018-08-22,https://www.reddit.com/r/pennystocks/comments/99i4au/innd_just_released_10q_450000_cash_settlement/
6,How to Slap a Stock - Beating Share Prices Down for Fun and Profit,99eiuc,RobertTanguay,https://www.reddit.com/r/pennystocks/comments/99eiuc/how_to_slap_a_stock_beating_share_prices_down_for/,1,0,[removed],2018-08-22,https://www.reddit.com/r/pennystocks/comments/99eiuc/how_to_slap_a_stock_beating_share_prices_down_for/
7,$BDCI loading nicely 3 days in a row. Gonna explode!,99e2vb,kaoticorder,https://www.reddit.com/r/pennystocks/comments/99e2vb/bdci_loading_nicely_3_days_in_a_row_gonna_explode/,17,17,I'm cool with these 10-20% daily gains though,2018-08-22,https://www.reddit.com/r/pennystocks/comments/99e2vb/bdci_loading_nicely_3_days_in_a_row_gonna_explode/
8,canb the next cvsi?,99g764,Fiddli,https://www.reddit.com/r/pennystocks/comments/99g764/canb_the_next_cvsi/,20,37,50%+ today,2018-08-22,https://www.reddit.com/r/pennystocks/comments/99g764/canb_the_next_cvsi/
