,title,id,author,url,score,num_comments,text,date,link
0,level 1 investor!,er75bd,N0tmyPr0nAcc0unt,https://www.reddit.com/r/pennystocks/comments/er75bd/level_1_investor/,1,30,i’ve got 130$ what should i buy? lmaoo most upvotes on a comment and ill buy as much as i can!,2020-01-20,https://www.reddit.com/r/pennystocks/comments/er75bd/level_1_investor/
1,Thoughts on LITH ? topped out or gonna keep going?,erdd0j,lepaidtrader,https://www.reddit.com/r/pennystocks/comments/erdd0j/thoughts_on_lith_topped_out_or_gonna_keep_going/,1,0,,2020-01-20,https://www.reddit.com/r/pennystocks/comments/erdd0j/thoughts_on_lith_topped_out_or_gonna_keep_going/
2,Top 15 Most Profitable Commodities by Investment Return (1990-2019),ercx5z,refuwu,https://www.reddit.com/r/pennystocks/comments/ercx5z/top_15_most_profitable_commodities_by_investment/,1,2,"[https://www.youtube.com/watch?v=5cyl32bQzoA](https://www.youtube.com/watch?v=5cyl32bQzoA)

This video shows the top 15 most profitable commodities from 1990 to 2019 based on annual investment return (%).

All  commodities ranked: Aluminum, Apple, Bananas, Barley, Beef, Chana,  Coal, Cobalt, Cocoa Beans, Coffee, Copper, Cotton, Fertilizer, Fish  meal, Gold, Groundnuts, Hides, Iron Ore, Lamb, Lead, Maize, Milk,  Molybdenum, Natural Gas, Nickel, Oats, Olive oil, Orange Juice,  Palladium, Palm oil, Platinum, Poultry, Propane, Rapeseed oil, Rice,  Rubber, Salmon, Shrimp, Silver, Sorghum, Soybean meal, Soybean oil,  Soybeans, Spot Crude, Sugar, Sunflower Oil, Swine Meat, Tea, Timber,  Tin, Tomato, Uranium, Wheat, Wool, Zinc",2020-01-20,https://www.reddit.com/r/pennystocks/comments/ercx5z/top_15_most_profitable_commodities_by_investment/
3,MSTO subpenny play of the week. DD inside,erelqg,miamidd12,https://www.reddit.com/r/pennystocks/comments/erelqg/msto_subpenny_play_of_the_week_dd_inside/,1,7,"MSTO is currently trading at $0.007 with a small float of 5M shares.

Company is doing real estate acquisitions and tangible assets. 

Level 2 is thin and based on the float can hit $0.03 - $0.05 with little volume.

Potential news coming soon and the company to become active in 2020

Big bounce coming... check the profile on OTC markets MSTO",2020-01-20,https://www.reddit.com/r/pennystocks/comments/erelqg/msto_subpenny_play_of_the_week_dd_inside/
4,Beyond Meat Plans To Enter The Chinese Market,erhldt,SetAStopInWeedstocks,https://www.reddit.com/r/pennystocks/comments/erhldt/beyond_meat_plans_to_enter_the_chinese_market/,1,8, [https://blog.mywallst.com/beyond-meat-plans-to-enter-the-chinese-market/](https://blog.mywallst.com/beyond-meat-plans-to-enter-the-chinese-market/),2020-01-20,https://www.reddit.com/r/pennystocks/comments/erhldt/beyond_meat_plans_to_enter_the_chinese_market/
5,"January 20, 2020 Tomorrow's Daily /r/Pennystocks Discussion - Tuesday plays!",ergy93,AutoModerator,https://www.reddit.com/r/pennystocks/comments/ergy93/january_20_2020_tomorrows_daily_rpennystocks/,1,1,"Please use this thread to discuss your plays of the day!

Since this thread is likely to fill up quickly, consider sorting the comments by ""new"" (instead of ""best"" or ""top"") to see the newest posts.",2020-01-20,https://www.reddit.com/r/pennystocks/comments/ergy93/january_20_2020_tomorrows_daily_rpennystocks/
6,Where can I learn?,erk0tg,almightyyute,https://www.reddit.com/r/pennystocks/comments/erk0tg/where_can_i_learn/,1,15,I constantly look at YouTube videos to learn how to trade. I look at channels such as Warrior Trading. Are there any resources you guys recommend for beginners to learn?,2020-01-20,https://www.reddit.com/r/pennystocks/comments/erk0tg/where_can_i_learn/
7,Question about buyouts,erkqy6,captainmavro,https://www.reddit.com/r/pennystocks/comments/erkqy6/question_about_buyouts/,1,4,"Hey all,

I had a question regarding how a Stock Price is typically affected when there is a buyout or takeover bid.
Let's say a company has a Market Cap of 20 million and trades around 0.05, and 500,000,000 outstanding shares.

No let's say another company bids on the first company for 1 billion dollars. Would the SP typically rise to around $2 a share?

The formula I used was 1 billion divided by 500 million shares equals $2.

Is this a fair guesstimate?",2020-01-20,https://www.reddit.com/r/pennystocks/comments/erkqy6/question_about_buyouts/
8,Good List Of Penny Stocks To Start The Week,erkolw,jameson62,https://www.reddit.com/r/pennystocks/comments/erkolw/good_list_of_penny_stocks_to_start_the_week/,1,11,I like this [list of penny stocks](https://pennystocks.com/featured/2020/01/20/penny-stocks-to-buy-5-companies-to-know-right-now-january-21-2020/) to kick start the week. Mainly FCEL has been a long-time focus of mine. But also glad I came across KIRK and a few others that I haven't really taken a closer look at yet.,2020-01-20,https://www.reddit.com/r/pennystocks/comments/erkolw/good_list_of_penny_stocks_to_start_the_week/
