,author,id,url,score,text,date
124,anarchofundalist,fcy22ie,/r/pennystocks/comments/ejdran/inpx_47_premarket_current_538am/fcy22ie/,1,"Oh that hurts. I bought shares in Apple and google around 2004...not that many but enough that if I had it today, I’d be a happy man. I sold them after my 1st child was born to make ends meet. No regrets there.

However at the same time period my wife told her then boss she should buy some apple and google stock, she bought several thousand shares of both. You’d think she would have been sent a thank you check but nothing.",2020-01-03
125,Jpaperz,fcy25p8,/r/pennystocks/comments/ejdran/inpx_47_premarket_current_538am/fcy25p8/,1,Tsla killjn it,2020-01-03
126,TeamMee,fcy29n3,/r/pennystocks/comments/ejiqab/1k_two_days_in_a_row/fcy29n3/,6,Do you think it's too late to buy into SAVA?,2020-01-03
127,MidWestMind,fcy2ejy,/r/pennystocks/comments/ejiqab/1k_two_days_in_a_row/fcy2ejy/,6,"No, hurry.  Not shares to short right now",2020-01-03
128,KomandoMetz,fcy3bo7,/r/pennystocks/comments/ejgdqz/inpx_hovering_at_55_62_jan32020/fcy3bo7/,2,sabby is in. known for shorting stocks over months. this happened to trnx when they entered it in feb 2019. they left today and stock is at 1 dollar now! sabby is in inpx since yesterday. RUN is my advice!,2020-01-03
129,TeamMee,fcy3if2,/r/pennystocks/comments/ejiqab/1k_two_days_in_a_row/fcy3if2/,2,Thank you.,2020-01-03
130,boyinahouse,fcy4j9i,/r/pennystocks/comments/ejfftf/bio_stocks_affected_by_iran_incident/fcy4j9i/,1,CHK is up 6%. Major oil stock turned into basically a penny stock.,2020-01-03
131,skchan2,fcy4z3o,/r/pennystocks/comments/ejgdqz/inpx_hovering_at_55_62_jan32020/fcy4z3o/,2,sabby?,2020-01-03
132,pyropupper,fcy572c,/r/pennystocks/comments/ejbbac/simple_questions_january_03_2020/fcy572c/,1,Robinhood isn't accessible in Canada,2020-01-03
133,lessthanmoreorless,fcy5psj,/r/pennystocks/comments/ejbbac/simple_questions_january_03_2020/fcy5psj/,1,"Nor in the UK either, been looking at the big apps but they don't seem to cover any penny stocks",2020-01-03
134,MidWestMind,fcy5pxg,/r/pennystocks/comments/ejiqab/1k_two_days_in_a_row/fcy5pxg/,2,did you get i. under 9?,2020-01-03
135,TeamMee,fcy5q0d,/r/pennystocks/comments/ejiqab/1k_two_days_in_a_row/fcy5q0d/,2,Any recommendations for which price I should sell at? I got in around 8.60. Not sure if I should wait till Monday just in case it opens much lower. Do you think it will continue going up Monday?,2020-01-03
136,TeamMee,fcy5w9d,/r/pennystocks/comments/ejiqab/1k_two_days_in_a_row/fcy5w9d/,2,I did!,2020-01-03
137,pyropupper,fcy64as,/r/pennystocks/comments/ejbbac/simple_questions_january_03_2020/fcy64as/,1,I'm going to dip my toes into Questrade,2020-01-03
138,mdawgt,fcy673w,/r/pennystocks/comments/eji6eg/is_anyone_watching_ontx/fcy673w/,1,"In yesterday at 39 and out today at 45. Didn’t want to hold it over the weekend.. No actual research went into this decision, just liked the look of the 1 month chart. Not a penny trader, just had some leftover change in the account.",2020-01-03
139,MidWestMind,fcy69t4,/r/pennystocks/comments/ejiqab/1k_two_days_in_a_row/fcy69t4/,1,insiders have been buying the last week.    It’ll be over 10 and put stop loss at 9 something.  sit and wait,2020-01-03
140,TeamMee,fcy6f6r,/r/pennystocks/comments/ejiqab/1k_two_days_in_a_row/fcy6f6r/,1,"Awesome,  thanks! I only bought what I could afford but I have watched Sava go from $3 to $9. Congrats on the 1k!",2020-01-03
141,MidWestMind,fcy6ref,/r/pennystocks/comments/ejiqab/1k_two_days_in_a_row/fcy6ref/,4,my commission is reddit gold.  lol.  jk.    Hope we both make more $$$,2020-01-03
142,KomandoMetz,fcy6vjo,/r/pennystocks/comments/ejgdqz/inpx_hovering_at_55_62_jan32020/fcy6vjo/,2,A fund known for shorting stocks for months. Google them!,2020-01-03
143,sedunrorrimemdnes,fcy7am1,/r/pennystocks/comments/ejj983/ontx/fcy7am1/,1,When do you think? And by how much?,2020-01-03
144,32653abC,fcy826s,/r/pennystocks/comments/ejj983/ontx/fcy826s/,2,Probably 4 or 5 cents in the next hour.,2020-01-03
145,niceperson33,fcy8vuy,/r/pennystocks/comments/ejj983/ontx/fcy8vuy/,3,It’s moving!,2020-01-03
146,[deleted],fcyaqjz,/r/pennystocks/comments/ejiqab/1k_two_days_in_a_row/fcyaqjz/,1,[removed],2020-01-03
147,anarchofundalist,fcybhun,/r/pennystocks/comments/ejjpic/kmph/fcybhun/,3,"Normally I wouldn’t cut and paste like this, but a poster named “Don” on yahoo finance posted the following...it’s persuasive...

“KemPharm has an extended runway into 2021. Here are 10 important points to consider.
1. They have cut their expenses to $1 million a quarter. With no new milestones they have more than enough cash into 2Q 2021 IMO.
2. Yes they have some $70 million in debt but with KVK they have $53 million in milestones and with  GPC another $483 million in milestones. With $536 million in milestones that debt could disappear very quickly!
3. GPC can file the  KP415 NDA any day now.
4. Apadaz sales started last November. KemPharm gets 30-50% of net profits.
5. GPC could file a KP484 IND at any time.
6. GPC also have options on KP879(SUD) and KP922 (amphetamine prodrug).
7. Deerfield have options on two prodrugs.
8. There are several more undisclosed partnerships which could enter the clinic this year.
9. Tax loss selling drove the share price down to the current silly levels. Once the share price is over $1 it should move up quickly.
10. KVK or GPC could easily take a partnership interest, or buyout the company...as could Takeda or other future competitors.”",2020-01-03
148,[deleted],fcyc6o7,/r/pennystocks/comments/ejiqab/1k_two_days_in_a_row/fcyc6o7/,1,[removed],2020-01-03
149,TeamMee,fcyctx5,/r/pennystocks/comments/ejiqab/1k_two_days_in_a_row/fcyctx5/,15,Congrats on another 1k!,2020-01-03
150,MidWestMind,fcyd5o8,/r/pennystocks/comments/ejiqab/1k_two_days_in_a_row/fcyd5o8/,13,"Thanks man, congrats on riding it up as well.   You’re up almost $2/share.    

Rumor says the price target is $42, but we all know how that goes.",2020-01-03
151,Lordofthehord91,fcydaj2,/r/pennystocks/comments/ejgdqz/inpx_hovering_at_55_62_jan32020/fcydaj2/,2,"I set a buy limit at .425 and sold at .46 ...buy limit was to high so set another buy limit at .405 if she bottoms out again I'll be selling at whatever prof I can gain before end of day.... 

So I'm between plans hold over weekend which im feeling wont produce ....stock is completely over bought 

Or 

Hold and wait for big time investors to join in and stock gets another run 

Any info ..or opinions what's your guys thoughts ?",2020-01-03
152,TeamMee,fcye49y,/r/pennystocks/comments/ejiqab/1k_two_days_in_a_row/fcye49y/,2,Have you seen the predicted price for inpx? Wish the rumors were true haha. I assume you will hold SAVA over the weekend since you bought in low?,2020-01-03
153,MidWestMind,fcyekmk,/r/pennystocks/comments/ejiqab/1k_two_days_in_a_row/fcyekmk/,7,"Yeah, I’m on day trade restriction.   Made a few mistakes last month and sold a stock that was dropping like a rock to save my ass.  So I have to hold.  I bought more this morning around 6.75",2020-01-03
154,[deleted],fcyepjj,/r/pennystocks/comments/eji6eg/is_anyone_watching_ontx/fcyepjj/,1,[removed],2020-01-03
155,TeamMee,fcyf45b,/r/pennystocks/comments/ejiqab/1k_two_days_in_a_row/fcyf45b/,3,"Sorry to bug you but I made way too many trades last week where I bought a stock kinda high hoping to catch the gains, watched it hit the peak, and then tank and end up losing money. If I sold at the right time all the trades would have been very profitable.  Do you think SAVA will continue going up Monday? I feel good about it but I am still new to trading.",2020-01-03
156,MidWestMind,fcyfk2y,/r/pennystocks/comments/ejiqab/1k_two_days_in_a_row/fcyfk2y/,4,"Hold it over the weekend for sure.  Read up a bit about the company.  I can tell you this, they have no debt and millions in cash to last 5 years.",2020-01-03
157,pyropupper,fcyfom5,/r/pennystocks/comments/ejgdqz/inpx_hovering_at_55_62_jan32020/fcyfom5/,2,"I looked into the history behind INPX, and at their lowest years back stocks were between $720 - $7.20

And this was during the 2008-2009 market crash. So honestly, a 52 week hold might hold some worth?",2020-01-03
158,TeamMee,fcyfoo8,/r/pennystocks/comments/ejiqab/1k_two_days_in_a_row/fcyfoo8/,1,"Awesome, I will definitely read up!",2020-01-03
159,paradoxpandas,fcygwof,/r/pennystocks/comments/ejbbac/simple_questions_january_03_2020/fcygwof/,2,Is fidelity fine for penny stock trading? I’ve got a Roth IRA set up on there and wondering if anyone has any experience with the free trading on fidelity,2020-01-03
160,niceperson33,fcyhc4q,/r/pennystocks/comments/ejgdqz/inpx_hovering_at_55_62_jan32020/fcyhc4q/,2,Is it worth buying in at below .43 rn or is it still expected to crash?,2020-01-03
161,captainzoomer,fcyhiiw,/r/pennystocks/comments/ejdran/inpx_47_premarket_current_538am/fcyhiiw/,1,"Me: Ooh look I made $10, sell! 

INPX: Hold my RedBull.",2020-01-03
162,krazay88,fcyi2ku,/r/pennystocks/comments/ejdran/inpx_47_premarket_current_538am/fcyi2ku/,1,I’m in at 0.4469!,2020-01-03
163,[deleted],fcyilav,/r/pennystocks/comments/ejdran/inpx_47_premarket_current_538am/fcyilav/,1,[deleted],2020-01-03
164,Jpaperz,fcyimik,/r/pennystocks/comments/ejdran/inpx_47_premarket_current_538am/fcyimik/,1,"Hoping for a nice open on monday, calling .55",2020-01-03
165,Ramon_1990,fcyiud4,/r/pennystocks/comments/ejj983/ontx/fcyiud4/,2,Bought yesterday at 0.385. Quick $500. Will hold.,2020-01-03
166,pyropupper,fcyjoyp,/r/pennystocks/comments/ejgdqz/inpx_hovering_at_55_62_jan32020/fcyjoyp/,2,I'm personally waiting for a noticeable dip. But if you want to play the pennies you could totally ride the ups and downs right now and make a few hundred.,2020-01-03
167,ScrappersUS,fcyk955,/r/pennystocks/comments/ej7ecj/how_much_you_scrubs_make_off_inpx/fcyk955/,1,11$ good enough for a 3 chicken tendy meal and fries,2020-01-03
168,skchan2,fcykzq1,/r/pennystocks/comments/ejjpic/kmph/fcykzq1/,2,"this does look interesting, also got a bull signal on the daily, might jump in on this

&amp;#x200B;

[https://www.tradingview.com/x/NwJlv297/](https://www.tradingview.com/x/NwJlv297/)",2020-01-03
169,harvgill1,fcympuy,/r/pennystocks/comments/ejj983/ontx/fcympuy/,2,What was the contract?,2020-01-03
170,Libertad_Financiera,fcyotko,/r/pennystocks/comments/ejgdqz/inpx_hovering_at_55_62_jan32020/fcyotko/,2,"So far it's holding this 0.40 area, I like that probably I'll buy some shares",2020-01-03
171,john19549,fcysy14,/r/pennystocks/comments/ejj983/ontx/fcysy14/,1,wonder what it will do monday,2020-01-03
172,fratstar_69_,fcyuzbl,/r/pennystocks/comments/ejj4s1/january_03_2020_tomorrows_daily_rpennystocks/fcyuzbl/,3,INPX.... again..... can’t go wrong looking at the chart,2020-01-03
173,peteyxj93,fcyv9mw,/r/pennystocks/comments/ejgdqz/inpx_hovering_at_55_62_jan32020/fcyv9mw/,2,Did you go through with it? Trending up post market  close,2020-01-03
174,Libertad_Financiera,fcyvmzf,/r/pennystocks/comments/ejgdqz/inpx_hovering_at_55_62_jan32020/fcyvmzf/,2,Yeah I did ! It's looking good so far..,2020-01-03
175,Sikspak12,fcyvnse,/r/pennystocks/comments/ejiqab/1k_two_days_in_a_row/fcyvnse/,6,I'm up 270$ from DMAN today I'm happy since thats the first profit I've made doing stocks,2020-01-03
176,bullishbehavior,fcywv60,/r/pennystocks/comments/ejgdqz/inpx_hovering_at_55_62_jan32020/fcywv60/,3,No debate needed won’t reach 1,2020-01-03
177,MidWestMind,fcyxd03,/r/pennystocks/comments/ejiqab/1k_two_days_in_a_row/fcyxd03/,4,Congrats!    We were all there at one point.   I made $200 MDR back around labor and was super stoked.   There’s a starting point.    Be excited and happy with any amount of profit.,2020-01-03
178,rudethirteen,fcyzz3g,/r/pennystocks/comments/ejiqab/1k_two_days_in_a_row/fcyzz3g/,2,"I got 20 shares. 
Should of got a couple more I guess...
But 120$ is 120$",2020-01-03
179,Sorroow,fcz0z3f,/r/pennystocks/comments/ejbbac/simple_questions_january_03_2020/fcz0z3f/,1,"Robinhood is available in the UK, isn't it?",2020-01-03
180,RZN_AZ,fcz1do9,/r/pennystocks/comments/ejn3ow/oil_stocks/fcz1do9/,4,Heard a lot of good things about llex,2020-01-03
181,Sorroow,fcz1gzo,/r/pennystocks/comments/ejn3ow/oil_stocks/fcz1gzo/,1,With the Iranian conflict right now?,2020-01-03
182,lessthanmoreorless,fcz1qcx,/r/pennystocks/comments/ejbbac/simple_questions_january_03_2020/fcz1qcx/,1,"It's not on the Google play store and on their website I had to sign up for a pilot with a 40,000 people waiting list",2020-01-03
183,Levaski,fcz1sn0,/r/pennystocks/comments/ejn3ow/oil_stocks/fcz1sn0/,1,"Yup, almost all penny stocks related to oil increased by 15%. Oil stocks in general increased.",2020-01-03
184,Levaski,fcz1vko,/r/pennystocks/comments/ejn3ow/oil_stocks/fcz1vko/,1,"It seems it will decrease by $0.10, then spike up, not sure to buy it now.",2020-01-03
185,alwaysmilesdeep,fcz2ppm,/r/pennystocks/comments/ejn3ow/oil_stocks/fcz2ppm/,1,"Llex is going to be sold to the highest bidder over the next 6 months.  Their stock is going to soar.  I have seen estimates of $5-6

I'm only collecting them, not selling.",2020-01-03
186,MidWestMind,fcz2tly,/r/pennystocks/comments/ejiqab/1k_two_days_in_a_row/fcz2tly/,1,normal friday sell off.  get some before monday,2020-01-03
187,Levaski,fcz3m2y,/r/pennystocks/comments/ejn3ow/oil_stocks/fcz3m2y/,3,Possible for the source that you found the information up? Thanks.,2020-01-03
188,FL--8--US,fcz4lvw,/r/pennystocks/comments/ejngub/blozf_and_babyf/fcz4lvw/,2,"I’ve been watching BLOZF for a while.  Still can’t figure out why such a big jump today, but I’m liking the technology.",2020-01-03
189,626LOU420,fcz7v3w,/r/pennystocks/comments/ejelhv/bought_inpx_at_011/fcz7v3w/,1,is it your birthday ?,2020-01-03
190,Harlequin_Winds,fcza7cr,/r/pennystocks/comments/ejngub/blozf_and_babyf/fcza7cr/,3,"I just posted about this company last night. I jumped on the BABYF bandwagon a while ago. There is just way too much potential to deny. There are no purely plant based formulas for toddlers, babies, or adults like this out there. According to the company they already have line-ups for the product(and it tastes good apparently). It is a known fact that dairy alternates such as soy can have negative effects on the reproductive system. And dairy has hormones and other contaminants in it from the livestock. So this plant based alternative will most likely attract hordes of parents and consumers. This product should alleviate the negatives surrounding soy alternates, lactose intolerant, those afraid of hormones, and the environmentally conscious, I am sure there are more reasons. 

Now the general consumer buying this product is a huge plus. But imagine this gets picked up in the healthcare industry. This stock will explode and fly to planet X where ever it is.

It is a gamble, but an educated gamble. Plant based foods are the future of foods whether we like it or not. 

Thanks for the post. I'll look into BLOZF to see what it's all about.",2020-01-03
191,207doughty,fczbhty,/r/pennystocks/comments/ejn3ow/oil_stocks/fczbhty/,1,BTE,2020-01-03
192,Crjon7034,fczdqsv,/r/pennystocks/comments/ejn3ow/oil_stocks/fczdqsv/,1,DMAN had a nice jump today!!! Thoughts on this one? (I realize it’s a less than a penny stock) but great potential. $$$,2020-01-03
193,Sorroow,fczelag,/r/pennystocks/comments/ejn3ow/oil_stocks/fczelag/,1,"Oh mb I'm new, thought prices for oil would drop bc
'there is uncertainty in getting new barrels in to sell' along those lines; was looking up Iran's percentage in worldwide oil production earlier &amp; it looks like it's around 10% so yeah oil stocks could work gl",2020-01-03
194,ambermage,fczem9k,/r/pennystocks/comments/ejelhv/bought_inpx_at_011/fczem9k/,1,"It will come back down over a couple weeks.  
By March is will be back in the high teens.",2020-01-03
195,alwaysmilesdeep,fczexwo,/r/pennystocks/comments/ejn3ow/oil_stocks/fczexwo/,1,"Stocktwits 

I look there for info.  Alot of the time there is good.  Also slot of hype.  But it's a spot to check regularly imho.",2020-01-03
196,[deleted],fczfk4j,/r/pennystocks/comments/ejelhv/bought_inpx_at_011/fczfk4j/,1,[deleted],2020-01-03
197,steveissuperman,fczfkoh,/r/pennystocks/comments/ejn3ow/oil_stocks/fczfkoh/,4,"Please tell me this is a joke. Stocktwits is easily the worst place on the internet for investing information. Literally just a bunch of morons shouting falsehoods and insults at each other like a bunch of retarded seals. 

And yes, I'm on there too",2020-01-03
198,NoMoreMemesNever,fczfool,/r/pennystocks/comments/ejelhv/bought_inpx_at_011/fczfool/,1,I paid 8.80 per share for my 2 shares,2020-01-03
199,steveissuperman,fczfp6c,/r/pennystocks/comments/ejn3ow/oil_stocks/fczfp6c/,1,"Oil is hard to predict. If you missed the Iran news, there's no telling when the next spike will come. Iran situation may fizzle out for a couple months. Not like they can nuke us.",2020-01-03
200,vladvash,fczjjfh,/r/pennystocks/comments/ejn3ow/oil_stocks/fczjjfh/,1,Sounds like I have somewhere other than wsb to check,2020-01-03
201,Indolent_Architect,fczk28x,/r/pennystocks/comments/ejdran/inpx_47_premarket_current_538am/fczk28x/,1,"I bought at .07 and sold at .14 

Fuck",2020-01-03
202,alwaysmilesdeep,fczmnpq,/r/pennystocks/comments/ejn3ow/oil_stocks/fczmnpq/,2,"They do post links and stuff to. 

https://www.marketwatch.com/amp/story/guid/C7050531-F9D4-4D97-BD80-BE80E0097666

Felix oil has the property adjacent to theirs which just sold.

Supposedly they have laid off extra staff and such making the company profitable

I have never told anyone to take my advice.  

But my $llex has currently made me $500 and looks all pretty in green.",2020-01-03
203,Lordofthehord91,fczodar,/r/pennystocks/comments/ejiqab/1k_two_days_in_a_row/fczodar/,2,How does the taxes work when you make 2k like this ?,2020-01-03
204,afrothunda104,fczrtiq,/r/pennystocks/comments/ejbbac/simple_questions_january_03_2020/fczrtiq/,1,I use Fidelity.,2020-01-03
205,grems8544,fczs9x5,/r/pennystocks/comments/ejiqab/1k_two_days_in_a_row/fczs9x5/,3,"If you are lucky enough, sell half on a double and then let it ride, let it ride, let it ride.  Playing with house money is always a good way to move forward...",2020-01-03
206,nunipatuni,fczwlei,/r/pennystocks/comments/ejiqab/1k_two_days_in_a_row/fczwlei/,3,Why do I get the feeling you’re just talking to yourself?,2020-01-03
207,TeamMee,fczwoxj,/r/pennystocks/comments/ejiqab/1k_two_days_in_a_row/fczwoxj/,1,"Are you saying, I am OP? I am certainly not OP. The 2k would have been nice though lol",2020-01-03
208,MidWestMind,fczylgc,/r/pennystocks/comments/ejiqab/1k_two_days_in_a_row/fczylgc/,3,"file a form, good thing it’s january and I have 12 months.  

Whatever you use to trade stocks will send you the tax info to print",2020-01-03
209,MidWestMind,fd02j9k,/r/pennystocks/comments/ejiqab/1k_two_days_in_a_row/fd02j9k/,1,u/nunipatuni.  I am not talking to myself either,2020-01-03
210,Herves7,fd0374y,/r/pennystocks/comments/ejdran/inpx_47_premarket_current_538am/fd0374y/,1,So whats the hub hub?,2020-01-03
211,SharkStocks,fd03aqn,/r/pennystocks/comments/ejn3ow/oil_stocks/fd03aqn/,1,"$DMAN looking very good folks @GEOENHANCED 
Come join the telegram DD room and find out what the buzz is all about.  Very big story going down here, as you see the stock is rising daily and took alot of interest and volume today.  Closed 91.14% green, and for good reason. 

Here is a tweet with the invite link for the DD room, glad to have you join!

https://twitter.com/SharkStocks/status/1213311820695400449?s=20

Shark",2020-01-03
212,RemindMeBot,fd1409w,/r/pennystocks/comments/ejdran/inpx_47_premarket_current_538am/fd1409w/,1,"There is a 17.7 hour delay fetching comments.

I will be messaging you in 4 days on [**2020-01-08 15:02:14 UTC**](http://www.wolframalpha.com/input/?i=2020-01-08%2015:02:14%20UTC%20To%20Local%20Time) to remind you of [**this link**](https://np.reddit.com/r/pennystocks/comments/ejdran/inpx_47_premarket_current_538am/fcxig7o/?context=3)

[**CLICK THIS LINK**](https://np.reddit.com/message/compose/?to=RemindMeBot&amp;subject=Reminder&amp;message=%5Bhttps%3A%2F%2Fwww.reddit.com%2Fr%2Fpennystocks%2Fcomments%2Fejdran%2Finpx_47_premarket_current_538am%2Ffcxig7o%2F%5D%0A%0ARemindMe%21%202020-01-08%2015%3A02%3A14%20UTC) to send a PM to also be reminded and to reduce spam.

^(Parent commenter can ) [^(delete this message to hide from others.)](https://np.reddit.com/message/compose/?to=RemindMeBot&amp;subject=Delete%20Comment&amp;message=Delete%21%20ejdran)

*****

|[^(Info)](https://np.reddit.com/r/RemindMeBot/comments/e1bko7/remindmebot_info_v21/)|[^(Custom)](https://np.reddit.com/message/compose/?to=RemindMeBot&amp;subject=Reminder&amp;message=%5BLink%20or%20message%20inside%20square%20brackets%5D%0A%0ARemindMe%21%20Time%20period%20here)|[^(Your Reminders)](https://np.reddit.com/message/compose/?to=RemindMeBot&amp;subject=List%20Of%20Reminders&amp;message=MyReminders%21)|[^(Feedback)](https://np.reddit.com/message/compose/?to=Watchful1&amp;subject=RemindMeBot%20Feedback)|
|-|-|-|-|",2020-01-03
213,mdawgt,fd2co2f,/r/pennystocks/comments/ejbbac/simple_questions_january_03_2020/fd2co2f/,1,Anyone thinking ROYT or OVID next week? Newb here.,2020-01-03
214,Clazeldo,fd2gm23,/r/pennystocks/comments/ejj4s1/january_03_2020_tomorrows_daily_rpennystocks/fd2gm23/,1,Lol try not to look at it so much over the weekend.,2020-01-03
215,Purple-Ham,fd2s3r0,/r/pennystocks/comments/ejngub/blozf_and_babyf/fd2s3r0/,3,Both of these aren’t on robinhood :(,2020-01-03
216,SmileBot-2020,fd2s5fp,/r/pennystocks/comments/ejngub/blozf_and_babyf/fd2s5fp/,3,I saw a :( so heres an :) hope your day is good,2020-01-03
217,aaron_j-ix,fd2ysxr,/r/pennystocks/comments/ejj1kr/home_at_home_group_buy_the_dip_again/fd2ysxr/,1,Which model did you apply to calculate the fair value of the stock?,2020-01-03
218,[deleted],fd30hvx,/r/pennystocks/comments/ejgdqz/inpx_hovering_at_55_62_jan32020/fd30hvx/,1,[deleted],2020-01-03
219,thatguybob321,fd34mbs,/r/pennystocks/comments/ejdran/inpx_47_premarket_current_538am/fd34mbs/,1,"Soooooo, it’s gonna go back up right...right?",2020-01-03
220,[deleted],fd35f2g,/r/pennystocks/comments/ejgdqz/inpx_hovering_at_55_62_jan32020/fd35f2g/,1,[deleted],2020-01-03
221,Jpaperz,fd3mi1y,/r/pennystocks/comments/ejdran/inpx_47_premarket_current_538am/fd3mi1y/,1,"Not a big move, im sure itll go back up, bulls were testing waters and profit taking.

Also 335m volume yesterday and 490m volume on thursday, from 9:00am premarket the stock itself is only down .02

Im thinkin a monday test back .56-.50. and then tuesday rally. Cause the 19m volume right at the 9:30 open reaching .65",2020-01-03
222,thatguybob321,fd4hyaa,/r/pennystocks/comments/ejdran/inpx_47_premarket_current_538am/fd4hyaa/,1,"I’m very new to stocks, how do you just know this??",2020-01-03
223,Jpaperz,fd4i9v3,/r/pennystocks/comments/ejdran/inpx_47_premarket_current_538am/fd4i9v3/,1,"I dont, nobody knows anything unless there is a SEC filings to make it legit, even so the market is always uncertain, picture the market as one big unstable insecure indecisive human. There are ways to use technical analysis correctly and incorrectly",2020-01-03
224,ArouetHaise,fd56u95,/r/pennystocks/comments/ejbbac/simple_questions_january_03_2020/fd56u95/,1,I'm in the same situation as you and I've been doing some research. But first tell me: are you looking to buy and sell (ie day trade) any given stock on the same day? Because any of the US brokers won't let you do that unless you have 25k dollars in your account.,2020-01-03
225,mmelnik,fd57uau,/r/pennystocks/comments/ejngub/blozf_and_babyf/fd57uau/,1,Lol also noticed this last night. Was also upset ;(,2020-01-03
226,Bobbyrage39,fd7infc,/r/pennystocks/comments/ejelhv/bought_inpx_at_011/fd7infc/,1,"No, my bday is in February.  This might have been a reddit anniversary? I'm not sure why that showed up.",2020-01-03
227,chandler_bling1,fd87qua,/r/pennystocks/comments/ejbbac/simple_questions_january_03_2020/fd87qua/,1,"Thanks for the reply! I’m not going to have that much cash to begin with so I guess not? I’m using Trading 212 atm and that lets me DT for small
Investments but doesn’t have any smaller stocks on there ☹️ - have you found anything else through your research?",2020-01-03
228,ghabrouch,fd92m5s,/r/pennystocks/comments/ejiqab/1k_two_days_in_a_row/fd92m5s/,1,Well done !,2020-01-03
229,qwertykid82,fd9oy8g,/r/pennystocks/comments/ejdran/inpx_47_premarket_current_538am/fd9oy8g/,1,I know your pain. I bought at .07 too and sold half at .14 then I sold half of what I had left at .25. I definitely should have waited,2020-01-03
230,ArouetHaise,fd9pumw,/r/pennystocks/comments/ejbbac/simple_questions_january_03_2020/fd9pumw/,2,"Yeah, I have - so far I haven't really seen many brokers operating the uk but offering US penny stocks. IG definitely does, and I think Hargreaves Lansdown might do. An IG trade costs £8, or £5 if you trade ten times in a month. Hargreaves cost £12. Only US brokers are subject to that 25,000 dollar day trading rule,  so you should still be able to day trade here with British brokers. The US brokers that I've seen are interactive brokers, sure trade, tradestation, tradestation global, tradezero, . Both tradezero and and suretrade bypass the PDT rule since they are offshore.

Reckon I'll go for either of the off shore ones, or maybe IG - and then move onto interactive brokers with 25k dollars. interactive brokers is easily the best broker.",2020-01-03
231,chandler_bling1,fda5i7e,/r/pennystocks/comments/ejbbac/simple_questions_january_03_2020/fda5i7e/,1,Very helpful - thanks!!,2020-01-03
232,Jpaperz,fda7oyg,/r/pennystocks/comments/ejjpic/kmph/fda7oyg/,1,"DD: theyve been on a downtrend since 2015

They are supposed to be NDA filing for KP415 this month, i dont know what the drug does, but it should pop on hype and we’ll see what happens from there",2020-01-03
