,author,id,url,score,text,date
135,DStrader888,e724vkq,/r/pennystocks/comments/9kt2rz/new_to_penny_stocks/e724vkq/,1,Its a hard one because when you do your research inline there are so many 50/50 answers about particular companies. You want to know about situations before the hit the press. Thats where your a step ahead of the game. My broker has given me some great recommendations for penny stocks this year.  Puration Inc and Liniu Technologies. You need someone good in that market that knows when the best time to buy but more importantly when the best time to sell is. He works on a commission on the profit he makes you rather than an entry or exit fee. So for him to make money he's got to pick you the right companies. Message me if you want to be pointed in that direction.,2018-10-02
136,DStrader888,e724yb8,/r/pennystocks/comments/9kmzmh/rnx/e724yb8/,1,Where you investing from?,2018-10-02
137,lkwtzxt,e7250oz,/r/pennystocks/comments/9klrz7/ogen/e7250oz/,1,Thanks for the heads up on mnga your the fucken man,2018-10-02
138,DStrader888,e7250vm,/r/pennystocks/comments/9kmzmh/rnx/e7250vm/,1,I just bought them to. I like them.,2018-10-02
139,DStrader888,e7251j6,/r/pennystocks/comments/9kmzmh/rnx/e7251j6/,1,Where you investing from?,2018-10-02
140,DStrader888,e725348,/r/pennystocks/comments/9kmzmh/rnx/e725348/,1,agree,2018-10-02
141,DStrader888,e7254r6,/r/pennystocks/comments/9kt48l/acol/e7254r6/,1,Yea I'm on. Great day hahaha,2018-10-02
142,DStrader888,e725gos,/r/pennystocks/comments/9kmjxn/commission_free_otc_brokers/e725gos/,1,My broker makes a commission on the profit he makes you. No fee or commission  on the entry or exit.,2018-10-02
143,BeligerentBlacksmith,e725l8c,/r/pennystocks/comments/9kt48l/acol/e725l8c/,1,"Yeah man, any opinion on where it’s going? I could see them going up with legalization but I haven’t actually done much DD on the company. They’re grinders are pretty much the grinder equivalent of bic lighters where I’m from and their smell proof baggies are pretty popular as well. Only reason I bought in the first place was because I was pretty confident the order from Aurora would cause some excitement. I sold half my shares today to lock in some profit and figure I’d let the other half sit in there until tomorrow morning. Going to do some research tonight but it pulled back harder than I expected towards the end of the day so I’m not super excited about the future but I’m still pretty inexperienced so in reality I don’t have a fucking clue. ",2018-10-02
144,newsmana,e725m17,/r/pennystocks/comments/9kragz/week_39_stock_picking_contest_results_the_winner/e725m17/,1,If only. ,2018-10-02
145,kobezhou24,e725niq,/r/pennystocks/comments/9kmzmh/rnx/e725niq/,1,What do you mean “about to blow up”.... $RNX has already gone from $.09 to $1.18 in September alone... still i believe there is more upside but you already missed the big chunk of the run.,2018-10-02
146,DStrader888,e7265kv,/r/pennystocks/comments/9kt48l/acol/e7265kv/,1,Exactly the same. I sold before the dip and left a bit of profit in. My broker is so on point with market news surrounding my investments. I normally just take his advice. He thinks it's worth holding as there or some more contracts being signed by some big companies and hedge funds in Canada.,2018-10-02
147,gtrg7,e72670s,/r/pennystocks/comments/9kmzmh/rnx/e72670s/,1,i read there is a big annoncement coming in the next few weeks. I feel like theres a nice peak coming..,2018-10-02
148,BeligerentBlacksmith,e7268eo,/r/pennystocks/comments/9kt48l/acol/e7268eo/,1,"Very interesting, thanks for the info ",2018-10-02
149,DStrader888,e726byi,/r/pennystocks/comments/9kt48l/acol/e726byi/,1,Welcome. Good luck,2018-10-02
150,kobezhou24,e726ppb,/r/pennystocks/comments/9kmzmh/rnx/e726ppb/,1,"Well they are presenting at a mining conference tomorrow. But unless they have news that trumps their 20,000 ounce gold boulder discovery, the next pump wont be nearly as big as the last that proud this stock up 1300%, we wont see a 1300% gain at most a 500% from these levels if the news is truly amazing",2018-10-02
151,rayk10k,e726u45,/r/pennystocks/comments/9kt14a/october_02_2018_tomorrows_daily_rpennystocks/e726u45/,1,"Just bought $100 worth of IGC, a seemingly CBD Specific cannabis company based out of Maryland as Canada’s full legalazation grows near. Bought in at $11 a share ",2018-10-02
152,stonedcantdecide,e727k80,/r/pennystocks/comments/9kragz/week_39_stock_picking_contest_results_the_winner/e727k80/,1,Where's the mistake?,2018-10-02
153,ManWithManyTalents,e727m0r,/r/pennystocks/comments/9kragz/week_39_stock_picking_contest_results_the_winner/e727m0r/,1,"I know, I know... I made a profit, but I should have put a trail stop on it or something to maximize profits ",2018-10-02
154,DebaterOver9000,e727o6z,/r/pennystocks/comments/9kusy9/lode/e727o6z/,1,The work they do is pretty amazing when it comes to mining and being environmentally friendly. I'm investing in this stock.,2018-10-02
155,newsmana,e727r3s,/r/pennystocks/comments/9kusy9/lode/e727r3s/,1,"An award? What about good news on perspective mining ventures? 

I don't think this is a buy. ",2018-10-02
156,stonedcantdecide,e7282jk,/r/pennystocks/comments/9kragz/week_39_stock_picking_contest_results_the_winner/e7282jk/,1,"I wouldn't focus too much on the what ifs side of things. There will always be something you could've done to make a few more dollars. Risk management and minimizing losses is what will keep you in the game for years. The most important thing is that you were positioned to be successful

Congratulations on the win though! Keep studying and honing your craft!",2018-10-02
157,azmtbr,e7283vw,/r/pennystocks/comments/9kusy9/lode/e7283vw/,1,Bought 500 earlier today.,2018-10-02
158,ManWithManyTalents,e72881x,/r/pennystocks/comments/9kragz/week_39_stock_picking_contest_results_the_winner/e72881x/,1,"Thanks a lot, man! Have any cool investing stories to share?",2018-10-02
159,EaterofDin0saurs,e7290zn,/r/pennystocks/comments/9kmzmh/rnx/e7290zn/,1,Still trading very well between 0.89-0.97!! Made lots of trades today.,2018-10-02
160,Forgetfulcunt,e7292bz,/r/pennystocks/comments/9kt2rz/new_to_penny_stocks/e7292bz/,1,Why don’t you try Timothy Sykes chat room. Good group of people. Tons of alerts to learn from. ,2018-10-02
161,stonedcantdecide,e7293ac,/r/pennystocks/comments/9kragz/week_39_stock_picking_contest_results_the_winner/e7293ac/,1,"Nothing off the top of my head that's going to be heart warming and make you optimistic about the future lol. My memory is a bit jaded most of the time though so I'll give it some more thought.

How new to investing are you? What type of trader are you?",2018-10-02
162,stonedcantdecide,e72949h,/r/pennystocks/comments/9kragz/week_39_stock_picking_contest_results_the_winner/e72949h/,1,300*,2018-10-02
163,stonedcantdecide,e729i5x,/r/pennystocks/comments/9kragz/week_39_stock_picking_contest_results_the_winner/e729i5x/,1,I've been trading IGC for the past few trading days mainly only using the VWAP and it's deviation bands. It's been pretty clean for bounces in both directions off of those key levels although I've only been dip buying as I didn't have shares to short. ,2018-10-02
164,mulletator,e729icu,/r/pennystocks/comments/9kt14a/october_02_2018_tomorrows_daily_rpennystocks/e729icu/,1,Based on what?,2018-10-02
165,pyette91,e729jp4,/r/pennystocks/comments/9kt14a/october_02_2018_tomorrows_daily_rpennystocks/e729jp4/,1,Hope,2018-10-02
166,ManWithManyTalents,e729kq7,/r/pennystocks/comments/9kragz/week_39_stock_picking_contest_results_the_winner/e729kq7/,1,"I’ve worked for a popular brokerage firm since February as a customer service rep as my first finance job. I started as a temp and was hired on full time and went through the class to take my 7. 

Test day came and I finished with about 12 minutes left so I took the time to go over some of my answers. I made the biggest mistake by second guessing myself and changing a bunch of answers. 

I made a 64 which is one point away from being able to retest. 

Luckily, the firm liked me and gave me an unlicensed role until I can retest in 11 months. ",2018-10-02
167,BIGDICKTAKER,e729orh,/r/pennystocks/comments/9kragz/week_39_stock_picking_contest_results_the_winner/e729orh/,1,What makes you say that?,2018-10-02
168,galactictaco42,e729sop,/r/pennystocks/comments/9kusy9/lode/e729sop/,1,"https://elkodaily.com/mining/mineral-extraction-pioneer-rethinks-metallurgy/article_a5cc1720-5a7f-592a-bf93-c5f3e671d04b.html

oh it is baby. lambs, moon palaces and probably a chocolate milkshake awaits.

at these prices why say no to a thousand shares?",2018-10-02
169,galactictaco42,e729xl3,/r/pennystocks/comments/9kusy9/lode/e729xl3/,1,"their currently abandoned mines can make use of a newly engineered process, turning waste soil into piles of gold, silver and other rare metals that are left behind in too minute or diluted quantities.

especially if prices go up for precious metals.

https://elkodaily.com/mining/mineral-extraction-pioneer-rethinks-metallurgy/article_a5cc1720-5a7f-592a-bf93-c5f3e671d04b.html

buy the hype sell the news then buy the hype from the news.",2018-10-02
170,galactictaco42,e72a07f,/r/pennystocks/comments/9kusy9/lode/e72a07f/,1,"only had a hundred shares worth in my balance after loading up on HSGX, watch for that hype as well, comrades. october 30th is the news.",2018-10-02
171,galactictaco42,e72a297,/r/pennystocks/comments/9kvzes/mnga/e72a297/,1,heard its going to 7 dollars soon.,2018-10-02
172,mulletator,e72a4s4,/r/pennystocks/comments/9kt14a/october_02_2018_tomorrows_daily_rpennystocks/e72a4s4/,1,It must be a pretty big secret since nobody knows anything.,2018-10-02
173,galactictaco42,e72a55q,/r/pennystocks/comments/9kt2rz/new_to_penny_stocks/e72a55q/,1,"find companies with upcoming news, buy their stock and then sell that stock at closing the day before the news comes out.",2018-10-02
174,pyette91,e72a5wa,/r/pennystocks/comments/9kt14a/october_02_2018_tomorrows_daily_rpennystocks/e72a5wa/,1,Rebellions are built on hope ,2018-10-02
175,Da_Fuked,e72aabz,/r/pennystocks/comments/9kt14a/october_02_2018_tomorrows_daily_rpennystocks/e72aabz/,1,$PURA - CBD water for sale in California ,2018-10-02
176,SedarCDN,e72aaoq,/r/pennystocks/comments/9kt14a/october_02_2018_tomorrows_daily_rpennystocks/e72aaoq/,1,IBIO,2018-10-02
177,davinator401,e72aiaf,/r/pennystocks/comments/9kragz/week_39_stock_picking_contest_results_the_winner/e72aiaf/,1,I saw a pic yesterday of their HQ which was some guys house,2018-10-02
178,mulletator,e72ajib,/r/pennystocks/comments/9kt14a/october_02_2018_tomorrows_daily_rpennystocks/e72ajib/,1,You've been watching too much Star Wars.  ,2018-10-02
179,thedubg,e72atif,/r/pennystocks/comments/9kmzmh/rnx/e72atif/,1,"The likelyhood that this excavation project has already peaked is extremely low. The rocks they pulled are going to light up Australia's Precious Metals Investment Symposium which is tomorrow. Eric Sprott has also taken a large position in RNX and will be visiting their Beta Mine tomorrow.

Theres no way of knowing what they have pulled out since their initial remarkable discovery but with all the buzz going on in the mining world I expect to see some new money flowing in regardless of that. 

I have a relatively small position but am extremely hopeful! ",2018-10-02
180,jgoldston_0,e72auw9,/r/pennystocks/comments/9kvzes/mnga/e72auw9/,1,"Dude.  Take profit.  For the love of God, take profit.

They announced yesterday a corporate rebranding which is 100% responsible for the increase.  That excitement is highly ambiguous and likely temporary (in the short term).  If it was me, I’d set a sell limit for the opening and run off into the sunset with what ya made here.",2018-10-02
181,TheBelowIsFalse,e72ax7n,/r/pennystocks/comments/9kusy9/lode/e72ax7n/,1,On HSGX? I must have missed something.,2018-10-02
182,rootchakra111,e72azt1,/r/pennystocks/comments/9kvzes/mnga/e72azt1/,1,Where did you hear that?,2018-10-02
183,chimp1992,e72b98p,/r/pennystocks/comments/9kmzmh/rnx/e72b98p/,1,News out!,2018-10-02
184,galactictaco42,e72baso,/r/pennystocks/comments/9kusy9/lode/e72baso/,1,"october 30th they have a meeting with FDA to get approval for Neocart (which only failed by the thinnest margin and only failed one of its uses).

meaning hype train central. I'm bailing at 2 bucks",2018-10-02
185,galactictaco42,e72bcem,/r/pennystocks/comments/9kvzes/mnga/e72bcem/,1,"its all over the blogs. sell your house and split it between LODE, HSGX and MNGA",2018-10-02
186,rootchakra111,e72bdzo,/r/pennystocks/comments/9kvzes/mnga/e72bdzo/,1,Lol but wait what blogs ? ,2018-10-02
187,galactictaco42,e72bgze,/r/pennystocks/comments/9kvzes/mnga/e72bgze/,1,"just stop asking questions and buy it already bro. you saw what IGC did right?

",2018-10-02
188,BIGDICKTAKER,e72bofp,/r/pennystocks/comments/9kragz/week_39_stock_picking_contest_results_the_winner/e72bofp/,1,Can you link the pic? Or upload it?,2018-10-02
189,papa-goat,e72cgcy,/r/pennystocks/comments/9kvzes/mnga/e72cgcy/,1,This is somewhat a knee jerk reaction.  Take winnings and dont hold through the weekend. Sharp spikes like this are not sustainable and will come crashing down. Depending on how fast it jumps I plan on selling at $1 if it blows past that then I'll set a limit sell and let it bounce around a bit. Feel it out. Yea?,2018-10-02
190,stonedcantdecide,e72d3fa,/r/pennystocks/comments/9kragz/week_39_stock_picking_contest_results_the_winner/e72d3fa/,1,"That sucks, second guessing myself is one of my biggest weaknesses! It's good that it worked out for you though. 

There's tons of ways to invest and things to invest in. The biggest thing is taking your time to study and learn. From there you'll need to find a strategy that works for you as everyone is different. You'll likely find one particular strategy that resonates with you and produces solid individual results. I, for example, am a small cap day trader most of the time  I generally buy into VWAP bounces or short largely extended stocks.

Risk management and minimizing losses are the 2 most important things as everyone loses at times. It's the nature of the stock market.
",2018-10-02
191,randymursh,e72di3w,/r/pennystocks/comments/9kt14a/october_02_2018_tomorrows_daily_rpennystocks/e72di3w/,1,"PLX for quick swing thru Friday, profits spinning back to core long position. Could be a “buy the rumor,” case here but an opportunity is being presented none the less. .74 and .695 are two current supports levels. Happy trading. ",2018-10-02
192,newsmana,e72dmak,/r/pennystocks/comments/9kusy9/lode/e72dmak/,1,Thank you for the info!,2018-10-02
193,TheBelowIsFalse,e72e94a,/r/pennystocks/comments/9kusy9/lode/e72e94a/,1,"Shit, thanks a bunch bud.",2018-10-02
194,pyette91,e72fc93,/r/pennystocks/comments/9kt14a/october_02_2018_tomorrows_daily_rpennystocks/e72fc93/,1,The rebellion is reborn today!! And I will not be the last crypto investor!!,2018-10-02
195,galactictaco42,e72fwds,/r/pennystocks/comments/9kusy9/lode/e72fwds/,1,"huh, it didn't seem to have  a pay wall up until now...https://old.reddit.com/r/RobinHoodPennyStocks/comments/9km35w/my_dd_on_lode/

i cant claim to have discovered it, this is the post i got it from. seemed legit enough for a 15 dollar roll of the dice. i only went in 100 shares.",2018-10-02
196,Libertrarian,e72gms3,/r/pennystocks/comments/9kusy9/lode/e72gms3/,1,Sold IGC to bust a Lode,2018-10-02
197,O0redstorm0o,e72guvm,/r/pennystocks/comments/9kvzes/mnga/e72guvm/,1,"Yea. I’ll keep a close look on it tomorrow. No idea if it will rise again or crash, but I’ll definitely set a sell limit. ",2018-10-02
198,touchfuzzygetdizzy1,e72iqc8,/r/pennystocks/comments/9kusy9/lode/e72iqc8/,1,"[https://www.reddit.com/r/RobinHoodPennyStocks/comments/9km35w/my\_dd\_on\_lode/](https://www.reddit.com/r/RobinHoodPennyStocks/comments/9km35w/my_dd_on_lode/)  
This is what's happening",2018-10-02
199,Epicpotato119,e72ju2t,/r/pennystocks/comments/9kragz/week_39_stock_picking_contest_results_the_winner/e72ju2t/,1,"I bought some around ~$2, how long do you think it will continue to rise? Any important news about the company to explain this? Is the media influence for weed stocks going to keep this going up?",2018-10-02
200,kobezhou24,e72k0qr,/r/pennystocks/comments/9kmzmh/rnx/e72k0qr/,1,AMAZING NEWS,2018-10-02
201,Bamness,e72kogq,/r/pennystocks/comments/9kusy9/lode/e72kogq/,1,An award for building a road. Nothing to do with mining. ,2018-10-02
202,Bamness,e72kwdu,/r/pennystocks/comments/9kusy9/lode/e72kwdu/,1,One article is about a road they built. Good PR but nothing towards a growing business. And the 2nd article talks about testing a new extraction method. Like a company testing a new cancer cure. Doesn't mean they have the cure. ,2018-10-02
203,saltypeanuts7,e72lp6m,/r/pennystocks/comments/9kvzes/mnga/e72lp6m/,1,"I would say just sell but IGC sellers are still suffering from sellimg early a 1000% gain is what all of us dream of


Do as you will.",2018-10-02
204,louiehass,e72m2pl,/r/pennystocks/comments/9krj3p/hiph_announces_major_distribution_deal_with_sing/e72m2pl/,1,Awesome! Definitely lot of buzz about them in the news too! ,2018-10-02
205,CaptainWeee,e72mnzj,/r/pennystocks/comments/9krj3p/hiph_announces_major_distribution_deal_with_sing/e72mnzj/,1,I found another article A/H’s will post it tomorrow 😁😁😁,2018-10-02
206,Itz_Ares,e72noay,/r/pennystocks/comments/9kvzes/mnga/e72noay/,1,Hahahahaha,2018-10-02
207,XekiliTrades,e72oc0x,/r/pennystocks/comments/9kvzes/mnga/e72oc0x/,1,I also bought at .19. Only 100 shares though. Still solid gainsss,2018-10-02
208,nonosurewhynot,e72omee,/r/pennystocks/comments/9ktyea/500/e72omee/,1,"CGAC!!!
It’s O/S is 1.27MM, it’s wound so tight!!",2018-10-02
209,X3noNuke,e72p5pr,/r/pennystocks/comments/9ktyea/500/e72p5pr/,1,Everyone is taking about Lode on r/robinhoodpennystocks haven't had time to do my DD but might just yolo $20 at it,2018-10-02
210,applescrispy,e72uhi4,/r/pennystocks/comments/9kragz/week_39_stock_picking_contest_results_the_winner/e72uhi4/,1,Looks like others are saying sell and be happy with the profit. ,2018-10-02
211,FlyerMileSecrets,e72x19j,/r/pennystocks/comments/9kvzes/mnga/e72x19j/,1,I'm holding,2018-10-02
212,Akeem868,e72xbr2,/r/pennystocks/comments/9kragz/week_39_stock_picking_contest_results_the_winner/e72xbr2/,1,😂😂😂😂😂,2018-10-02
213,Pureevil1992,e72zzol,/r/pennystocks/comments/9krnk3/eht/e72zzol/,1,I have been watching this company aswell. It's just a matter of when enough people find this news and spike the stock. The symbol is EDYYF if anyone was wondering.,2018-10-02
214,sh4dy15,e732c92,/r/pennystocks/comments/9ks7oa/intk_current_as_of_today_stop_sign_coming_down/e732c92/,1,Stop sign now removed!,2018-10-02
215,ManWithManyTalents,e735qoc,/r/pennystocks/comments/9kragz/week_39_stock_picking_contest_results_the_winner/e735qoc/,1,"Right now I’m really trying to get into option trading. I understand the concept and how they work, it’s just applying them is where I’m having some trouble. That stacked on top of learning how to use ThinkorSwim’s 5 billion features ",2018-10-02
216,NikoSleeps,e737iv6,/r/pennystocks/comments/9ksrrb/screw_ogen/e737iv6/,1,Not anymore,2018-10-02
217,NikoSleeps,e737ju7,/r/pennystocks/comments/9ksrrb/screw_ogen/e737ju7/,1,Id dump it to be honest,2018-10-02
218,jpegram17,e7381my,/r/pennystocks/comments/9kragz/week_39_stock_picking_contest_results_the_winner/e7381my/,1,I bought IGC 3 weeks ago at $1.40 and have seen a 552% return. I love this stock!,2018-10-02
219,Fatherthinger,e738hhp,/r/pennystocks/comments/9kragz/week_39_stock_picking_contest_results_the_winner/e738hhp/,1,It is down 26% today,2018-10-02
220,CaptainWeee,e73ae61,/r/pennystocks/comments/9krj3p/hiph_announces_major_distribution_deal_with_sing/e73ae61/,1,"Back over .08s close at .09, break .10 tomorrow test .13 again my prediction for today and tomorrow 😎👌🔥 $HIPH",2018-10-02
221,S4muru,e73arw8,/r/pennystocks/comments/9kt14a/october_02_2018_tomorrows_daily_rpennystocks/e73arw8/,1,"uh oh....I would look into other plays man.  I bought into IGC at 3.69 and sold at 11.  NXTTF isn't a great company, but RSI looks good and they'll bounce back some for a profit.",2018-10-02
222,mchgrms,e73asgk,/r/pennystocks/comments/9krj3p/hiph_announces_major_distribution_deal_with_sing/e73asgk/,1,"lol, I'm hoping this holds true!",2018-10-02
223,CaptainWeee,e73b0aq,/r/pennystocks/comments/9krj3p/hiph_announces_major_distribution_deal_with_sing/e73b0aq/,1,"MMs moving her up already, all the flip groups look to be completely out now 👏😁",2018-10-02
224,Beefcornpoop,e73d57u,/r/pennystocks/comments/9ktyea/500/e73d57u/,1,$LODE,2018-10-02
225,metagawd,e73dbmv,/r/pennystocks/comments/9kt14a/october_02_2018_tomorrows_daily_rpennystocks/e73dbmv/,1,Agree. I think IGC is going to hang on in the high singles/low doubles. I only have 35 shares (and well WELL WEEEEELLLLLL below $11) so we shall see what the future holds.,2018-10-02
226,S4muru,e73djjl,/r/pennystocks/comments/9kt14a/october_02_2018_tomorrows_daily_rpennystocks/e73djjl/,1,Lol yeah I got super lucky.  Buddy of mine gave me a tip on em and bought $500 at 3.69.  made about $1100 gain on it.,2018-10-02
227,LongJohnCopper,e73f2rz,/r/pennystocks/comments/9kn9s9/cvsi/e73f2rz/,1,And back in at $4.17 this morning. Probably room for a couple of good swing trades before November...,2018-10-02
228,zombiemoan,e73g79q,/r/pennystocks/comments/9kt48l/acol/e73g79q/,1,"Ive had this since I started using medtainers a year ago. I completely replaced my metal grinders for vaporizing. These are really smell proof, and the plastic doesnt shear even after months of use. 
",2018-10-02
229,Eleniria,e73i4i5,/r/pennystocks/comments/9ksnsi/reasons_for_rdgl_going_up_in_price_largely/e73i4i5/,1,"Man.... I have the same questions, let me know where you find answers :) ",2018-10-02
230,yourmonkeyboxismine,e73ndp4,/r/pennystocks/comments/9kn9s9/cvsi/e73ndp4/,1,Anything more besides that? Seems like they have decent financing with no debt and a good product that’s continuously selling. With CBD possibly becoming removed from schedule 1 why would it not be able to take advantage of the entire US market?,2018-10-02
231,newsmana,e73nj6u,/r/pennystocks/comments/9kn9s9/cvsi/e73nj6u/,1,Check out their corporate website. Its made out of fluff dream bullshit.,2018-10-02
232,ozigiri,e73o38f,/r/pennystocks/comments/9ksrrb/screw_ogen/e73o38f/,1,now at 2.19,2018-10-02
233,wannaberichguy777,e73splc,/r/pennystocks/comments/9krnk3/eht/e73splc/,1,"there we go , had no idea it was trading as EDYYF aswel ",2018-10-02
234,stonedcantdecide,e73tccs,/r/pennystocks/comments/9kragz/week_39_stock_picking_contest_results_the_winner/e73tccs/,1,"Right on. There are a lot of features, I try to keep it simple for the most part.

 I've never done options but they have better profit margins. I would switch to options personally if I felt like learning a brand new niche.",2018-10-02
235,LongJohnCopper,e73wb1f,/r/pennystocks/comments/9kn9s9/cvsi/e73wb1f/,1,"That's bog standard for any supplement/pharma marketing site. That has nothing to do with their financials. Their YoY growth is exponential, and will only get bigger as hemp legalizes. Will they go to the moon long term? Probably not without expanding into more products than just CBD, but from where they sit now there is plenty of upside.

I'll be swing trading them for a while to come I imagine.",2018-10-02
236,Epicpotato119,e73z3ra,/r/pennystocks/comments/9kragz/week_39_stock_picking_contest_results_the_winner/e73z3ra/,1,Welp I shoulda taken that advice yesterday... whoops.,2018-10-02
237,BeligerentBlacksmith,e740naa,/r/pennystocks/comments/9kt48l/acol/e740naa/,1,"It’s been years since I used one but I didn’t have any problems with it for sure. I think these guys carry decent quality, inexpensive products and the market for it is going to explode oct 17. I still know lots of people worried about the whole taboo drugs thing so they don’t own any kind of paraphernalia but I could see that changing once legalization comes around and people start to accept it so I think marijuana paraphernalia and packaging are going to take big leaps with legalization and there’s a lot less competition for dominance in that area than there is in actual producers. ",2018-10-02
238,logicallyillogical,e749y19,/r/pennystocks/comments/9kt14a/october_02_2018_tomorrows_daily_rpennystocks/e749y19/,1,"I've been holding ACOL for over 2 yrs, finally paid off. Double mine investment, sold half at .028 yesterday. ",2018-10-02
239,BeligerentBlacksmith,e74a5wu,/r/pennystocks/comments/9kt14a/october_02_2018_tomorrows_daily_rpennystocks/e74a5wu/,1,"That’s awesome, I sold half just before it started to dip yesterday. I’ve heard there’s some more deals coming down the tube for them too and with legalization coming marijuana packaging and containers and paraphernalia are going to be more in demand than ever so I feel pretty good about holding half for the next couple weeks",2018-10-02
240,logicallyillogical,e74aemy,/r/pennystocks/comments/9kt14a/october_02_2018_tomorrows_daily_rpennystocks/e74aemy/,1,"Yup, me too. Since they acquired the patents and IP, either is going to keep trending higher, or they will get bought by one of the large pot companies. Win win either way I feel. ",2018-10-02
241,jpegram17,e74ud36,/r/pennystocks/comments/9kragz/week_39_stock_picking_contest_results_the_winner/e74ud36/,1,Yeah that’s been a bummer. ,2018-10-02
242,bgtom,e74yg6i,/r/pennystocks/comments/9ktyea/500/e74yg6i/,1,TRUL = TCNNF on US exchanges (OTC),2018-10-02
243,sneakattack,e75gfbt,/r/pennystocks/comments/9kusy9/lode/e75gfbt/,1,They're actually working on building a production operation around this technology to full test it out and see if it can be expanded to replace cyanide heap leaching entirely.,2018-10-02
