,author,id,url,score,text,date
0,pitystonks,fo79dz1,/r/pennystocks/comments/g64q4s/just_a_noob_but_i_believe_these_oil_tankers_are/fo79dz1/,1,"Haha excuse Regis I know it has nothing to do with oil
 Well oily hair maybe...",2020-04-22
1,xxxmuluken,fo79v5e,/r/pennystocks/comments/g64rd7/buy_the_dip_tops_and_ship/fo79v5e/,2,I bought tops yesterday before this 15% dip. You think I can make a rebound?,2020-04-22
2,flip_your_WOW,fo7bkt9,/r/pennystocks/comments/g64rd7/buy_the_dip_tops_and_ship/fo7bkt9/,2,"Ofc. The price drop is bc of oil rebound. 

The volume dropped looks like day trader sold looking to buy the dip..

Around this watering hole, ship and tops are pnd stocks. So, now it's dump time and pump in the AH.",2020-04-22
3,Fl99ms,fo7chnn,/r/pennystocks/comments/g64rd7/buy_the_dip_tops_and_ship/fo7chnn/,2,"I have 1,500 TOPS at .2895 😩 just waiting for the pump . After hours correct?",2020-04-22
4,Shakwando,fo7d0j0,/r/pennystocks/comments/g657wf/decn_short_sell_or_buy_to_cover_are_now_my_only/fo7d0j0/,2,Not sure.  I just bought more at .31 and went through fine.  Up to 4700 shares now.  Most at .16.,2020-04-22
5,xxxmuluken,fo7djz5,/r/pennystocks/comments/g64rd7/buy_the_dip_tops_and_ship/fo7djz5/,1,Okay cool thanks,2020-04-22
6,JohnnyLakefront,fo7eqw8,/r/pennystocks/comments/g65bjk/decn_exit_strategy/fo7eqw8/,4,i would highly recommend against selling at open. Huge mistake.,2020-04-22
7,isaac11117,fo7eswn,/r/pennystocks/comments/g65bjk/decn_exit_strategy/fo7eswn/,3,I just bought 3000 more shares! to the moon!,2020-04-22
8,cmmckechnie,fo7exil,/r/pennystocks/comments/g65bjk/decn_exit_strategy/fo7exil/,-1,Yeah sell now lol,2020-04-22
9,cmmckechnie,fo7eyjx,/r/pennystocks/comments/g65bjk/decn_exit_strategy/fo7eyjx/,-3,Future bag holder here,2020-04-22
10,JohnnyLakefront,fo7f548,/r/pennystocks/comments/g65bjk/decn_exit_strategy/fo7f548/,6,it's breaking resistance levels and climbing steadily.... why the hell would you sell now?,2020-04-22
11,keystonerlite,fo7fit4,/r/pennystocks/comments/g65nc1/decn/fo7fit4/,3,I wish I bought more yesterday,2020-04-22
12,Shakwando,fo7fmnz,/r/pennystocks/comments/g65ikx/scyx/fo7fmnz/,1,I'm in this one too.  Cheap enough to see what happens over the next day or so.,2020-04-22
13,isaac11117,fo7fop8,/r/pennystocks/comments/g65nc1/decn/fo7fop8/,5,"I just bought 3000 MORE shares just now, this is the only penny stock I own and one of the only ones that truly have a good company behind it. This company actually has enormous potential over the next few months and will only climb sky high. After tomorrows news this thing will be trading above $1. Im holding long term",2020-04-22
14,JoeBarth22,fo7fwq1,/r/pennystocks/comments/g65nc1/decn/fo7fwq1/,1,why do you like the company long term?,2020-04-22
15,alexesver,fo7g0hm,/r/pennystocks/comments/g65q7a/i_couldnt_wait_till_tomorrow/fo7g0hm/,6,"New or used.
Us kings are buying the prototypes tomorrow",2020-04-22
16,Steelrocket07,fo7g1zd,/r/pennystocks/comments/g65ikx/scyx/fo7g1zd/,1,I’m afraid it’s resetting after it rallied from 0.55 a month ago. If it dips below .80 I think I’m out.,2020-04-22
17,Bluetrees44,fo7gak0,/r/pennystocks/comments/g65pzx/can_we_please_refrain_from_commenting_on_stocks/fo7gak0/,3,"been holding for 4 days and finally got my payout today. im having a great day today!, but yeah I agree with you man",2020-04-22
18,bennybouch,fo7gce7,/r/pennystocks/comments/g65q7a/i_couldnt_wait_till_tomorrow/fo7gce7/,2,lol,2020-04-22
19,isaac11117,fo7ghuv,/r/pennystocks/comments/g65nc1/decn/fo7ghuv/,4,They'll get tons of orders for the test kit from many countries and companies. Its a way less invasive kit and way less expensive. At the very least this thing will be rocketing up for a couple months.,2020-04-22
20,mushmyhead,fo7gses,/r/pennystocks/comments/g64rd7/buy_the_dip_tops_and_ship/fo7gses/,1,"New here, so im not challanging you or anything, but what makes you say this? How high do you think SHIP can go? I bought in wrecklessly at the worst possible time yesterday.

I've had a limit sell in for .25 all day, but im seeing other people talking about .30+.",2020-04-22
21,cmmckechnie,fo7gugt,/r/pennystocks/comments/g65bjk/decn_exit_strategy/fo7gugt/,1,How many people you think have a trailing stop loss?,2020-04-22
22,mizotrader,fo7h0f3,/r/pennystocks/comments/g65bjk/decn_exit_strategy/fo7h0f3/,-1,Based on what is it going so high today? Tomorrow’s press conference seems like it is meant to ease the optimism that they might get an FDA approval anytime soon. Their press note yesterday mentioned a lot of ‘issues’.,2020-04-22
23,flip_your_WOW,fo7hjdc,/r/pennystocks/comments/g64rd7/buy_the_dip_tops_and_ship/fo7hjdc/,1,"Look at the volume... it was 22mil and now 36.

As for ship, it was 24 now 45mil. 

At .28, I don't think it will break beyond that this week.",2020-04-22
24,isaac11117,fo7hng6,/r/pennystocks/comments/g65bjk/decn_exit_strategy/fo7hng6/,1,What issues?,2020-04-22
25,xxxmuluken,fo7hpn8,/r/pennystocks/comments/g65poc/ghsi_conference_live_get_in_on_the_dip/fo7hpn8/,2,Looks promising im gonna go do some DD then look at it later.,2020-04-22
26,JohnLouis24,fo7hvo2,/r/pennystocks/comments/g65nc1/decn/fo7hvo2/,2,"I bought more just now at .335, hoping that's not too high",2020-04-22
27,isaac11117,fo7i15p,/r/pennystocks/comments/g65nc1/decn/fo7i15p/,4,Nah bro ur chillin 😎this shits to the moon,2020-04-22
28,Kyism,fo7i6fw,/r/pennystocks/comments/g65q7a/i_couldnt_wait_till_tomorrow/fo7i6fw/,3,Damn!!! I can't wait to get mine,2020-04-22
29,bucky-2019,fo7i8ms,/r/pennystocks/comments/g65poc/ghsi_conference_live_get_in_on_the_dip/fo7i8ms/,6,"If it doesn't shoot up this time, I'll be shooting up to take away the pain of holding the bag for so long",2020-04-22
30,PupPop,fo7i9g4,/r/pennystocks/comments/g65bjk/decn_exit_strategy/fo7i9g4/,1,You can't even use trailing stops on OTC pink sheets.,2020-04-22
31,vantyle,fo7icz6,/r/pennystocks/comments/g65bjk/decn_exit_strategy/fo7icz6/,1,"Buy the rumor, sell the news.",2020-04-22
32,djscuba1012,fo7ig8l,/r/pennystocks/comments/g65poc/ghsi_conference_live_get_in_on_the_dip/fo7ig8l/,1,I just got off the call. Positive news! I bought some mid conference.,2020-04-22
33,BuzzyShizzle,fo7insj,/r/pennystocks/comments/g65bjk/decn_exit_strategy/fo7insj/,2,Ignore the downvotes lol.  +respect for recognizing the risk.,2020-04-22
34,jacobsawyerr,fo7iph5,/r/pennystocks/comments/g65nc1/decn/fo7iph5/,3,been in 10.5k shares @ .23 😎😎😎,2020-04-22
35,vantyle,fo7iqt2,/r/pennystocks/comments/g65pzx/can_we_please_refrain_from_commenting_on_stocks/fo7iqt2/,5,"Dude, not everyone is going to agree with you.",2020-04-22
36,janessssssssss,fo7ivhf,/r/pennystocks/comments/g65q7a/i_couldnt_wait_till_tomorrow/fo7ivhf/,1,Exactly...,2020-04-22
37,JohnLouis24,fo7iw34,/r/pennystocks/comments/g65nc1/decn/fo7iw34/,3,"Haha, let's hope you're right!",2020-04-22
38,xxxmuluken,fo7j10o,/r/pennystocks/comments/g65poc/ghsi_conference_live_get_in_on_the_dip/fo7j10o/,1,Is it too late to but in right now?,2020-04-22
39,JohnnyLakefront,fo7j1db,/r/pennystocks/comments/g65bjk/decn_exit_strategy/fo7j1db/,1,"ya, and the news comes out tomorrow, which should include information about who's looking to buy, and how much.",2020-04-22
40,whiterhinoqueef,fo7j2v1,/r/pennystocks/comments/g65bjk/decn_exit_strategy/fo7j2v1/,2,I’m not going to sell any of my shares until it reaches $20,2020-04-22
41,justusingredditUSA,fo7jdj6,/r/pennystocks/comments/g65bjk/decn_exit_strategy/fo7jdj6/,0,This guy doesn’t want to share the Lambos...,2020-04-22
42,JohnnyLakefront,fo7jgoo,/r/pennystocks/comments/g65nc1/decn/fo7jgoo/,1,Because they project 500 million at-home kits sold in the first 12 months,2020-04-22
43,justusingredditUSA,fo7jl5f,/r/pennystocks/comments/g65pzx/can_we_please_refrain_from_commenting_on_stocks/fo7jl5f/,1,Dude give me your intuition and Smarts Please.,2020-04-22
44,FearTheBeast,fo7jn36,/r/pennystocks/comments/g65nc1/decn/fo7jn36/,1,"160k shares, 110k @.04, 50k @ average of .2006. LETS GOOOOOO.",2020-04-22
45,WallStResearch-Bot,fo7jplg,/r/pennystocks/comments/g65nc1/decn/fo7jplg/,1,"I have crossposted this post to:

/r/WallStreetResearch/comments/g66b61/decn_4222020/

I am a bot and this action was performed automatically. Please contact u_sutterismine to have this subreddit blacklisted.",2020-04-22
46,ILoveSudoku,fo7jun1,/r/pennystocks/comments/g65poc/ghsi_conference_live_get_in_on_the_dip/fo7jun1/,1,"No, expected jump is to 7$",2020-04-22
47,cmmckechnie,fo7jvgy,/r/pennystocks/comments/g65pzx/can_we_please_refrain_from_commenting_on_stocks/fo7jvgy/,2,Can we refrain from falling in love with penny stocks please,2020-04-22
48,thelegend27______,fo7jyo2,/r/pennystocks/comments/g65q7a/i_couldnt_wait_till_tomorrow/fo7jyo2/,10,I'm gonna be handing water beds out like Oprah,2020-04-22
49,djscuba1012,fo7jyzs,/r/pennystocks/comments/g65poc/ghsi_conference_live_get_in_on_the_dip/fo7jyzs/,1,Hey btw I posted this link in [r/robinhoodpennystocks](https://www.reddit.com/r/RobinHoodPennyStocks/),2020-04-22
50,xxxmuluken,fo7jzo8,/r/pennystocks/comments/g65poc/ghsi_conference_live_get_in_on_the_dip/fo7jzo8/,1,Seriously? I would love to know where I can find out things like this. May I ask where you heard this?,2020-04-22
51,djscuba1012,fo7k1ta,/r/pennystocks/comments/g65poc/ghsi_conference_live_get_in_on_the_dip/fo7k1ta/,1,Thanks for posting btw,2020-04-22
52,mizotrader,fo7kajk,/r/pennystocks/comments/g65bjk/decn_exit_strategy/fo7kajk/,2,"Read their press note from yesterday.

https://finance.yahoo.com/news/decn-updates-progress-genviro-covid-131500047.html",2020-04-22
53,FSUag,fo7kcmr,/r/pennystocks/comments/g65vks/ship/fo7kcmr/,3,Did someone say AYTU???,2020-04-22
54,GrimePays,fo7kiw5,/r/pennystocks/comments/g65q7a/i_couldnt_wait_till_tomorrow/fo7kiw5/,1,Shit I bought already bought a car too...,2020-04-22
55,JoeBarth22,fo7km7x,/r/pennystocks/comments/g65nc1/decn/fo7km7x/,1,"Yes, this aint happening.  Sorry.  Get out EOD tomorrow at peak.",2020-04-22
56,cmmckechnie,fo7kry5,/r/pennystocks/comments/g65bjk/decn_exit_strategy/fo7kry5/,1,Way overextended. Looks like another leg up first though.,2020-04-22
57,worldrobotdomination,fo7ktsu,/r/pennystocks/comments/g65nc1/decn/fo7ktsu/,1,Remember a few days ago when $DECN crashed down just in the final hour of trading.,2020-04-22
58,Shakwando,fo7kv3q,/r/pennystocks/comments/g65vks/ship/fo7kv3q/,2,Are we buying AYTU again and heading to the moon????  Fuck it I'm in.,2020-04-22
59,whiterhinoqueef,fo7l5db,/r/pennystocks/comments/g65nc1/decn/fo7l5db/,1,Looks like some people are probably selling again to lock in profit like after it hit .29 for the first time this morning. Hoping it can maybe get up to .35 by EOD!,2020-04-22
60,Causalitysfool,fo7l5ya,/r/pennystocks/comments/g65poc/ghsi_conference_live_get_in_on_the_dip/fo7l5ya/,3,"Ya no way thats going up that much, I'm guessing 1-2$ at most.",2020-04-22
61,xxxmuluken,fo7lc0f,/r/pennystocks/comments/g65poc/ghsi_conference_live_get_in_on_the_dip/fo7lc0f/,1,I’d still take those profits but I was just interested In where they got that forecast lol,2020-04-22
62,nomosnow,fo7lgze,/r/pennystocks/comments/g65bjk/decn_exit_strategy/fo7lgze/,3,Very optimistic.,2020-04-22
63,nomosnow,fo7lj4s,/r/pennystocks/comments/g65bjk/decn_exit_strategy/fo7lj4s/,3,Can you expand on this?,2020-04-22
64,Jzobie,fo7lmdj,/r/pennystocks/comments/g65pzx/can_we_please_refrain_from_commenting_on_stocks/fo7lmdj/,1,I actually bought a few $$ worth but only like the $3 I had free at closing. Just didn’t want you to think that nobody listens. Trying to free some money up for more substantial invests soon but I keep buying long term.,2020-04-22
65,h0tB0xing,fo7lo9x,/r/pennystocks/comments/g65pzx/can_we_please_refrain_from_commenting_on_stocks/fo7lo9x/,4,"That's fine you dont have to agree with my research. Calling a stock a ""Pump and dump"" when you do not follow it does nothing for anyone. That was my problem. I welcome disagreement, it might do me good to hear another perspective on my opinion. Just not lying.",2020-04-22
66,MeIn2016LUL,fo7m04y,/r/pennystocks/comments/g65q7a/i_couldnt_wait_till_tomorrow/fo7m04y/,1,"I can't wait either to see how many people will be crying over DECN dropping despite getting an FDA approval which 90 other companies have, lol. Writing on the wall for this to dump down to $0.15-$0.20 when DECN will be unable to fulfill orders and get their product in the hands of customers.",2020-04-22
67,alexesver,fo7m1gs,/r/pennystocks/comments/g65q7a/i_couldnt_wait_till_tomorrow/fo7m1gs/,1,Troll,2020-04-22
68,hn1295,fo7m1q7,/r/pennystocks/comments/g64rd7/buy_the_dip_tops_and_ship/fo7m1q7/,2,SHIP is a dry bulk tanker company. Not sure if it can store excess oil....,2020-04-22
69,nyterydr82,fo7m664,/r/pennystocks/comments/g65nc1/decn/fo7m664/,1,Just sold at .34 I'll get back in tomorrow depending price.,2020-04-22
70,thatsAChopbro,fo7mao9,/r/pennystocks/comments/g65poc/ghsi_conference_live_get_in_on_the_dip/fo7mao9/,1,Honestly no since it’s really low but I don’t think it’s going to go more than .80,2020-04-22
71,thatsAChopbro,fo7md70,/r/pennystocks/comments/g65poc/ghsi_conference_live_get_in_on_the_dip/fo7md70/,2,What happen? After the conference and good news this went down more.,2020-04-22
72,migbyo,fo7mjdg,/r/pennystocks/comments/g65bjk/decn_exit_strategy/fo7mjdg/,2,What do you think they might be?,2020-04-22
73,[deleted],fo7mrnm,/r/pennystocks/comments/g65poc/ghsi_conference_live_get_in_on_the_dip/fo7mrnm/,1,[deleted],2020-04-22
74,friedchickenmane4,fo7ms8g,/r/pennystocks/comments/g65poc/ghsi_conference_live_get_in_on_the_dip/fo7ms8g/,1,Yup. Is this call over?  Cause I might need a hook up 😅,2020-04-22
75,xxxmuluken,fo7muka,/r/pennystocks/comments/g65poc/ghsi_conference_live_get_in_on_the_dip/fo7muka/,1,Well I already bought in at 43 and we’ll see how it does,2020-04-22
76,Not_Flygon,fo7n7f1,/r/pennystocks/comments/g65q7a/i_couldnt_wait_till_tomorrow/fo7n7f1/,1,This may be the sad truth of being priced in,2020-04-22
77,itwasthekids,fo7nugq,/r/pennystocks/comments/g65pzx/can_we_please_refrain_from_commenting_on_stocks/fo7nugq/,4,"I personally think this community could benefit from just staying away from the phrase 'pump and dump' altogether. That being said, the true traders among us won't take a random 'this is a pump and dump' comment for granted, just like they wouldn't take any DD on this sub for granted without doing research on their own.


However, I think we should also be aware of the people that may enter/exit positions based solely on content they see here. If OP or anybody else has a good idea for this, I would love to hear it :)",2020-04-22
78,MadReaper1,fo7pj77,/r/pennystocks/comments/g65pzx/can_we_please_refrain_from_commenting_on_stocks/fo7pj77/,4,Calling out pump and dumps with penny stocks is more often right than wrong.,2020-04-22
79,raw_testosterone,fo7pspq,/r/pennystocks/comments/g65q7a/i_couldnt_wait_till_tomorrow/fo7pspq/,2,Fake news propaganda,2020-04-22
80,thelegend27______,fo7pzbz,/r/pennystocks/comments/g65nc1/decn/fo7pzbz/,1,Ask and you shall receive,2020-04-22
81,jayyygarrr,fo7qap4,/r/pennystocks/comments/g65q7a/i_couldnt_wait_till_tomorrow/fo7qap4/,3,Up 43% today and tomorrow to the moon. Who the hell cares If they cant fulfill orders. After tomorrow you'll be on the beach sippin mai tais,2020-04-22
82,xxxmuluken,fo7qq3x,/r/pennystocks/comments/g65poc/ghsi_conference_live_get_in_on_the_dip/fo7qq3x/,1,"Noticed that too. Wonder what caused this,",2020-04-22
83,M16goespewpew,fo7qsdb,/r/pennystocks/comments/g65ha8/hold_or_sell_dust/fo7qsdb/,1,"I have JDST and I’m honestly just holding it. You don’t lose till you sell, and if you don’t need the money immediately then fuck it I’m holding on",2020-04-22
84,JohnnyLakefront,fo7qtio,/r/pennystocks/comments/g65bjk/decn_exit_strategy/fo7qtio/,1,They're already filing for their second product,2020-04-22
85,GaviJG,fo7qubr,/r/pennystocks/comments/g65bjk/decn_exit_strategy/fo7qubr/,1,"Yep, 10:15!!",2020-04-22
86,bmal22bmal,fo7quek,/r/pennystocks/comments/g67cqg/oas/fo7quek/,2,why is that?,2020-04-22
87,myforte322,fo7r0pr,/r/pennystocks/comments/g65nc1/decn/fo7r0pr/,1,LETS GEAAAAUUUX,2020-04-22
88,[deleted],fo7r2o7,/r/pennystocks/comments/g65pzx/can_we_please_refrain_from_commenting_on_stocks/fo7r2o7/,2,[removed],2020-04-22
89,FearoTheFearless,fo7r4jf,/r/pennystocks/comments/g67eri/another_decn_question/fo7r4jf/,7,They heavily hint at it being great was as they state they wish to share the large amount of excitement they have received from businesses for their product.,2020-04-22
90,SwimmingJunky,fo7r5pk,/r/pennystocks/comments/g67eri/another_decn_question/fo7r5pk/,11,That's why stop loss is your friend.,2020-04-22
91,myforte322,fo7r95n,/r/pennystocks/comments/g65nc1/decn/fo7r95n/,1,There you have it ✊,2020-04-22
92,[deleted],fo7raja,/r/pennystocks/comments/g67fi7/decn_press_release/fo7raja/,1,[deleted],2020-04-22
93,Cafesipper,fo7rd5x,/r/pennystocks/comments/g67eri/another_decn_question/fo7rd5x/,3,Yup!,2020-04-22
94,WallStResearch-Bot,fo7rdin,/r/pennystocks/comments/g67cqg/oas/fo7rdin/,1,"I have crossposted this post to:

/r/WallStreetResearch/comments/g67h0n/oas_4222020/

I am a bot and this action was performed automatically. Please contact u_sutterismine to have this subreddit blacklisted.",2020-04-22
95,myforte322,fo7rdnv,/r/pennystocks/comments/g65nc1/decn/fo7rdnv/,1,Why you bringing up old shit? Lol,2020-04-22
96,bighead-100,fo7rg7r,/r/pennystocks/comments/g67eri/another_decn_question/fo7rg7r/,6,"Mike DeWine the Ohio hovener is actively talking about a finger prick test that will be announced tomorrow that that has partnered with Ohio that is a gamer changer in contact tracing wonder what comp at is making an announcement tomorrow that is a finger prick test DECN 


https://www.ideastream.org/gov-mike-dewine-coronavirus-update-april-22-2020",2020-04-22
97,jacobsawyerr,fo7rj0r,/r/pennystocks/comments/g67fi7/decn_press_release/fo7rj0r/,2,I’ve been seeing 10:15 am pacific time,2020-04-22
98,fluxburn65,fo7rkdn,/r/pennystocks/comments/g65q7a/i_couldnt_wait_till_tomorrow/fo7rkdn/,-2,"my penny stocks are fun right? lol I have like hundreds of trillions in the stock market. LOL, cheers from America this time, Jesus FUKING CHrist",2020-04-22
99,TheRebelliousSpire,fo7rm2v,/r/pennystocks/comments/g65q7a/i_couldnt_wait_till_tomorrow/fo7rm2v/,1,"&gt;As the \[coronavirus\]pandemic continues, a new \[COVID-19 test\]has been authorized by the U.S. Food and Drug Administration.  
&gt;  
&gt;The new test allows for patients to collect their own samples using  **Pixel by LabCorp** COVID-19 Test home collection kits that they would then  mail to a lab for testing, according to an \[FDA announcement\](Tuesday.

&amp;#x200B;

[https://www.ctvnews.ca/health/coronavirus/u-s-fda-approves-first-at-home-covid-19-test-1.4905616](https://www.ctvnews.ca/health/coronavirus/u-s-fda-approves-first-at-home-covid-19-test-1.4905616)",2020-04-22
100,akkinney07,fo7rorz,/r/pennystocks/comments/g67fi7/decn_press_release/fo7rorz/,2,Thank you! Fingers will be crossed for sure.,2020-04-22
101,Melarious1,fo7rr42,/r/pennystocks/comments/g65bjk/decn_exit_strategy/fo7rr42/,5,Damn looking at the chart I'm kicking myself for not finding this earlier. Congrats to those that did.,2020-04-22
102,IceNineOmega,fo7rvx3,/r/pennystocks/comments/g67cqg/oas/fo7rvx3/,1,I've read a couple reports over the last few days saying that they have enough capital to get to the end of the year but 2022 could be really rough on them if oil prices dont get back over 60$ a barrel.  which was the average price in 2018,2020-04-22
103,bighead-100,fo7s16i,/r/pennystocks/comments/g67fi7/decn_press_release/fo7s16i/,7,"The Ohio Governor is talking about a finger prick test that will be released tomorrow. The only company that has a new release tomorrow in regards to this is DECN 


https://www.ideastream.org/gov-mike-dewine-coronavirus-update-april-22-2020",2020-04-22
104,FearoTheFearless,fo7s1d5,/r/pennystocks/comments/g67eri/another_decn_question/fo7s1d5/,2,timestamp?,2020-04-22
105,MoltenCare,fo7s1wy,/r/pennystocks/comments/g65bjk/decn_exit_strategy/fo7s1wy/,2,Hey man I understand if you don’t want to chase but in all honesty there’s still time. Will probably run up into close and on good news tomorrow too,2020-04-22
106,bighead-100,fo7s2o5,/r/pennystocks/comments/g67eri/another_decn_question/fo7s2o5/,3,It’s live right now,2020-04-22
107,[deleted],fo7s439,/r/pennystocks/comments/g67fi7/decn_press_release/fo7s439/,-2,[deleted],2020-04-22
108,[deleted],fo7s4sa,/r/pennystocks/comments/g67eri/another_decn_question/fo7s4sa/,-3,[deleted],2020-04-22
109,JohnnyLakefront,fo7s4u5,/r/pennystocks/comments/g65bjk/decn_exit_strategy/fo7s4u5/,1,"i don't think they said what time. It's normally then, but the last announcement was earlier.

I kind of expect it at market open",2020-04-22
110,bighead-100,fo7s7iu,/r/pennystocks/comments/g67eri/another_decn_question/fo7s7iu/,1,It’s live right now the very last question of today’s news conference talks about the finger prick announcement tomorrow,2020-04-22
111,akkinney07,fo7sab0,/r/pennystocks/comments/g67fi7/decn_press_release/fo7sab0/,4,Wow seems like someone missed the boat.  Smh.  I still think there’s time to jump in tho!,2020-04-22
112,akkinney07,fo7sb9s,/r/pennystocks/comments/g67fi7/decn_press_release/fo7sb9s/,1,Thank you!,2020-04-22
113,[deleted],fo7si7w,/r/pennystocks/comments/g67fi7/decn_press_release/fo7si7w/,2,[deleted],2020-04-22
114,DerivativeOf0,fo7sid4,/r/pennystocks/comments/g67fi7/decn_press_release/fo7sid4/,5,"This is huge news, omfg. I should’ve bought more shares. I’m so fucking clueless.",2020-04-22
115,BKNY75,fo7sk4o,/r/pennystocks/comments/g67eri/another_decn_question/fo7sk4o/,2,"This could also be a huge pump and dump. Generate excitement today and it crashes tomorrow when the announce the FDA said no. 

Like I said, I hold positions in DECN. 

I’m a believer in DECN. 

But I’m an even bigger believer in expectation management.",2020-04-22
116,akkinney07,fo7sqvb,/r/pennystocks/comments/g67fi7/decn_press_release/fo7sqvb/,0,"I got in 2,000 at $0.08.  I’m also good.  

Maybe I like to see who takes time out of there day to get mad about a reddit post. Found one.",2020-04-22
117,ama_gladiator,fo7sxh5,/r/pennystocks/comments/g67eri/another_decn_question/fo7sxh5/,7,There’d be a bunch of new lambo’s for sale. Lol.,2020-04-22
118,SlimCharlesFromBmore,fo7szl5,/r/pennystocks/comments/g65poc/ghsi_conference_live_get_in_on_the_dip/fo7szl5/,1,RIP,2020-04-22
119,gangstamengster,fo7t5tq,/r/pennystocks/comments/g67fi7/decn_press_release/fo7t5tq/,1,Their*,2020-04-22
120,akkinney07,fo7t889,/r/pennystocks/comments/g67fi7/decn_press_release/fo7t889/,-2,Anotha one.,2020-04-22
121,ShitPostGuy,fo7tcbh,/r/pennystocks/comments/g67qcs/decn_or_pctl/fo7tcbh/,2,"If the DECN news tomorrow is FDA approval, there’s room for it to climb. If not it will probably drop to at least 30 cents.",2020-04-22
122,[deleted],fo7td4z,/r/pennystocks/comments/g67qcs/decn_or_pctl/fo7td4z/,1,[removed],2020-04-22
123,cowboywayne14,fo7tdgp,/r/pennystocks/comments/g67qcs/decn_or_pctl/fo7tdgp/,6, Both,2020-04-22
124,JohnLouis24,fo7tf7s,/r/pennystocks/comments/g67qcs/decn_or_pctl/fo7tf7s/,2,PCTL no clue... I would've said too late for DECN this morning but the way things are going I would probably hop in before closing regardless of price. With the big news coming out tomorrow I see a lot of people hopping in after-hours/pre-market.,2020-04-22
125,Drap303,fo7tlar,/r/pennystocks/comments/g65q7a/i_couldnt_wait_till_tomorrow/fo7tlar/,3,hahahaha this is great.,2020-04-22
126,Synseer83,fo7ts6f,/r/pennystocks/comments/g67eri/another_decn_question/fo7ts6f/,1,I see what u did there.,2020-04-22
127,Melarious1,fo7tsj9,/r/pennystocks/comments/g65bjk/decn_exit_strategy/fo7tsj9/,2,That fear of missing out is a MF 😂 I'll have to take a closer look.,2020-04-22
128,whiterhinoqueef,fo7tu6h,/r/pennystocks/comments/g67qcs/decn_or_pctl/fo7tu6h/,1,I don’t think it necessarily has to be FDA approval tomorrow just any good news,2020-04-22
129,alexesver,fo7tus6,/r/pennystocks/comments/g67fi7/decn_press_release/fo7tus6/,2,"Oh man. 
This is huge. I don’t know who else it could be other then DECN",2020-04-22
130,Tmac1066,fo7tytm,/r/pennystocks/comments/g67myu/xspa/fo7tytm/,2,Yup 1500 shares at .53. Not sure how I feel either. All the rest of my stocks are doing surprisingly well so it makes up for the lack of profit in XSPA,2020-04-22
131,pat1122,fo7u0i7,/r/pennystocks/comments/g65q7a/i_couldnt_wait_till_tomorrow/fo7u0i7/,21,"I wasn’t sold on this early on and didnt want to get in around .20’s. I’m on the sidelines cheering for you fucks, hope you all make some cash tomorrow. Just don’t forget, buy the rumor sell the news, don’t get greedy. Good luck all",2020-04-22
132,Bluetrees44,fo7u2f6,/r/pennystocks/comments/g67cqg/oas/fo7u2f6/,1,"Been holding for a couple week now, hoping for a jump tomorrow",2020-04-22
133,justusingredditUSA,fo7u4m0,/r/pennystocks/comments/g67t8j/this_is_just_600_shares_of_decn_i_feel_bad_for/fo7u4m0/,8,.40 now... tomorrow is Christmas.,2020-04-22
134,ShitPostGuy,fo7u5e8,/r/pennystocks/comments/g67qcs/decn_or_pctl/fo7u5e8/,3,The entire price movement so far has been on the expectation of good news. If it’s not as good as people are hoping the price will drop.,2020-04-22
135,[deleted],fo7u9hg,/r/pennystocks/comments/g65q7a/i_couldnt_wait_till_tomorrow/fo7u9hg/,1,[removed],2020-04-22
136,jojow77,fo7ua4d,/r/pennystocks/comments/g65bjk/decn_exit_strategy/fo7ua4d/,1,And this is bad why?,2020-04-22
137,JoeBarth22,fo7ue8v,/r/pennystocks/comments/g67qcs/decn_or_pctl/fo7ue8v/,1,you can still get into DECN now and make nice profit tomorrow,2020-04-22
