,author,id,url,score,text,date
86,WeekendTacticalSuppl,ds4uzns,/r/pennystocks/comments/7njxkb/a_case_for_myhi/ds4uzns/,1,"Cashed out. Missed the top, but wanted to lock in the gains before they tumbled any more. 79% gain in 1 day, not bad.. not bad at all.

Maybe it skyrockets more this afternoon, who knows, but I try not to get greedy. If I have a nice gain, I would rather take it then gamble any more.",2018-01-02
87,[deleted],ds52ymu,/r/pennystocks/comments/7no46r/january_02_2018_tomorrows_daily_rpennystocks/ds52ymu/,1,[deleted],2018-01-02
88,rieboldt,ds5eghd,/r/pennystocks/comments/7nmseo/sanp_has_some_low_volume_price_action_this_morning/ds5eghd/,1,Awaiting the news. ,2018-01-02
89,5Loaves2Fish1Biscuit,ds6v3cr,/r/pennystocks/comments/7npbmz/yten_possible_continuation_swing/ds6v3cr/,1,"Man INSY really gave it to me today lol, but hey it was a good tip to look into. ",2018-01-02
90,Morsyn,ds74hp7,/r/pennystocks/comments/7npbmz/yten_possible_continuation_swing/ds74hp7/,1,"Don't worry, it will come back up",2018-01-02
91,FakeNewsSupreme,ds7bssh,/r/pennystocks/comments/7npumw/azfl/ds7bssh/,1,Go back and look at the chart in August and September. Then go look at the post history at that same time range on this sub. The big days are gone. Lots of dillution and bullshit press releases. ,2018-01-02
92,slightofhand69,ds8wjll,/r/pennystocks/comments/7no46r/january_02_2018_tomorrows_daily_rpennystocks/ds8wjll/,1,70+%  today!,2018-01-02
