,author,id,url,score,text,date
0,acastillo6,fcvz5ku,/r/pennystocks/comments/ej7hti/a_few_nice_penny_stocks_to_watch_inpx_rttr_and/fcvz5ku/,4,Inpx has made me 600 dollar profit today.,2020-01-03
1,BetrayedPredator,fcwa1qp,/r/pennystocks/comments/ej8ues/so_im_extremely_new_to_stocks_and_have_a_question/fcwa1qp/,2,"Its buying / selling of the same stock on the same trade day

Being marked as a PDT is not a warning 

It blocks you from day trades unless your portfolio is above 25k",2020-01-03
2,UniqueUsername789,fcwarxc,/r/pennystocks/comments/ej7ecj/how_much_you_scrubs_make_off_inpx/fcwarxc/,2,$0,2020-01-03
3,brandeeeny,fcweaob,/r/pennystocks/comments/ej8ues/so_im_extremely_new_to_stocks_and_have_a_question/fcweaob/,1,"Oh ok, so to clarify, I bought inpx before the jump today at like 0.11, if I sell it tomorrow I'll be good and not get a mark? I'm not planning on selling, but just incase it dives I want to plan ahead without worry.",2020-01-03
4,ShaBoogy,fcwfftw,/r/pennystocks/comments/ej7hti/a_few_nice_penny_stocks_to_watch_inpx_rttr_and/fcwfftw/,2,How are you watching after hours numbers?,2020-01-03
5,BetrayedPredator,fcwg2j7,/r/pennystocks/comments/ej8ues/so_im_extremely_new_to_stocks_and_have_a_question/fcwg2j7/,3,Correct,2020-01-03
6,upvoteguy5,fcwg7we,/r/pennystocks/comments/ej7hti/a_few_nice_penny_stocks_to_watch_inpx_rttr_and/fcwg7we/,3,"Same im 41,000 in at first at 17 then at 33 and all I'm going to do is add more tomorrow if there is any small kind of dip because it's going places. I think",2020-01-03
7,acastillo6,fcwge8y,/r/pennystocks/comments/ej7hti/a_few_nice_penny_stocks_to_watch_inpx_rttr_and/fcwge8y/,2,"2,995 shares at average .14 do you follow the stock info on stocktwits?",2020-01-03
8,upvoteguy5,fcwh2l0,/r/pennystocks/comments/ej7hti/a_few_nice_penny_stocks_to_watch_inpx_rttr_and/fcwh2l0/,2,"If I said no I would be lying.

I just started 3 weeks ago and just so happen to have 5k gifted to me. And after losing 1500 I consolidated aka sold at a loss, then discover stocktwits holy fucking mother of God I instantly put all my eggs in this stock and recovered all losses to have 7k profits. I kept adding money to make money.

I do have back up safe guys like baba and TMFC just from my opinion seems safe from what I've read.

And I'm looking at tomorrow investing in NDRA I have BIOC and sold all but 200 shares because it's growth got stagnant yesterday afternoon",2020-01-03
9,brandeeeny,fcwhrpv,/r/pennystocks/comments/ej8ues/so_im_extremely_new_to_stocks_and_have_a_question/fcwhrpv/,1,Thanks :),2020-01-03
10,AuthorLRClaude,fcwk3sm,/r/pennystocks/comments/ej7ecj/how_much_you_scrubs_make_off_inpx/fcwk3sm/,1,$6,2020-01-03
11,Bobbyrage39,fcwp061,/r/pennystocks/comments/ej7ecj/how_much_you_scrubs_make_off_inpx/fcwp061/,5,"$700 , bought in at .11 , 3500 shares",2020-01-03
12,ohiamaude,fcwqtu7,/r/pennystocks/comments/ej7hti/a_few_nice_penny_stocks_to_watch_inpx_rttr_and/fcwqtu7/,2,Marketwatch,2020-01-03
13,-Mikey213,fcwwepu,/r/pennystocks/comments/ejbqh3/free_trading_app_better_than_robinhood_and_webull/fcwwepu/,6,Fuck ur link ima sign up without yours,2020-01-03
14,That_Julian,fcwwk0a,/r/pennystocks/comments/ejbqh3/free_trading_app_better_than_robinhood_and_webull/fcwwk0a/,1,Send me your link so I can use it lmao,2020-01-03
15,-Mikey213,fcwwoal,/r/pennystocks/comments/ejbqh3/free_trading_app_better_than_robinhood_and_webull/fcwwoal/,5,https://j.moomoo.com/000Lt0,2020-01-03
16,chandler_bling1,fcwzkwc,/r/pennystocks/comments/ejbbac/simple_questions_january_03_2020/fcwzkwc/,2,Can anyone recommend a good platform for trading penny stocks? I’m uk based. Thanks!,2020-01-03
17,Kbmoor,fcx1o97,/r/pennystocks/comments/ejbqh3/free_trading_app_better_than_robinhood_and_webull/fcx1o97/,0,O real tuff guy,2020-01-03
18,Kbmoor,fcx1pqp,/r/pennystocks/comments/ejbqh3/free_trading_app_better_than_robinhood_and_webull/fcx1pqp/,-3,You just confirm ur gay...keep that faggy shit off my post,2020-01-03
19,Kbmoor,fcx1tx8,/r/pennystocks/comments/ejbqh3/free_trading_app_better_than_robinhood_and_webull/fcx1tx8/,-1,Ur such a dickrider,2020-01-03
20,xpercipio,fcx37dg,/r/pennystocks/comments/ejdran/inpx_47_premarket_current_538am/fcx37dg/,13,My body is ready,2020-01-03
21,KomandoMetz,fcx3nt4,/r/pennystocks/comments/ejdran/inpx_47_premarket_current_538am/fcx3nt4/,9,dipping under .4 right now. might drop like a stone or rip through .5 and then some. be careful! pennystock after all...,2020-01-03
22,gracilejaw,fcx3nup,/r/pennystocks/comments/ejdran/inpx_47_premarket_current_538am/fcx3nup/,6,"What the heck is happening my dude 

Can we explain this? Or just magic?",2020-01-03
23,Jpaperz,fcx3pe6,/r/pennystocks/comments/ejdran/inpx_47_premarket_current_538am/fcx3pe6/,7,"Its back at .37 now, but just like yesterday it showed .197 around this time and opened at .16",2020-01-03
24,xpercipio,fcx3san,/r/pennystocks/comments/ej7hti/a_few_nice_penny_stocks_to_watch_inpx_rttr_and/fcx3san/,0,That website misspelled inpixon lol,2020-01-03
25,Jpaperz,fcx40ti,/r/pennystocks/comments/ejdran/inpx_47_premarket_current_538am/fcx40ti/,7,Black magik 👀,2020-01-03
26,gracilejaw,fcx41yq,/r/pennystocks/comments/ejdran/inpx_47_premarket_current_538am/fcx41yq/,5,"Be real with me

You think this is going to hit .03 or could we like really see $1?? Look in2 that crystal ball plz",2020-01-03
27,xpercipio,fcx48md,/r/pennystocks/comments/ejdran/inpx_47_premarket_current_538am/fcx48md/,7,02.02 dollars in 2020 says xpercipio crystal dodecahedron.,2020-01-03
28,gracilejaw,fcx49d1,/r/pennystocks/comments/ejdran/inpx_47_premarket_current_538am/fcx49d1/,3,Well that’s quite the shape,2020-01-03
29,truthlesshunter,fcx4swc,/r/pennystocks/comments/ejdran/inpx_47_premarket_current_538am/fcx4swc/,5,"if you want the honest answer, it'll run a bit today, then probably dip a bit at morning, to climb up and stabilize around these pre-market prices, then trade normally/sideways next week. If they drop a good PR or ER, it'll probably skyrocket to a $1, but who knows when that'll happen.",2020-01-03
30,Jpaperz,fcx6irz,/r/pennystocks/comments/ejdran/inpx_47_premarket_current_538am/fcx6irz/,4,"Maybe not straight to a dollar, i feel a small pullback scare coming, there was 490m volume yesterday 😱",2020-01-03
31,peteyxj93,fcx738n,/r/pennystocks/comments/ejelhv/bought_inpx_at_011/fcx738n/,5,Honestly.. I think we are all in the same thought process as you right now. That being said i believe i will buy,2020-01-03
32,KomandoMetz,fcx73rn,/r/pennystocks/comments/ejdran/inpx_47_premarket_current_538am/fcx73rn/,2,"Strong support at .38
Might open at .5 and then some",2020-01-03
33,ohiamaude,fcx7q6r,/r/pennystocks/comments/ejelhv/bought_inpx_at_011/fcx7q6r/,1,I bought back in at .28 but I wouldn't buy in here. I would need to see some confirmation first.,2020-01-03
34,jameson62,fcx8hgd,/r/pennystocks/comments/ej7hti/a_few_nice_penny_stocks_to_watch_inpx_rttr_and/fcx8hgd/,1,TD Ameritrade ThinkOrSwim,2020-01-03
35,jameson62,fcx8ikw,/r/pennystocks/comments/ej7hti/a_few_nice_penny_stocks_to_watch_inpx_rttr_and/fcx8ikw/,2,I didn't see that as the case lol but anyway...lol YOLO INPX,2020-01-03
36,peteyxj93,fcx8pqt,/r/pennystocks/comments/ej7hti/a_few_nice_penny_stocks_to_watch_inpx_rttr_and/fcx8pqt/,2,Which would you suggest over the other? It seems like INPX is going to do nothing but go up. Im so torn 😂,2020-01-03
37,Herves7,fcx8q8n,/r/pennystocks/comments/ejdran/inpx_47_premarket_current_538am/fcx8q8n/,1,Should I buy some? I got $100. Sorry I'm new to this and this is like the 5th time I've seen this PennyStock mentioned. I just placed an order with a limit of .47 cents.,2020-01-03
38,[deleted],fcx8rig,/r/pennystocks/comments/ejelhv/bought_inpx_at_011/fcx8rig/,1,[removed],2020-01-03
39,SentientReptile,fcx94sf,/r/pennystocks/comments/ejelhv/bought_inpx_at_011/fcx94sf/,1,The good thing is that it's making money on its own now and I already got my initial investment plus a little extra back. It's just so hard lol.,2020-01-03
40,[deleted],fcx955x,/r/pennystocks/comments/ejelhv/bought_inpx_at_011/fcx955x/,1,[removed],2020-01-03
41,jameson62,fcx98w3,/r/pennystocks/comments/ej7hti/a_few_nice_penny_stocks_to_watch_inpx_rttr_and/fcx98w3/,1,lol . it will until it won't,2020-01-03
42,[deleted],fcx9d7a,/r/pennystocks/comments/ej8ues/so_im_extremely_new_to_stocks_and_have_a_question/fcx9d7a/,1,[removed],2020-01-03
43,thanx4thememories,fcx9t5k,/r/pennystocks/comments/ejelhv/bought_inpx_at_011/fcx9t5k/,1,I fought with that thought all night but set my limit buy so we will see!,2020-01-03
44,skinMARKdraws,fcxaamt,/r/pennystocks/comments/ejdran/inpx_47_premarket_current_538am/fcxaamt/,2,Yooo. Volume is at 490 million,2020-01-03
45,peteyxj93,fcxaqqt,/r/pennystocks/comments/ejelhv/bought_inpx_at_011/fcxaqqt/,1,Check out ZN. Moved .11 over night,2020-01-03
46,Bobbyrage39,fcxbn7z,/r/pennystocks/comments/ejdran/inpx_47_premarket_current_538am/fcxbn7z/,1,"I want to buy more, curious what it does premarket",2020-01-03
47,Bobbyrage39,fcxbrw8,/r/pennystocks/comments/ejelhv/bought_inpx_at_011/fcxbrw8/,1,I want to buy more. Waiting to see what it does pre market,2020-01-03
48,anarchofundalist,fcxc4lq,/r/pennystocks/comments/ejdran/inpx_47_premarket_current_538am/fcxc4lq/,3,I’m so depressed.,2020-01-03
49,Jpaperz,fcxc9ay,/r/pennystocks/comments/ejdran/inpx_47_premarket_current_538am/fcxc9ay/,6,"Dont be, there’s opportunity in the market everywhere if you look in the right places, sometimes you need to venture off.

Dont let 1 trade get you down, YoY im down 13k from TRNX and SPY calls expiring. Learn from mistakes, dont let the fomo get you down on a loss, im still holding TRNX and the waiting on freeshare pricing. 

Be safe",2020-01-03
50,Jpaperz,fcxch3b,/r/pennystocks/comments/ejelhv/bought_inpx_at_011/fcxch3b/,1,"Me personally, im buying more, but its going to be hard to find an entry, watch the candle stick volume and keep in mind yesterday was 490m volume. 

Me also:
Dont chase a trade if you are uncertain",2020-01-03
51,Johan47z,fcxdeg2,/r/pennystocks/comments/ejdran/inpx_47_premarket_current_538am/fcxdeg2/,2,I think today is the day the monies arrive!,2020-01-03
52,pyropupper,fcxeayw,/r/pennystocks/comments/ejbbac/simple_questions_january_03_2020/fcxeayw/,1,"Basically the same to what Chandler asked except for NA, preferably Canada. Looking to get over my fears of investing. I only live once, so I might as well shoot my shot at getting some bread.",2020-01-03
53,pyropupper,fcxf3ge,/r/pennystocks/comments/ejbqh3/free_trading_app_better_than_robinhood_and_webull/fcxf3ge/,2,"Oh, you're homophobic. Ew.",2020-01-03
54,DocMcFortuite,fcxfu04,/r/pennystocks/comments/ejelhv/bought_inpx_at_011/fcxfu04/,2,It’s at .50 now!,2020-01-03
55,No_Credibility,fcxg3y9,/r/pennystocks/comments/ejdran/inpx_47_premarket_current_538am/fcxg3y9/,2,".53 now, what a wild ride so far",2020-01-03
56,john19549,fcxgr3a,/r/pennystocks/comments/ejelhv/bought_inpx_at_011/fcxgr3a/,0,no telling what it would do at this point. it's allmost at .55. could keep going up it could be at it's ceiling. if it keeps going up it could reach a dollar. depends on what kind of risks you like taking.,2020-01-03
57,KubsterCSGO,fcxhabm,/r/pennystocks/comments/ejdran/inpx_47_premarket_current_538am/fcxhabm/,10,"“Bought” shares last night and assumed it would be filled by 9:30. It doesn’t get filled then so I panic buy - right at 0.62, the day’s high so far 🤦‍♂️",2020-01-03
58,Jpaperz,fcxhccq,/r/pennystocks/comments/ejdran/inpx_47_premarket_current_538am/fcxhccq/,4,ALL GOOD THOUGH LETS GOO,2020-01-03
59,MVPkraty,fcxhcen,/r/pennystocks/comments/ejdran/inpx_47_premarket_current_538am/fcxhcen/,1,What’s next? What’s the new one to explode?,2020-01-03
60,PassmetheToastplez,fcxhcw0,/r/pennystocks/comments/ej7ecj/how_much_you_scrubs_make_off_inpx/fcxhcw0/,1,$25 cause I panicked.,2020-01-03
61,Jpaperz,fcxhirm,/r/pennystocks/comments/ejdran/inpx_47_premarket_current_538am/fcxhirm/,3,TTNP RTTR ONTX OCGN DFFN also catching my interest. Riding out INPX,2020-01-03
62,KubsterCSGO,fcxhkpq,/r/pennystocks/comments/ejdran/inpx_47_premarket_current_538am/fcxhkpq/,3,"Honestly hoping for the $1 point, can’t believe I missed out yesterday and the afterhours",2020-01-03
63,pyropupper,fcxhpmu,/r/pennystocks/comments/ejdran/inpx_47_premarket_current_538am/fcxhpmu/,2,I think it will reach 0.7 before the end of the day. I've already seen it hit 0.65,2020-01-03
64,Johan47z,fcxhpo7,/r/pennystocks/comments/ejdran/inpx_47_premarket_current_538am/fcxhpo7/,2,"I sold 1800 at 53 with 26 buy in, and i bought in 100 shares again around 49

Looks like it might hit high 70s",2020-01-03
65,rhodrirhodri,fcxht4v,/r/pennystocks/comments/ejdran/inpx_47_premarket_current_538am/fcxht4v/,1,Might be worth waiting. Looks like its stabilizing at .5 and starting to dip a bit from there.,2020-01-03
66,pyropupper,fcxhuf6,/r/pennystocks/comments/ejdran/inpx_47_premarket_current_538am/fcxhuf6/,2,Damn I sure hope it hikes for your sake pal. I'd hop in the INPX money train but at this high of a price I can't risk it. Especially with it constantly going up and down right now. Going to either wait for a crash or some stability.,2020-01-03
67,Crowsale000,fcxi6aq,/r/pennystocks/comments/ejgdqz/inpx_hovering_at_55_62_jan32020/fcxi6aq/,5,3 dollars by when that’s ridiculous,2020-01-03
68,taiman8,fcxi7hj,/r/pennystocks/comments/ejdran/inpx_47_premarket_current_538am/fcxi7hj/,1,"I bought it at .47 cents already lol fuck
IDK what I'm doing",2020-01-03
69,peteyxj93,fcxiadx,/r/pennystocks/comments/ejgdqz/inpx_hovering_at_55_62_jan32020/fcxiadx/,7,And the panic begins lol,2020-01-03
70,rhodrirhodri,fcxiaqw,/r/pennystocks/comments/ejdran/inpx_47_premarket_current_538am/fcxiaqw/,1,"Haha same but I may have spoken too soon, it’s still above .5 most of the time!",2020-01-03
71,pyropupper,fcxif6q,/r/pennystocks/comments/ejgdqz/inpx_hovering_at_55_62_jan32020/fcxif6q/,4,"It just tanked back down to 0.52, lowkey kinda home it drops like a rock so I can buy in Lmao",2020-01-03
72,TheM0zart,fcxig7o,/r/pennystocks/comments/ejdran/inpx_47_premarket_current_538am/fcxig7o/,2,!remindme 5days,2020-01-03
73,europeein-OG,fcxigpm,/r/pennystocks/comments/ejgdqz/inpx_hovering_at_55_62_jan32020/fcxigpm/,5,I’m debating on selling at 1.00,2020-01-03
74,LemurLm,fcxigyc,/r/pennystocks/comments/ejgdqz/inpx_hovering_at_55_62_jan32020/fcxigyc/,4,I'm a newbie so I don't know if this was worth it/smart but I bought at around .4475 and sold at around 0.56. I think it will dip soon and maybe create an opportunity to buy again.,2020-01-03
75,peteyxj93,fcxih8t,/r/pennystocks/comments/ejgdqz/inpx_hovering_at_55_62_jan32020/fcxih8t/,3,Looking like a strong possibility!,2020-01-03
76,KubsterCSGO,fcxipiy,/r/pennystocks/comments/ejdran/inpx_47_premarket_current_538am/fcxipiy/,3,0.46 lol,2020-01-03
77,pyropupper,fcxir1y,/r/pennystocks/comments/ejgdqz/inpx_hovering_at_55_62_jan32020/fcxir1y/,3,"It's currently dropping down to 0.47, I'm waiting until it stabilizes.",2020-01-03
78,pyropupper,fcxis66,/r/pennystocks/comments/ejgdqz/inpx_hovering_at_55_62_jan32020/fcxis66/,4,It will not reach $3.00 LOL its currently crashing,2020-01-03
79,Jpaperz,fcxito0,/r/pennystocks/comments/ejdran/inpx_47_premarket_current_538am/fcxito0/,3,"Dont be scare of dips, watch candle volume, literally 19m bought and re sold off the last 30 mins, hold that shit",2020-01-03
80,pyropupper,fcxj4ff,/r/pennystocks/comments/ejgdqz/inpx_hovering_at_55_62_jan32020/fcxj4ff/,1,I agree but that's the rumor I heard,2020-01-03
81,Rhoff8713,fcxj5vf,/r/pennystocks/comments/ejgdqz/inpx_hovering_at_55_62_jan32020/fcxj5vf/,4,It’s done a huge dip the last day before hitting its daily high ... of it hits .44 buy the shit out of it,2020-01-03
82,BKNY75,fcxjg00,/r/pennystocks/comments/ejelhv/bought_inpx_at_011/fcxjg00/,1,Happy cake day!,2020-01-03
83,pyropupper,fcxjh8r,/r/pennystocks/comments/ejgdqz/inpx_hovering_at_55_62_jan32020/fcxjh8r/,1,Think that is a safe bet?,2020-01-03
84,john19549,fcxjlpr,/r/pennystocks/comments/ejgdqz/inpx_hovering_at_55_62_jan32020/fcxjlpr/,2,"don't know that i would hold all the way to 3. maybe bail at 1.50, and thats pushing it. be hard pressed to dump it at 3.",2020-01-03
85,Rhoff8713,fcxjp4s,/r/pennystocks/comments/ejgdqz/inpx_hovering_at_55_62_jan32020/fcxjp4s/,5,"I’m not an expert by any means. Any. But I got in at .11 , sold at 28. Then i got back in at .26 and have been riding ever since. Yesterday I almost pulled the trigger but I’m glad I didn’t. I’m gonna ride it out.  Don’t see it tanking unless something huge happens news wise. Also the volume hasn’t spiked yet which has me spooked as well.",2020-01-03
86,Crowsale000,fcxjso5,/r/pennystocks/comments/ejgdqz/inpx_hovering_at_55_62_jan32020/fcxjso5/,2,The real question is what the target rebuy price,2020-01-03
87,ikahntspehll,fcxk3bd,/r/pennystocks/comments/ejgdqz/inpx_hovering_at_55_62_jan32020/fcxk3bd/,3,"Got in at $.075 and sold enough this morning to cover the initial buy. Now I’m just along for the ride.

To the moon!

Edit: spelling",2020-01-03
88,pyropupper,fcxkcxh,/r/pennystocks/comments/ejgdqz/inpx_hovering_at_55_62_jan32020/fcxkcxh/,0,"Hey I pm'ed you, looking to ask some questions if that's cool?",2020-01-03
89,Winstonsama,fcxkvw0,/r/pennystocks/comments/ejdran/inpx_47_premarket_current_538am/fcxkvw0/,4,It's down to .41 might be a good time to buy in if you are looking to.,2020-01-03
90,Kurg3n42,fcxl68i,/r/pennystocks/comments/ej7ecj/how_much_you_scrubs_make_off_inpx/fcxl68i/,1,Ouch. But still a profit!!,2020-01-03
91,Bobbyrage39,fcxlcaa,/r/pennystocks/comments/ejelhv/bought_inpx_at_011/fcxlcaa/,2,Thank you!,2020-01-03
92,Kbmoor,fcxlkfj,/r/pennystocks/comments/ejbqh3/free_trading_app_better_than_robinhood_and_webull/fcxlkfj/,-1,Go suck 1,2020-01-03
93,H2OhYeahh,fcxml0c,/r/pennystocks/comments/ejfftf/bio_stocks_affected_by_iran_incident/fcxml0c/,1,"The market in general will take a hit when investors get cold feet. I would say BIO stocks should be fine for now. News outlets like to make everything sound like the end of the world unless the world is actually ending. Escalating tensions in the middle east is good for Raytheon, General Dynamics and other weapons manufacturers. Everything is going tits up once the Trump bubble pops though....be ready to pull out.",2020-01-03
94,pyropupper,fcxmna2,/r/pennystocks/comments/ejbqh3/free_trading_app_better_than_robinhood_and_webull/fcxmna2/,2,Already do sweaty ;),2020-01-03
95,thehairyjew69,fcxmzmm,/r/pennystocks/comments/ejdran/inpx_47_premarket_current_538am/fcxmzmm/,1,"Invested yesterday at .31, very new to this. Woke up this morning to a surprising profit of $140. I'm very interested in holding but also would hate to see this drop down. Has anyone heard of any future PR? I keep hearing once INPX does another PR it'll hit a dollar, thoughts?",2020-01-03
96,Kbmoor,fcxn4sg,/r/pennystocks/comments/ejbqh3/free_trading_app_better_than_robinhood_and_webull/fcxn4sg/,0,Smdh,2020-01-03
97,Memephis_Matt,fcxnn0j,/r/pennystocks/comments/ejgdqz/inpx_hovering_at_55_62_jan32020/fcxnn0j/,2,"I am the worst at selling and buying back.  I pick the worst times.  I started this week with 26,900 shares.  Now I'm down to 23,000.",2020-01-03
98,leftnut027,fcxo6ck,/r/pennystocks/comments/ejgdqz/inpx_hovering_at_55_62_jan32020/fcxo6ck/,1,Didn’t CNN project it will hit $299?,2020-01-03
99,Flintml,fcxoa0s,/r/pennystocks/comments/ejdran/inpx_47_premarket_current_538am/fcxoa0s/,11,"I'll be real with you. If you're new to this, as in trading, learn to take your profits and not look at the ""could be."" You made a quick buck, and now you have a better foundation to start investing in other things. Don't EVER look at the ""could be."" It could go to $1, or it could tank down to 10 cents. Just remember, with such a high volume, there are many, many larger stock brokers out there loaded up and waiting. They prey on this sort of news for the people jumping in with FOMO (Fear of missing out) so that they can dump their shares, collect their profits, and then go on to the next one. At the end of the day, you do what you feel like you should, but I'd suggest selling off for some profit and keeping some in the portfolio. The ones left in the portfolio you essentially get for ""free"" since you got your initial investment back and made a few bucks. Best of luck!",2020-01-03
100,mmtapez239,fcxocdq,/r/pennystocks/comments/ejdran/inpx_47_premarket_current_538am/fcxocdq/,-1,Tbh it was 136m volume just an hour ago plus it’s average is 120m now it’s 216m it’ll hit a dollar later today,2020-01-03
101,Memephis_Matt,fcxodo1,/r/pennystocks/comments/ej7hti/a_few_nice_penny_stocks_to_watch_inpx_rttr_and/fcxodo1/,2,"Robinhood says RTTR only has 7 employees,  I was tempted to buy in but that stopped me.  Is there a good reason why I shouldn't let that bother me?",2020-01-03
102,leftnut027,fcxoipf,/r/pennystocks/comments/ejbbac/simple_questions_january_03_2020/fcxoipf/,2,"I know it’s not the most popular but I would check out Robinhood, it’s very easy to use on phone.",2020-01-03
103,Penguins_in_Sweaters,fcxp2np,/r/pennystocks/comments/ejdran/inpx_47_premarket_current_538am/fcxp2np/,6,"I hope it goes to the moon for everyone that is still invested.  I got out this morning for a modest gain.  If it wasn’t for the INPX posts on this sub yesterday, I never would’ve known that INPX existed, so I’m thankful and happy for an extra $300.  Cheers and good luck!",2020-01-03
104,[deleted],fcxpajx,/r/pennystocks/comments/ejdran/inpx_47_premarket_current_538am/fcxpajx/,1,[deleted],2020-01-03
105,Jpaperz,fcxpc3s,/r/pennystocks/comments/ejdran/inpx_47_premarket_current_538am/fcxpc3s/,1,"Cheers 

I wasted 2 day trades. 

Out at .55 in at .52 

out at .49 in at .50

Was waiting for another pullback to .41 but then i realized i only lost 100 shares so now im saving the 3rd day trade into next week for somethin else or might not use it, initial average was .1701 though",2020-01-03
106,[deleted],fcxpd9v,/r/pennystocks/comments/ejdran/inpx_47_premarket_current_538am/fcxpd9v/,1,[deleted],2020-01-03
107,Makombi,fcxrfj8,/r/pennystocks/comments/ejdran/inpx_47_premarket_current_538am/fcxrfj8/,4,"Take heed of this advice, very important for beginners.",2020-01-03
108,Jpaperz,fcxsnpm,/r/pennystocks/comments/ejgdqz/inpx_hovering_at_55_62_jan32020/fcxsnpm/,1,With a 52 week hold,2020-01-03
109,Stereodog,fcxve65,/r/pennystocks/comments/ejdran/inpx_47_premarket_current_538am/fcxve65/,1,What is the most affordable way for me to purchase a penny stock?,2020-01-03
110,Bobbyrage39,fcxwumg,/r/pennystocks/comments/eji6eg/is_anyone_watching_ontx/fcxwumg/,6,Hopefully back into the .60s where I bought it,2020-01-03
111,[deleted],fcxwyx9,/r/pennystocks/comments/ejdran/inpx_47_premarket_current_538am/fcxwyx9/,1,[deleted],2020-01-03
112,Winstonsama,fcxx3ix,/r/pennystocks/comments/ejdran/inpx_47_premarket_current_538am/fcxx3ix/,1,"Use any commission free trading platform (i.e Robinhood, Webull, etc.) After that invest what ever amount your risk tolerance is.",2020-01-03
113,steveissuperman,fcxxg6d,/r/pennystocks/comments/ejelhv/bought_inpx_at_011/fcxxg6d/,0,"Nope, you missed it. Did better than I did though, I sold early too. The hype is fading, and while the company has some things going for it, it still has hurdles ahead and a lot to prove. Share price will fade back to the 20s again soon.",2020-01-03
114,elliottttttt,fcxxr51,/r/pennystocks/comments/ejdran/inpx_47_premarket_current_538am/fcxxr51/,1,I bought 2000 shares this morning at 48 and sold them off for 59 for a good $200 profit.  Thanks!  Trying to jump back in at 38 but as soon as it gets to 40 it goes back up,2020-01-03
115,tdnewmas,fcxya0k,/r/pennystocks/comments/ejdran/inpx_47_premarket_current_538am/fcxya0k/,1,"I bought both NFLX and TSLA back in 2013 and sold them both off for a 30%+ profit back, never to re-open my positions with them.",2020-01-03
116,MilkmanBlazer,fcxz1dr,/r/pennystocks/comments/eji6eg/is_anyone_watching_ontx/fcxz1dr/,1,Classic DD.,2020-01-03
117,DRsheesh,fcxzbe8,/r/pennystocks/comments/ejdran/inpx_47_premarket_current_538am/fcxzbe8/,4,Locked in $60K of profits. Still holding 20K of shares to see where it goes. Unreal start to the new year.,2020-01-03
118,DRsheesh,fcxziul,/r/pennystocks/comments/eji6eg/is_anyone_watching_ontx/fcxziul/,6,This will hit $0.60’s soon. Once actual news drops regarding NDA in China and US. Also the Phase 3 success this will hit $1 in the next 3 months. I’m long.,2020-01-03
119,Bobbyrage39,fcxzrwl,/r/pennystocks/comments/eji6eg/is_anyone_watching_ontx/fcxzrwl/,1,"Wrong stock, I was looking at OGEN. I'm in on ONTX at .49. Only 130 shares. One of the stocks I bought with the first $500 I started playing with a few months back",2020-01-03
120,MilkmanBlazer,fcy0d0r,/r/pennystocks/comments/eji6eg/is_anyone_watching_ontx/fcy0d0r/,1,Currently waiting on a couple of mine to rise back to entry point.,2020-01-03
121,europeein-OG,fcy1u47,/r/pennystocks/comments/ejiqab/1k_two_days_in_a_row/fcy1u47/,1,I’ll have to watch it,2020-01-03
122,skchan2,fcy1x6u,/r/pennystocks/comments/ejgdqz/inpx_hovering_at_55_62_jan32020/fcy1x6u/,3,"might  be trying to hit 1.618 on the extended fib (\~$0.70)

also haven't gotten a bear signal yet

[https://www.tradingview.com/x/LJSjsCpl/](https://www.tradingview.com/x/LJSjsCpl/)",2020-01-03
123,[deleted],fcy1zx9,/r/pennystocks/comments/ejdran/inpx_47_premarket_current_538am/fcy1zx9/,1,[deleted],2020-01-03
