,title,id,author,url,score,num_comments,text,date,link
0,"Report out on $IGPK: ""Integrated Cannabis Solutions (OTC:IGPK) Announces Plans To Register To OTCQB To Become Fully Reporting Issuer &amp; Maintain PPS Requirement Of $0.01""",d8094s,Pablo_trader,https://www.reddit.com/r/pennystocks/comments/d8094s/report_out_on_igpk_integrated_cannabis_solutions/,6,5,"[http://wallstbulletin.com/2019/09/integrated-cannabis-solutions-otcigpk-announces-plans-to-register-to-otcqb-to-become-fully-reporting-issuer-maintain-pps-requirement-of-0-01/](http://wallstbulletin.com/2019/09/integrated-cannabis-solutions-otcigpk-announces-plans-to-register-to-otcqb-to-become-fully-reporting-issuer-maintain-pps-requirement-of-0-01/)

&amp;#x200B;

&gt;Currently, the price of the stock is sitting at $0.002 and since OTCQB requires the issuing company to have a PPS of at least $0.01, analysts are keen to see what the company has to release in terms of news/updates in order to reach the mandatory $0.01 listing requirement. The CEO if IGPK also ruled out a Reverse Split on Friday, with the following statement.   
&gt;  
&gt;*A company doing a* r/S *files an Amended and Restated of the Articles of the Company and they make reference to the* r/S*.*  [*$IGPK*](https://twitter.com/search?q=%24IGPK&amp;src=cashtag_click) *ONLY amended the Preferred. The Company is not planning on anything outside of building the Company is the Cannabis space and CBD in WI right now.*",2019-09-23,https://www.reddit.com/r/pennystocks/comments/d8094s/report_out_on_igpk_integrated_cannabis_solutions/
1,What is the best brokerage in Canada for short selling penny stocks in NASDAQ ?,d876y4,AetherLenz,https://www.reddit.com/r/pennystocks/comments/d876y4/what_is_the_best_brokerage_in_canada_for_short/,1,0,[removed],2019-09-23,https://www.reddit.com/r/pennystocks/comments/d876y4/what_is_the_best_brokerage_in_canada_for_short/
2,OTC #Watchlist 9/23 📈🚀💰,d86irq,miamidd12,https://www.reddit.com/r/pennystocks/comments/d86irq/otc_watchlist_923/,11,5,"

$AABB $ABPR $ALYI $ARSN $ASKH $AURI $BEMG $BZTG $CMGO $DEVM $DLYT $DRVD $FUTS $HMLA $HZHI $IBGR $IGMB $IKTO $INKW $INND $INSO $KAVL $KALY $LRDR $MCTC $MILV $NSPX $OZSC $QPRC $REPO $SGMD $SIML $SOAN $TCEL $TSOI $UNRG $VNUE $VRUS $XALL 

https://t.me/stock_alerts",2019-09-23,https://www.reddit.com/r/pennystocks/comments/d86irq/otc_watchlist_923/
3,Must Read Report on $CRFT Before the Opening Bell,d85ug2,MapleLeafInvestor,https://www.reddit.com/r/pennystocks/comments/d85ug2/must_read_report_on_crft_before_the_opening_bell/,0,2,"Craft cannabis is in a position for massive growth; check out Pasha Brands report before opening bell- 

 [https://www.smallcapcanada.com/report/](https://www.smallcapcanada.com/report/)",2019-09-23,https://www.reddit.com/r/pennystocks/comments/d85ug2/must_read_report_on_crft_before_the_opening_bell/
4,3 Smallcap Biotech Stocks To Watch CPRX PMCB EYPT,d85r9g,markiemark621,https://www.reddit.com/r/pennystocks/comments/d85r9g/3_smallcap_biotech_stocks_to_watch_cprx_pmcb_eypt/,3,2,[https://stock-watch.market/rjx9t](https://stock-watch.market/rjx9t),2019-09-23,https://www.reddit.com/r/pennystocks/comments/d85r9g/3_smallcap_biotech_stocks_to_watch_cprx_pmcb_eypt/
5,Question about robinhood,d82idg,21421195211212,https://www.reddit.com/r/pennystocks/comments/d82idg/question_about_robinhood/,1,0,"Can you short pennystocks on there? I've been reading that you could, but I haven't found any feature.",2019-09-23,https://www.reddit.com/r/pennystocks/comments/d82idg/question_about_robinhood/
6,$TEUM Dropped Congrats Longs/Calls,d88xjb,21421195211212,https://www.reddit.com/r/pennystocks/comments/d88xjb/teum_dropped_congrats_longscalls/,1,0,You played yourselves.,2019-09-23,https://www.reddit.com/r/pennystocks/comments/d88xjb/teum_dropped_congrats_longscalls/
7,$HDII $ZMRK $STTH,d88sqs,CaptainWeee,https://www.reddit.com/r/pennystocks/comments/d88sqs/hdii_zmrk_stth/,11,25,Looking great guys hope you boys been banking 🤑🤑🤑 still holding the majority of my $HDII (My main bae) riding free on everything else.,2019-09-23,https://www.reddit.com/r/pennystocks/comments/d88sqs/hdii_zmrk_stth/
8,$LTBR -,d88hv4,Ryael,https://www.reddit.com/r/pennystocks/comments/d88hv4/ltbr/,2,2,"PRESENT RISKS - DO NOT IGNORE THIS:

If LTBR is not above $1 for 10 consecutive days by I think the first week of Nov they would be removed from the NASDAQ. At this juncture I think that a R/S is distinctly possible.

THE GOOD NEWS:

The CEO has been saying for some time that a contract is in the final stages. Today, LTBR announced that Enfission (a JV between LTBR and the worlds largest nuclear rod manufacturer Framatome created a few years ago) had successful demonstration of the manufacturing process and fabrication of LTBR Fuel surrogate rods in a length (6ft) that could be usable in NuScale Power's small modular reactors (SMR). SMRs are the hot thing right now, specifically with use in the military as the majority of western casualties in combat zones comes from refuelling.

NuScale signed an MOU not long ago and as mentioned before the JV with Framatome is insane and being seriously overlooked.

The lead test rod contract*, not a full blown contract yet, is expected soon. Likely after the manufacture of a 12ft surrogate rod. The issue is the timeline with NASDAQ but that's an artifical time constraint in terms of business progress. Meaning it doesn't have anything to do with their actual situation, simply their listing. 

How to invest:

-During all previous conference calls the CEO has been sure that a reverse split would not be needed. As time comes close...well that doesn't look so obvious. You could wait until the reverse split and the inevitable drop in price to jump in.

-*If*, and this is a big if, a contract is miraculously signed in the next 3 weeks, the stock would absolutely skyrocket. I believe the odds of this are not zero but not much higher.

Nothing in the nuclear contract world is small. Nothing. Taking a company with no debt, ~21 million in cash, a joint venture with the  worlds largest nuclear fuel manufacturer, and a market cap of $24.8 million and then giving them a contract and a step onto the big the stage would be crazy. Long shot but they keep making progress and taking steps towards profitability.",2019-09-23,https://www.reddit.com/r/pennystocks/comments/d88hv4/ltbr/
9,How many shares of a penny stock company should I buy to get a good profit?,d884qo,evanhix1,https://www.reddit.com/r/pennystocks/comments/d884qo/how_many_shares_of_a_penny_stock_company_should_i/,1,0,,2019-09-23,https://www.reddit.com/r/pennystocks/comments/d884qo/how_many_shares_of_a_penny_stock_company_should_i/
10,Penny stock type ETFs,d8ck8q,stvkthrow,https://www.reddit.com/r/pennystocks/comments/d8ck8q/penny_stock_type_etfs/,6,5,"Are there high risk - high reward ETFs, similar to penny stocks? My brokerage doesn’t allow to trade penny stocks and not allowed to open robinhood due to employer restrictions.",2019-09-23,https://www.reddit.com/r/pennystocks/comments/d8ck8q/penny_stock_type_etfs/
11,"$BEMG Nice bottom play. About to go Pink Current, watch for filings and volume (check for yourself)",d8bik0,WarMachineStocks,https://www.reddit.com/r/pennystocks/comments/d8bik0/bemg_nice_bottom_play_about_to_go_pink_current/,2,3,"$BEMG, near 52week low. Its yield, about to go pink current. Check recent PR's and check out that chart. They did a share reduction, and now its complete (73% reduction on outstanding commons). 

Could be a nice runner to keep watch of over next week or so.",2019-09-23,https://www.reddit.com/r/pennystocks/comments/d8bik0/bemg_nice_bottom_play_about_to_go_pink_current/
12,"$BCCI $RLTR Worlds Inc. Files Patent Infringement Lawsuit Against Linden Lab's ""Second Life",d8alnu,louied91,https://www.reddit.com/r/pennystocks/comments/d8alnu/bcci_rltr_worlds_inc_files_patent_infringement/,1,0,"[https://www.otcmarkets.com/stock/WDDD/news/Worlds-Inc-Files-Patent-Infringement-Lawsuit-Against-Linden-Labs-Second-Life?id=241069](https://www.otcmarkets.com/stock/WDDD/news/Worlds-Inc-Files-Patent-Infringement-Lawsuit-Against-Linden-Labs-Second-Life?id=241069)

**BOSTON, MA / ACCESSWIRE / September 23, 2019** **/** [Worlds](http://pr.report/LBxNiOab) Inc. (OTCQB:WDDD), a leading intellectual property developer and licensee of patents related to 3D online virtual worlds, has filed a complaint for patent infringement against Linden Research, Inc., d/b/a Linden Lab, a Delaware corporation based in San Francisco, California. In the complaint, Worlds accuses Linden Lab and its ""Second Life"" product of infringing Worlds' U.S. Patent No. 7,181,690, titled ""System and Method for Enabling Users to Interact in a Virtual Space"" (the ""'690 Patent"").

""We will work diligently to defend Worlds' patent rights,"" said Wayne M. Helge, lead counsel of Worlds' litigation team at [Davidson, Berquist, Jackson &amp; Gowdey](http://pr.report/3eXSuyHE), LLP (DBJG) against Linden Lab. ""Unlike many patents being asserted across the country, the ''690 Patent' has already fended off an adversarial challenge of its validity.""

The '690 Patent's validity was challenged in 2015, in an *inter partes* review petition filed by Bungie, Inc. with the USPTO's Patent Trial and Appeal Board (PTAB). More than 18 months later, the '690 Patent emerged from the *inter partes* review process with the asserted claims determined to be patentable by a panel of three judges of the PTAB.

In addition to DBJG, Worlds has the experienced litigation team at [RatnerPrestia](http://pr.report/RzHl7nX9)'s Wilmington, Delaware office, including attorneys Jeffrey B. Bove and Rex A. Donnelly, providing support in its enforcement of its patent rights.

""Our expert legal team at Davidson Berquist successfully defended the '690 Patent before the PTAB, and convinced the U.S. Court of Appeals for the Federal Court (CAFC) to reverse and remand unfavorable PTAB decisions against other Worlds' patents. The CAFC's [ruling](http://pr.report/aCdD3Vg0) instructed the PTAB to reconsider the methods it used to evaluate the relationship between Activision and Bungie, and provided strong guidance on the rules to follow,"" stated Thom Kidrin, Worlds Inc. CEO. ""We await an imminent favorable final outcome from the PTAB in this matter, and look forward to both restarting our already-active litigation against Activision and asserting Worlds' intellectual property rights against other infringers. This litigation against Linden Lab is the first step in that process.

Kidrin noted, ""Our '690 Patent is fundamental to the functionality and success of numerous 3-D, computer-generated, graphical, multi-user, interactive virtual world systems and games that are enjoyed by millions of people globally. While we are excited by the popularity of these games, we want to ensure that we and our shareholders receive just compensation for the system and method we developed that helped make these types of products possible.""",2019-09-23,https://www.reddit.com/r/pennystocks/comments/d8alnu/bcci_rltr_worlds_inc_files_patent_infringement/
13,"September 23, 2019 Tomorrow's Daily /r/Pennystocks Discussion - Tuesday plays!",d8ab1b,AutoModerator,https://www.reddit.com/r/pennystocks/comments/d8ab1b/september_23_2019_tomorrows_daily_rpennystocks/,1,2,"Please use this thread to discuss your plays of the day!

Since this thread is likely to fill up quickly, consider sorting the comments by ""new"" (instead of ""best"" or ""top"") to see the newest posts.",2019-09-23,https://www.reddit.com/r/pennystocks/comments/d8ab1b/september_23_2019_tomorrows_daily_rpennystocks/
