,author,id,url,score,text,date
0,thekillerz99,fbwgnyt,/r/pennystocks/comments/eetlpg/could_someone_kindly_give_some_rationality_about/fbwgnyt/,1,"Giant sell-off ≈ 13M shares, buy back and then they locked. Tomorrow could be ugly",2019-12-24
1,NotBeforeMyCovfefe,fbwzu9e,/r/pennystocks/comments/eetlpg/could_someone_kindly_give_some_rationality_about/fbwzu9e/,1,"Sounds like their data was mishandled? They put the blame on somebody else. It could be nothing, but it's an ominous sign. If you can get out with a small loss, I say flee. Otherwise, it may run in January. Good luck.",2019-12-24
2,Camel-Kid,fbxuauz,/r/pennystocks/comments/ef2hvp/panic_covering/fbxuauz/,1,Dont take on too big a position,2019-12-24
3,BetrayedPredator,fby2vti,/r/pennystocks/comments/ef2hvp/panic_covering/fby2vti/,1,"Set your profit / lost before you even buy any options

Follow through with them, cutting loses is better then the option expiring worthless",2019-12-24
4,Jsbrow04,fby3ppy,/r/pennystocks/comments/ef33xx/vbiv_who_here_bought_this_stock_when_it_was_in/fby3ppy/,1,Where do you see it going and when,2019-12-24
5,worldrobotdomination,fby7dd4,/r/pennystocks/comments/ef33xx/vbiv_who_here_bought_this_stock_when_it_was_in/fby7dd4/,1,"I missed VBIV, looks like it is maxed out here for awhile, right?

I do own a few shares of LCTX. Here again, these stocks just blast up on 1 day, so you have to be in before anything is announced, so how to do that?

We need a screening service that let's us know, ahead of time, about these announcements!",2019-12-24
6,vantyle,fbyam8z,/r/pennystocks/comments/ef2hvp/panic_covering/fbyam8z/,1,You could pick better stocks to short.,2019-12-24
7,jaysomething2,fbybend,/r/pennystocks/comments/ef33xx/vbiv_who_here_bought_this_stock_when_it_was_in/fbybend/,1,Probably insider information if no news came. I’m hoping it’s positive. It’s got a good target price. I did just put another 2k in at 1.26 to bad it ended at 1.24. Hoping it’ll go right back after the holidays and continue a positive rate.,2019-12-24
8,rpappas123,fbyh5sr,/r/pennystocks/comments/ef4svh/december_24_2019_tomorrows_daily_rpennystocks/fbyh5sr/,1,SDRL +20% in 24 hours just sold out today.,2019-12-24
9,Guessed555,fbyj3nf,/r/pennystocks/comments/ef33xx/vbiv_who_here_bought_this_stock_when_it_was_in/fbyj3nf/,1,"In at .66, holding til mid January",2019-12-24
10,whitney49ers,fbyjvwh,/r/pennystocks/comments/ef33xx/vbiv_who_here_bought_this_stock_when_it_was_in/fbyjvwh/,1,Got in @0.88.  Zip zam zoom to the moon!!,2019-12-24
11,13jija,fbylst3,/r/pennystocks/comments/ef33xx/vbiv_who_here_bought_this_stock_when_it_was_in/fbylst3/,1,Just hold 100 shares. Planning to buy another 500 on Thursday!,2019-12-24
12,123treeship,fbypmdc,/r/pennystocks/comments/ef33xx/vbiv_who_here_bought_this_stock_when_it_was_in/fbypmdc/,1,"Doubled my money, too bad I only bought 60 shares. Check out CNN Money and their forecast for stocks, they have been accurate about VBIV thus far.",2019-12-24
13,JuulBoy420,fbypy12,/r/pennystocks/comments/ef33xx/vbiv_who_here_bought_this_stock_when_it_was_in/fbypy12/,1,"I got in at 0.95 but then today averaged in more and now I have 361 shares averaged in at $1.13. This shit is going to the moon. Definitely going to at least $2.50 in January and analysts have a low price target of $5.50 and a high of $11. 

https://finance.yahoo.com/quote/VBIV/analysis?p=VBIV",2019-12-24
14,RegionalChaos,fbyqkrb,/r/pennystocks/comments/ef33xx/vbiv_who_here_bought_this_stock_when_it_was_in/fbyqkrb/,1,"I was in at .66, then out after 35% gain..",2019-12-24
15,Here_with_Popcorn,fbys1s5,/r/pennystocks/comments/ef33xx/vbiv_who_here_bought_this_stock_when_it_was_in/fbys1s5/,1,"Had it at .54, caught the drop... only 1000 shares",2019-12-24
16,Brenjah,fbys5hi,/r/pennystocks/comments/ef33xx/vbiv_who_here_bought_this_stock_when_it_was_in/fbys5hi/,1,Bought at 0.55,2019-12-24
17,MrVolatility,fbys8x8,/r/pennystocks/comments/ef33xx/vbiv_who_here_bought_this_stock_when_it_was_in/fbys8x8/,1,Its Going right towards scam city,2019-12-24
18,Seek_Adventure,fbyv70i,/r/pennystocks/comments/ef4svh/december_24_2019_tomorrows_daily_rpennystocks/fbyv70i/,1,$XMAS,2019-12-24
19,randomperson0284,fbz30ue,/r/pennystocks/comments/ef33xx/vbiv_who_here_bought_this_stock_when_it_was_in/fbz30ue/,1,Based on what?,2019-12-24
20,[deleted],fbz4ern,/r/pennystocks/comments/ef4svh/december_24_2019_tomorrows_daily_rpennystocks/fbz4ern/,1,[removed],2019-12-24
21,theokouim,fbz5u2q,/r/pennystocks/comments/ef33xx/vbiv_who_here_bought_this_stock_when_it_was_in/fbz5u2q/,1,!remindme 3 months,2019-12-24
22,RemindMeBot,fbz5ulh,/r/pennystocks/comments/ef33xx/vbiv_who_here_bought_this_stock_when_it_was_in/fbz5ulh/,1,"I will be messaging you in 3 months on [**2020-03-25 01:06:32 UTC**](http://www.wolframalpha.com/input/?i=2020-03-25%2001:06:32%20UTC%20To%20Local%20Time) to remind you of [**this link**](https://np.reddit.com/r/pennystocks/comments/ef33xx/vbiv_who_here_bought_this_stock_when_it_was_in/fbz5u2q/?context=3)

[**CLICK THIS LINK**](https://np.reddit.com/message/compose/?to=RemindMeBot&amp;subject=Reminder&amp;message=%5Bhttps%3A%2F%2Fwww.reddit.com%2Fr%2Fpennystocks%2Fcomments%2Fef33xx%2Fvbiv_who_here_bought_this_stock_when_it_was_in%2Ffbz5u2q%2F%5D%0A%0ARemindMe%21%202020-03-25%2001%3A06%3A32%20UTC) to send a PM to also be reminded and to reduce spam.

^(Parent commenter can ) [^(delete this message to hide from others.)](https://np.reddit.com/message/compose/?to=RemindMeBot&amp;subject=Delete%20Comment&amp;message=Delete%21%20ef33xx)

*****

|[^(Info)](https://np.reddit.com/r/RemindMeBot/comments/e1bko7/remindmebot_info_v21/)|[^(Custom)](https://np.reddit.com/message/compose/?to=RemindMeBot&amp;subject=Reminder&amp;message=%5BLink%20or%20message%20inside%20square%20brackets%5D%0A%0ARemindMe%21%20Time%20period%20here)|[^(Your Reminders)](https://np.reddit.com/message/compose/?to=RemindMeBot&amp;subject=List%20Of%20Reminders&amp;message=MyReminders%21)|[^(Feedback)](https://np.reddit.com/message/compose/?to=Watchful1&amp;subject=RemindMeBot%20Feedback)|
|-|-|-|-|",2019-12-24
23,jaysomething2,fbzk857,/r/pennystocks/comments/ef33xx/vbiv_who_here_bought_this_stock_when_it_was_in/fbzk857/,1,See you then,2019-12-24
24,jaysomething2,fbzk920,/r/pennystocks/comments/ef33xx/vbiv_who_here_bought_this_stock_when_it_was_in/fbzk920/,1,It’s all been good!,2019-12-24
25,purpleturtlelover,fbzx3os,/r/pennystocks/comments/ef33xx/vbiv_who_here_bought_this_stock_when_it_was_in/fbzx3os/,1,Bought at ~0.5 out at 0.9. Too bad im too poor cuz i only bought for 500 euros.,2019-12-24
26,jaysomething2,fc0dkcu,/r/pennystocks/comments/ef33xx/vbiv_who_here_bought_this_stock_when_it_was_in/fc0dkcu/,1,This is my first penny stock but I sort of started small then went all in too bad my average is like .97 but I’m in at like 10000 shares and up $2500. Still gonna hold,2019-12-24
27,polozenochka,fc0u5r2,/r/pennystocks/comments/ef33xx/vbiv_who_here_bought_this_stock_when_it_was_in/fc0u5r2/,1,What else are you holding hoping they will shoot up?,2019-12-24
28,jaysomething2,fc0wkff,/r/pennystocks/comments/ef33xx/vbiv_who_here_bought_this_stock_when_it_was_in/fc0wkff/,1,I bought two shares of $ZN hoping to earn enough for a big Mac.,2019-12-24
29,fullsend01,fc2ls4s,/r/pennystocks/comments/eetlpg/could_someone_kindly_give_some_rationality_about/fc2ls4s/,1,"What happened was the investors were waiting for the news and then when it was lunch break someone dropped a million shares dropping the price down to 1.50 range causing all retails stores and people with stop limits set to purchase the stock. It then had a volatility halt. After it was cleared people started buying a lot of shares and then there was another volatility halt and then the IIROC, then they released the news. The stock had increase of around 7 million to 13.5 million.",2019-12-24
30,[deleted],fc7ygci,/r/pennystocks/comments/ef33xx/vbiv_who_here_bought_this_stock_when_it_was_in/fc7ygci/,1,[removed],2019-12-24
31,JuulBoy420,fchqw9t,/r/pennystocks/comments/ef33xx/vbiv_who_here_bought_this_stock_when_it_was_in/fchqw9t/,1,"smh have you done any DD on this company? Everything about it is positive and there's a news catalyst coming in early Jan about their phase 3 data on a vaccine and it's basically guaranteed to be better than their competitors. Also, GSK is most likely planning a buyout in 2020 and if they do, VBIV will be bought out at at least $4, but more likely around $5-$8.",2019-12-24
32,JuulBoy420,fchrbcg,/r/pennystocks/comments/ef33xx/vbiv_who_here_bought_this_stock_when_it_was_in/fchrbcg/,1,Hold until at least the P3 news comes out in early Jan. I'm holding until a buyout is confirmed,2019-12-24
33,jaysomething2,fchta2n,/r/pennystocks/comments/ef33xx/vbiv_who_here_bought_this_stock_when_it_was_in/fchta2n/,1,Same I’m trying to buy other stocks but I’d say I’m 50 here and 50 in the regular market for fidelity,2019-12-24
34,JuulBoy420,fchu5l1,/r/pennystocks/comments/ef33xx/vbiv_who_here_bought_this_stock_when_it_was_in/fchu5l1/,1,Nice. Do you follow the stocktwits page for VBIV? There's a lot of good guys on there who give a ton of good DD info too and know a lot about the company,2019-12-24
35,jaysomething2,fci0zb3,/r/pennystocks/comments/ef33xx/vbiv_who_here_bought_this_stock_when_it_was_in/fci0zb3/,1,What’s DD? Yup I’m on there to bad it’s always the same older info,2019-12-24
36,MrVolatility,fci59d7,/r/pennystocks/comments/ef33xx/vbiv_who_here_bought_this_stock_when_it_was_in/fci59d7/,0,Meet me back here in 8 to 10 months. She be in the tiolet.,2019-12-24
37,[deleted],fci5oqi,/r/pennystocks/comments/ef33xx/vbiv_who_here_bought_this_stock_when_it_was_in/fci5oqi/,1,[deleted],2019-12-24
38,JuulBoy420,fci5rnq,/r/pennystocks/comments/ef33xx/vbiv_who_here_bought_this_stock_when_it_was_in/fci5rnq/,1,In 8 to 10 months the company will have already been bought out by GSK. If you really believe that short the company and share your position 🤷‍♂️,2019-12-24
39,MrVolatility,fci7j9m,/r/pennystocks/comments/ef33xx/vbiv_who_here_bought_this_stock_when_it_was_in/fci7j9m/,1,L.,2019-12-24
40,JuulBoy420,fci7r3g,/r/pennystocks/comments/ef33xx/vbiv_who_here_bought_this_stock_when_it_was_in/fci7r3g/,1,Exactly. I have a position in VBIV but if you’re so negative about it set a short position. But uh oh. You won’t. Because you know it’s not going anywhere but up from here on out.,2019-12-24
41,JuulBoy420,fci7w9y,/r/pennystocks/comments/ef33xx/vbiv_who_here_bought_this_stock_when_it_was_in/fci7w9y/,2,Due diligence. And I mean yeah it’s the same stuff but it’s all good info. All positive news that’s coming.,2019-12-24
42,JuulBoy420,feawy9m,/r/pennystocks/comments/ef33xx/vbiv_who_here_bought_this_stock_when_it_was_in/feawy9m/,1,Ay chief wya now?,2019-12-24
43,MrVolatility,feeyf0w,/r/pennystocks/comments/ef33xx/vbiv_who_here_bought_this_stock_when_it_was_in/feeyf0w/,1,Still here watching that massive dump at the bell this morning.,2019-12-24
