,title,id,author,url,score,num_comments,text,date,link
0,"Penny Stocks To Watch On Thursday, September 19, 2019 CBL NBY CRNT LXRX",d68ne6,jameson62,https://www.reddit.com/r/pennystocks/comments/d68ne6/penny_stocks_to_watch_on_thursday_september_19/,12,4,https://capitalmarket.exchange/pennystocks918,2019-09-19,https://www.reddit.com/r/pennystocks/comments/d68ne6/penny_stocks_to_watch_on_thursday_september_19/
1,3 Penny Stocks To Watch After News SCAN PAT PKK,d6ebrf,markiemark621,https://www.reddit.com/r/pennystocks/comments/d6ebrf/3_penny_stocks_to_watch_after_news_scan_pat_pkk/,21,4, [**https://stock-watch.market/stockwatch**](https://stock-watch.market/stockwatch),2019-09-19,https://www.reddit.com/r/pennystocks/comments/d6ebrf/3_penny_stocks_to_watch_after_news_scan_pat_pkk/
2,"Alert: $PBHG CEO responds to shareholder, big acquisition and news confirmed and coming.",d6e9lc,Pablo_trader,https://www.reddit.com/r/pennystocks/comments/d6e9lc/alert_pbhg_ceo_responds_to_shareholder_big/,0,1,"[https://i.imgur.com/Q61YNpZ.jpg](https://i.imgur.com/Q61YNpZ.jpg)

and

blob:[https://imgur.com/37075160-7601-47b5-9d10-b7fcc6f11821](https://imgur.com/37075160-7601-47b5-9d10-b7fcc6f11821)

&amp;#x200B;

ABout time! To let everyone know, this is the CEO that brought $AURI 2000% - Same CEO! Now, he focused on $PHBG! Get ready.",2019-09-19,https://www.reddit.com/r/pennystocks/comments/d6e9lc/alert_pbhg_ceo_responds_to_shareholder_big/
3,KULR Technology Provides Battery Safety Solutions to Global Tier-1 Medical Device Manufacturer,d6dt4g,supernova2020,https://www.reddit.com/r/pennystocks/comments/d6dt4g/kulr_technology_provides_battery_safety_solutions/,1,0,"Global Tier-1 Manufacturer applies KULR’s proprietary technology to improve battery pack design and safety solutions within various product lines.

CAMPBELL, Calif., Sept. 19, 2019 (GLOBE NEWSWIRE) -- KULR Technology Group, Inc. (OTCQB: KULR) (the “Company” or “KULR”), a leading developer of battery safety and thermal management technologies, announced that it has conducted testing and provided battery safety solutions for a global Tier-1 manufacturer of medical equipment and devices.

The testing included use of ISC technology for battery packs used in medical and monitoring devices. The ISC creates lithium-ion battery cell failures that mimic or recreate the most common types of failures such as latent defect or over-cycling. KULR also tested its NASA-utilized TRS technology in design solutions for use in the manufacturer’s battery packs. The TRS has repeatedly shown in independent laboratory testing to be the most effective heat sink that also prevents the impact of dangerous chain-reaction battery cell failures known as thermal runaway propagation.

KULR’s testing and safety products will enable this global medical device maker to adopt new battery cells into current battery packs with increased energy capacity while simultaneously maintaining high safety levels and backward compatibility within the same form factor.

“We are always proud to help our partners make their products better and safer,” said Michael Mo, CEO of KULR. “The technology is out there, well tested and accepted, to protect consumers by making battery packs safer and more reliable. KULR is helping pioneer ISC testing and next-gen battery enclosures for battery safety within the mission critical medical device sector. We look forward to helping customers with their battery testing methodology as well as developing future battery configurations while ensuring backward compatibility.”

Although KULR has provided battery and other related thermal solutions for partners including NASA, research institutions and defense partners, the work included in this announcement represents a significant advancement into testing and solution design for commercial, public customers – work KULR expects will result in successful commercialization across multiple vertical markets.

About KULR Technology Group, Inc.

KULR Technology Group, Inc. (OTCQB: KULR) develops, manufactures and licenses next-generation carbon fiber thermal management technologies for batteries and electronic systems. Leveraging the company’s roots in developing breakthrough cooling solutions for NASA deep space missions and backed by a strong intellectual property portfolio, KULR enables leading aerospace, electronics and electric vehicle manufacturers to make their products cooler, lighter and safer for the consumer. For more information, please visit [www.kulrtechnology.com](https://www.kulrtechnology.com).

Safe Harbor Statement

This release does not constitute an offer to sell or a solicitation of offers to buy any securities of any entity. This release contains certain forward-looking statements based on our current expectations, forecasts and assumptions that involve risks and uncertainties. Forward-looking statements in this release are based on information available to us as of the date hereof. Our actual results may differ materially from those stated or implied in such forward-looking statements, due to risks and uncertainties associated with our business, which include the risk factors disclosed in our parent entity’s Form 10-K filed on March 29, 2019. Forward-looking statements include statements regarding our expectations, beliefs, intentions or strategies regarding the future and can be identified by forward-looking words such as ""anticipate,"" ""believe,"" ""could,"" ""estimate,"" ""expect,"" ""intend,"" ""may,"" ""should,"" and ""would"" or similar words. We assume no obligation to update the information included in this press release, whether as a result of new information, future events or otherwise.

Source: [http://www.globenewswire.com/news-release/2019/09/19/1918034/0/en/KULR-Technology-Provides-Battery-Safety-Solutions-to-Global-Tier-1-Medical-Device-Manufacturer.html](http://www.globenewswire.com/news-release/2019/09/19/1918034/0/en/KULR-Technology-Provides-Battery-Safety-Solutions-to-Global-Tier-1-Medical-Device-Manufacturer.html)",2019-09-19,https://www.reddit.com/r/pennystocks/comments/d6dt4g/kulr_technology_provides_battery_safety_solutions/
4,Suretrader Suspended,d6gmt6,21421195211212,https://www.reddit.com/r/pennystocks/comments/d6gmt6/suretrader_suspended/,9,10,"Suretrader has been suspended for 5 days. As of now, there have been no reports on the Bahamas securities commission. Suretrader isn't taking calls, nor is allowing clients to withdrawal money. No ability to access platforms like Das trader either.

 Years ago when I traded on suretrader, I noticed my trades wouldn't be filled on the T&amp;S. In other words, CFD's had to be used given there were no legitimate executed orders. 

https://pbs.twimg.com/media/EE1iVfAXYAI8VHC?format=png&amp;name=900x900

This broker is one I highly recommend avoiding. After shutting down from the hurricane, it's now the second time Suretraders been shut down in less than a month.",2019-09-19,https://www.reddit.com/r/pennystocks/comments/d6gmt6/suretrader_suspended/
5,Any updates on LAHO's suspension?,d6fy6h,HuntersLoveABigRack,https://www.reddit.com/r/pennystocks/comments/d6fy6h/any_updates_on_lahos_suspension/,1,0,[removed],2019-09-19,https://www.reddit.com/r/pennystocks/comments/d6fy6h/any_updates_on_lahos_suspension/
6,TTCM Augmented Reality Scavenger Hunt and GUINNESS WORLD RECORDS,d6i4bx,Tylergame,https://www.reddit.com/r/pennystocks/comments/d6i4bx/ttcm_augmented_reality_scavenger_hunt_and/,4,2,Is anyone participating tomorrow in the arkhunt?,2019-09-19,https://www.reddit.com/r/pennystocks/comments/d6i4bx/ttcm_augmented_reality_scavenger_hunt_and/
7,"September 19, 2019 Tomorrow's Daily /r/Pennystocks Discussion - What are your plays for Thursday??",d6hu8l,AutoModerator,https://www.reddit.com/r/pennystocks/comments/d6hu8l/september_19_2019_tomorrows_daily_rpennystocks/,0,1,"Please use this thread to discuss your plays of the day!

Since this thread is likely to fill up quickly, consider sorting the comments by ""new"" (instead of ""best"" or ""top"") to see the newest posts.",2019-09-19,https://www.reddit.com/r/pennystocks/comments/d6hu8l/september_19_2019_tomorrows_daily_rpennystocks/
8,SRUS Merger,d6hsls,silverlakes123,https://www.reddit.com/r/pennystocks/comments/d6hsls/srus_merger/,2,1,"$SRUS https://stratuscapcorp.com holding up strong in this range. When details about the merger from last weeks filing (first filing in 15 years) comes out this will be a be a huge mover. OS is only 1.5mil and updates are on the way http://archive.fast-edgar.com//20190909/ARK2R22CZ22582Z222282CZZN3GAGZT222B2/#a_003 

Investor Relations email: https://twitter.com/silverlakes123/status/1174727043021443078?s=21",2019-09-19,https://www.reddit.com/r/pennystocks/comments/d6hsls/srus_merger/
9,$BCCI $RLTR Amazon Prime Sells Out of Baristas White Coffee in Sales Surge but New Inventory has Been Shipped from New In House Production Facility,d6hgt1,louied91,https://www.reddit.com/r/pennystocks/comments/d6hgt1/bcci_rltr_amazon_prime_sells_out_of_baristas/,8,3,"[https://www.otcmarkets.com/stock/BCCI/news/Amazon-Prime-Sells-Out-of-Baristas-White-Coffee-in-Sales-Surge-but-New-Inventory-has-Been-Shipped-from-New-In-House-Prod?id=240906](https://www.otcmarkets.com/stock/BCCI/news/Amazon-Prime-Sells-Out-of-Baristas-White-Coffee-in-Sales-Surge-but-New-Inventory-has-Been-Shipped-from-New-In-House-Prod?id=240906)

**SEATTLE, WA / ACCESSWIRE / September 19, 2019 /** Baristas Coffee Company, Inc. (OTC PINK:BCCI) Amazon Prime has sold out of Baristas White Coffee single-serve pods compatible with the Keurig 2.0 brewing system. New Inventory has been produced and shipped to Amazon from Baristas newly purchased and installed a line of manufacturing equipment that now allows for end to end production of single-serve pods compatible with the Keurig 2.0 brewing system as well as the Nespresso single-serve system.

📷

Baristas White coffee is still available on Amazon via other sellers and at [www.trywhitecoffee.com](http://pr.report/GI6n4w-j) where consumers can also ensure that they receive the first of the new inventory with Amazon by clicking the Amazon link.

Baristas Espresso Roast Keurig 2.0 compatible pods can now be purchased directly from the company at [www.baristas.tv](http://pr.report/Py1BlUAh) or on Amazon at [https://www.amazon.com/dp/B018VYOC0K](http://pr.report/0YcIzyO6) . They will soon be available directly from Amazon Prime as well. Espresso Roast represents the first of many single-serve products that can be produced on the new system that is now fully functional including those that may contain legal substances that could potentially provide benefits to those who consume.

Barry Henthorn CEO stated: ""Being able to react to a sudden surge in sales resulting from a very small marketing effort to existing customers is one of the primary benefits of our newly purchased in-house production line. We will now be able to ramp up our advertising with full confidence that we will be able to react quickly to increases in sales, managing inventories so that our customers will be able to experience our special products.""

The In-House manufacturing capabilities solves the previous supply challenges that were caused by long lead times and inventory management issues, coupled with Baristas ability to drive sales, out marketing its previous supply chain. Baristas will continue to utilize the relationship and capabilities of its co-packer for large runs but will now be able to fill in supply demands between larger runs as needed.

Baristas new in-house manufacturing capabilities will also aid in and accelerate the development of its new products and allow Baristas to partner with others who wish to bring their products to the single-serve beverage market.

Baristas will now be able to market its products with confidence that it will be able to keep up with demand and fulfill orders and a new marketing push is being implemented along with the new manufacturing capabilities.

The media buys and other cutting edge marketing are made possible and were created via digital media frontrunner ReelTime Media (OTC PINK:RLTR) [www.reeltime.com](http://pr.report/9vLSKxiI) whose capabilities are redefining how companies are evaluating and purchasing their TV, radio, print, and other new media. Baristas is now ready to support its new products and distributors with a marketing effort educating and driving consumers to consume Baristas historical and new products.",2019-09-19,https://www.reddit.com/r/pennystocks/comments/d6hgt1/bcci_rltr_amazon_prime_sells_out_of_baristas/
10,FUV Arcimoto event today,d6hckc,Elchaim,https://www.reddit.com/r/pennystocks/comments/d6hckc/fuv_arcimoto_event_today/,2,0,"Arcimoto is hodling an event later today, volume is still low but I bet it will pick up tomorrow morning or later today.",2019-09-19,https://www.reddit.com/r/pennystocks/comments/d6hckc/fuv_arcimoto_event_today/
11,$TRNX,d6h04u,KomandoMetz,https://www.reddit.com/r/pennystocks/comments/d6h04u/trnx/,3,12,"Taronis technologies to hold a CC 10 am et tomorrow covering their soon to IPO spin-off taronis fuels.
Big PR are in the pipeline. Big dividend in mid November.
Almost 9% up today.
Buy?",2019-09-19,https://www.reddit.com/r/pennystocks/comments/d6h04u/trnx/
12,Paper trading,d6m84p,itsfredagain,https://www.reddit.com/r/pennystocks/comments/d6m84p/paper_trading/,20,15,To all the people that paper trade and trade with actual money. When you're paper trading are you using the same capital amount that you actually have? Or do you use a bigger amount? Smaller amount? I'm wanting to start paper trading just kind of lost on it all,2019-09-19,https://www.reddit.com/r/pennystocks/comments/d6m84p/paper_trading/
