,author,id,url,score,text,date
1274,Philisophicalgoose33,fo7850w,/r/pennystocks/comments/g645y1/decn_heres_the_thing/fo7850w/,1,"My advice to everyone would be to hold for a bit! Think about this, this stock has risen 12 cents a share in a day because they released an announcement saying they are having an announcement Thursday. Just imagine how much it’ll skyrocket once actual good news is released! 

Once this thing gets approved, which I think of will very shortly, and orders start coming in, the PPS will have a floor of $1.00. I truly believe that

Don’t get me wrong, people will have stop limits at .35, .40,.60 ...etc which Is great if you wanna secure some profits in the short term, and you may see the price do some short declines, but investors will eat up those low shares and propel this forward. Secure some profits if you want, but as a long term hold this stock can really go high and holding this share will earn you more money in the long run. 

That’s my 2 cents tho",2020-04-22
1275,IceMochaDaVape,fo785di,/r/pennystocks/comments/g64e26/tops/fo785di/,2,I sold,2020-04-22
1276,crkhtlr,fo785n7,/r/pennystocks/comments/g64ikm/decn_to_the_moon/fo785n7/,1,I really don't think so,2020-04-22
1277,Weshallpropser,fo785z9,/r/pennystocks/comments/g64ikm/decn_to_the_moon/fo785z9/,3,At what point do we just grab our money bags and leave?,2020-04-22
1278,djlab353,fo7861h,/r/pennystocks/comments/g64ikm/decn_to_the_moon/fo7861h/,3,What are we targeting,2020-04-22
1279,alexesver,fo7864e,/r/pennystocks/comments/g645y1/decn_heres_the_thing/fo7864e/,1,"If it blows up? Prob around 1.25 limit for half my shares and if it keeps going up sell the rest in the 1.50-2.00 range.
Unless weird shit happens then I’ll just pull around and 1.00-1.25",2020-04-22
1280,[deleted],fo7868e,/r/pennystocks/comments/g64ikm/decn_to_the_moon/fo7868e/,1,[removed],2020-04-22
1281,[deleted],fo786bb,/r/pennystocks/comments/g64ikm/decn_to_the_moon/fo786bb/,1,[removed],2020-04-22
1282,alexesver,fo788xg,/r/pennystocks/comments/g64ikm/decn_to_the_moon/fo788xg/,4,Nope. Currently chilling right around 30. I’d do it. You can still get a decent profit off it.,2020-04-22
1283,School_IT_Hero,fo78b44,/r/pennystocks/comments/g6368r/exit_strategy_for_nat/fo78b44/,1,Got a 7c jun19 i got some time wont really worry till im 2 weeks out,2020-04-22
1284,ReDocter17,fo78cp8,/r/pennystocks/comments/g64ikm/decn_to_the_moon/fo78cp8/,1,It’s not showing up on Robinhood,2020-04-22
1285,alexesver,fo78elc,/r/pennystocks/comments/g64ikm/decn_to_the_moon/fo78elc/,4,It’s breaking resistance currently so we could make a trip to .40 by EOD. Then obviously there’s tomorrow.,2020-04-22
1286,xxxmuluken,fo78g3p,/r/pennystocks/comments/g64ikm/decn_to_the_moon/fo78g3p/,4,Not on Robinhood,2020-04-22
1287,alexesver,fo78gbw,/r/pennystocks/comments/g64ikm/decn_to_the_moon/fo78gbw/,3,RH doesn’t do OTC,2020-04-22
1288,bendangs,fo78gga,/r/pennystocks/comments/g64ikm/decn_to_the_moon/fo78gga/,11,One millions dollars a share,2020-04-22
1289,Philisophicalgoose33,fo78ir1,/r/pennystocks/comments/g62dbx/decn_dip/fo78ir1/,1,Hold out man! This 50$ will land you 300 bucks once approval and kits start rolling out,2020-04-22
1290,SponsorsExemption,fo78js3,/r/pennystocks/comments/g64ikm/decn_to_the_moon/fo78js3/,2,"yea the word around here on OTC stocks is they rarely show up on RobinHood.

Schwab seems to be the preferred platform for most",2020-04-22
1291,keystonerlite,fo78k0g,/r/pennystocks/comments/g62dbx/decn_dip/fo78k0g/,1,That’s what I’m hoping it does!,2020-04-22
1292,FTW_Rockets_FTW,fo78mkl,/r/pennystocks/comments/g64ikm/decn_to_the_moon/fo78mkl/,5,How many shares y’all holding? One dude has 50K shares wow,2020-04-22
1293,Philisophicalgoose33,fo78n67,/r/pennystocks/comments/g62dbx/decn_dip/fo78n67/,1,Holy crap. Congrats on good news!,2020-04-22
1294,JoeBarth22,fo78npf,/r/pennystocks/comments/g64ikm/decn_to_the_moon/fo78npf/,4,.30 is still a great price to get in,2020-04-22
1295,alexesver,fo78pm4,/r/pennystocks/comments/g64ikm/decn_to_the_moon/fo78pm4/,5,There’s a guy on the sub holding like 65 or 70k,2020-04-22
1296,ravcc,fo78qui,/r/pennystocks/comments/g62dbx/decn_dip/fo78qui/,1,Picture or it isn’t happening :),2020-04-22
1297,Weshallpropser,fo78rxz,/r/pennystocks/comments/g64ikm/decn_to_the_moon/fo78rxz/,7,See you on the moon !,2020-04-22
1298,Mustelll,fo78s20,/r/pennystocks/comments/g64ikm/decn_to_the_moon/fo78s20/,4,Man. Idk about y’all. But my 2500 units at .18 is looking mighty delicious. Thinking about selling my initial investment and keeping the rest locked.,2020-04-22
1299,alexesver,fo78vyu,/r/pennystocks/comments/g64ikm/decn_to_the_moon/fo78vyu/,3,Yeah. It’s breakin resistance rn. So the guys I thought who were wild for saying it may go to .40-.45 by EOD aren’t as crazy anymore.,2020-04-22
1300,Philisophicalgoose33,fo78vzk,/r/pennystocks/comments/g62dbx/decn_dip/fo78vzk/,1,Picked a hot stock bro 🤙,2020-04-22
1301,keystonerlite,fo78xkg,/r/pennystocks/comments/g62dbx/decn_dip/fo78xkg/,1,All thanks to Reddit 😂,2020-04-22
1302,jcktffy98,fo78z9r,/r/pennystocks/comments/g62gwm/mtl/fo78z9r/,1,Worth getting into now? or too late,2020-04-22
1303,Groovytime2,fo78zcw,/r/pennystocks/comments/g64e26/tops/fo78zcw/,2,Oh dang it now I gotta get rid of it and take a small loss,2020-04-22
1304,spanky-jr,fo78zvu,/r/pennystocks/comments/g64ikm/decn_to_the_moon/fo78zvu/,4,I’m in for 2000 shares @ .24 right now and debating if I should go in for another 2000 now,2020-04-22
1305,AlphaSquad1,fo792f5,/r/pennystocks/comments/g62gwm/mtl/fo792f5/,1,"Sounds like LTRPB, which I was kicking myself for missing for about an hour before it crashed. Figure it must have been a pump and dump, but with all the others happening lately I’m wondering if part of it is automated trading systems getting in a feedback loop.",2020-04-22
1306,myfotos,fo793bk,/r/pennystocks/comments/g624j5/bbrw_dividend_and_projected_sales_announced/fo793bk/,1,I asked about the liabilities yesterday and was downvoted and lied to and was told the liabilities do not exist.  Not one person has been able to explain the $7million in liabilities...,2020-04-22
1307,maolighter,fo798m0,/r/pennystocks/comments/g64ikm/decn_to_the_moon/fo798m0/,19,Anyone check on the $5k water mattress dude?? lol,2020-04-22
1308,JohnnyLakefront,fo79isx,/r/pennystocks/comments/g64ikm/decn_to_the_moon/fo79isx/,5,Blasted through resistance. And people are still gonna park their money in their EOD to prepare for the announcement tomorrow,2020-04-22
1309,Philisophicalgoose33,fo79jbm,/r/pennystocks/comments/g62dbx/decn_dip/fo79jbm/,1,That’s how I figured out about it too ! I wish I would have seen the stock posts at .02 cents tho! 😂,2020-04-22
1310,keystonerlite,fo79ldp,/r/pennystocks/comments/g62dbx/decn_dip/fo79ldp/,1,Me too! But I would’ve probably sold it at .2 😂,2020-04-22
1311,vantyle,fo79mnn,/r/pennystocks/comments/g62dbx/decn_dip/fo79mnn/,2,It's not on there.,2020-04-22
1312,j0shyuaa,fo79qhs,/r/pennystocks/comments/g5s19x/denbury_dnr/fo79qhs/,1,Yes. They recently sold a drilling property for 25 million and are hedged. I'm buying low .50 and selling high .60. Worth a swing,2020-04-22
1313,jtslice,fo79sg1,/r/pennystocks/comments/g645y1/decn_heres_the_thing/fo79sg1/,1,I want in so bad but neither of my brokers trade this,2020-04-22
1314,Slow_is_Fast,fo79wih,/r/pennystocks/comments/g63pcp/decn_conference/fo79wih/,1,Looks like something is happening. Just went up a couple.,2020-04-22
1315,PupPop,fo79x2g,/r/pennystocks/comments/g62dbx/decn_dip/fo79x2g/,1,It broke the 0.30 resistance. Tomorrow with the news I'm hoping for the big $1.,2020-04-22
1316,residentjared,fo79y6m,/r/pennystocks/comments/g64ikm/decn_to_the_moon/fo79y6m/,8,"This is my first try at penny stocks. 7,100 shares at $.19. Gonna just assume complete beginner’s luck and never play this game again. Haha",2020-04-22
1317,crkhtlr,fo79ynd,/r/pennystocks/comments/g64ikm/decn_to_the_moon/fo79ynd/,3,I missed it. What's this?,2020-04-22
1318,[deleted],fo79z18,/r/pennystocks/comments/g63pcp/decn_conference/fo79z18/,1,[deleted],2020-04-22
1319,xxxmuluken,fo7a1tg,/r/pennystocks/comments/g645y1/decn_heres_the_thing/fo7a1tg/,1,Same,2020-04-22
1320,maolighter,fo7a5s8,/r/pennystocks/comments/g64ikm/decn_to_the_moon/fo7a5s8/,9,"Some dude said he bought a $5k water bed and needed DECN to break like .25 so he could pay it off before his wife got mad

Edit: [here is the post](https://www.reddit.com/r/pennystocks/comments/g4xgsw/if_decn_doesnt_rise_im_screwed/)",2020-04-22
1321,EarlyBirdTheNightOwl,fo7a6je,/r/pennystocks/comments/g5zt2e/reminder_that_decns_test_will_be_a_finger_prick/fo7a6je/,1,Oh fuck that test,2020-04-22
1322,alexesver,fo7a8x7,/r/pennystocks/comments/g64ikm/decn_to_the_moon/fo7a8x7/,4,Yup. Depending on where the day goes I may consider pulling out right around the EOD if any weird news drops or I get cold feet. Serious profit margin as is.,2020-04-22
1323,Jeffrooow,fo7a9ny,/r/pennystocks/comments/g644tt/zom/fo7a9ny/,2,I’m holding with 1400 shares sadly. But I have hope,2020-04-22
1324,MaRrDuKzAyA,fo7af86,/r/pennystocks/comments/g644tt/zom/fo7af86/,1,At least DECN is keeping my portfolio afloat atm. Not happy with the way ZOM is treating me though. I thought we were friends.,2020-04-22
1325,alexesver,fo7afyn,/r/pennystocks/comments/g62dbx/decn_dip/fo7afyn/,1,"My bad. Saw it on the Dow Jones thing on Ameritrade.
Links to the company and the PR info. My bad.",2020-04-22
1326,MaRrDuKzAyA,fo7ah90,/r/pennystocks/comments/g64ikm/decn_to_the_moon/fo7ah90/,2,fidelity is coo too,2020-04-22
1327,fudorekz12,fo7ahym,/r/pennystocks/comments/g64ikm/decn_to_the_moon/fo7ahym/,2,In for 10k shares @.20. Lets go!,2020-04-22
1328,FSUag,fo7an6q,/r/pennystocks/comments/g64ikm/decn_to_the_moon/fo7an6q/,6,This cracked me up,2020-04-22
1329,YoMommaJokeBot,fo7ap5n,/r/pennystocks/comments/g64ikm/decn_to_the_moon/fo7ap5n/,3,"Not as too as your mama
***
^I ^am ^a ^bot. ^Downvote ^to ^remove. ^[PM](https://www.reddit.com/message/compose/?to=YoMommaJokeBot) ^me ^if ^there's ^anything ^for ^me ^to ^know!",2020-04-22
1330,JohnnyLakefront,fo7apqi,/r/pennystocks/comments/g64ikm/decn_to_the_moon/fo7apqi/,4,"you're insane. but then again, nobody ever went broke taking a profit.",2020-04-22
1331,redfour0,fo7as7v,/r/pennystocks/comments/g64ikm/decn_to_the_moon/fo7as7v/,2,"Got in at .21 using the remaining cash in my investment account. Only regret is not buying more.

We'll see what happens tomorrow though. Could easily get wiped out on bad or poor news.",2020-04-22
1332,NYC_summer,fo7aslq,/r/pennystocks/comments/g64ikm/decn_to_the_moon/fo7aslq/,1,Schwab will take too long to get approved to Depoist money. Any other apps ?,2020-04-22
1333,alexesver,fo7atm0,/r/pennystocks/comments/g64ikm/decn_to_the_moon/fo7atm0/,1,"I am. But honestly if it closes around .40 or higher I’d have made almost 20 cents a share. So it’s definitely a thought I’m considering.
Also I’m a victim or ORGEN so I got slight PTSD lol",2020-04-22
1334,alexesver,fo7b3ki,/r/pennystocks/comments/g64ikm/decn_to_the_moon/fo7b3ki/,2,Idk why I laughed at this.,2020-04-22
1335,Minds_Desire,fo7b3wi,/r/pennystocks/comments/g64ikm/decn_to_the_moon/fo7b3wi/,1,"What do you mean? You gotta double down. You are on a winning streak, can't quit now.",2020-04-22
1336,Reddit_and_forgeddit,fo7b5f3,/r/pennystocks/comments/g64ikm/decn_to_the_moon/fo7b5f3/,2,"Lmao, he’s happy today",2020-04-22
1337,mvanch12,fo7b5kf,/r/pennystocks/comments/g64ikm/decn_to_the_moon/fo7b5kf/,2,"Dude same I’m in at 1,500 at .20! Thank god I found the sub the other night",2020-04-22
1338,flip_your_WOW,fo7b6ya,/r/pennystocks/comments/g64e26/tops/fo7b6ya/,1,"Buy the dip. It's low, so no where left to to but up.",2020-04-22
1339,turnerdhr23,fo7b8in,/r/pennystocks/comments/g624j5/bbrw_dividend_and_projected_sales_announced/fo7b8in/,2,"From a poster on investor hub who has done extensive DD on the company and its workings:  ""The derivative liability is how BrewBilt is accounting for the wholly owned subsidiary of the old pet supply division. This will be spun off in 2020 and in the future will not be shown on the balance sheet. Anything the company gets for this spinoff will become an asset in the balance sheet, most likely cash.""

[link to post](https://investorshub.advfn.com/boards/read_msg.aspx?message_id=155181957)",2020-04-22
1340,Everyones_Grudge,fo7b8tx,/r/pennystocks/comments/g64ikm/decn_to_the_moon/fo7b8tx/,2,Meanwhile my funds haven't cleared TD Ameritrade yet so I'm just watching the money fly out the door,2020-04-22
1341,vantyle,fo7b90k,/r/pennystocks/comments/g64ikm/decn_to_the_moon/fo7b90k/,3,"Buy the rumor, sell the news.",2020-04-22
1342,Pyroxy3,fo7b92m,/r/pennystocks/comments/g624j5/bbrw_dividend_and_projected_sales_announced/fo7b92m/,1,If you wana make some money go with the flow and don't be a negative nancy dude. No1 likes you killing their vibe.,2020-04-22
1343,vantyle,fo7bbsh,/r/pennystocks/comments/g64ikm/decn_to_the_moon/fo7bbsh/,3,TD Ameritrade,2020-04-22
1344,alexesver,fo7bcor,/r/pennystocks/comments/g64ikm/decn_to_the_moon/fo7bcor/,1,Shit had me laughing good.,2020-04-22
1345,Murderouswaffle,fo7bfy9,/r/pennystocks/comments/g64ikm/decn_to_the_moon/fo7bfy9/,2,"My deposit with TD Ameritrade is still on hold too, super pissed I missed at .18.  Are there any apps that allow instant access like Robinhood and allow OTC?",2020-04-22
1346,latecalli,fo7bgfd,/r/pennystocks/comments/g62sis/newbie_question_margin_vs_cash/fo7bgfd/,1,https://www.ally.com/do-it-right/investing/what-are-unsettled-funds/,2020-04-22
1347,Reddit_and_forgeddit,fo7bgvy,/r/pennystocks/comments/g64ikm/decn_to_the_moon/fo7bgvy/,2,Wire it next time.  I wired more funds around midnight and was able to pick more up at .25 this morning.,2020-04-22
1348,Divesto,fo7bkmb,/r/pennystocks/comments/g5zt2e/reminder_that_decns_test_will_be_a_finger_prick/fo7bkmb/,1,It looked like they got a piece of it,2020-04-22
1349,Still-Proof,fo7blyn,/r/pennystocks/comments/g64ikm/decn_to_the_moon/fo7blyn/,1,"I don’t think so. Just bought more. May be a small loss worst case, but big upside.",2020-04-22
1350,residentjared,fo7bmnk,/r/pennystocks/comments/g64ikm/decn_to_the_moon/fo7bmnk/,4,"Haha, house always wins! But, I am in this one for the long haul.",2020-04-22
1351,hev71,fo7bqax,/r/pennystocks/comments/g64ikm/decn_to_the_moon/fo7bqax/,2,I use Fidelity.,2020-04-22
1352,myfotos,fo7br4v,/r/pennystocks/comments/g624j5/bbrw_dividend_and_projected_sales_announced/fo7br4v/,3,Thank you!,2020-04-22
1353,Barkluv,fo7bray,/r/pennystocks/comments/g62dbx/decn_dip/fo7bray/,2,Thanks,2020-04-22
1354,ShitPostGuy,fo7btig,/r/pennystocks/comments/g64ikm/decn_to_the_moon/fo7btig/,2,Just upped to 40K. 0.315 average price.,2020-04-22
1355,alexesver,fo7btjl,/r/pennystocks/comments/g62dbx/decn_dip/fo7btjl/,1,Welcome. Dow Jones has it posted along with other info and related links for their other stuff as well,2020-04-22
1356,SwankyTiger_0,fo7bv0b,/r/pennystocks/comments/g63jfv/publicequity_offering/fo7bv0b/,1,"I bought into NNDM at a too high of price point. Sounds like it will be a long time till the stock goes back up if ever. 

They will likely reverse split come end of june if they are not back above a dollar.

I am waiting till eod tomorrow to see if the stock moves at all and then probably cutting losses",2020-04-22
1357,Synseer83,fo7byz0,/r/pennystocks/comments/g64ikm/decn_to_the_moon/fo7byz0/,3,bought 500 yesterday. put in an order for an aditional 500. managed to get both around .2452,2020-04-22
1358,JoeBarth22,fo7c395,/r/pennystocks/comments/g64ikm/decn_to_the_moon/fo7c395/,5,looks like its trying to find a new floor around .31,2020-04-22
1359,swiftenhaal,fo7c9rp,/r/pennystocks/comments/g5rq8i/ston/fo7c9rp/,1,"Got in when it was 1.08 and averaged down to .73 but I’m expecting to take a loss. I know they’re not pennies but I also went in on CSV, SCI, and FLWS which all seem a lot more promising.",2020-04-22
1360,Still-Proof,fo7cilf,/r/pennystocks/comments/g64ikm/decn_to_the_moon/fo7cilf/,14,"I’m either making out big $$$ or getting divorced, so it’s a win win.",2020-04-22
1361,cg19831983,fo7ckmd,/r/pennystocks/comments/g64ikm/decn_to_the_moon/fo7ckmd/,3,Can’t get decn on RH? 🤔,2020-04-22
1362,PurpedUpPat,fo7cmhq,/r/pennystocks/comments/g5zt2e/reminder_that_decns_test_will_be_a_finger_prick/fo7cmhq/,1,Hm I feel like that doctor did it wrong because I had it done and it was nowhere near that level of pain or discomfort beyond my eyes watering also no blood.,2020-04-22
1363,Drchains,fo7cor2,/r/pennystocks/comments/g64hnx/decn_update_call_tomorrow/fo7cor2/,1,Do you know the timezone?,2020-04-22
1364,Cloudxixpuff,fo7crt3,/r/pennystocks/comments/g64e26/tops/fo7crt3/,1,Generally it dips to about .20 cents then sits for a week and pops to .30 for a day. At least that's what I thought,2020-04-22
1365,isaac11117,fo7cs9m,/r/pennystocks/comments/g645y1/decn_heres_the_thing/fo7cs9m/,1,We up to 0.33 BABY!,2020-04-22
1366,PupPop,fo7cw11,/r/pennystocks/comments/g62dbx/decn_dip/fo7cw11/,1,And you would have learned a couple car payments! Gains are gains.,2020-04-22
1367,keystonerlite,fo7cya7,/r/pennystocks/comments/g62dbx/decn_dip/fo7cya7/,1,That’s the truth,2020-04-22
1368,alexesver,fo7cza8,/r/pennystocks/comments/g64ikm/decn_to_the_moon/fo7cza8/,3,Lmaoooo,2020-04-22
1369,PupPop,fo7d0mq,/r/pennystocks/comments/g62dbx/decn_dip/fo7d0mq/,1,I have 9k shares and I'm up $700 today. It's gone up 35% today though so it could be out of steam for the day until tomorrows news.,2020-04-22
1370,isaac11117,fo7d1x0,/r/pennystocks/comments/g5zt2e/reminder_that_decns_test_will_be_a_finger_prick/fo7d1x0/,1,None! its up to 0.33!!!!!,2020-04-22
1371,jacobsawyerr,fo7d2n0,/r/pennystocks/comments/g64ikm/decn_to_the_moon/fo7d2n0/,3,in @ 10.5k shares!!!! to the moon ⬆️⬆️⬆️,2020-04-22
1372,PupPop,fo7d3mn,/r/pennystocks/comments/g62dbx/decn_dip/fo7d3mn/,1,Jesus gimme proof. If real you're about to be quite rich.,2020-04-22
1373,brandon152515,fo7d43b,/r/pennystocks/comments/g63seh/pctl_lookin_niccceeee/fo7d43b/,1,Is this a hold for the week?,2020-04-22
1374,isaac11117,fo7d4z2,/r/pennystocks/comments/g5zt2e/reminder_that_decns_test_will_be_a_finger_prick/fo7d4z2/,2,Charlie Schwab doesn't charge any fees for OTCs ;),2020-04-22
1375,Not_Flygon,fo7d65u,/r/pennystocks/comments/g64m29/thanks_for_joining_me_on_this_decn_adventure_book/fo7d65u/,1,"Not to burst anyone’s bubble, but be careful... news may be priced in when it drops 

Just so you know, I also own DECN",2020-04-22
1376,isaac11117,fo7d882,/r/pennystocks/comments/g5zt2e/reminder_that_decns_test_will_be_a_finger_prick/fo7d882/,1,Interesting! more lambos! :D,2020-04-22
1377,mamaboosie,fo7d8kl,/r/pennystocks/comments/g64ikm/decn_to_the_moon/fo7d8kl/,3,12K @ .14875 I’m already at over 100% return 🙌,2020-04-22
1378,ExXxplicitThoughts,fo7da4r,/r/pennystocks/comments/g5zt2e/reminder_that_decns_test_will_be_a_finger_prick/fo7da4r/,1,"Thanks for the tip, will be sure to check it out! 🤙",2020-04-22
1379,NewDisguiseNudistGuy,fo7ddbe,/r/pennystocks/comments/g64ikm/decn_to_the_moon/fo7ddbe/,2,"Smart. I won a lot with CODX when it first went to $20, lost it all within the following weeks",2020-04-22
1380,isaac11117,fo7dibo,/r/pennystocks/comments/g64ikm/decn_to_the_moon/fo7dibo/,3,Believe!!! take a loan out for 4 more!,2020-04-22
1381,alexesver,fo7djgf,/r/pennystocks/comments/g64ikm/decn_to_the_moon/fo7djgf/,3,At this rate imma own the dealership.,2020-04-22
1382,MisterPicklecopter,fo7dlk4,/r/pennystocks/comments/g64ikm/decn_to_the_moon/fo7dlk4/,3,"35,500 at .13. I just added another 3,500 and planning to hold. The world is going to need billions of these tests and their market cap is still under $50M. 

Things get extra interesting with the antibody test, I expect even greater demand than the virus test.",2020-04-22
1383,mamaboosie,fo7dmer,/r/pennystocks/comments/g64ikm/decn_to_the_moon/fo7dmer/,2,If you just opened a new account it takes around 5 days to clear for trading. (True for E*TRADE and others too),2020-04-22
1384,Reddit_and_forgeddit,fo7dpmh,/r/pennystocks/comments/g64ikm/decn_to_the_moon/fo7dpmh/,3,Not true if you wire money on td ameritrade after opening account.,2020-04-22
1385,UpSideofDown,fo7dpon,/r/pennystocks/comments/g645y1/decn_heres_the_thing/fo7dpon/,3,This is my Monday Lambo...,2020-04-22
1386,Pyroxy3,fo7dpys,/r/pennystocks/comments/g64m29/thanks_for_joining_me_on_this_decn_adventure_book/fo7dpys/,4,I'm riding this baby all the way to 30$. Gonna remove the rear view mirror in my lambo cause I'm never lookin back. Cya!,2020-04-22
1387,NYC_summer,fo7duq5,/r/pennystocks/comments/g64ikm/decn_to_the_moon/fo7duq5/,2,What do the fees look like on Fidelity?,2020-04-22
1388,Kyism,fo7duys,/r/pennystocks/comments/g5tej1/pctl/fo7duys/,1,This is solid DD thank you. I will invest in them,2020-04-22
1389,Kyism,fo7dytq,/r/pennystocks/comments/g64ikm/decn_to_the_moon/fo7dytq/,3,I'm holding 19.9k shares and debating if I'm selling tomorrow or holding on for longer,2020-04-22
1390,scoot87,fo7e97r,/r/pennystocks/comments/g64ikm/decn_to_the_moon/fo7e97r/,2,Depending on when you decide to sell,2020-04-22
1391,[deleted],fo7ec9w,/r/pennystocks/comments/g5zt2e/reminder_that_decns_test_will_be_a_finger_prick/fo7ec9w/,1,[removed],2020-04-22
1392,alexesver,fo7ef2u,/r/pennystocks/comments/g64ikm/decn_to_the_moon/fo7ef2u/,2,I think that floor is pretty well established now. Looking like that floor may be shifting to .32 now,2020-04-22
1393,whiterhinoqueef,fo7efgw,/r/pennystocks/comments/g64ikm/decn_to_the_moon/fo7efgw/,5,Mattress dude checking in here. Should be all good as far as the mattress goes but if this gets in the $1-2 range I think we might be able to move out of her boyfriends house.,2020-04-22
1394,Arniescc,fo7efhp,/r/pennystocks/comments/g64hnx/decn_update_call_tomorrow/fo7efhp/,1,They are out of Nevada which is Pacific time zone,2020-04-22
1395,justusingredditUSA,fo7eflx,/r/pennystocks/comments/g64ikm/decn_to_the_moon/fo7eflx/,2,DO IT. if you’re not going into financial burden by doing so.,2020-04-22
1396,ExXxplicitThoughts,fo7eikf,/r/pennystocks/comments/g5zt2e/reminder_that_decns_test_will_be_a_finger_prick/fo7eikf/,1,Anyone notice WeBull is not available in app store anymore? Yet I still have it previously downloaded... 🤔,2020-04-22
1397,justusingredditUSA,fo7ej6o,/r/pennystocks/comments/g64ikm/decn_to_the_moon/fo7ej6o/,3,Keep me updated boys. We getting pet Llamas tomorrow.,2020-04-22
1398,maolighter,fo7ejkn,/r/pennystocks/comments/g64ikm/decn_to_the_moon/fo7ejkn/,2,Lmao fuck yeah let’s get it,2020-04-22
1399,Schistotwerka,fo7eptl,/r/pennystocks/comments/g64ikm/decn_to_the_moon/fo7eptl/,2,Too bad I bought in at .35,2020-04-22
1400,isaac11117,fo7ev8t,/r/pennystocks/comments/g5zt2e/reminder_that_decns_test_will_be_a_finger_prick/fo7ev8t/,1,NP! just bought 3000 more shares of DECN ;),2020-04-22
1401,[deleted],fo7ezgd,/r/pennystocks/comments/g5zt2e/reminder_that_decns_test_will_be_a_finger_prick/fo7ezgd/,1,[removed],2020-04-22
1402,bigdigdoug,fo7f7aa,/r/pennystocks/comments/g61xn7/sgmd_under_a_penny_stock/fo7f7aa/,1,"Only my opinion but for context I got on this 2yrs ago at .06 - I'm currently at -94.72%
I should have taken the gain i had 1.5yrs ago but oh well. I've spent more on dumber stuff.
I'll spend (lose)my money elsewhere.",2020-04-22
1403,Arniescc,fo7fbjg,/r/pennystocks/comments/g61fzj/aiki_news/fo7fbjg/,1,"Yes,what is weird is they own a lot of Hoth stock and it is up a lot today yet AIKI is down.",2020-04-22
1404,alexesver,fo7fj28,/r/pennystocks/comments/g64m29/thanks_for_joining_me_on_this_decn_adventure_book/fo7fj28/,3,Wait what were thinking it’s going to 30$?,2020-04-22
1405,reddituser-10235,fo7foye,/r/pennystocks/comments/g64ikm/decn_to_the_moon/fo7foye/,3,I bought 3800 shares at .25. I still have like 1k laying around. Should I invest in more shares? I’m okay with losing it. This is my first penny stock so I’m kinda nervous on the decision.,2020-04-22
1406,bluto2003,fo7frfi,/r/pennystocks/comments/g64ikm/decn_to_the_moon/fo7frfi/,2,3650 at .21. Excited to have found this,2020-04-22
1407,Groovytime2,fo7fytv,/r/pennystocks/comments/g64ikm/decn_to_the_moon/fo7fytv/,3,This is a long shot but do you think we could get this to a dollar today👀👀,2020-04-22
1408,alexesver,fo7g8mo,/r/pennystocks/comments/g64ikm/decn_to_the_moon/fo7g8mo/,3,"No. But with EOD buyers rolling around 2:30-close we could prob get to .40
Never say never tho",2020-04-22
1409,bennybouch,fo7g8r7,/r/pennystocks/comments/g64ikm/decn_to_the_moon/fo7g8r7/,2,"hanging at 13,500 shares now.. just bought 4500 @ .33.  can't drive a lambo around unless you got big stones",2020-04-22
1410,ama_gladiator,fo7gbmj,/r/pennystocks/comments/g64ikm/decn_to_the_moon/fo7gbmj/,2,"8000 at .205

Put another buy 4000 order in at .31, then changed it to .32 , then .33.  It keeps outrunning me. Lol. 

I’ll drive it to the moon $.01 at a time.",2020-04-22
1411,alexesver,fo7gbna,/r/pennystocks/comments/g64ikm/decn_to_the_moon/fo7gbna/,3,It’ll prob get to .40 today by close. The rest of that decision is up to you,2020-04-22
1412,AnonMobile2010,fo7gc32,/r/pennystocks/comments/g64ikm/decn_to_the_moon/fo7gc32/,2,I cant even buy it on Robinhood. Doesn't even show up for me. Good luck on the riches.,2020-04-22
1413,CG_Ops,fo7gcyu,/r/pennystocks/comments/g64ikm/decn_to_the_moon/fo7gcyu/,2,Picked it up on Vanguard too,2020-04-22
1414,PupPop,fo7gd6v,/r/pennystocks/comments/g64ikm/decn_to_the_moon/fo7gd6v/,2,Instant classic.,2020-04-22
1415,gottchanow,fo7gdlc,/r/pennystocks/comments/g61fzj/aiki_news/fo7gdlc/,1,I bought in way too high and am now stuck.,2020-04-22
1416,Pyroxy3,fo7gdok,/r/pennystocks/comments/g64m29/thanks_for_joining_me_on_this_decn_adventure_book/fo7gdok/,7,Go big or go homeless.,2020-04-22
