,title,id,author,url,score,num_comments,text,date,link
0,"Is it better to buy many stocks, or put a lot of money into a few?",f221u9,Not_Flygon,https://www.reddit.com/r/pennystocks/comments/f221u9/is_it_better_to_buy_many_stocks_or_put_a_lot_of/,1,5,"What are your opinions on buying a bunch of shares of a few stocks, or buying about 20 shares of a ton of stocks?",2020-02-11,https://www.reddit.com/r/pennystocks/comments/f221u9/is_it_better_to_buy_many_stocks_or_put_a_lot_of/
1,Interested in learning more about Selling Options? (Usable with certain penny stocks),f20ps1,its_danyul,https://www.reddit.com/r/pennystocks/comments/f20ps1/interested_in_learning_more_about_selling_options/,1,2,"I've been getting a few messages with penny stock traders asking me what the benefits of selling options are. If you are interested in learning how to sell options, and even apply it to certain penny stocks, we have a free community that discusses selling options. If you are interested in learning, enthusiastic, and active, you can learn how to sell options. Invite only and limited space, we can only teach so many. 


https://discord.gg/Vmrm2m


This is not an ad for profit. We wish to find like minded individuals who are interested in increasing their knowledge. Thank you.",2020-02-11,https://www.reddit.com/r/pennystocks/comments/f20ps1/interested_in_learning_more_about_selling_options/
2,Anyone playing MTLO earnings?,f1zo7a,migbyo,https://www.reddit.com/r/pennystocks/comments/f1zo7a/anyone_playing_mtlo_earnings/,1,2,Earnings on Feb. 26... There's usually been a run-up in the past since it's a pretty liquid stock.,2020-02-11,https://www.reddit.com/r/pennystocks/comments/f1zo7a/anyone_playing_mtlo_earnings/
3,Do you buy and hold the stocks for many days? Or just buy and sell quickly within few hours for some profits?,f28vk8,share122018,https://www.reddit.com/r/pennystocks/comments/f28vk8/do_you_buy_and_hold_the_stocks_for_many_days_or/,1,0,,2020-02-11,https://www.reddit.com/r/pennystocks/comments/f28vk8/do_you_buy_and_hold_the_stocks_for_many_days_or/
4,02/11/20 MORNING WATCHLIST,f28l5o,mtmtrader,https://www.reddit.com/r/pennystocks/comments/f28l5o/021120_morning_watchlist/,1,6,"Here is my trading watchlist for the day with the largest gap ups, gap downs, previous day movers, news headlines, support, resistance, etc!

[https://masterthemarket.teachable.com/p/morning-watchlist](https://masterthemarket.teachable.com/p/morning-watchlist)",2020-02-11,https://www.reddit.com/r/pennystocks/comments/f28l5o/021120_morning_watchlist/
5,What is the move today in the stock market?,f27a10,samfrat66,https://www.reddit.com/r/pennystocks/comments/f27a10/what_is_the_move_today_in_the_stock_market/,1,0,[removed],2020-02-11,https://www.reddit.com/r/pennystocks/comments/f27a10/what_is_the_move_today_in_the_stock_market/
6,ONTX nosedive !,f2d814,Promiller98,https://www.reddit.com/r/pennystocks/comments/f2d814/ontx_nosedive/,1,0,[removed],2020-02-11,https://www.reddit.com/r/pennystocks/comments/f2d814/ontx_nosedive/
7,ONTX nosedive !,f2d811,Promiller98,https://www.reddit.com/r/pennystocks/comments/f2d811/ontx_nosedive/,1,0,[removed],2020-02-11,https://www.reddit.com/r/pennystocks/comments/f2d811/ontx_nosedive/
8,looking at getting into stonks help,f2d2e2,BamppXx,https://www.reddit.com/r/pennystocks/comments/f2d2e2/looking_at_getting_into_stonks_help/,1,8,"howdy, I'm new to stocks and only have a minimal idea of how to invest. If you have any recommendations on how to learn, where to invest, investing apps(?), etc please let me know. I know the bigger the investment the higher return could be but I can't put a lot into anything at the moment.

thanks",2020-02-11,https://www.reddit.com/r/pennystocks/comments/f2d2e2/looking_at_getting_into_stonks_help/
9,"February 11, 2020 Tomorrow's Daily /r/Pennystocks Discussion - What are your Wednesday plays?",f2c7dm,AutoModerator,https://www.reddit.com/r/pennystocks/comments/f2c7dm/february_11_2020_tomorrows_daily_rpennystocks/,1,8,"Please use this thread to discuss your plays of the day!

Since this thread is likely to fill up quickly, consider sorting the comments by ""new"" (instead of ""best"" or ""top"") to see the newest posts.",2020-02-11,https://www.reddit.com/r/pennystocks/comments/f2c7dm/february_11_2020_tomorrows_daily_rpennystocks/
10,Prepare for ONVO to reach above 1$,f2c571,samfrat66,https://www.reddit.com/r/pennystocks/comments/f2c571/prepare_for_onvo_to_reach_above_1/,1,5,ONVO is planning to merge after the 1st quarter of 2020 I read? They seem like a promising company no? Ideas thoughts need insight on those that might be holding or might be buying.,2020-02-11,https://www.reddit.com/r/pennystocks/comments/f2c571/prepare_for_onvo_to_reach_above_1/
11,Favorite technical analysis?,f2bz6l,xfactor90,https://www.reddit.com/r/pennystocks/comments/f2bz6l/favorite_technical_analysis/,1,2,"Hey guys, what are your go-to technical analysis indicators that have helped you make money (or save) in bullish/bearish pattern setups? 

I’m using SMA variations currently. Interested in what others use?",2020-02-11,https://www.reddit.com/r/pennystocks/comments/f2bz6l/favorite_technical_analysis/
12,Is anybody looking at $AABB?,f2byp0,nsaquatics,https://www.reddit.com/r/pennystocks/comments/f2byp0/is_anybody_looking_at_aabb/,1,4,"They published their drilling results from their Mine in  Guerrero, Mexico with Medium to High Grade results. They also just signed a letter of intent to Acquire a new gold mine in South America.",2020-02-11,https://www.reddit.com/r/pennystocks/comments/f2byp0/is_anybody_looking_at_aabb/
13,BUY BUY BUY BUY BUY BUY BUY BUY BUY BUY BUY BUY BUY BUY BUY BUY BUY Vaccine Cure #CARONAVIRUS comming will be a $15.00 to $20 Stock!!$$$$$$$$$$ BUY AND HOLD IBIO &amp; TTNP,f2bjmp,Wallstbrokers7,https://www.reddit.com/r/pennystocks/comments/f2bjmp/buy_buy_buy_buy_buy_buy_buy_buy_buy_buy_buy_buy/,1,0,[removed],2020-02-11,https://www.reddit.com/r/pennystocks/comments/f2bjmp/buy_buy_buy_buy_buy_buy_buy_buy_buy_buy_buy_buy/
14,What is the deal with M Line Holdings $MLHC,f2b6cd,tericket,https://www.reddit.com/r/pennystocks/comments/f2b6cd/what_is_the_deal_with_m_line_holdings_mlhc/,1,4,"I bought 20,000 shares of this and it seems like it hasn’t moved. I am confused at what is going on.",2020-02-11,https://www.reddit.com/r/pennystocks/comments/f2b6cd/what_is_the_deal_with_m_line_holdings_mlhc/
15,"What’s the cheapest broker, per-trade, to buy and sell penny stocks on?",f2em9i,OrenthalJames69420,https://www.reddit.com/r/pennystocks/comments/f2em9i/whats_the_cheapest_broker_pertrade_to_buy_and/,1,0,[removed],2020-02-11,https://www.reddit.com/r/pennystocks/comments/f2em9i/whats_the_cheapest_broker_pertrade_to_buy_and/
16,What’s better to trade penny stocks e-trade or fidelity?,f2eim0,OrenthalJames69420,https://www.reddit.com/r/pennystocks/comments/f2eim0/whats_better_to_trade_penny_stocks_etrade_or/,1,8,"I just turned 18 and am looking to learn about trading, I will most likely only be buying and selling penny stocks and not holding a stock for more then a few days at most, but what extra fees do these brokerage accounts charge? A commission? What’s a per-contract fee? And is it really free to just buy and sell?",2020-02-11,https://www.reddit.com/r/pennystocks/comments/f2eim0/whats_better_to_trade_penny_stocks_etrade_or/
17,BREAKING NEWS ! $TTCM- TAUTACHROME INC. - ARknet,f2dkhc,kingofcash1,https://www.reddit.com/r/pennystocks/comments/f2dkhc/breaking_news_ttcm_tautachrome_inc_arknet/,1,0,[removed],2020-02-11,https://www.reddit.com/r/pennystocks/comments/f2dkhc/breaking_news_ttcm_tautachrome_inc_arknet/
18,ONTX,f2daja,lagrat,https://www.reddit.com/r/pennystocks/comments/f2daja/ontx/,1,0,"Looks like a big dip during the conference, hold or save? bought in at .4 and still holding, got high risk tolerance",2020-02-11,https://www.reddit.com/r/pennystocks/comments/f2daja/ontx/
19,Oragenics?,f2h7u9,samfrat66,https://www.reddit.com/r/pennystocks/comments/f2h7u9/oragenics/,1,9,They were at a conference today but I could see bum fuck nothing on the conference what happened and when will the information be available looked on the website and the last thing that was posted was Friday.,2020-02-11,https://www.reddit.com/r/pennystocks/comments/f2h7u9/oragenics/
20,TTNP GOING FROM .33 CENTS TO $10.00 PRESS RELEASE https://markets.businessinsider.com/news/stocks/quebec-new-brunswick-newfoundland-nova-scotia-and-manitoba-join-alberta-saskatchewan-in-adding-knight-s-probuphine-to-their-provincial-drug-plans-in-the-fight-against-the-opioid-crisis-1028895703,f2gzu2,Tipoftheday77777,https://www.reddit.com/r/pennystocks/comments/f2gzu2/ttnp_going_from_33_cents_to_1000_press_release/,1,15,     TTNP GOING FROM .33 CENTS TO $10.00 PRESS RELEASE JUST OUT TTNP =$$$$$$ https://markets.businessinsider.com/news/stocks/quebec-new-brunswick-newfoundland-nova-scotia-and-manitoba-join-alberta-saskatchewan-in-adding-knight-s-probuphine-to-their-provincial-drug-plans-in-the-fight-against-the-opioid-crisis-1028895703,2020-02-11,https://www.reddit.com/r/pennystocks/comments/f2gzu2/ttnp_going_from_33_cents_to_1000_press_release/
21,$MYFT,f2argj,MrVolatility,https://www.reddit.com/r/pennystocks/comments/f2argj/myft/,1,11,"- 912 million Outstanding shares 
- Loading going on right now for next up wave
Banktank play
- Tons of Twitter hype
- Trading very thin
 Currently at 0.0045 


Should be a nice Pump

Next stop: Sexy town.",2020-02-11,https://www.reddit.com/r/pennystocks/comments/f2argj/myft/
22,AGRX,f2ap6x,Jaxon9182,https://www.reddit.com/r/pennystocks/comments/f2ap6x/agrx/,1,22,"Got in on AGRX at $4.02 and now it's up to $4.47 today, I was expecting it to reach around $5.00 by Friday when I intend(ed?) to sell before the weekend Twirla PDUFA, it is climbing faster than expected and I'm wondering what everyone's thoughts/projections on it are",2020-02-11,https://www.reddit.com/r/pennystocks/comments/f2ap6x/agrx/
23,$PMCB trying to fight higher,f2ac20,Kenny_Soulstring,https://www.reddit.com/r/pennystocks/comments/f2ac20/pmcb_trying_to_fight_higher/,1,0,"https://finance.yahoo.com/news/pharmacyte-biotechs-cell-box-r-153100739.html
Will PharmaCyte Biotech's Cell-in-a-Box(R) Technology Be The Game Changer To Effectively Treating Pancreatic Cancer?",2020-02-11,https://www.reddit.com/r/pennystocks/comments/f2ac20/pmcb_trying_to_fight_higher/
24,$ALRT,f29x1f,lyme43,https://www.reddit.com/r/pennystocks/comments/f29x1f/alrt/,1,0,"This is going to be big in diabetes management across the world.  


https://www.alrt.com/news/2020/02/11/alrt-partners-with-sgh-to-conduct-clinical-pilot",2020-02-11,https://www.reddit.com/r/pennystocks/comments/f29x1f/alrt/
25,Drone Delivery Canada?,f29ex4,SuperKolbasa,https://www.reddit.com/r/pennystocks/comments/f29ex4/drone_delivery_canada/,1,0,"Anybody have any interest in this? They are holding a showcase at the Canadian International Auto-show. Just curious if anyone is familiar, I have no number for you guys.",2020-02-11,https://www.reddit.com/r/pennystocks/comments/f29ex4/drone_delivery_canada/
26,IMTL,f29al3,Engineeredweed,https://www.reddit.com/r/pennystocks/comments/f29al3/imtl/,1,8,Does anyone know if IMTL is out of business/bankrupt? Any hope for its future?,2020-02-11,https://www.reddit.com/r/pennystocks/comments/f29al3/imtl/
27,AIM,f29661,usdblades,https://www.reddit.com/r/pennystocks/comments/f29661/aim/,1,19,Anyone else get in on $AIM. Im in at 1.11 feeling good this morning,2020-02-11,https://www.reddit.com/r/pennystocks/comments/f29661/aim/
28,"Morning plays! Good luck(OCGN, ONTX,ADXS)",f295pn,notanotherkevin,https://www.reddit.com/r/pennystocks/comments/f295pn/morning_plays_good_luckocgn_ontxadxs/,1,44,"Early morning movers:
ADXS-news 
OCGN-not a bad play here for scalp at the open pop
ONTX-Dont chase has been running for a week",2020-02-11,https://www.reddit.com/r/pennystocks/comments/f295pn/morning_plays_good_luckocgn_ontxadxs/
29,New report out on Psychedelic investment trends - What is everyones favorite psychedelic stock picks ?,f292kt,Hellcat_v8,https://www.reddit.com/r/pennystocks/comments/f292kt/new_report_out_on_psychedelic_investment_trends/,1,2,"[Who are the Main Players in the Growing Investment Trend in Psychedelic Medicine?](http://investingbulletin.com/2020/02/who-are-the-main-players-in-the-growing-investment-trend-in-psychedelic-medicine/)

Link: [http://investingbulletin.com/2020/02/who-are-the-main-players-in-the-growing-investment-trend-in-psychedelic-medicine/](http://investingbulletin.com/2020/02/who-are-the-main-players-in-the-growing-investment-trend-in-psychedelic-medicine/)

Id love to hear some thoughts - And, does anyone know any penny stocks that deal with psychedelic medicine/products?",2020-02-11,https://www.reddit.com/r/pennystocks/comments/f292kt/new_report_out_on_psychedelic_investment_trends/
30,New report out on Psychedelic investment trends - What is everyones favorite psychedelic stock picks ?,f292dg,Biotechz_500,https://www.reddit.com/r/pennystocks/comments/f292dg/new_report_out_on_psychedelic_investment_trends/,1,0,[removed],2020-02-11,https://www.reddit.com/r/pennystocks/comments/f292dg/new_report_out_on_psychedelic_investment_trends/
31,New report out on Psychedelic investment trends - What is everyones favorite psychedelic stock picks ?,f2923s,Lambo_Bob,https://www.reddit.com/r/pennystocks/comments/f2923s/new_report_out_on_psychedelic_investment_trends/,1,0,[removed],2020-02-11,https://www.reddit.com/r/pennystocks/comments/f2923s/new_report_out_on_psychedelic_investment_trends/
