,title,id,url,score,num_comments,text,date,link
178,صفقات كبرى قد تشهدها كرة القدم الأوروبية في 2018,7nh99d,https://www.reddit.com/r/worldnews/comments/7nh99d/صفقات_كبرى_قد_تشهدها_كرة_القدم_الأوروبية_في_2018/,1,0,,2018-01-01,http://wadifat-maroc.blogspot.com/2018/01/2018_1.html
179,"﻿Odgrodzenia Farmerskie (Dla Rumaków), Koneser",7nh97r,https://www.reddit.com/r/worldnews/comments/7nh97r/odgrodzenia_farmerskie_dla_rumaków_koneser/,1,0,,2018-01-01,http://www.docsandmeds.ng/forum/index.php?action=profile;u=53862
180,"Fresh protests reported in Tehran: Fresh protests have broken out in the Iranian capital, with images of burning cars on local media and online reports of heavy police presence.",7nh93p,https://www.reddit.com/r/worldnews/comments/7nh93p/fresh_protests_reported_in_tehran_fresh_protests/,19,12,,2018-01-01,https://www.rte.ie/news/world/2018/0101/930439-iran-protests/
181,Christopher Dawson Quotes About Men – 45909,7nh8xr,https://www.reddit.com/r/worldnews/comments/7nh8xr/christopher_dawson_quotes_about_men_45909/,1,0,,2018-01-01,http://www.trendquotes.com/christopher-dawson-quotes-about-men-45909/
182,﻿Nastrojowe Przegrodzenia,7nh8xk,https://www.reddit.com/r/worldnews/comments/7nh8xk/nastrojowe_przegrodzenia/,1,1,,2018-01-01,http://axzyz.org/home.php?mod=space&amp;uid=28455
183,Israel seeks to charge Palestinian teen who slapped soldiers,7nh8u6,https://www.reddit.com/r/worldnews/comments/7nh8u6/israel_seeks_to_charge_palestinian_teen_who/,2,8,,2018-01-01,http://www.france24.com/en/20180101-israel-palestinian-conflict-charges-teen-tamimi-viral-video-slapping-soldiers-occupation
184,New technology means you may never need to charge again,7nh7y6,https://www.reddit.com/r/worldnews/comments/7nh7y6/new_technology_means_you_may_never_need_to_charge/,3,3,,2018-01-01,https://www.nbcnews.com/business/autos/cellphones-cars-these-batteries-could-cut-cord-forever-n833621
185,"From cellphones to cars, cars these batteries could but cord forever",7nh7ra,https://www.reddit.com/r/worldnews/comments/7nh7ra/from_cellphones_to_cars_cars_these_batteries/,1,0,[deleted],2018-01-01,https://www.nbcnews.com/business/autos/cellphones-cars-these-batteries-could-cut-cord-forever-n833621
186,VIDEO: “Drake No Be God Now” – Davido Rips Into Drake and International Collaboration,7nh74e,https://www.reddit.com/r/worldnews/comments/7nh74e/video_drake_no_be_god_now_davido_rips_into_drake/,1,1,,2018-01-01,http://edujandon.com/2018/01/video-drake-no-be-god-now-davido-rips-into-drake-and-international-collaboration.html/
187,Shahrukh Khan Lifestyle 2018,7nh5lm,https://www.reddit.com/r/worldnews/comments/7nh5lm/shahrukh_khan_lifestyle_2018/,1,0,,2018-01-01,https://www.youtube.com/watch?v=Iw3P-IBvanU
188,"Freemasons are blocking reform, says Police Federation leader",7nh5gc,https://www.reddit.com/r/worldnews/comments/7nh5gc/freemasons_are_blocking_reform_says_police/,10,24,,2018-01-01,https://www.theguardian.com/uk-news/2017/dec/31/freemasons-blocking-reform-police-federation-leader
189,Einstein's spacetime doesn't exist!!!,7nh56c,https://www.reddit.com/r/worldnews/comments/7nh56c/einsteins_spacetime_doesnt_exist/,1,0,,2018-01-01,http://www.absolute-relativity.eu
190,Special Movies and Artworks of Tekken Movie No 11,7nh552,https://www.reddit.com/r/worldnews/comments/7nh552/special_movies_and_artworks_of_tekken_movie_no_11/,1,1,,2018-01-01,http://www.itsupergift.com/special-movies-and-artworks-of-tekken-movie-no-11/
191,شب يبحث عن فتاة للصداقة,7nh53s,https://www.reddit.com/r/worldnews/comments/7nh53s/شب_يبحث_عن_فتاة_للصداقة/,1,1,,2018-01-01,https://jo.sogarab.com/ad-44902.html
192,﻿Dysponuję Wyznaczenia Na Rozgraniczenia Do Fryc,7nh4sm,https://www.reddit.com/r/worldnews/comments/7nh4sm/dysponuję_wyznaczenia_na_rozgraniczenia_do_fryc/,1,1,,2018-01-01,http://www.heilz.com/home.php?mod=space&amp;uid=1460731&amp;do=profile
193,Henry A. Wallace Quotes About Power – 56974,7nh4go,https://www.reddit.com/r/worldnews/comments/7nh4go/henry_a_wallace_quotes_about_power_56974/,1,0,,2018-01-01,http://www.trendquotes.com/henry-a-wallace-quotes-about-power-56974/
194,Sydney welcomes 2018 with eight tonnes of fireworks,7nh4ev,https://www.reddit.com/r/worldnews/comments/7nh4ev/sydney_welcomes_2018_with_eight_tonnes_of/,3,3,,2018-01-01,https://www.theguardian.com/australia-news/2017/dec/31/new-years-eve-police-block-roads-in-australian-cities-as-revellers-prepare-for-fireworks
195,Death toll jumps as Iran protests continue,7nh3u4,https://www.reddit.com/r/worldnews/comments/7nh3u4/death_toll_jumps_as_iran_protests_continue/,9,1,,2018-01-01,http://www.aljazeera.com/news/2018/01/death-toll-jumps-iran-protests-continue-180101113226107.html
196,"After 27 years, Somalia regains control of airspace management — Shabelle",7nh3rn,https://www.reddit.com/r/worldnews/comments/7nh3rn/after_27_years_somalia_regains_control_of/,1,1,,2018-01-01,http://radioshabelle.com/27-years-somalia-regains-control-airspace-management/
197,PDP Spits Fire As It Reacts To President Buhari’s New Year Speech,7nh2o2,https://www.reddit.com/r/worldnews/comments/7nh2o2/pdp_spits_fire_as_it_reacts_to_president_buharis/,1,1,,2018-01-01,http://edujandon.com/2018/01/pdp-spits-fire-as-it-reacts-to-president-buharis-new-year-speech.html/
198,May I plug my daughter's boyfriend's game? 50 out of 50 by Tony Cicero,7nh2lc,https://www.reddit.com/r/worldnews/comments/7nh2lc/may_i_plug_my_daughters_boyfriends_game_50_out_of/,1,0,,2018-01-01,http://questswamppeopledeer.blogspot.com/2018/01/may-i-plug-my-daughters-boyfriends-game.html
199,"In China, rental bikes have become a social menace",7nh2kw,https://www.reddit.com/r/worldnews/comments/7nh2kw/in_china_rental_bikes_have_become_a_social_menace/,51,25,,2018-01-01,https://news.sky.com/story/in-china-rental-bikes-have-become-a-social-menace-11191053
200,"Emboldened by Trump, Israel's leading party moves to cement control over West Bank settlements",7nh1yh,https://www.reddit.com/r/worldnews/comments/7nh1yh/emboldened_by_trump_israels_leading_party_moves/,32,23,,2018-01-01,http://www.newsweek.com/2018-israel-likud-leading-party-israeli-settlements-west-bank-767388
201,Independent Educational Consultant - h2dcounseling.com,7nh13q,https://www.reddit.com/r/worldnews/comments/7nh13q/independent_educational_consultant/,1,1,,2018-01-01,http://www.dailymotion.com/video/x6ci4cw
202,Marijuana companies caught using banned pesticides to face fines up to $1-million,7nh0jm,https://www.reddit.com/r/worldnews/comments/7nh0jm/marijuana_companies_caught_using_banned/,54376,1776,,2018-01-01,https://www.theglobeandmail.com/news/national/marijuana-companies-caught-using-banned-pesticides-to-face-fines-up-to-1-million/article37465380/
203,Simon Wiesenthal Quotes About Men – 45715,7nh01j,https://www.reddit.com/r/worldnews/comments/7nh01j/simon_wiesenthal_quotes_about_men_45715/,1,0,,2018-01-01,http://www.trendquotes.com/simon-wiesenthal-quotes-about-men-45715/
204,Pakistan's government hits back at Trump over foreign aid threat: US has 'given us nothing but mistrust',7ngztw,https://www.reddit.com/r/worldnews/comments/7ngztw/pakistans_government_hits_back_at_trump_over/,2,4,,2018-01-01,http://www.washingtonexaminer.com/pakistans-government-hits-back-at-trump-over-foreign-aid-threat-us-has-given-us-nothing-but-mistrust/article/2644697
205,Report: U.S. Gives Israel Green Light to Assassinate Iranian General Soleimani,7ngzox,https://www.reddit.com/r/worldnews/comments/7ngzox/report_us_gives_israel_green_light_to_assassinate/,1,0,,2018-01-01,https://www.haaretz.com/israel-news/1.832387
206,"In Iceland, an example of what happens if you actually elect women",7ngzh8,https://www.reddit.com/r/worldnews/comments/7ngzh8/in_iceland_an_example_of_what_happens_if_you/,0,67,,2018-01-01,https://thinkprogress.org/in-iceland-its-now-illegal-to-pay-women-less-than-men-68e5a633a8d8/
207,“I Talk To Her Ghost And She Visits Me In Bed” – Father Of Amy Winehouse Who Died 6 Years Ago Shocks The World,7ngzea,https://www.reddit.com/r/worldnews/comments/7ngzea/i_talk_to_her_ghost_and_she_visits_me_in_bed/,1,1,,2018-01-01,http://edujandon.com/2018/01/i-talk-to-her-ghost-and-she-visits-me-in-bed-father-of-amy-winehouse-who-died-6-years-ago-shocks-the-world.html/
208,Saudi-led New Year airstrikes kill 20 civilians in Yemen's crowded market,7ngycz,https://www.reddit.com/r/worldnews/comments/7ngycz/saudiled_new_year_airstrikes_kill_20_civilians_in/,68,5,,2018-01-01,http://www.xinhuanet.com/english/2018-01/02/c_136865329.htm
209,Suspected Saudi-led coalition airstrikes in Yemen kill 23,7ngxur,https://www.reddit.com/r/worldnews/comments/7ngxur/suspected_saudiled_coalition_airstrikes_in_yemen/,1,1,[deleted],2018-01-01,https://www.washingtonpost.com/world/middle_east/suspected-saudi-led-coalition-airstrikes-in-yemen-kill-23/2018/01/01/587ce276-ef03-11e7-95e3-eff284e71c8d_story.html
210,Israel indicts teenage Palestinian girl who slapped soldiers,7ngxhy,https://www.reddit.com/r/worldnews/comments/7ngxhy/israel_indicts_teenage_palestinian_girl_who/,33,17,,2018-01-01,http://abcnews.go.com/International/wireStory/israel-indicts-teenage-palestinian-girl-slapped-soldiers-52083870
211,"China develops underwater surveillance networks in Indian Ocean, South China Sea",7ngwtr,https://www.reddit.com/r/worldnews/comments/7ngwtr/china_develops_underwater_surveillance_networks/,8,2,,2018-01-01,https://timesofindia.indiatimes.com/world/china/china-develops-underwater-surveillance-networks-in-indian-ocean-south-china-sea/articleshow/62326706.cms
212,"Pope Francis says humanity 'wasted' 2017 with war, lies.",7ndw6h,https://www.reddit.com/r/worldnews/comments/7ndw6h/pope_francis_says_humanity_wasted_2017_with_war/,111,54,[deleted],2018-01-01,http://www.nydailynews.com/news/world/pope-francis-humanity-wasted-2017-war-lies-article-1.3730419
213,"UK CEO and family killed in seaplane crash in Sydney, Australia",7ndw60,https://www.reddit.com/r/worldnews/comments/7ndw60/uk_ceo_and_family_killed_in_seaplane_crash_in/,1,1,[deleted],2018-01-01,http://www.news.com.au/national/breaking-news/divers-prepare-to-refloat-sunken-seaplane/news-story/4a22125577253bdbac8eba8870cb3d28
214,Frida Kahlo Quotes About Alone – 1055,7ndvyr,https://www.reddit.com/r/worldnews/comments/7ndvyr/frida_kahlo_quotes_about_alone_1055/,1,0,,2018-01-01,http://www.trendquotes.com/frida-kahlo-quotes-about-alone-1055/
215,﻿¿Es Posible Aprender Inglés Durmiendo?,7ndvm1,https://www.reddit.com/r/worldnews/comments/7ndvm1/es_posible_aprender_inglés_durmiendo/,1,1,,2018-01-01,http://notmydrama.com/members/cooley14baldwin/activity/650078/
216,"Italian president calls for 'realistic' proposals ahead of election - “The duty to make adequate proposals - realistic and concrete ones - is a must given the dimension of the problems our country faces,” Mattarella said during a traditional end-year speech broadcast live on national television.",7ndvie,https://www.reddit.com/r/worldnews/comments/7ndvie/italian_president_calls_for_realistic_proposals/,16,2,,2018-01-01,https://www.reuters.com/article/us-italy-election/italian-president-calls-for-realistic-proposals-ahead-of-election-idUSKBN1EP0LE
217,At midnight WhatsApp crashed for an hour in India with Happy New Year wishes,7ndvdw,https://www.reddit.com/r/worldnews/comments/7ndvdw/at_midnight_whatsapp_crashed_for_an_hour_in_india/,1,0,,2018-01-01,http://www.kaniz.in/details.php?At-midnight-WhatsApp-crashed-for-an-hour-in-India-with-Happy-New-Year-wishes&amp;id=314
218,"New year, new rules: what changes around the world from 1 January",7ndv9y,https://www.reddit.com/r/worldnews/comments/7ndv9y/new_year_new_rules_what_changes_around_the_world/,1,0,,2018-01-01,https://www.theguardian.com/us-news/2018/jan/01/new-year-new-rules-what-changes-on-1-january-around-the-world
219,Trump-Russia inquiry: Australian PM denies US relationship damaged by Downer report - Malcolm Turnbull does not deny report that information from diplomat Alexander Downer sparked FBI investigation,7ndv6j,https://www.reddit.com/r/worldnews/comments/7ndv6j/trumprussia_inquiry_australian_pm_denies_us/,0,0,,2018-01-01,https://www.theguardian.com/us-news/2018/jan/01/trump-russia-inquiry-australia-malcolm-turnbull-denies-relationship-damaged-alexander-downer-george-papadopoulos
220,Love Quote of the Day,7ndurc,https://www.reddit.com/r/worldnews/comments/7ndurc/love_quote_of_the_day/,1,1,,2018-01-01,http://cartvela.blogspot.com/2017/12/love-quote-of-day_46.html
221,New years live in Jackson Hole WY,7ndur0,https://www.reddit.com/r/worldnews/comments/7ndur0/new_years_live_in_jackson_hole_wy/,1,0,,2018-01-01,https://youtu.be/a7jwCYuQarU
222,﻿10 Things Your Rivals Could Instruct You About Musically Online.,7ndup9,https://www.reddit.com/r/worldnews/comments/7ndup9/10_things_your_rivals_could_instruct_you_about/,1,1,,2018-01-01,https://www.couchsurfing.com/people/michael-cashman
223,﻿Sojusznik Skwery Zaś Przepierzenia,7ndudv,https://www.reddit.com/r/worldnews/comments/7ndudv/sojusznik_skwery_zaś_przepierzenia/,1,0,,2018-01-01,http://sophrologie-alsace.com/index.php/kunena/user/13828-ifujydan
224,Happy new year - 2018,7ndu1g,https://www.reddit.com/r/worldnews/comments/7ndu1g/happy_new_year_2018/,1,0,,2018-01-01,https://poultryindia.tumblr.com/post/169174831117
225,Prime Minister of Australia says Downer link to Russia probe won't hurt relationship with Donald Trump,7ndtxr,https://www.reddit.com/r/worldnews/comments/7ndtxr/prime_minister_of_australia_says_downer_link_to/,6,3,,2018-01-01,http://abc.net.au/news/2018-01-01/pm-says-downer-link-to-russia-probe-wont-hurt-relationship-with/9296854?pfmredir=sm&amp;
226,Rocketman says “Hes open to dialouge” with south korea,7ndtt0,https://www.reddit.com/r/worldnews/comments/7ndtt0/rocketman_says_hes_open_to_dialouge_with_south/,0,7,[deleted],2018-01-01,http://in.reuters.com/article/northkorea-missiles-kimjongun/north-koreas-kim-says-open-to-dialogue-with-south-korea-will-only-use-nukes-if-threatened-idINKBN1EQ0ON
227,Tegean Capital Management Has Upped Micron Technology (MU) Holding; Wells Fargo Co New (WFC) Stake Upped by Sand Hill Global Advisors Llc,7ndtnf,https://www.reddit.com/r/worldnews/comments/7ndtnf/tegean_capital_management_has_upped_micron/,1,1,,2018-01-01,https://normanweekly.com/tegean-capital-management-has-upped-micron-technology-mu-holding-wells-fargo-co-new-wfc-stake-upped-by-sand-hill-global-advisors-llc/
228,Pheromones for men,7ndtbo,https://www.reddit.com/r/worldnews/comments/7ndtbo/pheromones_for_men/,1,0,,2018-01-01,http://www.pheromones555.com/for-men.html
229,Top 10 Most Peaceful Countries In The World 2018,7ndstj,https://www.reddit.com/r/worldnews/comments/7ndstj/top_10_most_peaceful_countries_in_the_world_2018/,1,1,,2018-01-01,http://www.bbcnewshub.com/top-10-most-peaceful-countries-in-the-world-2018/
230,How to get free yugioh cards,7nds8n,https://www.reddit.com/r/worldnews/comments/7nds8n/how_to_get_free_yugioh_cards/,1,1,,2018-01-01,https://yugiohrewards.com/
231,PUC Exam 2018 Karnataka timetable released at kar.nic.in; Here’s how to check,7nds57,https://www.reddit.com/r/worldnews/comments/7nds57/puc_exam_2018_karnataka_timetable_released_at/,1,0,,2018-01-01,http://www.b2s.pm/Ioxh3A
232,When Is the Chinese New Year? How to Celebrate the 2018 Year of the Dog,7nds1t,https://www.reddit.com/r/worldnews/comments/7nds1t/when_is_the_chinese_new_year_how_to_celebrate_the/,3,1,,2018-01-01,http://www.newsweek.com/when-chinese-new-year-how-celebrate-2018-year-dog-766906
233,trick scooters for sale,7ndrx9,https://www.reddit.com/r/worldnews/comments/7ndrx9/trick_scooters_for_sale/,1,1,,2018-01-01,http://lib.akb.nis.edu.kz/user/donish4/
234,"It‘s not ‘genital mutilation,‘ says Muslim physician‘s lawyer - Detroit",7ndrl2,https://www.reddit.com/r/worldnews/comments/7ndrl2/its_not_genital_mutilation_says_muslim_physicians/,1,0,[deleted],2018-01-01,https://kaplanherald.com/2017/12/31/its-not-genital-mutilation-says-muslim-physicians-lawyer/
235,"London,UK,Berlin,Burj Khalifa Dubai,Philippines and Moscow fireworks at the start of new year 2018",7ndr5n,https://www.reddit.com/r/worldnews/comments/7ndr5n/londonukberlinburj_khalifa_dubaiphilippines_and/,1,0,,2018-01-01,https://youtu.be/aXU16BHAP6s
236,Howard Kurtz Helps Hemingway Dishonestly Attack Times Report On Papadopoulos Prompting Russia Investigation,7ndr29,https://www.reddit.com/r/worldnews/comments/7ndr29/howard_kurtz_helps_hemingway_dishonestly_attack/,1,1,,2018-01-01,http://www.newshounds.us/kurtz_hemingway_attack_times_report_papadopoulos_prompting_russia_investigation_123117
237,Maya Angelou Quotes About Education – 15787,7ndqok,https://www.reddit.com/r/worldnews/comments/7ndqok/maya_angelou_quotes_about_education_15787/,1,0,,2018-01-01,http://www.trendquotes.com/maya-angelou-quotes-about-education-15787/
238,Syrian First Family Visits Wounded Syrian Soldiers,7ndqay,https://www.reddit.com/r/worldnews/comments/7ndqay/syrian_first_family_visits_wounded_syrian_soldiers/,1,0,,2018-01-01,http://www.syrianews.cc/syrian-first-family-visits-wounded-soldiers/
239,Kim Jong-un: North Korea's nuclear arsenal is now complete,7ndq8w,https://www.reddit.com/r/worldnews/comments/7ndq8w/kim_jongun_north_koreas_nuclear_arsenal_is_now/,3,7,,2018-01-01,https://www.theguardian.com/world/2018/jan/01/kim-jong-un-north-korea-nuclear-arsenal
240,Einstein's spacetime doesn't exist!!!,7ndpn9,https://www.reddit.com/r/worldnews/comments/7ndpn9/einsteins_spacetime_doesnt_exist/,1,0,,2018-01-01,http://www.absolute-relativity.eu
241,"The Trump train hurtles into 2018. Buckle up, America",7ndpie,https://www.reddit.com/r/worldnews/comments/7ndpie/the_trump_train_hurtles_into_2018_buckle_up/,1,1,,2018-01-01,https://www.newsday.com/long-island/politics/the-trump-train-hurtles-into-2018-buckle-up-america-1.15729311
242,Special Movies and Artworks of Tekken Movie No 10,7ndp9q,https://www.reddit.com/r/worldnews/comments/7ndp9q/special_movies_and_artworks_of_tekken_movie_no_10/,1,1,,2018-01-01,http://www.itsupergift.com/special-movies-artworks-tekken-movie-no-10/
243,Future new technology | Fire rescue These should be built in to all skyscrapers!new technology electric cargo bike,7ndp48,https://www.reddit.com/r/worldnews/comments/7ndp48/future_new_technology_fire_rescue_these_should_be/,1,1,,2018-01-01,https://youtu.be/Xy7jjXEvT5Mhttps://youtu.be/TsYUsfu7gMw
244,Krka park,7ndooa,https://www.reddit.com/r/worldnews/comments/7ndooa/krka_park/,1,1,,2018-01-01,https://www.swedishnomad.com/krka-national-park-in-croatia/
245,Buy Duromine 30 mg Online ( Duromine Weight Loss ),7ndocj,https://www.reddit.com/r/worldnews/comments/7ndocj/buy_duromine_30_mg_online_duromine_weight_loss/,1,1,,2018-01-01,http://www.b2s.pm/8LNbPT
246,The ghostly radio station no one claims to run,7ndo7p,https://www.reddit.com/r/worldnews/comments/7ndo7p/the_ghostly_radio_station_no_one_claims_to_run/,1,1,,2018-01-01,https://www.myjoyonline.com/news/2017/December-31st/the-ghostly-radio-station-no-one-claims-to-run.php
247,The Best Gym Shoes for Every Workout |,7ndnvr,https://www.reddit.com/r/worldnews/comments/7ndnvr/the_best_gym_shoes_for_every_workout/,1,0,,2018-01-01,https://bestweightliftingshoes.net/weightlifting/best-cheap-weightlifting-shoe/
248,Grandmaster Flash Quotes About Attitude – 5036,7ndnq4,https://www.reddit.com/r/worldnews/comments/7ndnq4/grandmaster_flash_quotes_about_attitude_5036/,1,0,,2018-01-01,http://www.trendquotes.com/grandmaster-flash-quotes-about-attitude-5036/
249,Kelly Clarkson Sings ‘Stronger (What Doesn’t Kill You)’ On Dick Clark’s New Year’s Rockin’ Eve,7ndn3y,https://www.reddit.com/r/worldnews/comments/7ndn3y/kelly_clarkson_sings_stronger_what_doesnt_kill/,1,0,,2018-01-01,http://elgibborsms.com/blog/kelly-clarkson-sings-stronger-what-doesnt-kill-you-on-dick-clarks-new-years-rockin-eve/
250,South Korea seizes second ship suspected of providing oil to North Korea,7ndn17,https://www.reddit.com/r/worldnews/comments/7ndn17/south_korea_seizes_second_ship_suspected_of/,1,0,,2018-01-01,http://www.caliphatemedia.info/2017/12/south-korea-seizes-second-ship.html
251,"North Korea's kim says 'open to dialog' with south korea, will only use nukes if threatened",7ndmcr,https://www.reddit.com/r/worldnews/comments/7ndmcr/north_koreas_kim_says_open_to_dialog_with_south/,6,1,,2018-01-01,https://www.msn.com/en-us/news/world/north-koreas-kim-says-open-to-dialog-with-south-korea-will-only-use-nukes-if-threatened/ar-BBHDxTN?li=BBmkt5R&amp;ocid=spartanntp
252,SPDR S&amp;P 500 ETF Trust (SPY) is Stelac Advisory Services LLC’s Largest Position,7ndm7a,https://www.reddit.com/r/worldnews/comments/7ndm7a/spdr_sp_500_etf_trust_spy_is_stelac_advisory/,1,1,,2018-01-01,https://www.thelincolnianonline.com/2017/12/31/spdr-sp-500-etf-trust-spy-shares-bought-by-stelac-advisory-services-llc-updated-updated.html
253,"In DR Congo, 8 Killed and Altar Boys Arrested Amid Crackdown on Protests",7ndm60,https://www.reddit.com/r/worldnews/comments/7ndm60/in_dr_congo_8_killed_and_altar_boys_arrested_amid/,6,1,,2018-01-01,https://www.nytimes.com/2017/12/31/world/africa/congo-protest-joseph-kabila.html
254,Libya: Once the Jewel of Africa,7ndm2h,https://www.reddit.com/r/worldnews/comments/7ndm2h/libya_once_the_jewel_of_africa/,1,0,,2018-01-01,http://www.syrianews.cc/libya-jewel-africa/
255,Parasols: a Way Statement Or Protection by The Sun,7ndl4n,https://www.reddit.com/r/worldnews/comments/7ndl4n/parasols_a_way_statement_or_protection_by_the_sun/,1,1,,2018-01-01,https://www.dailystrength.org/journals/flower-girl-dresses-and-white-dresses-more-in-style-now
256,misljimi poker,7ndkzm,https://www.reddit.com/r/worldnews/comments/7ndkzm/misljimi_poker/,1,1,,2018-01-01,http://www.motopoker.net/
257,Alan Perlis Quotes About Learning – 41142,7ndkus,https://www.reddit.com/r/worldnews/comments/7ndkus/alan_perlis_quotes_about_learning_41142/,1,0,,2018-01-01,http://www.trendquotes.com/alan-perlis-quotes-about-learning-41142/
258,Senior U.S. Republican senator: 'Let Mr. Mueller do his job',7ndkqk,https://www.reddit.com/r/worldnews/comments/7ndkqk/senior_us_republican_senator_let_mr_mueller_do/,31,6,,2018-01-01,http://www.dailymail.co.uk/wires/reuters/article-5224955/Senior-U-S-Republican-senator-Let-Mr-Mueller-job.html
259,"North Korea's Kim says 'open to dialogue' with South Korea, will only use nukes if threatened",7ndkjd,https://www.reddit.com/r/worldnews/comments/7ndkjd/north_koreas_kim_says_open_to_dialogue_with_south/,11,4,,2018-01-01,https://www.reuters.com/article/us-northkorea-missiles-kimjongun/north-koreas-kim-says-open-to-dialogue-with-south-korea-will-only-use-nukes-if-threatened-idUSKBN1EQ0NJ
260,YouTuber Vitaly kicked from hotel New Years Eve due to discrimination!,7ndkga,https://www.reddit.com/r/worldnews/comments/7ndkga/youtuber_vitaly_kicked_from_hotel_new_years_eve/,1,0,,2018-01-01,https://youtu.be/MPdDtSGKkz4
261,"Compass Group chief, five others dead in Sydney seaplane crash",7ndkbg,https://www.reddit.com/r/worldnews/comments/7ndkbg/compass_group_chief_five_others_dead_in_sydney/,9,2,,2018-01-01,https://www.reuters.com/article/us-australia-seaplane/compass-group-chief-five-others-dead-in-sydney-seaplane-crash-idUSKBN1EQ0O3
262,"Clean A Naked, Unfinished Cedar Wooden Deck With Dish Cleaning soap",7ndka7,https://www.reddit.com/r/worldnews/comments/7ndka7/clean_a_naked_unfinished_cedar_wooden_deck_with/,1,1,,2018-01-01,https://usalocator.org/subway-locations/georgia/homerville
263,Iran protests turn deadly as 2 demonstrators reported killed,7ndka0,https://www.reddit.com/r/worldnews/comments/7ndka0/iran_protests_turn_deadly_as_2_demonstrators/,4,1,,2018-01-01,https://www.cbsnews.com/news/iran-protests-turn-deadly-as-2-demonstrators-reported-killed/
264,Web Developer,7ndk35,https://www.reddit.com/r/worldnews/comments/7ndk35/web_developer/,1,0,,2018-01-01,http://www.gulf-recruitments.com/2018/01/web-developer.html
265,"CNN, NYT called out over Iran protests coverage",7ndjwm,https://www.reddit.com/r/worldnews/comments/7ndjwm/cnn_nyt_called_out_over_iran_protests_coverage/,0,5,,2018-01-01,http://english.alarabiya.net/en/media/print/2017/12/31/CNN-NYT-called-out-over-Iran-protests-coverage.html
266,Kim Jong Un says the nuclear button is always on his desk,7ndiz6,https://www.reddit.com/r/worldnews/comments/7ndiz6/kim_jong_un_says_the_nuclear_button_is_always_on/,0,13,,2018-01-01,http://edition.cnn.com/2017/12/31/asia/kim-jong-un-new-year-address-nuclear/index.html
267,Part Time Maid Services,7ndi90,https://www.reddit.com/r/worldnews/comments/7ndi90/part_time_maid_services/,1,0,,2018-01-01,http://www.housemaid.com.sg/search_maid_result.html?p=13
268,Quintilian Quotes About Art – 3775,7ndhta,https://www.reddit.com/r/worldnews/comments/7ndhta/quintilian_quotes_about_art_3775/,1,0,,2018-01-01,http://www.trendquotes.com/quintilian-quotes-about-art-3775/
269,que es bitcoin cash,7ndhse,https://www.reddit.com/r/worldnews/comments/7ndhse/que_es_bitcoin_cash/,1,1,,2018-01-01,http://criptonoticias.com/informacion/que-es-bitcoin
270,Malcolm Turnbull says postal survey could decide future of Australian republic,7ndha0,https://www.reddit.com/r/worldnews/comments/7ndha0/malcolm_turnbull_says_postal_survey_could_decide/,3,5,,2018-01-01,https://www.theguardian.com/australia-news/2018/jan/01/malcolm-turnbull-says-postal-survey-could-decide-future-of-australian-republic
271,2018 is finally here!,7ndg9a,https://www.reddit.com/r/worldnews/comments/7ndg9a/2018_is_finally_here/,4,8,,2018-01-01,https://www.timeanddate.com/countdown/newyear
272,North Korea casts nuclear shadow over Asia's 2018,7ndfwb,https://www.reddit.com/r/worldnews/comments/7ndfwb/north_korea_casts_nuclear_shadow_over_asias_2018/,1,5,,2018-01-01,https://www.theguardian.com/world/2018/jan/01/north-korea-casts-nuclear-shadow-over-asias-2018
