,title,id,url,score,num_comments,text,date,link
0,Hjalmar Branting Quotes About Equality – 17267,7ndb42,https://www.reddit.com/r/worldnews/comments/7ndb42/hjalmar_branting_quotes_about_equality_17267/,1,0,,2018-01-01,http://www.trendquotes.com/hjalmar-branting-quotes-about-equality-17267/
1,Palestinians recall envoy to US for consultations after Jerusalem move,7ndanq,https://www.reddit.com/r/worldnews/comments/7ndanq/palestinians_recall_envoy_to_us_for_consultations/,1,0,,2018-01-01,http://worldaffairs7.com/palestinians-recall-envoy-to-us-for-consultations-after-jerusalem-move/
2,﻿Schody Bariery Okrążenia Metalowe,7ndalp,https://www.reddit.com/r/worldnews/comments/7ndalp/schody_bariery_okrążenia_metalowe/,1,0,,2018-01-01,http://jingmiwang.com/space-uid-30751.html
3,British CEO dies in seaplane crash,7nda4k,https://www.reddit.com/r/worldnews/comments/7nda4k/british_ceo_dies_in_seaplane_crash/,10,4,[deleted],2018-01-01,http://www.smh.com.au/nsw/six-victims-of-the-hawkesbury-river-seaplane-crash-named-by-police-20180101-h0bzb9.html
4,Monument Valley is Free for limited time,7nd9tp,https://www.reddit.com/r/worldnews/comments/7nd9tp/monument_valley_is_free_for_limited_time/,1,0,,2018-01-01,http://questswamppeopledeer.blogspot.com/2017/12/monument-valley-is-free-for-limited-time.html
5,Suggestions To Support You Get Far more YouTube Views,7nd9kh,https://www.reddit.com/r/worldnews/comments/7nd9kh/suggestions_to_support_you_get_far_more_youtube/,1,1,,2018-01-01,http://fleminghodges89.thesupersuper.com/post/how-to-get-youtube-views-for-your-movies
6,#Dubai breaks Guinness World Record on New Year https://rawdoggtv.com/ #GuinnessWorldRecord,7nd92n,https://www.reddit.com/r/worldnews/comments/7nd92n/dubai_breaks_guinness_world_record_on_new_year/,1,0,,2018-01-01,https://www.khaleejtimes.com/new-year-2018/dubai-breaks-guinness-world-record-on-new-year
7,Lending Curiosity Up to sixty p.c,7nd8u0,https://www.reddit.com/r/worldnews/comments/7nd8u0/lending_curiosity_up_to_sixty_pc/,1,1,,2018-01-01,http://lyonlauritsen6.iktogo.com/post/lending-interest-up-to-60-pc
8,"A huge fire has destroyed up to 1,400 vehicles in a multi-storey car park in Liverpool, UK",7nd8gd,https://www.reddit.com/r/worldnews/comments/7nd8gd/a_huge_fire_has_destroyed_up_to_1400_vehicles_in/,70,17,[deleted],2018-01-01,http://www.bbc.com/news/uk-england-manchester-42529615
9,Kim Jong Un Says North Korea's Nuclear Forces Are Now 'Complete',7nd85b,https://www.reddit.com/r/worldnews/comments/7nd85b/kim_jong_un_says_north_koreas_nuclear_forces_are/,37,30,,2018-01-01,http://time.com/5083086/north-korea-kim-jong-un-new-year-address/
10,"﻿Odgrodzenia Plastykowe Zaś Deski PCV. Furtki, Płoty",7nd7zg,https://www.reddit.com/r/worldnews/comments/7nd7zg/odgrodzenia_plastykowe_zaś_deski_pcv_furtki_płoty/,1,0,,2018-01-01,http://www.jnbiaoji.com/home.php?mod=space&amp;uid=31613
11,All vehicles destroyed in Liverpool car park blaze,7nd7im,https://www.reddit.com/r/worldnews/comments/7nd7im/all_vehicles_destroyed_in_liverpool_car_park_blaze/,1,0,[deleted],2018-01-01,https://www.yahoo.com/news/vehicles-destroyed-liverpool-car-park-blaze-030058205.html
12,﻿Odrętwiałe Obramowania,7nd6ze,https://www.reddit.com/r/worldnews/comments/7nd6ze/odrętwiałe_obramowania/,1,1,,2018-01-01,http://www.ruiyuan99.com/bbs/home.php?mod=space&amp;username=uvigan
13,Bradley Cooper Quotes About Family – 20940,7nd52t,https://www.reddit.com/r/worldnews/comments/7nd52t/bradley_cooper_quotes_about_family_20940/,1,0,,2018-01-01,http://www.trendquotes.com/bradley-cooper-quotes-about-family-20940/
14,"North Korea declares completion of nuclear force, entire U.S. within range",7nd4ic,https://www.reddit.com/r/worldnews/comments/7nd4ic/north_korea_declares_completion_of_nuclear_force/,134,66,,2018-01-01,http://bnonews.com/news/index.php/news/id6910
15,"In that location are populate World Health Organization bed football, and and then on that point are citizenry WHO live,",7nd4a0,https://www.reddit.com/r/worldnews/comments/7nd4a0/in_that_location_are_populate_world_health/,1,1,,2018-01-01,http://www.bdlive77.com
16,Einstein's spacetime doesn't exist!!!,7nd49r,https://www.reddit.com/r/worldnews/comments/7nd49r/einsteins_spacetime_doesnt_exist/,1,0,,2018-01-01,http://www.absolute-relativity.eu
17,Likud calls for annexation of parts of West Bank,7nd41q,https://www.reddit.com/r/worldnews/comments/7nd41q/likud_calls_for_annexation_of_parts_of_west_bank/,22,2,,2018-01-01,http://www.aljazeera.com/news/2017/12/likud-calls-annexation-parts-west-bank-171231215302354.html
18,"North Korea will only use nukes if threatened, says Kim.",7nd39m,https://www.reddit.com/r/worldnews/comments/7nd39m/north_korea_will_only_use_nukes_if_threatened/,3,4,[deleted],2018-01-01,http://www.thehindu.com/news/international/north-korea-will-only-use-nukes-if-threatened-says-kim/article22341955.ece
19,Kim says US should know North Korean nuclear force a reality,7nd391,https://www.reddit.com/r/worldnews/comments/7nd391/kim_says_us_should_know_north_korean_nuclear/,0,2,,2018-01-01,http://abcnews.go.com/International/wireStory/kim-us-north-korean-nuclear-force-reality-52076678
20,How To Decorate Your Kitchen,7nd331,https://www.reddit.com/r/worldnews/comments/7nd331/how_to_decorate_your_kitchen/,1,0,,2018-01-01,http://interior-designersindia.blogspot.in/2017/12/how-to-decorate-your-kitchen.html
21,Liverpool car park blaze destroys hundreds of vehicles on New Year’s eve.,7nd2ym,https://www.reddit.com/r/worldnews/comments/7nd2ym/liverpool_car_park_blaze_destroys_hundreds_of/,1,0,,2018-01-01,http://www.thehindu.com/news/international/liverpool-car-park-blaze-destroys-hundreds-of-vehicles-on-new-years-eve/article22341945.ece
22,How To Get YouTube Views For Your Films,7nd2v0,https://www.reddit.com/r/worldnews/comments/7nd2v0/how_to_get_youtube_views_for_your_films/,1,1,,2018-01-01,https://sociaboost.com/buy-youtube-services-now/
23,North Korea: We sincerely hope the Winter Games in the South will be successful,7nd2ud,https://www.reddit.com/r/worldnews/comments/7nd2ud/north_korea_we_sincerely_hope_the_winter_games_in/,12,9,,2018-01-01,https://www.bloomberg.com/news/articles/2018-01-01/north-korea-s-kim-signals-olympics-truce-seeks-talks-with-seoul
24,China's growth engine stutters as factories slow down,7nd2im,https://www.reddit.com/r/worldnews/comments/7nd2im/chinas_growth_engine_stutters_as_factories_slow/,8,4,,2018-01-01,https://www.theguardian.com/business/2017/dec/31/chinas-growth-engine-stutters-as-factories-slowdown
25,Gary Numan – Cars,7nd29y,https://www.reddit.com/r/worldnews/comments/7nd29y/gary_numan_cars/,1,0,,2018-01-01,https://www.vidcamstars.com/gary-numan-cars/
26,What keeps this UN peacekeeper going?,7nd1ce,https://www.reddit.com/r/worldnews/comments/7nd1ce/what_keeps_this_un_peacekeeper_going/,1,0,,2018-01-01,http://www.bbc.com/news/av/world-africa-42368974/what-home-comforts-keep-this-un-peacekeeper-going
27,﻿Top Eleven 2017 Hack Cheats Tokens Free.,7nd0oo,https://www.reddit.com/r/worldnews/comments/7nd0oo/top_eleven_2017_hack_cheats_tokens_free/,1,1,,2018-01-01,http://h0mepage.net/europepacket3/2018/01/01/think-youre-cut-out-for-doing-top-eleven-tokens-code-take-this-quiz/
28,"Police in Houston say a man who had an AR-15 rifle, a shotgun, handgun, and ammunition in his hotel room on New Year's Eve had no intention to use them",7nd0lc,https://www.reddit.com/r/worldnews/comments/7nd0lc/police_in_houston_say_a_man_who_had_an_ar15_rifle/,102,77,,2018-01-01,https://www.businessinsider.com.au/man-had-guns-and-ammunition-in-hotel-room-new-years-eve-2017-12?utm_content=bufferca653&amp;utm_medium=social&amp;utm_source=facebook.com&amp;utm_campaign=buffer-bi&amp;r=US&amp;IR=T
29,How To Get Your Organization Booming On Instagram,7nd025,https://www.reddit.com/r/worldnews/comments/7nd025/how_to_get_your_organization_booming_on_instagram/,1,1,,2018-01-01,http://h0mepage.net/langballelambert4/2018/01/01/is-it-well-worth-utilizing-hashtags-on-instagram/
30,Major Banks Reportedly Just Began Freezing Accounts of Bitcoin Users,7nd00r,https://www.reddit.com/r/worldnews/comments/7nd00r/major_banks_reportedly_just_began_freezing/,1413,497,,2018-01-01,http://thefreethoughtproject.com/top-four-banks-freezing-customer-accounts-bitcoin/
31,Bill Condon Quotes About Dating – 13224,7ncysc,https://www.reddit.com/r/worldnews/comments/7ncysc/bill_condon_quotes_about_dating_13224/,1,0,,2018-01-01,http://www.trendquotes.com/bill-condon-quotes-about-dating-13224/
32,﻿FC United Of Manchester 1 Stockport County 0 (FA Mug 3QR Replay) 3 October.,7ncy50,https://www.reddit.com/r/worldnews/comments/7ncy50/fc_united_of_manchester_1_stockport_county_0_fa/,1,1,,2018-01-01,https://www.reddit.com/r/worldnews/comments/7ncx7f/why_we_love_top_eleven_training_guide_and_you/
33,"﻿Why We Love Top Eleven Training Guide (And You Should, Too!).",7ncx7f,https://www.reddit.com/r/worldnews/comments/7ncx7f/why_we_love_top_eleven_training_guide_and_you/,1,1,,2018-01-01,http://cartesdevisitekraft.over-blog.com/2017/08/10-tips-for-top-eleven-hack.html
34,Why China doesn't want your waste anymore,7ncx5r,https://www.reddit.com/r/worldnews/comments/7ncx5r/why_china_doesnt_want_your_waste_anymore/,0,0,,2018-01-01,http://www.bbc.com/news/av/world-42512361/why-china-doesn-t-want-your-waste-anymore
35,Palestinians recall envoy to US,7ncwiw,https://www.reddit.com/r/worldnews/comments/7ncwiw/palestinians_recall_envoy_to_us/,9,0,,2018-01-01,http://www.bbc.com/news/world-middle-east-42531102
36,Veterans Affairs Minister Seamus O’Regan says LGBTQ apology was also about ‘shame’: Seamus O'Regan reflects on how he internalized shame over his sexuality — something he did not embrace until a decade ago.,7ncwaw,https://www.reddit.com/r/worldnews/comments/7ncwaw/veterans_affairs_minister_seamus_oregan_says/,0,0,,2018-01-01,https://www.thestar.com/news/canada/2017/12/31/veterans-affairs-minister-seamus-oregan-says-lgbtq-apology-was-also-about-shame.html
37,Electrical Wire to Use for your Home,7ncw99,https://www.reddit.com/r/worldnews/comments/7ncw99/electrical_wire_to_use_for_your_home/,1,0,,2018-01-01,http://electricalprojectscontractor.blogspot.in/2017/12/type-of-electrical-wire-to-use-for-your.html
38,Ministers accused of 'risking the country’s security' by considering use of volunteers to guard borders: The Home Office has accepted the proposals have been looked at by officials.,7ncvr7,https://www.reddit.com/r/worldnews/comments/7ncvr7/ministers_accused_of_risking_the_countrys/,0,1,,2018-01-01,http://www.independent.co.uk/news/uk/politics/border-force-volunteers-uk-customs-immigration-home-office-a8135511.html
39,"Netanyahu's party votes for resolution calling on Israel to annex West Bank, increase settlements",7ncv3x,https://www.reddit.com/r/worldnews/comments/7ncv3x/netanyahus_party_votes_for_resolution_calling_on/,1,1,,2018-01-01,https://www.haaretz.com/israel-news/.premium-1.832259
40,John Scarlett Quotes About intelligence – 38821,7ncuu1,https://www.reddit.com/r/worldnews/comments/7ncuu1/john_scarlett_quotes_about_intelligence_38821/,1,0,,2018-01-01,http://www.trendquotes.com/john-scarlett-quotes-about-intelligence-38821/
41,UN chief issues 'red alert' for the world,7ncun6,https://www.reddit.com/r/worldnews/comments/7ncun6/un_chief_issues_red_alert_for_the_world/,0,3,[deleted],2018-01-01,http://www.cnn.com/2017/12/31/us/un-secretary-general-2018-message-intl/index.html
42,"Happy New Year 2018 Quotes: Inspirational, WhatsApp Statuses, Wishes - Happy New Year 2018",7nctp0,https://www.reddit.com/r/worldnews/comments/7nctp0/happy_new_year_2018_quotes_inspirational_whatsapp/,1,0,,2018-01-01,https://www.merrychristmas2017happynewyear2018.com/happy-new-year-2018-quotes-inspirational-whatsapp-statuses-wishes/
43,"Netanyahu's Party Votes for Resolution Calling on Israel to Annex West Bank, Increase Settlements Netanyahu's Party Votes for Resolution Calling on Israel to Annex West Bank, Increase Settlements",7nct79,https://www.reddit.com/r/worldnews/comments/7nct79/netanyahus_party_votes_for_resolution_calling_on/,1,1,[deleted],2018-01-01,https://www.haaretz.com/israel-news/.premium-1.832259
44,Tori Amos Quotes About Music – 50706,7ncsew,https://www.reddit.com/r/worldnews/comments/7ncsew/tori_amos_quotes_about_music_50706/,1,0,,2018-01-01,http://www.trendquotes.com/tori-amos-quotes-about-music-50706/
45,Kim Jong-un claims he has nuclear button on his desk as he warns US that weapons are now a 'reality',7ncrgb,https://www.reddit.com/r/worldnews/comments/7ncrgb/kim_jongun_claims_he_has_nuclear_button_on_his/,5,5,[deleted],2018-01-01,http://www.telegraph.co.uk/news/2018/01/01/kim-jong-un-warns-us-north-koreas-nuclear-weapons-now-reality/
46,North Korean leader says he has ‘nuclear button’ but won’t use unless threatened,7ncqz9,https://www.reddit.com/r/worldnews/comments/7ncqz9/north_korean_leader_says_he_has_nuclear_button/,0,1,,2018-01-01,https://www.washingtonpost.com/world/north-korea-leader-says-he-hasnuclear-button-but-wont-use-unless-threatened/2017/12/31/af3dc188-ee96-11e7-90ed-77167c6861f2_story.html?hpid=hp_hp-top-table-main_nkorea-940pm%3Ahomepage%2Fstory
47,The Mysterious Chinese Company Worrying the World,7ncqbu,https://www.reddit.com/r/worldnews/comments/7ncqbu/the_mysterious_chinese_company_worrying_the_world/,10,3,,2018-01-01,https://www.bloomberg.com/news/articles/2017-12-17/the-mysterious-chinese-company-worrying-the-world-quicktake-q-a
48,WhatsAppDown: WhatsApp crashes as world brings in New Year; Here is How Twitter explodes to brief outage,7ncq31,https://www.reddit.com/r/worldnews/comments/7ncq31/whatsappdown_whatsapp_crashes_as_world_brings_in/,1,0,,2018-01-01,http://www.techdoge.in/2018/01/whatsapp-crashes-as-world-brings-in-New-Year-Here-is-How-Twitter-explodes-to-brief-outage.html
49,Manolo Blahnik Quotes About Travel – 69343,7ncoue,https://www.reddit.com/r/worldnews/comments/7ncoue/manolo_blahnik_quotes_about_travel_69343/,1,0,,2018-01-01,http://www.trendquotes.com/manolo-blahnik-quotes-about-travel-69343/
50,Great Information About Learning To Play Soccer,7ncoro,https://www.reddit.com/r/worldnews/comments/7ncoro/great_information_about_learning_to_play_soccer/,1,1,,2018-01-01,https://sukabet.net/deposit/
51,President Trump Voices Support for Protesters Against the Islamic Regime in Iran,7nil4y,https://www.reddit.com/r/worldnews/comments/7nil4y/president_trump_voices_support_for_protesters/,1,0,,2018-01-01,https://www.theissue.com/politics/president-trump-voices-support-for-protesters-against-the-islamic-regime-in-iran
52,Twitter blocks AfD lawmaker's account over racist remarks against Arabs,7nil3u,https://www.reddit.com/r/worldnews/comments/7nil3u/twitter_blocks_afd_lawmakers_account_over_racist/,1,0,[deleted],2018-01-01,https://www.dailysabah.com/islamophobia/2018/01/01/twitter-blocks-afd-lawmakers-account-over-racist-remarks-against-arabs
53,Zimbabwe Opposes UN Motion to Condemn Myanmar Human Rights Abuses,7nikz7,https://www.reddit.com/r/worldnews/comments/7nikz7/zimbabwe_opposes_un_motion_to_condemn_myanmar/,6,1,,2018-01-01,http://allafrica.com/stories/201712290585.html
54,﻿Odgrodzenia Asfaltowe Także Działalności Dekarskie,7nikvv,https://www.reddit.com/r/worldnews/comments/7nikvv/odgrodzenia_asfaltowe_także_działalności_dekarskie/,1,0,,2018-01-01,http://www.yofu100.com/home.php?mod=space&amp;uid=19669
55,"Germany needs 'new left-wing people's party,' says leftist veteran Oskar Lafontaine: The co-founder of the Left party has called for a new alliance to catapult the left wing into power. He believes German voters are more than ready for such an option",7nijrb,https://www.reddit.com/r/worldnews/comments/7nijrb/germany_needs_new_leftwing_peoples_party_says/,37,27,,2018-01-01,http://www.dw.com/en/germany-needs-new-left-wing-peoples-party-says-leftist-veteran-oskar-lafontaine/a-41991732
56,﻿Jakie Sa Imperatywy Dotyczace Konfiguracje Obramowania?,7nijmt,https://www.reddit.com/r/worldnews/comments/7nijmt/jakie_sa_imperatywy_dotyczace_konfiguracje/,1,1,,2018-01-01,http://whjsxy.cn/bbs/home.php?mod=space&amp;uid=403253
57,"UK considers taxing Silicon Valley's ""ruthless profiteers in t-shirts"" over extremist content",7nij2r,https://www.reddit.com/r/worldnews/comments/7nij2r/uk_considers_taxing_silicon_valleys_ruthless/,1,1,,2018-01-01,https://qz.com/1168919/uk-considers-taxing-silicon-valleys-ruthless-profiteers-in-t-shirts-over-extremist-content/
58,Iranian President Rouhani calls for unity as death toll rises in unrest,7nihwy,https://www.reddit.com/r/worldnews/comments/7nihwy/iranian_president_rouhani_calls_for_unity_as/,18,22,,2018-01-01,http://edition.cnn.com/2018/01/01/world/iran-protests-deaths-rouhani-intl/index.html
59,¿Ya viste con qué camiseta de la Liga MX posó Leo Messi? 👀 🇲🇽 (ESPN),7nihsq,https://www.reddit.com/r/worldnews/comments/7nihsq/ya_viste_con_qué_camiseta_de_la_liga_mx_posó_leo/,1,1,,2018-01-01,http://dailypressline.blogspot.com/2018/01/ya-viste-con-que-camiseta-de-la-liga-mx.html
60,"Iranian protesters attack police stations, raise stakes in unrest",7nihj5,https://www.reddit.com/r/worldnews/comments/7nihj5/iranian_protesters_attack_police_stations_raise/,643,164,,2018-01-01,https://www.reuters.com/article/us-iran-rallies/iranian-protesters-attack-police-stations-raise-stakes-in-unrest-idUSKBN1EP064
61,"More than a quarter of Earth's land surface will become ""significantly"" drier even if humanity manages to limit global warming to two degrees Celsius, the goal espoused in the Paris Agreement, scientists said on Monday",7nigni,https://www.reddit.com/r/worldnews/comments/7nigni/more_than_a_quarter_of_earths_land_surface_will/,1019,378,,2018-01-01,http://www.france24.com/en/20180101-quarter-land-will-be-drier-under-2-c-warming-study
62,How to pack for your trip,7nifr2,https://www.reddit.com/r/worldnews/comments/7nifr2/how_to_pack_for_your_trip/,1,1,,2018-01-01,http://www.theworldaroundus.tk/2017/12/how-to-pack-for-your-trip.html
63,Pakistan responds to Trump's tweet and America loses another ally,7nifdq,https://www.reddit.com/r/worldnews/comments/7nifdq/pakistan_responds_to_trumps_tweet_and_america/,1,0,,2018-01-01,https://www.dailykos.com/stories/2018/1/1/1728999/-Pakistan-responds-to-Trump-s-tweet-and-America-loses-another-ally
64,"New Year car torching, arrests up in France",7nie69,https://www.reddit.com/r/worldnews/comments/7nie69/new_year_car_torching_arrests_up_in_france/,22,3,,2018-01-01,https://www.afp.com/en/news/23/new-year-car-torching-arrests-france-doc-vi9zr3
65,Affordable Fashion With Money Clothing,7nie4w,https://www.reddit.com/r/worldnews/comments/7nie4w/affordable_fashion_with_money_clothing/,1,1,,2018-01-01,http://colab.di.ionio.gr/index.php?option=com_k2&amp;view=itemlist&amp;task=user&amp;id=331576
66,﻿Obramowania Panelowe Fabrykant,7nidsb,https://www.reddit.com/r/worldnews/comments/7nidsb/obramowania_panelowe_fabrykant/,1,1,,2018-01-01,http://newmp3.uz/index.php?subaction=userinfo&amp;user=oxuzup
67,Coral is Dying Globally. But We Can Save Some Reefs From Total Destruction.,7nid2f,https://www.reddit.com/r/worldnews/comments/7nid2f/coral_is_dying_globally_but_we_can_save_some/,1,0,,2018-01-01,http://trafficinfinityx.com/share/5a4abfe9c1b65964fc758bd4?social_media=reddit&amp;t=1514848253
68,"Don't extinguish migrants' hopes, Pope says on World Day of Peace",7nicy9,https://www.reddit.com/r/worldnews/comments/7nicy9/dont_extinguish_migrants_hopes_pope_says_on_world/,0,5,[deleted],2018-01-01,https://www.reuters.com/article/us-pope-peace/dont-extinguish-migrants-hopes-pope-says-on-world-day-of-peace-idUSKBN1EQ0Y7
69,بعد ثلاثة تعادلات.. مانشستر يونايتد يستعيد نغمة الانتصارات بفوزه على إيفرتون,7nickn,https://www.reddit.com/r/worldnews/comments/7nickn/بعد_ثلاثة_تعادلات_مانشستر_يونايتد_يستعيد_نغمة/,1,0,,2018-01-01,http://wadifat-maroc.blogspot.com/2018/01/blog-post_55.html
70,Katy Perry Quotes About Sad – 60968,7nic92,https://www.reddit.com/r/worldnews/comments/7nic92/katy_perry_quotes_about_sad_60968/,1,0,,2018-01-01,http://www.trendquotes.com/katy-perry-quotes-about-sad-60968/
71,Kuwaiti report: US gives Israel go-ahead to kill powerful Iranian general,7nic56,https://www.reddit.com/r/worldnews/comments/7nic56/kuwaiti_report_us_gives_israel_goahead_to_kill/,25,10,,2018-01-01,https://www.timesofisrael.com/report-us-gives-israel-go-ahead-to-kill-powerful-iranian-general/
72,Friends build island to avoid New Year's Eve alcohol ban at New Zealand's Tairua estuary,7niba1,https://www.reddit.com/r/worldnews/comments/7niba1/friends_build_island_to_avoid_new_years_eve/,8,0,,2018-01-01,http://www.abc.net.au/news/2018-01-02/group-builds-island-to-avoid-nz-drinking-ban/9297776
73,Norway Labour Party's deputy leader suspended over harassment allegations,7niahc,https://www.reddit.com/r/worldnews/comments/7niahc/norway_labour_partys_deputy_leader_suspended_over/,20,1,,2018-01-01,http://reuters.com/article/amp/idUSKBN1EQ19F
74,"Camila Cabello, Shawn Mendes and Nick Jonas Wow at New Year's Rockin' Eve",7ni9x8,https://www.reddit.com/r/worldnews/comments/7ni9x8/camila_cabello_shawn_mendes_and_nick_jonas_wow_at/,1,0,,2018-01-01,http://www.cheekywomen.org/camila-cabello-shawn-mendes-and-nick-jonas-wow-at-new-years-rockin-eve/
75,Girls Love Dress Up Games,7ni9qw,https://www.reddit.com/r/worldnews/comments/7ni9qw/girls_love_dress_up_games/,1,1,,2018-01-01,http://butaneroot60.unblog.fr/2018/01/01/nina-dobrev-fashion-in-the-vampire-diaries/
76,"Trump withholding millions in aid to Pakistan, as he accuses country of giving 'safe haven' to terrorists",7ni98e,https://www.reddit.com/r/worldnews/comments/7ni98e/trump_withholding_millions_in_aid_to_pakistan_as/,1,0,[deleted],2018-01-01,http://therightpassage.com/trump-withholding-millions-aid-pakistan-accuses-country-giving-safe-haven-terrorists/
77,"#BREAKING Iran violent protests – death toll has risen to 20, including three security officials",7ni93v,https://www.reddit.com/r/worldnews/comments/7ni93v/breaking_iran_violent_protests_death_toll_has/,1,0,,2018-01-01,https://voiceofpeopletoday.com/iran-violent-protests-death-toll-risen-20-including-three-security-officials/#.Wkq7dtOlNII.reddit
78,"About 40,000 French homes without power due to winter storm",7ni7ee,https://www.reddit.com/r/worldnews/comments/7ni7ee/about_40000_french_homes_without_power_due_to/,26,7,,2018-01-01,http://www.foxnews.com/world/2018/01/01/about-40000-french-homes-without-power-due-to-winter-storm.html
79,Jordan royal palace denies rumors about dismissal of princes,7ni65x,https://www.reddit.com/r/worldnews/comments/7ni65x/jordan_royal_palace_denies_rumors_about_dismissal/,1,0,,2018-01-01,https://www.reuters.com/article/us-jordan-palace-princes/jordan-royal-palace-denies-rumors-about-dismissal-of-princes-idUSKBN1EQ0OT
80,Experts say this video suggests that Trump is suffering from Dementia Or WORSE,7ni63k,https://www.reddit.com/r/worldnews/comments/7ni63k/experts_say_this_video_suggests_that_trump_is/,1,1,,2018-01-01,http://blue-courier.com/experts-say-video-suggests-trump-suffering-dementia-worse-think/
81,Happy New Year from North Korea: ‘The entire United States is within range of our nuclear weapons’,7ni5s1,https://www.reddit.com/r/worldnews/comments/7ni5s1/happy_new_year_from_north_korea_the_entire_united/,0,4,,2018-01-01,http://investmentwatchblog.com/happy-new-year-from-north-korea-the-entire-united-states-is-within-range-of-our-nuclear-weapons/
82,Nigerian army says more than 700 people have escaped Boko Haram captivity,7ni5l0,https://www.reddit.com/r/worldnews/comments/7ni5l0/nigerian_army_says_more_than_700_people_have/,91,2,,2018-01-01,http://www.bbc.com/news/world-africa-42536065
83,Sloane Crosley Quotes About Freedom – 24896,7ni3yu,https://www.reddit.com/r/worldnews/comments/7ni3yu/sloane_crosley_quotes_about_freedom_24896/,1,0,,2018-01-01,http://www.trendquotes.com/sloane-crosley-quotes-about-freedom-24896/
84,Double chess champion boycotts Saudi Arabia tournament over women's rights,7ni3kq,https://www.reddit.com/r/worldnews/comments/7ni3kq/double_chess_champion_boycotts_saudi_arabia/,59,25,,2018-01-01,http://www.chicagotribune.com/news/nationworld/ct-saudi-arabia-chess-20171230-story.html
85,"Pope Francis: 2017 marred by 'death, lies and injustices'",7ni3bu,https://www.reddit.com/r/worldnews/comments/7ni3bu/pope_francis_2017_marred_by_death_lies_and/,1,1,,2018-01-01,http://thehill.com/policy/international/366949-pope-francis-calls-on-people-to-take-responsibility-after-2017-marred-by
86,Recreational cannabis is now LEGAL in California,7ni3bs,https://www.reddit.com/r/worldnews/comments/7ni3bs/recreational_cannabis_is_now_legal_in_california/,8,2,,2018-01-01,http://www.bbc.com/news/world-us-canada-42532776
87,برادة شيرو مع مبرد ثيرموكنجsl300,7ni2id,https://www.reddit.com/r/worldnews/comments/7ni2id/برادة_شيرو_مع_مبرد_ثيرموكنجsl300/,1,1,,2018-01-01,https://sa.sogarab.com/ad-48846.html
88,Palestinian girl charged after slap video,7ni1zv,https://www.reddit.com/r/worldnews/comments/7ni1zv/palestinian_girl_charged_after_slap_video/,10,41,,2018-01-01,http://www.bbc.com/news/world-middle-east-42535685
89,﻿La Cartouche #6 — Les Meilleurs Jeux Android Et IOS — RadioKawa,7ni1e2,https://www.reddit.com/r/worldnews/comments/7ni1e2/la_cartouche_6_les_meilleurs_jeux_android_et_ios/,1,1,,2018-01-01,http://jeux-triche.fr/wwe-mayhem-triche-v1-1-nouvelle-version/
90,China's ban on ivory trade comes into force,7ni0lm,https://www.reddit.com/r/worldnews/comments/7ni0lm/chinas_ban_on_ivory_trade_comes_into_force/,21,1,,2018-01-01,http://www.bbc.co.uk/news/world-asia-china-42532017
