,title,id,url,score,num_comments,text,date,link
447,"Airline safety: 2017 was safest year in history for passengers around world, research shows",7nencs,https://www.reddit.com/r/worldnews/comments/7nencs/airline_safety_2017_was_safest_year_in_history/,22,3,,2018-01-01,http://www.independent.co.uk/travel/news-and-advice/air-safety-2017-best-year-safest-airline-passengers-worldwide-to70-civil-aviation-review-a8130796.html
448,Tesco tells Christmas temps they will get wages via prepaid cards - which cost 50p per withdrawal,7nenb5,https://www.reddit.com/r/worldnews/comments/7nenb5/tesco_tells_christmas_temps_they_will_get_wages/,737,177,,2018-01-01,http://www.telegraph.co.uk/work-salary/news/tesco-tells-christmas-temps-will-get-wages-via-prepaid-cards/
449,"UK does not have capacity to deal with extra plastic waste after a Chinese import ban, says UK Recycling Association.",7nem81,https://www.reddit.com/r/worldnews/comments/7nem81/uk_does_not_have_capacity_to_deal_with_extra/,288,89,,2018-01-01,http://www.bbc.co.uk/news/business-42455378
450,Hampstead Heath ladies say swimming pond is not gender fluid,7nelwn,https://www.reddit.com/r/worldnews/comments/7nelwn/hampstead_heath_ladies_say_swimming_pond_is_not/,10,18,,2018-01-01,http://www.dailymail.co.uk/news/article-5223641/Hampstead-ladies-say-swimming-pond-not-gender-fluid.html
451,Remembering the people we lost in 2017,7nelkt,https://www.reddit.com/r/worldnews/comments/7nelkt/remembering_the_people_we_lost_in_2017/,1,3,,2018-01-01,http://fastnewsandworld.com/remembering-people-lost-2017/
452,"See How Justin Bieber, Sofia Richie, Victoria Beckham and More Stars Are Spending Their New Year's Eve",7nelgw,https://www.reddit.com/r/worldnews/comments/7nelgw/see_how_justin_bieber_sofia_richie_victoria/,1,0,,2018-01-01,http://www.cheekywomen.org/see-how-justin-bieber-sofia-richie-victoria-beckham-and-more-stars-are-spending-their-new-years-eve/
453,WhatsApp fell on New Year’s Eve,7nel9b,https://www.reddit.com/r/worldnews/comments/7nel9b/whatsapp_fell_on_new_years_eve/,1,1,,2018-01-01,http://mynutriday.com/nutri_day/whatsapp-fell-new-years-eve/
454,"Two more dead as further unrest grips Iran: 'A local MP said the pair were shot dead overnight in the town of Izeh, raising the toll from the protests to six.'",7nel3c,https://www.reddit.com/r/worldnews/comments/7nel3c/two_more_dead_as_further_unrest_grips_iran_a/,1,0,[deleted],2018-01-01,http://www.bbc.com/news/world-middle-east-42532784
455,"Trump says ""we'll see"" after Kim Jong Un warns North Korea's nuclear weapons can reach entire U.S.",7nektt,https://www.reddit.com/r/worldnews/comments/7nektt/trump_says_well_see_after_kim_jong_un_warns_north/,14,43,,2018-01-01,http://www.newsweek.com/trump-says-well-see-kim-jong-un-warns-nuclear-launch-button-his-desk-767144
456,What's the deal with Team Monster?,7neklz,https://www.reddit.com/r/worldnews/comments/7neklz/whats_the_deal_with_team_monster/,1,0,,2018-01-01,http://questswamppeopledeer.blogspot.com/2017/12/whats-deal-with-team-monster.html
457,"Lorde, New Zealand targeted in pro-Israel Washington Post ad - ABC News (Australian Broadcasting Corporation)",7nekf4,https://www.reddit.com/r/worldnews/comments/7nekf4/lorde_new_zealand_targeted_in_proisrael/,4,17,,2018-01-01,http://mobile.abc.net.au/news/2018-01-01/lorde-and-new-zealand-targeted-by-pro-israel-ad/9296778
458,Pakistan plans takeover of charities run by Islamist figure U.S. has targeted,7nejvb,https://www.reddit.com/r/worldnews/comments/7nejvb/pakistan_plans_takeover_of_charities_run_by/,6,1,,2018-01-01,https://www.reuters.com/article/us-pakistan-militants-exclusive/exclusive-pakistan-plans-takeover-of-charities-run-by-islamist-figure-u-s-has-targeted-idUSKBN1EQ0T6?il=0
459,#learnenglish #learnenglishfree #howtolearnenglishin30days,7nejq3,https://www.reddit.com/r/worldnews/comments/7nejq3/learnenglish_learnenglishfree/,1,1,,2018-01-01,https://www.youtube.com/watch?v=tpLU54n5NXY&amp;t=7s
460,"Samsung Galaxy On Nxt 16GB Variant Launching on January 3: Price, Specifications",7nejmb,https://www.reddit.com/r/worldnews/comments/7nejmb/samsung_galaxy_on_nxt_16gb_variant_launching_on/,1,1,,2018-01-01,https://www.gadget390.com/samsung-galaxy-nxt-16gb-variant-launching/
461,Jordan royal palace denies rumours about dismissal of princes,7nejke,https://www.reddit.com/r/worldnews/comments/7nejke/jordan_royal_palace_denies_rumours_about/,12,1,,2018-01-01,https://www.middleeastmonitor.com/20180101-jordan-royal-palace-denies-rumours-about-dismissal-of-princes/
462,Ten killed in Iran protests as anti-Government demos sweep country,7nejdx,https://www.reddit.com/r/worldnews/comments/7nejdx/ten_killed_in_iran_protests_as_antigovernment/,1,1,,2018-01-01,https://www.thesun.co.uk/news/5245111/ten-killed-in-iran-protests-as-anti-government-demos-sweep-country/
463,Brad Pitt Quotes About Peace – 53350,7nejcx,https://www.reddit.com/r/worldnews/comments/7nejcx/brad_pitt_quotes_about_peace_53350/,1,0,,2018-01-01,http://www.trendquotes.com/brad-pitt-quotes-about-peace-53350/
464,Has Anyone Ever Shot Down an F-15 in Air Combat?,7nejcv,https://www.reddit.com/r/worldnews/comments/7nejcv/has_anyone_ever_shot_down_an_f15_in_air_combat/,1,1,,2018-01-01,https://asymmetricdialogue.blogspot.com/2018/01/has-anyone-ever-shot-down-f-15-in-air.html
465,10 people killed amid nationwide protests in Iran – state TV,7nejbz,https://www.reddit.com/r/worldnews/comments/7nejbz/10_people_killed_amid_nationwide_protests_in_iran/,9,0,[deleted],2018-01-01,https://www.rt.com/news/414736-iran-protests-fatalities-media-reports/
466,'Ten dead' in Iran as anti-government protests continue,7nej86,https://www.reddit.com/r/worldnews/comments/7nej86/ten_dead_in_iran_as_antigovernment_protests/,8,0,[deleted],2018-01-01,https://news.sky.com/story/two-killed-in-iran-as-anti-government-protests-continue-11191415
467,"North Korea's Kim says 'open to dialogue' with South Korea, will only use nukes if threatened",7nej7i,https://www.reddit.com/r/worldnews/comments/7nej7i/north_koreas_kim_says_open_to_dialogue_with_south/,7,4,,2018-01-01,https://www.reuters.com/article/us-northkorea-missiles-kimjongun/north-koreas-kim-says-open-to-dialogue-with-south-korea-will-only-use-nukes-if-threatened-idUSKBN1EQ0NJ?il=0
468,Recreational cannabis use becomes legal in California,7nej74,https://www.reddit.com/r/worldnews/comments/7nej74/recreational_cannabis_use_becomes_legal_in/,17,2,,2018-01-01,http://www.bbc.co.uk/news/amp/world-us-canada-42532776
469,High Court upholds law regulating fees in private schools,7nej2y,https://www.reddit.com/r/worldnews/comments/7nej2y/high_court_upholds_law_regulating_fees_in_private/,30,1,,2018-01-01,http://www.thehindu.com/news/national/gujarat-hc-upholds-law-regulating-fees-in-private-schools/article22288361.ece
470,'Ten people killed' in Iranian protests,7nej0o,https://www.reddit.com/r/worldnews/comments/7nej0o/ten_people_killed_in_iranian_protests/,9,0,[deleted],2018-01-01,https://www.itv.com/news/2018-01-01/iran-protests/
471,"UK NHS Patient Asks for Female Nurse for Cervical Smear, Gets Tattooed Trans Man With Stubble",7neivu,https://www.reddit.com/r/worldnews/comments/7neivu/uk_nhs_patient_asks_for_female_nurse_for_cervical/,5,6,,2018-01-01,http://www.breitbart.com/london/2017/12/31/woman-requested-female-nurse-intimate-procedure-summoned-obviously-male-transsexual-stubble-tattoos/
472,ISIS 'long white beard' executioner who stoned people captured in Mosul,7neifb,https://www.reddit.com/r/worldnews/comments/7neifb/isis_long_white_beard_executioner_who_stoned/,1777,432,,2018-01-01,http://en.abna24.com/news/middle-east/isis-long-white-beard-executioner-who-stoned-people-captured-in-mosul_875201.html
473,Hold the internet site layout amazing,7neiep,https://www.reddit.com/r/worldnews/comments/7neiep/hold_the_internet_site_layout_amazing/,1,1,,2018-01-01,https://hummingbirdwebdesign.com/search-engine-optimization-port-washington-new-york/
474,Sexual assaults reported in Berlin despite 'safety area' for women,7neief,https://www.reddit.com/r/worldnews/comments/7neief/sexual_assaults_reported_in_berlin_despite_safety/,7,3,,2018-01-01,http://www.foxnews.com/world/2018/01/01/sexual-assaults-reported-in-berlin-despite-safety-area-for-women.html
475,Новогодние Поздравления Велемира 2018 Christmas Congratulations of Velem...,7neidp,https://www.reddit.com/r/worldnews/comments/7neidp/новогодние_поздравления_велемира_2018_christmas/,1,1,,2018-01-01,https://www.youtube.com/attribution_link?a=3R8ij_hnbqI&amp;u=%2Fwatch%3Fv%3Dc0bSPOoCDXo%26feature%3Dshare
476,China Shuts Down Domestic Ivory Trade In Effort To Fight Poaching,7nei72,https://www.reddit.com/r/worldnews/comments/7nei72/china_shuts_down_domestic_ivory_trade_in_effort/,7,1,,2018-01-01,https://www.huffingtonpost.com/entry/china-bans-ivory-sales_us_5a47a24ae4b06d1621b8f856
477,شركة الرواد لنقل الاثاث /0796556043/0791892219////,7nei0a,https://www.reddit.com/r/worldnews/comments/7nei0a/شركة_الرواد_لنقل_الاثاث_07965560430791892219/,1,1,,2018-01-01,https://jo.sogarab.com/ad-44897.html
478,"Trump, who called Iran a terrorist nation, is in no position to sympathize with Iranian people: Iran President",7nehz3,https://www.reddit.com/r/worldnews/comments/7nehz3/trump_who_called_iran_a_terrorist_nation_is_in_no/,11,1,,2018-01-01,http://ifpnews.com/exclusive/trump-no-position-sympathize-iranian-people-rouhani/
479,Iran state TV says 10 killed in protests yesterdat,7neht2,https://www.reddit.com/r/worldnews/comments/7neht2/iran_state_tv_says_10_killed_in_protests_yesterdat/,1,1,[deleted],2018-01-01,https://www.washingtonpost.com/world/middle_east/the-latest-iran-state-tv-says-10-killed-in-protests/2018/01/01/24a6b478-eeda-11e7-95e3-eff284e71c8d_story.html?utm_term=.deba25f735a6
480,Sexual assaults reported in Berlin despite 'safety area' for women,7nehp5,https://www.reddit.com/r/worldnews/comments/7nehp5/sexual_assaults_reported_in_berlin_despite_safety/,1,4,,2018-01-01,http://www.foxnews.com/world/2018/01/01/sexual-assaults-reported-in-berlin-despite-safety-area-for-women.html
481,Five things you need to know about protests in Iran,7nehl5,https://www.reddit.com/r/worldnews/comments/7nehl5/five_things_you_need_to_know_about_protests_in/,15,0,,2018-01-01,http://www.aljazeera.com/news/2017/12/protests-iran-171231083620343.html
482,At least eight dead as passenger boat capsizes in...,7nehjb,https://www.reddit.com/r/worldnews/comments/7nehjb/at_least_eight_dead_as_passenger_boat_capsizes_in/,1,1,,2018-01-01,http://msplay.blogspot.com/2018/01/at-least-eight-dead-as-passenger-boat.html
483,Two more protesters killed amid Iran demonstrations: report,7nehhc,https://www.reddit.com/r/worldnews/comments/7nehhc/two_more_protesters_killed_amid_iran/,11,0,,2018-01-01,http://www.foxnews.com/world/2018/01/01/two-more-protesters-killed-amid-iran-demonstrations-report.html
484,Kim Jong Un Wants The U.S. To Know That His Nuclear Arsenal Is Complete,7nehcg,https://www.reddit.com/r/worldnews/comments/7nehcg/kim_jong_un_wants_the_us_to_know_that_his_nuclear/,12,5,,2018-01-01,https://www.npr.org/sections/thetwo-way/2017/12/31/574906948/kim-jong-un-wants-the-u-s-to-know-that-his-nuclear-arsenal-is-complete
485,"2018: FG to stem job losses, create new ones – Ngige",7neh9s,https://www.reddit.com/r/worldnews/comments/7neh9s/2018_fg_to_stem_job_losses_create_new_ones_ngige/,1,1,,2018-01-01,http://edujandon.com/2018/01/2018-fg-to-stem-job-losses-create-new-ones-ngige.html/
486,"Kim Jong Un declares North Korea is a nuclear power, says 'button' is on his desk",7neh31,https://www.reddit.com/r/worldnews/comments/7neh31/kim_jong_un_declares_north_korea_is_a_nuclear/,7,3,,2018-01-01,https://www.cnbc.com/2017/12/31/kim-jong-un-declares-north-korea-is-a-nuclear-power.html
487,George Murray Quotes About Respect – 60255,7neh1b,https://www.reddit.com/r/worldnews/comments/7neh1b/george_murray_quotes_about_respect_60255/,1,0,,2018-01-01,http://www.trendquotes.com/george-murray-quotes-about-respect-60255/
488,France sets up tax dept to investigate Jews,7negpc,https://www.reddit.com/r/worldnews/comments/7negpc/france_sets_up_tax_dept_to_investigate_jews/,4,25,,2018-01-01,http://www.jpost.com/Israel-News/France-sets-up-tax-dept-to-investigate-Jews-521379
489,Iran confirms 10 killed as anti-government protests enter fifth day.,7negjo,https://www.reddit.com/r/worldnews/comments/7negjo/iran_confirms_10_killed_as_antigovernment/,6,0,[deleted],2018-01-01,https://www.haaretz.com/middle-east-news/iran/1.832363
490,"Iranian state TV reports that 10 people have been killed amid nationwide protests, without elaborating.",7neghv,https://www.reddit.com/r/worldnews/comments/7neghv/iranian_state_tv_reports_that_10_people_have_been/,1236,159,,2018-01-01,https://apnews.com/7a806706f1954356bc81f48a90c135ef/The-Latest:-Iran-state-TV-says-10-killed-in-protests?utm_campaign=SocialFlow&amp;utm_source=Twitter&amp;utm_medium=AP
491,2018 will be the 'worst for humanitarian crises' since the Second World War,7neghs,https://www.reddit.com/r/worldnews/comments/7neghs/2018_will_be_the_worst_for_humanitarian_crises/,45,11,,2018-01-01,http://www.telegraph.co.uk/news/2017/12/31/2018-will-worst-humanitarian-crises-since-second-world-war
492,Fox News Breaking News Alert,7negg3,https://www.reddit.com/r/worldnews/comments/7negg3/fox_news_breaking_news_alert/,1,1,,2018-01-01,http://topnewstrends101.blogspot.com/2018/01/fox-news-breaking-news-alert.html
493,Iran president: Trump has no right to sympathize with protesters,7neg83,https://www.reddit.com/r/worldnews/comments/7neg83/iran_president_trump_has_no_right_to_sympathize/,21,4,,2018-01-01,https://www.nbcnews.com/nightly-news/video/iran-president-trump-has-no-right-to-sympathize-with-protesters-1127033411865
494,Israeli Authorities Detained 26 Terrorism Suspects Early Monday Morning,7neg5h,https://www.reddit.com/r/worldnews/comments/7neg5h/israeli_authorities_detained_26_terrorism/,18,1,,2018-01-01,https://sputniknews.com/middleeast/201801011060456361-israel-terrorism-suspects-arrest/
495,"North Korea's Kim says 'open to dialogue' with South Korea, will only use nukes if threatened",7neg2z,https://www.reddit.com/r/worldnews/comments/7neg2z/north_koreas_kim_says_open_to_dialogue_with_south/,1,1,,2018-01-01,http://cartvela.blogspot.com/2018/01/north-koreas-kim-says-open-to-dialogue.html
496,"Israeli politicians appose Likud resolution to annex parts of West Bank, vote sparks fury",7nefy2,https://www.reddit.com/r/worldnews/comments/7nefy2/israeli_politicians_appose_likud_resolution_to/,7,3,,2018-01-01,https://www.rt.com/news/414734-israel-annexation-west-bank-settlements/
497,"Pakistan’s government plans to seize control of charities and financial assets linked to Islamist leader Hafiz Saeed, who Washington has designated a terrorist, according to officials and documents reviewed by Reuters.",7neft2,https://www.reddit.com/r/worldnews/comments/7neft2/pakistans_government_plans_to_seize_control_of/,52,5,[deleted],2018-01-01,https://www.reuters.com/article/us-pakistan-militants-exclusive/exclusive-pakistan-plans-takeover-of-charities-run-by-islamist-figure-u-s-has-targeted-idUSKBN1EQ0T6
498,Forex Lasers Forum,7nefe3,https://www.reddit.com/r/worldnews/comments/7nefe3/forex_lasers_forum/,1,2,,2018-01-01,https://www.forexlasers.com
499,Kim Jong-unâs Overture to South Korea Signals Possible Thaw in Nuclear Crisis,7nefb8,https://www.reddit.com/r/worldnews/comments/7nefb8/kim_jongunâs_overture_to_south_korea_signals/,1,2,,2018-01-01,https://www.nytimes.com/2017/12/31/world/asia/north-korea-kim-jong-un-olympics.html
500,"Nuclear war with North Korea is closer than ever, says former US military chief",7nef5s,https://www.reddit.com/r/worldnews/comments/7nef5s/nuclear_war_with_north_korea_is_closer_than_ever/,24,42,,2018-01-01,http://www.telegraph.co.uk/news/2017/12/31/nuclear-war-north-korea-closer-ever-says-former-us-military/
501,British chief executive and family killed in Australian seaplane crash,7nef4q,https://www.reddit.com/r/worldnews/comments/7nef4q/british_chief_executive_and_family_killed_in/,38,0,,2018-01-01,http://www.telegraph.co.uk/news/2018/01/01/australian-police-name-british-family-killed-seaplane-crash/
502,"Saudi Arabia, UAE introduce VAT for first time",7neevg,https://www.reddit.com/r/worldnews/comments/7neevg/saudi_arabia_uae_introduce_vat_for_first_time/,243,79,,2018-01-01,http://www.daijiworld.com/news/newsDisplay.aspx?newsID=488764
503,"Iranians free to criticize, stage protest: Iran President",7neetl,https://www.reddit.com/r/worldnews/comments/7neetl/iranians_free_to_criticize_stage_protest_iran/,44,6,,2018-01-01,http://www.presstv.com/Detail/2017/12/31/547403/Rouhani-Iran-protest-criticism
504,Oliver Wendell Holmes Quotes About Future – 26970,7neesy,https://www.reddit.com/r/worldnews/comments/7neesy/oliver_wendell_holmes_quotes_about_future_26970/,1,0,,2018-01-01,http://www.trendquotes.com/oliver-wendell-holmes-quotes-about-future-26970/
505,"Kim Jong-Un gave the first indication that North Korea could participate in next month's Winter Olympics in the South, despite tensions over Pyongyang's nuclear weapons programme.",7neerx,https://www.reddit.com/r/worldnews/comments/7neerx/kim_jongun_gave_the_first_indication_that_north/,23,2,,2018-01-01,http://www.france24.com/en/20180101-kim-says-north-korea-could-participate-souths-winter-olympics
506,Thousands flee fireworks explosion at Australia beach,7neeja,https://www.reddit.com/r/worldnews/comments/7neeja/thousands_flee_fireworks_explosion_at_australia/,578,50,,2018-01-01,http://www.bbc.co.uk/news/world-australia-42531996
507,"Beginning today, transgender individuals can join the US military",7neein,https://www.reddit.com/r/worldnews/comments/7neein/beginning_today_transgender_individuals_can_join/,50,26,,2018-01-01,http://abcnews.go.com/US/beginning-today-transgender-individuals-join-us-military/story?id=52051204
508,"Minibus falls into sea near Shanghai, killing 7 people",7neeh4,https://www.reddit.com/r/worldnews/comments/7neeh4/minibus_falls_into_sea_near_shanghai_killing_7/,39,0,,2018-01-01,http://abcnews.go.com/International/wireStory/minibus-falls-sea-shanghai-killing-people-52080596
509,Israeli minister wishes Iranian protesters 'success',7neeg3,https://www.reddit.com/r/worldnews/comments/7neeg3/israeli_minister_wishes_iranian_protesters_success/,167,78,,2018-01-01,http://abcnews.go.com/International/wireStory/israeli-minister-wishes-iranian-protesters-success-52080664
510,At least 8 dead as speedboat capsizes off Indonesia's Borneo,7nee9n,https://www.reddit.com/r/worldnews/comments/7nee9n/at_least_8_dead_as_speedboat_capsizes_off/,34,3,,2018-01-01,http://www.foxnews.com/world/2018/01/01/at-least-8-dead-as-speedboat-capsizes-off-indonesias-borneo.html
511,Runescape Summoning Guide,7nee0y,https://www.reddit.com/r/worldnews/comments/7nee0y/runescape_summoning_guide/,1,1,,2018-01-01,https://lerche15gentrygarrettsherwood741.shutterfly.com/21
512,48 underage girls have been rescued from the ashrams of a ‘godman’ in Delhi,7nedwb,https://www.reddit.com/r/worldnews/comments/7nedwb/48_underage_girls_have_been_rescued_from_the/,7,2,[deleted],2018-01-01,https://www.washingtonpost.com/world/asia_pacific/48-underage-girls-have-been-rescued-from-the-ashrams-of-a-godman-in-delhi/2017/12/31/92737142-eca2-11e7-956e-baea358f9725_story.html
513,"Earth becoming a desert without climate deal, scientists warn",7ngwl3,https://www.reddit.com/r/worldnews/comments/7ngwl3/earth_becoming_a_desert_without_climate_deal/,81,54,,2018-01-01,http://www.washingtonexaminer.com/earth-becoming-a-desert-without-climate-deal-scientists-warn/article/2644599
514,﻿WPC Odgrodzenia Kompozytowe,7ngwgq,https://www.reddit.com/r/worldnews/comments/7ngwgq/wpc_odgrodzenia_kompozytowe/,1,0,,2018-01-01,http://www.tube8y.com/space-uid-71937.html
515,Pete Cashmore Quotes About Positive – 56382,7ngvs6,https://www.reddit.com/r/worldnews/comments/7ngvs6/pete_cashmore_quotes_about_positive_56382/,1,0,,2018-01-01,http://www.trendquotes.com/pete-cashmore-quotes-about-positive-56382/
516,Pakistan ready to share every detail of US aid: FM,7ngvlg,https://www.reddit.com/r/worldnews/comments/7ngvlg/pakistan_ready_to_share_every_detail_of_us_aid_fm/,50,14,,2018-01-01,https://www.samaa.tv/pakistan/2018/01/pakistan-ready-to-share-every-detail-of-us-aid-khawaja-asif/
517,Did you see the first Supermoon of 2018?,7ngv9z,https://www.reddit.com/r/worldnews/comments/7ngv9z/did_you_see_the_first_supermoon_of_2018/,0,8,,2018-01-01,https://www.readersfusion.com/news/supermoon-2018/
518,Hiiii,7ngujs,https://www.reddit.com/r/worldnews/comments/7ngujs/hiiii/,1,0,,2018-01-01,https://youtu.be/li9apVFFfyk
519,Two Saudi prince released from detention in anti-corruption probe,7ngsir,https://www.reddit.com/r/worldnews/comments/7ngsir/two_saudi_prince_released_from_detention_in/,1,1,[deleted],2018-01-01,http://therightpassage.com/two-saudi-prince-released-detention-anti-corruption-probe/
520,Defiant Iranian protesters steal revolutionary guard's trousers even as death toll mounts,7ngs66,https://www.reddit.com/r/worldnews/comments/7ngs66/defiant_iranian_protesters_steal_revolutionary/,90,17,,2018-01-01,http://www.telegraph.co.uk/news/2018/01/01/defiant-iran-protesters-steal-revolutionary-guards-trousers/
521,Police woman beaten during new years in France,7ngrwy,https://www.reddit.com/r/worldnews/comments/7ngrwy/police_woman_beaten_during_new_years_in_france/,1,0,,2018-01-01,https://www.liveleak.com/view?i=3fc_1514828496
522,Новогодние Поздравления Велемира 2018 Christmas Congratulations of Velem...,7ngr5d,https://www.reddit.com/r/worldnews/comments/7ngr5d/новогодние_поздравления_велемира_2018_christmas/,1,0,,2018-01-01,https://www.youtube.com/attribution_link?a=0BL_1i5pZqM&amp;u=%2Fwatch%3Fv%3Dc0bSPOoCDXo%26feature%3Dshare
523,London Catholic school abuse survivor speaks of 'constant violence',7ngqz3,https://www.reddit.com/r/worldnews/comments/7ngqz3/london_catholic_school_abuse_survivor_speaks_of/,115,7,,2018-01-01,https://www.theguardian.com/uk-news/2018/jan/01/london-catholic-school-abuse-survivor-speaks-of-constant-violence-st-benedicts
524,"Police officer killed, 3 wounded at hands of 'rioter' during rallies in Iran – state media",7ngqgo,https://www.reddit.com/r/worldnews/comments/7ngqgo/police_officer_killed_3_wounded_at_hands_of/,0,14,,2018-01-01,https://www.rt.com/news/414766-iran-officer-killed-protests/
525,New Year drinkers build sand-haven to avoid liquor ban,7ngq17,https://www.reddit.com/r/worldnews/comments/7ngq17/new_year_drinkers_build_sandhaven_to_avoid_liquor/,40,5,,2018-01-01,http://www.newshub.co.nz/home/new-zealand/2018/01/new-year-drinkers-build-sand-haven-to-avoid-liquor-ban.html
526,"Pope on 2018: forget life's useless baggage, empty chatter",7ngpxz,https://www.reddit.com/r/worldnews/comments/7ngpxz/pope_on_2018_forget_lifes_useless_baggage_empty/,46,6,,2018-01-01,http://naxtshop.com/2018/01/01/pope-2018-forget-lifes-useless-baggage-empty-chatter/
527,"Here are the top 10 cryptoassets of 2017 (and bitcoin’s 1,000% rise doesn’t even make the list)",7ngpw1,https://www.reddit.com/r/worldnews/comments/7ngpw1/here_are_the_top_10_cryptoassets_of_2017_and/,0,0,,2018-01-01,http://www.techaed.com/top-10-cryptoassets-2017-bitcoins-1000-rise-doesnt-even-make-list/
528,"Cristiano Ronaldo, Kim, Kanye and Others Captured in Awesome New Year's Eve Photos",7ngpfi,https://www.reddit.com/r/worldnews/comments/7ngpfi/cristiano_ronaldo_kim_kanye_and_others_captured/,1,1,,2018-01-01,https://www.babaleftonline.com/kim-kanye-company-captured-awesome-new-years-eve-photos/
529,Iran ‘s Government is reportedly blocking the Internet to calm down protests,7ngp9q,https://www.reddit.com/r/worldnews/comments/7ngp9q/iran_s_government_is_reportedly_blocking_the/,1,0,,2018-01-01,http://securityaffairs.co/wordpress/67313/digital-id/iran-protests-internet-censorship.html
530,Breaking News 1/1/18 Kim Jong Un Is Ready An Has Button On His Desk.,7ngp8r,https://www.reddit.com/r/worldnews/comments/7ngp8r/breaking_news_1118_kim_jong_un_is_ready_an_has/,1,0,,2018-01-01,https://www.youtube.com/attribution_link?a=9Axr67GGH48&amp;u=%2Fwatch%3Fv%3D4THvffvq4AA%26feature%3Dshare
531,"Well, do I even have to say something",7ngp2u,https://www.reddit.com/r/worldnews/comments/7ngp2u/well_do_i_even_have_to_say_something/,1,1,[deleted],2018-01-01,http://www.nmtechh.com/X9hAL
532,﻿Lakierowanie Słupków Obramowania 08.06.2014,7ngof9,https://www.reddit.com/r/worldnews/comments/7ngof9/lakierowanie_słupków_obramowania_08062014/,1,0,,2018-01-01,http://forum.ueh.edu.vn/member.php?u=96422
533,"Blaze destroys hundreds of cars, melts floors of Liverpool car park",7ngodj,https://www.reddit.com/r/worldnews/comments/7ngodj/blaze_destroys_hundreds_of_cars_melts_floors_of/,57,8,,2018-01-01,https://www.reuters.com/article/us-britain-fire/blaze-destroys-hundreds-of-cars-melts-floors-of-liverpool-car-park-idUSKBN1EQ163
534,"Here are the top 10 cryptoassets of 2017 (and bitcoin’s 1,000% rise doesn’t even make the list)",7ngnlx,https://www.reddit.com/r/worldnews/comments/7ngnlx/here_are_the_top_10_cryptoassets_of_2017_and/,1,1,,2018-01-01,http://www.techaed.com/top-10-cryptoassets-2017-bitcoins-1000-rise-doesnt-even-make-list/
535,Taoiseach (Irish Prime Minister) concerned over ‘cult status’ of Scientology,7ngn6f,https://www.reddit.com/r/worldnews/comments/7ngn6f/taoiseach_irish_prime_minister_concerned_over/,776,193,,2018-01-01,http://www.irishexaminer.com/breakingnews/ireland/taoiseach-concerned-over-cult-status-of-scientology-820229.html
536,Al Gore Quotes About Failure – 18638,7ngmyi,https://www.reddit.com/r/worldnews/comments/7ngmyi/al_gore_quotes_about_failure_18638/,1,0,,2018-01-01,http://www.trendquotes.com/al-gore-quotes-about-failure-18638/
