,title,id,url,score,num_comments,text,date,link
362,"Trump shifts gears on Afghanistan - After decrying nation building during his presidential campaign &amp; lambasting Afghanistan as a “complete waste,” he's in the midst of sending 1000s more troops to the country in an effort to stabilize it.",7nf75f,https://www.reddit.com/r/worldnews/comments/7nf75f/trump_shifts_gears_on_afghanistan_after_decrying/,332,184,,2018-01-01,http://thehill.com/policy/defense/366832-trump-shifts-gears-on-afghanistan
363,"India, Pakistan exchange 27th list of nuclear installations",7nf70m,https://www.reddit.com/r/worldnews/comments/7nf70m/india_pakistan_exchange_27th_list_of_nuclear/,1,1,,2018-01-01,http://www.assamtribune.com/scripts/detailsnew.asp?id=jan0118/at045
364,"Nuclear button is on my desk, says Kim",7nf6wf,https://www.reddit.com/r/worldnews/comments/7nf6wf/nuclear_button_is_on_my_desk_says_kim/,1,0,,2018-01-01,http://www.bbc.com/news/world-asia-42531574
365,"Nagoya University Hospital will deploy a squad of robots in February to deliver medicine and test samples, even between floors, while reducing the workload of nurses and other staff members. Four robots will be operated on night shifts from 5 p.m. through 8 a.m., when fewer employees are working.",7nf6ul,https://www.reddit.com/r/worldnews/comments/7nf6ul/nagoya_university_hospital_will_deploy_a_squad_of/,7,5,,2018-01-01,http://www.asahi.com/ajw/articles/AJ201801010027.html
366,Katherine Jenkins Quotes About Relationship – 57762,7nf6kx,https://www.reddit.com/r/worldnews/comments/7nf6kx/katherine_jenkins_quotes_about_relationship_57762/,1,0,,2018-01-01,http://www.trendquotes.com/katherine-jenkins-quotes-about-relationship-57762/
367,Israel's Likud party members vote to annex West Bank settlements,7nf6hh,https://www.reddit.com/r/worldnews/comments/7nf6hh/israels_likud_party_members_vote_to_annex_west/,1,0,[deleted],2018-01-01,https://www.breakingisraelnews.com/100215/likud-central-committee-votes-exercise-sovereignty-judea-samaria/
368,كم من الوقت تحتاجه الشرطة الصينية لتحديد موقعك من خلال شبكة من كاميرات المراقبة ؟,7nf6h6,https://www.reddit.com/r/worldnews/comments/7nf6h6/كم_من_الوقت_تحتاجه_الشرطة_الصينية_لتحديد_موقعك_من/,1,0,,2018-01-01,https://5thaqafah.blogspot.com/2018/01/blog-post_90.html
369,Israel's Likud party members vote to annex West Bank settlements,7nf6ac,https://www.reddit.com/r/worldnews/comments/7nf6ac/israels_likud_party_members_vote_to_annex_west/,1,1,[deleted],2018-01-01,https://www.washingtonpost.com/world/middle_east/israels-likud-party-members-vote-to-annex-settlements/2018/01/01/77e0b44c-eef1-11e7-95e3-eff284e71c8d_story.html?utm_term=.4b205038f7b4
370,﻿Ogrodzenia Bezbarwne W Odgrodzenia Dodatkowo Furty,7nf63s,https://www.reddit.com/r/worldnews/comments/7nf63s/ogrodzenia_bezbarwne_w_odgrodzenia_dodatkowo_furty/,1,1,,2018-01-01,http://pattinson-fan.ru/index.php?subaction=userinfo&amp;user=uqiryxuf
371,What Games Is Your First Install/Download in 2018?,7nf62x,https://www.reddit.com/r/worldnews/comments/7nf62x/what_games_is_your_first_installdownload_in_2018/,1,0,,2018-01-01,http://questswamppeopledeer.blogspot.com/2018/01/what-games-is-your-first.html
372,Lorde labelled a bigot,7nf62f,https://www.reddit.com/r/worldnews/comments/7nf62f/lorde_labelled_a_bigot/,4,18,,2018-01-01,https://www.9news.com.au/world/2018/01/01/14/36/nz-singer-lorde-labelled-bigot-in-full-page-ad-by-pro-israel-group
373,Trump: No More Aid to Deceitful Pakistan,7nf5y2,https://www.reddit.com/r/worldnews/comments/7nf5y2/trump_no_more_aid_to_deceitful_pakistan/,2,0,[deleted],2018-01-01,http://thehill.com/policy/international/366965-trump-rips-pakistan-in-first-tweet-of-2018
374,Special Movies and Artworks of Tekken Movie No 13,7nf5mx,https://www.reddit.com/r/worldnews/comments/7nf5mx/special_movies_and_artworks_of_tekken_movie_no_13/,1,1,,2018-01-01,http://www.itsupergift.com/special-movies-and-artworks-of-tekken-movie-no-13/
375,"After a year that saw democracy advocates in Hong Kong jailed and ousted from public office, thousands marched through the streets of Hong Kong on New Year’s Day to warn China not to meddle further in the city’s affairs and undermine its autonomy.",7nf5ko,https://www.reddit.com/r/worldnews/comments/7nf5ko/after_a_year_that_saw_democracy_advocates_in_hong/,1061,151,,2018-01-01,https://www.reuters.com/article/us-newyear-hongkong-protests/after-tough-year-hong-kong-democracy-protesters-sound-warning-to-china-on-new-years-day-idUSKBN1EQ0YZ?il=0
376,"Nigeria: Death toll in Boko Haram attack on loggers rises to 25 | The jihadists are increasingly targeting loggers in their armed campaign, accusing them of spying for the military",7nf5go,https://www.reddit.com/r/worldnews/comments/7nf5go/nigeria_death_toll_in_boko_haram_attack_on/,3,0,[deleted],2018-01-01,https://www.theguardian.com/world/2018/jan/01/nigeria-toll-in-boko-haram-attack-on-loggers-rises
377,"Several arrested in Berlin, Cologne over suspected sexual assault during NYE celebrations",7nf5en,https://www.reddit.com/r/worldnews/comments/7nf5en/several_arrested_in_berlin_cologne_over_suspected/,0,2,[deleted],2018-01-01,https://www.miragenews.com/several-arrested-in-berlin-cologne-over-suspected-sexual-assault-during-nye-celebrations/
378,Forces on alert as India gears up to weed out atleast 2 Million Bangladeshis from border state,7nf50t,https://www.reddit.com/r/worldnews/comments/7nf50t/forces_on_alert_as_india_gears_up_to_weed_out/,62,27,,2018-01-01,https://sputniknews.com/asia/201712301060433948-india-weeds-out-illegal-muslims/
379,Should You Dress volumptuous?,7nf503,https://www.reddit.com/r/worldnews/comments/7nf503/should_you_dress_volumptuous/,1,1,,2018-01-01,http://www.iamsport.org/pg/bookmarks/butanelyric12/read/35694306/new-fashion-time-of-kids
380,"Kim Jong Un urges mass production of nukes, says North Korea ready for war",7nf4zg,https://www.reddit.com/r/worldnews/comments/7nf4zg/kim_jong_un_urges_mass_production_of_nukes_says/,2,1,[deleted],2018-01-01,https://www.timesofisrael.com/kim-jong-un-says-us-should-know-north-korean-nuclear-force-a-reality/
381,SPDR S&amp;P 500 ETF Trust (SPY) Shares Sold by Guyasuta Investment Advisors Inc.,7nf4y8,https://www.reddit.com/r/worldnews/comments/7nf4y8/spdr_sp_500_etf_trust_spy_shares_sold_by_guyasuta/,1,1,,2018-01-01,https://www.thelincolnianonline.com/2018/01/01/guyasuta-investment-advisors-inc-has-1-70-million-stake-in-spdr-sp-500-etf-trust-spy-updated-updated.html
382,New Year's Eve brings record cold for much of US,7nf4tq,https://www.reddit.com/r/worldnews/comments/7nf4tq/new_years_eve_brings_record_cold_for_much_of_us/,1,1,[deleted],2018-01-01,http://edition.cnn.com/2017/12/31/us/new-years-eve-winter-weather/index.html
383,"Those who have never tried out video games might find them a little overwhelming, but there's absolutely nothing to be a",7nf4aw,https://www.reddit.com/r/worldnews/comments/7nf4aw/those_who_have_never_tried_out_video_games_might/,1,1,,2018-01-01,http://familiarspots.com/members/stroud39olesen/activity/446619/
384,Scholars call for Somalia to be protected from foreign interference,7nf417,https://www.reddit.com/r/worldnews/comments/7nf417/scholars_call_for_somalia_to_be_protected_from/,3,2,,2018-01-01,https://www.middleeastmonitor.com/20180101-scholars-call-for-somalia-to-be-protected-from-foreign-interference/
385,Manny Pacquiao Quotes About Relationship – 57700,7nf3zq,https://www.reddit.com/r/worldnews/comments/7nf3zq/manny_pacquiao_quotes_about_relationship_57700/,1,0,,2018-01-01,http://www.trendquotes.com/manny-pacquiao-quotes-about-relationship-57700/
386,"UK developers to help country prefabricate its way out of housing shortage: A major UK housebuilder will prefabricate up to a quarter of its homes in a factory, in the latest attempt by the construction industry to tackle the country’s housing shortage.",7nf3v8,https://www.reddit.com/r/worldnews/comments/7nf3v8/uk_developers_to_help_country_prefabricate_its/,6,9,,2018-01-01,http://www.scmp.com/property/international/article/2126384/uk-developers-help-country-prefabricate-its-way-out-housing
387,Researchers Propose Ecuador-Costa Rica Swimway To Protect Marine Life - swimway will be “new type of international (marine) management” system to sustain at-risk marine migrating and mating between Galapagos Islands Marine Reserve in Ecuador and Cocos Island Marine Reserve in Costa Rica.,7nf3d7,https://www.reddit.com/r/worldnews/comments/7nf3d7/researchers_propose_ecuadorcosta_rica_swimway_to/,1,0,,2018-01-01,https://www.telesurtv.net/english/news/Researchers-Propose-Ecuador-Costa-Rica-Swimway-To-Protect-Marine-Life-20171231-0009.html
388,Lorde called a bigot over cancelled Israel concert in full-page Washington Post ad: Advertisement taken by rabbi Shmuley Boteach also accuses New Zealand of prejudice against Israel.,7nf2yw,https://www.reddit.com/r/worldnews/comments/7nf2yw/lorde_called_a_bigot_over_cancelled_israel/,960,769,,2018-01-01,https://www.theguardian.com/music/2018/jan/01/lorde-called-a-bigot-over-israel-stance-in-full-page-washington-post-ad
389,"Pakistan has given U.S. nothing but lies and deceit, says Donald Trump.",7nf2x0,https://www.reddit.com/r/worldnews/comments/7nf2x0/pakistan_has_given_us_nothing_but_lies_and_deceit/,41,15,,2018-01-01,http://www.thehindu.com/news/international/pakistan-has-given-us-nothing-but-lies-and-deceit-says-donald-trump/article22346765.ece
390,Death toll rises in Iran amid wave of protests,7nf2sw,https://www.reddit.com/r/worldnews/comments/7nf2sw/death_toll_rises_in_iran_amid_wave_of_protests/,11,1,,2018-01-01,http://edition.cnn.com/2018/01/01/world/iran-protests-deaths-rouhani-intl/index.html
391,Arthur Ashe Quotes About Time – 68830,7nf2pl,https://www.reddit.com/r/worldnews/comments/7nf2pl/arthur_ashe_quotes_about_time_68830/,1,0,,2018-01-01,http://www.trendquotes.com/arthur-ashe-quotes-about-time-68830/
392,At least eight dead as passenger boat capsizes in...,7nf2nx,https://www.reddit.com/r/worldnews/comments/7nf2nx/at_least_eight_dead_as_passenger_boat_capsizes_in/,1,1,,2018-01-01,http://msplay.blogspot.com/2018/01/at-least-eight-dead-as-passenger-boat_1.html
393,Researchers Gave Robots the Ability to Think Ahead,7nf2mg,https://www.reddit.com/r/worldnews/comments/7nf2mg/researchers_gave_robots_the_ability_to_think_ahead/,1,0,,2018-01-01,http://trafficinfinityx.com/share/5a4a3368c1b65957013c5c98?social_media=reddit&amp;t=1514812284
394,Donald trump calls for regime change in Iran,7nf29e,https://www.reddit.com/r/worldnews/comments/7nf29e/donald_trump_calls_for_regime_change_in_iran/,1,0,[deleted],2018-01-01,https://mobile.twitter.com/realDonaldTrump/status/947802588174577664
395,"Pakistan gave us lies, deceit in return for billions in aid, says Trump",7nf208,https://www.reddit.com/r/worldnews/comments/7nf208/pakistan_gave_us_lies_deceit_in_return_for/,9,5,,2018-01-01,https://timesofindia.indiatimes.com/world/us/us-foolishly-gave-pakistan-33-million-in-aid-for-its-lies-and-deceit-trump/articleshow/62326120.cms
396,France looks to deepen trade ties with Russia and China: “We are moving from a world dominated by very exclusive trans-Atlantic relations toward a rebalancing”,7nf1af,https://www.reddit.com/r/worldnews/comments/7nf1af/france_looks_to_deepen_trade_ties_with_russia_and/,343,302,,2018-01-01,https://www.wsj.com/articles/france-looks-to-deepen-trade-ties-with-russia-and-china-1514808000
397,"Trump rips Pakistan in 1st tweet of 2018: “The US has foolishly given Pakistan more than $33 billion in aid over the last 15 years, and they have given us nothing but lies &amp; deceit.."" ""They give safe haven to the terrorists we hunt in Afghanistan, with little help. No more!”",7nf16a,https://www.reddit.com/r/worldnews/comments/7nf16a/trump_rips_pakistan_in_1st_tweet_of_2018_the_us/,1,1,[deleted],2018-01-01,http://thehill.com/policy/international/366965-trump-rips-pakistan-in-first-tweet-of-2018
398,"Don't extinguish migrants' hopes, Pope says on World Day of Peace",7nf121,https://www.reddit.com/r/worldnews/comments/7nf121/dont_extinguish_migrants_hopes_pope_says_on_world/,0,5,,2018-01-01,http://reuters.com/article/amp/idUSKBN1EQ0Y7
399,Lending Fascination Up to sixty percent,7nf0kb,https://www.reddit.com/r/worldnews/comments/7nf0kb/lending_fascination_up_to_sixty_percent/,1,1,,2018-01-01,http://www.postpost.me/davorcoin-lending-interest-60-percent/
400,Wideland: An Open Source and Crowd Developed State,7nf0d5,https://www.reddit.com/r/worldnews/comments/7nf0d5/wideland_an_open_source_and_crowd_developed_state/,1,1,,2018-01-01,https://wideland.org
401,6 Things You Should Expect to See in 2018,7nf00r,https://www.reddit.com/r/worldnews/comments/7nf00r/6_things_you_should_expect_to_see_in_2018/,1,1,,2018-01-01,http://waterfordwhispersnews.com/2017/12/30/6-things-you-should-expect-to-see-in-2018/
402,"Israeli archaeologists find 2,700-year-old 'governor of Jerusalem' seal impression",7nezrw,https://www.reddit.com/r/worldnews/comments/7nezrw/israeli_archaeologists_find_2700yearold_governor/,528,300,,2018-01-01,https://www.reuters.com/article/us-israel-archaeology/israeli-archaeologists-find-2700-year-old-governor-of-jerusalem-seal-impression-idUSKBN1EQ0WH
403,"Donald Trump attacks Pakistan claiming 'they have given us nothing but lies and deceit' in return for $33bn aid - ''They give safe haven to the terrorists we hunt in Afghanistan, with little help. No more!'",7nezpr,https://www.reddit.com/r/worldnews/comments/7nezpr/donald_trump_attacks_pakistan_claiming_they_have/,49929,9504,,2018-01-01,http://www.independent.co.uk/news/world/americas/donald-trump-pakistan-tweet-lies-deceit-aid-us-president-terrorism-aid-a8136516.html
404,US President Donald Trump says 'no more' aid to Pakistan to fight terrorism after $33 million given over 15 years,7nez5n,https://www.reddit.com/r/worldnews/comments/7nez5n/us_president_donald_trump_says_no_more_aid_to/,45,42,,2018-01-01,http://www.ibtimes.co.in/us-president-donald-trump-says-no-more-aid-pakistan-fight-terrorism-755255
405,A look at 2017's biggest news stories,7nez4i,https://www.reddit.com/r/worldnews/comments/7nez4i/a_look_at_2017s_biggest_news_stories/,1,1,,2018-01-01,https://www.youtube.com/watch?v=zMWSmULqsk8
406,Jane Pauley Quotes About Future – 27343,7neyvc,https://www.reddit.com/r/worldnews/comments/7neyvc/jane_pauley_quotes_about_future_27343/,1,0,,2018-01-01,http://www.trendquotes.com/jane-pauley-quotes-about-future-27343/
407,U.K. threatens Facebook and Google with new taxes if they don't share more user data to fight terrorism,7neyrl,https://www.reddit.com/r/worldnews/comments/7neyrl/uk_threatens_facebook_and_google_with_new_taxes/,45,14,,2018-01-01,https://venturebeat.com/2018/01/01/u-k-threatens-facebook-and-google-with-taxes-if-they-dont-share-more-user-data-to-fight-terrorism
408,President Donald Trump wishes Happy New Year 2018 to All American And drops a hint,7neyga,https://www.reddit.com/r/worldnews/comments/7neyga/president_donald_trump_wishes_happy_new_year_2018/,1,0,,2018-01-01,https://youtu.be/Wl1ArQXBCDc
409,যুক্তরাষ্টকে এবার যা বলে হুমকি দিলেন উত্তর কোরিয়ার নেতা কিম জং।।,7neyea,https://www.reddit.com/r/worldnews/comments/7neyea/যকতরষটক_এবর_য_বল_হমক_দলন_উততর_করয়র_নত_কম_জ/,1,0,,2018-01-01,https://www.youtube.com/attribution_link?a=Yk9VIJ1f3bo&amp;u=%2Fwatch%3Fv%3DldIeaOlwZew%26feature%3Dshare
410,Crowd blast Reekado Banks for Yabbing Lil Kesh,7neybj,https://www.reddit.com/r/worldnews/comments/7neybj/crowd_blast_reekado_banks_for_yabbing_lil_kesh/,1,0,,2018-01-01,https://www.aderemisblog.com.ng/2018/01/crowd-blast-reekado-banks-yabbing-lil-kesh/
411,"Cheats, media, impending emits and new equipment - there is a lot to take care of once you love online games! You have t",7ney9n,https://www.reddit.com/r/worldnews/comments/7ney9n/cheats_media_impending_emits_and_new_equipment/,1,1,,2018-01-01,http://delhimonuments.org/members/aldridgestender1/activity/289746/
412,"Car park fire destroys 1,400 vehicles",7nexq6,https://www.reddit.com/r/worldnews/comments/7nexq6/car_park_fire_destroys_1400_vehicles/,2,0,[deleted],2018-01-01,http://www.bbc.com/news/uk-england-manchester-42529615
413,"Nuclear button is on my desk, says Kim",7nexii,https://www.reddit.com/r/worldnews/comments/7nexii/nuclear_button_is_on_my_desk_says_kim/,1,8,,2018-01-01,http://www.bbc.com/news/world-asia-42531574?intlink_from_url=http://www.bbc.com/news/topics/c40rjmqdwl3t/kim-jong-un&amp;link_location=live-reporting-story
414,"Iran protests death toll reaches 12, state media reports",7newzk,https://www.reddit.com/r/worldnews/comments/7newzk/iran_protests_death_toll_reaches_12_state_media/,44,1,,2018-01-01,https://www.nbcnews.com/news/world/iran-protests-death-toll-reaches-12-state-media-reports-n833806
415,What Is Dash?,7newz6,https://www.reddit.com/r/worldnews/comments/7newz6/what_is_dash/,1,1,,2018-01-01,https://freebitcoins2018.com/what-is-dash/
416,Kim Jong Un warns North Korea’s nuclear button is on his desk,7newsy,https://www.reddit.com/r/worldnews/comments/7newsy/kim_jong_un_warns_north_koreas_nuclear_button_is/,3,1,,2018-01-01,http://nationalpost.com/news/world/kim-says-us-should-know-north-korean-nuclear-force-a-reality
417,Four young men killed in London new year stabbings,7newkc,https://www.reddit.com/r/worldnews/comments/7newkc/four_young_men_killed_in_london_new_year_stabbings/,7,0,,2018-01-01,https://www.theguardian.com/uk-news/2018/jan/01/four-young-men-killed-in-london-new-year-stabbings
418,Parking garage fire destroys hundreds of cars in UK,7newg4,https://www.reddit.com/r/worldnews/comments/7newg4/parking_garage_fire_destroys_hundreds_of_cars_in/,1,1,[deleted],2018-01-01,https://apnews.com/9a458437ba894a6c8589b90dfb902fb3/Parking-garage-fire-destroys-hundreds-of-cars-in-UK
419,Jack Ma's Brilliant Response to Donald Trump,7new3t,https://www.reddit.com/r/worldnews/comments/7new3t/jack_mas_brilliant_response_to_donald_trump/,1,2,[deleted],2018-01-01,https://www.beingguru.com/2017/11/jack-mas-brilliant-response-to-donald-trump/
420,অবশেষে ভারতের আসামের নাগরিকদের তালিকা প্রকাশ। রাজ্য থেকে বের করা হচ্ছে অ...,7nev0f,https://www.reddit.com/r/worldnews/comments/7nev0f/অবশষ_ভরতর_আসমর_নগরকদর_তলক_পরকশ_রজয_থক_বর_কর_হচছ_অ/,1,0,,2018-01-01,https://www.youtube.com/attribution_link?a=5mmYGyaQwYM&amp;u=%2Fwatch%3Fv%3DVMVc2Q1m4-c%26feature%3Dshare
421,Watch President Buhari’s New Year Address,7neurn,https://www.reddit.com/r/worldnews/comments/7neurn/watch_president_buharis_new_year_address/,1,0,,2018-01-01,https://www.aderemisblog.com.ng/2018/01/watch-president-buharis-new-year-address/
422,"Four young men were killed in stabbing incidents in London amid New Year celebrations, the Met Police has said.",7neu14,https://www.reddit.com/r/worldnews/comments/7neu14/four_young_men_were_killed_in_stabbing_incidents/,7,0,,2018-01-01,http://www.bbc.com/news/uk-england-london-42534127
423,What is Cellulite?,7nesqx,https://www.reddit.com/r/worldnews/comments/7nesqx/what_is_cellulite/,1,0,,2018-01-01,http://feeds.feedburner.com/blogspot/TlOimr
424,New top story on Hacker News: U.S. oil production booms as new year begins,7nesna,https://www.reddit.com/r/worldnews/comments/7nesna/new_top_story_on_hacker_news_us_oil_production/,1,1,,2018-01-01,http://www.whatisnew.ml/2018/01/new-top-story-on-hacker-news-us-oil.html
425,"Pope Francis have cards printed and distributed showing a 1945 photo of victims of the nuclear bombing of Nagasaki along with the words ""the fruit of war.""",7nesmh,https://www.reddit.com/r/worldnews/comments/7nesmh/pope_francis_have_cards_printed_and_distributed/,8,13,[deleted],2018-01-01,http://edition.cnn.com/2017/12/31/europe/pope-francis-nagasaki-photo/index.html
426,Wideland: An Open Source and Crowd Developed State,7nesil,https://www.reddit.com/r/worldnews/comments/7nesil/wideland_an_open_source_and_crowd_developed_state/,1,1,,2018-01-01,https://igg.me/at/8aUzRpyKrEc
427,Crystal ball drops in frigid Times Square,7nesgz,https://www.reddit.com/r/worldnews/comments/7nesgz/crystal_ball_drops_in_frigid_times_square/,0,2,[deleted],2018-01-01,http://www.news.com.au/world/breaking-news/freezing-times-square-draws-revellers/news-story/ef8f721c485a4a5bf0b782de26c99d0b
428,Elizabeth Edwards Quotes About Poetry – 54141,7nes9e,https://www.reddit.com/r/worldnews/comments/7nes9e/elizabeth_edwards_quotes_about_poetry_54141/,1,0,,2018-01-01,http://www.trendquotes.com/elizabeth-edwards-quotes-about-poetry-54141/
429,Likud party calls for de-facto annexation of Israeli settlements,7nes50,https://www.reddit.com/r/worldnews/comments/7nes50/likud_party_calls_for_defacto_annexation_of/,12,7,,2018-01-01,"https://www.ynetnews.com/articles/0,7340,L-5064594,00.html"
430,﻿Okratowania Rąbane Stolica,7nerwv,https://www.reddit.com/r/worldnews/comments/7nerwv/okratowania_rąbane_stolica/,1,1,,2018-01-01,http://klimaatkeur.nl/index.php?option=com_k2&amp;view=itemlist&amp;task=user&amp;id=377658
431,UK boss and family killed in seaplane crash,7nerqg,https://www.reddit.com/r/worldnews/comments/7nerqg/uk_boss_and_family_killed_in_seaplane_crash/,1,5,,2018-01-01,http://www.bbc.co.uk/news/uk-42531669
432,Venezuela to raise its minimum wage by 40%,7nerq1,https://www.reddit.com/r/worldnews/comments/7nerq1/venezuela_to_raise_its_minimum_wage_by_40/,10,8,[deleted],2018-01-01,http://www.bbc.com/news/world-latin-america-42531573
433,office cleaning services IL,7nerk2,https://www.reddit.com/r/worldnews/comments/7nerk2/office_cleaning_services_il/,1,0,,2018-01-01,http://feeds.feedburner.com/blogspot/nWDRT
434,Shan George’s sister dies on accident spot 5 days after they made a Calabar carnival video,7nerbw,https://www.reddit.com/r/worldnews/comments/7nerbw/shan_georges_sister_dies_on_accident_spot_5_days/,1,1,,2018-01-01,http://edujandon.com/2018/01/shan-georges-sister-dies-on-accident-spot-5-days-after-they-made-a-calabar-carnival-video.html/
435,"Pakistan Plans Takeover Of Organisations Run By Hafiz Saeed, Says Secret Document",7ner6s,https://www.reddit.com/r/worldnews/comments/7ner6s/pakistan_plans_takeover_of_organisations_run_by/,1,0,,2018-01-01,http://www.firstlivenews.com/world/pakistan-plans-takeover-organisations-run-hafiz-saeed-says-secret-document/
436,যেভাবে নতুন বছরকে বরন করলো বিশ্ববাসী। দেখুন ২০১৮....,7neqyq,https://www.reddit.com/r/worldnews/comments/7neqyq/যভব_নতন_বছরক_বরন_করল_বশববস_দখন_২০১৮/,1,0,,2018-01-01,https://www.youtube.com/attribution_link?a=QqqMKnJrM7Y&amp;u=%2Fwatch%3Fv%3D5ZGOo1kDQCI%26feature%3Dshare
437,Topless woman attacks man for 'groping' her at New Year's Eve music festival,7neqrj,https://www.reddit.com/r/worldnews/comments/7neqrj/topless_woman_attacks_man_for_groping_her_at_new/,1,1,,2018-01-01,https://www.youtube.com/watch?v=Abb7Dbr7znY
438,NYTimes: Trump Transforms Presidency Like No Other,7neqn4,https://www.reddit.com/r/worldnews/comments/7neqn4/nytimes_trump_transforms_presidency_like_no_other/,0,1,,2018-01-01,https://www.newsmax.com/politics/trump-kelly-new-york-times-presidency/2017/12/31/id/834503/
439,A visual that shows just how many Rohingya villages have been burned,7neqbh,https://www.reddit.com/r/worldnews/comments/7neqbh/a_visual_that_shows_just_how_many_rohingya/,1,1,,2018-01-01,http://brisktopia.com/t1G
440,Jose Padilha Quotes About Technology – 67524,7neq1j,https://www.reddit.com/r/worldnews/comments/7neq1j/jose_padilha_quotes_about_technology_67524/,1,0,,2018-01-01,http://www.trendquotes.com/jose-padilha-quotes-about-technology-67524/
441,"APC Will Lose Presidential Election in 2019, Nigerian Footballers to Die – Primate Nathaniel Releases Shocking 2018 Prophecies",7neppa,https://www.reddit.com/r/worldnews/comments/7neppa/apc_will_lose_presidential_election_in_2019/,1,1,,2018-01-01,http://edujandon.com/2018/01/apc-will-lose-presidential-election-in-2019-nigerian-footballers-to-die-primate-nathaniel-releases-shocking-2018-prophecies.html/
442,﻿Inspect Your Bad Backlinks And Your Rivals Excellent Backlinks.,7neozq,https://www.reddit.com/r/worldnews/comments/7neozq/inspect_your_bad_backlinks_and_your_rivals/,1,1,,2018-01-01,https://whataremybacklinks.wordpress.com/2017/12/17/what-are-my-backlinks/
443,MiroPure 2 in 1 Ionic Hair Straightener Brush with Heat Resistant Glove and Temperature Lock Function,7nenya,https://www.reddit.com/r/worldnews/comments/7nenya/miropure_2_in_1_ionic_hair_straightener_brush/,1,0,,2018-01-01,http://onenet24.com/beauty/hair-care/styling-tools-and-appliances/
444,"السعودية والإمارات تطبقان ضريبة “القيمة المضافة"".. وارتفاع أسعار الوقود بالمملكة",7nenvo,https://www.reddit.com/r/worldnews/comments/7nenvo/السعودية_والإمارات_تطبقان_ضريبة_القيمة_المضافة/,1,0,,2018-01-01,http://wadifat-maroc.blogspot.com/2018/01/blog-post.html
445,Lipo 6 Chromium 100 caps 200mcg tomar Nutrex,7nenp9,https://www.reddit.com/r/worldnews/comments/7nenp9/lipo_6_chromium_100_caps_200mcg_tomar_nutrex/,1,1,,2018-01-01,https://www.corposflex.com/nutrex-lipo-6-chromium-100-caps-cromio-picolinato-emagrece-tomar
446,Ten dead in Iran protests - state TV,7nenef,https://www.reddit.com/r/worldnews/comments/7nenef/ten_dead_in_iran_protests_state_tv/,38,3,,2018-01-01,http://www.bbc.com/news/world-middle-east-42532784
